,tweet
3038,shop closet tonight tomorrow hashtag number easili creatabl look usernam usernam usernam usernam usernam usernam usernam hashtag hashtag hashtag httpaddr pictur
3039,know mani pair usernam jean u buy new pair u alreadi exact pair
3040,usernam usernam usernam usernam usernam go braless
3041,usernam usernam thank
3042,honor host q w jenni livingston director pari burn thank usernam facilit convers individu self express pride weekend nyc heavi black heart yellow heart green heart blue heart purpl heart hashtag pictur
3043,usernam size stock loudli cri face weari face
3044,got realli cute jean usernam swell knee go wear
3045,wanna know usernam aeri real model yet usernam usernam get usernam help
3046,usernam probabl best way inform custom onlin order cancel littl empathi rather cap casual hey could go long way pictur
3047,usernam american eagl outfitt usernam kawasaki shi shen nai chuan xian httpaddr pictur
3048,love campaign usernam usernam xxx pictur
3049,usernam got hoodi jogger american eagl usernam
3050,usernam usernam usernam angel headset cute video cute root
3051,usernam love check found usernam h ttp httpaddr number cm su cusd pictur
3052,usernam usernam busi chic blazer amazonfashion shirt zara pant usernam shoe usernam httpaddr
3053,hashtag american eagl ae gridback fleec jogger maroon usernam httpaddr pictur
3054,usernam usernam numbermomma slave
3055,usernam usernam great physiqu
3056,usernam trust us go want everyth new collab httpaddr hashtag cc usernam usernam pictur
3057,usernam suhana khan spot usernam tank top hashtag hashtag hashtag hashtag hashtag httpaddr
3058,still ecstat free pair jean usernam like free stuff tho pictur
3059,also type number diabet honestli amaz see pump site sensor open make feel less alon insecur heavi black heart usernam httpaddr
3060,usernam app complet useless everi time tri check let say deliv countri live us keep updat app never fix bug
3061,usernam usernam hope that bc one came includ pack slip thank u let know
3062,_sherifelmahdi hi usernam reach custom servic team heard noth back also brought top number differ irish shop none could get
3063,think number reason usernam would give parcel usernam deliv thought usernam
3064,usernam usernam love love love outfit whole outfit usernam shoe usernam httpaddr
3065,usernam usernam ye get cutest stuff tyler pick blindfold outfit
3066,usernam usernam usernam hell yeah wear anytim complain
3067,usernam usernam one appli one model disabl ill friend introduc campaign suggest also owner usernam could prob find addit model interest thank repres us heavi black heart
3068,usernam american eagl outfitt usernam tampa fl httpaddr
3069,usernam one job pictur
3070,usernam american eagl outfitt usernam trumbul ct httpaddr
3071,usernam type person guy repres throw anti gay lesbian slur peopl haden mckenna httpaddr
3072,use code julian number next purchas usernam pictur
3073,hat dress shoe usernam need sponsor basic whole wardrob place love item jean fit well weari face smile face heart shape eye
3074,way hashtag usernam usernam httpaddr
3075,usernam hit killer pr scheme
3076,usernam usernam went yesterday white smile face sparkl heart pictur
3077,usernam camera flash first coffe everyth button continu catch attent eye green tank usernam moneysymbnumb fit sooo nice wear small rib sure httpaddr
3078,usernam usernam usernam oh
3079,usernam usernam usernam usernam usernam usernam usernam usernam usernam usernam usernam expect lot lot food photo grin face
3080,usernam use number friend share use clearli friend pictur
3081,yo happen dope usernam newn x leveljean pictur
3082,compani say data scienc analyt team help bolster move usernam hashtag httpaddr
3083,thank usernam make jean fit suppos
3084,okay usernam ad kill
3085,point sent usernam three email order still email back get quit annoy neutral face
3086,usernam usernam usernam usernam go wrong doc
3087,peopl buy item onlin usernam uk charg addit top duti tax wast time take custom servic hashtag hashtag
3088,usernam american eagl outfitt usernam cedar park tx httpaddr
3089,usernam luv pic usernam usernam smile face heart shape eye httpaddr
3090,pro shop tip usernam price match onlin store item
3091,usernam love order stuff onlin show hous secur tag wth american eagl
3092,usernam model like cute ugli also number number free thx usernam american eagl love cloth got gay ass aesthet
3093,thank usernam usernam fact young girl young adult hashtagdiabet shown ad magazin asham hashtagdreallif hashtagd hashtag httpaddr
3094,usernam bntrwni mkhlsynh summer arab letter alef yybwnh arab letter alef ly arab letter alef ykhlsh wylh face tear joy pout face american eagl outfitt usernam kuwait citi httpaddr
3095,ear make fantast parti outfit find american eagl aeo hashtag hashtag hashtag hashtag httpaddr
3096,usernam usernam love u much man blue heart
3097,thing find shop usernam pictur
3098,usernam hashtag hashtag usernam x httpaddr
3099,walk american eagl usernam tonight saw ad campaign look familiar pretti much exactli year day sinc basic concept air downward dog usernam hashtag hashtag hashtag pictur
3100,usernam usernam style obvious
3101,usernam oh good smile face heart shape eye smile face heart shape eye smile face heart shape eye need take time day appreci applaud usernam repres real women model underwear clap hand sign emoji modifi fitzpatrick type number number clap hand sign emoji modifi fitzpatrick type number number clap hand sign emoji modifi fitzpatrick type number number women beam httpaddr
3102,done usernam
3103,daytim date got dressier visit usernam flirti summer dress eye catch accessori pictur
3104,aeo earn rise qnumber via pittsburgh post gazett httpaddr pictur
3105,leverag facebook ad see usernam usernam use platform reach new audienc httpaddr pictur
3106,usernam usernam omg dead face tear joy face tear joy
3107,usernam lmao yeah good plain tshirt nice fit graphic tee lack littl weari face
3108,usernam b e c h best escap anyon spent last number day ocean lay tri get bronz like golden chicken nugget person rais hand celebr emoji modifi fitzpatrick type number swimsuit zara short usernam httpaddr
3109,usernam usernam color code definit color better match set bottom pictur
3110,usernam site work current mobil devic order
3111,usernam usernam usernam usernam usernam love
3112,usernam usernam usernam usernam yall hire
3113,usernam usernam usernam mum type number amaz xxx
3114,usernam usernam usernam usernam usernam usernam usernam usernam usernam usernam usernam usernam usernam usernam usernam usernam usernam love mg heavi black heart heavi black heart heavi black heart heavi black heart
3115,usernam usernam usernam word return happen downthread haha
3116,wtf usernam bought moneysymbnumb dress last season get wear wore happen shotti work hashtag hashtag pictur
3117,usernam hey usernam hire us pretti great par aesthet face tear joy face tear joy heavi black heart heavi black heart heavi black heart photo lushmeg hashtag hashtag hashtag hashtag hashtag httpaddr
3118,usernam usernam real slaveri shackl common shackl peopl would ha e thrown jail also
3119,size number short bottom american eagl year back compar size number short top bought today usernam tell bodi posit campaign loyal custom pictur
3120,pictur import brought tear inclus import everyon bodi beauti abl see someon identifi intim way power thank usernam pictur
3121,usernam soft razzleberry______________________sam student employe usernam give httpaddr
3122,usernam usernam girl heard got clearanc jean moneysymbnumb
3123,spring final come scranton person rais hand celebr weekend weather forecast smile face heart shape eye usernam hashtag pictur
3124,thank usernam featur real peopl websit includ love ladi ostomi hashtag hashtag pictur
3125,usernam usernam sadli mine never last loudli cri face fast fashion industri made hard jean pass intro stage white frown face
3126,usernam wednesday might go work ina beach kinda mindset hashtag pictur
3127,omg almost speechless anger shock level racism insensit disrespect toward entir race ppl darkest time histori world period shame usernam httpaddr
3128,usernam need help resolv long pend issu get packag order onlin contact custom care sever time keep mention get touch usernam up provid detail supplier one unhappi custom
3129,tire usernam jean pant rip qualiti pant turn shit
3130,noth satisfi order number new pair jean shirt usernam moneysymbnumb shrug emoji modifi fitzpatrick type number number zero width joiner male sign
3131,order dad jean usernam hope live hype review blog
3132,usernam usernam usernam usernam way lol ask better replac
3133,usernam usernam usernam look nice realli like want get
3134,usernam believein power usernam httpaddr
3135,usernam usernam clearli live rock
3136,usernam usernam realli usernam usernam short boy say make packag look great gear toward teen huh pictur
3137,onlin order came oh sick thank usernam pictur
3138,usernam usernam usernam love much landon heavi black heart heavi black heart heavi black heart
3139,name jose rivera vazquez age number year oldfrom puerto rico region indic symbol letter p region indic symbol letter r live unit stateemail rvjnumber httpaddr usernam usernam usernam usernam pictur
3140,usernam um
3141,sure exclus usernam think face think face pictur
3142,usernam usernam holocaust never happen
3143,hey usernam explain sell hashtag shackl hashtag hashtag pictur
3144,usernam put stylehashtag tag pant
3145,someon pleas produc jean get hole crotch usernam
3146,scientif advanc need made prevent inevit inner thigh hole ladi denim jean jean jean chub rub real inner thigh real problem real run pant look eye usernam usernam usernam usernam
3147,want feel softest soft without overwhelm weigh take someon sensori overload constantli usernam soft sexi plush way go pictur
3148,let ensur futur equal take hashtag stand discrimin sport shirt benefit usernam get usernam hashtag photo usernam pictur
3149,httpaddr check latest spring look hashtag hashtag hashtag hashtag hashtag hashtag usernam usernam usernam usernam usernam usernam usernam usernam usernam usernam usernam usernam
3150,year ago usernam jacket love lost bought anoth one left one bar one night bartend grab took home could get back die true stori hashtag
3151,american eagl outfitt fashion forward diversifi peopl get usernam pictur
3152,usernam guy restock onlin store
3153,bravo usernam continu support hashtag commun hashtag hashtag pictur
3154,usernam usernam ohhh yeah hear ya
3155,_mariahmariem lmao peopl blast usernam twitter aye fk face tear joy face tear joy
3156,usernam discount colleg student upsid face
3157,usernam get love radio work usernam make happi
3158,usernam second chang girlfriend shirt instead admit quit flannel though
3159,woman cloth jean usernam get control workforc usernam cloud white point backhand index emoji modifi fitzpatrick type number httpaddr pictur
3160,usernam start friday thank soooo much let part famili idea hard work get job black heart suit
3161,usernam usernam usernam usernam happi birthday
3162,usernam cloth smell like made great grandma basement
3163,usernam usernam liter amaz ship get order number day everi time thank amaz xoxo shop addict
3164,usernam everi pair short bought guy either rip pocket blew number mo wtf
3165,usernam usernam take lot money smell cheap dolli parton kind
3166,feel usernam httpaddr
3167,amaz buy bra well done usernam usernam httpaddr
3168,usernam usernam hell ya
3169,hey usernam hashtag campaign hella exclus wanna see ad campaign size rang make larger size store thing hashtag hashtag
3170,thank usernam know definit target pictur
3171,work butt get shape babi usernam provid swimsuit give extra coverag mama need water wave
3172,usernam latest code email pictur
3173,usernam hey americanair usernam flown thank safe flight jr httpaddr
3174,usernam got pair absolut love darker stretchi lost lot color distress look kind ratti kind turn away white frown face usernam
3175,heck becom brand ambassador usernam usernam closet cloth everyth
3176,usernam usernam rememb summer bodi made winter smile face sunglass
3177,usernam bro say usernam underwear moneysymbnumb pop follow usernam ae hashtag hashtag
3178,usernam purchas moneysymbnumb sandal march moneysymbnumb lot normal spend usual buy usernam sandal similar moneysymbnumb moneysymbnumb never experienc usernam sell style sandal year went af pleas advis pictur
3179,usernam alreadi spoke someon phone help hour guy huge e commerc busi time updat polici keep time
3180,usernam american eagl owe usernam check endors morn usernam
3181,usernam alway usernam
3182,wear usernam short bought yesterday thigh blue
3183,wisconsin first ever tax free shop event progress save store includ justic usernam usernam mani favorit back school httpaddr detail tax free shop httpaddr hashtag pictur
3184,final post california coachella outfit diari link everyth guy want shop piec super afford stuff usernam usernam usernam httpaddr
3185,kind eagl logo cc usernam httpaddr
3186,hey usernam option checkout everyth ship togeth like realli care take extra week feel like number differ packag number item littl excess
3187,girl buy usernam boxer hashtag
3188,usernam usernam omfg saf x pictur
3189,usernam excit new usernam outfit usernam bed take central park adventur hashtag hashtag hashtag loeb boathous central park httpaddr
3190,yeah thank contact usernam via chat phone call told sorri help
3191,got good laugh today excit see cami order mailbox open found happen usernam face tear joy pictur
3192,usernam usernam girl sale onlin right plu free ship ittttt
3193,usernam usernam usernam feel hard
3194,proud new partnership merchandis line creat usernam usernam hashtag hashtag statu liberti pictur
3195,underpaid overwork truest statement thing show work usernam number year bunch cloth bare wear httpaddr
3196,usernam get sooooo expens face roll eye
3197,usernam usernam brand launch new ad campaign featur mani differ beauti bodi includ mani never rare repres advertis hashtag hashtag httpaddr
3198,usernam usernam cute omg
3199,work butt number month final paid got offer full time manag job usernam white smile face
3200,usernam
3201,usernam usernam truli seriou peopl need get
3202,usernam bought sock ago want buy anoth pair still sell anyth similar pictur
3203,say today bike build usernam hit hashtag hashtag hashtag pictur
3204,httpaddr hashtag hashtag hashtag hashtag hashtag hashtag hashtag hashtag hashtag hashtag hashtag hashtag hashtag hashtag hashtag usernam usernam usernam usernam usernam usernam
3205,new school heavi check mark new car heavi check mark new job doubl pay last one heavi check mark new usernam jean somehow fit hip waist perfectli heavi check mark life good
3206,cannot believ usernam would sell someth like thought decent compani obvious wrong suffer great loss insensit uncar act person color shop httpaddr
3207,usernam make comfort pant dont
3208,live color rainbow blossom unicorn face dress usernam hat usernam pictur
3209,yo usernam flatter waist size went number number say like new flex style jean one bit bring back regular non flex option pleas
3210,usernam think kind inappropri httpaddr
3211,number usernam httpaddr
3212,mayb usernam comfort bra hashtag httpaddr
3213,usernam disappoint sleepi face pictur
3214,usernam httpaddr
3215,need usernam make surf perfum perman
3216,usernam
3217,hey usernam could lower price
3218,usernam usernam angel human
3219,usernam american eagl outfitt usernam miami beach fl httpaddr
3220,deadlin tomorrow post shirt creation yet submit design inspir other get vote share instagram hashtag tomorrow miss awesom opportun usernam pictur
3221,anyon actual wear usernam high waist jean short without entir ass shown walk number step
3222,usernam usernam thank ship short four day pay two day ship
3223,yo en fan nono nerd face emocionado porqu laura breneman directora de style de usernam comento mi historia see evil monkey pictur
3224,usernam best jean hand jean person rais hand celebr
3225,usernam usernam usernam wow
3226,goodby usernam ars even repli last time ever spend money pretti certain retail worst httpaddr
3227,cloth brand like ageless style httpaddr usernam showginimara usernam usernam usernam usernam usernam usernam hashtag hashtag hashtag pictur
3228,usernam wear jean wear usernam organ skirt pant even hashtag fave cozi usernam shred jeg aero jean stiff donat aunt foster children
3229,usernam model pretti like im shop ive also fallen love beauti women
3230,mall usernam heard obsess usernam shiz start sing along dress room shrug emoji modifi fitzpatrick type number zero width joiner femal sign nerd face
3231,gee thank usernam usernam deliv packag time explan sure daughter understand gift christma
3232,hard find pair jean number cotton denim super disappoint usernam dissolv bullhead favor shitti mix flex materi usernam sadli follow suit back usernam
3233,usernam thank spoke said noth done furiou
3234,shame digniti usernam american eagl sell shackl bracelet pictur
3235,usernam shame deepli disgust disturb
3236,hobbi usernam usernam passion heavi black heart even got friend wink face
3237,usernam white jean obsess usernam httpaddr
3238,usernam usernam might get pair thank pictur
3239,american eagl chang extra long inseam number inch number usernam u chop number inch leg
3240,style hashtag usernam usernam usernam pictur
3241,usernam hand best slide summer pictur
3242,usernam guy discount coupon special go right button shirt belt jean
3243,usernam usernam buy aeri bra
3244,um usernam tri treat websit work
3245,terribl disappoint usernam custom servic live chat person talk answer question ask wast time
3246,usernam usernam usernam realli love today hashtag hashtag
3247,yesterday usernam pictur
3248,hey usernam tri access site uk constantli get even email pictur
3249,usernam usernam need get shit togeth ruin live
3250,usernam first blood face tear joy american eagl outfitt usernam shibui gu qu tokyo httpaddr pictur
3251,usernam shirt even make shelv face tear joy pictur
3252,usernam pleas make jean girl big thigh wont make sound walk
3253,usernam como gustan lo polo color brillant precio acces hashtag usernam httpaddr
3254,usernam came today even though bought thing price outrag sign credit card definit sale like often heavi black heart
3255,work usernam like two week alreadi hide bag logan face palm emoji modifi fitzpatrick type number zero width joiner femal sign hashtag
3256,usernam usernam um heck ye two heart two heart revolv heart revolv heart sparkl heart sparkl heart
3257,usernam would love win trip hashtag hashtag alway rep usernam music festiv music note httpaddr
3258,one week christma tree swoon pant found usernam sponsor post share heavi black heart pictur
3259,usernam american eagl outfitt usernam shibui gu qu tokyo httpaddr
3260,one favorit thing respond peopl tweet usernam account think usernam httpaddr
3261,usernam usernam usernam heavi black heart httpaddr realli excus style half hair crop usernam actual sport bra jean jean httpaddr httpaddr jewelri rocksbox except httpaddr
3262,usernam doubl denim love pictur
3263,appreci effort reduc wast usernam usernam number wast packag everi singl pair underwear plastic wrap feel super wast right pensiv face pictur
3264,ye usernam new campaign set huge exampl hope other follow step
3265,usernam gain control usernam cloud httpaddr pictur
3266,usernam like type fabric one post day jean stretchi
3267,wow got bomb ass deal liter bought two pair jean number shirt less number love usernam love sale coupon member
3268,usernam usernam agre
3269,usernam take ya girl money swear face tear joy
3270,usernam crazi usernam
3271,usernam usernam think like see usernam concert hear daytona great book
3272,usernam chat work app tri email got vagu respons
3273,usernam one mistak pair sunglass plaid shirt
3274,tri pair jean usernam found fuck appl jack pocket hashtag
3275,serious wtf usernam give women complex pictur
3276,usernam usernam love one hahaha
3277,usernam report better busi bureau client resolut team could use better train offer free number day ship person shoprunn alreadi pay number day ship year slap face pay custom
3278,appreci usernam swimsuit model look like curvi stretch mark
3279,usernam american eagl outfitt usernam union gap wa httpaddr
3280,usernam usernam usernam ador heel wow
3281,like follow instruct exchang size usernam keep get email refund want jean
3282,usernam usernam dirti danc fallen log forest
3283,kudo usernam usernam consist repres wide rang talent campaign absolut love brand abl show love respect incorpor everyon good hashtag hashtag hashtag hashtag hashtag purpl heart pictur
3284,usernam usernam usernam cute need cub jersey set come pittsburgh grimac face
3285,idea usernam hashtag perfum back stock usernam usernam hashtag hashtag hashtag hashtag
3286,never wear jean leg big usernam flex jean clutch
3287,need usernam high waist midi short pretti pleas mid rise hit awkward part bodi
3288,hashtag imposs make purchas websit usernam onlin custom servic terribl mexican call center cancel purchas websit take credit
3289,usernam usernam omg congrat jenna
3290,usernam usernam usernam fibromyalgia never seen media like heart heavi black heart heavi black heart
3291,usernam someth wrong site whe add cart noth happen wont let log
3292,anyon want number usernam httpaddr pictur
3293,usernam take money tire face weari face
3294,usernam usernam nonsens bring back wife think attract
3295,disappoint usernam paid two day ship realli go two day two day process order order number item seem ship httpaddr learn usernam
3296,fact usernam xshort jean petit dress honestli bless us shorti person rais hand celebr emoji modifi fitzpatrick type number number person rais hand celebr emoji modifi fitzpatrick type number number
3297,stay warm cold weather chenil sweater usernam coat usernam smile face smile eye hashtag hashtag pictur
3298,usernam usernam usernam usernam usernam usernam usernam usernam usernam usernam usernam wait u come home
3299,usernam shirt list site discount work add cart also call custom rep help honor price pictur
3300,friend spain go start think place get cloth canada usernam sinc whenev ask got someth answer face tear joy
3301,today wear usernam suffer sever breakout basic like number without benefit respons faster metabol hashtag hashtag
3302,usernam american eagl outfitt usernam morrow ga httpaddr
3303,usernam usernam usernam usernam usernam usernam
3304,usernam guarante cloth pair pant worn hand time rip purchas awhil ago though
3305,usernam gain control usernam cloud httpaddr pictur
3306,today hashtag usernam cutout bodysuit usernam rip hashtag tulip sunflow pictur
3307,usernam usernam mom jean best jean sparkl heart crown great sale outlet httpaddr
3308,usernam usernam suck complain bracelet look realli cool would like get one myelf
3309,fulfil number resolut effici commun w advisor hashtag usernam pictur
3310,usernam hi
3311,usernam obvious poc design team would told slave shackl bracelet bad idea httpaddr
3312,usernam usernam face tear joy face tear joy assum tweet must complaint hashtag hashtag
3313,usernam usernam usernam usernam usernam usernam holi smoke great argh uh guess b w style also big fan color hard choos
3314,usernam httpaddr
3315,current wear usernam jewel usernam kimono usernam mom jean httpaddr pictur
3316,usernam thank stand hashtag
3317,usernam forget enter chanc win usernam messeng bag visit page httpaddr
3318,live kansa almost entir life learn usernam websit usernam name american royal see evil monkey
3319,usernam hey american eagl guy restock jean month
3320,usernam usernam wish wait alway sparkl usernam usernam usernam httpaddr
3321,usernam live sunshin swim sea drink air ralph waldo emerson black sun ray honeybe sunflow quiet moment immers natur find peac wear favorit usernam summer httpaddr
3322,usernam hire model mean look obviou talent lmfao pictur
3323,usernam guy pleas make kent state univers tailgat cloth want somee
3324,day work market director usernam usernam usernam pictur
3325,compani go cc busi seen new offer number usernam usernam usernam today
3326,usernam
3327,usernam excit new crop kick flare pant except show censor attach hashtag hashtag hashtag pictur
3328,usernam pictur
3329,look usernam shirt think could paint live room old crewneck make realiz yeah httpaddr pictur
3330,usernam order onlin vs get mail hashtag hashtag pictur
3331,usernam usernam tie need barkley compliant like rest benefit wear tie
3332,usernam pray guy part order ship deliv time weari face white point index emoji modifi fitzpatrick type number
3333,usernam releas fall collect begin august broke weari face
3334,buy overal usernam hand best decis ever made
3335,usernam yeah miss mark one think ancestor thought shackl fashion statement face roll eye think face face roll eye think face face roll eye think face pictur
3336,usernam still accept cloth recycl store
3337,usernam usernam suck n realli feel bad n realli awesom hear u doin someth nice ur bro hundr point symbol hundr point symbol
3338,usernam jean number month alreadi worn wtf girl big thigh suppos majorli disappoint pictur
3339,usernam
3340,mom could happier usernam hashtag campaign wish retail would follow httpaddr
3341,usernam usernam plu size curvi girl tri usernam
3342,usernam extrem disappoint custom httpaddr bought number pair jean liter pay moneysymbmoneysymb cost due mistak made behalf frustrat part speak custom srvce rep get read gener script respons instead heard
3343,usernam usernam liter softest thing world obsess
3344,usernam usernam usernam usernam usernam ask next time usernam
3345,usernam ughhhh gray weari face weari face weari face weari face pictur
3346,usernam usernam hashtag never die
3347,number fashion make comeback usernam usernam smart move fave number look talk laugh usernam hashtag httpaddr pictur
3348,number sure skirt avail usernam speak httpaddr
