,tweet
0,usernam usernam usernam usernam happi know love compani merchandis offer black heart black heart black heart
1,usernam usernam fuck realli need go mall find american eagl
2,usernam number usernam httpaddr
3,usernam thank usernam feliz semana para todo hashtag hashtag hashtag hashtag hashtag httpaddr
4,usernam poor tast httpaddr
5,usernam usernam went american eagl sinc like jean absolut find anyth
6,bought three swimsuit usernam significantli cheaper price instagram famou swimsuit canada cost arm shit return polici
7,would amaz work usernam would get discount extrem cute cloth
8,right found pregnant use number free pair pant usernam never abl fuck wear god know fit back super skinni rip jean ever
9,usernam hell usernam disgust
10,usernam pleas start men undergar line want start excit number moneysymbnumb deal
11,usernam usernam top exact print
12,know love usernam use reward bogo number coupon one order get two pair jean moneysymbnumb free ship beat
13,yasss love usernam person rais hand celebr httpaddr
14,usernam actual remov item inventori due outrag face palm zero width joiner male sign httpaddr
15,usernam usernam ridicul make option wait send togeth httpaddr
16,hi usernam need buy pair blue black jean buy one get one number sale soon thank
17,hey usernam put ur ad pictur
18,hold safe space dancer empow futur entrepreneur amplifi women voic okc wear comfort jean fit petit frame stretchhhhh day livin best life two heart usernam hashtag hashtag hashtag jean pictur
19,ever stop wear usernam jean got new pair yesterday jeg absolut comfiest thing worn long time hashtag person rais hand celebr emoji modifi fitzpatrick type number
20,jean consid categori best invent men usernam hashtag hashtag black heart suit
21,masculino de la numberra edad en el cajero hsbc col reforma usernam en el lugar usernam usernam
22,number young consum want shop store tamera alesi usernam person rais hand celebr emoji modifi fitzpatrick type number person rais hand celebr emoji modifi fitzpatrick type number brick mortar let go hashtag
23,usernam usernam usernam let fuck gooooooo
24,usernam honestli love usernam usernam model actual real peopl unrealist imag beauti advertis today wish compani authent model day httpaddr
25,usernam american eagl outfitt usernam clearwat fl httpaddr
26,usernam usernam dm
27,usernam usernam __beansoup__ usernam um never
28,never order onlin usernam loudli cri face
29,usernam pleeeaaassee tell restock shirt person fold hand emoji modifi fitzpatrick type number number person fold hand emoji modifi fitzpatrick type number number person fold hand emoji modifi fitzpatrick type number number pictur
30,tri usernam ne x level cloth stretchiest comfort denim ever favorit jean never fit felt better home page url store american_eagle_outfitt hashtag hashtag hashtag pictur
31,current process usernam websit manag ae keep say usernam quak loudli cri face pictur
32,usernam producto poca pleas
33,usernam usernam honestli smh twitter need thing
34,usernam e smile face sunglass new fave usernam jean person rais hand celebr emoji modifi fitzpatrick type number hashtag hashtag hashtag hashtag httpaddr
35,made two usernam order week hate cant wait till get loudli cri face
36,usernam usernam usernam done
37,hashtag hashtag hashtag hashtag usernam usernam usernam usernam usernam pictur
38,usernam usernam legend support legend
39,usernam usernam usernam hate shop sinc junior year high school size number also extra long struggl face roll eye face roll eye
40,usernam usernam happen one time went local american eagl receipt ask remov
41,usernam go see older playlist
42,dear usernam place onlin order cloth sell go piss hashtag
43,usernam usernam ahm sorri mean nice
44,usernam usernam aeo think price ridicul high everi buy someth cute coupon usernam lifeeeeeee
45,usernam usernam usernam pictur
46,usernam partner w global impact identifi vet ngo directli engag disast relief puerto rico mexico usernam distribut moneysymbnumberk cash gift kind number partner ground effort usernam usernam usernam usernam
47,usernam way order sad know order offer free pair jean number expir pretti much store mani item husband limit purchas deadlin pictur
48,usernam usernam x
49,went usernam websit look swim suit thrill see differ bodi type littl retouch smile face heart shape eye
50,usernam american eagl compani list pathet respons weakest simpli care cloth produc hashtag abus women cast hashtag hashtag hashtag httpaddr
51,usernam cool spent moneysymbnumb short fall apart one wash ok hand sign emoji modifi fitzpatrick type number number pictur
52,american eagl usernam set debut larger rang denim size women men fall number follow usernam footstep includ divers cast male model brand new ne x level hashtag campaign httpaddr
53,usernam usernam daughter usernam work usernam st joseph mo hashtag diabet p would also make great model compani imag
54,usernam vacacion dia number yo aqui face savour delici food american eagl outfitt usernam puebla httpaddr
55,email usernam today suppos know advertis read subject thing english pictur
56,usernam liter number year later still rock ae sock usernam rip month go usernam pictur
57,bt wait upload actual photo usernam usernam hashtag hashtag pictur
58,usernam usernam usernam usernam usernam usernam usernam usernam usernam usernam ya need model feel free contact
59,sleep romper usernam bought everyth never take
60,number usernam ye pleas thank
61,dear usernam love stop tri make hairi armpit thing sexi ever sexi stop
62,hey usernam could pleas make jean color onlin real life thank
63,aeo nyc want chang way shop pictur
64,usernam usernam usernam usernam tattoo mafia camden de black heart black heart black heart small busi becom famili usernam usernam usernam brand inspir make feel put togeth give pick up sparkl
65,day one usernam usernam lit watch usernam perform everyth guy die see p shop entir look httpaddr sign horn emoji modifi fitzpatrick type number hashtag pictur
66,usernam like em first ok hey u give love pl og fan usernam
67,usernam pleas make jean peopl thick thigh mind bought jean number month ago alreadi hole face roll eye
68,usernam glitter star necklac hashtag short chain necklac silverton glass numberc hashtag pictur
69,present usernam usernam listen market team liter immedi follow present order cloth realli great brand guy team came us amaz group women
70,usernam pleas start line anim outfit call american beagl
71,determin save usernam stripe mom jean ive want
72,usernam lolol ok
73,fashion team usernam year done one heck job elvi usa shirt person rais hand celebr emoji modifi fitzpatrick type number two heart whole floorset pictur
74,alway love usernam tell lol hashtag blue heart hashtag number summer number campaign blue heart pictur
75,thank usernam romper tall answer prayer
76,usernam hashtag usernam
77,usernam usernam usernam usernam usernam usernam usernam usernam usernam usernam thankyou muchhhh
78,excus usernam wrong websit even navig mess ugh plz fix thx
79,cardi said plan tour usernam give rais
80,amaz hashtag hashtag buy number get number number plu hashtag hashtag usernam httpaddr
81,usernam usernam usernam usernam absolut right ok hand sign
82,usernam hi american eagl bought fleec number year ago teenag keep steal still great condit get worn ton especi cold winter day would love buy pictur
83,damn usernam clap hand sign emoji modifi fitzpatrick type number number person rais hand celebr emoji modifi fitzpatrick type number number hashtag pictur
84,never mani hashtag aeo pictur
85,usernam usernam well might need save get birthday lol
86,usernam pleas help know write email cs go nowher get respons everi number hour use
87,usernam love check found usernam httpaddr
88,usernam usernam usernam oh fashion
89,usernam could restock boot cut jean would cool
90,usernam look like model usernam ad usernam blame eye httpaddr
91,usernam good time today follow lewiscapaldi usernam usernam today hashtag hashtag hashtag hashtag grant park httpaddr
92,usernam usernam usernam cute smile face heart shape eye
93,okay like awar buy number jean usernam get one free audac
94,hashtag jean jogger buy one get one number number number number number aeo hashtag pictur
95,usernam want buy dress click link httpaddr redirect main clearanc dress page loudli cri face pleas send help desper need take money money wing pictur
96,argu usernam best jean
97,still receiv usernam order suppos deliv decemb number decemb number pout face
98,usernam promot smile face open mouth cold sweat httpaddr
99,oh love buy jean store find stain blood crotch thank usernam
100,usernam alway ice coffe weather
101,usernam ce marqu qui savent vou accueillir httpaddr usernam usernam une banqu qui vou accueil dan un cafe espac de cowork de facon decontracte usernam ou american eagl ou vou pouvez regler dan la cabin essayag avec un ipad usernam pictur
102,usernam usernam usernam usernam numberso usernam usernam ilynumb
103,usernam usernam happi friday rain week last time saw sunni day reminisc hope sunni weekend hand index middl finger cross short usernam shirt bp usernam sandal httpaddr
104,women twitter usernam heard plea brand new pair jean pocket fit entir hand wrist hashtag
105,usernam usernam send link lol
106,say pictur could usernam campaign ad pictur
107,usernam american eagl must color section smh damn use fuck usernam httpaddr
108,usernam httpaddr
109,absolut use love usernam jean use think jean good qualiti last year thought angri face hashtag
110,usernam jean size size number dresser bigger size number skinni leg hang store right
111,usernam usernam number centuri handcuff
112,httpaddr usernam found song playlist
113,usernam usernam jurass vibe kansascitymo tank top jean usernam jacket usernam glass usernam hashtag hashtag httpaddr
114,usernam usernam boyfriend went boot camp stole ae jogger relat
115,usernam usernam number number recommend high waist jean good qualiti realli cute
116,usernam usernam pleas cast
117,make move newli renov usernam store reopen upper level sear wing hashtag hashtag pictur
118,spent number dollar order cloth usernam usernam see evil monkey smile face open mouth cold sweat number bralett number regular bra number floral tank top
119,suck pay ship usernam want long length jean carri store smile face open mouth cold sweat like fault leg long pay extra shrug emoji modifi fitzpatrick type number number zero width joiner femal sign shrug emoji modifi fitzpatrick type number number zero width joiner femal sign shrug emoji modifi fitzpatrick type number number zero width joiner femal sign
120,usernam usernam jean one fit right soft sexi line soft
121,usernam usernam usernam u make day everi day miss u wait see u hunni
122,usernam usernam design
123,stack upward black arrow number usernam victori hand pictur
124,usernam usernam pl send discount code loyal custom also broke colleg student afford number item cart person fold hand emoji modifi fitzpatrick type number number pictur
125,hashtag hashtag current hire sale associ look fun outgo associ love fashion avail work flexibl schedul includ even weekend number year older appli onlin httpaddr usernam hashtag
126,get readi summer mix match shirt short pant number dh number complet outfit usernam hashtag pictur
127,realli tri win governor ball ticket usernam
128,buy number pair usernam leg number pair boot usernam moneysymbnumb hashtag ok hand sign
129,usernam ye pleas see bc short cutest afford anymor httpaddr
130,usernam fix number clearanc page websit shit keep rickrol back begin click hoodi hashtag
131,usernam well use usernam coupon faith util clearanc love qualiti usernam underwear
132,usernam usernam hi number name meaghan number number number number could model would lit also like shop store amaz see thank love lot
133,anyon els see issu pictur bought onlin came mail put sensor warehous hashtag hashtag hashtag usernam pictur
134,usernam usernam usernam damn make everyth look good
135,usernam usernam usernam madatong idesu goxin pei itadakiarigatougozaimasu
136,usernam usernam usernam usernam god bless alyssa hope hashtag white smile face
137,awesom usernam employe make tri jean much fun usual heavi black heart ok hand sign emoji modifi fitzpatrick type number number help find perfect pair jean smile face heart shape eye
138,usernam say aint fulli discontinu super skinni men
139,usernam usernam agre
140,thank american eagl outfitt foundat usernam host great chariti golf event beauti day foundat support youth empower educ environment conserv young women health pictur
141,usernam usernam offend would pull product apolog put back
142,usernam realli step jean game bc soccer girl found jean fit properli fit thigh waist pure magic
143,wait free usernam jean arriv smile face heart shape eye jean special thank quickli ebat grin face smile eye
144,usernam httpaddr
145,usernam usernam yeah make ass look amaz
146,usernam usernam love black heart call hand
147,usernam pleas indic sale end sale advertis app tire miss sale show end
148,mani cute usernam usernam item cheap right item number henley httpaddr
149,love usernam color american usernam usernam usernam american eagl eagl wore usernam obsess forc wear usernam meet paid dad meet
150,usernam ur size black jean realli want pleas restock asap might cri
151,usernam number onlin today deserv treat
152,would like thank usernam make nice fit jean pant
153,usernam send confirm email order receiv smile face heart shape eye smile face heart shape eye xx
154,usernam usernam mueroooo
155,usernam cuo tsutanohagui riniji tsuta usernam httpaddr
156,usernam think laugh way httpaddr
157,opinion jean better usernam jean
158,big shoutout usernam websit tell password limit sign
159,usernam usernam usernam great love dorothi
160,order sum mom jean bc love mom short much usernam
161,listen usernam radio app work make day much easier found actual like justin beiber song still deal tho xnumber
162,time favorit usernam jean final give year loudli cri face loudli cri face loudli cri face loudli cri face loudli cri face
163,worst custom servic goe usernam today pictur
164,usernam much pay shaquiri xhaka promot world cup
165,hey usernam usernam usernam good news one kind httpaddr
166,pink matter tulip tulip fire fire aeo jean cut shirt usernam hashtag hashtag hashtag hashtag hashtag pictur
167,find feel good outfit usernam pictur
168,usernam usernam yea keep cave children temper tantrum solv everyth
169,usernam thank heavi black heart heavi black heart heavi black heart httpaddr
170,thank woman check us usernam hashtag hashtag today especi help w return find differ pant fit teen hashtag hashtag hashtag
171,usernam store get upgrad check temp locat maci wing pictur
172,realli like usernam swim suit year
173,usernam absolut appreci help get issu
174,think spring think jean hashtag usernam pictur
175,usernam usernam usernam pleas marri
176,callout usernam usernam usernam usernam usernam
177,usernam usernam exchang problem
178,hey usernam wonder onlin custom servic suck number wait number min hold yell someon chat onlin support peopl still solut screw order exchang
179,preppi guy st paddi day guid blog featur usernam usernam usernam httpaddr hashtag hashtag hashtag hashtag hashtag pictur
180,usernam usernam pictur
181,usernam guy start carri plu size store size number number find mislead hard order jean
182,usernam pleas make normal black jean
183,usernam websit hate updat address order went uni adress cancel order call reorder specif chang im fire way past bed time
184,usernam usernam usernam constant shop struggl
185,aeo happen shirt want buy websit loudli cri face pictur
186,absolut love usernam creat fit room girl write someth posit total confid booster mani white smile face pictur
187,usernam usernam usernam
188,want christma usernam hand aux chord fr
189,usernam make bodi posit move men hashtag usernam httpaddr
190,realli need start train lucki skinni jean stretch well courtesi usernam usernam aeo need work chino pant thread bleed problem though realli ridicul
191,usernam usernam exact thing happen ae white jean glad one face tear joy face roll eye
192,oan got pair jean six pair sock usernam moneysymbnumb today coupon life
193,unless usernam usernam someth racist loyal contribut give money becki patient fit free tote got even tho promo start today grate
194,usernam usernam tri
195,usernam usernam smile face open mouth smile eye hope video thumb sign
196,also spent two hour famili put togeth outfit kid senior photo fun ever usernam brought hashtag thank usernam usernam
197,usernam usernam lol like number cloth american eagl outfitt
198,usernam im fuck piss liter everi pair american eagl pant know fuck rip fuck stupid pictur
199,thank u compliment usernam alreadi wear pictur
200,usernam clap hand sign person rais hand celebr ok hand sign
201,oh probabl go return go usernam like done first place
202,usernam usernam alway ok hand sign emoji modifi fitzpatrick type number
203,let complet order usernam
204,usernam usernam wtf
205,usernam updat still found gut
206,find funni stop usernam pick stuff usernam stuff hashtag
207,enter competit predict winner usernam excel award number could win psnumber toward dinner restaur choic join httpaddr pictur
208,usernam lot bralett stock certain size store onlin coupl week idea restock
209,usernam usernam usernam usernam doubt strength
210,usernam love hashtaghashtag usernam serv gorgeou httpaddr
211,usernam explor around hashtag head back home airplan thank usernam fli hashtag blast call hand emoji modifi fitzpatrick type number number hashtag hashtag millennium park httpaddr
212,usernam usernam make american eagl haul yt video tyler buy outfit without know tri dhsufnel
213,great photo _faithlogan usernam smile face heart shape eye smile face sunglass camera clap hand sign hashtag hashtag hashtag hashtag hashtag hashtag hashtag hashtag hashtag hashtag hashtag hashtag hashtag usernam usernam hashtag hashtag hashtag httpaddr
214,usernam usernam hope disco ball fall head
215,usernam hashtag log account keep get get error messag tri reset password help httpaddr hashtag hashtag
216,usernam american eagl outfitt usernam seattl wa w usernam httpaddr
217,got stupid stain favorit pair jeg get pair load usernam replac weari face
218,usernam sneaki pictur
219,usernam usernam lmao true
220,usernam usernam usernam usernam numberlackcunumb usernam wanna love bad smile face smile eye
221,usernam usernam proud
222,usernam thumb sign know usernam would wheel around number inch screen dashboard httpaddr
223,perfect pair pant exi took tri found thank usernam
224,usernam usernam packag
225,usernam find pictur
226,usernam usernam usernam jajajajaja noooo roll floor laugh
227,usernam usernam even winter isol patch snow special qualiti snowflak babi angel usernam usernam httpaddr
228,usernam send email american eagl outfitt almost month still dont answer could aeo jean closet custom servic great product
229,love usernam even also great jean soft sexi tee awesom hashtagd hashtag hashtag hashtag pictur
230,usernam usernam usernam amaz outfit makeup ear shoe pedi high killer heel
231,suja chandrasekaran hashtag usernam appoint board usernam congratul suja httpaddr
232,fortun home favorit pair pant decid split seem sadli still good pair pant usernam help make right pictur
233,star spangl day happi hashtag camera usernam pictur
234,want thank usernam croptop smile face heart shape eye smile face heart shape eye love one fave hundr point symbol hashtag hashtag pictur
235,dear usernam wanna know idea put rip bottom back pocket jean wanna talk sincer girl phone fell pocket almost fell middl number flight cement stair upsid face
236,usernam usernam usernam ye heavi black heart final matter care show
237,usernam usernam real bodi campaign also sell one size pant would way fit averag bodi
238,price peopl will pay buy moneysymbnumb phone comput issu ab price work usernam great compani work discount gener alway give away free cloth employe httpaddr
239,bought pair jean usernam three day ago realiz hole buy jean pre made hole exchang even though wore hour
240,usernam stay wild flower child hibiscu black sun ray outfit usernam bag urbanoutfitt toronto ontario httpaddr
241,usernam usernam beauti pictur winter favorit season year
242,usernam usernam take full advantag sunshin today sun face sweater usernam pant usernam shoe httpaddr
243,usernam offici hair overr accessor lazi awesom turban hashtag hashtag hashtag hashtag hashtag hashtag americanapparelusa usernam httpaddr
244,usernam hashtag want free cloth
245,usernam usernam stop call bracelet shackl say stop sell shackl
246,thank god usernam flex pant
247,usernam fit send back anyway thank
248,usernam usernam hi kindli follow us dm inform thank
249,usernam usernam usernam cute soft yellow heart yellow heart love aaron
250,usernam stop individu wrap everi item pl pictur
251,anoth usernam playlist usernam
252,usernam babi cold outsid snowflak camera xiaoray_art dress usernam hashtag hashtag httpaddr
253,play style usernam pictur
254,usernam usernam yo pictur
255,usernam usernam usernam jml jml jml jml jml hottt
256,usernam usernam usernam bea miller demi cant kiss themboth
257,disappoint usernam employe treat
258,usernam usernam usernam usernam ni modo babe gotta shop regular store unless wanna pay express ship lol
259,usernam usernam usernam usernam usernam get freind model deal httpaddr
260,usernam usernam usernam mother son colostomi bag deepli impress ad shopper share friend actual brought tear thank httpaddr
261,usernam
262,usernam usernam usernam women resort leg dress
263,usernam ight found order morn
264,usernam usernam usernam depend size wear torrid plu size cloth size larg numberx start short inseam maxi person wait tall inseam maxi
265,usernam usernam happi saturday let hard time life take meant make stronger cant rememb top confound face confound face confound face pant usernam sandal usernam lo httpaddr
266,buy anymor cloth usernam cloth shitti bore though compani disrespect hashtag hashtag hashtag hashtag httpaddr let honest usernam better cloth anyway
267,realli great hear favorit brand usernam sell usernam sunglass
268,usernam stop harass keep take money weari face pictur
269,number usernam pant rip crotch sit number face roll eye face roll eye
270,usernam wonder essay usernam mean chang glacial pace httpaddr usernam usernam usernam usernam usernam usernam hashtag
271,usernam fuck websit useless stg lost busi due simpl design mistak fix shit
272,usernam like moneysymbnumb back websit fuck trash
273,usernam usernam check usernam awesom app let save print coupon smartphon httpaddr
274,usernam usernam usernam usernam funni actual american eagl symbol freedom
275,aeo coupon code expir probabl continu advertis front page websit say number order appar expir midnight est angri face fals advertis
276,usernam usernam kudo usernam usernam featur model disabl medic condit represent matter httpaddr pictur
277,usernam usernam usernam usernam brock hampton guy pokemon
278,shout usernam use real women instead model smile face heart shape eye love see stretch mark freckl tanlin etc instead perfect ppl also bra bralett buy one get one free today
279,usernam usernam still believ giant poster model cloth brand feel proud realli amaz
280,usernam clearanc jean moneysymbnumb go get u
281,american eagl drawer best afford shit flex em tho pl feel weird usernam
282,usernam usernam lol pictur
283,usernam usernam usernam thank heavi black heart
284,usernam roommat happi let cancel order right
285,shoutout usernam recommend usernam tri mom jean fit good httpaddr
286,god bless usernam long option buy one piec bless
287,usernam heard usernam shenanigan would greatli appreci guy wanna tag comment purpl heart hashtag hashtag hashtag hashtag hashtag hashtag hashtag hashtag httpaddr
288,spent number minut tri get refund usernam moneysymbnumb shirt order never receiv got run around disgust go cut new aeo credit card embarrass sinc use work aeo
289,usernam usernam help usual send separ one go take lot longer get wait hope go
290,usernam awesom princess georget ballerina fashion project bow arrow thank dream team took part made happen partner crime marchlnumb wear jean usernam comfort httpaddr
291,love usernam heavi black heart heavi black heart heavi black heart pictur
292,hey usernam huge fan cradl middl school grave postgrad love work top short number number stublet leg long abdomen tri cover cute thing beer gut gone pleas consid
293,show store super excit start first day associ usernam afternoon hashtag fire heavi black heart
294,usernam usernam usernam
295,usernam american eagl outfitt usernam zapopan jal httpaddr
296,usernam gain control usernam cloud httpaddr pictur
297,usernam usernam im proud cool
298,usernam usernam usernam usernam usernam usernam usernam okay readi one zzzzzzzzzzzzzzzzzzzzzzzzzzzzzzzzzzzzzzzzzzzzzzzzzzzzzzzzzzzzzaaaaaaaaaaaaaaaaaaaaaaaaaaaaaaaaaaaaaaaaaaaaaaaaaaaaaaaaaaaaaaaaaaaaaannnnnnnnnnnnnnnnnnnnnnnnnnnnnnnnggggggggggggggggggggggggggggggggggggggggggghgggggggggggggggggg gurl okay
299,make tube top built bra usernam usernam usernam usernam
300,usernam usernam bouquet heavi check mark ootdsuto katakana hiragana prolong sound mark ri katakana hiragana prolong sound mark zudechirahorazhi wen moratsutamini katakana hiragana prolong sound mark chiyannoshirthadisney seanodayo heavi black heart victori hand emoji modifi fitzpatrick type number se itoteisutoba qun nike ai palm tree leaf flutter wind jean overal americaneaglejp aeo eyeglass sunglassesflex_japan athlet shoe sneakeradida hashtaghashtaghashtaghashtaghashtag httpaddr
301,dig new royal jogger thank usernam
302,usernam usernam usernam usernam usernam kid number grow fast drop small fortun everi time go
303,aeri partner nation eat disord associ neda fourth annual campaign httpaddr usernam usernam pictur
304,usernam usernam usernam thank usernam campaign word begin explain much mean make emot struggl diabet littl less daunt
