,tweet
4545,usernam furiou bought jean websit pay item ship uk get separ bill usernam duti tax fee includ initi transact would made purchas known never
4546,show usernam pant hashtag pictur
4547,shoutout usernam american eagl outfitt super skinni jean cuz know twig jean new fave
4548,usernam usernam lol lil
4549,damn usernam thought better jean fit butt well httpaddr
4550,honestli usernam one favorit store shop late
4551,hello usernam number number leg statur thank make perfect fit jeg extra long size final ankl warm person rais hand celebr pictur
4552,usernam make jean worth moneysymbnumb ya girl love ya jean afford moneysymbnumb one pair sleep face pictur
4553,usernam kill ship list gift arriv way said go thank much fist hand sign emoji modifi fitzpatrick type number
4554,usernam abl log ae account anyth like even add thing cart also tri make new account see mayb someth act thing keep get error pictur
4555,usernam usernam ugh n saw tweet face roll eye face roll eye face roll eye face roll eye face roll eye
4556,usernam pictur
4557,usernam usernam usernam usernam usernam usernam love beauti pictur
4558,usernam usernam order sweater last year still gotten almost month ago birthday need long past tri track say inform unavail unaccept
4559,usernam usernam crazi tyler love one use spray pillow face tear joy guess go somewher els inform desk person emoji modifi fitzpatrick type number number oh interest think face face tear joy upsid face
4560,usernam usernam full stock need pad shift person rais hand celebr emoji modifi fitzpatrick type number
4561,usernam expor midtown bit usernam hashtag dress p hold phone close face get whole look roll floor laugh hashtag hashtag hashtag hashtag httpaddr
4562,enjoy year save jackpot favorit brand includ usernam usernam usernam mani info httpaddr hashtag pictur
4563,usernam httpaddr
4564,usernam american eagl definit becom favorit cloth store
4565,like host shout usernam real one futur hashtag hashtag pictur
4566,usernam american eagl outfitt usernam pedreg cmx httpaddr
4567,usernam usernam gonna gonna wear bday tomorrow bummer
4568,usernam usernam park number street away hous bc bitti old focu make hill kinda glad close earli face cold sweat
4569,usernam cute american eagl outfitt usernam new hartford ny httpaddr pictur
4570,use usernam app first time love cant wait review tri haul youtub channel thing got usernam usernam usernam ok hand sign emoji modifi fitzpatrick type number number shop bag heavi black heart
4571,usernam actual hell give us full pocket take away hashtag pictur
4572,shop brother remind usernam actual sella singl piec cloth actual made america hashtag hashtag pictur
4573,usernam usernam would absolut take back
4574,someon want explain special usernam overal sold moneysymbnumb
4575,usernam usernam im twig cannot possibl relat
4576,usernam usernam somebodi seen first second movi time comfort share internet much hashtag
4577,usernam usernam precis think roll line product would pine everi last word signag hashtag hashtag
4578,usernam whoever made deserv rais hashtag hashtag hashtag hashtag pictur
4579,usernam hashtag pictur
4580,usernam usernam usernam bra best
4581,usernam thought shop onlin meant easi go somewher talk peopl wear pant worth much troubl weari face pictur
4582,love usernam cloth everyth buy fit well comfort
4583,usernam jean go come back stock httpaddr want cash bogo nope hashtag
4584,tu armario es un reflejo de tu actitud frent la vida expres con prenda te muestren tu personalidad juvenil moderna encuentra opcion como esta en usernam de nuestro nivel number hashtag hashtag pictur
4585,new cpa convers jeffrey mitch american eagl outfitt valu usernam design cpa busi industri httpaddr usernam
4586,usernam usernam u look cute girl us
4587,usernam usernam thank good know think gonna gonna go store handl
4588,usernam alway wanna put shit sale buy
4589,usernam omg usernam sponsor hashtag hashtag hashtag hashtag
4590,usernam eye usernam
4591,usernam liter worst compani terribl servic super disappoint
4592,main stage inclus unfilt convers women entrepreneurship hashtag usernam usernam pictur
4593,usernam girl like high waist short shrug emoji modifi fitzpatrick type number zero width joiner femal sign shrug emoji modifi fitzpatrick type number zero width joiner femal sign give us like number pair low rise short choos seem fair
4594,worn new ae jean twice alreadi small hole back aeo need talk
4595,place number order usernam week asham
4596,pay fifti dollar pair short usernam bare last two month four wear
4597,usernam usernam pic happen eye new moon face
4598,usernam usernam usernam love boo bouquet rose purpl heart
4599,usernam addict so cut money wing
4600,usernam number hour sinc team ignor pay custom
4601,usernam super help go store ship back conveni peopl onlin shop reason
4602,usernam usernam usernam booti face stuck tongu wink eye thank person fold hand emoji modifi fitzpatrick type number number usernam andrewbuda awesom cheeki peach pic usernam two heart see evil monkey two heart usernam usernam hashtag hashtag aeo headquart httpaddr
4603,hey usernam pl ship bath suit quickli skip day thank love bye sparkl sparkl sparkl
4604,usernam usernam usernam would sniff heart beat
4605,readi spring shoot usernam hashtag hashtag pictur
4606,shout usernam jean fit thick love pleas ever leav peach two heart peach two heart
4607,hi usernam anyon abl get back pleas
4608,usernam usernam usernam freez toosh snow snowflak tee usernam jacket usernam jean usernam boot httpaddr
4609,usernam hello bought pair jean week ago zipper broke alreadi
4610,usernam consid normal wear tear purchas mid jan worn sparingli wash thrice number time till appal qualiti pictur
4611,usernam usernam usernam mooooodddd af
4612,usernam liter number custom line number cashier fun upsid face upsid face upsid face upsid face upsid face upsid face upsid face
4613,plu amaz deal alll timee usernam usernam pictur
4614,order someth onlin sale return item rebuy sale xx usernam
4615,good see usernam well hashtag pay httpaddr
4616,usernam usernam usernam usernam eagl totem pictur
4617,usernam retweet madonnamaniac airplan leo usernam queen univers usernam usernam shirt hashtag hashtag httpaddr
4618,usernam usernam disappoint site manag handl employe steal moneysymbnumb daughter wallet dress room spend ton money store hashtag hashtag hashtag
4619,guy throw coupon two lmao onlin shop joke usernam
4620,serious spend whole paycheck usernam sponsor alreadi loudli cri face loudli cri face loudli cri face loudli cri face
4621,usernam usernam face tear joy
4622,usernam hi hello girlfriend work realli hard one store aaand believ except salespeopl get commiss base pay x amount sale act great incent make sale provid great reward good work httpaddr bbi face throw kiss
4623,hashtag usernam usernam usernam usernam httpaddr
4624,usernam hey know long size swimwear thing bodysuit long torso mine would love
4625,usernam usernam wow ye
4626,usernam live chat servic suck ask simpl size question told go store get answer
4627,moneysymbnumb two heart usernam ili pictur
4628,puffi sleev jam person rais hand celebr catch latest blog post featur look black rightward arrow httpaddr tjmaxx usernam usernam usernam pictur
4629,usernam usernam clearli twitter bot read tweet though
4630,usernam hmu tho httpaddr
4631,favorit shirt got mess today littl devast either need find way mend super tini hole find exact replac usernam hashtag pictur
4632,usernam usernam make comfi jean prefer usernam day smile face heart shape eye
4633,usernam usernam step number go montrealstep number go jean jean jeansnumb success guarante best shop experi ever
4634,como te explico que al ver esta foto en vez de ir corriendo comprar deprimo ma hashtag usernam pictur
4635,usernam give coupon model jean pictur
4636,day number packag somewher space appar usernam
4637,hashtag ceo usernam demand respons tweet hell back respond fire fire fire fire httpaddr
4638,usernam usernam definit cloth attempt make women appeal men
4639,usernam realli let
4640,usernam usernam mani video brand free tbh wouldnt upset get sponsor vid
4641,know know usernam fragranc line gender neutral tell limit jasmin lotu rose scent femal bust sinc birth
4642,liter never disappoint compani worst custom servic ever usernam
4643,oh wait long buy favorit leg usernam stock size loudli cri face loudli cri face loudli cri face whole day ruin
4644,usernam hashtag hashtag hashtag hashtag hashtag americanair usernam swear httpaddr
4645,american eagl un catalogo con la diversidad flor de piel usernam httpaddr pictur
4646,okay get usernam addict sue pictur
4647,usernam usernam mine alway get actual buy trinidi troubl size though never truli know fit unless tri
4648,usernam usernam glad one think liter brand jean last number year
4649,usernam american eagl cynic exploit lgbtq pride big display mn mall america store number mile away burnsvil store noth shame show gut support lgbtq right consist broadli market target
4650,whole wardrob usernam need get endors deal weekli spend numbermoneysymb numbermoneysymb hashtag
4651,usernam thank friend one favorit shot
4652,usernam takenumb promo code say valid promot
4653,usernam fyi best experi union sq shop today denis look us well super impress
4654,usernam guy chang name activ flex tri find pair caus like wear comfi flexibl cloud leg pictur
4655,usernam usernam style vegan leather weather usernam usernam usernam usernam usernam usernam httpaddr pictur
4656,usernam usernam cuuuuut ador bea
4657,wear men flannel top usernam stay warm cozi httpaddr pictur
4658,usernam usernam usernam usernam freak hate face tear joy skull
4659,usernam usernam
4660,usernam given custom servic tbh think abil pass bug report food chain peopl fix
4661,usernam usernam great work like numberyr look like start find new stuff buy even w discount usernam hashtag hashtagdlookslikem
4662,usernam usernam count ao shop go forward decis bracelet absolut stupid top enough pc bs
4663,usernam usernam beauti clap hand sign emoji modifi fitzpatrick type number
4664,usernam usernam face open mouth smile face open mouth
4665,usernam usernam usernam pictur
4666,global brand presid usernam discuss stay relev cool featur new concept store love store laundri idea colleg kid hashtag httpaddr
4667,usernam usernam congrat
4668,holi market promo email usernam need chang subscript prefer asap hashtag
4669,usernam usernam usernam time upgrad photograph eagl
4670,understand usernam light wash jeg never last long dark wash one need answer pout face
4671,usernam usernam righhhhht want pair black overal ae place find size limit af
4672,call long leg dancer hashtag hashtag hashtag hashtag outfit detail face scream fear usernam usernam pictur
4673,usernam usernam usernam mayb go hand deliv stay
4674,usernam love shirt jacket much got usernam happen sale httpaddr
4675,usernam usernam assin peopl get bracelet liber belong looney bin
4676,store shown except custom servic holiday season usernam usernam usernam usernam usernam usernam usernam
4677,usernam httpaddr hashtag hashtag hashtag hashtag usernam scoobys_fit_stop kennetconnel httpaddr
4678,usernam wish all pant would stop rip within two week buy
4679,usernam american eagl outfitt usernam mexico citi cmx httpaddr
4680,would nice usernam coupon
4681,quick shout usernam mail week color jeg bless person rais hand celebr emoji modifi fitzpatrick type number person rais hand celebr emoji modifi fitzpatrick type number person rais hand celebr emoji modifi fitzpatrick type number
4682,usernam usernam usernam
4683,usernam damn brought three pack boxer store dubai mall got back home open find one pair xl got mug favorit brand
4684,spi usernam blanket tho eye httpaddr
4685,usernam hey realli like sweatshirt bought number number coupon buy win win us pleas thank u
4686,usernam usernam usernam need make sure show seven year old dd think cool probabl want start shop aeo
4687,total return fanni pack pick super cute one usernam perfect trip
4688,usernam usernam omg thank
4689,usernam usernam usernam usernam usernam usernam sooooo guy tight pant show packag drop sag ass pant peopl get ask leav women girl yoga pant short skirt tight low cut blous could go peopl wear face roll eye
4690,hey everyon yall could show support ig tag usernam usernam usernam usernam usernam brand recent post would awesom thank everyon support alreadi
4691,usernam need answer unaccept httpaddr
4692,well well usernam american eagl also own vista outdoor hashtag hashtag httpaddr hashtag
4693,usernam onlin sale end
4694,usernam usernam beauti si two heart
4695,usernam usernam find joy simpl thing work sure
4696,usernam yup sometim dress like number year old wink face right great mornin rompin new usernam playsuit room aka danc hashtag hashtag hashtag hashtag httpaddr
4697,usernam shame cave one person complain bracelet racist wth countri come
4698,usernam usernam usernam hate
4699,usernam usernam usernam also aso missguid topshop tall section
4700,usernam terribl shop experi rosemount outlet mall wait line behind other fit room person front given room turn wrong line peopl work must thought health
4701,found usernam carri x long inseam jeg excit bought number pair jean tall hard find jean fit excit hope
4702,usernam ahh hmm heb je gekeken naar americaneagl usernam vind de klede voor heren dit jaar ook niet zo
4703,usernam usernam pictur
4704,usernam pick line probabl made okay hashtag hashtag hashtag hashtag shame shame cersei voic pictur
4705,also go check usernam pride collect onlin sell number sale benefit get better project love compani promot divers inclus love wave white flag zero width joiner rainbow
4706,usernam right
4707,usernam usernam usernam numbercoralharbour usernam cater target demograph young women buy cloth men realli compar still buy cloth bar establish
4708,usernam usernam usernam usernam numberso usernam usernam oh god ur pretti
4709,usernam usernam cave social justic warrior busi pathet get backbon chang peopl
4710,usernam usernam that sad pair ive sinc number grade im number theyr still perfect pensiv face
4711,usernam niu zi duan ku get american eagl outfitt usernam state colleg pa httpaddr
4712,sparkl shirt surpris giveaway sparkl shirt thought would set someon schwinn schwag give away one men usernam tailgat schwinn shirt person rais hand celebr enter go instagram post black rightward arrow httpaddr pictur
4713,love cut one piec usernam kiss mark hashtag hashtag hashtag hashtag pictur
4714,usernam hashtag beauti sale price great deal problem item hashtag dump carton without wrap protect plastic tissu papper wet rain dump one top anoth bent insid bottom support panel
4715,usernam big man one big grand prize usernam hashtag hashtag hashtag hashtag hashtag hashtag hashtag hashtag httpaddr
4716,yo need new pant watch wonder woman viral usernam get new jean pictur
4717,usernam usernam usernam usernam awesom lot peopl look deal hope got one
4718,girl usernam usernam time squar new york pictur
4719,second pair usernam jean bought last year zipper broke track make boho flare jean anymor suck pout face
4720,usernam usernam even like jean great price anyway think face
4721,usernam hey friend wave hand sign emoji modifi fitzpatrick type number littl busi work front thing final get slow herb got usernam overal year ago httpaddr
4722,get number usernam use link httpaddr
4723,much respect usernam differ size model think beauti natur allow model pictur heavi black heart need world
4724,usernam usernam usernam usernam usernam usernam butt look good arizona jean accord girlfriend statement need
4725,usernam usernam usernam wonder
4726,usernam usernam usernam damn remov
4727,usernam usernam usernam usernam record sole reason appli place employe discount
4728,want say thank usernam use gorgeou model say plu size pictur show women look like sit add word plu size photoshop tummi make us feel fat realli step right direct pictur
4729,usernam earli selfi rock usernam shadezzz lovin shadezzz hashtaghashtag httpaddr
4730,la tienda deberian de replicar el custom first de usernam
4731,usernam usernam cute love much
4732,hey usernam thank cancel damn order tell shit
4733,usernam usernam sunday funday sunday top usernam jean usernam hashtag hashtag hashtag hashtag hashtag hashtag usernam httpaddr
4734,usernam someth said
4735,usernam usernam omg love much face tear joy heavi black heart
4736,usernam usernam usernam well think depend size man shop hahaha happen plenti numberxnumb one place numberxnumb other
4737,sum summer plan perfectli jumpsuit galor usernam ice coffe repeat usernam hashtag pictur
4738,usernam usernam usernam usernam liter
4739,bought cute ass underwear thank usernam
4740,usernam usernam usernam tempt
4741,usernam usernam usernam sparkl sparkl jacket usernam usernam vspinksho usernam httpaddr
4742,usernam click link said stock
4743,usernam usernam usernam hell pusht want brockhampton
4744,never stop angri usernam websit take numberev load
4745,usernam usernam jean favorit type jean fit like box glove hashtag
4746,shoutout usernam usernam get packag deliv less number hour
4747,usernam um pictur
4748,usernam usernam rt got doubl length lock
4749,usernam gain control usernam cloud httpaddr pictur
4750,usernam apolog still sell never shop post everi social media forum particip goodby httpaddr
4751,usernam look last week guy think tap tag __shirt usernam pant httpaddr
4752,usernam although best experi point system custom servic certainli make jessica f tiffani awesom sure help solv problem
4753,usernam pleas fix websit go order jean told avail go check done websit tell avail yet go find differ size websit tell avail
4754,usernam usernam studio collabor platform custom creat experi brand site social media team engag directli guest compos real time content shareabl moment usernam hashtag hashtag httpaddr
4755,usernam cute new line colleg tailgat shirt cours purdu never includ upsid face
4756,usernam absolut joke usernam americanair ever want call suck hashtag httpaddr
4757,appar fall love usernam day shrug zero width joiner male sign httpaddr
4758,ah ye almost roll week two overnight ship thank usernam
4759,usernam usernam usernam fuuuuuuuccccckkkkkkkk
4760,ladi inform chang life want inexpens comfort underwear ever wear buy american eagl usernam shrug
4761,usernam usernam ur welcom
4762,usernam usernam usernam ooof
4763,usernam pleas keep put usernam playlist make work much better heavi black heart
4764,usernam usernam slide code
4765,offici done worst job ever life happier ye talk usernam
4766,usernam usernam congrat si
4767,usernam usernam basic model see differ
4768,usernam american eagl outfitt usernam marlton nj httpaddr
4769,usernam glad like usernam hashtag seri actual get hashtag home send thumb sign emoji modifi fitzpatrick type number number one usernam hashtag face tear joy need hashtag pronto quietest place could find hashtag
4770,usernam okay usernam hole pocket problem lost two debit card phone fell spent moneysymbnumb short put hole pocket come cc usernam pictur
4771,usernam great experi monroevil pa locat today thought know
4772,usernam alreadi talk someon great gotta wait dhl thank awesom custom servic smile face smile eye
4773,mc tam alesi usernam kristen arci onstag hashtag talk data driven audienc insight inform thing creativ media process usernam pictur
4774,usernam ama lo que hace nunca tendra que trabajar eagl hashtag hashtag usernam aeolavictoria aeo_distritonumb en plaza puerta la victoria queretaro httpaddr
4775,usernam come loudli cri face pictur
4776,rt usernam team usernam ultim design contest show us got creat vote shirt submit us use hashtag submiss end next friday june number polic car revolv light hashtag hashtag pictur
4777,thursday far fun size number musket bar breakfast found first class cancel instead write essay librari usernam websit
4778,usernam usernam american eagl store big deal bad girl dont cri ya feel
4779,usernam usernam goodwil shrug emoji modifi fitzpatrick type number zero width joiner femal sign
4780,usernam usernam numberlocdiva new mission make sure bitch go busi
4781,usernam thank great select jean jeggjng hashtag hashtag hashtag hashtag
4782,usernam dear usernam talk hashtag httpaddr
4783,thank usernam featur hashtagd model show realiti diseas girl women hashtag httpaddr
4784,usernam guy suck
4785,usernam would think remind staff use person testimoni would way effect custom hear staff remind upsid face
4786,tfw order jean usernam onlin open find pictur
4787,tri order onesi usernam cancel shipment onesi still websit order messag alexi amaz joke weather dad move florida gender norm hashtag pictur
4788,usernam pleas repli let brush sure person america bought shirt idea other could interpret
4789,usernam saw groupon email talk wife replac aeo leather flip number sole final come apart hop onlin see review show drastic reduc qualiti leather flip buy
4790,usernam usernam pictur
4791,usernam usernam mani get
4792,usernam find jean probabl one difficult thing usernam jean fit well also realli comfort although get frustrat httpaddr
4793,usernam usernam wow face tear joy face tear joy
4794,usernam usernam usernam awesom think shop support cyborg mainstream heavi black heart
4795,usernam explain
4796,usernam nice pictur
4797,villagemeridian welcom usernam center year among new retail offic tenant via usernam httpaddr pictur
4798,usernam sponsor
4799,hey usernam size jean tri store sinc mani differ style fit differ
4800,usernam app blow phone notif everi number second tire face goin
4801,usernam go new go hoodi pictur
4802,buy select pair aeo jean aeo short get select pair equal less valu number usernam pictur
4803,like thank usernam make extra short length jean sinc short still long two heart
4804,usernam sell favorit jean anymor realli know life anymor
4805,said winter blue fashion shop usernam pair today pictur
4806,usernam super sweater usernam easi dress number cherri blossom hashtag httpaddr
4807,usernam usernam love aeo jean actual skinni make booti look great long jean claim long fit way ankl haha
4808,fact ever made shelf show usernam need hire least peopl color httpaddr
4809,hey usernam forget add custom servic number busi model
4810,tri get cute shirt usernam collar wrinkl game strong one wash hashtag hashtag pictur
4811,shoutout emma usernam gateway mall lnk turn day around good person smile face smile eye
4812,never mind china person run seriou trade deficit usernam
4813,aeo take number clearanc style onlin httpaddr expir number number
4814,usernam usernam help girl look hot sweatshirt
4815,usernam usernam teen thrill also worth note usernam websit mani young women differ challeng
4816,usernam thought call custom servic email sever time issu ongo nobodi want resolv frustrat
4817,usernam american eagl outfitt usernam osaka httpaddr
4818,usernam usernam would put go spend money drool face x
4819,usernam hashtag last year still bleed blue shoe cs advis vinegar soak keen go buy vinegar bucket wear pant recommend
4820,usernam usernam know size xs xxl weari face white frown face
4821,usernam usernam go hard new stewart line httpaddr
4822,usernam usernam aeo never heard brand
4823,today went usernam store curiou usernam play speaker sooo happi proud deserv play public much queen heavi black heart well earn
4824,l u play usernam mexico today person rais hand celebr emoji modifi fitzpatrick type number region indic symbol letter region indic symbol letter x usernam pictur
4825,hire usernam pictur
4826,usernam usernam wear tester
4827,usernam usernam usernam l
4828,usernam usernam let get one thing straight pan two pan one
4829,usernam number percent cardhold work clearanc jean
4830,best thing new usernam jean fact almost hole like jean actual pocket front final
4831,dera usernam employe know fun talk friend snapchat fun daughter regist wait buy someth hashtag
4832,usernam usernam usernam victori hand
4833,usernam usernam need fix chang room door loud slam everyon let slam
4834,usernam ur worker need pay attent check peopl tire face pictur
4835,hey usernam worst possibl custom servic woodfield schaumburg il locat retail manag pretti embarrass go hope custom get treat better
4836,usernam tnumberd alway thought could never model pretti see pump inset skin love make happi
4837,jean expens cotton shortag moneysymbnumb fine moneysymbnumb moneysymbnumb one pair insan usernam
4838,usernam usernam hey get back mah train u bnumber lol follow
4839,usernam usernam usernam usernam wish could afford kind devic would save least number shot day eas control blood sugar level
4840,usernam american eagl outfitt usernam shibui gu qu tokyo httpaddr
4841,usernam usernam usernam pictur
4842,spot usernam embroid denim short trend may born number aliv well today read blog spring fashion trend httpaddr pictur
4843,usernam usernam usernam true definit want want hot pepper hot pepper hot pepper
4844,got pair clearanc usernam tomgirl jean offici best
4845,number item bag usernam websit moneysymbnumb loudli cri face
4846,usernam peopl suck got enjoy pretti scarf treat usernam httpaddr
4847,mind race wonder right move hashtag usernam usernam usernam need hashtag model slightli smile face pictur
4848,usernam noth like get new jean mail alarm tag clap hand sign clap hand sign clap hand sign pictur
4849,usernam poor custom servic today yodel uk packag order us month ago return sender reason attempt made make deliveri address order christma cheer
4850,usernam aprilnumb sparkl black star black star black star american eagl eagl liang iwu mai eteyokatsuta smile face sunglass usernam usernam hontodohamarishiteru smile face heart shape eye hashtag httpaddr
4851,usernam said give new code give code
4852,usernam usernam look sneez face smile face heart shape eye
4853,usernam usernam amazon equal terribl suffer thank
4854,ugh love new sweatshirt usernam sunflow sunflow sunflow pictur
4855,usernam usernam usernam hell bring beyonc instead
