,tweet
1520,wish usernam packag would deliv usernam tracker say usernam usp say attempt deliv notif left yesterday notif heck pant pout face
1521,super stoke usernam bath suit arriv friday get deliv yet chill first order even arriv use usernam app put anoth order hashtag hashtag
1522,usernam custom servic suck would never spend dime time hashtag
1523,usernam made purchas two week ago gotten free jean coupon moneysymbnumb reward go
1524,usernam quit new trend face palm emoji modifi fitzpatrick type number zero width joiner femal sign haha fix pictur
1525,usernam usernam alloy
1526,usernam usernam pt number pictur
1527,usernam haha realiz warrant much help
1528,sooo someon hack usernam reward account stg use free jean point someon name melina duro gonna problem
1529,usernam restock nude leaf high neck swimsuit
1530,usernam usernam good god
1531,usernam usernam impress
1532,usernam yall fuck right hope shit close
1533,usernam usernam extra pictur
1534,usernam usernam mi vida
1535,usernam american eagl outfitt usernam north miami beach fl httpaddr
1536,usernam usernam insan
1537,legal charg number pair jeban usernam
1538,insan today went shop usernam short jean number
1539,usernam usernam queen heart arrow
1540,number want shop usernam usernam usernam number wait dont shop usernam usernam
1541,usernam usernam usernam thank u chapin sparkl heart would love model idea start lol face tear joy
1542,hashtag promot hashtag w campaign hashtag hashtag hashtag watch hashtag usernam usernam usernam usernam usernam hashtag httpaddr
1543,usernam live chat option websit call right
1544,usernam usernam usernam usernam usernam usernam pictur
1545,guy usernam buy one get one free bra bralett today welcom
1546,feel like read harri potter newspap scroll usernam jean section
1547,usernam usernam pictur
1548,usernam new flagship new york combin customiz merchandis social media approv aesthet follow link httpaddr
1549,excit remodel usernam substanti moon side side launch usernam two heart sparkl hashtag hashtag
1550,usernam usernam take casual denim look next level night style usernam rip jean jean lush pink lace top marshal spike usernam flat accessor httpaddr
1551,futur market data market data per kristen arci usernam hashtag usernam pictur
1552,stood usernam sinc day freak one jean jean fuck love watch bloom like sparkl heart httpaddr
1553,usernam love campaign real peopl keep show support tomorrow shop
1554,usernam usernam want long leg go gym shark onlin number number fit well littl long
1555,usernam worst custom servic american eagl
1556,usernam
1557,grab credit card freezer go usernam get hire
1558,two fav thing usernam usernam pictur
1559,write brand essenc assign usernam jean jeg closet liter seen brand sinc stop shop la senza girl number hashtag hashtag
1560,dear usernam usernam thank much includ diabet new photo shoot let wear pump cgm shed light someth usual put dark manag live revolv heart
1561,usernam dress room shenanigan usernam eagl hashtag hashtag hashtag hashtag hashtag hashtag american httpaddr
1562,usernam dont ask collect one size thought size inclus
1563,usernam usernam shit u right
1564,usernam alreadi contact someon via live chat said noth pretti sure websit said long numberpm would process
1565,usernam gotta girl like usernam
1566,one becom usernam usernam model happi person rais one hand emoji modifi fitzpatrick type number number hashtag
1567,usernam usernam usernam usernam usernam usernam usernam usernam
1568,usernam usernam usernam might start look addit cost put hashtag kevlar line product aim teen first compani go make billion httpaddr
1569,usernam usernam
1570,usernam numbercharmss pictur
1571,reason usernam chose usernam improv hashtag hashtag httpaddr
1572,usernam alreadi tri call prior tweet agent unabl anyth
1573,usernam usernam legitim hate cloth
1574,usernam american eagl outfitt usernam atlanta ga httpaddr
1575,usernam pictur
1576,usernam httpaddr
1577,wtf usernam email chines think face pictur
1578,admit enter usernam first time sinc tweenag year check hashtag hear free hashtag hashtag id prime locat near usernam way draw custom thumb sign emoji modifi fitzpatrick type number bathtub pictur aeo aeri store
1579,fuck shackl kid usernam httpaddr
1580,make bad day even wors expedit packag door got home face look triumph usernam
1581,american eagl one best boxer ever soft comfort etc use wear champion whatev pack wore could never go back usernam
1582,usernam usernam trend setter face stuck tongu tightli close eye
1583,ur next top usernam model come ya pictur
1584,love usernam campaign featur model variou medic condit hashtag pictur
1585,cloth manufactur need understand number inch inseam tall long extra long length repeat noooottttt long help girl usernam usernam usernam usernam usernam
1586,usernam inspir piec sir need answer httpaddr
1587,usernam usernam reach usernam usernam send feedback new ad campaign use model hashtag differ respons wait support httpaddr
1588,usernam aeri store montreal qc httpaddr
1589,usernam afternoon aeo wax chore coat hashtag henley buckmasonusa undershirt nfdenim httpaddr
1590,usernam usernam slim thin sculpt jenni craig fat
1591,usernam usernam quot one finest thespian histori pictur
1592,thank amaz sponsor usernam usernam usernam usernam usernam usernam usernam
1593,usernam usernam hope better luck return label hassl caus someon clearli hurri pay attent
1594,usernam veo veo american eagl outfitt usernam delegacion iztapalapa ciudad de mexico httpaddr
1595,usernam usernam pictur
1596,want free usernam jean white frown face hand index middl finger cross emoji modifi fitzpatrick type number number
1597,usernam realli disappoint size keep chang walk wear normal size jean tri pair size button size keep go bc ur make ur jean smaller get hashtag hashtag hashtag
1598,usernam usernam usernam pictur
1599,usernam thank give differ info chat disconnect regularli hold time end told ye stock well might ae employe stick vega gambl store want custom shop
1600,great spend psnumber usernam hit anoth psnumber custom charg shame went onlin uk worth ad number get ship
1601,usernam extrem flex number ok hand sign emoji modifi fitzpatrick type number smile face smile eye
1602,nice work usernam messeng platform think link tool great locat page social channel along local info inspir even hashtag hashtag httpaddr
1603,usernam even twitter autom respons smh
1604,usernam usernam mean
1605,design usernam thought buyer thought appropri sell hashtag hashtag hashtag hashtag pictur
1606,usernam hope usernam usernam work togeth futurebecaus would drop mall often collabor pictur
1607,petit usernam add ut tailgat collect
1608,usernam usernam happi person rais one hand emoji modifi fitzpatrick type number number happi person rais one hand emoji modifi fitzpatrick type number number happi person rais one hand emoji modifi fitzpatrick type number number
1609,usernam
1610,usernam usernam happen multipl time target
1611,usernam usernam usernam
1612,american eagl outfitt ceo buy condo new ritz carlton resid miami beach httpaddr usernam pictur
1613,happen number month wear men usernam jean email custom servic pretti much told respons hole thread come pocket want wast money buy american eagl jean pictur
1614,usernam usernam three pair jean variou store hope
1615,also super cool continu glucos monitor newer omnipod thank includ tnumberd love usernam revolv heart pictur
1616,babi usernam usernam mexico stan intern model singer queen pictur
1617,appar usernam know make jean anymor month half old pictur
1618,usernam usernam usernam roy moor victori bracelet
1619,tone def blatantli unapologet offens either way face palm emoji modifi fitzpatrick type number zero width joiner femal sign face good gestur emoji modifi fitzpatrick type number usernam httpaddr
1620,yooo good usernam httpaddr
1621,usernam ask collect babe face throw kiss everyth els offer xx xxl sparkl heart
1622,uhmm ship cloth america usernam confus face pictur
1623,aeo nyc want chang way shop pictur
1624,usernam colleg bound co ed want miss new usernam x usernam collab httpaddr hashtag hashtag
1625,usernam oh look shirt order onlin american eagl
1626,usernam usernam usernam usernam stun outfit gorgeou make smile face heart shape eye smile face heart shape eye black heart suit thumb sign
1627,somebodi pleas tell usernam hashtag thought great idea sell shackl accessori trend hashtag
1628,happi holiday usernam take number number holiday collect jean hashtag number tomorrow number number number pictur
1629,usernam _itscindynumb congrat
1630,neutral turtleneck usernam denim usernam booti usernam hashtag hashtag hashtag pictur
1631,thank american eagl outfitt excel custom servic readili resolv issu daughter usernam
1632,usernam usernam love outfit late purpl heart inform desk person emoji modifi fitzpatrick type number zero width joiner femal sign x ok hand sign emoji modifi fitzpatrick type number imstylewig usernam usernam usernam usernam httpaddr
1633,usernam usernam aye happen drop number floor fine smile face open mouth cold sweat face tear joy
1634,went usernam free leg play usernam good know noth chang sinc high school wink face multipl music note
1635,want stock hashtag gear good check pick usernam usernam usernam httpaddr
1636,usernam usernam usernam look beauti
1637,definit bought usernam actual seem tri stop toxic photoshop fake cultur cloth store go buy usernam definit embrac natur beauti like cloth line creat natur fabric
1638,best custom servic experi ever thank usernam wish ask name could give shoutout
1639,usernam usernam thank girli angel black heart suit
1640,expect number packag usernam number usernam next coupl day like
1641,usernam hashtag pictur
1642,abfrl bring icon fashion brand american eagl india usernam usernam hashtag hashtag httpaddr pictur
1643,usernam sponsorship number year almost long wait
1644,usernam usernam hahaha
1645,usernam guy gonna restock
1646,usernam usernam might go sole hear
1647,work usernam nick guy shade usa usa usa pittsburgh repres httpaddr
1648,alway reach whichev pair closest photo usernam hashtag pictur
1649,usernam jean god gift thank everi damn day
1650,usernam usernam bring back bracket peopl use wear back day think peopl dig deep one
1651,usernam usernam wtf usernam compar httpaddr photo straight usernam
1652,would liter anyth pair blue pair black denim jeg skinni jean size number x short usernam
1653,usernam usernam ohhhhhh well shit want joke bad
1654,usernam usernam order tonight go rock tjme face tear joy
1655,usernam usernam number week proper respons even courtesi email phone call state case dealt
1656,hashtag usernam clearanc denim sale
1657,usernam usernam usernam wrangler cant contain big ole dick either derek invest stretchi pant
1658,usernam thank recogn women ibd beauti heavi black heart heavi black heart mean lot us pictur
1659,usernam cannot wait close credit account compani amount bullshit run around impos past coupl month complet fuck crap want keep charg fee let access account fuck
1660,wow ok usernam seinfeld merch smh smh usernam pictur
1661,hey congrat superbowl win american eagl smile face sunglass usernam
1662,usernam usernam alway get jean reason
1663,forev love usernam pant
1664,usernam thank send email buy short want bad go site see sold size expressionless face pictur
1665,amount shop wanna usernam usernam physic hurt face tear joy
1666,usernam usernam rude loudli cri face loudli cri face loudli cri face ratchet would went
1667,usernam receiv wrong item store inform anyway get right item
1668,usernam american eagl outfitt usernam mexico citi cmx httpaddr
1669,usernam usernam went thing alway wore american eagl hollist till olivia realiz move jean need stretch sonoma offer
1670,usernam mom walk said realli proud american eagl put normal look peopl pictur realli proud peopl roll stretch mark good mom approv face tear joy
1671,usernam usernam usernam usernam stripper hang drag queen find showbiz dye hair becom fashion icon realli tell life stori big screen
1672,ipo stock price number need present lol usernam
1673,usernam happen usernam ador bomber jacket sale httpaddr
1674,usernam usernam usernam visita
1675,usernam usernam bracelet offend clearli never even slave reach point slave america quit time bracelet let sink like move let
1676,usernam problem email pictur
1677,love usernam recent bought pair jean number time wash keep die hand blue ugh neutral face persev face
1678,usernam usernam clap hand sign emoji modifi fitzpatrick type number clap hand sign emoji modifi fitzpatrick type number clap hand sign emoji modifi fitzpatrick type number
1679,shirt usernam usernam hashtag pictur
1680,usernam ye smile face heart shape eye
1681,usernam usernam cute
1682,ye ye ye wear ostomi pouch rest life see blue quit httpaddr usernam usernam httpaddr
1683,usernam buy two jean one bigger smaller tyrion lanist
1684,usernam sportin red white blue weekend quick stop american eagl aka usernam today shop httpaddr hashtag hashtag hashtag pictur
1685,new bra usernam without doubt comfiest one ever own
1686,usernam somehow think chri get usernam sponsorship mayb get enough tweet could work
1687,usernam guy better sale jean buy one get one number cut
1688,usernam love real peopl real diagnosi model differ bodi type alway asham diabet thought peopl would think differ saw monitor greatest thing ever httpaddr
1689,usernam usernam oh love one look cute
1690,summer heat get keep romper usernam rotat coolest look around pictur
1691,usernam usernam love also hope afford awesom cloth buy insulin moneysymbnumb per vial might last number week stretch
1692,usernam __cdayi thank cee reliev face
1693,hashtag usernam pictur
1694,usernam still jean recycl program pair jeg bit dust like recycl saw old blog number would take store give number code next jean purchas
1695,closet becom number usernam part base pittsburgh like hella afford comfi
1696,realli bad job sad close store number one time grate opportun growth importantli friend usernam given past number year definit live love life ae
1697,usernam usernam usernam fantast win
1698,usernam discontinu ae real demand answer
1699,pretti littl laundri smirk face grow heart hashtag hashtag usernam usernam pictur
1700,usernam go back make cologn real give rest left smile face open mouth cold sweat hashtag
1701,love usernam mom jean wish wait long
1702,usernam usernam hashtag hashtag usernam usernam birkenstock roll floor laugh face tear joy mca club bandra kurla httpaddr
1703,usernam usernam usernam usernam push tyler favorit rapper
1704,usernam usernam high waist super high bit much tho get artist crop think mid rise also great
1705,usernam usernam everi time buy american eagl jean rip less year
1706,melissa lamb show us summer style st laurent effortless denim look usernam pair favourit distress crop white jean usernam shoulder top usernam add ankl strap sandal usernam pictur
1707,usernam mom short need remind mom forgotten make mom short extra larg pocket snack pacifi built ziplock bag cracker hashtag hashtag hashtag hashtag pictur
1708,usernam usernam cuti
1709,wanna know someth crazi bought pair aeo jean coupl week ago size number size number wast smaller size number wast jean also american eagl anyon els see problem
1710,usernam go credit card bill pay webpag tri last two day view account say page either busi
1711,usernam usernam lmao omg hahahahaha
1712,usernam usernam place name american eagl
1713,usernam usernam email back told lost custom
1714,love usernam jean great job httpaddr
1715,usernam like sweater got clearanc websit comfi color rather pleas thumb sign pictur univers mississippi polic depart
1716,usernam usernam your cute
1717,decouvrez hashtag hashtag number hashtag hashtag usernam hashtag hashtag httpaddr usernam usernam usernam usernam usernam usernam usernam usernam usernam usernam usernam usernam usernam usernam
1718,recommend tailgat line usernam enough super comfort great design usernam
1719,awesom way go usernam usernam heavi black heart guy think cool httpaddr
1720,usernam hire employe beyond rude carmel store say custom servic time low
1721,usernam usernam tri see would offer someth sinc pair almost moneysymbnumb dollar help whatsoev
1722,shout usernam play song love store get tweet like everi day peopl say heard play shop amaz glow star
1723,usernam realli bad experi aeo lutz florida shop disrespect receiv today
1724,channel behavior aeo use consum first approach hashtag pictur
1725,usernam usernam whoa usernam terribl
1726,usernam get number taco print boxer brief onlin store taco taco
1727,usernam usernam custom servic still matter realiz hope usernam celebr kailyn
1728,usernam usernam usernam thank
1729,usernam store excit go nightclub next door find store blast music hashtag
1730,get equal mean share fragranc bring back live usernam
1731,usernam happi hashtag happi honeybe busi purpl heart pictur
1732,birthday week today anyon would kind get love forevaaaaa usernam heavi black heart hug face pictur
1733,usernam happi hump day dromedari camel usernam zara van flowereyewear appl hashtag hashtag hashtag hashtag httpaddr
1734,usernam best softest jean ever
1735,usernam
1736,lol okay thank number item order arriv number separ packag number invoic upsid face face tear joy hashtag hashtag hashtag usernam pictur
1737,usernam usernam white person buy wear around mean
1738,paid shut usernam credit card one piss custom
1739,dress sit usernam shop cart eyebal easter eye email let know sale smile face heart shape eye boom number get easter love usernam x
1740,usernam usernam thing happen pair year ago new pair rip seam like number month disappoint
1741,thought look cute today present realiz present size sticker still shirt thank usernam
1742,usernam updat onlin jean wait number month size need
1743,exactli moneysymbnumb ridicul usernam httpaddr
1744,usernam usernam usernam usernam usernam usernam usernam usernam usernam usernam miss suppos come week work
1745,usernam love black super skinni jean fav smile face heart shape eye loudli cri face person fold hand emoji modifi fitzpatrick type number number
1746,round number speak usernam final speak corpor hope someon compet help
1747,favorit thing usernam employe alway know someon wear cloth caught betti wear shirt usernam
1748,swear hashtag jean fit peopl like hello sisterhood travel pant probabl pair usernam jean
1749,usernam dream jean came mail person rais hand celebr emoji modifi fitzpatrick type number number liter love
1750,usernam come x long pant woah
1751,um whaaaaat u wear jean lmao love usernam inform desk person emoji modifi fitzpatrick type number number zero width joiner femal sign pictur
1752,ok hashtag new usernam highest rise jean number number recommend
1753,usernam think face
1754,stori morn facebook page httpaddr hashtag thank usernam usernam usernam usernam usernam friend hashtag hashtag pictur
1755,want shout guy someon stole new jean porch refund question ask guy best usernam
1756,usernam lit fire
1757,usernam usernam usernam gonna wait till tomorrow get paid alreadi pick two face tear joy
1758,alway tell tri new place jean alway end disappoint bc thigh waist cooper usernam place buy pant sneez face xx
1759,shop clearanc moneysymbnumb usernam pictur
1760,need size number usernam skirt need ass loudli cri face loudli cri face face tear joy
1761,usernam would love order app keep pop everi time tri add cart tire face pictur
1762,usernam morn usernam awar typo cyber squatter misus tm sinc year link httpaddr hashtag hashtag
1763,usernam pictur
1764,usernam usernam ador much loudli cri face x
1765,shoutout hashtag inclus model start differ bodi type model jean lol usernam pictur
1766,usernam impress inclus approach promot product featur model cloth happen medic devic awesom show girl want model need hide devic keep healthi aliv
1767,usernam american eagl outfitt usernam fujimi shi saitama httpaddr
1768,usernam like ad pic anymor
1769,usernam jean even denim everi time get pair even stretch year last pair love thought hashtag
1770,usernam american eagl outfitt usernam charleston wv httpaddr
1771,qryb arab letter alef arab letter alef ftt arab letter alef h arab letter alef wl frw hashtag arab letter alef rbks_ryzyrf fy hashtag arab letter alef lri arab letter alef l tryq arab letter alef ltkhssi fy mrkz hashtag arab letter alef h _tf arab letter alef syl usernam ydhkr arab letter alef n arab letter alef lmrkz ydm mt arab letter alef jr mnh arab letter alef usernam w usernam w usernam w usernam arab letter alef ntzrw arab letter alef tgttyn arab letter alef n qrb llmshrw br sn arab letter alef bn arab letter alef httpaddr pictur
1772,usernam pride collect cute smile face heart shape eye
1773,clase de market de la marca de ropa usernam en hashtag smile face sunglass usernam pictur
1774,readi summer cherri blossom rainbow black sun ray httpaddr usernam usernam usernam usernam usernam hashtag pictur
1775,usernam need stop sale bc heart say ye bank account say
1776,usernam model entir closet american eagl
1777,shout usernam usernam featur hashtagd teen w medic devic full view beauti hashtag hashtagdlookslikem pictur
1778,usernam restock artist flare jean soon need exchang pair bought almost everi size stock time favorit style jean jean
1779,want high rise jean men number much ask cough usernam cough
1780,bought number swimsuit moneysymbnumb today thank usernam hook sista sign horn emoji modifi fitzpatrick type number
1781,usernam guy store chandigarh india place order onlin ship hidden charg
1782,make happi usernam pictur
1783,love usernam model
1784,usernam usernam cute
1785,usernam usernam usernam usernam usernam sorri hard sick need sing get well soon
1786,chock full news usernam usernam usernam usernam usernam sign futur email httpaddr httpaddr
1787,usernam need make comfort set want queen size slightli frown face pay extra
1788,thank usernam credit card cut sent shini replac one want use hashtag
1789,usernam plz make mini skirt longer actual wear one long woman would prefer butt display everywher go
1790,usernam duckin around classic usernam plu dude moneysymbnumb right httpaddr
1791,usernam usernam ye girl pun
1792,usernam usernam wow actual unawar thank girl face tear joy sparkl sparkl heart
1793,okay usernam need stop hole back pocket fad bc phone fell pocket like numberx surpris crack yet
1794,usernam pleas pleas pleas put back stock perfer size small need order number day wise wont good bath suit wear trip pleas put back stock pictur
1795,usernam usernam usernam could buy rip jean
1796,usernam gonna cute bout one timeeeeeee
1797,usernam sit outsid store phone laugh
1798,usernam chang size honestli ridicul
1799,tri work overnight usernam listen usernam usernam crack gener quiet store need episod make night co worker look crazi stop number swab pictur
1800,usernam httpaddr
1801,alreadi rub hole thigh newer usernam capri face roll eye unamus face serious mayb number month
1802,usernam pleas explain pictur
1803,usernam usernam usernam jeg tan line burnt usernam save face horribl burn smile face heart shape eye smile face heart shape eye flex bicep emoji modifi fitzpatrick type number httpaddr
1804,usernam usernam boob big
1805,channel inner carri bradshaw usernam hashtag hashtag distress denim jean usernam graphic usernam accessori make look match coffe mug finish look hashtag hashtag hashtag pictur
1806,usernam hey guy get charg got sent two pair jean order
1807,prop usernam model differ shape size could still better part bought suit would previous avoid see girl look like look amaz httpaddr compani take note hashtag benefit bottom line
1808,usernam usernam ton clearanc item less moneysymbnumb hashtag hashtag hashtag
1809,worst custom servic award goe usernam
1810,usernam leg like butter leg
1811,usernam usernam well friend right get sock bet sock lol
1812,usernam usernam order bra minut anyway
1813,usernam custom servic suck
1814,usernam usernam happen gotten jean
1815,usernam usernam usernam amaz
1816,share liter bought moneysymbnumb pair jean moneysymbnumb bra free ship usernam moneysymbnumb say bargain shopper inform desk person emoji modifi fitzpatrick type number pictur
1817,mean much bc never thought ever see model colostomi bag model underwear bra swim wear middl school holli insecur scar wish could seen someth like back thank usernam usernam two heart httpaddr
1818,usernam american eagl outfitt usernam yokohama shi kanagawa httpaddr
1819,usernam httpaddr
1820,got one usernam soft sexi cardigan outlet last week true say soft def keep warm work right glad bought color black person rais hand celebr emoji modifi fitzpatrick type number person rais hand celebr emoji modifi fitzpatrick type number pictur
1821,usernam usernam want hear sing pleas big fan httpaddr love huge hit written want sing femal part
1822,usernam usernam mom jean win hashtag hashtag hashtag hashtag hashtag httpaddr
1823,last name pl consid n letter fun charact usernam pictur
1824,wish usernam jean freak rip time
1825,usernam usernam give lemon drink beer shrug emoji modifi fitzpatrick type number zero width joiner femal sign stuck miami see tomorrow medellin httpaddr
1826,usernam usernam ye lot differ option
1827,usernam dream partnership alert usernam partner httpaddr
1828,usernam usernam usernam beauti smile grin face smile face heart shape eye two heart
1829,dualiti aaron shoutsout big love usernam look cute day hashtag revolv heart butterfli pictur
1830,usernam usernam heck
1831,usernam usernam usernam usernam l
1832,usernam _erinonfir happen stuff ship separ loudli cri face
1833,hashtagech le point de vent adapt aux hashtag comm usernam ou usernam ou usernam hashtag en propos de hashtag lieux de vie et hashtag peut fair sa lessiv tout en travail dan l espac hashtag et en faisant se cours pictur
1834,done usernam interest rate suck
1835,usernam packag move packag transit up facil kentucki number day info
1836,usernam get outfit inspir usernam usernam face tear joy httpaddr
