,tweet
817,hashtag hashtag usernam usernam unicorn face unicorn face unicorn face unicorn face hashtag come wbk hashtag pictur
818,usernam friend usernam drop insan good song coupl day ago go listen interpos spotifi usernam httpaddr
819,usernam httpaddr
820,usernam usernam awesom
821,record hashtag tune first light year new version httpaddr applemus
822,usernam usernam usernam usernam usernam meu coracao explod de felicidad junto com voce usernam hashtag clap hand sign clap hand sign clap hand sign clap hand sign clap hand sign multipl music note multipl music note region indic symbol letter b region indic symbol letter r blue heart heavi black heart
823,usernam usernam usernam usernam boc listal number straight classic there way
824,best playlist usernam offer god heaven pictur
825,usernam usernam usernam usernam usernam usernam b ettini number
826,usernam se conviert en la artista femenina con ma cancion simultanea dentro del topnumb de usernam en toda la historia toda la cancion de hashtag entraron al chart acompanada de fefe big bank nicki cuenta con number cancion en el topnumb creando nuevo record pictur
827,usernam listen shit wack like
828,usernam
829,usernam usernam smile face heart shape eye multipl music note
830,usernam usernam usernam ooh love ooh love hoo love good crown crown
831,usernam _cjorddi usernam fact
832,usernam cover rock roll nois pollut usernam usernam usernam stream platform crank httpaddr
833,usernam usernam usernam usernam usernam usernam bad luck usernam got alreadi face tear joy everybodi turn around queen hit power women know
834,usernam usernam usernam usernam usernam usernam usernam usernam usernam usernam usernam usernam usernam gonna get usernam track face open mouth cold sweat wave hand sign
835,usernam usernam usernam pleas open dm person fold hand emoji modifi fitzpatrick type number loudli cri face
836,usernam usernam usernam usernam usernam usernam usernam usernam usernam usernam
837,usernam vnumber hashtag hashtag edicion origin remasterizada number gramo vinilo edicion limitada usernam usernam usernam usernam usernam beyond speaker three sound wave decidu tree person fold hand emoji modifi fitzpatrick type number hashtag hashtag hashtag hashtag
838,song day usernam usernam usernam hashtag hashtag hashtag httpaddr
839,usernam usernam usernam buon compleanno amor mio ci hai sorpreso proprio tanto birthday cake heavi black heart il regalo piu bello lo hai fatto tu noi non ho parol sono commossa sei tornata loudli cri face hashtag hashtag
840,keep stream hashtag usernam httpaddr
841,usernam usernam pleas put antarctica back usernam
842,hashtag usernam httpaddr
843,usernam usernam twin hug face get check either mine
844,battl usernam usernam heat httpaddr
845,usernam usernam usernam beeh come sempr senza parol come sai fare solo tu hashtag e gia una bomb bomb buon compleanno confetti ball parti popper birthday cake balloon wrap present vecchietta heavi black heart e buon ritorno ci sei mancata tanto smile face heart shape eye smile face heart shape eye
846,usernam usernam te amo loca
847,usernam usernam estoy fascinada con hashtag es todo lo que esta bien
848,usernam usernam usernam usernam usernam usernam diao betagan zidato ri ben nospotifydak wen kenaimitaidesun hai wai dehawen keterumitaidesu ri ben dehacryst lakenospotifyhaji jin saretenaimitaidesu
849,usernam ta famoso usernam
850,usernam pleas updat homescreen widget look current play music usernam widget certainli httpaddr almost made switch usernam usernam httpaddr fist hand sign person fold hand usernam hashtag hashtag hashtag
851,usernam usernam cannot wait watch
852,usernam hashtag hashtag usernam colombia smile face heart shape eye smile face heart shape eye crown pictur
853,usernam usernam usernam usernam nice fire fire
854,x usernam gone pay whole kvshygang trillspil
855,usernam usernam post youtub pl
856,usernam usernam usernam hope sell powder album
857,usernam usernam usernam usernam love u much
858,usernam usernam fam make sure podcast major stream outlet usernam usernam usernam etc
859,yo usernam download usernam new album hashtag hit download circl stop pictur
860,usernam usernam usernam cd come usual buy number number share famili went target
861,usernam usernam usernam usernam xxxxxxxxxxxx cherri blossom sparkl hashtag teacher two heart britney teacheri listen musico g two heart sparkl eight point black star sparkl shoot star eight point black star sparkl shoot star cherri blossom two heart rabbit face cat face dog face mous face omg heavi black heart cherri blossom sparkl cherri blossom sparkl cherri blossom sparkl cherri blossom sparkl cherri blossom sparkl cherri blossom sparkl cherri blossom
862,usernam usernam da lugar pra outro aranha
863,usernam map tan album nan sou usernam wi man pask mwen ou gen bagay nan mainw
864,usernam usernam yasss big congrat heavi black heart
865,usernam usernam auguri amor black heart suit mi sei mancata tantissimo ben tornata hashtag amorosoofhashtag
866,usernam usernam callat con tu applemus
867,good morn usernam usernam infinit pl
868,watch usernam alreadi got mad respect usernam make appreci artist even check kill bruv wish u would usernam see ya soon httpaddr
869,usernam usernam usernam usernam usernam usernam esperando hashtag hashtag hashtag hashtag hashtag hashtag hashtag hashtag sign horn
870,usernam pre order usernam usernam avail hope headlin tour album
871,shadi usernam pictur
872,usernam usernam njani manj
873,usernam deu livr
874,usernam nao obrigado est cara cantam que nem fanho
875,usernam usernam love legend
876,wish usernam music usernam
877,httpaddr listen debut album avail good platform usernam usernam usernam hashtag hashtag hashtag hashtag hashtag hashtag hashtag
878,usernam let download neither listen song hashtag usernam broken heart broken heart loudli cri face pictur
879,usernam number classic usernam usernam pictur
880,usernam usernam dope love album play car day fire fire fire
881,sharkymajor usernam step hashtag uk region indic symbol letter g region indic symbol letter b video watch usernam httpaddr hashtag hashtag usernam listen httpaddr
882,person avail stream usernam httpaddr pictur
883,usernam usernam usernam much one
884,still thuggin usernam right fire fire fire pictur
885,usernam usernam te dinlemek icin tiklayin hashtag hashtag hashtag httpaddr
886,usernam usernam usernam usernam usernam usernam usernam usernam eye aubergin splash sweat symbol pictur
887,usernam usernam richsex fire hit
888,numberltj tea usernam fix shit rn
889,usernam usernam initi number month pay nois keep ur system run updat uconnect system moneysymbmoneysymbmoneysymbmoneysymbmoneysymbmoneysymb nav system moneysymbmoneysymbmoneysymbmoneysymbmoneysymb sirusxm radio moneysymbmoneysymbmoneysymbmoneysymbmoneysymb auto maker rack buck long last car payment want keep system date
890,okay usernam usernam usernam made complet bop hashtag usernam omg addict
891,usernam usernam bich king kong
892,usernam httpaddr
893,usernam usernam pleas listen httpaddr
894,accord usernam hashtag usernam usernam number million subscrib upcom plan hashtag hashtag usernam httpaddr
895,usernam usernam bey still fix
896,usernam usernam usernam te amo si
897,usernam music link bio music score multipl music note tumbler glass stream download itzsomethinaboutthi hashtag hashtag hashtag hashtag hashtag hashtag hashtag hashtag decept let go go gt usernam httpaddr
898,nickiminaj listen whole album love download usernam loudli cri face loudli cri face loudli cri face
899,follow usernam multipl music note pictur
900,usernam usernam usernam usernam usernam tesellil yalan sarki boyunca nakarat gibi akici olsaymi kesk nakarat cok iyi cunku unutulacaksin icin tam tersini dusunuyorum cok basarili artik basariyorsun en silik sarki olabilir
901,usernam _carlosrivera padrisima
902,usernam numberwblk usernam stream usernam usernam spotifi spotifycanada usernam numberwblk usernam hashtag thompson hotel toronto httpaddr
903,listen hashtag usernam multipl music note httpaddr
904,usernam usernam usernam usernam ohhhh hell ye
905,frenchi scream rington yet need remind answer call face tear joy face tear joy usernam usernam hashtag hashtag hashtag hashtag
906,usernam new music usernam present hashtag playlist number usernam usernam feat pusha pharrel goldlink shi glizzi rico nasti ybn corda masego peso da mafia enjoy httpaddr pictur
907,usernam usernam fuckin dope dawg flex bicep emoji modifi fitzpatrick type number
908,usernam usernam usernam buon compleanno idolo una canzon meravigliosa e la ventesima volta che guardo il video e stupendo hashtag pictur
909,anybodi els troubl ad music usernam orrr
910,usernam usernam love lot heavi black heart heavi black heart heavi black heart heavi black heart heavi black heart ok hand sign ok hand sign ok hand sign ok hand sign
911,moment look usernam notic usernam releas anoth song new album sli dog face tear joy pretti intens song sign horn emoji modifi fitzpatrick type number pictur
912,usernam usernam cool smile face sunglass smile face sunglass smile face sunglass smile face sunglass smile face sunglass smile face sunglass smile face sunglass love blue heart face throw kiss smile face heart shape eye blue heart face throw kiss smile face heart shape eye blue heart face throw kiss smile face heart shape eye good day sun face black sun ray proud person rais hand celebr person rais hand celebr person rais hand celebr person rais hand celebr person rais hand celebr person rais hand celebr person rais hand celebr keep hard work thumb sign thumb sign thumb sign thumb sign thumb sign thumb sign thumb sign
913,usernam usernam jm cryifn
914,usernam usernam miraaaa fire pictur
915,usernam usernam usernam im download
916,usernam usernam lali lo ame es lo mejor del mundo
917,usernam usernam film amaz perfectli thought execut beyond obsess heavi black heart heavi black heart heavi black heart
918,usernam stream epiphani
919,usernam usernam usernam mine
920,wth abl play next song usernam
921,usernam usernam usernam usernam thank ani till number tho one track preview avail usernam might drop littl someth tonight howev
922,si tell usernam fix ya album usernam face roll eye im bout go back spotifi lol
923,usernam hashtag fire usernam hashtag mobil phone rightward arrow left httpaddr
924,usernam usernam see think deserv grammi stage abl compar other heartbreak glad saw light found confid heavi black heart heavi black heart
925,usernam usernam escucha bien esta cancion ti te la estoy dedicando hashtag ya esta dispon en usernam _carlosrivera httpaddr pictur
926,hashtag hashtag usernam crown keep stream hashtag httpaddr pictur
927,usernam usernam honor usernam memori need usernam hashtag usernam
928,usernam usernam usernam usernam jak mial kupiona poewienien moc sciagnac jeszc raz za free jesli dobrz cie zrozumialem
929,usernam usernam usernam everyth listen goodcharact link symbol bio add spotifi playlist listen str stream platform usernam usernam usernam usernam httpaddr
930,usernam usernam usernam usernam blue heart
931,usernam usernam usernam yellow heart thumb sign camera four leaf clover
932,usernam usernam usernam hashtag avail digit platform usernam usernam usernam googleplaymus spotifi youtub usernam usernam usernam httpaddr
933,poetri music usernam present new album afriqu mon desir laurinda hofmeyr afriqu mon desir ensembl listen album usernam httpaddr hashtag pictur
934,usernam divulgacao pesadissima
935,martingarrix exclus mix usernam play live one mix usernam tune httpaddr pictur
936,usernam usernam love hashtag
937,usernam usernam anyway stream queen spotifi httpaddr
938,dramat im gonna usernam soul need daeng number clock number usernam
939,usernam usernam usernam fire estamo hashtag en usernam como trend hit fire top upward arrow gracia usted mi gent person fold hand emoji modifi fitzpatrick type number earth globe america rompiendo hashtag fire fire fire valentino ft usernam cross mark usernam link en mi perfil en mi canal de youtub httpaddr
940,usernam usernam usernam stream album download stream count toward billboard leav cloud next song
941,get groov new singl mud usernam man danc httpaddr pictur
942,barbi dream hashtag usernam red appl pictur
943,usernam listen album much time alreadi bout dig slightli smile face thumb sign hashtag white point backhand index fire fire fire fire fire hashtag usernam hashtag hashtag usernam hashtag speaker three sound wave speaker three sound wave speaker three sound wave httpaddr
944,usernam usernam usernam usernam mine work thanx
945,usernam usernam usernam usernam usernam usernam throw bih shuffl viiiiib
946,usernam usernam love babi
947,usernam usernam usernam usernam usernam usernam usernam httpaddr give us follow
948,usernam music start play plug earphon music app even open
949,new ep silk etc come everywher august number number usernam usernam usernam usernam usernam anywher els listen music probabl httpaddr pictur
950,usernam usernam hashtag hashtag usernam usernam hashtag
951,usernam explain pay moneysymbnumb month appl music skip constantli phone updat happen wifi lte sick pay much money someth work half time
952,usernam usernam polic car revolv light polic car revolv light polic car revolv light new music alert polic car revolv light polic car revolv light polic car revolv light issaj_ r u e r applemus usernam spotifi platform hashtag hashtag httpaddr
953,usernam usernam usernam person rais hand celebr
954,usernam usernam yasssss sister snap
955,usernam usernam usernam eddi pleas pleas fix appl music itun match confus replac uniqu mix track appl itun user librari pleas updat document make easi find allow prevent origin track appl offer
956,usernam usernam usernam usernam usernam usernam meu eterno menudo
957,usernam usernam usernam usernam usernam usernam usernam usernam hill eyesguitar world review
958,usernam shuttin spotifi httpaddr
959,redman longass career top song per usernam featur christina auguilera face tear joy pictur
960,usernam nop
961,usernam usernam usernam one smartest guy busi well done garrix boy congrat
962,usernam eu ia silva
963,dope boy world wide vibe playlist usernam
964,usernam tf play music devic yo btw still premium subscript android btw
965,usernam usernam usernam usernam usernam usernam usernam usernam multipl music note fist hand sign emoji modifi fitzpatrick type number number multipl music note
966,pre save sleek boy ep via usernam august number httpaddr
967,usernam usernam usernam usernam muy pronto nuevo lanzamiento en toda la plataforma digital spotifi usernam usernam usernam hashtag hashtag hashtag hashtag hashtag hashtag hashtag multipl music note hashtag hashtag hashtag pictur
968,usernam usernam usernam usernam usernam amaz number excit hear whole thing
969,usernam usernam usernam smile face heart shape eye smile face heart shape eye smile face heart shape eye smile face heart shape eye smile face heart shape eye smile face heart shape eye smile face heart shape eye smile face heart shape eye smile face heart shape eye
970,usernam paraben usernam mestr de todo os tempo aquel axe person rais hand celebr emoji modifi fitzpatrick type number
971,love hashtag cover far go hashtag happi person rais one hand zero width joiner femal sign water wave multipl music note check usernam httpaddr camera randal michelson pictur
972,usernam usernam usernam queen
973,usernam usernam hashtag usernam w r k n e platform usernam spotifi amazon httpaddr
974,check mesmer perform accordion virtuoso usernam number usernam winner concert latest naxo releas path h c andersen avail usernam usernam httpaddr httpaddr
975,iphon rap number usernam
976,usernam httpaddr
977,new album avalon usernam usernam listen httpaddr
978,new music usernam httpaddr
979,usernam usernam anytim babi
980,usernam usernam ye queen
981,usernam usernam usernam usernam usernam usernam awesom show last night paramount thank zakk
982,usernam usernam usernam ha detto qualcosa
983,usernam usernam usernam finalment io gia innamorata auguriiiii black heart suit
984,usernam stop tell bout nicki album dont care
985,awww thank usernam smile face open mouth tightli close eye fire let danc speaker three sound wave dancer man danc heavi black heart heavi black heart heavi black heart httpaddr
986,play get paul johnson realli point put lyric usernam httpaddr pictur
987,usernam usernam usernam usernam usernam usernam usernam usernam show wait see
988,usernam usernam usernam usernam usernam usernam algun lugar en puerto rico dond se pueda conseguir el lp el lp vien con poster firmado hay una edicion digit high re number number
989,usernam insanlari sikmey yer ariyorlar ucretsiz diyorlar ucretli cikiyor amk c lari hayatlari sahtekarlik firsatcilik
990,usernam usernam usernam usernam usernam usernam usernam usernam zakk jd u guy keep knock skit jon boston chapter sign horn flex bicep sdmf
991,usernam usernam usernam spotifi appl
992,usernam usernam usernam usernam usernam usernam usernam usernam pure magic nice
993,usernam usernam usernam yooo first singl live stream platform thank exist usernam black heart usernam usernam spotifi usernam fuck wit ya boi money bag httpaddr
994,img usernam usernam usernam studio usernam hashtag premier last night two heart pictur
995,usernam usernam usernam youll never cardi b stop tri face tear joy face tear joy face tear joy face tear joy usernam
996,usernam usernam usernam usernam usernam usernam usernam instrument vol number process distribut whole album platform atleast monday hashtag hashtag hashtag support music hibiscu hibiscu hibiscu usernam usernam usernam usernam usernam usernam usernam usernam usernam pictur
997,usernam usernam usernam smile face heart shape eye smile face heart shape eye smile face heart shape eye smile face heart shape eye smile face heart shape eye smile face heart shape eye
998,usernam multipl music note without disappear forev forev multipl music note hashtag hashtag usernam usernam pictur
999,got usernam back pictur
1000,first world problem complain usernam usernam basic butcher japanes music collect usernam region lock certain song brother listen origin version metropoli usernam
1001,numberk goin dummmi fire fire fire go get shit rn usernam pictur
1002,usernam usernam usernam grazi perch e tutto bellissimo grazi perch riesci sempr non deludermi ti amo tantissimo tanti auguri passa una buona giornata come sara la nostra heavi black heart
1003,usernam usernam se te dio mi gordo anda con ninguno pendejo pue venezuela stand
1004,usernam stop sugggest countri music
1005,anyon els appl music fuckin mine mess coupl day usernam x gone need fix refund friend moneysymb caus let use roll floor laugh
1006,usernam usernam usernam bucigv
1007,velhic enorm tamanho de vida obrigada usernam pela genialidad humildad e compartilhar tanto talento com gent confira stream usernam clap hand sign emoji modifi fitzpatrick type number clap hand sign emoji modifi fitzpatrick type number clap hand sign emoji modifi fitzpatrick type number clap hand sign emoji modifi fitzpatrick type number clap hand sign emoji modifi fitzpatrick type number clap hand sign emoji modifi fitzpatrick type number vale muito pena httpaddr
1008,usernam new ep bro toni v amaz tune definit recommend usernam usernam pictur
1009,usernam numberso post hq pic shirtless calum rn thank almost numberam im wait
1010,appl music let download queen album usernam usernam think face think face think face
1011,usernam usernam usernam chaiiiii diamond hard bruh hard pass tha rock oooh killam em hahahahahaha much love cameroon u b fire
1012,hashtag e il nuovo brano di alessandra usernam potet scaricarlo da usernam e ascoltarlo su usernam cliccando qui black rightward arrow httpaddr hashtag bomb heavi black heart
1013,usernam usernam proud happi grow heart
1014,usernam usernam usernam grazi del regalo smile face heart shape eye buon compleanno amor grow heart
1015,hashtag avail pre save usernam httpaddr pictur
1016,usernam usernam usernam usernam usernam usernam usernam usernam bolt neck disgust kid zakintho love brother zakk spell correct make phone
1017,usernam uhh
1018,usernam usernam ___itsash super fake
1019,usernam usernam usernam idgaf dat sing mixtur shit cut rap bad bitch nicki type shit llc best song song shoulda like llc fire fire fire fire fire bring roman back featur idgaf nobodi say let argu know bitch full potient
1020,usernam plan two new releas messeng bipolar shaman ambient shaman done acoust electr guitar follow burn collect classic first black cat ms usernam
1021,seem like everyon stress week someth get weekend roll hashtag hashtag usernam httpaddr
1022,read great usernam usernam differ usernam usernam recent switch spotifi premium think platform littl bit recept independ artist thank read httpaddr
1023,numberu zair william avail stream usernam usernam usernam httpaddr pictur
1024,usernam usernam usernam usernam usernam usernam usernam usernam paperwork
1025,usernam hashtag usernam pictur
1026,number year hip hop person rais hand celebr emoji modifi fitzpatrick type number put playlist togeth featur number song sampl creat favorit rap song listen usernam usernam usernam httpaddr
1027,usernam usernam usernam usernam usernam usernam usernam usernam hot
1028,usernam usernam usernam sei tornata qui crown crown crown crown top upward arrow top upward arrow top upward arrow music note music note music note music note music note bomb bomb bomb usernam
1029,usernam usernam drake featur
1030,usernam usernam usernam semplicement g r z e ora cerco di riprendermi anch se non ci riusciro
1031,usernam usernam usernam motion ft arlonnn stream platform full moon symbol sunflow go get vibe hashtag usernam spotifi usernam soundcloud still bless regardless httpaddr
1032,usernam usernam hashtag ra vi lho
1033,usernam usernam
1034,usernam usernam obrigado gil essa obra e mai um present pra no muito obrigado
1035,rainbow usernam hashtag offici watch usernam eye httpaddr pictur
1036,usernam usernam usernam u reason love hous music heavi black heart heavi black heart heavi black heart heavi black heart heavi black heart heavi black heart heavi black heart heavi black heart heavi black heart heavi black heart heavi black heart heavi black heart hope one day wl work dope hous song keep time right
1037,medasinmus sit exclam mark left right arrow top upward arrow debut album iren usernam usernam listen httpaddr pictur
1038,usernam usernam know way ran ridicul
1039,usernam usernam usernam pictur
1040,usernam guy put maddennumb soundtrack usernam need gym person fold hand emoji modifi fitzpatrick type number person fold hand emoji modifi fitzpatrick type number loudli cri face
1041,usernam usernam usernam legend know legend
1042,hashtag u like usernam usernam usernam usernam love hashtag httpaddr
1043,usernam usernam usernam make album usernam face stuck tongu tightli close eye smile face open mouth smile eye crown two heart
1044,usernam usernam usernam usernam usernam usernam usernam usernam usernam ha pretti much
1045,usernam usernam usernam woohoo sad dont appl phone white frown face
1046,need futur monster mixtap usernam
1047,usernam usernam pictur
1048,daryaa usernam hashtag juniorbachchan taapse vickykaushalnumb anuragkashyapnumb kanikadhillon itsamittrivedi httpaddr
1049,usernam usernam usernam ayi let goo hashtag
1050,usernam usernam te amo heavi black heart
1051,usernam guy tell hungri ghost usernam
1052,usernam hashtag hashtag hashtag usernam usernam usernam usernam hashtag hashtag usernam usernam usernam usernam usernam usernam httpaddr
1053,usernam usernam usernam usernam x sorpresa xya esta dispon hashtag en usernam usernam usernam usernam usernam mucha plataforma ma el video sale manana sabado la number number pm en youtub muy atento white heavi check mark escucha la cancion ya white point backhand index deezer httpaddr hashtag pictur
1054,usernam usernam ok buddi hashtag hashtag usernam pictur
1055,usernam usernam sign horn sign horn sign horn sign horn sign horn person rais hand celebr person rais hand celebr person rais hand celebr heavi black heart
1056,usernam httpaddr
1057,usernam usernam usernam grazi di tutto ale sparkl heart sparkl heart
1058,usernam usernam usernam bangen ntwana fist hand sign
1059,usernam usernam io sono senza parol ancora una volta tanti auguri usernam e grazi infinit heavi black heart heavi black heart heavi black heart
1060,slut squar exclam mark usernam usernam pictur
1061,thank usernam
1062,usernam usernam usernam must live rock lol
1063,usernam usernam usernam hashtag headphon hashtag hashtag hashtag usernam song hashtag hashtag hashtag httpaddr
1064,usernam usernam usernam hashtag play south africa loudli cri face hand index middl finger cross
1065,hey usernam network connect listen music download listen offlin consist complet defeat purpos unless android phone user
1066,usernam usernam te amo mariana
1067,usernam want updat close app without music stop face palm emoji modifi fitzpatrick type number number zero width joiner femal sign
1068,usernam usernam usernam come brazil region indic symbol letter b region indic symbol letter r hashtag pictur
1069,usernam usernam usernam usernam sei special yellow heart yellow heart yellow heart yellow heart yellow heart
1070,hashtag usernam time rnumberhab remix song one httpaddr usernam httpaddr usernam httpaddr usernam
1071,usernam httpaddr
1072,usernam usernam usernam new skeeterlaflar signedbythestreet ep ft deagl nonbruh casperr project stream via usernam major stream platform includ usernam usernam number number stream purchas link httpaddr
1073,usernam usernam puedo parar de escucharlo lali te amo
1074,usernam usernam usernam usernam love
1075,usernam sick ass listen song bye play shit mo phone statu symbol go music free could get result cheap ass phone catch wave
1076,nickiminaj current domin us usernam hashtag hashtag hashtag hashtag respect hashtag reach hashtag us appl music album pictur
1077,usernam numberso pictur
