,tweet
1078,usernam usernam usernam next album number one love sm heavi black heart heavi black heart
1079,usernam block ban alex jone
1080,usernam usernam usernam omg crazi
1081,summer sun face chill vibe usernam hashtag hashtag hashtag hashtag hashtag hashtag hashtag hashtag hashtag hashtag httpaddr
1082,happen usernam face cold sweat face cold sweat face cold sweat pictur
1083,usernam usernam usernam queen best album ask friend famili speak truth
1084,ybb godzilla delux edit usernam avail major digit music platform stream purchas offic album today multipl music note fire fire fire hashtag hashtag hashtag hashtag hashtag hashtag applemus link white point backhand index httpaddr
1085,lo gordo en la playlist hashtag ahora en usernam httpaddr pictur
1086,usernam check new remix usernam type link bio hashtag hashtag hashtag hashtag hashtag hashtag spotifi usernam httpaddr
1087,usernam usernam aprehendit et videt alguien imagina en espana un musico esenci exministro de cultura asi
1088,sparkl heart love chosen sparkl heart multipl music note new song releas multipl music note preview usernam usernam shaycarl hashtag httpaddr
1089,usernam usernam amaz heavi black heart yellow heart green heart blue heart purpl heart
1090,usernam usernam love aaron purpl heart
1091,imm sad usernam free trial end loudli cri face loudli cri face back pandora lmao iight caus switch tast music instead listen song number time listen hashtag yet imm hella salti loudli cri face loudli cri face
1092,usernam hashtag number countri usernam song belong hashtag hashtag hashtag hashtag hashtag hashtag hashtag chun swae bae atm bought album gonna buy song later gotta see queen top spot hot number number top number hot hundr chart hashtag hashtag
1093,guess su usernam
1094,usernam usernam song remain heart forev love everi word note thank love heavi black heart smile cat face heart shape eye babi angel emoji modifi fitzpatrick type number pictur
1095,time music platform like usernam usernam step stream qualiti music realli matter deliv audio high qualiti resoulut numberkbp unaccept number usernam win reason right hashtag
1096,usernam drop one shot happi two shot sad listen new album usernam usernam httpaddr httpaddr
1097,usernam pleas help issu past number week sa canada pictur
1098,usernam usernam usernam usernam usernam usernam sweet pictur
1099,usernam usernam usernam anyon size chart pleas realli want buy skinni weari face pictur
1100,usernam usernam usernam usernam usernam usernam usernam usernam father zakk one wick axe skull crossbon
1101,usernam usernam usernam pictur
1102,usernam usernam u deserv love heavi black heart heavi black heart
1103,usernam speak head silhouett speak head silhouett speak head silhouett speak head silhouett speak head silhouett httpaddr
1104,usernam usernam glad appl music love hear live ku grin face smile eye multipl music note dancer
1105,time tri add song playlist add clean version pleas fix usernam
1106,usernam usernam usernam usernam usernam usernam usernam fuck let get site
1107,releas first album usernam usernam usernam hashtag httpaddr
1108,usernam usernam usernam liter happen tri buy song indian store next minut curat playlist music librari got vanish instantli thano hand snap pleas look usernam
1109,usernam usernam usernam bellissimaaaaaa aa hashtag
1110,estou tentando ouvir hashtag da usernam na usernam ma eu clico na musica e toca outra nao estou conseguindo ouvir album toda ele toca mesma toda hora loudli cri face
1111,usernam usernam usernam usernam usernam usernam usernam usernam fuck bad ass
1112,usernam usernam usernam download music youtub websit ez
1113,wait number septemb listen album bring thunder listen ep wait avail stream download usernam usernam usernam usernam usernam usernam guitar sign horn guitar
1114,usernam usernam usernam dope album
1115,usernam usernam es por chupart la media ni porqu todo lo que haga gusta peroooo realmentd que cancioneeee laleee muy arriba encantan sign horn lo que va ser el luna va explotaaar rose fire mouth bomb
1116,usernam usernam usernam tanti auguri sandrina anch se il regalo lo hai fatto noi smile face heart shape eye heavi black heart
1117,usernam usernam hi love would mean world follow back love im proud hashtag amaz pictur
1118,dzieki uprzejmosci usernam mam mozliwosc po ponad roku przerwi znowu testowac usernam nadal jest hashtag hashtag kpina hashtag nie istniej obsluga przez hashtag tragedia hashtag jest swietni nadal usernam rzadzi
1119,usernam usernam love
1120,hashtag hashtag usernam pictur
1121,usernam usernam usernam usernam usernam usernam usernam usernam pictur
1122,usernam need night mode
1123,usernam usernam he hotti
1124,usernam usernam usernam usernam sarkinin sozleri icin httpaddr
1125,gusta cuando djawadi se sale de su zona de comfort pero siento que se sigu quedando corto al final para el cine ramin djawadi slender man number httpaddr via usernam pictur
1126,usernam usernam usernam ugh took loudli cri face loudli cri face
1127,number song top number usernam hashtag hashtag rap banish hashtag tower hop usernam usernam take throne princess emoji modifi fitzpatrick type number hashtag hashtag hashtag usernam pictur
1128,usernam usernam purchas non appl music subscrib
1129,usernam queri india debit card get accept payment gateway
1130,usernam usernam usernam ricoooooo thank
1131,nicki minaj album sound hella drake like neutral face mean alright guess someth fill resum guess hashtag hashtag hashtag usernam usernam usernam
1132,holi shit anghami usernam get shit togeth pictur
1133,e bir de unutmadan hashtag zirvedekil turkc rap listesind hashtag usernam usernam usernam httpaddr
1134,usernam usernam usernam usernam best
1135,hey usernam would hard add line two give songwrit credit usernam pictur
1136,releas new reason smile watch much brighter life shine _ httpaddr usernam usernam usernam usernam usernam usernam usernam usernam usernam usernam usernam pictur
1137,usernam usernam foda se
1138,usernam usernam usernam avail appl user
1139,usernam usernam usernam usernam usernam pictur
1140,usernam sooo upset get see usernam rainbow film today face tear joy face tear joy face tear joy face tear joy face tear joy face tear joy face tear joy face tear joy face tear joy
1141,new singl autom teller machin fire larg red circl digit store white heavi check mark hashtag usernam usernam usernam usernam usernam usernam usernam usernam usernam usernam usernam usernam usernam usernam usernam usernam numberebeat usernam usernam pictur
1142,usernam usernam httpaddr get numberd support
1143,usernam usernam un homenaj hashtag encanto gracia usernam usernam en santa lucia hill httpaddr
1144,playlist could never reach spotifi level know usernam
1145,usernam usernam one stream platform get tune fire fire write hand emoji modifi fitzpatrick type number chart upward trend hashtag hashtag hashtag usernam usernam usernam usernam httpaddr
1146,usernam usernam lali podea hacer firma en mendoza por favor
1147,usernam usernam usernam ora che cambio la pell e la destinazion ragazza color autunno non saro piu tornera quella voglia di correr avet present quando cert canzoni arrivano al momento giusto e sembrano parlar di te ecco questa e una di quell ne avevo davvero bisogno grazi ale heavi black heart heavi black heart
1148,usernam usernam see one day lifetim hope missouri
1149,thank usernam like soundcloud spotifi white smile face usernam
1150,usernam pleas help die httpaddr
1151,usernam usernam e em sua velhic vc vai defend um bandido medo da lava jato
1152,usernam usernam usernam usernam usernam cool thank lol cb readi hehe pictur
1153,get new singl usernam usernam fire fire fire httpaddr
1154,explicit version queen play go usernam
1155,hashtag hashtag album usernam top chart australia crown usernam pictur
1156,usernam gud luv enjoy
1157,usernam ye kany respect man ever take crap true countri region indic symbol letter u region indic symbol letter hashtag hashtag
1158,usernam usernam usernam love coffe
1159,usernam usernam need one fun usernam documentari film reunion tour sayin
1160,get number month usernam avail appl carplay r jeep compass httpaddr pictur
1161,usernam tire rap shit fuck convent today listen real music store thank push usernam word joiner pena person fold hand usernam usernam pictur
1162,usernam usernam usernam hashtag eminem nicki minaj sing togeth ok hand sign ok hand sign ok hand sign ok hand sign
1163,usernam usernam love
1164,usernam fuck suck
1165,usernam usernam usernam usernam dead face tear joy
1166,usernam usernam ahahsh delib
1167,usernam usernam usernam usernam te necesitamo en mexico smile face heart shape eye smile face heart shape eye
1168,usernam usernam usernam usernam usernam usernam dooooooop
1169,usernam usernam usernam io sono ancora senza parol loudli cri face loudli cri face loudli cri face bentornata queen del mio cuor loudli cri face heavi black heart hashtag
1170,usernam usernam wow heavi black heart
1171,usernam usernam hello kesha pretti love u smile face heart shape eye blue heart green heart yellow heart purpl heart yellow heart blue heart
1172,usernam usernam usernam usernam siriusxm
1173,hashtag usernam usernam smile face smile eye multipl music note dispon ahora en usernam white point backhand index httpaddr
1174,usernam usernam sparkl heart sparkl heart sparkl heart
1175,usernam usernam fire fire fire
1176,usernam usernam usernam heavi plu sign heavi multipl x
1177,usernam usernam usernam wow u bare afford make number show lol still feel lucki see number time enjoy
1178,usernam usernam usernam io sono senza parol e bellissima verament face throw kiss tantissimi auguri tesoro bello smile face heart shape eye heavi black heart
1179,usernam usernam te amo
1180,usernam usernam leav
1181,usernam usernam usernam usernam usernam usernam love
1182,hashtag hashtag lush usernam feel new usernam usernam pictur
1183,okay period usernam pay good money httpaddr
1184,get caught vibe listen hashtag playlist featur usernam headphon usernam
1185,pay appl music everi month even download fuck song anymor smile face smile eye fuckin spin circl wast money face palm emoji modifi fitzpatrick type number number zero width joiner femal sign usernam
1186,stream hashtag album usernam usernam million time smile face heart shape eye enta w maii best hashtag
1187,usernam restor old delet playlist usernam fck x number
1188,rt usernam get hashtag usernam dizzi symbol httpaddr pictur
1189,usernam usernam httpaddr
1190,usernam usernam usernam usernam usernam usernam best
1191,usernam numbereband guy good
1192,usernam usernam usernam thumb sign
1193,usernam usernam usernam u slid barbi dream hashtag hashtag bitch ithashtag
1194,usernam usernam usernam today time step googl wwgnumberwga
1195,real talk get jojo usernam
1196,usernam usernam put discographi intern fan loudli cri face loudli cri face loudli cri face skull
1197,usernam usernam finalment usernam heavi black heart heavi black heart heavi black heart heavi black heart heavi black heart ci sei mancataaaa hashtag e una bomba gia il loop smile face heart shape eye e auguri di buon compleanno heavi black heart e grazi per averci fatto questo regalo
1198,usernam usernam es una bombaaaaaa bomb collis symbol fire wink face
1199,usernam usernam usernam usernam ayyy
1200,yesterday switch usernam usernam membership almost number year decid switch due lack support appl watch appl tv actual impress appl music heavi black heart pictur
1201,usernam usernam e q seu tempo de vida gil seja prolongado por muito tempo
1202,usernam usernam amaz usernam blossom cherri blossom bouquet go watch stori usernam appl hashtag hashtag franklin histor district httpaddr
1203,usernam usernam pleas make dark mode thing pictur
1204,usernam usernam love relat lot even thank heavi black heart
1205,usernam usernam usernam n f l shuffl everywher white heavi check mark usernam season hashtag hashtag hashtag hashtag hashtag hashtag hashtag stream download record today usernam usernam usernam usernam video popcorn popcorn popcorn hashtag usernam usernam keyword satellit antenna hashtag seriou lord pictur
1206,tri figur pillowtalk remix shuffl pillowtalkxxx usernam usernam
1207,best jona brother album littl bit longer taken appl music u pleas explain thank usernam
1208,chart downward trend avail vinyl cd via httpaddr music store chart downward trend stream via usernam amp usernam chart downward trend redeem usernam dropcard httpaddr chart downward trend download via usernam chart downward trend steal open week would sick
1209,usernam usernam download still negat fact delet album librari order download rest song never let reason pictur
1210,usernam usernam collabor would nice shrug emoji modifi fitzpatrick type number zero width joiner male sign
1211,usernam usernam usernam thx
1212,usernam usernam cool
1213,usernam usernam usernam usernam oh wow free version loudli cri face
1214,usernam usernam beauti kesha hope life treat well tri keep happi find differ way channel lifestyl know easier said done keep smile
1215,usernam usernam oooeee pay hashtag hashtag speaker three sound wave hashtag youtub usernam usernam hashtag hashtag hashtag hashtag hashtag hashtag httpaddr
1216,kudozz ft usernam legendari produc usernam usernam usernam usernam usernam pictur
1217,usernam usernam usernam hey
1218,usernam usernam usernam hashtag hashtag usernam dellyranxmus hashtag hashtag usernam hashtag hashtag hashtag speaker three sound wave speaker three sound wave speaker three sound wave hashtag usernam hashtag hashtag hashtag httpaddr
1219,mcscuse get skate smoke rap hashtag version usernam hashtag hashtag usernam
1220,usernam usernam usernam usernam usernam usernam
1221,usernam usernam aaaa te amo
1222,usernam usernam usernam usernam usernam appl musicdejian suo shitemodetekonaidesu
1223,usernam usernam
1224,usernam guy drop album
1225,one problem barbi dream usernam usernam
1226,usernam usernam usernam live nice
1227,usernam usernam odznaczeni zaznaczeni opcji biblioteka muzyczna icloud daje jaki efekti pictur
1228,usernam usernam usernam bentornata e auguri principessa heavi black heart heavi black heart heavi black heart
1229,usernam usernam usernam usernam c est freak de timmi trumpet
1230,usernam usernam es un vicio pictur
1231,usernam usernam usernam usernam block usernam usernam ban infowar hate speech account like alex jone
1232,usernam usernam usernam pero de verdaaaad smile face heart shape eye que hermosa foto
1233,usernam usernam usernam usernam delight album boy noth bop banger put realli import messag phenoman purpl heart
1234,usernam usernam usernam usernam usernam heard tidal good numbermo trial pay artist fewer stream count number album sound qualiti better
1235,usernam usernam favorit got featur best week playlist usernam httpaddr
1236,usernam usernam ye song catchi love pictur
1237,usernam need someth bought usernam yet download phone
1238,usernam usernam usernam album fuck lit queen
1239,usernam usernam usernam bellissimo il brano e auguri di buon compleanno birthday cake parti popper confetti ball wrap present
1240,rapper vinc lee usernam usernam usernam collis symbol collis symbol collis symbol pictur
1241,aye usernam need song librari smooth strawberri httpaddr
1242,usernam usernam usernam khub sundor dada
1243,usernam chase us around avail us loudli cri face usernam
1244,usernam usernam puedo creer que ayer te haya visto te abrac heavi black heart heavi black heart te amo tanto heavi black heart
1245,usernam usernam usernam usernam usernam usernam lo esperado
1246,usernam usernam te amo mi amor heavi black heart heavi black heart heavi black heart heavi black heart estuvist increibl ayer gracia por ser tan humild por la firma de mi disco smile face heart shape eye heavi black heart
1247,usernam usernam dpo base numberm ass kiss hashtag freeload semi httpaddr rule buy stock entiti provid product lovein meantim e wrong truck kill togeth w usernam hashtag nut usernam moneysymbnumberb hashtag obviou borat
1248,marni english gothic ep usernam httpaddr
1249,usernam usernam usernam usernam usernam usernam muy buena musica esperando buena noticia con tu salud
1250,usernam goodby wave hand sign unicorn face
1251,usernam usernam usernam usernam usernam usernam usernam usernam beauti
1252,usernam usernam usernam usernam usernam usernam usernam great fire support track httpaddr
1253,last american come two week go grab new singl usernam httpaddr pictur
1254,even listen new usernam album usernam want keep account lock number day verifi everyth cunt usernam
1255,still love hate usernam usernam pictur
1256,hashtag number playlist gonna fire avail today usernam
1257,usernam thank love fire fire fire top upward arrow soon rightward arrow tm flossin hit number k tube click link bio get numberk avail purchas stream platform spotifi usernam amazon httpaddr
1258,usernam usernam usernam usernam thank dj marti love much
1259,usernam could pay still would listen
1260,usernam usernam ahhh deserv dev best mistak bop proud love heavi black heart heavi black heart
1261,usernam usernam told hillbilli come bro man httpaddr
1262,usernam usernam usernam usernam genial carino xx smile face heart shape eye smile face heart shape eye mouth sparkl heart mouth heavi black heart mouth broken heart mouth rose clap hand sign clap hand sign clink glass clink glass smile face sunglass mouth
1263,usernam usernam love
1264,usernam usernam great song
1265,one know usernam hashtag video put last two show usernam
1266,love hear usernam usernam feel httpaddr
1267,usernam usernam usernam usernam billi ocean wave cultur get ep link httpaddr usernam applemus usernam googleplaymus usernam usernam hypebeast usernam usernam httpaddr
1268,usernam usernam usernam queen follow trend talk fuckin poppin pillsxus hugge fan honestli hundr point symbol relat anymor shrug emoji modifi fitzpatrick type number zero width joiner femal sign mean lose number fan matter wink face make clear
1269,usernam usernam usernam happi guy heavi black heart smile face heart shape eye
1270,usernam usernam voce nunca ha de envelhec gil
1271,usernam start usernam agap mayb get subscript httpaddr
1272,usernam usernam stori numberyear old littl brother born problem told us water head mayb big fan noiw thank god aliv hear music happi pictur
1273,usernam usernam queen releas heavi black heart crown
1274,usernam usernam usernam nicki realli gave album still come fire like wow fuck game like number year strong bitch still write ya damn song pay nigga front like like shit pay nigga write shit weari face fire fire
1275,start appl itun award show usernam usernam dm instruct collect check great idea
1276,usernam usernam congratul usernam hashtag hashtag hashtag fire fire fire anoth solid album keep keep
1277,serious fourth time get togeth wtf usernam pictur
1278,usernam usernam usernam crazi im hook talk number letter yeah ik hate
1279,usernam usernam lali hermoso disco gracia por todo por la buena onda de ayer por tu carisma tu amor two heart eternament gracia
1280,usernam usernam cuti bean
1281,usernam thank hashtag great weekend hashtag usernam hashtaghashtaghashtag number httpaddr hashtag hashtag hashtag hashtaghashtag usernam httpaddr
1282,usernam usernam usernam ok hand sign emoji modifi fitzpatrick type number number
1283,usernam usernam usernam deserv
1284,usernam usernam q onda el concurso bro
1285,hashtag know usernam play hashtag hashtag usernam usernam hashtag hashtag hashtag hashtag usernam think hashtag hashtag usernam usernam usernam usernam usernam usernam usernam usernam usernam
1286,usernam usernam mi deezer gusto mucho ahora estoy en spotifi con vario amigo
1287,usernam usernam usernam heck crazi rememb guy came last year huge look guy amaz see far guy come sooo excit see happen futur ili heart arrow heart arrow heart arrow heart arrow heart arrow heart arrow heart arrow
1288,usernam usernam usernam usernam usernam usernam usernam usernam happi birthday dear dario flex bicep birthday cake region indic symbol letter region indic symbol letter r
1289,usernam usernam usernam
1290,usernam need get togeth latest soca
1291,usernam usernam love heavi black heart heavi black heart heavi black heart rainbow rainbow rainbow rainbow
1292,usernam usernam awesom thank listen
1293,usernam usernam que seja primeiro de muito
1294,usernam santi take song usernam expressionless face expressionless face expressionless face face without mouth
1295,fume usernam make qualiti playlist chang song two day later face roll eye loudli cri face pout face
1296,usernam usernam remov download librari count stream
1297,usernam merci numberbb usernam heavi black heart pictur
1298,usernam usernam usernam usernam usernam usernam soumitaidesun ri ben hachu kutsutekatsukoshu kidearimashita
1299,usernam usernam usernam usernam soo coolll smile face heart shape eye smile face heart shape eye smile face heart shape eye
1300,usernam usernam femal rapper call nicki support femal rap crack face x hashtag usernam long live crown
1301,usernam usernam fire
1302,new collabor usernam deutsch grammophon usernam first temptat switch usernam wish spotifi took classic music serious
1303,usernam usernam usernam icon song earth coco chanel smile cat face heart shape eye listen coco chanel hour think brain gonna explod collis symbol stop cri face smile cat face heart shape eye pictur
1304,usernam usernam quiero el cd aca llego todavia loudli cri face loudli cri face loudli cri face
1305,car go rix still cover take top cmo corner avail free usernam stream usernam httpaddr
1306,appl music act usernam think face
1307,number night appl music numberfutur usernam think face
1308,usernam usernam te amo
1309,usernam pleas get usernam usernam amoneysymbmoneysymb need song album front page well thumb sign emoji modifi fitzpatrick type number
1310,usernam usernam usernam voila sa va passer en boucl smile face heart shape eye smile face heart shape eye smile face heart shape eye bisou depui la franc face throw kiss pictur
1311,point last night ad everi club number song usernam regret
1312,usernam numberso u snap
1313,usernam usernam usernam bentornata heavi black heart non riesco smetter di ascoltarla sei sempr hashtag con solo un anno piu happi birthday balloon parti popper
1314,usernam usernam usernam usernam usernam usernam usernam usernam hello zakk beatiful guitar like one much un colombia theresa good guitar god blesyou zakk
1315,usernam usernam usernam usernam usernam usernam usernam usernam usernam funni though corpor appl quick acquiesc chines censorship long get market share
1316,listen hashtag open book usernam hashtag httpaddr
1317,usernam usernam te amoooo
1318,usernam kak raz nedavno chital fantasticheskuiu simfoniiu giperion usernam usernam pictur
1319,usernam usernam hashtag
1320,usernam listen gargoyl dan lyon via hashtag httpaddr hashtag pictur
1321,usernam tolero drake gracia
1322,usernam usernam usernam usernam martin tin tin garrix face stuck tongu wink eye
1323,usernam usernam usernam usernam usernam usernam usernam usernam usernam usernam usernam usernam usernam usernam usernam ye tierra whack playlist
1324,usernam que musica que disco que banda purpl heart usernam usernam pictur
1325,good usernam post discuss differ usernam usernam get readi begin trial appl music spotifi trial end usernam good point httpaddr
1326,usernam usernam dale mi amor promocionar hashtag full flex bicep emoji modifi fitzpatrick type number number kiss mark
1327,would love know old faith singl album pre order usernam usernam yet
1328,sanfilippo doll belong upcom solo hashtag album avail usernam httpaddr pictur
1329,usernam drop tape motion pictur movi camera go check music platform usernam usernam usernam pictur
1330,usernam appreci sibeliu usernam usernam pictur
1331,introduc usernam best week weird wonder mashup sound usernam nice tune httpaddr
1332,usernam usernam vamooosss fire fire fire heavi black heart heavi black heart heavi black heart clap hand sign emoji modifi fitzpatrick type number number clap hand sign emoji modifi fitzpatrick type number number clap hand sign emoji modifi fitzpatrick type number number flex bicep emoji modifi fitzpatrick type number number flex bicep emoji modifi fitzpatrick type number number flex bicep emoji modifi fitzpatrick type number number
1333,usernam usernam sign sun rise x zero width joiner male sign sun face camera nichola shorter pictur
1334,usernam usernam queen read newspap
1335,usernam usernam said appl said
1336,usernam usernam usernam twitter automat pick appl like wtf use either
1337,usernam usernam pictur
1338,usernam usernam tua presenca comov grand number
1339,usernam usernam usernam usernam usernam new album hashtag right stream usernam usernam purchas usernam usernam httpaddr httpaddr
1340,usernam usernam usernam se posebej druzinska narocnina
1341,usernam usernam less tri convers get high know thing like obvious prude worri pornhub happi spread truth love drive motherfuck crazi heavi black heart
1342,usernam usernam usernam hope kim get album drop smh
1343,usernam usernam usernam usernam usernam usernam usernam usernam usernam usernam usernam usernam usernam usernam x face ok gestur emoji modifi fitzpatrick type number zero width joiner femal sign x face ok gestur emoji modifi fitzpatrick type number zero width joiner femal sign x face ok gestur emoji modifi fitzpatrick type number zero width joiner femal sign x
1344,music disappear usernam
1345,forget follow playlist accompani upcom book usernam usernam playlist reveal number number song anoth ad tonight hashtag hashtag hashtag hashtag hashtag hashtag hashtag hashtag hashtag hashtag pictur
1346,usernam usernam doc brown singl httpaddr usernam come number number number digit stream platform face scream fear usernam usernam spotifi deezer hashtag hashtag hashtag hashtag httpaddr
1347,usernam usernam te amo
1348,usernam usernam l b l k usernam hashtag feat come soon platform usernam spotifi amazon httpaddr
