,tweet
553,usernam usernam usernam deep hous fan pleas check singl person fold hand emoji modifi fitzpatrick type number person fold hand emoji modifi fitzpatrick type number httpaddr pictur
554,usernam usernam usernam te amo martin garrix usernam
555,usernam usernam usernam devo ancora trovar le parol per esprimer tutto quello che mi fai provar loudli cri face smile face heart shape eye questo momento ho solo lacrim di gioia grazi per questo splendido regalo e grazi per esser rimasta hashtag di number anni fa heavi black heart
556,usernam usernam usernam usernam usernam usernam hashtag pictur
557,usernam usernam studio night avail stream platform polic car revolv light polic car revolv light usernam spotifi usernam usernam soundcloud usernam etc comment think ep think face httpaddr
558,nao acredito que som usernam fica mudo na hora da gravacao de tela face palm emoji modifi fitzpatrick type number number zero width joiner male sign
559,applemus playlist abysm
560,usernam play crush album
561,usernam usernam usernam httpaddr
562,usernam httpaddr
563,usernam usernam usernam httpaddr hai fatto un regalo stupendo grazi buon compleanno sandrina heavi black heart hashtag
564,la stessa e il nuovo brano di alessandra amoroso puoi scaricarlo da usernam e ascoltarlo su usernam cliccando qui black rightward arrow httpaddr hashtag pictur
565,usernam usernam e da insensatez bolivariana
566,usernam usernam queen post
567,get rest aaliyah discographi usernam orrrrrrr face roll eye
568,usernam new song kiss like miss come august number follow us spotifi usernam hear second releas link bio camera flash harrytheeditor httpaddr
569,usernam numberso cute face tear joy heart arrow
570,thank usernam jazz includ usernam start corner playlist httpaddr prototyp httpaddr pictur
571,usernam usernam usernam usernam battl begin
572,usernam everi time press song want anoth song play press like number time row anoth song play worth spend money everi month
573,usernam usernam excel tast perform face throw kiss thumb sign
574,usernam usernam usernam shrug emoji modifi fitzpatrick type number zero width joiner femal sign person rais hand celebr emoji modifi fitzpatrick type number
575,usernam less give studio microphon studio microphon studio microphon studio microphon one favorit song new album run evolut milki way snippet store link bio clapper board album avail usernam usernam httpaddr
576,usernam usernam usernam usernam usernam usernam ere uno de mi artista favorito del mundo
577,spotifi student discount come hulu premium usernam weak hundr point symbol httpaddr
578,usernam usernam usernam come si fa non amarti quando sei sempr hashtag face throw kiss face throw kiss face throw kiss heavi black heart heavi black heart heavi black heart ps tutto cio non ci dimentichiamo del tuo compleanno quindi tantissimi auguri sandrina non potevi fare un regalo miglior sia per te che per noi grazieeeeeee hashtag hashtag
579,littl brother record album avail usernam usernam usernam sign horn emoji modifi fitzpatrick type number number give listen give follow trust regret x heavi black heart hashtag httpaddr
580,usernam usernam usernam usernam usernam usernam usernam usernam smell twitter giveaway sign horn emoji modifi fitzpatrick type number
581,usernam usernam usernam high score repeat day
582,usernam usernam te amo
583,usernam usernam voce e mito mestr
584,usernam wait usernam go tarnish brand meet devil reallyv
585,usernam usernam usernam hey want apolog mean whenev plu stop express love john number number ima getem talk yo momma
586,omg listen usernam us usernam chang life wordshak amaz album thank usernam pictur
587,usernam usernam usernam ym number number dash symbol dash symbol kill nois
588,usernam _carlosrivera httpaddr
589,usernam usernam usernam nwa babi repeat song jam fam lit fire fire fire af nice one bro thumb sign
590,usernam usernam usernam want date new track playlist snapshot follow us hashtag follow link httpaddr microphon green appl man danc hashtag hashtag hashtag usernam usernam usernam usernam usernam usernam usernam pictur
591,usernam usernam blow usernam usernam hashtag httpaddr
592,usernam usernam usernam usernam usernam usernam pictur
593,usernam usernam also httpaddr contract
594,hey know listen music usernam need everyon care follow usernam httpaddr pictur
595,llego el sabado gozar dancer emoji modifi fitzpatrick type number number man danc emoji modifi fitzpatrick type number multipl music note busca nuestra musica en tu plataforma digit favorita usernam usernam usernam usernam usernam usernam pictur
596,usernam gonna put lyric usernam ii start prep tour
597,usernam usernam usernam usernam brows tab lost caus issu bought itun yesterday play appl music without click listen itun
598,usernam escucha bien esta cancion ti te la estoy dedicando hashtag ya esta dispon en usernam _carlosrivera httpaddr pictur
599,falsifi number usernam usernam caus number billion stream ticket sale ad httpaddr
600,usernam usernam check latest releas hashtag hashtag avail hashtag hashtag usernam usernam usernam usernam usernam googleplaymus etc httpaddr
601,usernam usernam usernam yeah wtf
602,usernam usernam httpaddr
603,ya escucharon la nueva cancion del gran usernam ya casi te olvido dispon en usernam usernam clap hand sign emoji modifi fitzpatrick type number number clap hand sign emoji modifi fitzpatrick type number number clap hand sign emoji modifi fitzpatrick type number number clap hand sign emoji modifi fitzpatrick type number number grand maestro pictur
604,usernam therapi session avail want sue
605,usernam usernam usernam hashtag usernam get_repost katakana middl dot katakana middl dot katakana middl dot hashtag polic car revolv light polic car revolv light polic car revolv light polic car revolv light hashtag usernam usernam produc usernam direct usernam usernam httpaddr
606,usernam usernam te amooo
607,usernam usernam usernam usernam usernam usernam dond puedo conseguir el vinyl
608,anyway exit avail tuesday number number httpaddr well usernam usernam usernam usernam usernam usernam usernam plu hashtag hashtag hashtag hashtag pictur
609,usernam usernam deserv
610,usernam usernam usernam last album
611,usernam usernam httpaddr c
612,usernam usernam usernam mad
613,usernam usernam seem like huge departur sound catchi sure need listen
614,usernam usernam usernam hey love genr music edm need listen
615,usernam usernam gracia ya llego por aca pictur
616,usernam usernam queen crown
617,usernam wish usernam told alreadi ad song specif playlist
618,usernam usernam usernam fire
619,usernam fool gold numberletterznuk usernam listen httpaddr pictur
620,usernam usernam usernam usernam usernam love goe like classic minaj shit
621,usernam usernam bellissima heavi black heart heavi black heart heavi black heart tantissimi auguriiii birthday cake x birthday cake usernam face throw kiss face throw kiss face throw kiss
622,usernam usernam pictur
623,usernam usernam finish watch like number second ago beauti inspir thank share stori heavi black heart x yellow heart green heart blue heart purpl heart
624,usernam usernam usernam ladi gaga gonna piss usernam
625,usernam usernam usernam usernam usernam usernam vampir time music old vibe everyth new smile face sunglass
626,number number year use noth usernam decid jump ship usernam go hashtag appl ish usernam could stop bother rather censor playlist oh well break shit black cavier usernam pictur
627,usernam usernam lmao one meal relax
628,neither pay artist usernam usernam httpaddr
629,usernam recent upgrad ee get appl januari number howev receiv text ee state appl finish howev account ee still state number januari refer tri alter set
630,usernam usernam hashtag know heavi black heart
631,weekend jam httpaddr usernam might make danc warn heavi black heart heavi black heart heavi black heart heavi black heart httpaddr
632,usernam usernam disappoint okay usernam
633,follow appl music fresh music show date bt photo trumpet red appl httpaddr hashtag hashtag hashtag hashtag usernam usernam usernam usernam usernam pictur
634,usernam usernam usernam new album let shook
635,usernam _carlosrivera hay lugar dond la escuch la vi smile face heart shape eye smile face heart shape eye smile face heart shape eye smile face heart shape eye
636,usernam usernam explan need pictur
637,usernam usernam great press coverag
638,usernam usernam usernam ja genau gehort zu einer diskus dazu also bei mir irgendwi schon dfind den song um einig besser al ca va thumb sign der hat mehr pepp drinn bin gespannt auf nachher wegen dem musikvideo
639,usernam usernam usernam usernam usernam usernam usernam basarilarinin devamini dilerim ok hand sign ok hand sign ok hand sign pictur
640,usernam usernam japan goodnight time v v g modifi letter small modifi letter small modifi letter small ni modifi letter small g h modifi letter small stress outlin white star
641,new wave avail appl music water wave water wave water wave water wave water wave usernam pictur
642,usernam usernam usernam usernam hashtag music video youtub usernam channel singl avail purchas usernam usernam usernam stream servic hashtag hashtag hashtag hashtag httpaddr
643,hashtag usernam becom number femal album reach number usernam anti usernam ctrl usernam iop usernam pictur
644,usernam usernam usernam usernam love us usernam tri tortur welcom
645,usernam usernam polic car revolv light new album alert polic car revolv light tommi ghost seanstrangenumb usernam spotifi usernam usernam digit platform video first singl httpaddr
646,usernam usernam ya te extrano lali que hago ahora
647,tou surpreso como playlist usernam sao boa
648,usernam hashtag usernam usernam pictur
649,usernam usernam usernam usernam usernam usernam usernam usernam usernam ye nina loyal pop bop
650,listen usernam music inspir select track playlist usernam white right point backhand index httpaddr pictur
651,usernam usernam graca deu que vc exist e que ele te conserv entr no por muito mai tempo com seu talento e saud
652,usernam usernam usernam somo do desd ayer que paro de escucharlo
653,usernam usernam usernam usernam usernam usernam usernam usernam usernam jump babi pictur
654,usernam usernam usernam usernam tweeti bacc
655,usernam usernam usernam buon compleanno birthday cake ciao wave hand sign face throw kiss face throw kiss face throw kiss face throw kiss
656,usernam catch week music news usernam announc new partnership usernam usernam come music modern act via usernam httpaddr
657,usernam usernam httpaddr
658,usernam usernam usernam usernam usernam usernam usernam usernam
659,hey ya pueden escuchar hashtag en usernam httpaddr
660,judg moral music crescent moon new moon symbol hashtag via usernam stream download project edg half moon usernam usernam httpaddr pictur
661,usernam usernam usernam make sens
662,usernam httpaddr
663,usernam usernam usernam amoreeee e stupenda heavi black heart heavi black heart heavi black heart nessuno ha dimenticato che oggi e una data important auguriiii amoreeeeee hashtag umilta fatta persona face throw kiss face throw kiss face throw kiss face throw kiss heavi black heart heavi black heart heavi black heart heavi black heart
664,usernam usernam pour drank headshot drank x smile face horn hashtag avail digit platform download stream youngblizz_dc usernam usernam spotifi usernam usernam googleplaymus httpaddr
665,usernam usernam usernam usernam saludo al mejor dj x desd bolivia
666,usernam spent morn cri usernam watch beat heart best hear pray live last month minnesota one favorit moment ever
667,hashtag leav avail itun httpaddr hashtag hashtag hashtag hashtag hashtag hashtag hashtag hashtag hashtag hashtag hashtag hashtag hashtag hashtag hashtag hashtag usernam
668,usernam usernam usernam tanti auguri di buon compleanno anch se il regalo ce lo hai fatto tu parti popper parti popper ti lasciamo il tempo di festeggiar poi ti aspettiamo che non vediamo l ora di iniziar questo nuovo capitolo insiem te heavi black heart hashtag
669,usernam usernam congratul confetti ball confetti ball bottl pop cork clink glass bottl pop cork glow star usernam offici releas hashtag hashtag usernam usernam pleas support purchas copi today hashtag hit link clink glass bottl pop cork bottl pop cork clap hand sign emoji modifi fitzpatrick type number clap hand sign emoji modifi fitzpatrick type number httpaddr
670,quando hai creduto qualcuno e sei stato deluso ferito ammor ca nun vale nient buon ascolto disponibil su usernam usernam usernam httpaddr hashtag
671,usernam usernam realli enjoy read find conclus made auction
672,oh gosh best mistak ad break pop usernam crazi httpaddr
673,legend music score origin instrument multipl music note download gt usernam headphon httpaddr speaker three sound wave hashtag clapper board
674,usernam tune usernam usernam radio httpaddr usernam bust silhouett httpaddr headphon httpaddr usernam hashtag hashtag hashtag hashtag around hashtag hashtag hashtag hashtag hashtag pictur
675,usernam usernam usernam usernam usernam usernam usernam usernam gremlin whack
676,usernam usernam soooo pre order queen came today excit listen let listen chun li bed rich sex
677,region indic symbol letter h region indic symbol letter perform live usernam hashtag aug number number hashtag get hashtag hashtag hashtag hashtag usernam usernam usernam usernam usernam usernam usernam usernam tune august number usernam hashtag usernam pictur
678,usernam usernam usernam sempr hashtag di number anni fa orgoglioso di te di noi e del tuo percorso tanti auguri blue heart blue heart
679,usernam usernam usernam usernam best dj world favorit dj numberev smile face heart shape eye smile face heart shape eye heavi black heart
680,usernam usernam find say hashtag fraud hashtag cheap remak hashtag queen bee usernam song went hard wish whole album hard song like hashtag felt like filler httpaddr
681,usernam usernam usernam love
682,usernam usernam usernam nicki bodi album real rap back flex bicep emoji modifi fitzpatrick type number crown fire fire fire fire fire ok hand sign emoji modifi fitzpatrick type number rais fist emoji modifi fitzpatrick type number x emoji modifi fitzpatrick type number hug face tire face
683,usernam usernam jesli nie byli wczesniej w trakci kupion tylko sciagniet w ramach uslugi nie jest wiel ugrania
684,usernam usernam usernam noob
685,usernam usernam pictur
686,usernam usernam usernam bentornata amor grand heavi black heart fire hashtag
687,usernam usernam usernam nicki minaj sampl tupac
688,usernam usernam velhic nada gil voce ainda e um garoto
689,usernam wtf happen shit disappear
690,new ep halfway home great time make ep stream usernam usernam usernam usernam usernam usernam hashtag hashtag hashtag hashtag pictur
691,usernam usernam nicki minaj joke irrit
692,wonder find hashtag hashtag rington hashtag usernam pictur
693,usernam consigu hashtag de hashtag ft hashtag en usernam httpaddr usernam usernam
694,usernam usernam pictur
695,hashtag usernam httpaddr
696,usernam usernam aaaaaaa seria meu sonho
697,la gozadera nunca para cuando sigu usernam en usernam hazlo disfruta su sencillo hashtag httpaddr pictur
698,usernam usernam usernam httpaddr video get numberk view channel get number number sub someth realli realli special
699,usernam speaker cancel stroke speaker l x v l number u n w usernam httpaddr
700,usernam usernam yess deserv much knew song would blow song get recognit deserv fire fire proud
701,usernam go hashtag hashtag new singl silver gold usernam featur hashtag song hashtag world fire fire fire fire hashtag hashtag hashtag usernam usernam spotifi httpaddr
702,usernam usernam usernam usernam usernam usernam usernam usernam zakk wtf
703,jimmi iovin record exec produc work artist rang eminem bruce springsteen think face appl got someth say usernam
704,usernam usernam queen spoken hashtag hashtagin hashtag usernam white medium star white medium star white medium star white medium star white medium star usernam hashtag usernam get_repost katakana middl dot katakana middl dot katakana middl dot love new york new york httpaddr
705,usernam usernam usernam usernam usernam would cool see song playlist actual sort remind gcb well httpaddr
706,usernam usernam discazo
707,usernam abl chromecast weari face
708,music librari got vanish switch countri appl id suggest mani opt appl music think wrong thank usernam usernam usernam
709,numbercreenstudio usernam usernam usernam usernam usernam usernam usernam usernam usernam vaalll tamil sign virama tamil sign virama tuk tamil sign virama kll tamil sign virama
710,usernam usernam use deezer durant ano estaba muy contento cambi por la promesa del contenido exclusivo pero la verdad ha decepcionado voy coger la prueba de spotifi que usado nunca el premium decido si vuelvo deezer
711,usernam usernam sin dillan grey avail buy stream usernam usernam usernam usernam usernam well httpaddr
712,got usernam could stream hashtag usernam hug face
713,except twitter alway pay entertain usernam red amazonprimenow applemus access without get flood unnecessari ad relief worth money cabl home bad pay httpaddr
714,usernam usernam thank love film incred like
715,usernam usernam love queen sparkl heart rainbow sparkl
716,usernam usernam usernam httpaddr hashtag
717,usernam usernam big mahalo friend usernam featur recent singl catch vibe playlist usernam stoke includ sick artist httpaddr
718,usernam usernam usernam l unica che fa il regalo alla sua bigfamili il giorno del suo compleanno quando dovremmo esser noi farglielo birthday cake usernam sei unica two heart nu ccangiar mai hashtag hashtag e comunqu auguri amor mio number te sta ffaci vecchia
719,usernam usernam usernam usernam follow fan nicki minaj
720,hey guy updat behind board moor sound playlist usernam jerh ft usernam abu dhabi ft usernam usernam usernam usernam httpaddr pictur
721,number month usernam librari gone usernam realli old fashion softwar cri face
722,usernam usernam remov download stream count
723,anyon els experienc usernam act past week hope updat would fix luck hashtag
724,usernam flexinfab feat usernam outta mind gutter boy stream usernam spotifi dalla texa httpaddr
725,usernam usernam need get butt one show asap
726,usernam usernam usernam usernam u ibiza
727,usernam usernam usernam look handsom smile face heart shape eye
728,number number number orf prod usernam stream platform preorder usernam hashtag hashtag hashtag hashtag hashtag pictur
729,yo usernam put j cole person playlist imma snap gonna realiz absolut trash
730,take strategi shame usernam usernam
731,usernam usernam im proud
732,usernam usernam usernam ben tornata queen una bombaaa heavi black heart smile face heart shape eye smile face heart shape eye bomb ah tanti auguri sandrina parti popper confetti ball face throw kiss face throw kiss
733,usernam usernam omg ye deserv
734,usernam usernam usernam su play music
735,usernam neverrrrr innnnn myyyyi baggg avail everywher black heart eye usernam link bio singl whippin n winnin artist usernam kid qwest written usernam kid httpaddr
736,usernam prometieron usernam grati es verdad ya la puedo usar unamus face unamus face unamus face
737,usernam usernam usernam get front page placement album releas
738,usernam work kind thing listen speak friction usernam rock workout playlist httpaddr
739,usernam usernam usernam usernam usernam wow
740,usernam mzekezek song get usernam hashtag hashtag hashtag
741,usernam usernam realli got cryin club
742,usernam usernam usernam usernam usernam usernam usernam usernam lol still sober zakk face tear joy
743,usernam thank
744,go usernam store make purchas love usernam purpl heart hashtag hashtag usernam pictur
745,usernam nao obrigada
746,usernam usernam number soni discman skip less appl music phone fix pleas
747,petit usernam add product credit wanna see produc mix master song
748,usernam usernam usernam hello martin face tear joy face tear joy face tear joy
749,hey usernam tri aaliyah shit fuck banger import part earli number better
750,usernam usernam usernam usernam usernam usernam usernam usernam buy one
751,usernam usernam usernam usernam either amazon iheart
752,usernam usernam usernam love u
753,usernam usernam stop tune new ep saiyan god avail usernam music platform earth globe america fire httpaddr
754,usernam usernam usernam gag
755,usernam fuck ass custom support repres fuck guy custom support number day number hour overal still singl fuck clue make itun recogn usb port new phone fuck
756,usernam usernam usernam usernam usernam usernam usernam usernam long island guess paramount
757,usernam usernam interest get inform work
758,usernam usernam usernam usernam usernam usernam usernam usernam usernam usernam better advantag us bc live state smaller popul california new york california get least number tour date get number number realli agre way pick tour date anoth way
759,usernam usernam work caus mine work
760,usernam usernam usernam heart arrow
761,usernam usernam download disappear iphon still show mac go get everyth back phone
762,usernam usernam
763,usernam usernam usernam usernam usernam usernam listen pepper soup ep fred mason prod usernam also ft usernam httpaddr applemus usernam usernam usernam usernam usernam hashtag hashtag hashtag hashtag hashtag hashtag
764,listen world feat choklat phont zo usernam httpaddr
765,alway listen usernam number hr work straight end day number batteri life instal new updat go noon complet dead charg phone usernam
766,love usernam took curs feel explicit version ass
767,get know artist perform resist ibiza week number offici usernam playlist listen httpaddr pictur
768,usernam usernam bruh slime em like dat nudi
769,usernam usernam dope ok hand sign
770,usernam usernam usernam prettiest littl bodi
771,go act like usernam funni stuff listen usernam koli p pay moneysymbnumb car trapper took away consid numberweek notic
772,kunstler der deutschen grammophon kuratieren fur appl music httpaddr usernam usernam usernam usernam hashtag hashtag
773,listen classic light feat usernam usernam usernam httpaddr
774,usernam usernam ale dlaczego zrezygnow ja mam od number lat daje rade
775,usernam usernam usernam graciass linda grow heart grow heart
776,usernam yeni albumu hashtag ile usernam zirvedekil turkc rap listesind hashtag httpaddr
777,usernam download usernam new album hashtag die drive rock classic amaz must dl
778,like usernam even know anymor pictur
779,develop app connect music system public place control playlist patron bid play choic music opportun immens sale applemus usernam usernam usernam usernam usernam usernam usernam
780,usernam hey follow usernam playlist good tune wink face httpaddr pictur
781,quan ran guan xi nairen tachinoqu gatong zinisareterunozhi shiteagetekudasai face tear joy usernam usernam pictur
782,usernam usernam omgomg
783,usernam usernam imma tri uwm fufu shit hope email still activ
784,okay cri hyster watch usernam beauti soul grow heart album alreadi help much film cherri top blue heart green heart yellow heart x heavi black heart purpl heart heavi black heart x yellow heart green heart blue heart hashtag hashtag usernam pictur
785,usernam usernam gil eu te amo
786,morn search jaden smith song icon usernam iphon even get video recommend usernam data transfer appl googl g board data sucker everyth non googl iphon pictur
787,usernam yeah could stop make song librari year suddenli unavail without notic caus know want buy album alreadi get back one song
788,usernam usernam usernam new music skeeterlaflar signedbythestreet ep ft deagl nonbruh casperr project stream via usernam major stream platform includ usernam usernam number number stream purchas link httpaddr
789,usernam numbersweetlex _chrisexcess meme screenshot netflix mean meme finit resourc
790,usernam usernam usernam wassup boi
791,usernam usernam usernam usernam usernam usernam flush face
792,usernam usernam video come soon right
793,usernam usernam happen pictur
794,listen tap avail usernam httpaddr
795,usernam usernam usernam tanti auguri per il tuo nuovo singolo e per il tuo compleanno face throw kiss face throw kiss birthday cake parti popper parti popper confetti ball
796,usernam usernam usernam usernam yaassss
797,usernam usernam przerzucilem sie na usernam jest wiel lepiej
798,usernam usernam brandon caskey j gutta number
799,usernam usernam bet wont follow tho ive wait year follow pictur
800,usernam number song top number usernam genr proud realli hashtag hashtag
801,usernam usernam usernam usernam differ countri thing total differ spotifi everyon pay rt pictur
802,give away number vip weekend ticket usernam usernam subscript soon get phone readi mobil phone mobil phone mobil phone listen white right point backhand index httpaddr
803,usernam usernam usernam usernam usernam nice song guy
804,usernam usernam usernam usernam usernam hard one bro choos im real best houston album long time classic statu
805,usernam usernam hashtag optic disc fire still digit platform yu tap alreadi yu late usernam usernam link bio victori hand emoji modifi fitzpatrick type number white smile face eat hashtag httpaddr
806,time usernam get guest list playlist usernam
807,usernam usernam usernam usernam usernam usernam usernam usernam tommarow
808,new music new video new merch come way soon check new album back squar one usernam usernam camera flash lui alarcon hashtag hashtag hashtag hashtag pictur
809,usernam wait music usernam except usernam music go hit usernam first
810,usernam numberso plz stap
811,appl music icin boyl bir playlist hazirlamistim karisik kaset tadinda gundemden daralanlara gelsin iyi haftasonlari usernam httpaddr
812,usernam usernam usernam usernam usernam usernam bank use
813,usernam usernam pleas follow follow back region indic symbol letter c region indic symbol letter fan
814,usernam usernam usernam peep smile face open mouth cold sweat smile face open mouth cold sweat face tear joy pictur
815,psa stream hashtag usernam
816,stream usernam usernam usernam usernam hashtag playlist httpaddr
