,tweet
0,ja genau gibt ab sofort bei usernam usernam fire rocket httpaddr
1,usernam ok hand sign
2,la stessa e il nuovo brano di alessandra usernam puoi scaricarlo da usernam e ascoltarlo su usernam cliccando qui black rightward arrow httpaddr hashtag
3,usernam usernam loudli cri face loudli cri face loudli cri face loudli cri face
4,thank much usernam ad song pop list mean earth globe america usernam httpaddr pictur
5,usernam usernam usernam hell yea awesom
6,usernam usernam usernam usernam hashtag fuck usernam sir need someth httpaddr
7,usernam numberso hey gonna put case someon sad smile uwur pictur
8,usernam usernam usernam diciamo che domani dovrei alzarmi all sei e mezza sono ancora qui ad ascoltar hashtaghashtag face tear joy face tear joy
9,usernam usernam vai para venezuela
10,usernam usernam love love song two heart two heart two heart two heart
11,usernam usernam usernam wig gone pleas help find
12,usernam usernam cuut
13,usernam proud sparkl heart usernam pictur
14,usernam usernam usernam usernam usernam usernam yawn
15,usernam franchement vou ete le meilleur vou avez mi la mixtap agust mai vou avez pa mi la chanson clap hand sign
16,usernam usernam aguant spotifyyyy lali
17,know also usernam httpaddr
18,usernam equal shuffl play person fold hand emoji modifi fitzpatrick type number number person fold hand emoji modifi fitzpatrick type number number
19,thought improv usernam new music mix algorithm util machin learn identifi genr music term comput understand deal way recommend music cross genr artist happen name
20,usernam usernam usernam httpaddr
21,love record great job guy enter swedish appl music chart usernam usernam usernam usernam usernam usernam usernam usernam httpaddr
22,usernam usernam usernam usernam usernam fuck love much better melvin rabbit reveng hard clean master
23,properli discuss album come back q give stuff away documentari come usernam usernam
24,usernam usernam usernam detroit come support usernam debut perform singl hashtag flex bicep emoji modifi fitzpatrick type number flex bicep emoji modifi fitzpatrick type number avail usernam flex bicep emoji modifi fitzpatrick type number flex bicep emoji modifi fitzpatrick type number event brought usernam pictur
25,snooz lose find supertramp brother bound usernam anymor hashtag usernam hashtag pictur
26,usernam usernam neg squar latin capit letter p squar exclam mark usernam usernam batteri batteri batteri batteri listen tell us favorit track radio dvd control knob batteri batteri batteri batteri hashtag hashtag hashtag hashtag hashtag hashtag hashtag hashtag httpaddr
27,usernam ey got iphon never use appl music keep charg psnumber month
28,combin enclos keycap combin enclos keycap combin enclos keycap combin enclos keycap e combin enclos keycap combin enclos keycap combin enclos keycap r combin enclos keycap e combin enclos keycap l combin enclos keycap l combin enclos keycap combin enclos keycap c combin enclos keycap combin enclos keycap r combin enclos keycap combin enclos keycap e combin enclos keycap z combin enclos keycap l combin enclos keycap combin enclos keycap z combin enclos keycap combin enclos keycap love everi time usernam mother among thing usernam hashtag pictur
29,usernam usernam usernam bentornata sandrina smile face heart shape eye grazi x questo meraviglioso regalo avremmo dovuto farlo te ed invec lo hai fatto tu noi person fold hand il brano e il video sono stupendi danno una sensazion di freschezza leggerezza semplicita e purezza smile face heart shape eye ci sei tanto mancata grow heart hashtag
30,usernam usernam got email yesterday nicki album readi download click link song still show phone preorder album back juli alreadi paid show two song phone pictur
31,upcom appl music number month subscript free w verizon unlimit httpaddr hashtag hashtag usernam usernam hashtag
32,usernam still steal peopl music unsubscrib
33,usernam usernam gran debut lali fire fire clap hand sign clap hand sign tan feliz por vo revolv heart hashtag la rompeee pictur
34,usernam usernam usernam grazieee heavi black heart heavi black heart
35,usernam usernam usernam una bomba sono orgogliosa di te heart arrow pictur
36,httpaddr big up usernam person fold hand emoji modifi fitzpatrick type number black heart
37,usernam usernam never heard cb featur go buy song itun
38,usernam nah chief
39,usernam usernam usernam usernam hit vem
40,usernam usernam bless smile face heart shape eye got everi singl item shop hundr point symbol ok hand sign hashtag hashtag usernam usernam pictur
41,usernam usernam usernam buon compleanno tesoro heavi black heart questa volta ci hai fatto tu un regalo noi e che regalo stupendo finalment sei tornata sempr hashtag revolv heart revolv heart semplicement grazi grow heart
42,usernam usernam ight appl boi ask question
43,usernam usernam usernam yeah everyon say
44,usernam usernam imma let yall speak head silhouett releas awesom pilot episod motion graphic novel check let us know think httpaddr
45,usernam nah
46,usernam usernam realli like good nut
47,usernam bozoma saint john usernam domin stage year like forc natur pair fierc stiletto join usernam hashtag former usernam exec httpaddr hashtag hashtag pictur
48,usernam usernam usernam tanti auguri te e tanti auguri anch non potevo ricever regalo miglior grazi heavi black heart pictur
49,usernam usernam think either window fault issu display sinc coupl month sure tri reinstal itun appl music itun mac idevic work issu quit like usernam usernam
50,usernam tryna figur charg card moneysymbnumb last month like three time x
51,pretti impress screen saver ask hahabut serious look forward next saturday perform usernam usernam store usernam start numberpm sharp see music note hashtag hashtag hashtag hashtag hashtag hashtag hashtag usernam pictur
52,usernam usernam pictur
53,usernam usernam usernam coolhashtag
54,usernam usernam usernam usernam spotifi
55,usernam usernam usernam never understand societi call music
56,usernam usernam que velhic
57,usernam numberso love u guy sm
58,usernam usernam stream queen httpaddr
59,usernam usernam ya lo compro
60,usernam usernam usernam queen fire fire fire pictur
61,appl music got fuck usernam let download album yup told usernam
62,usernam usernam stop listen listen count hashtag hashtag hashtag hashtag hashtag
63,usernam usernam usernam get physic copi caus first week sale
64,usernam usernam usernam usernam talk rumor brazil need know prepar
65,usernam sound much better usernam set usernam miss qualiti badd
66,usernam usernam usernam usernam usernam thank support two singl apart cool love two heart check avail stream platform usernam usernam usernam usernam usernam usernam hashtag hashtag hashtag hashtag pictur
67,usernam birthday song produc usernam hashtag hashtag hashtag usernam hashtag hashtag hashtag hashtag shot usernam hashtag hashtag httpaddr
68,usernam usernam usernam lindoooooooo heavi black heart heavi black heart heavi black heart heavi black heart heavi black heart heavi black heart heavi black heart heavi black heart heavi black heart
69,usernam usernam usernam usernam okay caus log googl play music listen
70,blakavelli avail usernam usernam httpaddr
71,usernam usernam usernam alreadi sharpli time
72,usernam usernam usernam lord work usernam
73,usernam usernam hashtag pictur
74,usernam usernam usernam break skeeterlaflar signedbythestreet ep ft deagl nonbruh casperr project stream via usernam major stream platform includ usernam usernam number number stream purchas link httpaddr
75,usernam usernam usernam mediocr album
76,usernam usernam time tea break thing multipl music note glow star multipl music note httpaddr courtesi usernam smile face sunglass
77,yess usernam applemus woke song brainhashtag hashtag hashtag fire fire fire fire httpaddr
78,usernam usernam usernam usernam usernam go without internet access number aug still realli excit hope download number
79,usernam usernam usernam awesom smile face heart shape eye smile face heart shape eye
80,usernam usernam usernam usernam coloss
81,usernam usernam usernam usernam usernam glad
82,usernam usernam queen wbk
83,usernam usernam mi sobrina de number ano para de bailar gracia por hacerla entreten con est dia face tear joy cloud lightn hashtag
84,usernam usernam love new version purpl heart purpl heart love u
85,purpl heart purpl heart kiss mark fire fire fire fire hashtag hashtag hashtag usernam usernam hashtag hashtag usernam httpaddr
86,usernam usernam usernam omfg lovin smile face heart shape eye wait long final album remeb forev crown fire heavi black heart person fold hand emoji modifi fitzpatrick type number gem stone love itali onika region indic symbol letter region indic symbol letter hashtag
87,usernam usernam avail countri n imma scream
88,usernam usernam usernam hashtag usernam get_repost katakana middl dot katakana middl dot katakana middl dot hashtag hashtag usernam dellyranxmus hashtag hashtag usernam hashtag hashtag hashtag speaker three sound wave speaker three sound wave speaker three sound wave hashtag httpaddr
89,usernam usernam usernam il piu bel regalo che potessi fare tu noi grazi smile face heart shape eye e tanti auguriii parti popper parti popper
90,top number crack usernam sit hashtag usernam canada metal song chart releas day check debut singl cast away exclus usernam weekend httpaddr appl canada inc pictur
91,ye socialist media nazi ie usernam usernam usernam usernam usernam need regul media outlet must held sane standard master baiter media right dictat first amend usernam usernam usernam httpaddr
92,mi musica jama habia estado tan ordenada en perfecto orden desd que cambi usernam soy tan feliz smile face smile eye balloon
93,usernam usernam httpaddr
94,usernam usernam usernam e tornata siamo tornati non vedo l ora di viver tutto quanto l amor che solo tu trasmetti sono felicissimissima ale mia mi esplod il cuor buon compleanno tesoro mio black heart suit black heart suit
95,usernam dramat sort switch spotifi
96,usernam _chrisexcess usernam good thing save meme sinc number serious first thing thought screen shot even make meme lol
97,usernam way pick witch way sort song think face
98,hashtag told us one thing usernam usernam pictur
99,usernam usernam usernam usernam yei
100,usernam bring back old itun
101,kobe kd kyri pick k usernam hashtag hashtag hashtag usernam usernam
102,usernam usernam usernam queen top number saudi arabia region indic symbol letter region indic symbol letter purpl heart
103,usernam usernam usernam usernam usernam awesom
104,listen usernam usernam usernam gotta love usernam interview celebr pictur
105,usernam usernam gonna spam day long spotifi promo better rapper ya label shit uh pay shittttttttt fuckin industri weari face unfortun
106,number number applemus usernam usernam usernam usernam usernam hashtag hashtag hashtag hashtag hashtag hashtag usernam usernam usernam usernam pictur
107,usernam usernam usernam thank
108,usernam usernam usernam congrat guy
109,usernam hey everyon
110,telephon receiv ring ring telephon receiv usernam phone usernam total access last night cover lot athlet shoe get trainer dirti festiv multipl music note would like collab red appl usernam next artist speaker httpaddr pictur
111,wrong usernam play album hashtag play rich sex chun li fix wanna listen whole album
112,usernam pleas add room improv comeback season usernam person fold hand person fold hand need life hashtag
113,lead usernam piano chill playlist glass mishima number saint sebastian play maki namekawa httpaddr
114,usernam usernam usernam dope fire fire fire fire
115,usernam usernam usernam httpaddr
116,usernam usernam toda la cancion gustan la two heart
117,usernam numberso love listen day liter art like vocal calum smile littl fucker ashton sweat drumbeat michael look like whole buffet wow next level
118,biggest problem usernam enough usernam
119,usernam usernam song good vocal talent angel blindli support anyth frog face
120,heavi black heart usernam pictur
121,usernam usernam usernam fck appl
122,hashtag hashtag usernam usernam like usernam
123,exclus mix usernam play live one mix usernam tune httpaddr usernam pictur
124,usernam usernam queen noth matter
125,usernam thank hashtag hashtag usernam
126,usernam dobra wiadomosc chociaz troch szkoda ze w usernam nie utworow w formaci usernam na dobrym zestawi dac sluchawki slychac roznic miedzi miedzi empeczi wszelkimi lossless mqa z korzyscia dla tego ostatniego
127,usernam usernam usernam u introduc browser numberixnumberin yet know come ur closest ppl u got type
128,usernam usernam usernam usernam usernam usernam usernam bro find shit sound cloud think face
129,usernam hashtag usernam read new offer usernam unlimit custom get six month appl music hashtag httpaddr
130,usernam usernam usernam usernam love
131,usernam usernam yeah thought grand shiiiiit
132,usernam usernam hashtag es un fire headphon top upward arrow clap hand sign clap hand sign clap hand sign
133,usernam usernam thank
134,love wake morn go scroll music find usernam ad latest usernam track phone well play appl sivan well play clap hand sign clap hand sign clap hand sign
135,hashtag usernam pictur
136,usernam usernam usernam usernam usernam love tho someon book guy
137,usernam usernam cant get enough song multipl music note studio microphon heavi black heart
138,usernam usernam alway great hear song dig spur boot
139,usernam usernam usernam pictur
140,usernam what go abl download music usernam album damn good problem hashtag hashtag pictur
141,usernam usernam meantim first singl differ drop octob number art usernam avail platform august number itunesmus usernam spotifi usernam soundcloud httpaddr
142,also listen new usernam song hashtag playlist usernam face stuck tongu wink eye sign horn emoji modifi fitzpatrick type number httpaddr
143,usernam usernam love u
144,usernam usernam usernam yo nicki nicki nicki documentari
145,usernam usernam ja curtindo de prima ja gostei de quatro pedacinho jacintho na real
146,usernam usernam usernam ablum fire fire fire love much truli queen ablum sound like
147,usernam usernam usernam new releas skeeterlaflar signedbythestreet ep ft deagl nonbruh casperr project stream via usernam major stream platform includ usernam usernam number number stream purchas link httpaddr
148,usernam usernam usernam pleas pleas final come way us abl download song mpnumber file email text directli itun pleas hashtag
149,usernam usernam usernam usernam usernam usernam usernam america care war civil n world war econom usernam understand spirit cook dinner usernam arrest till die alcatraz run tim unfollow clinton usernam usernam berniecrat peac victori hand numbertonumbermac usernam
150,usernam let borrow free month membership good
151,usernam usernam usernam love much queenhashtag
152,number usernam usernam hashtag hashtag httpaddr
153,usernam usernam googl play music
154,usernam usernam usernam mestr absoluto number
155,usernam usernam bruh u sponsor
156,usernam usernam stream queen nicki minaj
157,usernam usernam usernam u
158,usernam hashtag usernam usernam usernam usernam usernam usernam pictur
159,pay never offer bullshit usernam usernam pictur
160,yessssssss usernam know httpaddr
161,usernam usernam cute
162,usernam usernam usernam usernam usernam clock music board music httpaddr board
163,usernam naw good pictur
164,usernam httpaddr
165,usernam usernam usernam love heavi black heart queen crown
166,usernam usernam usernam usernam usernam usernam gracia hermano
167,mucho loveo usernam ad latest singl drum bass playlist black heart suit black heart suit black heart suit
168,e um vai tomar cu usernam por nao liberar ptnumber e ptnumber pra brasil tive que baixar bando de galalau de porra
169,usernam usernam usernam lmfaooo mood barbi dream pictur
170,usernam usernam numberchainz naw pictur
171,usernam hashtag heavi black heart tulip usernam usernam pictur
172,dear usernam verifi student statu like number time leav alon
173,usernam usernam usernam still count tho
174,je croi que j ai jamai eu affair un servic client aussi aimabl san ironi merci usernam wave hand sign emoji modifi fitzpatrick type number
175,usernam usernam deserv mom heavi black heart
176,track pulau featur appl music usernam check httpaddr hashtag hashtag hashtag hashtag hashtag hashtag hashtag hashtag hashtag hashtag hashtag hashtag hashtag
177,usernam usernam usernam usernam usernam spare time
178,usernam usernam deserv heavi black heart
179,let play hashtag idk someon help pleas face roll eye weari face turn earlier usernam usernam pictur
180,usernam usernam usernam cool never seen tour right releas live song begin tour promot futur show run thru usernam believ cc usernam
181,usernam usernam muito obrigado gil muito obrigado
182,usernam usernam tremendo disco lala pictur
183,yet usernam delet download becom annoy
184,love listen top countri radio usernam hear usernam proud far becom heavi black heart heavi black heart pictur
185,usernam proud guy happi releas day hashtag keep hustl big thing come way everyon go stream hashtag usernam one fun project chanc work killer album wilt flower httpaddr pictur
186,e meu primeiro disco da minha velhic gilberto gilfic com vontad de mergulhar ainda mai em hashtag entao va em httpaddr e confira disco com stream exclusivo usernam e muito outro materiai que preparamo hashtag pictur
187,usernam main work httpaddr
188,usernam usernam usernam usernam hashtag album hashtag lipstick sexi club vibe wink face smile face heart shape eye face throw kiss black heart suit black heart suit black heart suit katakana middl dot katakana middl dot katakana middl dot sparkl heart sparkl heart sparkl heart go listen hashtag avail usernam usernam spotifi usernam usernam usernam usernam httpaddr
189,usernam august number mark releas date quietu solu stem major stream platform usernam usernam usernam hashtag hashtag hashtag hashtag hashtag hashtag hashtag hashtag hashtag hashtag hashtag hashtag pictur
190,usernam usernam usernam look forward see sunday night greek
191,fire fire fire fire usernam usernam usernam usernam httpaddr
192,usernam usernam omg stop listen live music fantast bring back show seen far hashtag start week sunday three show one week music get excit person rais hand celebr emoji modifi fitzpatrick type number number roll floor laugh roll floor laugh person rais hand celebr emoji modifi fitzpatrick type number number multipl music note music note
193,usernam usernam usernam usernam usernam usernam usernam usernam pleas play graveyard discipl tomorrow starland
194,usernam still confus usernam still usernam lemonad album face roll eye
195,usernam orrrrr listen hashtag usernam
196,birthday boy usernam usernam httpaddr
197,usernam usernam hashtag hashtag hashtag heart ribbon sir heart ribbon good form heart ribbon llc heart ribbon chun swea heart ribbon hard white
198,get weekend start right ihc mixtap ft new jam usernam usernam usernam usernam usernam usernam usernam mani spotifi httpaddr usernam httpaddr pictur
199,listen number hashtag hashtagbal usernam hashtag hashtag hashtag hashtag httpaddr
200,usernam usernam usernam usernam best anoth one face tear joy face tear joy face tear joy brainer lawd stuck head
201,usernam usernam usernam oh frick
202,usernam usernam usernam usernam drop card thing say artist upload media card yet plz fix want listen new stuff
203,usernam usernam usernam usernam usernam glad see back rhett
204,usernam usernam usernam usernam heavi black heart heavi black heart heavi black heart
205,numberfreshl usernam usernam usernam usernam usernam
206,usernam usernam happi obsess super cute rabbit ring usernam wear forest whilst play glow keyboard rainbow film usernam hashtag hashtag
207,usernam usernam usernam usernam oye martin porqu vien mi pai
208,ohhhh ju look spotifi premium usernam finna get boot golfer httpaddr
209,usernam numberso wish never met caus your hard forget heart arrow
210,usernam see latest post httpaddr hashtag wreklisrecord symphonicdist bcmusicev nine_oh_ googl itun spotifi verifi usernam tidal amazon youtub googleplay iheartradio deezer twittersalut httpaddr
211,usernam httpaddr
212,usernam usernam good love u miss u
213,usernam usernam usernam bella bella bella complimenti chiedo solo per interess personal collaborazion zibba smile face halo
214,usernam usernam appl music usa canada mexico track pictur
215,spent number minut look kesha documentari usernam find new page link artist page nada much tri new servic
216,usernam usernam girl long school email still work sync email use often
217,usernam usernam usernam gia scaricato pezzo bomba bentornata ale smile face heart shape eye heavi black heart face throw kiss
218,usernam listen love music noth like perfect group song chang mood bring back memori usernam modern r b station today chang mood httpaddr
219,usernam usernam discazo hija bomb
220,usernam catch fever hashtag avail usernam hashtag hashtag hashtag pictur
221,usernam closer new mixtap hashtag hashtag avail usernam usernam hard copi optic disc bro _itswilloffici hundr point symbol thank love httpaddr
222,mine thing usernam httpaddr
223,realli talk ft jay z usernam anymor feel like tell sleepi face httpaddr
224,usernam usernam usernam anch il mio httpaddr
225,usernam usernam usernam usernam te amo te amo te amo
226,usernam usernam usernam
227,usernam usernam aguant appl music una bien tkm
228,check steve roach deep cut appl music usernam httpaddr
229,usernam miss call avail usernam spotifi pleas take listen share polic car revolv light link bio polic car revolv light httpaddr
230,miss self titl album usernam usernam courtesi sister label usernam listen usernam usernam httpaddr
231,usernam realli need librari httpaddr
232,usernam usernam usernam usernam usernam usernam usernam usernam look back collis symbol avail via usernam usernam usernam usernam usernam collis symbol r c h headphon hashtag heavi check mark hashtag fire fire fire hashtag usernam usernam usernam usernam hashtag hashtag hashtag hashtag
233,usernam usernam tremendooo fire
234,usernam usernam usernam usernam blast work
235,thank usernam ad easi best week number countri support greatli appreci hashtag pictur
236,usernam usernam usernam listen queen radio got queen soon drop smile face heart shape eye smile face heart shape eye ahunnit mf tell nick noth speak head silhouett hand index middl finger cross emoji modifi fitzpatrick type number
237,stream hashtag hashtag usernam httpaddr pictur
238,usernam usernam preorder album usernam one song bad static suppos fix somehow
239,usernam usernam usernam awesom
240,usernam usernam usernam usernam usernam fire fire fire fire
241,usernam type caption irk nicki fan women us men even gay love women empower cancel everyon els suppos talkin equal usernam pleas fix person fold hand pretti pleas pictur
242,usernam numberso pay appl music
243,usernam white point backhand index emoji modifi fitzpatrick type number white point backhand index emoji modifi fitzpatrick type number httpaddr
244,usernam black heart hashtag hashtaghashtag avail platform usernam spotifi usernam still rollin otw headphon httpaddr
245,usernam usernam usernam let act like see hashtag well smirk face crown pictur
246,usernam usernam usernam usernam usernam usernam usernam usernam fantast show fella pictur
247,usernam appl music keep paus listen
248,thank check hypochondria usernam usernam usernam usernam usernam et al hashtag httpaddr
249,usernam team lyric curat excel write skill music knowledg attent detail might need go back work pictur
250,usernam usernam yasssss hero love forev
251,usernam usernam tm get usernam usernam white point index emoji modifi fitzpatrick type number white heavi check mark jackson mississippi httpaddr
252,left airpod patio night rain accid still work fine found float small puddl water say past bluetooth headset kill usernam product servic life
253,enjoy new african music kid usernam sister stream usernam come soon pictur
254,new music suggest usernam album among incred versatil compani usernam usernam usernam usernam listen symphoni number pyotr ilych tchaikovski conduct leonard bernstein face tear joy headphon thumb sign pictur
255,usernam usernam usernam buon compleanno alessandra birthday cake birthday cake wrap present wrap present parti popper parti popper rimani sempr hashtag headphon headphon un fior un raro color headphon headphon sei la miglior auguri face throw kiss face throw kiss
256,usernam phish scam go user get mail like photo may like issu advisori appl user pictur
257,usernam usernam hold hashtag spot usernam album queen barbi dream fire fire smile face heart shape eye pictur
258,usernam usernam hate
259,usernam usernam usernam stavolta il regalo ce lo hai fatto proprio tu auguri amor heavi black heart heavi black heart heavi black heart
260,usernam usernam great see hear appl music classic section get love listen dg playlist work yesterday heard mani great perform warrant explor look forward listen
261,usernam usernam number star gee stunna man envis god bless
262,usernam never buy usernam usernam
263,went numberk juli number number k august numberk month usernam hashtag gettn mill end fall mark word go get latest singl call pictur
264,usernam usernam il ya un myster naturel qui souffl dan l air si tu l ecout prudem tu entendra l air
265,hashtag el hashtag trae queen el cuarto album de estudio de usernam esta increibl fire dispon ya en usernam usernam pictur
266,usernam usernam usernam dib dub
267,spend weekend soundtrack hashtag multipl music note usernam httpaddr pictur
268,usernam usernam hola bombonnnn
269,usernam usernam calient
270,usernam usernam usernam usernam usernam awesom track
271,usernam usernam ansioso para ouvi lo
272,usernam usernam yesss girl
273,say like usernam wya httpaddr
274,usernam usernam libera usernam ess dai e ruim libera melhor
275,usernam usernam usernam usernam temaaaazo
276,usernam usernam usernam happen support toward usernam never ever buy usernam usernam whatsoev usernam product whole life
