,tweet
0,usernam usernam need lol
1,usernam feel sister love kid activ rip number pair week usernam usernam best
2,usernam buy someth onlin return store instead mail back bought bunch work pant big husband moneysymbnumb return confus face
3,usernam usernam pictur
4,usernam usernam usernam usernam usernam usernam usernam usernam go usernam usernam etc shirt alway get color want person like straight white tee without pocket feel look better usernam short post problem internet expect one comment
5,usernam includ breweri work cloth
6,dicki team l fashion mecca usernam httpaddr pictur
7,usernam usernam nice bro
8,chinatown market x usernam pictur
9,philli elev usernam set usernam usernam hold hashtag pictur
10,usernam usernam usernam usernam usernam boy fli
11,usernam usernam avail broe rais fist emoji modifi fitzpatrick type number
12,happi hashtag usernam usernam usernam see hashtag store great giveaway today hashtag peep
13,usernam usernam usernam usernam bie zhu decu li bo ikarapuropa katakana hiragana prolong sound mark dequan shu ba kunonibi si nandeshiyounaa
14,usernam lookout wall
15,usernam usernam lmaoooo
16,nb nigga usernam got want cop usernam suit fresh g fazo face tear joy flex bicep emoji modifi fitzpatrick type number hundr point symbol
17,usernam usernam usernam x usernam full white fog hashtag hashtag httpaddr
18,usernam usernam diggin
19,usernam usernam usernam beard longer hair cut smile face open mouth tightli close eye b number minut face tear joy face tear joy
20,usernam reup coupl new size usernam number flex fit khaki brown black httpaddr
21,usernam women pant long sleev shirt option carri number natur fiber cotton wool linen hemp work hashtag need appropri cloth
22,usernam usernam order yesterday deliv dpd work saturday
23,usernam pictur
24,usernam _omnificent_ usernam usernam flygod keep us fresh fuck fruiti color
25,final thank self blue heart usernam pictur sm megamal
26,usernam usernam usernam usernam yeeeaaassss
27,lol sk er wear white sweater cleanest usernam ever seen
28,think excit thing done week get new pair usernam
29,usernam usernam usernam usernam usernam usernam usernam usernam usernam take
30,usernam matter mani vote someon got method get vote wrong unsportsmanlik timothi deserv spot peopl vote bunch time block peopl sole said vote someon els
31,usernam belt coupl month last one product buy pictur
32,usernam usernam nice wait see model
33,usernam usernam rock one strap cut overal tank live
34,usernam love jacket need wear white yoga teacher train mayb could dicki yogi
35,usernam usernam look good look forward show realli enjoy watch monkey everi week
36,usernam usernam usernam amaz
37,usernam usernam usernam usernam go get shop clean weari face weari face weari face
38,usernam usernam usernam realli tight
39,usernam usernam ke belaela le nna waits face tear joy inform uncl
40,usernam usernam check usernam post block say vote someon els
41,need dicki sponsor dicki pl sponsor origin
42,usernam usernam thank
43,usernam numberuraniwa numberanumbercnumbercnumberf jin yao suru
44,dress like pro summer usernam httpaddr
45,cultur prom dress usernam usernam pictur
46,usernam usernam usernam usernam questa sera live verona victori hand emoji modifi fitzpatrick type number number camera flash usernam charliedop usernam usernam usernam usernam hashtag usernam usernam usernam usernam httpaddr usernam usernam hashtag hashtag hashtag httpaddr pictur
47,usernam usernam fabul idea charlatan
48,usernam check black orang dicki men xxl button front work shirt number pocket hashtag httpaddr via usernam
49,want wave usernam presentan usernam mucha banda ma est sabado en el club rotario en hashtag dicki usernam usernam usernam pictur
50,usernam usernam yeah genuin dicki haha
51,usernam usernam usernam usernam und da sieht viel besser au hellyeah pictur
52,cityoffortworth celebr final beam usernam arena instal today construct halfway finish stori tonight usernam newsfix number number pictur
53,usernam need sponsorship come back pictur
54,usernam usernam one realiz show herbi luv bug use origin music movi
55,nake pozzi campaign usernam usernam usernam lehlohonolopaanumb dress usernam usernam pictur
56,usernam usernam usernam usernam okay bei un sieht da dann eher au pictur
57,usernam product made china region indic symbol letter c region indic symbol letter n product thought made usa region indic symbol letter u region indic symbol letter pictur
58,usernam usernam usernam damn right wait see ya person rais hand celebr
59,usernam usernam said
60,usernam usernam errrr okay
61,usernam usernam chang person
62,rip usernam shoe hardli got see work short three month life pictur
63,usernam usernam lo mataron por que es una mafia lo politico son uno malandrin pero se visten con traje zapato usernam usernam
64,man usernam need sponsor street fight jean use combat least number number time
65,slew new tee usernam httpaddr piec httpaddr pictur
66,usernam make work pant tacki materi attatch waist line help keep shirt tuck
67,usernam usernam usernam classic shit ok hand sign emoji modifi fitzpatrick type number number
68,usernam number shift warehous hashtag second pair last pair fuck two shift pictur
69,usernam usernam that cool want
70,usernam come hold togeth one even lunch pictur
71,usernam usernam usernam cloth purchas indulg
72,usernam usernam usernam thank mark remind us wagner posit healthcar httpaddr
73,usernam total need buy fresh gear
74,usernam restock pictur
75,usernam usernam ff stop usernam know better get tri market share guy hand stop peddl stuff actual men fashion kind bore gener fairli plain pretti consist time real dicki great
76,want father day pair thorogood work boot usernam work shirt button up cours coupl new pair work pant walmart new work truck allow continu incred hardwork provid born pictur
77,usernam usernam hashtag
78,numbernnumb usernam nike cortez life right usernam lol pictur
79,catch usernam slim fit work short next saturday kill pain shoot
80,usernam
81,usernam usernam think
82,usernam usernam usernam omg ur feet look tini
83,brother hike mission peak wear usernam sponsor afford shoe pictur
84,usernam usernam usernam thank toni much appreci
85,usernam usernam said unpack tool lol
86,usernam usernam pretti much exclus shop onlin well issu tri first store total luck someth decent want wear tall man struggl tell ya
87,usernam usernam usernam usernam ke ai
88,usernam usernam scrub type top wear usernam scrub pretti comfort cool heat
89,usernam usernam usernam usernam hell ye
90,usernam usernam usernam dicki made spoil breath
91,usernam usernam usernam steezi sunday look friend httpaddr usernam usernam hashtag hashtag hashtag hashtag hashtag hashtag hashtag hashtag hashtag hashtag hashtag hashtag hashtag hashtag hashtag pictur
92,usernam love ripstop cargo short standard apparel keep without rip hole number month
93,usernam usernam usernam usernam usernam realli like usernam basic work trouser reason price eurnumb last well load pocket comfort fit hammer loop bought two pair buy
94,usernam say size number big tall clearli size number big tall
95,usernam usernam damn phone produc great qualiti photo
96,hope everyon enjoy last night welcom dinner hashtag thank everyon attend also usernam sponsor offici event photograph follow pictur
97,usernam usernam collab beauti think wed harmon well
98,usernam usernam usernam usernam usernam usernam number would even better thumb sign thumb sign thumb sign thumb sign
99,offer still valid usernam pictur
100,usernam usernam sure dick ie pictur
101,usernam usernam usernam go let ladi respond
102,blue heart black heart michaeljwoodard showin signatur usernam style smile face sunglass pictur
103,usernam hashtag mastermindjapan_offici get_repost katakana middl dot katakana middl dot katakana middl dot celebr number anniversari usernam httpaddr
104,usernam hashtag x usernam black heart pictur
105,usernam usernam full monti
106,usernam look like dope usernam magazin ad page
107,usernam usernam usernam yhow yhow text messeng bruh kant uyi bonil shrug emoji modifi fitzpatrick type number number zero width joiner femal sign fire fire fire fire bottl pop cork clink glass
108,usernam usernam sponsor pleas beat heart sparkl heart revolv heart grow heart
109,usernam usernam usernam usernam usernam usernam usernam usernam usernam usernam usernam usernam usernam thank beverli person fold hand realli appreci hashtag region indic symbol letter z region indic symbol letter
110,new idea pant took pair usernam cargo pant put design pictur
111,usernam black red
112,l e c u n e l spot serafina slater street jean school satchel xwhere outfit overal usernam shoe usernam hat usernam bag usernam hashtag inspir white right point backhand index httpaddr pictur
113,usernam call guy told go httpaddr claim warranti noth wrong
114,usernam ne restez pa san vetement color c est l ete avec usernam dicki ovalo slim fit short sleev work shirt httpaddr hashtag hashtag hashtag hashtag hashtag hashtag hashtag hashtag httpaddr pictur
115,usernam timothi heller deserv win disgrac compani say hashtag hashtag
116,usernam usernam fack
117,sinc steve rendl came onboard hashtag compani year ago made substanti move sell usernam brand acquir usernam usernam brand hashtag hashtag hashtag hashtag httpaddr
118,usernam usernam idk got em
119,usernam usernam pull ador dicki suit
120,usernam still wait repli usernam
121,usernam sponsor plz pictur
122,usernam usernam usernam usernam ugh must squar buckl
123,high schooler wear fashion youth httpaddr via usernam friend mckinley made cool usernam usernam usernam usernam usernam usernam usernam usernam usernam
124,feel like usernam realli miss opportun httpaddr
125,usernam _queenlioness_ aye tri gotta buy number time china loudli cri face loudli cri face loudli cri face
126,usernam normal two week old last belt last year one alreadi peel pictur
127,omg number pair usernam short lament abl find replac ofliter httpaddr
128,usernam usernam numberbrand american stylehashtag hashtaglik hashtag hashtag hashtag hashtag httpaddr
129,usernam usernam snap back hat
130,usernam usernam famou
131,usernam usernam usernam usernam numberman cute
132,usernam usernam usernam usernam usernam nice jen
133,usernam impress custom servic spoke today easi talk took care issu quickli better come expect thank dicki
134,usernam usernam number
135,hashtag us numberracingteam amaz dad usernam usernam usernam usernam usernam usernam usernam usernam usernam usernam usernam usernam usernam pictur
136,usernam black
137,usernam usernam usernam usernam wait hear sign horn emoji modifi fitzpatrick type number
138,usernam usernam hashtag hashtag today tomorrow want gmg shirt
139,usernam usernam great advertis usernam usernam usernam usernam usernam usernam usernam usernam pictur
140,usernam usernam damn right want see
141,usernam usernam trainer
142,usernam short inseam shorter number inch us number guy
143,usernam coupon sent cbc attende yet found pair work pant like tri wait discount code thank
144,usernam usernam usernam usernam cri cri much love guy
145,usernam usernam usernam
146,usernam usernam httpaddr
147,oh usernam
148,usernam usernam usernam b natur like dad
149,wonder workwear market rise let dicki show win next big uniform purchas httpaddr usernam hashtag pictur
150,bought cloth besid dicki number year shout brand link hundr point symbol usernam get board
151,usernam total saw hispan poc wear usernam plaid shirt wife beater neck shirt must ms number
152,usernam usernam usernam ye pleas
153,usernam usernam farm garden yard work cloth e usernam usernam usernam etc
154,usernam littl number month old boot fall apart disappoint pictur
155,usernam sign man usernam
156,rip crotch scrub bottom smh usernam need help
157,shor leg sun anoth hashtag deal pam tie time redhawk pro work short made usernam httpaddr get hand sun still hashtag hashtag hashtag pictur
158,usernam jealou rock dem usernam girl
159,usernam usernam hello much interest busi develop good compani creat market garment item good compani pl advis urgent
160,usernam usernam look mopar sale site look good car could flip
161,dari logika sederhana kita tentu saja seseorang tak akan memb celana usernam untuk kedua kali tidak akan memb produk usernam lagi dan hanya sesekali menggunakan usernam
162,usernam usernam usernam usernam usernam usernam usernam usernam usernam usernam usernam usernam best mate thumb sign
163,muito obrigado brasil hashtag usernam usernam pictur
164,usernam usernam usernam ok outfit smile face heart shape eye
165,usernam usernam usernam usernam cierran en hashtag hashtag hashtag dejando number persona desempleada en lo hashtag usernam usernam
166,usernam usernam usernam usernam usernam dm ed link
167,usernam usernam congrat franni
168,usernam hashtag amaz hashtag alway nice kind person line custom hashtag usernam hashtag
169,usernam made chino abolova ekasi
170,usernam usernam usernam one british wed attend tomorrow
171,hashtag hot hashtag check new usernam temp iq perform cool hashtag hashtag httpaddr
172,usernam get red painter pant need asap
173,usernam usernam hashtag stock usernam hashtag hashtag road hashtag call see mick paul gang great friendli servic usernam usernam usernam usernam usernam usernam usernam usernam pictur
174,usernam hand best pant skate question doubt cop pair
175,usernam lol good point funni still love jean late usernam pant good comfi
176,usernam usernam awesom ok hand sign emoji modifi fitzpatrick type number
177,usernam usernam bro person fold hand put
178,usernam usernam im dead non tradit model bodi girl dumb pictur
179,usernam usernam usernam usernam yess
180,usernam pant shirt sock everyday invest usernam sneaker usernam bore practic
181,usernam usernam
182,usernam pl send pair custom pink number origin fit dicki ill forgiv
183,usernam usernam usernam usernam usernam usernam saya tatoan saat ini terinspirasi liat bang usernam smile face open mouth tightli close eye keren euy
184,usernam usernam ngikhona lol
185,love usernam usernam pictur
186,usernam thought
187,dick hashtag usernam hashtag pictur
188,usernam kid usernam face tear joy loudli cri face loudli cri face loudli cri face
189,usernam sport usernam hat follow doubl win usernam superbik class camera flash doubler pictur
190,usernam usernam wurd ich wahlen
191,usernam usernam usernam chequer flag victori hand emoji modifi fitzpatrick type number usernam hashtag donington park race circuit httpaddr
192,school year rewrit teacher thread mr b wear usernam everyday entir school year dicki chuck taylor usernam gear everyday teacher teach awesom wear look awesom
193,usernam everyday dark blue fedex gray black tan plaid day hashtag
194,hey usernam would like clear brand film contact
195,usernam usernam usernam usernam usernam usernam usernam usernam usernam usernam usernam usernam usernam usernam usernam usernam none winner usernam
196,usernam restock pictur
197,shoutout usernam keep creas tf jean pensiv face white point index emoji modifi fitzpatrick type number
198,usernam prefer usernam number usernam coveral make women go crazi pictur
199,old school like usernam cell phone pocket sold soul train fashion
200,shop great valu camo jacket like usernam cornwel jacket httpaddr httpaddr hashtag hashtag hashtag hashtag hashtag hashtag hashtag hashtag hashtag hashtag hashtag pictur
201,usernam usernam usernam usernam usernam usernam usernam usernam usernam usernam usernam great weekend great race
202,usernam hashtag cat face wri smile hao kidakaraarasa katakana hiragana prolong sound mark nanonisi wazu usernam noo katakana hiragana prolong sound mark ba katakana hiragana prolong sound mark teemai tsuteshimaimashitanodehei sukini katakana hiragana prolong sound mark tovanswolu itebu kimasu athlet shoe httpaddr
203,usernam usernam beer assist seen
204,usernam usernam dude need dress like up httpaddr seen episod south park
205,stop buy suprem like hey usernam usernam love blue heart sparkl face cowboy hat
206,usernam usernam let dm
207,jean jean code puppi snack princip anoth fundrais prove teacher financi httpaddr usernam httpaddr
208,usernam rn smile face open mouth cold sweat
209,usernam usernam complet wardrob happi wardrob usernam usernam usernam usernam hashtagth hashtagthpartnumb hashtag hashtagthpartnumb hashtagthpartnumb hashtag httpaddr
210,siri remind usernam dryer pictur
211,usernam usernam fuck agre
212,usernam shoutout usernam make pair sunglass dude giant cranium fit httpaddr
213,usernam usernam usernam wear black dicki even beach like even dedic theme
214,usernam usernam usernam man myth legend king
215,usernam te seguir junto con usernam usernam usernam usernam
216,usernam usernam roll floor laugh roll floor laugh roll floor laugh roll floor laugh thumb sign thumb sign
217,usernam usernam usernam usernam usernam usernam dare get paint new gear
218,usernam usernam usernam hair revolv heart
219,usernam usernam dicki hack taylor dress code ya se kasi
220,usernam usernam usernam scarecrow stalker zombi
221,usernam usernam know mean sometim brought stuff us ebay good result obvious us market bigger watch size wetsuit women workwear jacamo great suit workwear bit nich
222,usernam usernam think work saftey glass foam pad insid
223,need new hashtag check usernam usernam offer great qualiti rangehashtag hashtag httpaddr
224,sure fun rip pant less month cardiac arrest wear correct underwear underneath fact volunt crew call spongebob thank usernam ignor email
225,usernam usernam usernam caus even space gotta keep street pictur
226,usernam thank usernam person fold hand emoji modifi fitzpatrick type number chocol bar heart decor pictur
227,usernam usernam photo shoot get notic
228,usernam usernam get dicki merchandis store soon white smile face
229,shout usernam qualiti work sock rare wear definit get hole like brand feet mvp
230,look forward usernam usernam global brand meet hashtag next week work present thought leader captain industri realli fun partner hashtag hashtag hashtag hashtag hashtag hashtag pictur
231,dress usernam camera flash usernam
232,usernam usernam usernam ah ye riveria
233,tgif anoth gnarli session back alley bump usernam usernam usernam usernam usernam usernam usernam usernam usernam pictur
234,heavi check mark boot made work call store see new dicki rang could get retweet like pleas usernam usernam usernam usernam pictur
235,usernam usernam usernam anytim alway support white heavi check mark white heavi check mark
236,yung pagkauwi ko may ganito yaaaay smile face heart shape eye iba din magsurpris ang inay ko best heavi black heart usernam hashtag hashtag pictur
237,link usernam
238,hey dude usernam send pant pl rli need httpaddr dude need x
239,httpaddr usernam u ef kid freak coveral nearli moneysymbnumb buck usernam heavi black heart dicki r way cheaper materi u sport damn way stop tri number take advantag folk w ur crap tht knockoff hashtag smh pictur
240,usernam usernam usernam moneysymbnumb real monkey sew togeth himalayan sweat shop
241,dicki invit custom help design workwear usernam httpaddr pictur
242,get summer streetwear good readi usernam x fila httpaddr hashtag
243,usernam love uk
244,usernam check usernam
245,usernam usernam make sens
246,usernam look dicki everywher find special order knockoff httpaddr
247,usernam time denim jacket
248,usernam usernam usernam babi pictur
249,usernam heard usernam
250,dicki team usernam pa ep number build woodward present usernam httpaddr pictur
251,usernam call custom becom ambassador httpaddr pictur
252,look guy realli anyon depend style hug face vintag shirt size moneysymbnumb usernam straight leg pant size moneysymbnumb stan smith usernam size number moneysymbnumb riversid hashtag pictur
253,usernam usernam big danni fist hand sign fist hand sign that wassup
254,usernam usernam usernam usernam _redlightgo usernam usernam usernam usernam usernam usernam usernam usernam wala
255,usernam usernam sadli eaten bbq sandwich give decent tip get paid bbq sauc bbq sandwich salad lettuc aw would never recommend food servic
256,usernam navi black ok hand sign
257,usernam usernam white point index white point index white point index white point index fist hand sign fist hand sign
258,open chat got wrong thick see thing look head tryin g get shout link phone black bath hous bloc usernam short got jungl beard war
259,usernam sponsor luv u usernam hashtag pictur
260,usernam usernam usernam nigh indestruct coupl year realli workshirt would pinch
261,usernam usernam usernam zao izh sheng chi shu liang xian ding togoriya shishinagarazhi duan woyan wanakatsutanohasaitodejia ge womitaxiao fei zhe woshu liang xian ding zao izh sheng chitoiuyan xie dehuo wasetepan duan li wodun raseg ru saserutamedesuka
262,usernam usernam usernam bro u realli snappin
263,rt httpaddr soak sun usernam number inch multi pocket work short also avail color httpaddr hashtag hashtag pictur
264,usernam usernam dm open
265,f outstand servic usernam custom servic well done regard hesit busi thank
266,usernam usernam usernam usernam usernam
267,usernam usernam usernam usernam usernam usernam great idea
268,usernam usernam smile face sunglass
269,httpaddr dicki usernam hashtag hashtag hashtag hashtag
270,usernam se ven bueno wink face wink face
271,la empresa usernam utiliza botella de plastico para producir pantalon con la finalidad de favorec al medio ambient via usernam hashtag hashtag httpaddr pictur
272,usernam spoke repres usernam name anna far need award best repres ever hashtag hashtag hashtag
273,usernam dirti pant vs camp chair stitch clear hashtag pictur
274,usernam usernam usernam thank jen mission accomplish pictur
275,usernam usernam number riviera
276,usernam pl sponsor like point live ur cloth either work home sport dicki u might well go ahead sponsor alreadi
277,usernam chanc ad ladi work short collect got ladi work trouser fit realli well thumb sign pictur
278,usernam usernam usernam pictur look real good roll floor laugh roll floor laugh disabl veteran vertan know back right peopl john fetterman tom wolf know peopl need person stand tie anoth trump
279,usernam usernam pant safe back crisi avert
280,usernam usernam usernam usernam _redlightgo usernam usernam usernam usernam usernam usernam usernam kailangan po bang mag buy agad ng ticket sa number na po
281,usernam usernam usernam gotta talk exist thank show love doe heavi heart exclam mark ornament hashtag
282,hashtag tuvist un par de usernam
283,usernam usernam tell discoveri pass new episod program argentina last tuesday pass first episod httpaddr show old httpaddr show work world
284,usernam usernam usernam pictur
285,fresh fashion union la custom usernam capsul collect httpaddr hashtag hashtag pictur
286,usernam usernam usernam diggin autograph auction let proce go fave non profit foundat hashtag hashtag hashtag hashtag hashtag hashtag
287,usernam _ even dirt road simplic remain suprem ok hand sign pictur
288,usernam inflat materi pictur
289,usernam gotta strike deal w usernam co would dope af
290,anyon talk michael usernam wardrob usernam
291,usernam usernam serious think
292,usernam usernam desir effect
293,usernam usernam usernam usernam usernam usernam usernam usernam usernam usernam usernam usernam usernam usernam usernam usernam outsid garden cottag
294,usernam
295,usernam usernam nice white l shop
296,usernam hook fam
297,wear work usernam trouser feel weird come back sun hashtag
298,usernam usernam usernam right
299,six hour endur entri list usernam saturday remain number empti posit establish newli form team challeng pirellimoto usernam usernam usernam usernam usernam pictur
300,would unreal imagin adela dicki spit bar usernam get done fire multipl music note httpaddr
301,usernam got brand new select uniform shirt women moister wick crew neck tee canva chukka boot help keep cool smile face sunglass summer usernam hashtag hashtag
302,usernam usernam estamo intentando subir ma foto de est outfit pero es que lo podemo evitar jimmi camiseta usernam mono usernam gorra usernam camiseta usernam timber peto usernam nuria usernam httpaddr pictur
303,usernam usernam usernam usernam usernam usernam usernam miss nike air dont self
304,usernam start make skinni jean httpaddr
305,usernam usernam
306,usernam hey still sell number number baggi short check somewher els
307,usernam usernam usernam give want half ass car cheap sell alot money money bag money bag money bag
308,usernam usernam small big lmao sleepi face sleepi face
309,chiqui te ponga freaki plancham lo usernam vamono ricki number smirk face smile face sunglass
310,wish usernam still store orlando
311,usernam usernam usernam usernam usernam usernam usernam that dope look
312,usernam send us dm help resolv
313,usernam usernam usernam usernam usernam usernam usernam usernam usernam usernam usernam usernam usernam usernam usernam numberusw usernam usernam usernam usernam usernam usernam usernam usernam usernam usernam httpaddr
314,usernam usernam usernam shame get usernam pro spain boot shoe product like glove kind wear way via amazon extremli expens
315,usernam usernam usernam cheap shot immatur realli hashtag hashtag hashtag hashtag hashtag hashtag hashtag hashtag hashtag hashtag hashtag hashtag hashtag hashtag
316,usernam get shirt south africa
317,person fold hand purpl heart usernam usernam geniumoneysymb person fold hand purpl heart banknot dollar sign banknot dollar sign banknot dollar sign banknot dollar sign banknot dollar sign banknot dollar sign banknot dollar sign
318,usernam usernam usernam usernam excit hear favourit band alway
319,love usernam usernam work man anti style style oh amaz singer yeah hashtag pictur
320,httpaddr dicki utcai termekek erkeztek usernam munkaruha boltjaiba
321,even cattleman never pull calf pair dicki sock usernam
322,usernam usernam usernam best wait watch john fetterman humili debat mayb dicki sponsor
323,usernam usernam usernam usernam niic hear
324,usernam usernam usernam miss
