,tweet
325,hashtag workwear hashtag store onlin see redhawk pro trouser httpaddr usernam pictur
326,usernam usernam usernam numbercaseyramoshaba fire fire fire
327,usernam usernam kieran pfp make nauseou look
328,usernam blue blue blue blue blue blue
329,dicki appoint cano httpaddr usernam usernam hashtag hashtag hashtag hashtag pictur
330,usernam usernam well pic neutral face
331,usernam usernam favorit look heavi black heart heavi black heart
332,usernam usernam fault mordi
333,usernam usernam usernam almost adventur begin coffe get adventur start usernam beckman cigar leather dicki hashtag levi hashtag hashtag hashtag hashtag hashtag hashtag hashtag httpaddr pictur
334,william dodo good compani usernam global brand meet madrid spain region indic symbol letter e region indic symbol letter pictur
335,usernam usernam usernam usernam usernam usernam usernam usernam usernam usernam usernam usernam usernam anyth happen hope great weekend chequer flag thumb sign
336,usernam usernam keep tri
337,usernam usernam race shop st augustin
338,usernam happen five time five pair less year send replac broke pictur
339,usernam usernam like design
340,usernam hope bogo deal soon could use new work pant soon
341,usernam usernam check dodg viper pictur
342,number usernam dicki sa street cultur go hand hand like pap chakalaka one point dicki omnipres south african street would forgiven believ local brand httpaddr pictur
343,number pair usernam return gotta pay send back broke ass gotta box pant fit
344,usernam usernam number number number number
345,usernam usernam usernam usernam usernam usernam usernam usernam usernam will give number whomev help product market look partner n half owner patent pend global product
346,usernam rock usernam number short
347,usernam usernam usernam lost aaron richard sit offic day repli tweet
348,usernam usernam usernam want shirt pensiv face
349,primer avanc de usernam hashtag maquiladora usernam de hashtag usernam en hashtag cierran sorpresivament sin previo aviso dejando en la call mil number trabajador
350,juli special offer featur fantast summer workwear offer includ usernam shirt short safeti boot psnumber check full promot httpaddr today hashtag hashtag pictur
351,morn smile face open mouth tightli close eye day number hashtag sponsor usernam usernam usernam hint hint wink face httpaddr
352,usernam usernam usernam usernam get life regardless knock set back
353,usernam fix
354,best f ckin job ever typic work outfit includ sweet railroad issu rx glass love new spec hashtag x emoji modifi fitzpatrick type number number steam locomot usernam pictur
355,four favorit travel companion number usernam knumber number usernam holster number usernam belt number trusti usernam wallet pictur
356,usernam usernam yeah khaki go great minimalist wardrob face stuck tongu wink eye
357,usernam usernam usernam see even charcoal gbnumber thank
358,usernam usernam share love check top engag commun member commun rocket grow twitter follow httpaddr
359,lol saw usernam store
360,well dicki good enough tommi lee pammi anderson son usernam usernam hashtag hashtag hashtag hashtag pictur
361,usernam relax cabin icon shirt cool httpaddr pictur
362,usernam usernam usernam usernam usernam usernam support fox friend
363,usernam usernam tamaranai smile face heart shape eye thumb sign fire yatsupamoderugaiikara hashtag
364,usernam usernam usernam hashtag usernam katakana middl dot katakana middl dot katakana middl dot usernam x usernam usernam esta tard de camino al fiestorro que han montado lo amigo de usernam usernam httpaddr pictur
365,usernam usernam love get caus gonna make galaxi bad azz uh oh beer number beer stewart
366,usernam mmm dem hashtag usernam httpaddr
367,pro skateboard tom knox bore southsea weekend httpaddr hashtag hashtag usernam usernam pictur
368,usernam camera usernam pictur
369,usernam usernam lyytvvyyb hebrew letter alef v g yph mkhzyqym bbvgrshvb
370,usernam usernam usernam pictur
371,usernam gotta get sponsor
372,usernam usernam usernam usernam use cut arm slice stitch along top shoulder one piec bib n brace answer
373,usernam black
374,usernam usernam thought dicki bbq joint
375,usernam made daughter weekend hashtag hashtag pictur
376,usernam _hawkrac usernam usernam usernam usernam usernam usernam usernam hashtag hashtag usernam usernam usernam hashtag hashtag hashtag pictur
377,usernam usernam usernam gross disgust human usernam campaign stand cheap shot oppon look like wear know oppos intellig dedic polici
378,usernam usernam
379,usernam usernam usernam usernam usernam
380,usernam usernam usernam usernam usernam broer fire fire fire
381,usernam usernam usernam cool thank
382,usernam usernam usernam usernam usernam usernam usernam usernam usernam usernam usernam usernam usernam usernam usernam usernam littl weekend place
383,mexican girl stay west coast fit alway consist pair usernam usernam cortez httpaddr
384,usernam hide rock amazingli talent contest usernam usernam faith wear cloth exclus give free style trend live tv load fan wonder post sponsor yet
385,usernam pleas get old dark navi blue pant walmart got new blue pant walmart bartlett tn lighter navi blue like much
386,numbercd give us call number number dicki get bottom
387,cut usernam pant knee short hot fuck lemmi god hashtag hashtag
388,usernam usernam pictur
389,say goodby skinni jean hashtag brand like usernam usernam take street style say usernam httpaddr hashtag
390,usernam usernam fuck slim straight slim skinni though
391,hashtag spice rum amaz hashtag jacket sailorjerri logo usernam usernam usernam usernam pictur
392,usernam pictur
393,usernam usernam lyour energi contigu mjw
394,usernam usernam thank shame x
395,usernam usernam usernam usernam beyond dope
396,there gonna whole lot usernam purchas year
397,cat west coast still rock usernam
398,wear almost exclus usernam short sleev work shirt still piss select numberxlt color select drop number fuck httpaddr make sens want better color shirt damnit
399,usernam usernam honestli would love see usernam fwisd purchas lagrav field make fwisd usernam partnership like frisco usernam usernam becom great citi peopl pass
400,usernam usernam una camiseta desd chile
401,usernam usernam torino
402,usernam jeje see evil monkey white smile face imma cop real soon wink face
403,usernam tu usernam
404,usernam usernam usernam usernam usernam usernam got trouser good wash well e shrink like lot trainer soon look pretti naff black white one
405,usernam beig
406,usernam usernam dicki tell buh bye need peopl like repres compani pictur
407,usernam usernam pictur
408,usernam usernam ummm lol
409,usernam usernam thank guy love support highli appreci person fold hand heavi black heart heavi black heart
410,usernam ezintwembu
411,hey usernam wanna work futur brand usernam httpaddr
412,thank came support taylor hill trade day wednesday miss panic anoth trade day high street godston branch monday number associ dicki big wipe usernam usernam hashtag pictur
413,find interest kim jong un like basketbal high top fade rock usernam jailbird outfit hashtag
414,usernam usernam usernam usernam usernam usernam usernam paint cloth
415,usernam usernam pictur
416,usernam usernam pleas bring back regular camo short last number year lost bunch weight find pair fit loudli cri face loudli cri face hashtag
417,usernam dicki number pant back puppi fli mess wink face usernam hashtag hashtag httpaddr
418,usernam usernam wish cash buy
419,number n texan disabl readi strut runway usernam hashtag fundrais thank fashion donat usernam usernam share exclus cloth fit httpaddr
420,usernam usernam usernam face tear joy face tear joy still keep cut back sorri say wife keep make cut back face tear joy roll floor laugh face tear joy
421,usernam know find local onlin usa pop uk site pictur
422,usernam usernam heavi black heart ok hand sign smile face heart shape eye face throw kiss
423,tackl workwear eas eisenhow heavi duti trouser usernam avail httpaddr hashtag hashtag hashtag hashtag hashtag hashtag hashtag pictur
424,usernam gracia smile face smile eye person fold hand emoji modifi fitzpatrick type number number movi camera usernam por mi uniform hashtag hashtag smile face sunglass receta de hoy en httpaddr
425,usernam usernam usernam usernam make us feel good alway beacon light around love
426,origin distinct x dicki sampl short aye usernam wassup wit collect pictur
427,hoy comenzo el ultimo usernam en pomona california sign horn fire chequer flag jenna estara en el stand de usernam junto con la fundacion keep breast conociendo fan heavi black heart sparkl pictur
428,usernam pleas use higher qualiti metal hardwar revers belt bought end get strip quit easili
429,usernam usernam quer e uma dicki para ti
430,big save usernam summer work gear sunni sleaford branch great price short polo shirt trainer pictur
431,usernam usernam also need someth south africa region indic symbol letter z region indic symbol letter person fold hand person fold hand
432,usernam bootleg pant women stock time
433,usernam happen use reliabl number last number pair jean bought garbag belt loop break week seam break first wear garbag
434,usernam usernam rad shop usernam usernam dickiessk dickieslifeoffici onlin httpaddr
435,usernam usernam usernam nankayokufen kannaikedokatsukoiikotohajian wei inai fire fire fire
436,usernam usernam hi darren sorri hear repli dm question pleas let know happi help thank craig
437,modern hashtag look daili hashtag speak clair brown buyer usernam workwear understand think behind compani pro rang cloth httpaddr pictur
438,usernam usernam usernam even rock shrug emoji modifi fitzpatrick type number zero width joiner femal sign smile face heart shape eye
439,usernam usernam usernam shallow politician vote base merit integr perhap take time reflect charact
440,usernam usernam
441,usernam usernam
442,usernam usernam cuz dick i
443,usernam usernam usernam usernam go go glomar respons one
444,face around braamfontein mothupi kgats new age pantsula usernam fanat shoot camera flash usernam like rt earth globe europ africa pictur
445,usernam ask coke
446,readi cash sale stock suppli banknot dollar sign save back school usernam hashtag hashtagschool hashtag httpaddr via usernam
447,usernam usernam usernam kokomadeji ding lu xian yaro pian sarehenzo
448,new short number belt loop break first day first one within leav apart walk car hell usernam
449,usernam usernam usernam usernam beauti black heart suit rainbow
450,usernam usernam ad articl usernam usernam usernam assembl hashtag httpaddr
451,usernam hey sweeti pleas make overal dress checker print xoxoxoxoxo
452,usernam new spring collect form usernam httpaddr
453,usernam httpaddr
454,usernam usernam richard look littl tire lol
455,love new usernam hashtag work pant
456,usernam travel outfit usual wear comfi usernam pant usernam shoe flight hug face pictur
457,walk race shop realiz usernam made capri pant pictur
458,usernam usernam dodg omni smile face open mouth
459,know interim wear usernam hashtag hashtag
460,usernam usernam usernam usernam usernam usernam also yellow huda beauti electr obsess palett
461,usernam usernam alway pleasur bro fist hand sign emoji modifi fitzpatrick type number
462,usernam would awesom follow neutral face sayin
463,usernam here usernam suit caption ig keep energi love yall pictur
464,bodi warmer usernam pair jean usernam sneaker usernam much dope done pictur
465,usernam usernam usernam usernam social media team run account
466,usernam usernam great job spring summer collect
467,usernam biggest question ask answer day usernam usernam usernam never easi decis hashtag hashtagtip hashtag hashtag hashtag
468,actual dunno pick pocket attack yeah usernam cool guy dick
469,love woman usernam
470,usernam usernam dicki uniform husband clean compani got uniform
471,usernam usernam usernam hope still wear shirt tie handsom elev profess
472,usernam bought belt month ago look like suggest would greatli appreci pictur
473,one remark amaz interact hashtag usernam kind care pleasur speak thank usernam look forward futur purchas
474,usernam usernam usernam usernam usernam omg thank loudli cri face
475,usernam usernam usernam wear swimshirt beach actual safeti consciou cours union fight safeti everi turn corpor shill like wagner dont expect care thing like usernam
476,usernam couldnt make regular dark navi like regular dicki short lighter blue color pictur
477,usernam usernam usernam usernam usernam number year govt rule philli disast hashtag hashtag hashtag hashtag need usernam usernam hashtag gov wolf move us hashtaghashtag hashtag hashtag
478,usernam sponsor
479,gotta love frome haircut ramshack barber plu new tee usernam product usernam barcelona coffe usernam oh sticker go futur race car usernam pictur
480,usernam usernam usernam end era perhap someth els come along one day
481,usernam usernam king
482,usernam usernam think posit danger sign excel smile face open mouth tightli close eye
483,usernam usernam usernam usernam shayil fade
484,usernam usernam happi person rais one hand happi person rais one hand happi person rais one hand happi person rais one hand happi person rais one hand happi person rais one hand dm avail
485,usernam usernam big boy
486,usernam usernam sponsor pl
487,wonder usernam ever texa sure expect wear nice black jean numberdeg shame
488,usernam everyon like black white got cover usernam httpaddr
489,usernam usernam basin ge judg nko nga mura kog buta sa akong photo cge lng ga shade hahaha
490,aj wear usernam short lmao httpaddr
491,usernam usernam usernam fun
492,usernam aye usernam need talk
493,usernam usernam believ usernam still repli tweet ash must good
494,usernam usernam usernam usernam fit pic pictur
495,usernam usernam usernam usernam kind jelli jacket smile face heart shape eye
496,usernam usernam authent
497,usernam collis symbol hammer c k e workwear good skateboard fire ok hand sign usernam dickiessk dickieslifeoffici httpaddr
498,see dicki usernam u jeon jeongguk life damn lucki httpaddr
499,usernam usernam usernam usernam omgggggg
500,usernam usernam usernam jordi sky open flow strong keep move peac bless
501,usernam usernam usernam usernam usernam usernam hope usernam becom sponsor build start
502,usernam usernam usernam usernam smile face heart shape eye smile face heart shape eye smile face heart shape eye smile face heart shape eye
503,usernam pictur
504,random product reach anyon make intro someon american workwear brand someon like usernam boot usernam usernam usernam look partner featur fund approv content seri list brand huge opp free content
505,usernam usernam got number problem mentor richard old bird run without hashtag mentor anymor pictur
506,usernam u buy dicki cloth
507,usernam matter happen alway reli usernam number origin
508,usernam usernam usernam free pant put sign twitter
509,need usernam collab usernam
510,usernam impress onlin order custom servic compani place order email cs get track number show packag deliv yesterday packag found say deliveri pend hashtag
511,usernam usernam usernam requir candid wear neckti pictur
512,usernam _peaceofmindco real shit money bag hundr point symbol
513,celebr hashtag brought huski cleaner without permiss end reliev larg number dress pant fond probabl usernam conjunct yesterday complaint cost job hashtag hashtag
514,purchas someth usernam ask review honest review given choic up suck receiv repli review meet criteria basic good put site dishonesti polici
515,c mon usernam worn sock place small plastic hold sock togeth culprit wear comfort pictur
516,usernam next time hawaii trial give us shout may photogen certainli test kit limit usernam quiet word wink face
517,usernam come qualiti usernam slim fit number inseam regular relax fit short hashtag hashtag httpaddr
518,usernam usernam usernam whatev
519,es habitu ver colaboracion entr marca espanola e internacional pero grimey lo ha vuelto hacer con una propuesta jailwear grimey x dicki httpaddr usernam usernam
520,usernam sponsor usernam associ lol
521,hey usernam make fuck belt loop bigger wear fli belt got look stupid wear belt loop
522,usernam sponsor us somethin pictur
523,check usernam instal hashtag httpaddr pictur
524,great meet dean usernam rob scott direct supplier usernam today hashtag hashtag hashtag today hashtag hashtag hashtag hashtag hashtag pictur
525,usernam usernam usernam usernam usernam usernam httpaddr
526,usernam usernam follow trend dumbass dicki trendi
527,summer shock april number number b side collectivepnumb entranceperform usernam wearechicosciskychurchth chongkeysevenmr bone boneyard circusdavid vs goliath manilaunderfiredj set bstrd prncepres usernam usernam pictur
528,usernam black alway
529,grandma bought usernam warp tour shirt xl like number size big imma still wear pictur
530,usernam usernam got pair topman slim chino cambridg last super comfi fit quit well
531,usernam usernam usernam usernam usernam usernam paint brush
532,usernam usernam u get record contract u record mayb time
533,usernam usernam see told ya dicki everytym wear sinc number even market pitch highschool prove dicki could sold work forc bacc number mi market teacher laugh mi look hundr point symbol squar exclam mark
534,tell usernam face throw kiss
535,usernam usernam let bring back
536,usernam offici usernam model smile face sunglass
537,soul train fashion usernam x usernam collab httpaddr
538,said ima say usernam japannn tire face fire tire face fire
539,usernam usernam adjust make inaccur size
540,expect usernam wear tie debat wear black usernam even beach face tear joy face tear joy face tear joy httpaddr
541,still rock usernam
542,usernam usernam usernam usernam usernam person fold hand emoji modifi fitzpatrick type number fist hand sign emoji modifi fitzpatrick type number
543,usernam usernam pictur
544,usernam usernam usernam ha mull got free moment
545,usernam
546,httpaddr usernam belt comfort fit fit youth attir never felt good hashtag hashtag hashtag hashtag pictur
547,usernam usernam usernam definit richard
548,dicki lanza en japon una edicion limitada de camiseta basada en la seri de animacion bola de dragon httpaddr
549,usernam usernam look marvel two heart hug face face throw kiss
550,usernam usernam help ya
551,hashtag usernam chequer flag grow heart pictur
552,hashtag partner usernam explain hashtag coveral import part workplac hashtag profession hashtag read benefit httpaddr hashtag hashtag hashtag hashtag pictur
553,usernam usernam usernam usernam usernam great review jen
554,usernam usernam usernam see qualiti galco holster dicki wallet serious kimber never find lameass wheelgun hip carri twice round kimber tupperwar
555,imagin usernam usernam collab drool face
556,usernam usernam usernam aayaaaay maaaaaan fire fire fire fire fire fire fire
557,usernam usernam hard job someon lol
558,usernam usernam model
559,usernam usernam usernam two heart bouquet
560,roadi unless wear usernam short
561,usernam usernam backpackbadass vizio sound barretro game shirtsmom step dad fuckin awesom
562,usernam mani retweet free pair pant
563,place everyth alreadi cook usernam slowest food place
564,usernam sparkl pantalon dicki pedido wpnumber sparkl usernam hashtag hashtag hashtag hashtag hashtag hashtag hashtag hashtag hashtag hashtag hashtag hashtag hashtag packag pedido envio para todo el peru hundr point symbol packag black heart
565,usernam dicki r usernam trend south africa httpaddr pictur
566,usernam usernam usernam welcom
567,usernam usernam usernam numberfen dewan mai shitesonoatosuguzai fan jue ding surutsut moushi qian nida chihe wasetetayaromei du mei du xiao xian shiiyatsuyanaa
568,usernam beer
569,opt chino short cool versatil lightweight oxbridg cut off retain tailor sizzl without scorch usernam hashtag hashtag hashtag hashtag hashtag httpaddr pictur
570,usernam usernam usernam heard man sponsor
571,usernam usernam daniel ask rt tweet like rt pictur
572,usernam usernam usernam usernam usernam usernam usernam usernam usernam usernam httpaddr
573,hashtag latest usernam stockist tallaght dublin visit jame stephen qualiti work wear work hard sinc number excel rang choic store pictur
574,usernam come folk get one usernam eurosport polo shirt usernam usernam
575,manana jenna va estar haciendo un g con la primera number persona en el puesto de usernam httpaddr
576,usernam sponser pictur
577,usernam yeah buy onlin time especi guy throw discount lol readi impuls buy short last night
578,wear lot mf dicki usernam httpaddr
579,usernam landmast pro safeti wellington made rubber neopren combin help provid fulli waterproof boot also insul cold httpaddr pictur
580,usernam sponsor
581,usernam store pleas narrow option usernam usernam usernam usernam usernam usernam usernam usernam usernam usernam usernam usernam usernam usernam usernam let know
582,usernam wine red
583,usernam usernam ask fan spam vote
584,usernam usernam usernam readi weekend race hashtag pictur
585,usernam usernam cute word
586,usernam usernam camera clap hand sign clap hand sign clap hand sign
587,usernam usernam usernam go togeth like pb j
588,usernam hey usernam come make dicki pictur
589,usernam usernam usernam usernam say final face throw kiss
590,usernam thank much white point index emoji modifi fitzpatrick type number sign horn emoji modifi fitzpatrick type number pictur
591,number usernam work bootsuntil end august sun face pictur
592,usernam workwear launch new footwear tradeswomen httpaddr pictur
593,usernam usernam lineup stellar
594,usernam usernam usernam drop
595,usernam usernam todo tenemo una carcel de la que escapar usernam x usernam pictur
596,usernam new work pant show run worri hole go start pictur
597,usernam whoop whoop fresh batch new color usernam unoffici uniform hashtag httpaddr
598,interest piec usernam brand histori mention look go httpaddr
599,pleas bring dragon ball collabor south africa usernam
600,usernam usernam usernam
601,usernam pari sunni black sun ray today buy white cloth usernam hashtag httpaddr
602,usernam usernam style fashion selfish pursuit world die selfish moneysymbnumb pair usernam usernam label na buy number pair usernam jean give number homeless enough chang good lunch
603,sutazio huu hashtag hashtag hashtag hashtag hashtag hashtag hashtag hashtag dai hashtag hashtag hashtag hashtag hashtag hashtag usernam usernam hashtag hashtag hashtag hashtag hashtag usernam usernam usernam usernam usernam usernam hashtag hashtag pictur
604,usernam usernam usernam wait v neck shirtha ha hashtag face throw kiss smile face horn
605,lose weight fun game number pair usernam size none fit anymor
606,usernam usernam ugh love
607,usernam usernam look profession
608,usernam usernam let go full circl photoshoot lol
609,dicki safeti boot perfect protect great price black rightward arrow httpaddr pictur
610,usernam enjoy new usernam sun glass plu face alagang crozett face tear joy hashtag httpaddr
611,shout usernam tasti guitar shout usernam sock pictur
612,go usernam fourth consecut order receiv ship track inform
613,usernam usernam fulli prepar btw pictur
614,rip yet anoth sock usernam sock year fail less
615,usernam usernam usernam usernam usernam usernam usernam thank man
616,usernam usernam usernam hate freedom mark
617,usernam usernam usernam let honest piac qualiti work boot pictur
618,usernam usernam black heart suit call hand
619,usernam hola en colombia como se pueden adquirir su producto gracia
620,usernam levistrausssahashtag dicki vans_numb steelotumi combo commun pictur
621,see april number sa lemeri waaaaah usernam usernam usernam usernam bawal ipost sa fb malalaman nila na sinung leav ang sl ko hindi sick leav hahahahahaha hashtag okay loudli cri face usernam
622,usernam usernam usernam usernam thnx nat nat
623,usernam usernam usernam usernam usernam might even see tssf face tear joy
624,usernam workwear hard work hard wear sinc httpaddr sole proud offer extens rang ppe workwear dicki proven global brand see rang come visit sole hq hashtag hashtag hashtag hashtag hashtag hashtag hashtag pictur
625,dickiess numberkondisi number usernam usernam usernam pictur
626,everi day holiday love hashtag usernam usernam hashtag hashtag hashtag pictur
627,usernam person fan usernam short help
628,usernam usernam usernam hope great day
629,usernam disappoint custom servic sent pant back month ago exchang respons post offic confirm deliveri also respons messag custom servic inquir
630,usernam custom servic rock sock hashtag hashtag
631,usernam collabor everi bodi shoe except usernam usernam httpaddr
632,usernam usernam usernam hi rememb
633,usernam got new usernam number work shirt readi anyth hashtag hashtag
634,usernam usernam skinni work pant doubl knee best fit appar need someth littl stronger worn six week anyon know tough fit work pant hashtag hashtag hashtag hashtag hashtag hashtag hashtag httpaddr pictur
635,usernam bich mandatori pictur
636,dick i life u know mean eye usernam
637,usernam usernam usernam ima send u jay rock
638,usernam usernam yeezi tho
639,usernam usernam usernam usernam man lot pair usernam jean photo
640,usernam fuck bro idk black tee usernam short pant
641,wear usernam listen cypress httpaddr time httpaddr
642,hashtag tri usernam gear like usernam brand fave hashtag hashtag hashtag hashtag httpaddr
643,usernam weight comfort pictur
644,usernam usernam usernam usernam numbererebel appreci
645,usernam nice classi usernam hashtag hashtag hashtag httpaddr
646,usernam usernam usernam wrote usernam leverag collabor like usernam usernam usernam strengthen commun usernam httpaddr
647,great work usernam usernam rais money usernam draw usernam usernam pictur
648,usernam usernam usernam pictur
649,miss jean dicki comfort work casual pant usernam
650,usernam worn usernam sinc number hashtag
651,number number order usernam order pass junction number mnumber order stop outsid small fish chip shop south darlington
652,usernam usernam usernam ayayayay mammi ok hand sign fire two heart
