,tweet
955,usernam numberakosu usernam sugo katakana hiragana prolong sound mark katsukoii smile face heart shape eye smile face heart shape eye black heart fire thumb sign hashtag gao
956,usernam usernam usernam usernam preorder
957,usernam wear roll neck usernam scarf usernam trouser usernam sock usernam shoe golf le fleur usernam pictur
958,ine usa roupa da usernam
959,usernam usernam deeeee leeeeeeeteeeee
960,usernam dm lol need free shit pictur
961,usernam usernam usernam wow moment
962,usernam pleas make dicki stretchi waistband
963,usernam usernam love kid
964,new uniform arriv usernam person rais hand celebr emoji modifi fitzpatrick type number never take grant grate get work incred brand thank much dicki pictur
965,roof nearli complet moneysymbnumb million usernam arena fort worth httpaddr via usernam usernam hashtag pictur
966,usernam sure thing thank
967,usernam happen got smh face palm emoji modifi fitzpatrick type number number zero width joiner male sign pictur
968,stock usernam hard work hard wear sinc number hashtag hashtag hashtag hashtag hashtag hashtag pictur
969,shop usernam work pant moment
970,usernam usernam thing sjijo usernam
971,usernam usernam pictur
972,usernam usernam chanc get uk
973,usernam dicki usernam team flex bicep new collabor avail exclus usernam x check gysot right black rightward arrow httpaddr
974,hashtag return huge success earli morn model session usernam usernam usernam usernam usernam usernam usernam pictur
975,usernam get hashtag readi coachella metal hip sack usernam dicki women httpaddr pictur
976,mr steal ur starex number number haypbi tito year aye aye aye sponsor pl usernam usernam usernam usernam etc bc tito thrift smile face sunglass fire fire fire pictur
977,usernam usernam boy puttin mixtap eye eye eye eye
978,bought usernam pant year ago rip stop noth use usernam pant go number year go strong pictur
979,usernam usernam usernam usernam usernam usernam usernam usernam rememb yanyayayayayaya yamaarashi still pictur
980,check usernam hoodi warm coat cold tee hashtag hashtag httpaddr pictur
981,usernam usernam usernam usernam usernam usernam usernam usernam usernam sure guy help need encourag femal trade need feel comfort
982,board approv contract new graduat venu begin number number brand new usernam arena usernam time excit make move class number
983,want know usernam store locat httpaddr
984,ca fan pick copi match day programm come home game season get number discount voucher insid usernam workwear store usernam outlet villag pictur
985,usernam thank hook hashtag hashtag hashtag pictur
986,photoshoot da usernam pra usernam usernam pictur
987,usernam usernam ek se youngsta like usernam look remind chri cross da brat back day outfit look great would pair em pair navi blue usernam origin black chuck add pantsula feel pictur
988,usernam usernam usernam pictur
989,usernam pleas give usernam endors deal rep like crazi usernam pictur
990,rip everi pair pant spot pay much paper pant usernam switch usernam
991,bravo usernam usernam dope httpaddr
992,usernam usernam usernam deitsuki katakana hiragana prolong sound mark zu korabozai fa le shimishiteimasu
993,usernam usernam usernam usernam perfect match person rais hand celebr
994,usernam usernam number pair one work busi casual meet oliv garden
995,usernam httpaddr pictur
996,usernam usernam usernam usernam usernam usernam usernam usernam amaz love
997,usernam put dicki pro rang new websit today httpaddr relaunch end month love usernam rang
998,usernam usernam usernam famou write advic tell new cloth wast money save money thing support write
999,usernam usernam httpaddr le photo de la premier journe dispon hashtag hashtag hashtag hashtag hashtag hashtag hashtag hashtag hashtag usernam usernam usernam usernam usernam usernam pictur
1000,love feel fresh usernam hashtag hashtag
1001,wasssuppppppppp ft usernam usernam usernam pictur
1002,recommend decent work wear slim cut trouser usernam number month alreadi look like crap blown stitch around fli
1003,usernam keep ya eye prize hashtag hoodi usernam pant usernam shoe usernam bag usernam smile face sunglass httpaddr pictur
1004,usernam mind
1005,usernam alway upward mobil
1006,usernam usernam usernam usernam right like genuin kind good heart angel
1007,usernam usernam usernam usernam usernam usernam usernam usernam time over
1008,usernam usernam ultima sesion de foto poison heart cloth con ropa usernam pantalon usernam httpaddr
1009,checker shirt that warp tour usernam need tire face loudli cri face
1010,usernam usernam usernam pictur
1011,usernam usernam mai que tudo
1012,usernam belt stuck liter bought belt week ago much heavi duti pictur
1013,usernam httpaddr
1014,oz fella came parti filipino fan number consecut tour date philippin excus miss even one arcan riot tour usernam pulp magazin tripzilla philippin present usernam juli number tour pictur
1015,usernam usernam usernam usernam usernam usernam ye pictur
1016,usernam usernam rr look concern go green
1017,usernam usernam hundr point symbol
1018,usernam usernam idea guy origin number r work pant numberxnumb black current unavail
1019,textil technologist usernam hashtag near hashtag info appli httpaddr hashtag pictur
1020,riverton short sleev polo shirt usernam get premium qualiti without premium price avail two colour variou size xxl visit httpaddr httpaddr hashtag hashtag hashtag hashtag pictur
1021,usernam usernam buy em logo easi buy without though dicki websit
1022,usernam usernam usernam usernam lol ever work might job got given face tear joy
1023,usernam think someon cut check someth probabl lost like number dollar chang year caus yall pocket trash af shrug zero width joiner male sign face tear joy smirk face
1024,usernam usernam usernam usernam look like want
1025,usernam numberakosu usernam ye would love smile face smile eye smile face smile eye hundr point symbol
1026,usernam pensiv face
1027,pack goodi bag sponsor usernam hashtag usernam tomorrow hashtag pictur
1028,usernam usernam usernam usernam usernam usernam usernam usernam usernam usernam usernam usernam numberdigitaluk usernam usernam usernam usernam usernam usernam usernam usernam usernam
1029,usernam usernam usernam usernam usernam usernam usernam usernam usernam usernam usernam usernam usernam good luck
1030,usernam usernam never succeed without passion like love job
1031,usernam usernam usernam usernam usernam usernam usernam damn gurl smile face heart shape eye fire
1032,usernam got first time wear httpaddr inspector hashtag lol pictur
1033,usernam usernam usernam usernam happi back idd ground excit see favorit brand usernam usernam usernam usernam usernam usernam bolle_eyewear usernam usernam usernam hashtag hashtag pictur
1034,usernam usernam pictur
1035,usernam pictur
1036,coleccion grmi x dicki con usernam fire usernam hashtag hashtag httpaddr
1037,thank kelsey vieira usernam amaz custom donat number brand new usernam backpack us heavi black heart school satchel pictur
1038,usernam first imag usernam websit usernam class number truck hashtag sit front center usernam usernam usernam hashtag hashtag hashtag hashtag hashtag hashtag hashtag pictur
1039,la nueva tendencia de lv es usar ropa usernam pero do talla ma grand httpaddr
1040,usernam need dicki x convers x cdg collab one day pl
1041,usernam usernam kiss mark
1042,usernam usernam dicki dickless decid
1043,usernam wear usernam button work shirt everi day probabl make entri level offic posit fanci suit plu fraction colleg debt hint big corpor love care employe
1044,usernam usernam tri hard stay relev lol wanna puke
1045,usernam sponsor key aspir hashtag usernam hashtag hashtag pictur
1046,usernam hello ship saudi arabia
1047,usernam usernam usernam carhartt style
1048,usernam usernam itek lesego gongw got miss pair skull face tear joy
1049,usernam usernam sign
1050,usernam usernam usernam hashtag hashtaghashtag pictur
1051,usernam usernam usernam usernam miss audit sing sure made right honestli saw pic love havent watch idol
1052,usernam usernam eye fire
1053,usernam usernam coupl shirt complaint
1054,usernam unionlosangel usernam team get dicki collect httpaddr pictur
1055,make gear war nurs scurb plz usernam
1056,usernam hashtag liter buy vote block peopl vote sure u want fame thirsti person face brand hashtag
1057,tempt weekend rememb mr belvoir dicki suckl pig asado cycl live nottingham croxton kerrial open garden lot lot usernam httpaddr hashtag hashtag hashtag hashtag hashtag belvoircc usernam usernam
1058,everyon alreadi know non suit suit think go thing see usernam x usernam hat match case pant
1059,usernam usernam dope
1060,usernam love justin brother choi friend lexi run httpaddr local vegan cafe go strong month love everyth thank bring someth new differ hood see soon x pictur
1061,dear usernam pledg use kasi young star sparkl kamogelo ndlovu cloth advert got posit energi love brand dm contact let rt till dicki give opportun bomb bomb bomb pictur
1062,usernam grey
1063,usernam hey chanc could let sponsor least walk advertis
1064,en esto momento la presentacion de usernam en nuestra pasarela hashtag number pictur
1065,usernam usernam usernam shame
1066,usernam usernam ever need badass femal lead singer sponsor hit us httpaddr
1067,custom servic admin assist usernam hashtag near hashtag info appli httpaddr hashtag pictur
1068,usernam usernam ok thank sound interest never heard
1069,usernam usernam usernam spirit anim
1070,usernam
1071,usernam moneysymbnumb well spent work pant
1072,love usernam work short jean gone number pair relax fit flex work pant number month worn fabric number month
1073,earth day challeng someth natur prize award individu group compani send us entri earth day usernam usernam usernam usernam usernam usernam usernam usernam pleas share challeng pictur
1074,usernam still think usernam hire u real deal wear real deal product
1075,usernam usernam usernam ur cuuut also ice coffe warp find
1076,usernam usernam q td
1077,usernam usernam usernam usernam usernam usernam usernam anoth vote boot jen thumb sign
1078,usernam dear dicki watch american idol usernam rock dicki new age
1079,usernam khaki
1080,usernam thank usernam new set top usernam make qualiti workwear apparel sinc number dicki cloth offer superior craftsmanship deliv style comfort everi day pictur
1081,usernam usernam usernam heavi black heart smile face heart shape eye rose
1082,great valu hi viz teeshirt usernam psnumber vat usernam httpaddr hashtag hashtag hashtag pictur
1083,good see usernam europ still support monkey work usernam thank wonder love folk dicki
1084,usernam usernam usernam usernam sounandesukamaaannama lu datsutarali yong shiyasusoudesunexiao zao kuridomudao chan shitehoshiidesu xiao
1085,usernam usernam jeff tri like ashley found elast jean usernam look make women one though cuz cloth compani shit think women materi hug everi curv like els point women wear cloth
1086,usernam x usernam hashtag hashtag hashtag hashtag hashtag hashtag hashtag pictur
1087,para toda ocas asi es lo ma nuevo de usernam jean httpaddr hashtag hashtag pictur
1088,usernam usernam dang thought give away ga monkey gear know
1089,usernam palm spring usernam ultimi pezzi saldo hashtag usernam hashtag hashtag hashtag hashtag lanciano
1090,usernam usernam congrat parti popper
1091,usernam notr coup de coeur du jour un chino basiqu et intemporel de chez usernam httpaddr pictur
1092,detox box httpaddr via usernam gopro usernam usernam usernam
1093,usernam mani like gotta get make happen think face httpaddr
1094,usernam usernam dude beast jami foy battl scar httpaddr via usernam
1095,usernam usernam usernam guess took foto
1096,jump suit saturday sunday usernam pictur
1097,usernam workwear happen regular wash pete sake pictur
1098,usernam usernam wait see galaxi sure world
1099,usernam usernam think number number inbetween size
1100,usernam disappoint u guy offer number stone color pant anymor r favorit pictur
1101,usernam usernam usernam somewhat famou pictur
1102,usernam usernam usernam usernam usernam usernam usernam think think would win next kingfish tournament usernam usernam rapalacanada hashtag usernam usernam usernam hashtag usernam usernam usernam usernam usernam usernam pictur
1103,usernam pl give free workman pant ur favorit skater brand
1104,usernam need contact charg card purchas make
1105,usernam usernam usernam order pant form
1106,usernam usernam usernam usernam usernam usernam usernam usernam yay
1107,usernam usernam hook
1108,hello usernam buy anymor pant till hand fit front pocket number foot number dude averag build what deal go long guy get money
1109,usernam boot hole littl year last pair last two year hell
1110,kaplowitz hashtag hashtag usernam carpent denim hashtag work cloth hashtag hashtag httpaddr usernam stuff hashtag hashtag
1111,usernam search social media content coordin hashtag hashtag hashtag hashtag httpaddr
1112,usernam usernam nope childhood drama ken doll real exist bit boxi ken numberxnumb usernam ballroom gap style caus typic usernam divid httpaddr usernam hashtag usernam super shirt shop usernam pictur
1113,usernam usernam alway hold three pair year
1114,usernam usernam face tear joy
1115,usernam usernam usernam usernam look beauti
1116,love usernam call hand black heart suit pictur
1117,outfit number wiw number ft hashtag usernam hashtag usernam usernam usernam hashtag hashtag hashtag httpaddr
1118,usernam usernam usernam usernam usernam usernam two heart two heart two heart victori hand emoji modifi fitzpatrick type number number
1119,usernam usernam usernam jie san pian sarenaidekudasaiyo wan mai nankaninatsutemasensamoren qi gaaruyounijian sekakeruzi zuo zi yan nandesuyokorehaanchix wei yafei bang zhong shang nankadehaarimasen koregayan ran tarushi shi nandesuyo konnabu fa xing wei wotwitteryayoutubeshang depe ran toyatsuterundesuyotong bao shitekudasai hontoni
1120,usernam legend flex bicep pictur
1121,usernam usernam usernam rock usernam magazin logo black black usernam number oliv usernam ave usernam harajuku tokyo pictur
1122,usernam usernam usernam usernam usernam usernam usernam usernam got one thumb sign thumb sign thumb sign thabk httpaddr point surround area make great backdrop
1123,usernam aww thx big prop usernam supris secret shopper usernam make cargo skirt smile face open mouth thumb sign
1124,uhhh usernam anyway make girl junior pinstrip overal bigger size die absolut size avail
1125,temperatur drop tad earlier week find extra layer keep warm site head moulton park add usernam hoodi telephon order hashtag hashtag pictur
1126,ai copywrit endors brand like esprit dicki httpaddr hashtag hashtag hashtag hashtag usernam usernam usernam hashtag hashtag
1127,im wear full usernam outfit coincident usernam follow us twitter sign meant
1128,usernam usernam usernam sizeabl mood
1129,usernam usernam usernam took hous sing perform song amazingli michael get dicki commerci thumb sign emoji modifi fitzpatrick type number victori hand emoji modifi fitzpatrick type number hashtag
1130,stock qualiti work wear usernam visit websit find great price varieti httpaddr pictur
1131,get pair brown usernam pant old red usernam shoe
1132,usernam usernam usernam week ago usernam deliv promo copi cd envelop open cd remov empti case put back insid lol
1133,usernam guy make work pant turn leg sauna would freak happi
1134,usernam work wear short take knee pad thank
1135,usernam search social media content coordin hashtag hashtag hashtag hashtag httpaddr
1136,usernam usernam usernam usernam pictur
1137,usernam egunon xaval esta va xa lo barba lover colab usernam usernam cosita guapa dispo httpaddr
1138,usernam usernam saludo de uruguay
1139,usernam usernam usernam usernam usernam usernam usernam lol reet face tear joy
1140,usernam usernam sponsor
1141,usernam usernam paki nila che hahahhhh di mi ka afford apil ko houahuaa
1142,fresh hashtag fit shirt new watch shoe usernam jean httpaddr pictur
1143,usernam usernam lame hope get abil tri soon everyon industri wear
1144,porqu la ropa tambien utiliza tecnologia usernam tien una sorpresa para ti httpaddr pictur
1145,bless gift shoe men charl street men shelter thank usernam usernam donat number pair shoe last week made differ live men thank pictur
1146,usernam usernam see usernam work hashtag could use friend
1147,usernam usernam thing
1148,stomp price lambert lead supplier hashtag hashtag hashtag includ major brand usernam usernam usernam httpaddr pictur
1149,usernam usernam usernam usernam usernam usernam usernam usernam see bright green spnumberk mat photobomb italo
