,tweet
653,usernam usernam thank much person fold hand grin face
654,usernam need small escap also love usernam jean smile cat face heart shape eye perfect lil sunday httpaddr
655,usernam usernam usernam pictur
656,fuck usernam
657,usernam usernam white shirt wear usernam shirt session went well
658,usernam ooo
659,usernam usernam usernam usernam usernam usernam usernam usernam usernam usernam usernam drama love nerd face
660,usernam usernam usernam usernam think get knumber compar other size calib
661,usernam usernam usernam usernam usernam matt look sad
662,usernam revient en forc et ca nou rend tre tre happi httpaddr pictur
663,stockist supplier industri lead brand includ usernam usernam usernam usernam usernam usernam usernam usernam usernam usernam usernam usernam
664,sure would like maker work wear construct would take effect plu size women work kind place need size number number smh usernam usernam pictur
665,usernam usernam hashtag
666,usernam usernam usernam cute
667,last chanc usernam around long enter competit httpaddr pictur
668,usernam usernam progress republican comment men wear usernam would good time comment union worker wear cloth
669,usernam usernam eks cav kick much fire fire fire fire athlet shoe
670,voltimum take look latest hashtag hashtag avail usernam usernam usernam keep warm hashtag httpaddr
671,usernam usernam work short got mani year ago festiv cost psnumber
672,usernam usernam usernam number_seventeen satsuchiya katakana hiragana prolong sound mark katakana hiragana prolong sound mark katakana hiragana prolong sound mark n ohayougozaimasu zao kukaranoriha katakana hiragana prolong sound mark saru ben dang niopi reyang deshitaa _ _ mkiyatsupuga liang kuosi ide metsuchiyakatsukoii tsu djin ri noben fan deha luo chizhao ite le shiminagara satsuchiyannomei li wo itsupaiapi katakana hiragana prolong sound mark rushit wan zhang tsutelai texia saimas
673,usernam usernam usernam usernam usernam yesss
674,usernam usernam love
675,usernam sponsor kid stop wear dicki httpaddr
676,wear usernam everi singl day life usernam sponsor hashtag x hashtag
677,usernam pictur
678,usernam usernam usernam first thought exactli
679,usernam high demand find fit sd roll weekend hashtag hashtag httpaddr pictur
680,dicki new lineup tee dragon ball fan comet httpaddr
681,usernam usernam wow good one babe
682,usernam usernam usernam usernam thank heavi black heart
683,nuevo refresssssssh sparkl person rais hand celebr emoji modifi fitzpatrick type number ok hand sign emoji modifi fitzpatrick type number cami pant gorra tabla en tienda globe meridian httpaddr number patin state neighborhood skateshop barcelona hashtag hashtag hashtag hashtag hashtag hashtag hashtag hashtag usernam pictur
684,usernam usernam deserv shit g flex bicep hundr point symbol
685,hashtag hashtag style usernam websit waaay tha uniform plu free ship minimum especi x seri denim young men teen dicki gear junior httpaddr
686,usernam usernam usernam usernam usernam usernam usernam usernam usernam usernam usernam usernam usernam usernam usernam usernam face tear joy face tear joy face tear joy
687,like usernam short
688,usernam usernam yeah bless heart costum design usernam
689,usernam usernam usernam usernam usernam usernam pictur
690,usernam scrub fade tho think face
691,new orlean made usernam shirt skinni poppin california made pant popular wore back number big ass cell phone pocket one matter fact aint cell phone pocket
692,suppli dicki workwear hardwear durabl perfect trade also embroid print compani httpaddr hashtag hashtag hashtag hashtag hashtag hashtag hashtag hashtag hashtag usernam pictur
693,usernam usernam usernam iranwakonnan
694,usernam reason work short pant size drastic differ bare button number short number pant fall without belt deal
695,wish usernam hit model contract face tear joy
696,usernam usernam random ass collab lol
697,usernam usernam usernam usernam usernam usernam usernam usernam usernam usernam usernam usernam usernam usernam usernam usernam ha ha cad mr p
698,usernam usernam usernam true sksksk
699,move mountain usernam usernam hashtag hashtaghashtag hashtag hashtaghashtag pictur
700,usernam usernam pictur
701,usernam breweri collect shop great style httpaddr pictur
702,usernam usernam thought ir ghostbust distanc richard entri sign
703,repurpos old usernam boot hashtag inspir usernam pictur
704,thx usernam sensat support big fat ars age love grant x pictur
705,proudli wear usernam dicki pta shirt ladi good counsel school pta committe wear famili fun day helper wear usernam hi vi vestshashtag hashtag httpaddr
706,usernam thank usernam sponsor prize httpaddr
707,usernam usernam met would like one shirt made canadian girl day region indic symbol letter c region indic symbol letter pictur
708,usernam usernam usernam usernam usernam usernam usernam usernam usernam usernam usernam well mint app like normal video thing im minc bag technolog fix boiler dunno use phone face tear joy face tear joy
709,usernam usernam wear black red yeezi hell ye
710,usernam usernam usernam weari face weari face weari face
711,usernam usernam god bless
712,usernam usernam usernam sent dm call hand emoji modifi fitzpatrick type number
713,usernam usernam usernam clink beer mug
714,usernam guy still make differ color pant work pant jean hashtag use rock red green babi blue prison orang seem find store anymor hashtag hashtag
715,usernam usernam brother stuff post make porn star blush smile face open mouth hashtag
716,usernam usernam usernam usernam well done heavi black heart parti popper
717,guy unpack new tool check newest project come along wait see babi complet hashtag hashtag usernam pictur
718,fresh fashion union la custom usernam capsul collect httpaddr hashtag hashtag pictur
719,usernam usernam usernam cloth make man fool wear tie r u suggest men suit abl leader
720,usernam usernam ayeeee fire
721,usernam usernam x hashtag short store perfect ride warm weather httpaddr
722,usernam bring pant alreadi foo
723,usernam usernam usernam usernam glad feel like confid slightli smile face
724,appar usernam live world women work pictur
725,usernam hey usernam order httpaddr box came label cut rate usernam cloth insid joke need sort sort facil friendli remind wear usernam coveral day day
726,usernam usernam ed essenti men pictur
727,usernam usernam hashtag usernam rejoin usernam summertim sportswearaft join forc httpaddr
728,usernam usernam usernam perfect face tear joy
729,usernam usernam usernam
730,ugh number year usernam bc even number anniversari encor im readi festiv happen one far away citi w artist big britch pout face bring back usernam asap close enough smaller
731,usernam usernam usernam rock usernam magazin logo black black usernam number oliv usernam ave usernam harajuku tokyo httpaddr pictur
732,usernam appreci new fit agenda person fold hand emoji modifi fitzpatrick type number person rais hand celebr emoji modifi fitzpatrick type number
733,hey usernam love coveral hashtag could dmme nashvil stockist hashtag
734,usernam usernam usernam jin ri nodong hua ping jia yin sazunix kimashiyo
735,got usernam mother fucker shop
736,usernam usernam need pic charl thank upsid face
737,number year old man wear usernam complain babi mama httpaddr
738,usernam hey probabl number number year ago bought backpack seem recal lifetim warranti bottom start fall apart wonder warranti still appli year use
739,usernam make cloth usa
740,usernam usernam anoth solid win
741,usernam think realli wrong girl relax fit pant cost moneysymbnumb men work pant moneysymbnumb cost twice much make exploit femal custom
742,usernam usernam pay go watch leed co way hell
743,usernam usernam open today numberam till number numberpm usernam usernam usernam hashtag hashtag hashtag hashtag httpaddr pictur
744,usernam hey stuff wear hang wear everyday
745,dicki number work pant number anniversari music video httpaddr via usernam
746,today number chad chaffin usernam dodg power stroke diesel number usernam hashtag
747,get extra petit size pleas usernam pictur
748,usernam usernam usernam dotard wear yuge tie enough said
749,usernam usernam usernam yo soy fan de timberland laten mucho hashtag
750,usernam usernam usernam usernam usernam usernam good luck
751,usernam usernam usernam beauti heavi black heart
752,usernam usernam gentl brother love work creat content promot market purpos regist compani great servic
753,usernam usernam usernam wish gonna come back worst face roll eye ur toxic person ruin timothi fandom u know right
754,usernam work wear lil twist fire pictur
755,less week go til hashtag excit huge thank sponsor usernam sponsor award contribut colleg life progress earli colleg award hashtag
756,usernam usernam steve zissou lookin like whole snack haha face stuck tongu wink eye
757,usernam usernam usernam usernam get hi vi women size shape tri person geeza one fine occasion wear see find
758,usernam spoke jennif w today help resolv issu boot thank much got custom life thumb sign emoji modifi fitzpatrick type number
759,usernam find number pocket dungare jean anywher includ web site pic retail need pant abl go job site high level manag meet back job site good option pictur
760,usernam usernam hashtag
761,fyi usernam allow ship usernam dicki yoy might want offer option longer order want anyth fedex hashtag hashtag
762,usernam usernam nice smile face smile eye
763,break usernam hashtag show tonight usernam usernam shot
764,usernam gunna make belt wide belt loopsasshol
765,usernam south africa shortag dicki overal dicki shop sell
766,decouvrez la collect usernam httpaddr
767,usernam usernam pictur
768,usernam usernam usernam usernam usernam sure let hope look great dicki pictur cross finger lot dicki ad michael purpl heart
769,usernam nao param de chegar novidad para teu verao camisa quiksilv calco usernam teni httpaddr
770,usernam usernam look person fold hand
771,usernam usernam make comeback tour
772,usernam husband use overal number time zipper broke call number hashtag ignor custom servic rep never buy dicki stand behind product work cancel order
773,thank hashtag rt mention like interact rememb today red friday w white privileg wore pink tee purpl usernam nurs httpaddr
774,usernam usernam dayo
775,usernam usernam slim straight real one
776,entr lo favorito de millenni del vasto catalogo de pantalon usernam se encuentra el xdnumber un comodo pantalon gabardina con cort ajustado pierna entubada dispon en color cafe arena deslavado azul marino oscuro que pued utilizar en ocasion informal pictur
777,free jean usernam httpaddr
778,done thank chanc usernam usernam entir famili cannot beat term valu moneysymb heavi black heart
779,would think pair usernam work pant would last longer two week seam break cut hole button worst experi ever cloth wast money
780,usernam final got break usernam short smile face sunglass uta tri save live peopl httpaddr
781,usernam liter cannot rememb want rememb life without wonder trouser five pair dream five love x pictur
782,la nueva coleccion de usernam esta inspirada en la cultura chicana httpaddr pictur
783,usernam usernam happi person rais one hand emoji modifi fitzpatrick type number zero width joiner male sign happi person rais one hand emoji modifi fitzpatrick type number zero width joiner male sign happi person rais one hand emoji modifi fitzpatrick type number zero width joiner male sign
784,usernam usernam usernam usernam usernam usernam usernam usernam usernam usernam usernam nice one chap
785,usernam usernam usernam immatur omfg
786,usernam usernam usernam usernam usernam usernam usernam usernam usernam usernam usernam usernam usernam good luck come season
787,usernam usernam look good
788,usernam usernam need eisenhow jacket
789,usernam might make yo spokesperson httpaddr
790,usernam usernam dope hundr point symbol
791,usernam usernam hashtag pleas rt prefer httpaddr
792,want usernam sponsor
793,usernam usernam stun ever say anyth wast word handsom man like face throw kiss
794,omg guy usernam usernam sent best packag ever weari face smile face heart shape eye person fold hand hashtag ye usernam x usernam jacket hashtag hashtag pictur
795,look powder blue usernam find
796,usernam usernam usernam dope pic fire fire fire
797,usernam come spring x zero width joiner male sign smile face sunglass bomb hashtag usernam httpaddr
798,usernam usernam usernam hahahaha true best thing happen hapen someon wear scarp
799,numberelementsshop usernam usernam no trae lo clasico en forma de pantalon chino corto para lo que se alejen del ajustamiento generalizado dispon en numberelementsshop todo est veranito hashtag hashtag hashtag hashtag httpaddr pictur
800,blockstar comet usernam usernam httpaddr
801,usernam usernam usernam usernam usernam usernam usernam usernam post pictur wear overal dress shirt nike pippen basketbal shoe
802,number race number differ locat across countri differ challeng terrain weather big thank usernam venu build crew volunt spartan make memor race weekend crush aroo hashtag pictur
803,usernam usernam face tear joy roll floor laugh
804,usernam usernam usernam also heard great thing usernam
805,usernam usernam happi person rais one hand happi person rais one hand happi person rais one hand look
806,usernam usernam usernam sound campaign strategi wagner go guy attir beach kid let wonder fact kill suburban gop
807,watch bbc hashtag girl clean bandit wear usernam boiler suit love clearli cool enough know name hashtag
808,usernam great usernam thank share
809,dicki dope httpaddr
810,usernam well said
811,still wear usernam trust im faith slightli smile face
812,usernam usernam hello wave hand sign
813,usernam usernam get pair
814,_juemi_ usernam usernam _juemi_ hashtag httpaddr pictur
815,usernam dead cherri red sued inspir red usernam pink leather interior tire face tire face tire face tire face tire face tire face tire face tire face tire face tire face tire face tire face skull tire face tire face skull skull skull skull fire fire fire fire fire fire fire fire fire httpaddr pictur
816,usernam usernam usernam face open mouth cold sweat sparkl fire
817,usernam fact usernam har new big dick energi meme show social media person suck
818,usernam usernam ja feel ja definit feel smile face sunglass
819,usernam numberakosu usernam thank smile face smile eye jin du yi xu nixi zhen wocuo roun thumb sign
820,usernam pant usernam pant
821,usernam dicki exhibit thanxxx usernam usernam usernam person fold hand person fold hand person fold hand hashtag hashtag hashtag httpaddr
822,usernam usernam
823,usernam usernam sometim ass make thing cannot make pot done clap hand sign clap hand sign pictur
824,usernam usernam pictur
825,usernam pack readi usernam time tri someth bit differ usernam junior super sport miss bike hashtag grimac face
826,usernam check dm
827,usernam usernam wear lowan_offici usernam dicki perverze_offici use draupnir usernam httpaddr
828,usernam usernam shirt better usernam shirt
829,usernam usernam feel like internet cash hashtag hashtag yet countless shot work lol
830,usernam usernam usernam usernam usernam yep number usernam marshal sound like good incent hint hint
831,usernam got hole trouser like number month wear know pant mainli worn art student like come like psnumber work heavi duti trouser
832,love usernam peopl hashtag
833,anyon usernam connect need get usernam line coveral roll least talk model opp hashtag hashtag pictur pulpit rock brew compani
834,cute pic usernam event yesterday heavi check mark chequer flag yellow heart usernam pictur
835,becom brand rep usernam
836,usernam pictur
837,usernam need next weekend usernam
838,usernam usernam usernam usernam yeah potato salad
839,usernam new usernam roanok shirt part macho beard co collabor dicki one five design featur small artwork print chest larger print back also dicki httpaddr
840,usernam sinc number pictur
841,realli fuckin lame usernam femal version actual use work wear like coveral dicki girl add insult injuri call grown ass women girl
842,realli wish donat usernam high school use wear black one almost everyday number year straight middl high school
843,conhashtag number see get usernam fucher new cold war kick old transport plant hire war get put area run datebas usernam usernam shock couor
844,usernam usernam usernam usernam usernam need check httpaddr
845,usernam dope ass work cloth
846,usernam usernam galaxi
847,usernam usernam rockin look mate wink face
848,usernam greatest compani planet earth
849,usernam usernam usernam usernam usernam usernam usernam u good sort yr kit look look good grin face smile eye thumb sign
850,usernam usernam posit exampl alway need thank
851,usernam would pair usernam maroon color almost number year
852,load usernam pant choos make sure check blog find perfect httpaddr httpaddr shop httpaddr pictur
853,usernam usernam think need go warehous crown next crown train station get help hashtag produc supplier
854,usernam usernam like lot
855,usernam big head shave dr_dunc new dome piec dickieslifeoffici usernam usernam httpaddr
856,hashtag merch usernam smile face heart shape eye smile face heart shape eye need right video credit hashtag hashtag pictur
857,get workwear hip mani newish compani make fake usernam hi viz pant enough alreadi
858,usernam want let know bought usernam jacket built hood moneysymbnumb usernam tonight great deal origin retail price moneysymbnumb found clearanc rack moneysymbnumb plu addit number moneysymbnumb pay shop around
859,usernam usernam usernam kind babi hope mopar usual crappi ford pick up often use show thumb sign recreat vehicl
860,spot potenti gravi train futur heavili usernam money fund lifestyl slide usernam dm need rememb shake usernam boy number
861,usernam usernam usernam outro piqueeee
862,usernam usernam smile face heart shape eye smile face heart shape eye smile face heart shape eye loudli cri face heavi black heart awww heart
863,usernam usernam usernam order wait process
864,top four camera tongu usernam usernam getolympu pictur
865,usernam usernam sell stock keep sock
866,well usernam accord usernam normal wear tear boot number month cover warranti buy usernam
867,usernam great pay moneysymbnumb ship return pant big deter reorder maaaaan half price dang ol pant
868,usernam usernam thank put skate coveral usernam kill game
869,today go tri make usernam boiler suit look fashion stay tune pictur
870,usernam twin citi find store carri doubl knee pant actual store need tri buy
871,usernam new santa cruz action shop look usernam usernam onlin store usernam hashtag hashtag hashtag hashtag hashtag hashtag hashtag pictur
872,cold drizzli stop earth revolut hashtag ergo need plaid short sleev soon usernam usernam usernam right httpaddr great deal smart hashtag
873,usernam usernam usernam pictur
874,usernam usernam usernam usernam news make errect
875,usernam usernam usernam assum offer wear contract nation ambul uniform
876,usernam best costum servic weari face pictur
877,usernam numberakosu usernam fresh asf heavi black heart
878,usernam usernam usernam mai wane katakana hiragana prolong sound mark yo
879,usernam dicki life
880,usernam perfect usernam thumb sign thumb sign thumb sign
881,usernam usernam sweet
882,usernam usernam show better build car compet number readi see build car
883,usernam usernam usernam correct wear capri pant face stuck tongu wink eye
884,usernam que el mal tiempo te fastidi la primavera proteget del frio la lluvia con una gran seleccion de canguro cortaviento usernam que nada te pare cloud tornado hashtag hashtag hashtag hashtag hashtag hashtag paralel store
885,usernam usernam usernam thumb sign emoji modifi fitzpatrick type number thumb sign emoji modifi fitzpatrick type number thumb sign emoji modifi fitzpatrick type number thumb sign emoji modifi fitzpatrick type number thumb sign emoji modifi fitzpatrick type number thumb sign emoji modifi fitzpatrick type number thumb sign emoji modifi fitzpatrick type number thumb sign emoji modifi fitzpatrick type number
886,rt usernam usernam one shift warehous bought usernam friday pick saturday even worn work yesterday pictur
887,usernam usernam usernam usernam usernam asian usernam usernam usernam us hashtag domest product hashtag number_gam usernam usernam moneysymbmtch worth valu afford product usernam best usernam usernam hashtag usernam
888,heavi heart say nearli number year togeth week part way two dicki pant one irrepar tear one broken zipper thank constant life past year broken heart pictur
889,usernam usernam spikiri son
890,usernam usernam never weigh waist shrink one meal day omad might best start number number number number googl jason fung go
891,usernam usernam come number order
892,usernam usernam usernam fuck nut
893,usernam usernam pictur
894,usernam usernam bought two numberpack crew sock walmart decemb one fruit loom dicki last pair fruit loom sock hole dicki sock hole quit unexpect pictur
895,today say man sport red cargo kilt hate say usernam explor option
896,usernam usernam usernam usernam haiii banamanga uletha umlilo face ok gestur emoji modifi fitzpatrick type number zero width joiner male sign hand index middl finger cross emoji modifi fitzpatrick type number
897,usernam usernam usernam usernam usernam found jacket fit wear anyth tshirt stiff materi
898,usernam usernam usernam nobodi realli care wear tie want serv peopl
899,usernam tri usernam jean x
900,usernam usernam usernam tupac twitter httpaddr mizzi pl sing somewher maria ws stori dicki w thug life enscrawl face savour delici food
901,usernam _peaceofmindco usernam usernam need
902,usernam rememb use number shade like cross current charcoal navi lighter call dusti blue stop chanc make thank
903,usernam pictur
904,sun leg dark sunglass shop great rang hashtag short onlin brand includ usernam usernam usernam black sun ray black rightward arrow httpaddr hashtag hashtag hashtag hashtag hashtag hashtag pictur
905,usernam usernam fire
906,usernam usernam usernam usernam usernam lol
907,mi usernam son de la suert four leaf clover green heart
908,usernam usernam usernam underst
909,usernam suppos funni pictur
910,god good featur editori usernam x usernam releas get dicki collab full stori click link httpaddr pictur
911,usernam usernam usernam like sound guy shirt better face scream fear get one like face savour delici food
912,sierra_tal recommend get sturdi pair pant usernam
913,usernam open usernam shop kyoto jing du nosi ting dedeitsuki katakana hiragana prolong sound mark zunodian gakai dian shimashita pictur
914,usernam usernam dicki chuck offici uniform play pop punk band number
915,usernam usernam usernam congrat usernam usernam other major achiev
916,usernam r u e r dt r u e r usernam hashtag hashtag httpaddr pictur
917,usernam usernam someon think way hard
918,usernam usernam galaxi well technic ltd clark w griswold would proud pictur
919,usernam smile face sunglass httpaddr
920,usernam usernam oh take back follow
921,usernam usernam home
922,usernam regret httpaddr
923,let us know receiv usernam number number hashtag jacket psnumber want see great safe look two tone jacket absolut hashtag httpaddr pictur
924,usernam usernam short
925,usernam employe harass custom bull crapola roofer st croix sweat alot employe insinu piss usernam get lunch realli make us question left famili come treat like shit usernam
926,day number hashtag design initit present colour usernam skateboard deck hashtag hashtag hashtag hashtag hashtag hashtag hashtag hashtag pictur
927,hey usernam uhm ever plan restock pleas thank pictur
928,usernam usernam usernam usernam number motion
929,usernam usernam usernam usernam cargo pant love dicki cargo penpocket cell phone pocket pant combo cargo short usernam
930,usernam bought two pair usernam everyday workwear trouser size number final painter trouser fit comfort realli inexpens tad long short love
931,hey usernam usernam wanna explain packag arriv condit pictur
932,usernam insist spam email bot even server time request stop deserv custom usernam usernam usernam
933,creat cloth line street wear base usernam hundr point symbol hundr point symbol
934,usernam pictur
935,usernam usernam thank fella ok hand sign emoji modifi fitzpatrick type number
936,usernam usernam serious amaz congrat babe deserv heavi black heart green heart heavi black heart green heart
937,_omnificent_ ever happen rapper wear usernam suit hashtag pictur
938,usernam need usernam start make work shirt hawaiian print work like dad look like uncl bonu hawaiian shirt iron stain show
939,usernam usernam usernam usernam fire ok hand sign emoji modifi fitzpatrick type number hashtag face savour delici food hashtag
940,usernam usernam usernam usernam pictur
941,sun still httpaddr cool hot weather larg select work short httpaddr size avail navi blackpric start psnumber dicki portwest pictur
942,excit day top usernam project fort worth tx proud work usernam impress new arena congrat beck usernam usernam usernam mani other tremend project mileston hashtag hashtag pictur
943,usernam usernam usernam usernam _redlightgo usernam usernam usernam usernam usernam usernam usernam usernam ikaw boi sino kasama mo
944,usernam well usernam sign buy guy pant
945,usernam usernam hashtag great weekend thank thumb sign pictur
946,usernam usernam fire
947,usernam usernam usernam usernam usernam idea shirt struggl find
948,distrust heller enough usernam might want take look involv someon compet next dicki girl httpaddr
949,usernam usernam oh yeah wank
950,usernam usernam usernam usernam pue un llamado la autoridad e inversionista de maquiladora usernam por favor se instalen en usernam instalens en usernam usernam
951,usernam usernam usernam usernam usernam usernam usernam usernam dream team smile face heart shape eye
952,true usernam need httpaddr
953,usernam usernam usernam yeah see lol mara know would murder shoot rais fist flex bicep
954,usernam usernam give look thank
