,tweet
4551,usernam usernam usernam usernam yasss person rais hand celebr emoji modifi fitzpatrick type number
4552,usernam usernam nikogda ne pol zovala upakovki taki klassniuchi
4553,usernam usernam lie
4554,order first usernam hug face cloud paint beam puff glossier perfum
4555,got first usernam order first time beauti compani recogn makeup look need three item boy brow conceal lippi final feel seen
4556,usernam usernam usernam usernam usernam usernam usernam link incorrect give error page
4557,brow done year think happi full au naturel bit pencil usernam boy brow door pictur
4558,usernam direct consum beauti brand usernam rip hashtag playbook httpaddr pictur
4559,usernam ask want order one item get free ship httpaddr
4560,right thought chill day rememb ran usernam moistur
4561,usernam usernam
4562,usernam realli tryna turn hoarder face tear joy grow heart packag cute cherri blossom
4563,want everyth usernam eye eye thx bye
4564,usernam tati would love usernam review especi lip product store uk buy onlin review rare trust opinion
4565,went usernam canyon look dewi asf let appreci pictur
4566,omg care great shit wait number minut line numberdeg day usernam face roll eye
4567,usernam usernam tu la kann face tear joy wani nnt updt psai serum tu pl
4568,usernam hi send free product bc poor advertis let everyon know wear glossier love bye
4569,usernam usernam love johnathan
4570,time brilliant basic game chang gadget number product team love right httpaddr ft usernam usernam usernam usernam usernam usernam usernam usernam usernam usernam usernam usernam
4571,usernam pet peev know bottl gonna run cri face cri face
4572,look strenght usernam pictur
4573,usernam usernam usernam yay love locat hang flatiron smile face sunglass
4574,mani ppl wait line usernam mom wait line buy stuff mom ask pick lol
4575,love usernam perfect skin tint sparkl pictur
4576,usernam ur perfum made httpaddr httpaddr smell divin
4577,moment lose cap balm dotcom work tire face cri face sneez face usernam
4578,told friend wear full face usernam realli number hour sweat believ
4579,usernam longer offer subscript option went purchas lash stick deliveri everi month show
4580,receiv amaz custom servic life usernam shook
4581,usernam thank
4582,glossier usernam close battl two brand war onlin awar kiss mark check httpaddr learn pictur
4583,usernam lash slick okkkk pictur
4584,usernam usernam usernam need daili routin done
4585,usernam usernam pictur
4586,got usernam packag yesterday soon open boyfriend said yaayyy sticker lol love thing
4587,flip knew usernam usernam stan pictur
4588,wonder ye usernam mascara bee knee
4589,usernam usernam usernam black heart suit black heart suit black heart suit
4590,especi usernam moneysymbnumb lipgloss lmao loudli cri face httpaddr
4591,got one best tag usernam post head big think cool enough chat usernam lime water
4592,call basic number makeup routin usernam live
4593,usernam usernam tayo magkakaroon hahahahaha
4594,hey usernam lash slick hashtag got hottest sweatiest meltingest london summer live memori without singl panda face eye day smile face sunglass thermomet fire
4595,usernam usernam birthday gift idea cough cough
4596,usernam hi issu tri order websit last night sent dm chanc help
4597,serious though usernam best creat instagram stori content person rais hand celebr emoji modifi fitzpatrick type number number cloud pictur
4598,usernam usernam usernam usernam usernam usernam usernam usernam usernam usernam usernam usernam usernam usernam usernam usernam alway found pay attent compani place ad unexpect channel startup use tv ad billboard subway ad high ad spend corpor use social notic ad stand undifferenti nois
4599,usernam site make imposs purchas thing let select canada seem like even option mobil wont let login account
4600,usernam usernam canyon glamour shot
4601,usernam protect sun two heart sun face sun face sun face
4602,tomorrow place number product order usernam friend back home pray number
4603,mine broke morn loudli cri face usernam still love u tho httpaddr
4604,usernam usernam realli
4605,click wanna get number first purchas usernam httpaddr
4606,usernam usernam usernam yea girl struggl adult acn korean product thing clear skin check compani though
4607,hashtag usernam usernam usernam person account love follow usernam usernam usernam usernam name great inspo
4608,anyway check usernam review httpaddr
4609,usernam hire pleas
4610,go easi use makeup pick lipstick httpaddr hashtag usernam usernam usernam usernam usernam usernam pictur
4611,usernam usernam usernam usernam heavi black heart
4612,usernam usernam gotta wait cash inject lip inject u feel
4613,usernam releas toner need
4614,let known usernam lash slick stay though long teari meet academ advisor morn number number smear smudg
4615,liter went usernam websit everyth cart came like moneysymbnumb got rid colleg budget allow loudli cri face face tear joy
4616,thank usernam know need today pictur
4617,mani usernam pouch need long weekend away number answer number pictur
4618,love usernam pleas work magic anoth stapl product make eyelin hood lid smudg crystal ball unicorn face tulip
4619,lost usernam balm dotcom cap flight back home rip broken heart pictur
4620,usernam usernam usernam usernam usernam usernam usernam usernam usernam dead set want cri brand everywher zero access loudli cri face
4621,lost usernam lipgloss serious heartbroken start griev process purchas condol welcom tire face loudli cri face broken heart broken heart broken heart pictur
4622,imagin usernam made cream highlight cloud paint formula eye sparkl
4623,usernam usernam ridicul
4624,usernam boyfriend use entir usernam rang like water loudli cri face loudli cri face loudli cri face loudli cri face
4625,order new product usernam excit tri updat channel hashtag hashtag hashtag hashtag hashtag hashtag hashtag
4626,usernam usernam know ok
4627,usernam pictur
4628,two new obsess anyth usernam recommend buy hug face usernam usernam pictur
4629,usernam repli stori loudli cri face
4630,exfoli cover entir bodi usernam bodi hero im feel like sleek dolphin
4631,day victori hand usernam imagin checkout screen usernam inspir usernam victori hand absolut favorit pictur
4632,glossier lash slick good actual look forward put mascara pictur
4633,one day one day step foot usernam store everyth okay
4634,usernam usernam sound like dog owe money
4635,usernam usernam glossier truth person rais hand celebr
4636,usernam usernam new info hashtag pictur
4637,usernam found place tini cute sticker come usernam order smile cat face heart shape eye bicycl pictur
4638,usernam nice
4639,griev loss sweet puppi day think usernam packag stolen might thing put edg face open mouth cold sweat face open mouth cold sweat face open mouth cold sweat
4640,glossier launch franc soon think gonna collaps smile face heart shape eye optic disc optic disc sparkl hashtag usernam pictur
4641,emili weiss start usernam chang beauti industri give women control product routin brand make competit industri find httpaddr hashtag hashtag hashtag
4642,usernam make happen she beauti
4643,thank usernam elev alreadi awesom email game amaz cat gif subject line metatag also made day number kudo email market team
4644,usernam worthi caus
4645,hi want tri glossier new line easi use beauti basic leav fresh glow right away use link get number first purchas httpaddr x glossier usernam usernam usernam hashtag hashtag pictur
4646,usernam usernam kind look like giant orchid
4647,usernam old becom new hashtag cost skyrocket brand like usernam gear toward tradit tactic like hashtag tulip tram httpaddr pictur
4648,usernam usernam skin look good anoth note nicest eyebrow clap hand sign emoji modifi fitzpatrick type number
4649,usernam actual brighten entir week look pretti die tri
4650,rip pink usernam bag tsa rip examin stuff pit alway think suspici never fail
4651,usernam show boy wear stuff ig pretti pleas
4652,usernam usernam incred
4653,usernam appli
4654,usernam boy tell friend take home mom
4655,usernam usernam thank
4656,sparkl usernam pop locat come chicago sparkl httpaddr
4657,love usernam gener g sheer matt lipstick much smile face heart shape eye must get shade
4658,usernam usernam hkwm life got english
4659,idea exist world without boy brow usernam
4660,usernam usernam ooooo let know
4661,usernam usernam usernam deberia ir chivi esa marca es bien padr usernam
4662,order item want month usernam smile face heart shape eye parti popper
4663,usernam invis shield take madrid sparkl pictur
4664,get usernam bless care packag pleas send milki jelli stuff help girl glow take cute selfi
4665,usernam usernam kind wholesom content
4666,place usernam order feel like pictur
4667,usernam yo usernam kid
4668,usernam usernam usernam usernam lie know paint nail that extent
4669,usernam hashtag face hashtag show hashtag commun hashtag hashtag like usernam creat hashtag involv custom optim experi via usernam httpaddr pictur
4670,usernam pl becom avail australia often care makeup love seen product
4671,usernam usernam usernam come stay tune
4672,girl need find right one someth light nourish tri usernam prime moistur purpl heart httpaddr
4673,usernam usernam need make happen asap tire face tire face tire face weari face weari face weari face weari face
4674,someon shower usernam makeup
4675,treat usernam product two heart two heart pictur
4676,usernam
4677,use usernam cosmet yet makeup bag quickli becom exclus glossier smile face heart shape eye smile face heart shape eye smile face heart shape eye httpaddr
4678,hashtag hashtag team usernam hashtag pictur icon brand templ also discov new mag post white right point backhand index httpaddr pictur
4679,moment devast flight lose luggag usernam solut come back stock septemb broken heart rip clear skin
4680,usernam whenev visit websit chrome glitch stop tri mani time numer day still work want buy lash slick idea go
4681,usernam amaz custom servic made duplic order wrong address email return one order gave full refund said bother return extra makeup grow heart sparkl
4682,usernam desper wonder hashtag restock loudli cri face loudli cri face loudli cri face loudli cri face loudli cri face
4683,know probabl wear sunscreen even indoor follow guid chose best sunscreen skin type black sun ray usernam usernam usernam usernam usernam hashtag hashtag httpaddr
4684,usernam ye
4685,happi hashtag upgrad usernam mirror bit carp noctem black heart bat spider skull crossbon pictur
4686,usernam usernam usernam usernam usernam usernam usernam usernam usernam usernam ye girl weari face art amaz glad back
4687,usernam face tear joy face tear joy face tear joy face tear joy cloud paint beam pictur
4688,usernam pictur
4689,element play havoc complexion summer simpl six step skincar routin ensur skin glow summer long read blog post feat usernam usernam usernam usernam httpaddr camera flash glossier pictur
4690,usernam usernam look amaz
4691,usernam usernam usernam usernam tri burt bee better carmex shrug zero width joiner femal sign
4692,got sampl usernam perfum packag today total forgot captiv smell damn glossier tri save money smell like supermodel
4693,great articl rise skintellectu consum way clu brand give credit other includ usernam alreadi har new sourc knowledg httpaddr
4694,subi mi primer video hashtag es un tour en el showroom de usernam en hashtag statu liberti sparkl happi person rais one hand emoji modifi fitzpatrick type number number zero width joiner femal sign two heart aqui el link httpaddr pictur
4695,usernam dm usernam travel size airplan sparkl heart
4696,usernam anyon experi usernam skin care product love dislik like brand price point need chang skincar regimen
4697,usernam la everyth want two heart smile face heart shape eye lipstick
4698,usernam usernam usernam stun coupl two heart p love dress
4699,usernam usernam omfg paintbrush emoji loudli cri face im heartbroken
4700,love usernam email hashtag pictur
4701,met usernam lash slick fell love natur wrote love stori dress kill magazin httpaddr
4702,usernam usernam thing gonna last brow get wet
4703,usernam balm dotcom best lip balm spread word
4704,left hous w usernam tint balm eyelid one tell shit
4705,usernam label absolut disappear mine lol
4706,almost want search trash sticker face tear joy sad end usernam broken heart pictur
4707,new blog post sunscreen review part ii usernam usernam usernam usernam httpaddr hashtag hashtag hashtag hashtag
4708,tri squeez everi last drop mili jelli loudli cri face weari face usernam pictur
4709,usernam suggest total creat love brand beat heart eyelin hair product soap merch would total buy love everyth guy store think mix beat heart beat heart beat heart
4710,usernam usernam ooh ty
4711,usernam usernam mine broke wtf
4712,bikini bikini book book hashtag sparkl usernam hashtag hashtag hashtag hashtag hashtag hashtag hashtag hashtag usernam pictur
4713,usernam usernam usernam wanna know marcel look like
4714,half custom store would prefer research someth social media phone talk salesperson usernam usernam hashtag
4715,usernam usernam stun best brow
4716,usernam best custom servic ever whole wide world im tellin u
4717,treat usernam product today dope brow come
4718,usernam usernam usernam usernam usernam beauti gorgeou
4719,hey usernam took nice photo send free stuff gotta love cloud paint actual cloud pictur
4720,usernam usernam usernam usernam usernam usernam usernam usernam usernam usernam uau que arrasoo
4721,usernam usernam usernam show trick grin face smile eye
4722,final travel usernam milki jelli babi bottl hashtag hashtag hashtag pictur
4723,broken gener g almost finish stretch conceal sad day usernam pictur
4724,usernam usernam usernam tri
4725,usernam amount product brush perfect sparkl
4726,usernam morn use milki jelli cleaner skin feel milki smooth heavi heart exclam mark ornament thank usernam heavi heart exclam mark ornament
4727,usernam gener g lipstick shade like use photo heavi black heart
4728,got first ever perfum complement dentist thank usernam
4729,left usernam moistur ex place think take loss harder broken heart
4730,sad day final ran usernam perfect skin tint disappoint face liter thing wear summer
4731,usernam usernam usernam ugh wow mind
4732,usernam es la mejor noticia que han dadooooo yellow heart
4733,moistur like finish face rose water spray either usernam usernam whatev pictur
4734,yaakaipthamngaanthii thai charact mai ek emrikaa yaakthamkab usernam usernam usernam
4735,look tri new makeup skincar brand recommend usernam usernam usernam hashtag
4736,usernam make money wing money wing money wing per sq ft typic appl store take advantag free usernam trial read gem like articl talk e commerc brand take back brick mortar innov great success electr light bulb httpaddr
4737,usernam oh need
4738,ever usernam launch malaysia ive die tri product
4739,usernam know trick use usernam birthday cake balm hashtag pictur
4740,usernam girl wait line melros pl usernam need coverag glossier
4741,usernam put email number still gotten confirm code smile face open mouth cold sweat
4742,someon give usernam product huhuhuhu
4743,usernam usernam usernam support wife fear clich
4744,fli nyc today know dang well first stop go usernam showroom person rais hand celebr emoji modifi fitzpatrick type number
4745,usernam glossier take experienti market new depth liter check new glossier canyon locat new la locat hashtag httpaddr
4746,archiv number face mist keep cool hashtag httpaddr usernam superdrug caudalieuk avene_uki mariobadescu usernam glossier hashtag httpaddr
4747,usernam usernam would highli recommend experi
4748,thank usernam lash slick stay strong throughout intermitt teari graduat season
4749,beg usernam releas bronzer pictur
4750,usernam usernam cloud paint boy brow haloscop
4751,also dreamt usernam cloud paint especi new shade felt real legit thought still makeup bag woke weari face
4752,usernam glossi vibe kiss mark use je ne sai quoi usernam lip liner usernam lip gloss perfect combo face throw kiss hashtag hashtag hashtag hashtag httpaddr pictur
4753,usernam u big fat hun heart arrow heart arrow heart arrow heart arrow heart arrow heart arrow heart arrow heart arrow heart arrow heart arrow heart arrow heart arrow pictur
4754,usernam usernam two week side side first two week pic around number month pictur
4755,usernam use solut past number day skin seem get bit wors normal fellow hashtag devote notic
4756,stronger custom relationship stronger loyalti custom need stakehold usernam coo build custom led brand scale ok hand sign emoji modifi fitzpatrick type number httpaddr
4757,think ever use anoth lip balm mouth absolut fave get number first usernam order use link white right point backhand index emoji modifi fitzpatrick type number httpaddr thank later inform desk person emoji modifi fitzpatrick type number zero width joiner femal sign pictur
4758,usernam usernam hah know photo look good true unfortun biggest neg review site written anoth droopi lid korean think give tri regardless thank miss
4759,usernam hi yeah um talk get free lifetim suppli super pure serum
4760,usernam need franc
4761,usernam usernam haha help packag icon
4762,usernam usernam serum life
4763,usernam differ formula
4764,usernam lash slick give eyelash life person rais hand celebr emoji modifi fitzpatrick type number pictur
4765,idiot pack milki jelli cleanser cabin bag upsid face make chuck upsid face ok upsid face usernam
4766,usernam absolut heart arrow thank respond
4767,usernam usernam ugh exactli want shop bad cri face
4768,dream smear usernam skin tint face skin becam glowi woke rememb dont ship lebanon loudli cri face
4769,usernam call name two heart sparkl
4770,usernam think make purchas icon disappear accident ad two skin tint cant anyth
4771,usernam awesom makeup
4772,usernam boy brow got look good feel fine sparkl pictur
4773,life usernam like ya b gimmi natur glow live
4774,usernam usernam thank youuuu like spf everi day want light feel everyday spf heavi black heart
4775,dear usernam pleas start ship oversea stop famili member everi time one us travel us thank hug face pictur
4776,usernam usernam yeah cours deal w bad skin long start use face wash broken sinc gonna tri makeup purpl heart
4777,goe camp trust usernam bag raccoon let see charger nah balm dot com heck yeah upsid face upsid face upsid face bewar raccoon perfectli smooth lip grimac face pictur
4778,usernam cc usernam
4779,usernam neeeeed ship australia heavi black heart heavi black heart heavi black heart sun face sparkl
4780,usernam tom usernam usernam three exampl brand go beyond great product servic bring custom commun httpaddr pictur
4781,think face think face usernam usernam pictur
4782,year see less featur function make emot connect josh levin usernam hashtag hashtag usernam
4783,usernam usernam experienti showroom digit nativ vertic brand last hope shop center nail polish
4784,found shade usernam usernam stretch conceal dark never felt spiritu connect icon life
4785,usernam usernam hell ye bodi readi person rais hand celebr emoji modifi fitzpatrick type number number
4786,new case studi usernam use usernam thwart account takeov simpl set eas use hashtag hashtag hashtag httpaddr pictur
4787,omg usernam clear gloss fire wowowowwowow new fave
4788,fav blush take plane journey usernam thing go cri pictur
4789,left favorit usernam balm car melt everywher loudli cri face loudli cri face
4790,usernam usernam cloud paint liter imposs appli much blend like dream even powder cloud favorit puff
4791,usernam usernam balm dot com went seem fave mani grimac face ohhh subject order hope make skin bit brighter glowi
4792,usernam usernam nice
4793,usernam usernam let u know girli beat heart
4794,new video tri usernam makeup final face stuck tongu httpaddr pictur
4795,usernam usernam usernam usernam got marc jacob liquid liner recommend amaz
4796,usernam ugh thank
4797,first usernam order made two heart two heart two heart
4798,usernam usernam sound like need boy brow pictur
4799,usernam secret histori longer human deep work
4800,usernam hire make aesthet instagram account caus thing im good im lost studi
4801,usernam usernam pictur
4802,usernam usernam ok convert grimac face
4803,without milki jelli cleanser number day forgot repack fear usernam showroom come kiss mark
4804,usernam hire cute funni make ur playlist run ur insta page
4805,usernam love boy brow much favourit product ever help feel like much product come brush use tube half quick use
4806,confid level could usernam model want
4807,usernam brand emphasi one one care includ direct engag via social media inspir mani peopl becom brand evangelist known usernam girl clap hand sign emoji modifi fitzpatrick type number clap hand sign emoji modifi fitzpatrick type number httpaddr
4808,usernam usernam top shelf
4809,usernam usernam got solut boy brow
4810,usernam usernam cherri balm dot com
4811,tell usernam perfum broken
4812,usernam usernam usernam usernam mean like corbyn daniel jonah ultim trio
4813,choos usernam life hashtag life chose shrug emoji modifi fitzpatrick type number number zero width joiner femal sign httpaddr
4814,usernam updat makeup add littl hashtag mouth whole lot usernam hashtag pictur
4815,usernam _heymadison boy brow lash slick need solut tri respons budget
4816,full face usernam product usernam test brown skin check httpaddr pictur
4817,make usernam order tonight shall get glow star sparkl heart hashtag
4818,anyon tri cloud paint usernam worth buy
4819,omg usernam gteam member gem gem stone love compani much pictur
4820,usernam ye tast like birthday cake weari face pictur
4821,usernam usernam
4822,convert mom usernam club mom daughter glow two heart person rais hand celebr
4823,usernam usernam usernam usernam usernam usernam usernam omg need either done hanacur facial thought semi preciou stone roller
4824,antelop canyon usernam pictur
4825,wait usernam make deodor
4826,usernam usernam hmmm
4827,nah usernam boy brow httpaddr
4828,glossier glossier realli afford glossier usernam
4829,stun creatur usernam hashtag hashtag hashtag hashtag hashtag hashtag hashtag hashtag usernam httpaddr stun creatur usernam hashtag pictur
4830,httpaddr usernam usernam usernam usernam usernam
4831,know made friend group usernam order
4832,usernam usernam like need beauti product face stuck tongu wink eye amaz without know though heavi black heart heavi black heart heavi black heart heavi black heart heavi black heart
4833,packag usernam get tomorrow god real
4834,woke cold sweat check new usernam cloud paint dream
4835,tell laptop becom breed ground undi need cover world usernam sticker pictur
4836,usernam boy brow lash slick quickli becom coupl favorit thing planet earth sparkl heart
4837,usernam usernam never liquid shadow super interest check
4838,wish usernam loyalti point swim pleas
4839,get usernam birthday cri tbh
4840,usernam usernam thank much come face throw kiss face throw kiss face throw kiss
4841,usernam usernam lush websit late flush face
4842,usernam usernam usernam great idea
4843,last number brain cell least usernam mascara let look cute lay floor
4844,actual best time la usernam usernam usernam usernam pictur
4845,usernam usernam
4846,express inner beauti want mask usernam thank much unamus face unamus face like hate brand think good brand hate peopl drag light coverag like ye know
4847,new usernam make monday better cherri blossom two heart solid version smell good spray better hashtag hashtag hashtag hashtag hashtag hashtag hashtag hashtag pictur
4848,someon get three set balm dotcom usernam thank
4849,usernam usernam want use code give number face throw kiss httpaddr
4850,usernam usernam got good mini milki jelli cleanser new face mist cloud paint lidstar new mascara
4851,usernam usernam
4852,usernam thank babi love tire face face tear joy hundr point symbol sparkl heart two heart
4853,usernam pt number pictur
4854,ctilburymakeup highlight usernam lipbalm usernam eyelin usernam mascara beauti must have hashtag usernam read influenc spotlight httpaddr hashtag hashtag hashtag hashtag hashtag pictur
4855,usernam usernam usernam usernam recal
4856,usernam long take item ship uk roughli
4857,usernam give sticker emo
4858,share pre pregnanc morn skincar routin blog httpaddr usernam usernam usernam two heart pictur
4859,usernam got husband bank card save account time slip get mad get glossi pictur
4860,usernam usernam usernam usernam love carmex pictur
4861,usernam thank u ur strong mascara stay intact harshest meltdown
4862,usernam thank white smile face
4863,fyi usernam lash slick smear cri hashtag coverag
4864,dy hair match favourit lip cheek combo puff crush make feel cute usernam pictur
4865,town cb lost usernam bday cake balm dot calm bu last night drunk man accost quick cri sess tragic thing abl put sparkli cake lip find want rainbow sticker
4866,get invit camp usernam need know
4867,usernam prais
4868,number nom retenir draft point rightward arrow number champion du hashtag digit nativ httpaddr usernam usernam usernam dan usernam hashtag hashtag hashtag hashtag region indic symbol letter u region indic symbol letter pictur
4869,usernam usernam littl dri cleanser use way wors honestli moistur wash face anyway definit big deal
4870,glossier super pure serum chang skin one day tini pimpl textur tzone chin woke clear sm amaz red gone turn skin need lil vitamin bnumber smile face open mouth smile eye smile face open mouth smile eye thank usernam pictur
4871,usernam usernam would love know get back holiday face stuck tongu wink eye
4872,usernam usernam glad work
4873,la marqu de cosmetiqu usernam son esprit ethiqu et sa dynamiqu bodi posit arriv en franc en octobr sparkl httpaddr
4874,caus look cute yesterday usernam hashtag hashtag hashtag hashtag hashtag pictur
4875,usernam nice know thank
4876,usernam usernam usernam usernam usernam usernam usernam usernam usernam usernam she back
4877,usernam usernam u httpaddr
