,tweet
1648,futur belong brand engag custom usernam make happen httpaddr usernam hashtag hashtag hashtag pictur
1649,tip lash hit frame sunglass blink usernam lash slick hashtag
1650,usernam usernam usernam would love tri cream blush rosey ive never tri cream blush way powder chang good isnt
1651,order first product usernam number hashtag first purchas heart arrow hashtag hashtag hashtag httpaddr
1652,usernam usernam def work pretti remind k beauti orang tint use cheek lip
1653,usernam usernam usernam usernam usernam usernam usernam usernam work pant favorit fit comfort httpaddr
1654,usernam use usernam link save number first order heavi black heart httpaddr
1655,muscl memori point come go email log track order bc srsli excit number hour away usernam pictur
1656,usernam usernam usernam clear lip gloss shiney asf move slip
1657,usernam usernam usernam tweet made number u
1658,usernam usernam number usernam bow broynumb usernam eyeshadow primer potion number usernam divin eyeshadow palett tattoo liner troopernumb old mascaranumb usernam metal crush highlight gold skoolnumb usernam liplinernumb usernam lipstick number number
1659,usernam usernam usernam usernam usernam awesom lineup would love hear reid talk usernam paytm
1660,usernam usernam usernam hashtag
1661,motiv list find job lol degbt merchdegcut clothesdegmor usernam degnew camera degblack panther costumedegvansdegpastel stuff pictur
1662,usernam sponsor bc number face routin u love u httpaddr
1663,visit beauti ubud monkey forest turn cheeki guy keep hand usernam tri grab pink pouch huge rip without red clip littl scar definit memor experi loudli cri face face tear joy pictur
1664,usernam ye white smile face victori hand emoji modifi fitzpatrick type number number
1665,even wear blush feel like absolut need usernam cloud paint hashtag
1666,makeup brand crave right definit usernam answer
1667,obsess usernam gener g leo beat heart lion face newest must bag
1668,usernam restock solut peopl beg
1669,big thank amaz usernam svp market usernam session morn entitl build brand hashtag experi compet amazon usernam shoutout learn much wait hashtag speaker pictur
1670,also watch usernam review overcom desper need boybrow cloudpaint die
1671,smile face heart shape eye first tast usernam pictur
1672,usernam usernam dimens number number even good
1673,usernam usernam thank tri mascara start
1674,lost milk jelli cleanser face open mouth cold sweat face open mouth cold sweat face open mouth cold sweat face open mouth cold sweat face open mouth cold sweat face open mouth cold sweat face open mouth cold sweat face open mouth cold sweat face open mouth cold sweat face open mouth cold sweat face open mouth cold sweat usernam
1675,usernam usernam usernam beauti like alway
1676,five minut summer hashtag routin mostli courtesi usernam haloscop crescent moon stone perfect hold summer gloom get number glossier order shop link httpaddr hashtag pictur
1677,walk day noth usernam loudli cri face loudli cri face loudli cri face pictur
1678,usernam usernam usernam usernam usernam usernam usernam usernam usernam usernam usernam usernam usernam usernam usernam usernam alwasi want stori startup lifecycl seen ad nyc subway year saw em wax wane
1679,heck order anoth bottl yesterday could wait gotten mini ugh must wallet usernam
1680,usernam usernam usernam usernam anong shade meron ka swatch ako soon kiss face close eye
1681,happi one year anniversarri usernam rose splash sweat symbol two heart pictur
1682,hai wai serebuyahuatsushiyonisutakaramoren qi ri ben wei shang lu nokosumeburando glossiernomei li nipo rimasu hashtag wai kosum hashtag katakana hiragana prolong sound mark yo katakana hiragana prolong sound mark ku hashtag ben wei shang lu httpaddr
1683,usernam usernam love tri lash paradis
1684,usernam howwww
1685,usernam ya plz hope ship ph could stop bug rel us bring everi time visit
1686,use usernam cloud paint eye go fall
1687,usernam worri sent email sort new one happi clam thank respons
1688,usernam usernam one option get us deliveri address httpaddr receiv packag glossier reship intern httpaddr
1689,usernam usernam ad ye pictur
1690,usernam clear glossier bag guy teas us instagram eye readi
1691,saddest part lose make bag miss usernam boy brow lash slick broken heart
1692,ok appar usernam solut stock septemb want know expect skin
1693,love usernam haze cloud paint like gener g lipstick def new fave black heart suit pictur
1694,usernam usernam usernam usernam usernam usernam anumb great video creator usernam usernam usernam usernam usernam usernam usernam usernam usernam hashtag
1695,usernam come chicago readi two heart sparkl heart tulip hashtag
1696,target ad instagram usernam bag know obsess make guess
1697,usernam hashtag fix problem realli know go
1698,usernam usernam loudli cri face loudli cri face loudli cri face
1699,usernam best custom servic hug face
1700,usernam usernam usernam usernam usernam usernam usernam usernam usernam usernam usernam usernam usernam usernam usernam usernam solid read httpaddr
1701,spend money usernam realis could gotten number face roll eye face tear joy
1702,usernam product would recommend httpaddr pictur
1703,usernam usernam take w huhuhuhaha
1704,uh usernam like pictur instagram number felt heart backflip heart arrow loudli cri face pictur
1705,usernam mascara lash slick fiber hashtag hashtag hashtag hashtag hashtag hashtag hashtag hashtaghashtag hashtag hashtag hashtag hashtag hashtag hashtag hashtag pictur
1706,usernam issu websit
1707,usernam usernam usernam usernam usernam congrat usernam
1708,usernam usernam usernam usernam usernam usernam usernam usernam usernam usernam paint better eyelid whole canva
1709,success stori favorit help take peek effort put brand reach current state one favorit usernam make httpaddr
1710,midst cri say goodby famili move nyc realiz usernam eyelin usernam lash stick stay put whole time cri face broken heart think face flush face hashtag hashtag
1711,usernam coupon link httpaddr
1712,liter three thing wear lip usernam lip gloss usernam pillow plump usernam lip balm ultim trio pictur
1713,usernam usernam clap hand sign emoji modifi fitzpatrick type number clap hand sign emoji modifi fitzpatrick type number clap hand sign emoji modifi fitzpatrick type number clap hand sign emoji modifi fitzpatrick type number clap hand sign emoji modifi fitzpatrick type number
1714,hurt brand began rip usernam make mood board direct follow look everyth straight pinterest brand owner reconsid creativ strategi tactic
1715,usernam pleas give ur product give number page essay fulli detail review good broke
1716,ever see usernam phone app x besid sticker app
1717,usernam usernam ur stun
1718,va el ant despu con hashtag de usernam en mi ojito papujo eye eye pictur
1719,usernam usernam usernam usernam usernam sure standard sinc cryptocollect inher digit mainstream adopt mobil app wallet print option like usernam showcas option like usernam
1720,usernam wish cloud paint could vegan hope one day reformula cloud paint vegan caus realli badli want use
1721,usernam usernam pleas tri hard like caus cute irrit skin dri
1722,usernam thank get theme song stuck head glossier face look triumph
1723,usernam underr
1724,usernam glossier cloud paint dusk blend like dream look super natur blushi nice wash color usernam
1725,freak love usernam moon mask feel soooo good skin reliev face sparkl
1726,know save pink usernam bag thing second order threw first one away tbh never get sad
1727,usernam want thank bottom heart introduc usernam almost two year ago liter chang entir life two heart
1728,vetsfront desk someth smell amaz moi go real well exactli usernam perfum best actual product incred buy number min later behind desk shop w number new bff
1729,usernam honestli like million pound usernam moistur surg anyth usernam usernam retinol dermalift thingi sunscreen everi day alway
1730,usernam usernam think obsess glossier
1731,let talk usernam lipgloss smile face heart shape eye
1732,usernam melanin strong
1733,sheesh usernam custom servic liter best
1734,hashtag kaylaa_k_ number slide present maddiebelloff presentationpassionfruit la croix strawspend moneysymbnumb la croix swimsuitonli number min late workth idea usernam lash stickjenna marbl julien solomita new hous
1735,think usernam make happen eye httpaddr
1736,usernam usernam yay
1737,anyon got usernam code person fold hand emoji modifi fitzpatrick type number number
1738,usernam usernam usernam usernam wear carmex
1739,need want mani thing usernam broke colleg student pictur
1740,usernam usernam want tri bad gotta let us know think revolv heart
1741,usernam usernam usernam usernam usernam usernam usernam usernam usernam usernam usernam usernam usernam usernam usernam usernam version number billboard
1742,usernam nooo pictur
1743,check new usernam locat l pack hashtag appeal includ hashtag packag plenti opportun hashtag httpaddr
1744,kind storm want life usernam cloudpaint storm loudli cri face need u ph real bad broken heart httpaddr
1745,usernam bring back headband pleas would dream come true
1746,lesson usernam presid coo henri davi number use cocreat involv custom everi step number build creativ destruct play tradit market playbook number brand futur engag consum tell stori hashtag
1747,usernam wth thank u im love u
1748,usernam usernam geniu
1749,usernam usernam wear today two heart
1750,realli check went back get number min later parti popper face head bandag usernam pictur
1751,wait autumn like usernam pictur
1752,hi usernam tri access websit uk show moneysymb longer deliveri detail order multipl time loudli cri face loudli cri face
1753,realli upset live near usernam showroom honestli feel like life would chang blue heart sparkl
1754,usernam morn black sun ray black sun ray black sun ray pictur
1755,usernam usernam oooh wanna know like
1756,usernam usernam usernam usernam usernam usernam usernam usernam usernam usernam girl ye smile face heart shape eye person rais hand celebr tire face
1757,usernam thank
1758,usernam usernam hijack ur tweet lash slick layer top usernam total temptat mascara give v similar effect ur ball budget
1759,usernam ok vegan
1760,usernam recent beauti fave almost entir usernam basic doubl roundup use glossier stuff black rightward arrow httpaddr two heart nail polish emoji modifi fitzpatrick type number two heart hashtag hashtag hashtag usernam pictur
1761,usernam thank
1762,usernam heavi black heart
1763,usernam usernam usernam usernam usernam usernam usernam agre brand key dtc consum product actual think brand still import even app think usernam brand messag design system spot got fan larg social media follow immedi
1764,usernam usernam absolut awesom smile face sunglass
1765,usernam know guy technic makeup brand ever think sell phone case know would definit buy
1766,usernam never fail make skin feel amaz xxx tulip sparkl peach hashtag
1767,boy brow usernam chang life
1768,surpris site fun alway notic usernam site access w keyboard navig want abl tab around glossier hit lawsuit violat american disabl act hashtagi httpaddr usernam
1769,liter pranc front door bc got notif usernam packag arriv btw birthday balm dotcom smell better imagin smile face heart shape eye
1770,agre mascara magic usernam httpaddr
1771,usernam understand store london sell glossier product order onlin heavi black heart
1772,usernam usernam look pretti love natur look
1773,usernam think safe take balmdotcom beach heat chang product intern ship live kill abl restock shrug emoji modifi fitzpatrick type number number zero width joiner femal sign
1774,usernam usernam ha ha think food peopl north korea funni
1775,embrac dawn usernam httpaddr pictur
1776,usernam place order today moneysymbnumb rush ship get time trip thursday thank u
1777,usernam need give free makeup need money stuff gold
1778,heavi black heart usernam pictur
1779,usernam usernam put import document mine got clue els lol
1780,teenag cousin flew la visit take day trip new york want visit usernam store consid disown
1781,usernam usernam usernam want one
1782,usernam ye pleas
1783,usernam serious thought go announc glossier candl
1784,sleep tonight know way usernam pictur
1785,usernam make eye cream beg loudli cri face
1786,usernam look good usernam sponsor
1787,usernam thank u much number look saw remot job usa thought ask
1788,usernam usernam wait thing tri love stretch concelear game changer thank usernam
1789,usernam usernam fabul wish bigger tube though
1790,usernam way could get date around avail quebec cant wait anymor
1791,usernam usernam usual hahaha
1792,usernam usernam pictur
1793,usernam got packag today littl sad bc get sticker
1794,usernam look good boy brow wink face
1795,hot weather nice makeup keep slide best look splash sweat symbol realli usernam lidstar though budg got long wear makeup favourit need check hashtag hashtag hashtag pictur
1796,idea usernam open la alreadi
1797,big fan usernam brand stand great articl talk compani gaini success disrupt beauti industri hashtag hashtag httpaddr
1798,glossier latest offer definit bold one httpaddr
1799,everi day fave love recent bit conceal number product good go usernam usernam usernam usernam usernam hashtag pictur
1800,spritz lil brother toni hawk shirt usernam perfum mine noth
1801,usernam thank must milk cleanser use glossier someth like wink face
1802,summer makeup lip balm sunscreen mascara usernam boy brow
1803,usernam usernam dad best lol
1804,usernam usernam hashtag
1805,usernam plu size makeup model thing thing
1806,face smell yummi ty usernam
1807,cannot believ day age someon steal beauti product face open mouth face open mouth face open mouth girl got soap hair mask usernam face mask shame white frown face unamus face
1808,alway tell go spend money expedit ship grown adult find patienc httpaddr news bought insan amount usernam spent moneysymbnumb expedit ship surpris patienc
1809,shortest horror stori live india lost birthday balm dotcom usernam
1810,yup use week never go back anyth els usernam lash slick number wonder world smile face heart shape eye
1811,know love real vivid dream usernam open chicago
1812,welcom rainsvil wave hand sign crocodil x usernam pictur
1813,usernam new product would love tri solut pore need r coupon code avail
1814,summer theme lil sweati lil usernam
1815,usernam usernam glad honestli believ make feel wonder heavi black heart
1816,usernam make hand cream
1817,usernam usernam _gjordan see face pictur
1818,bro need lip balm thing purs usernam birthday balm dig cake scent flavour sparkl
1819,usernam usernam wanna sponsor lolol
1820,usernam best custom servic heavi black heart grimac face
1821,take closer look american beauti brand usernam usernam shake industri shape futur httpaddr hashtag
1822,usernam usernam ok thank
1823,tonight beauti routin also complet made femal own oper brand complet coincid love dizzi symbol sparkl usernam ctilburymakeup fentybeauti lushltd
1824,much hydrat usernam hashtag hashtag pictur
1825,usernam order came mail highli excit tri product btw packag cute
1826,usernam usernam b bar glad hear still go strong decad serv age
1827,usernam showroom dreami ear rice pictur glossier
1828,want tri usernam bad cherri
1829,poc tri everi conceal best list recommend usernam stretch conceal enough formula plump moistur eye area stay put look natur
1830,glossier founder ceo detail nighttim eye makeup routin search perfect deodor favorit scrub pretti controversi httpaddr heavi heart exclam mark ornament pictur
1831,usernam usernam lidstar cub slip
1832,cheek fleek lockscreen fleek dizzi symbol hibiscu x usernam pictur
1833,usernam usernam hashtag
1834,usernam usernam artist palett product detail usernam velvet lip glide bound eyelid usernam moondust palett element magnet usernam holograph glitter prolongwear nourish waterproof foundat prolongwear conceal usernam cloudpaint haze beam cont
1835,gracia dio por el air acondicionado usernam el snicker con helado adentro
1836,usernam new usernam shade especi great skin tone darker side httpaddr
1837,got peeper guy eye check challeng hashtag watch number includ usernam usernam usernam usernam httpaddr pictur
1838,someon pleas stop order everi usernam product
1839,usernam realli good job cloud paint cherri blossom sun face pictur
1840,usernam usernam usernam code automat appli cart use link httpaddr smile face smile eye go get glow sparkl
1841,usernam usernam usernam usernam usernam usernam usernam usernam usernam usernam ahhhhhhhh miss art much jsjsj sparkl heart revolv heart grow heart broken heart two heart sparkl heart grow heart grow heart revolv heart sparkl heart grow heart grow heart grow heart revolv heart grow heart sparkl heart grow heart two heart grow heart sparkl heart grow heart sparkl heart grow heart grow heart sparkl heart amaz pictur
1842,usernam usernam stay splash sweat symbol hydrat splash sweat symbol
1843,see dilemma usernam usernam usernam usernam pictur
1844,usernam realli work heavi black heart
1845,usernam usernam glossier come chicago
1846,somehow usernam oil wash open bag spill bodi wash sad loudli cri face loudli cri face
1847,usernam experi w lash stick today cri boy anyth mascara stay intact person rais hand celebr emoji modifi fitzpatrick type number
1848,ok usernam gteam liter best custom support ever talk
1849,usernam usernam usernam wish taken pic bc even dramat way hope
1850,someon tri almost everi clear lip gloss drug store prestig brand honestli say usernam best lip gloss among thing
1851,hey usernam chanc stop use plastic packag least postag realli want buy bear amount plastic guy use send even tiniest product pleas chang
1852,high tea usernam pictur
1853,hey usernam make eyebrow pencil angl like hashtag brow defin less flaki see perfect duo hashtag
1854,usernam know new mascara perfect
1855,saw lash slick sweep world n u knew somethn elso come usernam come w cloud paint ur broke babi wish u could rosi cheek babi
1856,today blog share skincar item save skin dermat flare feat usernam coupl cherri blossom usernam hashtag two heart httpaddr
1857,thought swatch glossier stretch conceal httpaddr usernam usernam
1858,usernam think realli interest video would full face usernam complet number usual
1859,usernam usernam usernam
1860,mom approv life choic clap hand sign emoji modifi fitzpatrick type number sparkl cc usernam pictur
1861,want go lo angel shop usernam birthday
1862,usernam usernam ur fave cloud paint
1863,tri clean teeth use usernam primer loudli cri face
1864,tri usernam new cloud paint shade number differ skin tone impress httpaddr pictur
1865,sad day skin hate run usernam mega green galaxi pack cri face
1866,usernam shop usernam recent trip nyc thought whole time face throw kiss sparkl heart
1867,usernam attempt milk bar birthday cake told fail eat usernam birthday balm
1868,usernam number discount code provid someon checkout purchas product discount come effect
1869,current watch hashtag episod usernam open usernam packag girl alreadi mogul make
1870,realli want job simpli prepar day usernam ship australia x
1871,usernam pleas sell necklac loudli cri face pictur
1872,usernam need glossier sheet mask pictur
1873,usernam bought cloud paint usernam birthday two heart love best friend
1874,usernam hiya store credit show press buy tri anyway said error
1875,usernam usernam eye lid star woulda bought cleanser much liz earl stuff wanna use first
1876,also rate usernam cri get degre lash still look bomb
1877,new usernam milki jelli cleanser review sparkl heart httpaddr hashtag hashtag usernam usernam
1878,alright kid say chees camera flash chees wedg usernam hashtag hashtag hashtag pictur
1879,beach n bob beachi essenti blog httpaddr usernam usernam pictur
1880,sparkl glossier dizzi symbol usernam hashtag pictur
1881,usernam usernam seen ig look crazi
1882,alway alway use usernam exampl brand understand social media work influenc even budget alway feel like wavelength everi employe spoken super nice ok hand sign
1883,usernam usernam usernam usernam usernam usernam usernam bloodi hell
1884,thank usernam cloud paint
1885,current use usernam milk jelli use usernam micellar water winter httpaddr
1886,vote fave cleanser hashtag hashtag usernam usernam usernam usernam usernam usernam usernam usernam usernam httpaddr pictur
1887,apr ski ear usernam dawn cloud paint hashtag perfect camera flash usernam httpaddr
1888,usernam usernam need shelv look like one day
1889,usernam usernam love lightweight
1890,lash slick much better old mascara thank u usernam
1891,xia ji norinkukarajin hai wai debao fa de naren qi wokua rukosum katakana middl dot sukinkeaburando usernam iwu ganumb offninarimasu cherri totsutemoosusumenanod zehizehishi tsutemiten peach sparkl httpaddr pictur
1892,offici entir usernam makeup collect excit never cake face sparkl kiss mark slightli smile face lipstick cherri victori hand rainbow eye pictur
1893,psa usernam playlist spotifi pictur
1894,usernam today put cloud paint lip work great lip stain innov hire
1895,usernam usernam girl thought someon drag read first coupl word read rest saw usernam sdksksksksd
1896,usernam feel like never right time reorder caus someth new drop time fear face face tear joy
1897,usernam done smile face sunglass
1898,spot somewher along wooster st hope well love loudli cri face usernam hashtag pictur
1899,usernam bought product onlin month ago never receiv sent two email ignor get refund pleas thank
1900,kinda disappoint usernam lip gloss order lot stickier thought everi said
1901,cri usernam hashtag pictur
1902,usernam usernam usernam usernam usernam usernam usernam usernam usernam usernam usernam usernam usernam usernam usernam usernam usernam usernam snark must bc awesom analyt insight
1903,hope usernam order come thing get final hashtag
1904,usernam arriv today n im luvv cute number pictur
1905,travel essenti sparkl two heart usernam pictur
1906,love simpl email smile face heart shape eye ok hand sign emoji modifi fitzpatrick type number thank remind usernam pictur
1907,realli dig affirm mirror repurpos construct wast ok hand sign emoji modifi fitzpatrick type number usernam usernam hashtag hashtag httpaddr
1908,usernam usernam come eye cream want cut profit
1909,glossier fav product pleas make get last product get bottom either scrape cut loss wanna either pictur
1910,final decid product buy usernam hashtag
1911,feel like usernam product peopl minim skincar issu simpli want accentu alreadi radiant skin someon correct wrong loudli cri face
1912,usernam cloud artist palett pictur
1913,abl leav hous today makeup first time month feel crazi self consciou thank usernam heavi black heart heavi black heart heavi black heart heavi black heart
1914,usernam usernam disappoint
1915,anoth year camp usernam upset angri left jealou
1916,usernam etsuton usernam nomasukara tekaonraindeshikamai enaitosi tsutetakedodiao betaraniyu katakana hiragana prolong sound mark yo katakana hiragana prolong sound mark kunidian pu dekiteta xing kitasugiru flush face flush face flush face flush face pictur
1917,usernam usernam ugh
1918,sparkl glam squad appreci post sparkl thank usernam keyla marquez make feel beauti last night hashtag take villag face stuck tongu tightli close eye usernam usernam usernam pictur
1919,true life usernam solut truth especi afford biologiqu recherch pnumber great aha bha product
1920,say good thing come wait say get impati number year still wait usernam bless australia sparkl cri face shrug emoji modifi fitzpatrick type number zero width joiner femal sign
1921,cloud paint new friend roll floor laugh usernam hashtag hashtag pictur
1922,want usernam birthday
1923,love usernam pictur
1924,articl usernam made smile big httpaddr
1925,usernam pleas bless put solut back stock skin confus af pictur
1926,boy brow brown lash slick perfect usernam smile face heart shape eye pictur
1927,usernam usernam usernam usernam oh sexi lip look pictur
1928,usernam usernam usernam usernam carmex day everyday
1929,tbh get tutori suggest pat usernam cloud paint smear shit face wanna look like sunset
1930,usernam took tumbl spray week ruin
1931,realli need usernam get togeth get solut back stock
1932,usernam super natur good makeup makeup day
1933,usernam use boy brow
1934,usernam usernam lmao say repeatedli last night
1935,usernam super happi recent purchas boy brow realli unhappi wast packag find unnecessari pad plastic bag within alreadi pad plastic envelop
1936,wish list usernam gorgeou new shade cloud paint httpaddr
1937,usernam ever come deodor
1938,usernam usernam pictur
1939,constantli hope usernam come eyelin want entir makeup routin glossier
1940,usernam usernam skin first rose juul pod second
1941,usernam pick alreadi go debt anymor colleg
1942,usernam usernam love bed cover need face tear joy melon melon
1943,hey usernam u email discount code bc u recent reformul ur perfect skin tint bought old formula u hit girl anoth code bc new blush bought haul stuff right bnumber drop
1944,usernam usernam beth go hashtag
1945,usernam tri find bag month final found zipper broke sad love much pictur
1946,ok usernam ship quebec
1947,usernam glossier gonna tho face tear joy roll floor laugh
1948,usernam drunk girl bar bathroom level love happen honestli women want compet women want bond boy brow usernam tell great lash look
1949,usernam haha yo im flatter check usernam
1950,usernam go open franc octob kiss mark mouth lipstick x emoji modifi fitzpatrick type number number dizzi symbol pictur
1951,super excit get first lip balm dotcom usernam sticker ladi got get sticker pictur
1952,usernam sweetest ador revolv heart revolv heart revolv heart revolv heart pictur
1953,hi kweensclick link u want number ur first order usernam cherri blossom revolv heart httpaddr
1954,excit tri new cloud paint usernam bouquet sparkl cherri blossom glow star beat heart pictur
1955,usernam parfum lash slick mascara balm dotcom soooo good first disappear proxi warehous could get found get lost dhl forev hope someon enjoy least hashtag
