,tweet
3251,shoutout usernam anoth amaz product launch lash slick bottl pop cork sparkl make sure read review black rightward arrow httpaddr spoiler alert love
3252,usernam wait tri usernam mascara tri two heart
3253,order cloud paint cloud artist palett black heart love u usernam
3254,usernam usernam usernam hot girl buy skincar crew sexi af
3255,usernam love storm
3256,usernam r u clming atlanta
3257,got stuff usernam look video soon
3258,scrap makeup play new usernam mascara mum stop track went wow lash look amaz trust look like crap tell face tear joy face tear joy face tear joy
3259,usernam pictur
3260,yo usernam boy brow life
3261,usernam usernam usernam usernam last bit true product find skin type need need imper clear skin product holi grail could nightmar someon els
3262,wow someon post photo antelop canyon az though usernam showroom la lolololol bye hashtag hashtag
3263,go check new youtub video sparkl beat heart usernam httpaddr
3264,usernam replac usernam boy brow number time shrug zero width joiner femal sign
3265,usernam usernam god damn
3266,usernam usernam basic like cetaphil gentl cleanser overpr cruelti free though
3267,simpl makeup look ft lot usernam httpaddr hashtag hashtag
3268,usernam usernam omgggggggg product smile face heart shape eye
3269,usernam usernam omg ye
3270,usernam usernam order next splurg
3271,usernam recommend bought usernam first time product specif let see goe shall pictur
3272,first ever usernam purchas number month deliber mani product mani see said fuck bought flex bicep emoji modifi fitzpatrick type number pictur
3273,usernam usernam cloud paint beam favourit excit
3274,usernam unreal custom servic
3275,usernam sampl glossier got made boyfriend dick hard purchas full size grow heart
3276,usernam heart
3277,first usernam packag full skin treat arriv today pictur
3278,usernam usernam complet agre buy makeup local drugstor pharmaci check usernam exampl light makeup learn spend lot money though anoth word lip tint sheer lipstick bb cream good start point skin
3279,wanna buy thing usernam mom keep yell whenev use debit card ughhh
3280,usernam heavi heart exclam mark ornament without perfum hashtag pictur
3281,usernam pictur
3282,usernam usernam breakout
3283,come usernam time half number gone last bottl super pure serum half gone pleas least give us timelin ship quebec person fold hand
3284,usernam usernam awwwww sri bad reaction yo take ya hand let link soon
3285,warm weather essenti ft lot cream blush sunscreen face mist budg usernam lash slick wrap pink pouch two heart sun face pictur
3286,usernam pictur
3287,usernam usernam rememb school bare brow
3288,usernam usernam usernam
3289,final ran usernam solut stock weari face weari face weari face so
3290,usernam pleas bring product germani loudli cri face heavi black heart
3291,full face usernam pictur
3292,usernam loveee smile face heart shape eye
3293,go back us first thing buy skincar make item usernam
3294,prime moistur rich chang life usernam sparkl two heart
3295,usernam usernam omg tysm sparkl heart
3296,get x ray knee good news pregnant x ray technician like usernam perfum
3297,wait tri cutiesx usernam pictur
3298,wrap last week ia ai event nyc usernam thank panelist usernam usernam sg hashtag hashtagb hashtag pictur
3299,visit fam two week alreadi got mom hook usernam boy brow pictur
3300,usernam list start ship australia
3301,restock usernam sponsor tbh alway broke face tear joy loudli cri face pictur
3302,usernam usernam awesom wait hear
3303,usernam find showroom pickup
3304,usernam omg would furiou sorri
3305,usernam sorri interrupt wear new usernam mascara tell bought alyssa httpaddr ye know say friendship brand loyalti hashtag hashtag
3306,usernam depend
3307,usernam wow storm look beauti smile face heart shape eye
3308,usernam cool logo
3309,usernam usernam usernam usernam
3310,number hour ago stop usernam ceo street soho told hashtag usernam thank leverag aesthet drive deliv true empower us aspir changemak mean freak namast sparkl
3311,usernam usernam flick wrist clap hand sign emoji modifi fitzpatrick type number clap hand sign emoji modifi fitzpatrick type number clap hand sign emoji modifi fitzpatrick type number
3312,thank u usernam make easi video job without put pound makeup number
3313,stranger told model wear usernam new cloud paint httpaddr pictur
3314,usernam usernam omg
3315,everyth need know usernam store lo angel httpaddr pictur
3316,lose phone still need get pictur usernam besti usernam pictur
3317,buy usernam jumper extra ask friend eye
3318,wait boy brow becom size lash slick anyon els usernam sparkl pictur
3319,usernam usernam activ women bike commut
3320,proof usernam lash slick incred sea today bounc wave stay put day
3321,usernam perman store pleas thank person fold hand emoji modifi fitzpatrick type number number
3322,usernam u look new rep love sparkl ur product tell everyon know would love plug even grow heart grow heart
3323,usernam usernam omg
3324,usernam omfg right liter face tear joy ok hand sign emoji modifi fitzpatrick type number black heart suit
3325,usernam lash slick chang life sparkl yesterday took number hour nap still woke perfect lash sorceri
3326,usernam go avail travel size big question
3327,usernam usernam usernam usernam usernam usernam usernam usernam usernam usernam usernam usernam usernam usernam usernam usernam usernam huge benefit awar till first billboard public transit ad buy prior compani bu ad run chicago number month extra shrug emoji modifi fitzpatrick type number zero width joiner male sign
3328,got new bottl usernam skin perfect tint first cloud paint haze feel like new woman readi take world
3329,final cave bought usernam boy brow recent replac holi grail video even went religion paid ship brow never look better new religion buy whatev usernam say httpaddr
3330,usernam hiya tri order uk work help
3331,usernam pictur
3332,usernam usernam hate peopl wear full coverag makeup talk shit glossier milk makeup bc like natur look like ur thing move
3333,usernam usernam usernam usernam usernam usernam usernam glad like
3334,migo get shot love also usernam serum realli comin thru pictur
3335,look step custom servic game take number lesson usernam take team next level httpaddr pictur
3336,thing prevent leav mascara overnight flake icki feel eye wake usernam lash slick complet obliter gross flaki everi excus leav face tear joy
3337,usernam shoulda got usernam lash slick
3338,usernam usernam usernam usernam usernam hashtag sparkl smile face halo sparkl
3339,usernam hi tri order canada time check countri say us chang
3340,usernam usernam usernam usernam peopl need favourit thing number use
3341,usernam usernam remind kept mine need add suitcas tomorrow morn
3342,mayb problem usernam pictur
3343,usernam usernam yesterday around number
3344,well order item usernam liter none item order sent face tear joy face tear joy face tear joy
3345,hi discount code first time order pleas usernam
3346,usernam usernam usernam usernam usernam usernam usernam usernam usernam usernam queen
3347,usernam usernam relat sparkl tire face
3348,usernam usernam thank clarifi
3349,peopl unlock shop today emili weiss founder usernam talk import custom hashtag hashtag influenc httpaddr hashtag
3350,zara usernam usernam number top brand hashtago retail initi httpaddr hashtag hashtag pictur
3351,hi usernam httpaddr
3352,alreadi feel like new dewi woman sparkl l usernam pictur
3353,usernam usernam appal
3354,live posit patagonia took transpar halo top around hashtag hashtag method usernam usernam abl refin hashtag strategi listen custom feedback httpaddr
3355,usernam usernam think repli wrong person ask imag pale peopl wear new shade websit
3356,ahhhh usernam cloud paint storm look absolut perfect smile face heart shape eye
3357,usernam line outsid nyc show room
3358,usernam usernam usernam usernam usernam usernam usernam usernam usernam usernam usernam meant write ugli nail gift satan guess unholi
3359,need corner sing heart go lost usernam gener g lipstick aka red lipstick make look like joker put
3360,usernam lash stick boy brow far favorit makeup product
3361,squar so usernam lash slick broke sad love pleas help squar so pictur
3362,usernam usernam mostli sad whoever suppos get order got pensiv face
3363,usernam usernam usernam usernam champ make retail experi see latest la store open
3364,left usernam cleanser hotel room bathroom cri loudli cri face loudli cri face loudli cri face loudli cri face
3365,usernam usernam usernam usernam wear chapstick
3366,usernam usernam usernam usernam usernam usernam usernam usernam usernam fuck kat von heard eyeko eyelin good dupe tho
3367,wow usernam custom servic amaz pictur
3368,usernam ah thought may made smaller bottl travel still cool though
3369,want serum fro glossier batido one get usernam
3370,usernam god bless ur brand
3371,usernam chosen perfum big day bride veil emoji modifi fitzpatrick type number bride veil emoji modifi fitzpatrick type number next week wonder sampl could take bag ceremoni loudli cri face pl help lil bride grow heart
3372,well usernam say finger paint cloud paint finger paint tho weari face
3373,hand index middl finger cross emoji modifi fitzpatrick type number number hand index middl finger cross emoji modifi fitzpatrick type number number finger cross mini bodi hero usernam person rais hand celebr emoji modifi fitzpatrick type number number
3374,usernam way add gift note packag see option ribbon
3375,usernam usernam yay girl
3376,realiz usernam soon ship sweden still finland loudli cri face hashtag pictur
3377,three usernam product bought last month becom stapl makeup routin essenti boy brow smile face heart shape eye
3378,usernam hello usernam pleas replac erin collect deserv
3379,usernam usernam schat hoe bestel je het dan met zo een servic
3380,repurchas usernam boy brow number time liter best ever holi grail brow gel smile face heart shape eye sparkl heart
3381,mom sister wear lash slick today guess could call us perfect usernam famili two heart hashtag
3382,usernam reason get websit work input address purchas allow input credit card data purchas seem keep stuck address ship section
3383,usernam usernam shh
3384,use new usernam lash slick mascara honestli amazingggg number number absolut ye go buy
3385,usernam oh
3386,usernam usernam
3387,usernam icon ador much man dizzi symbol sparkl face look triumph herb
3388,usernam want meet face behind brandd heavi black heart two heart two heart person fold hand emoji modifi fitzpatrick type number person fold hand emoji modifi fitzpatrick type number
3389,wonder usernam hug face open store london impati deliveri arriv smile face smile eye
3390,usernam usernam usernam usernam face tear joy heavi black heart
3391,shade manicur basic usernam solut sparkl pictur
3392,usernam new goodi usernam usernam arriv mail yesterday feel feel unstopp usernam
3393,insid glossier intern expans strategi usernam httpaddr via usernam
3394,good skin look atm client derail present tell beauti skin ask product use usernam deiti skincar ordinari usernam di hashtag
3395,ok camp usernam team look fun
3396,hashtag poste par alexandra sur instagram stori hier usernam pictur
3397,first skeptic new usernam mascara watch two episod queer eye miracul mascara face incred
3398,usernam usernam right hourglass brow gel soft brown
3399,usernam usernam nooooo
3400,usernam usernam usernam ty ash
3401,usernam usernam omg ye
3402,give discount boy brow pleas si need usernam pictur
3403,usernam _veemo best trilog person rais hand celebr emoji modifi fitzpatrick type number
3404,usernam sooth face mist hashtag bucket ice
3405,usernam usernam usernam icon look
3406,new video live thing im love month may usernam hope guy enjoy hashtag ytcreator usernam usernam usernam usernam usernam usernam usernam httpaddr
3407,around familiar face worn place worn face usernam pictur
3408,usernam usernam real thing need know skin secret look skin make deal devil sell soul girl tell us smile face heart shape eye ok hand sign
3409,meu sonho de vida e ter balm dotcom da usernam ma eu sou pobr
3410,usernam usernam oooooo help red hyperpigment
3411,usernam usernam im shook
3412,dream boy brow last night think truli call usernam stan
3413,usernam usernam omgg cousin die go
3414,usernam usernam wear makeup home goddamn love shit tri
3415,u wear lash slick ur brow lash u forgot boy brow home sparkl usernam pictur
3416,shout number year old train want know intern summer want go b bar tonight also shout usernam appar fabul skincar routin
3417,someon buy one everyth usernam
3418,serious obsess usernam pictur
3419,usernam usernam sponsor post
3420,usernam usernam siin thai charact mai ek aarakcchang maariiwiwt nthaabnpaakd thai charact mai tho wyaih thai charact mai tho duuhn thai charact mai ek ynakha peach
3421,anyon tri usernam leo lipstick anyon want
3422,usernam store credit referr onlin account use store purchas la locat
3423,usernam usernam usernam usernam usernam roller lash real benefit
3424,usernam usernam hashtag usernam usernam featur exclus discount women fashion makeup appar download app make sure miss futur deal save usernam usernam usernam httpaddr pictur
3425,usernam def go need get hand custom dye import brunch plan httpaddr
3426,would much like go hashtag usernam usernam
3427,glossier usernam simpl design aesthet httpaddr hashtag hashtag hashtag hashtag
3428,usernam glossier take experienti market new depth liter check new glossier canyon locat new la locat hashtag httpaddr
3429,usernam usernam fan
3430,usernam usernam usernam usernam usernam usernam honestli think ihob market strategi backfir offer lot market competit
3431,receiv first usernam packag morn order second number hour later done pictur
3432,link tri usernam yet get number first order httpaddr
3433,actual celebratori chain snapchat sent year everytim full size milki jelli cleanser magic made tsa usernam hashtag
3434,product test week episod usernam lash slick usernam killawatt foil usernam afterglow orgasm lip balm usernam light palett load also includ lol httpaddr
3435,usernam usernam omg mine koyak jdkalfjdk ok gonna let know soon back aa face look triumph pouch nice
3436,usernam usernam tho
3437,usernam usernam founder ceo usernam emili weiss speak futur social commerc usernam number hashtag hashtag hashtag pictur
3438,wear much usernam even funni pictur
3439,usernam usernam ooo review debat get wowder
3440,usernam _hjsxo smell incred got lot mix review guess skin ingredi skin like shrug emoji modifi fitzpatrick type number zero width joiner femal sign
3441,realli wish usernam hire brand ambassador weari face
3442,usernam give usernam vibe hihi sana mura lang sparkl sparkl sparkl
3443,usernam keep pop social media im sooooooo tempt rn
3444,acabo de comprar mucha cosita fe usernam para que lleguen casa de novio full moon face heavi black heart
3445,order two usernam lip gloss lost one even took box found last night time vega pictur
3446,thank love new goodi usernam time tomorrow flight airplan two heart pictur
3447,usernam thankyou x
3448,usernam usernam usernam usernam usernam welp beauti glow skin money onion ring blame
3449,eye match shirt prettttt cool usernam cloudpaint storm top birthday cake balm dot com lip sparkl pictur
3450,panel cut edg businesswomen discuss secret best influenc partnership ft usernam httpaddr via usernam
3451,usernam usernam usernam blair let duet
3452,usernam usernam usernam usernam usernam gorgeou
3453,tonight er told nice eyebrow courtesi usernam usernam pluck number
3454,usernam broken shaker pictur
3455,usernam face throw kiss
3456,usernam usernam would say long last also dewi tysm person fold hand emoji modifi fitzpatrick type number heavi black heart
3457,friday shmood usernam pictur
3458,usernam thank
3459,want spend save usernam smile face heart shape eye
3460,usernam usernam usernam usernam usernam usernam usernam usernam usernam usernam usernam usernam usernam usernam usernam usernam long list campaign run moneysymbnumberk moneysymbnumberk guess moneysymbnumberm gone usernam annual basi grow httpaddr
3461,usernam usernam much bad bitch energi
3462,usernam usernam disappoint one balm dot com pictur
3463,cri lost usernam balm dot com comic con last night loudli cri face alway happen
3464,dream usernam sold new balm dot calm could control mind peopl wear lol wtf
3465,want go usernam store badli alreadi ran boy brow low cloud paint
3466,brought long see like shop usernam along lil show tell gorg bit pick httpaddr pictur
3467,usernam drop mini like pictur
3468,usernam usernam glossier list cruelti free brand list cruelti free mascara love tart mascara tarteist light camera lash essenc lash princess afford altern slightli smile face two heart
3469,usernam sure get ask time could pleas start make travel size product know mani us would happili pay love use mini exact product use home
3470,usernam liter best custom servic go lad
3471,usernam usernam truli man magnet
3472,usernam packag super cute made day white smile face smile face heart shape eye
3473,usernam usernam imagin actual clear enough skin though
3474,lash slick versu nah thank care packag usernam whole offic obsess eye two heart pictur
3475,final got usernam lash slick lemm tell cri slept number hour stuff incred sparkl sparkl sparkl
3476,new post current beauti favourit httpaddr hashtag hashtag feat usernam usernam usernam usernam usernam usernam hashtag hashtag hashtag hashtag
3477,usernam usernam sorri say lit
3478,usernam usernam good use also perfect makeup bubbl wrap protect makeup get smash damag
3479,usernam usernam know gonna need everyth weari face receiv salv coconut usernam last month love wanna tri glossi eye dunno feel coconut smell eyelid
3480,usernam new new two heart hashtag hashtag hashtag pictur
3481,sinc day one cloud paint haloscop first time sport stretch conceal suprem verdict everi make make feel like skin went heavi blanket float heavenli cloud hashtag hashtag usernam hashtag
3482,realiz intern got seat usernam tabl hill usernam founder emili weiss pictur
3483,call hashtag hashtag grad import thing read day behold number usernam market plan httpaddr hashtag hashtag
3484,usernam usernam true
3485,usernam u anoth san francisco pop
3486,forgot normal make remov home usernam usernam milk jelli took make knew suppos good holi guacamol impress
3487,usernam usernam usernam usernam poor alex good tri sweati
3488,usernam hashtag stuff amaz harsh rub get either use link httpaddr number serious go check look good look good everyon
3489,usernam usernam relat
3490,usernam made perman dalla store think heart would happi forev
3491,modern market brand build content drive convers creat commun lead engag advocaci usernam httpaddr
3492,usernam ugh fine compar better get highlight good measur
3493,usernam lash slick stay hot yoga class sweat butt impress beat heart
3494,usernam usernam absolut beauti
3495,usernam thank love heavi black heart
3496,usernam thank
3497,uhh think anoth life usernam model
3498,ladi order usernam think order sure essenti
3499,lot new post blog week gone includ roundup new usernam goodi httpaddr hashtag pictur
3500,usernam usernam usernam usernam usernam usernam usernam usernam usernam usernam usernam usernam usernam usernam usernam usernam usernam follow follow
3501,get mom hook boy brow usernam addict run famili smile face smile eye sparkl pictur
3502,today wore mascara usernam lash slick first time month let say forgot mascara smudg thing expressionless face
3503,la sky even moon wear usernam cloud paint beam puff sparkl heart pictur
3504,usernam usernam usernam see entir summer lemon drop look
3505,love meet usernam editor chief usernam cann httpaddr brand digit age relationship httpaddr instanc usernam done men health usernam beauti matter next httpaddr pictur
3506,icon travel airplan usernam pictur
3507,usernam usernam diicchang
3508,usernam pleas consid make pink bubbl bag option order checkout first time custom mani use cring everi time receiv anoth like custom throw garbag detriment earth
3509,order usernam holiday arriv get home beat holiday blue right
3510,lay bed think rainbow much love usernam
3511,usernam soon travel friday lol
3512,usernam usernam usernam usernam usernam great could get founder built scale busi focus atom oppos byte ie manufactur physic product instead softwar
3513,usernam cloud paint haze gorg pinkest shade pink use get look channel cherri blossom xx httpaddr pictur
3514,usernam usernam work well look great
3515,normal usernam balm dot calm feel gritti cherri one feel gritti appli birthday cake one
3516,wear usernam makeup today costum work said fresh glow skin sparkl revolv heart thx glossier
3517,boy suck onlin shop almost order birthday present bc boyf work usernam websit yet order wtf face tear joy still grate though heart ribbon sparkl heart
3518,put usernam cloud paint puff httpaddr
3519,anoth packag usernam xlove ya lot excit use lash slick two heart
3520,hey usernam sponsor pictur
3521,inspir femal leader usernam ceo usernam amaz skincar beauti brand real women beauti happen individu celebr hashtag hashtag pictur
3522,want reiter usernam lash slick magic unicorn mascara dream
3523,usernam beauti
3524,know ever wore makeup usernam legendari
3525,shameless plug spent much time money cater sensit skin use usernam product six month skin budget smile face smile eye order link get number get moneysymbnumb fuel addict httpaddr
3526,daili remind usernam pictur
3527,week told smell good nice eyebrow day still thank usernam
3528,honestli felt much confid sinc use usernam know care feel need wear full coverag foundat big ol deal gal
3529,good thing come usernam packag black smile face rotat heavi black heart bullet pictur
3530,found best compani power women women usernam usernam usernam httpaddr
3531,packag first usernam deliveri brighten day love bubbl wrap zip lock bag hashtag childhood sticker life decor phone cover hashtag
3532,usernam eye cream would nice face throw kiss
3533,usernam usernam omg neue welt wird sich auftun versprech dein klingt aber auch top
3534,would vote moisturis crowdsourc new beauti frontier usernam httpaddr hashtag cc usernam usernam usernam usernam pictur
3535,offici declar usernam birthday balm miss pleas send condol
3536,began write glossier hate tweet compar product spit produc like number minut deepthroat media fill ad usernam touch
3537,shoutout usernam lash stick hold usernam concert ok hand sign heavi black heart
3538,use link number first order usernam httpaddr
3539,usernam _goddessonthego hope like big open parti pop
3540,usernam add packag option peopl order
3541,usernam love usernam bias heavi black heart
3542,usernam usernam usernam usernam usernam usernam product alreadi establish vs digit product app
3543,watch lot skincar makeup video youtub life rememb recommend usernam lash slick mascara thank whoever bc love
3544,doin dew usernam melros place kiss mark love pair white wide leg denim perfect travel httpaddr outfit httpaddr httpaddr hashtag hashtag hashtag hashtag httpaddr pictur
3545,usernam usernam sexi ye
3546,usernam usernam glow face throw kiss
3547,number influenc market case studi unbeliev result usernam aso airbnb mercedesbenz glossier boxedwat microsoft natgeo craftsvilla get perform detail httpaddr pictur
3548,usernam usernam waaaaa pretti
3549,damn whoever write subject line usernam email hashtag deserv rais hashtag
3550,usernam consum brand come mind usernam _cocokind usernam done nice job build hyper engag commun leverag product dev etc
3551,okay balm dotcom usernam new favourit lip balm good want declutt one
3552,usernam usernam que comprastee
3553,skin tint stretch conceal cloud paint haloscop boy brow lid star lip balm number glow mediocr bitch usernam
3554,thank u usernam ur balm dot com help weird eyelid eczema love u
3555,singl hand gotten middl age mom life hook usernam
3556,mom order packag usernam said hope come go vacay type respons pictur
3557,usernam la store amaz
3558,usernam past favorit give skin bright healthi glow hot humid day httpaddr ft usernam usernam
3559,usernam usernam right smh hope find
3560,love love new usernam mini milki jelli cleanser go see refil option hashtag hashtag hashtag hashtag
3561,usernam thank guuuurl look good hashtag pictur
3562,obsess cloudpaint usernam ok hand sign emoji modifi fitzpatrick type number number butterfli two heart unicorn face person rais hand celebr emoji modifi fitzpatrick type number number sign horn emoji modifi fitzpatrick type number number thumb sign emoji modifi fitzpatrick type number number pictur
3563,realli feel hashtag vibe imag need use pastel pink often shoot usernam pictur
3564,travel size milki jelli cleanser usernam would truli answer problem
3565,usernam usernam usernam dous bae spray lovabl
3566,glossier cloud paint beam illumin face like crazi feel like back sunni beach holiday cloud artist palett black sun ray
3567,usernam usernam usernam usernam carmex way
3568,want buy everyth usernam poor pictur
3569,ok think problem rlli fell love usernam haloscop highlight first use wow loudli cri face
3570,first coffe hashtag hashtag hashtag usernam hashtag hashtag usernam pictur
3571,usernam love guy girl gotta get red boy brow deserv even get emoji person blond hair zero width joiner femal sign
3572,usernam usernam would dope
3573,usernam usernam quit polygam come perfum
3574,usernam boy brow bae person rais hand celebr
3575,latest hashtag tech world usernam nomin usernam poppi thorp becom new director switch usernam httpaddr hashtag
3576,usernam highlight melt mailbox upsid face brb cri pictur
3577,usernam get past put ship address info ive tri mani time help
3578,listen say next big busi ventur dog makeup usernam usernam usernam usernam usernam usernam
3579,usernam well spent almost moneysymbnumb face wash serum shit better
3580,usernam mini smile face heart shape eye smile face heart shape eye smile face heart shape eye
3581,usernam usernam face tear joy dead
