,tweet
0,forev take note usernam handbook httpaddr hashtag hashtag hashtag hashtag
1,usernam love product suppos happen loudli cri face loudli cri face pictur
2,siempr rompo mi pink pouch de usernam so
3,usernam hire httpaddr
4,usernam still sad loos mine one use cri face
5,smell like flower thank usernam
6,noth like see usernam releas two new shade cloud paint showroom yesterday pictur
7,tri liquid blush usernam far love look natur hope hold whole day
8,usernam ship india pl person fold hand lead happier life
9,usernam releas bronzer mayb cloud paint bronzer cloud lower left paintbrush nerd face
10,stress dream last night forgot bring backup usernam london woke discov ship uk stress free sparkl
11,much enjoy mini encount usernam via instagram dm hope sponsor one day
12,usernam lipgloss nice make lip b like plump lil slug babi
13,usernam usernam would u bring carryon knew big
14,cute thing smile face heart shape eye two heart usernam pictur
15,want need birthday get whole usernam collect would complet
16,usernam makeup chang damn life
17,smell like usernam bodi hero french fri
18,thank usernam sparkl pictur glossier
19,usernam usernam brilliant hack
20,best subject line ever dog face usernam pictur
21,usernam send us pink packag via nocturn aviat pictur
22,usernam wait get
23,rrrrrrealli hope chicago usernam popup open time fli major leagu quidditch championship august alreadi sf popup la locat nyc trip work fall winter
24,bucket list summer end go zoo becom glossier rep usernam go nekter get eyebrow hair done go thrift w _lilav usernam go waffl hous w usernam becom closer god
25,oovoo javer said smell good thank usernam smile face smile eye
26,lust summer three pick usernam usernam usernam httpaddr usernam hashtag hashtag pictur
27,usernam usernam usernam usernam usernam pleas stay focus brand
28,usernam pleas make highlight coconut oil love haloscop much break like crazi wherev put loudli cri face
29,want number first usernam purchas free ship psnumber use link love letter httpaddr
30,usernam thank dmed earlier gotten respons yet
31,usernam femal version suprem
32,number year old tell use usernam cleanser hand wash upsid face face tear joy
33,usernam taken total moneysymbnumb bank account phone number post onlin hashtag hashtag
34,usernam usernam ohhh check thank hope well two heart
35,usernam make shop fun us shop grown form entertain store ad art exhibit activ even huge canyon like usernam make irl retail fun interact brand httpaddr hashtag hashtag hashtag pictur
36,usernam usernam pictur
37,usernam usernam usernam usernam usernam usernam usernam usernam usernam usernam usernam usernam usernam usernam usernam usernam boston ad set subway moneysymbnumberk per month nyc let call moneysymbnumberk brand mayb moneysymbnumbermm per month
38,usernam stop watch pure love
39,help gone usernam rabbit hole
40,artist hashtag usernam director product develop hashtag give depth lesson make industri polit color hashtagnyc pictur
41,want usernam send promo code feel moder better massiv order need place hashtag pictur
42,took nap wear lash slick wowder woke face still look good usernam win guess
43,usernam usernam httpaddr go xx
44,usernam usernam usernam usernam liter die laugh
45,usernam launch new shade cloud paint pretti pl someon fli stae get pretti pl pictur
46,usernam usernam dream
47,thank usernam dreami experi rose revolv heart dizzi symbol rainbow cherri blossom cherri pictur glossier hq
48,usernam hello get skun perfect code work keen order asap dm ed
49,son name dewey true usernam girl day dream dewi skin
50,lash slick earn offici endors surviv tear see usernam good job usernam sparkl
51,usernam usernam twist cap
52,usernam someth seem wrong canadian site get past ship inform checkout
53,still dream ear rice sparkl usernam pictur melros place
54,highlight brought usernam hors show sweat world may never know hors show sweat
55,go pump chemic bodi number number month one beauti jabroni wear usernam make skin alreadi perfect
56,usernam usernam pictur
57,usernam usernam ship spain loudli cri face loudli cri face loudli cri face want product badli pictur
58,usernam usernam gonna need review
59,face usernam usernam rocket pictur
60,model usernam dream speak exist balloon pictur
61,usernam better get hashtag pictur
62,girl sit front train use usernam make bag clutch current appli full skincar routin use httpaddr woman want clap hand sign clap hand sign clap hand sign
63,tweet usernam like usernam tweet usernam
64,usernam give shoutout usernam influenc strategi hashtag austin
65,look babi almost two month happi cop storm next sparkl usernam hashtag pictur
66,everytim usernam come london never money stori life
67,recent get messag skincar againnnnn long routin someth know make differ whether use super pure serum usernam highli recommend shop httpaddr
68,usernam within span one week ran boy brow lost coconut balm dot com car ran rose rough week pictur
69,usernam usernam sparkl usernam usernam founder usernam behind cool girl movement everyon beauti afford effect product make us realli believ httpaddr
70,usernam wow look beauti dear hope get
71,use link number first usernam order httpaddr
72,usernam glossier twitter account shrug emoji modifi fitzpatrick type number zero width joiner femal sign
73,usernam hi intern recognis hashtag certif make easi consum choos palm oil free product would love board pleas visit httpaddr learn us monkey sparkl heart seedl
74,new favorit usernam glow star httpaddr pictur
75,usernam usernam would cri boy brow joke better hit usernam
76,usernam ship asia pleas
77,usernam usernam need buy two heart
78,usernam usernam hmm
79,usernam usernam stretch conceal
80,usernam thank usernam heart arrow
81,train work cancel white heavi check mark tore hole usernam pouch content fli everywher white heavi check mark realli hope bad thing come three silver line buy boy brow lash slick replac aforement pouch preper south america victori hand
82,never like color pink usernam shop bag pictur
83,usernam get bit stick around new logo websit seem like inspir usernam great move ask hashtag hashtag hashtag hashtag pictur
84,alway keen get product usernam hope gonna avail intern soon heavi black heart
85,know never shut heck usernam amazingli annoy love thing new link number first purchas bc amaz ok bye httpaddr
86,bought usernam lash stick everi part makeup routin glossier sparkl sparkl sparkl littl thing
87,usernam make set spray pl number
88,usernam amaz support staff best custom servic seen
89,usernam usernam usernam usernam usernam usernam usernam _cocokind usernam usernam usernam skimm
90,trade usernam skin tint lash slick
91,usernam mascara mascara sinc convert usernam
92,usernam birthday cake balm smell tast feel good live
93,yeess convinc friend take usernam store la see soon pictur
94,soooo usernam come miami hug face
95,usernam usernam numberskin usernam hi love two heart
96,usernam usernam order countri pictur
97,usernam usernam numberphoebejtonkin nice pair eye
98,order first item usernam alreadi feel cute
99,ship norway coward usernam
100,usernam usernam usernam thrill fierc fun peopl work togeth great compani board
101,new white medium star number hashtag product love get glow summer number black sun ray fire xfeat usernam usernam usernam usernam httpaddr pictur
102,imagin usernam oil balm cleanser number cleans follow milki jelli number skin care routin would complet happi
103,anxious await next usernam packag smile face heart shape eye
104,usernam lol break immedi though mine broke within like two week use
105,usernam usernam face tear joy dammit happen face tear joy
106,wait till get hand usernam
107,usernam usernam code let u number first order httpaddr x
108,shout usernam bomb custom servic
109,usernam usernam reba mind
110,usernam _mialeon pictur
111,usernam usernam
112,usernam usernam sweetest
113,wow usernam lash slick everyth
114,usernam usernam usernam guy deserv award cutest coupl trophi
115,girl gotta work usernam usernam
116,usernam usernam ahhh wanna go
117,usernam usernam sorri endur trial wrong bad thing happen good peopl
118,usernam usernam much ye tender green culprit cashless even mean whose patronag need excatli x much classism work quit stanc take esp la
119,usernam hack afford cloud paint moment mix drugstor blush haloscop dewi glow sparkl
120,usernam usernam usernam usernam liter number number bc u lol
121,usernam storm cloudpaint perfect color look like realli piss number minut ago like half glass wine need highli recommend
122,usernam usernam
123,usernam usernam simpl r say harsh artifici perfum colour upset skin instead use purest possibl skin love ingredi trust product kind sensit skin httpaddr
124,usernam usernam wow deep
125,usernam usernam tsa take away face tear joy
126,usernam come eyelin bronzer pleas makeup collect complet hashtag hashtag hashtag
127,usernam usernam usernam usernam usernam usernam usernam usernam usernam usernam ye babi
128,usernam glossier arriv denmark white smile face smile face heart shape eye smile face heart shape eye
129,almost usernam solut sold septemb loudli cri face loudli cri face loudli cri face loudli cri face loudli cri face
130,usernam give gay want
131,usernam usernam glossier queen
132,pretti sure chemist usernam also witch bc product pure magic sparkl crystal ball
133,usernam ur super pure serum gave allerg reaction think face
134,usernam usernam bbi girl use coin color vaselin
135,usernam pictur
136,usernam colett pari sparkl heart dizzi symbol tulip sparkl pictur
137,glossier plsplspl come philippin next loudli cri face usernam
138,long overdu anoth hashtag product roundup post recent fave usernam usernam usernam httpaddr hashtag hashtag hashtag pictur
139,usernam usernam twin black heart
140,usernam pleas nayer see u everydayyyyyi
141,usernam mayb hashtag hashtag wear lip daili would love sun protect two heart
142,usernam usernam jelli cleanser must
143,sent edg work today rush fact sweat ton sent edg fact lost glossier lip gloss usernam
144,noah fenc build skyscrap usernam mascara
145,look number first usernam order aff link httpaddr ribbon babi bottl cherri favourit balm dot com milk jelli cleanser pictur
146,know usernam wait get home pictur
147,usernam boy brow chang life eyebrow better
148,usernam nah
149,hey usernam promo code right person fold hand
150,usernam red one would fuck sick wtf
151,usernam usernam yo tambien mucho thumb sign emoji modifi fitzpatrick type number number
152,best mail day sparkl usernam pictur
153,usernam would love ship qc yet loudli cri face pl pl pl
154,usernam pictur
155,tri decid usernam cloud paint get winter think would work better porcelain complexion storm haze pl vote hashtag usernam hashtag hashtag hashtag
156,usernam usernam usernam usernam usernam voic
157,usernam realli want ur clear glossssss
158,usernam usernam girl person rais hand celebr emoji modifi fitzpatrick type number best
159,usernam pictur
160,usernam usernam usernam invoic
161,psa lost coconut hashtag guess say summer number offici usernam
162,number hashtag hashtag suggest number may tip point women hashtag httpaddr usernam usernam usernam usernam usernam usernam usernam usernam usernam usernam usernam usernam usernam usernam usernam usernam
163,usernam usernam use glycol toner love combin salicyl lactic acid brought skin almost back normal almost thank much suggest
164,buy number million tube usernam clear lip gloss shop bag happi person rais one hand emoji modifi fitzpatrick type number zero width joiner femal sign banknot pound sign httpaddr
165,usernam portugues sun sparkl sparkl haloscop topaz cloud paint haze pictur
166,usernam ah huh
167,want tri usernam line hug face
168,today shower ask boyfriend pass milki jelli number cleanser actual chose right one usernam hero
169,usernam usernam brow girl person rais hand celebr emoji modifi fitzpatrick type number number person rais hand celebr emoji modifi fitzpatrick type number number person rais hand celebr emoji modifi fitzpatrick type number number
170,usernam usernam legit week today want order number obsess
171,shout usernam cover cost new product bought origin formula right upgrad front awesom thing hashtag hashtag hashtag
172,roman let put usernam mascara cuti pictur
173,usernam usernam love sunset pictur first one particular anumb smile face heart shape eye
174,usernam usernam love
175,final took trip usernam store la httpaddr pictur
176,usernam sponsor gurl httpaddr usernam
177,usernam kid massiv fan say showroom nyc true
178,usernam usernam nice love lip gloss serious order next pay check
179,dip ivanka usernam product x zero width joiner male sign httpaddr
180,usernam usernam fact peopl
181,usernam usernam sunflow
182,usernam usernam formula chang
183,first time long time stranger comment perfum wear usernam cours
184,usernam usernam usernam ooooo wait tri love tip
185,usernam usernam ahhh excit
186,went usernam got lip gloss everyth insid millenni pink cute insid room take photo sound effect color chang light everi purchas come pink baggi canva tote bag primer sampl
187,usernam usernam drop grad school work glossier chicago
188,love usernam product bought yesterday look real cute work today sparkl
189,usernam usernam wear right feel ya face tear joy
190,face tradit hashtag sinc hashtag still need take care everyday hashtag outsid morn hashtag help keep thing move everi day week httpaddr usernam usernam pictur
191,usernam omg yayyyyy number product haha
192,wait usernam gloss get man face roll eye
193,usernam usernam oh lipgloss lot smile face heart shape eye smile face heart shape eye smile face heart shape eye smile face heart shape eye lipstick
194,usernam join mini confer hashtag learn brand like usernam usernam influenc strategi brand httpaddr pictur
195,usernam add storm cart
196,usernam
197,know togeth someon borrow usernam invis shield never return seriou guy
198,usernam usernam ye get
199,usernam usernam usernam httpaddr
200,usernam prob still great fragranc get load compliment whenev wear
201,usernam usernam mine broke though
202,buroguq bao matamaaodian qing bao ke ai ikosumeburando glossier nychu noburandodeshi uren jie nna rikaco ohuishiyaruburogu power ameba httpaddr
203,usernam current write love usernam product obsess milk jelli cleanser prime moistur make skin feel sooo nice pictur
204,wish broke could buy usernam product
205,usernam usernam
206,usernam usernam cute
207,speak univers next time money make haul shall usernam
208,usernam ok use face use
209,made first usernam purchas super pump clap hand sign emoji modifi fitzpatrick type number
210,usernam usernam usernam usernam pictur
211,know hashtag consum well consum demand natur ingredi transpar ethic sourc sustain packag take bullshit right pictur credit usernam pictur
212,usernam je sai je sai j attend avec tellement impati
213,still wait usernam announc date pop come chicago pictur
214,usernam come miami pleas need
215,met girl usernam awesom sinc black girl moment smile talk product thank person fold hand emoji modifi fitzpatrick type number hashtag pictur
216,usernam lash slick full review photo httpaddr hashtag hashtag hashtag hashtag hashtag hashtag hashtag pictur
217,feel like christma came earli today usernam pictur
218,usernam hi long lash slick last bouquet
219,usernam bc ship india
220,want n would buy usernam product mass unnecessari packag
221,usernam hire pictur
222,wait payday usernam restock pictur
223,listen coupl podcast usernam want buy everyth usernam smart woman love brand
224,usernam usernam take kid karat tonight plz post watch hustl ass door martial art uniform lipstick
225,usernam parcel somewher univers work someon els sign haloscop lash slick
226,fave thing usernam versatil forget eyeshadow gen g forget haloscop throw balm dot com cheekbon
227,liter ugli broke usernam
228,usernam usernam seriou size shoe u wear
229,omg usernam smile face heart shape eye smile face heart shape eye smile face heart shape eye hashtag httpaddr
230,fire hot beauti news fire usernam eye person fold hand lipstick cherri blossom region indic symbol letter region indic symbol letter f httpaddr pictur
231,realli need bronzer contour stick usernam
232,usernam usernam ugh look websit noth appeal review iffi weari face
233,usernam usernam usernam abbi love face tear joy
234,usernam usernam best moneysymbnumb best friend ever spent lol mine gift
235,want tri usernam bad
236,usernam hey way purchas product australia
237,wait get paid blow usernam
238,usernam lost lash slick never upset part miss
239,usernam usernam sure
240,usernam one tote pleas thank loudli cri face loudli cri face loudli cri face two heart
241,usernam usernam love stuff end purchas link number httpaddr
242,anyon use usernam love vid want hear custom review purchas tri
243,usernam prime rich contain recycl ugh love moistur much pleas say ye
244,flight munich mumbai weekend brand new usernam cherri balmdotcom slip rest place fell black hole flight never found great number week hope miss miss fyi amaz
245,honestli got first usernam packag yesterday alreadi put second order goodi bc sucker love
246,latest jennif streak daili httpaddr thank usernam usernam usernam hashtag hashtag
247,readi weekend trip usernam pink pouch differ bag purs two heart two heart pictur
248,payday usernam order grow heart
249,usernam month sinc becam hook account may tire eventu time usernam perfectli encapsul well httpaddr
250,usernam usernam usernam ye voir la macronn
251,realli need start get usernam soon
252,usernam usernam sticker combo cute point httpaddr
253,usernam yaaaaaaaaa proud usernam let sampl product second articl tbh
254,usernam makeup came oml prettier real life person fold hand emoji modifi fitzpatrick type number number sparkl sparkl pictur
255,want love usernam custom servic fire obsess thank usernam
256,usernam campaign liter sixth grade make routin number back hard hashtag hashtag hashtag
257,usernam usernam use shop ship get stuff know anyon london ship
258,usernam usernam omggggg sorri suck assssss
259,usernam know solut back stock person fold hand face freak
260,usernam cloud paint appar leak got white shirt went pick loudli cri face loudli cri face loudli cri face anyon know remov bright pink liquid blush white shirt
261,usernam la marqu usernam est aujourd hui sur tout le levr avant son lancement en franc qui se cach derrier usernam rencontr avec cell qui entend bouscul le code du secteur hashtag httpaddr
262,usernam order lash slick number day drop still neutral face
263,usernam boy brow
264,usernam usernam number_soci usernam usernam number come bombaaaaa
265,number first purchas glossier best place beauti basic heavi black heart ok hand sign httpaddr usernam usernam
266,usernam usernam haha
267,guy usernam came made sure stuff trip shed singl beauti tear onto box lie heavi black heart sparkl pictur
268,usernam usernam ur brillianc know bound
269,usernam usernam grimac face grimac face grimac face grimac face could possibl gone bad
270,usernam usernam good
271,usernam usernam usernam usernam usernam usernam usernam usernam usernam usernam wig flew mar
272,soooo late train usernam boy brow chang life
273,usernam offer financi aid packag
274,guy smell usernam perfum light fresh smell usernam want
275,take moment today appreci peopl kind subtweet usernam custom servic team
276,first usernam order place pictur
277,realli confus usernam brand usernam numberyo dude aesthet numberyo women
278,usernam usernam usernam heheh
279,usernam usernam usernam usernam lol bouje use burt bee got wick deal ulta upper east side
280,hi usernam order product last week ship notif say packag deliv pickup point aka hous thought girl tri get boy brow
281,usernam usernam life chang plain simpl
282,usernam compani market phenomen clap hand sign emoji modifi fitzpatrick type number current accept donat new cloud paint money bag pictur
283,wear number scent chanel chanc og usernam darl glossier solid perfect littl travel companion definit throw travel bag head shoot today talent set httpaddr pictur
284,want usernam product also travel siiiiiiz pictur
285,usernam usernam stretch conceal ftw
286,usernam usernam dndkskkajaja deff ghost wrote
287,usernam usernam usernam usernam usernam usernam usernam _cocokind usernam usernam usernam usernam roosterteeth barstool well
288,way excit get first usernam packag
289,usernam start ship denmark number ill offici glossier girl
290,usernam usernam grnumber
291,usernam bodi hero get confisc way kauai upsid face upsid face upsid face upsid face upsid face
292,lidstar cloud paint haloscop last though temperatur liter hotter flame hell lollapalooza give usernam oscar immedi love sparkl
293,glossier forev obsess pictur
294,usernam usernam usernam usernam quick haul usernam feat phase number number set sparkl sparkl sparkl httpaddr usernam hashtag hashtag usernam usernam usernam usernam hashtag usernam hashtag usernam hashtag
295,usernam usernam ugh meant cashless
296,noth bring joy like usernam say hi email
297,usernam pleas repli dm smile face smile eye
298,want usernam skincar product shini lipgloss loudli cri face
299,gotta love usernam person rais hand celebr thank come httpaddr
300,usernam usernam
301,usernam usernam hey babe instagram got mad littl mini video shout latest hashtag video old school photo drop latest video share june beauti skincar fave usernam usernam usernam usernam usernam usernam pictur
302,usernam usernam usernam want
303,heart would break lose usernam product
304,wait moment ever sinc shed tear pour milki jelli last work trip heavi black heart usernam pictur
305,bring home goodi fam usernam love store melros heavi black heart
306,usernam usernam love milki jelli get one everi six month
307,usernam model new cloud paint someon dark chocol skin tone pictur
308,usernam women leadership panel usernam usernam chat build brand co creat custom custom thank usernam includ number woman bunni ear zero width joiner femal sign pictur tesla
309,usernam usernam usernam usernam love carmex
310,glossier market strategi creat hashtag empir read share hashtag stand rest hashtag httpaddr hashtag hashtag hashtag pictur
311,lost usernam boy brow first world problem honestli asham face
312,boyfriend offici adopt pink usernam pouch person use even convinc flush face smile face heart shape eye pictur
313,usernam usernam wanna get bad
314,hey usernam might recommend usernam prime moistur httpaddr
315,usernam tri product usernam send us free product wink face wink face
316,usernam usernam love two product pictur
317,usernam hi guy want buy product problem ship australia could start ship au would amaz aussi glossier fan also reach sydney glossier showroom pleas see evil monkey
318,also wore usernam hashtag edc raccoon eye festiv person rais hand celebr emoji modifi fitzpatrick type number parti popper
319,love usernam
320,usernam usernam usernam usernam lip plump good wanna buy
321,usernam lash stick epic eyelash moon crescent moon
322,usernam usernam usernam ili babenumb pictur
323,usernam usernam usernam usernam usernam usernam usernam usernam usernam usernam si
324,appear usernam read tweet formul whatev want like idk mayb glitteri lip gloss face oil would tight af
325,usernam pictur
326,usernam lash slick hold curl much like say spend day beach singl smudg eye pictur
327,miss glossier lip gloss u scoundrel stole wish ill upon u
328,blurri effect corner use trusti usernam pink zip pouch
329,usernam usernam usernam omg hahahaha
330,love usernam smile face heart shape eye smile face heart shape eye smile face heart shape eye pictur
331,usernam make rep bad skin ran boy brow
332,usernam order came morn lemm tell yall sumthin boy brow lash slick combo deadli pictur
333,quick shoutout usernam rose balm dot com ultra kissabl lip number number would recommend number number boy would kiss
334,usernam usernam girl could use damn next order go back anoth lippi mayb cloud paint benetint low
335,usernam usernam thai charact mai ek ngek thai charact mai ek ngngngngng
336,usernam usernam love
337,usernam usernam perfect look smile face heart shape eye smile face heart shape eye smile face heart shape eye
338,someon flight wear usernam perfum go california truli god real
339,usernam usernam usernam usernam put carmex rn
340,poolsid essenti hashtag pouch black sun ray hashtag usernam pictur
341,ughhh buy much usernam go work
342,usernam happen blind learn usernam better
343,usernam glad ship intern
344,usernam usernam mediocr best tbh
345,skin suffer usernam product come mail smile face open mouth cold sweat
346,noth irrit youtub review usernam make product take time understand brand aesthet expect full coverag make face roll eye face roll eye face roll eye face roll eye face roll eye face roll eye face roll eye face roll eye face roll eye face roll eye face roll eye face roll eye face roll eye face roll eye face roll eye face roll eye face roll eye face roll eye face roll eye face roll eye face roll eye
347,care usernam obnoxi brand everi time wear makeup feel like came frolick sunlit dewi field love much sparkl
348,excit hear usernam come chicago summer httpaddr
349,number first purchas usernam beauti basic leav fresh glow right away httpaddr
350,usernam geniu need listicl use pink bag
351,run around nyc day yet still somehow manag get compliment usernam perfum
352,realli mad make time hit usernam store la go back
353,usernam usernam
354,usernam obsess birthday balm dotcom actual favorit thing ever smile cat face heart shape eye pictur
355,wow usernam custom servic good face savour delici food
356,tfw rush get readi wed usernam skin tint becom dress tint amount tide go save pictur
357,best feel get order confirm email usernam pictur
358,usernam usernam liter die excit heavi black heart
359,best friend devot usernam run deep plan celebr releas travel jelli cleanser celebr friendaversari
360,usernam usernam list write citi councilman aw trend around thank remind
