,tweet
290,usernam usernam usernam usernam beyonc goddess
291,ope usernam look dumb af let pictur
292,usernam usernam gucci know face tear joy thought face tear joy give tae best qualiti deserv
293,usernam usernam usernam usernam usernam usernam usernam usernam usernam usernam usernam woww smile face heart shape eye smile face heart shape eye saturday made
294,anoth usernam project complet usernam hashtag delight work usernam pic usernam httpaddr hashtag hashtag pictur
295,usernam usernam usernam look marvel smile face sunglass
296,usernam usernam ye see pictur
297,usernam deh ya pre video usernam mane fire fire clapper board world wait say clink glass clink glass hashtag hashtag pictur
298,usernam need inspir use instagram new igtv featur learn brand like usernam usernam usernam usernam use httpaddr
299,usernam usernam si
300,smile face heart shape eye smile face heart shape eye smile face heart shape eye smile face heart shape eye smile face heart shape eye smile face heart shape eye hashtag usernam httpaddr
301,anoth exampl usernam becam mass product base art alessandro michel number min video travel modern art histori httpaddr hashtag
302,usernam usernam daddi ass drool face drool face smile face heart shape eye
303,usernam usernam lucianita ere como una princesa de cuento de hada tien uno ojito que parecen miel
304,usernam usernam haber si activan
305,usernam usernam omfg icon
306,en el articulo de esta semana para usernam contamo porqu la nueva gafa de usernam son el complemento perfecto para est verano gucci introduc new sunglass collect green heart smile face sunglass httpaddr
307,usernam usernam suprem c est pour le con dylan
308,usernam usernam yassssssssssss bitch tell hmu face tear joy
309,usernam usernam omg ye
310,usernam usernam mi favorito querida
311,usernam usernam usernam usernam courtney tool
312,gone back time birthday see bonni clyde dress present usernam usernam usernam usernam usernam hashtag hashtag hashtag hashtag hashtag hashtag hashtag hashtag hashtag hashtag hashtag hashtag pictur
313,usernam usernam sparkl diamond sharpay number eye speak evil monkey smirk face person rais hand celebr nail polish victori hand pictur
314,good morn dear friend region indic symbol letter f region indic symbol letter r black sun ray kto rano vstaiot tomu bog podaiot luchshaia odezhda ot gucci usernam nei chuvstvuesh sebia komfortno udobno pri chiom novaia kollektsiia polna kak ulichnym httpaddr
315,break boundari scent refus conform usernam httpaddr httpaddr hashtag hashtag hashtag hashtag hashtag hashtag pictur
316,usernam usernam gucci hire usernam httpaddr
317,usernam usernam sister slay fire
318,jean harri hoy uso un pantalon de jog usernam con raya lo costado con un valor de number dolar en la historia de instagram de nick httpaddr comprarlo aqui httpaddr inbox tray usernam jh heavi heart exclam mark ornament pictur
319,usernam usernam usernam usernam biggi ice cube biz marki
320,usernam jac jagaciak en usernam para la portada de har bazaar alemania septiembr number x regan cameron pictur
321,ummmmmm usernam love bag shoe sunni akin zombi lifestyl market wth pictur
322,gucci throw major danc event septemb httpaddr pictur
323,usernam usernam arab letter alef lmwdyl arab letter alef arab letter alef lqdymh ydw arab letter alef arab letter alef nt arab letter alef jh arab letter alef ly shkl br arab letter alef nd arab letter alef w arab letter alef llh shft arab letter alef lshkl qbl number snh wl arab letter alef nsyth wl arab letter alef nsyt myn arab letter alef lli k arab letter alef n l arab letter alef bsh
324,finallevel wear usernam bomber usernam mad
325,est es el modelo que usernam necesita smile face heart shape eye smile face heart shape eye httpaddr
326,usernam usernam usernam u wanna usernam moonstar face tear joy person fold hand emoji modifi fitzpatrick type number person fold hand emoji modifi fitzpatrick type number person fold hand emoji modifi fitzpatrick type number
327,usernam model usernam pleas sign one model brand
328,usernam got hashtag long drive hat usernam sunni usernam sunglasshut hashtag hashtag hashtag hashtag hashtag hashtag httpaddr
329,usernam usernam gucci promis httpaddr cc usernam icemasteri usernam
330,usernam usernam tu carita bonita number
331,gucci cloth today tho smile face heart shape eye god damn love heavi black heart black heart green heart usernam usernam
332,usernam usernam usernam well hope abl soon haha face tear joy
333,usernam usernam anoth beauti imag hat usernam usernam time share page dolc gabanna usernam usernam share alway gratitud love httpaddr
334,usernam darker sensual interpret origin usernam bloom hashtag open ginger healthi dose rose hashtag hashtag httpaddr
335,luxuri intern fashion brand usernam usernam open new boutiqu part continu invest usernam usernam hashtag pictur
336,usernam usernam usernam fuck die face tear joy roll floor laugh roll floor laugh roll floor laugh roll floor laugh
337,usernam usernam bitch realli gonna make zero graviti eh kid damn face scream fear
338,usernam usernam usernam that style
339,usernam usernam usernam usernam usernam pretti
340,usernam take peek practic blogger editor closet hard press find one usernam icon marmont bag love plush velvet version two heart hashtag httpaddr pictur
341,mirada que seducen con httpaddr hashtag hashtag hashtag hashtag hashtag hashtag hashtag hashtag hashtag hashtag hashtag hashtag hashtag hashtag hashtag hashtag hashtag hashtag hashtag pictur
342,usernam usernam ask make school unifom pleas roll floor laugh
343,usernam usernam belleza
344,usernam fall winter number via usernam httpaddr
345,usernam usernam good morn chile cami two heart
346,usernam usernam number pic fashion inspo
347,usernam usernam usernam usernam ta poderosa essa garota
348,usernam usernam usernam get mistaken usernam hashtag person rais hand celebr emoji modifi fitzpatrick type number person rais hand celebr emoji modifi fitzpatrick type number person rais hand celebr emoji modifi fitzpatrick type number soho httpaddr
349,quiero teni usernam ahora
350,usernam usernam usernam ishuuuuuuuu miss mbau hundr point symbol crown person fold hand
351,usernam nice usernam shade mr pvd
352,usernam usernam ye fuck omg
353,al ich number klick hatt fragten die hater ob dieser maverick behindert ist nach number mill klick zahl ich bar fur den usernam kindersitz
354,abl shop local lead accident bing shop onlin luckili usernam usernam onlin shop help satisfi crave new goodi black heart
355,found new gucci design usernam httpaddr
356,usernam usernam usernam pleas repli email number month sinc shoe pleas ship
357,usernam usernam usernam usernam usernam el enano moral usernam que dejo la concubina nombrada en usernam despu de ser viceministro es un ser bizarro que su unica virtud es poners vestido de usernam usernam con teni usernam
358,usernam usernam usernam usernam al maltrato anim thumb sign emoji modifi fitzpatrick type number number
359,even tho usernam afford phone screen feel fabul like usernam two heart pictur
360,usernam usernam usernam bag smile face heart shape eye smile face heart shape eye smile face heart shape eye smile face heart shape eye
361,usernam usernam ask gucci spoil usernam day white smile face
362,usernam usernam usernam like girl midget
363,usernam usernam dare half squat moneysymbnumb pant freakin tree
364,usernam usernam usernam usernam usernam jaaa echt een koopj face tear joy face tear joy
365,dear usernam fan design would love get product httpaddr young age afford anyth httpaddr give sincer sofia
366,new usernam bloom advert make want play river friend fanci dress rain taker
367,usernam usernam usernam usernam
368,usernam usernam iconiccccccccccc imagin get readi w zero graviti x
369,clone son amor heavi black heart usernam vs usernam hashtag httpaddr
370,usernam usernam usernam low key gorgeou rocket men
371,usernam came defin hashtag say goe everyth gucci httpaddr pictur
372,usernam usernam usernam usernam usernam ok hand sign ok hand sign
373,die make sure casket design usernam grimac face
374,usernam usernam usernam patrocinem
375,usernam usernam make usernam
376,vim por est apresentar todo uma obra prima magnifica que estoriador encontraram em museu em baixo da terra ao lado de uma bolsa da channel cortada destruida e uma caixa de sapado usernam pictur
377,usernam athlet shoe httpaddr
378,usernam peopl drive usernam usernam curiou thought balloon keep see fanni pack
379,usernam usernam done anyway
380,usernam hire man httpaddr
381,get gucci suprem belt loui vuitton suprem belt add ovo last king usernam usernam usernam usernam pleaaaaassseeessssss
382,usernam usernam ye usernam queen
383,usernam usernam pl usernam walk one runway show would icon
384,usernam usernam rose smile face heart shape eye
385,usernam wow nice
386,usernam usernam omg ye queen space
387,usernam usernam usernam yeah
388,usernam usernam crazi good work
389,usernam x usernam collab usernam trophi pictur
390,usernam usernam usernam usernam usernam usernam promot strike iron hot play eminem background opportun
391,usernam usernam usernam usernam new hashtag cakemagazin supercuti emmaadobson usernam usernam httpaddr usernam usernam usernam hashtag hashtag hashtag hashtag httpaddr
392,usernam usernam world
393,usernam usernam usernam lol brand plu open store think
394,usernam usernam heavi black heart gucci httpaddr
395,usernam usernam kononitsutohaberuqiang wei black question mark ornament shi kungurasandekorezhao tarajin du ha dainozinoren tsuteyan warechiyaunziya tire face pictur
396,usernam usernam would amaz
397,usernam pleas updat store cali harri campaign thank
398,usernam usernam te amo beso desd uruguay heavi black heart purpl heart region indic symbol letter u region indic symbol letter
399,usernam usernam usernam b ou
400,look realiz hashtag usernam bag rip within month own get real human gucci talk brand cost number number price respond numberx faster
401,usernam exo comeback
402,usernam usernam miss
403,usernam usernam icon
404,petit kim taehyung model usernam gucci wast time get man right beat heart pictur
405,heavi check mark pura esencia usernam anillo chevali dobl g de oro amarillo pictur
406,usernam usernam usernam usernam usernam usernam usernam fire person rais hand celebr emoji modifi fitzpatrick type number
407,nocapp banditgvngmvrco usernam hashtag hashtag hashtag hashtag hashtag hashtag hashtag hashtag hashtag hashtag hashtag hashtag httpaddr
408,usernam sega inspir usernam journey jewel embellish sneaker httpaddr pictur
409,usernam usernam usernam
410,feel hashtag hashtag vibe today even though work insid day mayb og bhnumber play background hashtag hashtag usernam httpaddr pictur
411,usernam usernam follow
412,agarr tienda gucci versac loui vuitton usernam usernam usernam la maestra usernam esta libr va por tu oferta
413,stay subject great art stumbl across usernam wall soho nyc hashtag hashtag hashtag hashtag hashtag httpaddr
414,happi sorrow rizzi hashtag hashtag httpaddr fendi usernam usernam usernam look mentorhashtag hashtag hashtag hashtag hashtag
415,usernam vy mozhet poteriat etu model httpaddr
416,usernam usernam full face zero graviti hashtag usernam
417,black sun ray springtim week away hashtag shoe inspir black sun ray usernam high heel shoe woman sandal woman boot shoe smile face heart shape eye hashtag dress hashtag hashtag hashtag hashtag hashtag hashtag hashtag hashtag hashtag pictur
418,usernam gonna make anoth campaign photo shoot usernam pictur
419,stop even appreci believ appreci come hashtag hashtag usernam usernam usernam usernam usernam usernam hashtag hashtag usernam usernam pictur
420,usernam usernam usernam hashtag hashtag hashtag hashtag hashtag hashtag hashtag sparkl sparkl sparkl heavi black heart heavi black heart heavi black heart pictur
421,usernam usernam usernam elton shine brighter still love outfit smile face sunglass smile face sunglass cant wait tour end face cold sweat
422,usernam usernam usernam im shake hahahahah
423,irk much usernam boast spent moneysymbnumberk usernam sock via usernam stori struggl fact pay student loan rest life throw money bruh
424,usernam usernam pictur
425,usernam usernam usernam el detal es q da risa cuando se mete en problema ajeno en cbt nadi le da bola
426,usernam usernam think usernam help ok hand sign pictur
427,goat usernam loafer httpaddr
428,usernam wazup u guy start make cloth super footbal look similar
429,usernam lust loudli cri face gucci gg suprem messeng httpaddr via usernam
430,usernam hire man pictur
431,feel httpaddr usernam pictur
432,usernam usernam bitch ye
433,und ich fick usernam dafur da sie kein iphon x case droppen die dummen design bengel
434,check hashtag number_star_colin custom celtic jersey usernam slipper redneck hat hashtag hashtag allenberri resort httpaddr
435,hey usernam lost usernam sunglass yesterday although mad ultim fault would realli love could help get anoth pair thing gucci sad gucci less
436,never come back never sob gucci envi mad tell httpaddr usernam usernam usernam hashtag hashtag hashtag pictur
437,usernam usernam _twistedp_ number
438,hella want moneysymbnumb usernam sock love sock hashtag
439,usernam usernam omg love much two heart ok hand sign
440,usernam usernam usernam hey guy love elton love mr sew lol xxoo
441,usernam usernam could come handi decid reboot music career use video also imagin peopl go see display museum mani mani mani year
442,usernam hi usernam tshirt store today london pictur
443,usernam guy enough ink man contract httpaddr
444,usernam usernam pleas clap hand sign emoji modifi fitzpatrick type number number
445,would wear nando usernam
446,usernam usernam uhmm face tear joy face tear joy face tear joy pictur
447,beauti usernam watch belong wrist moneysymbnumb eye less expect spend face tear joy hashtag hashtag hashtag hashtag pictur
448,usernam usernam hope awesom weekend face throw kiss anyon anyth excit guy like outfit day post top usernam jean usernam bag shoe usernam watch usernam hashtag hashtag hashtag hashtag hashtag httpaddr
449,usernam usernam hahahah realis u mention usernam duhh smh face tear joy
450,usernam usernam hashtag
451,usernam usernam hashtag week visit bogotahashtag semana en bogota hashtag visit hashtag para esta visita hashtag usernam usernam usernam usernam usernam usernam usernam usernam usernam usernam usernam usernam usernam usernam pictur
452,una imagen de hashtag la nueva campana de usernam fotografiada por _glen_luchford lo teni hashtag estan adornado con banda elastica removl que tienen httpaddr una colaboracion de gucci sega pictur
453,usernam perfect model realis httpaddr
454,wish bendinemali end benizakunya usernam rha pictur
455,fake usernam lololol ag everyth hashtag andrew number hashtag pictur
456,usernam httpaddr
457,usernam usernam quell immondic
458,usernam usernam kind store
459,usernam usernam usernam awesom work love
460,usernam usernam usernam sweater tank tuck
461,usernam usernam even need ask see tweet one doorstep friday
462,usernam usernam usernam get trigger kill anim aliv without fish hunt dumbass
463,usernam usernam usernam gold
464,summer fun heavi black heart heavi black heart swimsuit usernam hashtag hashtag hashtag httpaddr
465,usernam olha bem que vc estao perdendo httpaddr
466,usernam usernam bahfkskdnamakxoivjrhtbbn
467,usernam usernam pictur
468,usernam usernam __mackk brokest em lol happi birthday
469,usernam yall diggin usernam boot usernam rock hashtag hashtag hashtag hashtag hashtag httpaddr
470,la nueva estetica de usernam hashtag region indic symbol letter region indic symbol letter hashtag hashtag hashtag httpaddr
471,usernam usernam usernam usernam usernam usernam usernam usernam usernam usernam usernam u r look actress player adject defin ur beauti
472,see miss usernam pictur
473,usernam usernam bombon
474,hey usernam want model want give chanc think face heavi black heart usernam pictur
475,usernam usernam usernam usernam usernam usernam usernam usernam usernam usernam aw thank much love hope incred week well two heart pictur
476,usernam usernam go mar make youtub video would amaiz glow star
477,wanna style like usernam instead usernam purs usernam track suit want usernam watch usernam suit pictur
478,regrann dvlstylist usernam usernam unicef stylist dvlstylist hashtag hashtag hashtag hashtag hashtag ktencernumb katakana middl dot katakana middl dot katakana middl dot hashtag hashtag httpaddr
479,usernam hashtag new arriv fall winter numbercod numberxbdnumb eurnumb number hashtag hashtag hashtag hashtag hashtag hashtag hashtag hashtag hashtag hashtag hashtag hashtag httpaddr
480,fashion moment guid wear usernam ace httpaddr hashtag hashtag pictur
481,usernam usernam usernam nick grimshaw radio host bbc radio number good friend boy one direct includ harri done interview harri watch alway funni
482,usernam usernam giiiiii
483,httpaddr usernam usernam hashtag hashtag hashtag hashtag hashtag hashtag hashtag hashtag hashtag hashtag hashtag hashtag hashtag hashtag hashtag hashtag hashtag hashtag
484,usernam long skirt white medium star via nordicstylereport rate outfit number number smile face open mouth smile eye fakerstrom usernam skirt usernam bag usernam shoe hashtag hashtag hashtag hashtag hashtag httpaddr
485,usernam hui se toqe ______________________________ gucci fearofgod essenti usernam thombrowneni dolcegabbana ______________________________hashtaghashtaghashtag du hashtag httpaddr
486,pra lembrar uma da minha vista preferida pela janela aviao airplan hashtaghashtag hashtag hashtag smile face sunglass safiraonlin usernam hashtag cordoba argentina httpaddr
487,usernam usernam usernam usernam usernam usernam
488,premier night johndavidwashington usernam blackkklansman camera dmillzzz lo angel california httpaddr
489,usernam usernam readi content roll floor laugh
490,usernam usernam smile face heart shape eye smile face heart shape eye smile face heart shape eye weari face
491,usernam shoe display get excit fall us click link bio learn tri true tip trick transit wardrob summer httpaddr
492,usernam usernam idol kim taehyung love gucci much yall better take gucci model jssjj
493,usernam usernam usernam great idea
494,usernam usernam usernam dkhylw arab letter alef l arab letter alef nyq w arab letter alef lmrttb smile face heart shape eye smile face heart shape eye kiss face close eye blue heart
495,would style ladi gaga week day number usernam f wnumber metal ensembl usernam cat eye sunglass strathberri signatur bag usernam pearl stretch boot pictur
496,usernam hashtag usernam katakana middl dot katakana middl dot katakana middl dot hashtag x usernam usernam hashtag camera flash usernam pictur
497,usernam usernam ye wait
498,ask usernam pay life httpaddr
499,usernam usernam usernam unidentifi fli wig retreat
500,usernam holograph runway lip blow usernam runway usernam invit vogu bejewel buckl sneaker
501,think agre tae bord model like serious usernam marco bizzarri alessandro michel yall sleep httpaddr
502,usernam happen last seasson date retir usernam backpack retir vault need love forev home two heart face tear joy sparkl heart usernam seri feel need gucci shit throw old track suit sure fit sparkl heart hand index middl finger cross face tear joy hashtag
503,gym bag better usernam usernam usernam httpaddr pictur
504,gucci bamboo incred scent ever experienc gucci hashtag hashtag
505,shop usernam pictur
506,brand cloth avail cheap price footpath one go brand outlet nike usernam usernam usernam
507,usernam usernam ye ye ye ye ye
508,usernam usernam
509,usernam usernam usernam best art im sorri
510,usernam usernam ya thing thot usernam
511,usernam usernam usernam alway
512,boo chillin trickdilli oh eugen haha usernam trickdilli httpaddr
513,usernam sobr melhor festa de aniversario da vida hashtag look hashtag lelisblanc por usernam joia usernam sandalia usernam make usernam hair usernam assistent httpaddr
514,usernam purchas belt moneysymbnumb palm beach garden locat close sure coat come pleas help pictur
515,usernam usernam usernam noth wrong fresh fanni pack haha
516,usernam usernam queen need upgrad purpl
517,hashtag sneaker heavi heart exclam mark ornament coolest thing ever mucho con demasiado lo sega de usernam boca raton florida httpaddr
518,usernam usernam pictur
519,usernam ecco il vostro testimoni prego ciao httpaddr
520,usernam usernam usernam usernam mani limt edit billykirk carryal produc lookin good
521,usernam usernam usernam usernam usernam usernam queria tanto ter estado nessa festa
522,usernam usernam usernam thought wear bright sun hat realiz wear wig gotta love roll floor laugh roll floor laugh roll floor laugh
523,usernam usernam usernam usernam usernam usernam would look absolut hot birthday suit bad either
524,usernam naona mliamua kufika mashinani pictur
525,usernam mani rt sponsorship loudli cri face loudli cri face
526,usernam obrigada por proporcionar roupa maravilhosa pro meu filho usar
527,legend usernam numberchainzthegoat usernam usernam usernam numberfutur usernam usernam usernam usernam usernam usernam usernam usernam usernam usernam usernam usernam usernam usernam usernam usernam pictur
528,usernam usernam say ye wtf
529,usernam move hashtag hashtag hashtag hashtag hashtag hashtag hashtag hashtag hashtag hashtag hashtag hashtag hashtag hashtag hashtag hashtag httpaddr
530,usernam usernam check usernam fake shit lmao pictur
531,usernam usernam dapper dan would hook hashtag
532,usernam pictur
533,usernam usernam _olji usernam usernam pictur
534,usernam usernam usernam truth hover around realli goof add legend usernam usernam _mane
535,usernam hawainoqi hou zui gao grow heart rainbow grow heart palm tree grow heart hashtag usernam sunglass usernam jewelri usernam hashtag hashtag hashtag hashtag hashtag hashtag chang suo waikiki hawaii httpaddr
536,usernam usernam track suit smile face heart shape eye face throw kiss face savour delici food hashtag hashtag hashtag
537,kim taehyung usernam realli could model wow usernam get
538,voguemagazin septemb cover featur usernam wear usernam lynn ban headpiec floral headdress rebel rebel camera photograph tyler mitchel pictur
539,usernam old new final number year servic usernam wallet time meed cash usernam card holder next number year ok hand sign emoji modifi fitzpatrick type number pictur
540,usernam usernam usernam lo pondria definitivament gem stone
541,usernam usernam usernam brand would wear everywher go tht ppl ask
542,rfw arab letter alef l hdth tshkyl mn gwtshi fy frw n arab letter alef arab letter alef lywm usernam hashtag hashtag pictur
543,usernam polic car revolv light polic car revolv light polic car revolv light polic car revolv light cash giveaway polic car revolv light polic car revolv light polic car revolv light polic car revolv light name number rapper pictur think face eye top upward arrow winner get moneysymbnumb cashapp money wing readi set go vertic traffic light metgalaoffici supremenewyork usernam usernam hm_man usernam _addida httpaddr
544,usernam usernam ayyyyy look good stud
545,usernam usernam usernam usernam usernam usernam usernam usernam usernam usernam usernam usernam usernam usernam usernam usernam usernam usernam usernam usernam usernam usernam usernam usernam usernam usernam usernam usernam usernam usernam usernam usernam usernam usernam usernam usernam usernam usernam usernam usernam usernam usernam usernam usernam usernam usernam usernam usernam usernam
546,usernam usernam long boomerang face tear joy face tear joy face tear joy
547,hashtag usernam pictur
548,usernam usernam clap hand sign stan clap hand sign
549,usernam usernam usernam usernam usernam usernam ta achando que e justin bieber agora
550,usernam httpaddr
551,usernam usernam lolol noooooo see set powder float everywher face tear joy roll floor laugh roll floor laugh usernam
552,thank usernam two heart bless u flex bicep pictur
553,aaaaa je le veux usernam svp pictur
554,back road usernam
555,usernam failur becuz damn failur lookin usernam
556,usernam usernam usernam wait see beauti creation person smile face smile eye microphon gem stone purpl heart
557,usernam usernam vll kriegst du dann ja free
558,usernam usernam di review wkwkwk
559,trainer heavi black heart usernam usernam usernam pic usernam hashtag hashtag hashtag hashtag pictur
560,signatur floral stripe logo centric piec discov usernam covet hashtag black rightward arrow httpaddr pictur
561,usernam usernam usernam usernam usernam usernam make happen guy
562,usernam last night bride veil wed guest attir second hashtag two heart dress usernam new backlesssho usernam old bag usernam usernam new nippl cover model httpaddr
563,usernam usernam bitch ye
564,even bag eye design smile face open mouth cold sweat usernam hashtag hashtag la palma de gran canaria httpaddr
565,usernam love store smile face heart shape eye usernam sparkl shop bag hashtag hashtag hashtag hashtag hashtag wink face money wing key easi way top still tri get one step time one httpaddr
566,usernam usernam wowww
567,usernam usernam usernam usernam usernam usernam usernam usernam usernam usernam usernam usernam usernam usernam usernam usernam usernam usernam usernam usernam
568,new found respect usernam brand
569,stay late offic made huge progress deadlin today parti popper sweater tank surpris keep last usernam order current major markdown also found dupe usernam sunglass smile face sunglass follow httpaddr pictur
570,usernam tm hundr point symbol airplan earth globe europ africa usernam ok hand sign emoji modifi fitzpatrick type number hashtag wrap present packag ok hand sign emoji modifi fitzpatrick type number hashtag dubai marina mall httpaddr
571,usernam usernam usernam stupend marvel babi one reliev face
572,run errand fanci sneaker today lol usernam hashtag pictur
573,usernam usernam queen
574,usernam usernam buen dia cami nueva esperanza
575,usernam usernam usernam usernam usernam usernam usernam usernam usernam _amixem usernam usernam usernam bite
