,tweet
0,usernam competit one focus light block anyon threaten shine ok hand sign emoji modifi fitzpatrick type number kiss mark mix high low usernam heel usernam dress httpaddr
1,usernam usernam kkkk usernam contrata ele
2,usernam caraca que bolsa linda eu quero
3,usernam usernam usernam ye plz
4,usernam featur hashtag sneaker dope nope hashtag hashtag httpaddr
5,offici dead hashtag chicken remind harri style gucci ad roll floor laugh roll floor laugh roll floor laugh roll floor laugh usernam usernam bad pictur
6,usernam usernam usernam pleas hire model
7,usernam usernam number support
8,hashtag luomovogu sparkl object sparkl special appoint everi week end categori day mix httpaddr favourit one select usernam gg canva beauti case httpaddr
9,usernam retweet gucci usernam actress usernam appear fall cover usernam long sleev v neck gown hashtag hashtag hashtag hashtag stylist hashtag pictur
10,usernam usernam feliz lune cami saludo desd uruguay
11,heut teil number von hashtag unternehmen usernam die studierenden haben sich interessant unternehmen al studienobjekt gewahlt usernam usernam usernam usernam usernam usernam usernam usernam usernam usernam hashtag
12,im tri get discov anyon need model insta usernam usernam usernam usernam usernam usernam usernam usernam usernam usernam usernam usernam usernam usernam usernam usernam usernam usernam usernam pictur
13,usernam usernam usernam mi felicitacion todo el esfuerzo la lucha han dado victoria algun dia el maltrato anim acabara hand index middl finger cross clap hand sign
14,hashtag usernam tortois shell frame pictur
15,usernam usernam naw brought back year ago miss wave
16,usernam usernam usernam yea pleas
17,usernam usernam congratul jeffre shine exampl hard work right idea turn someon luck bare save left usernam clad httpaddr nate
18,usernam usernam usernam usernam usernam usernam usernam usernam usernam usernam usernam usernam usernam usernam usernam usernam usernam jajajajajajaja tu tag roll floor laugh
19,usernam usernam month get readi new moon face
20,usernam usernam revers hand middl finger extend emoji modifi fitzpatrick type number number
21,way gucci look amaz noth compar nake smile cat face heart shape eye drool face weari face revolv heart usernam usernam usernam usernam pictur
22,usernam usernam usernam im dead
23,usernam usernam omg would amaz bet better lol
24,usernam pleas sign model contract look look effortlessli beauti look everyon swoon he utterli ether pleas omg beg httpaddr
25,biyonsevoguebiao zhi bai idoresugagutsuchidemouhitotsunokarahurunanohaarekisanda katakana hiragana prolong sound mark katakana middl dot matsukui katakana hiragana prolong sound mark n usernam usernam usernam pictur
26,usernam usernam usernam nice
27,usernam usernam usernam dress pictur
28,usernam usernam hashtag
29,usernam usernam usernam usernam spi origin eye
30,usernam usernam usernam usernam usernam usernam usernam proud start make differ young age make better citizen world clap hand sign clap hand sign hashtag
31,chri lee hashtag look usernam usernam usernam usernam hashtag hashtag hashtag hashtag hashtag hashtag hashtag hashtag hashtag hashtag hashtag hashtag hashtag hashtag hashtag hashtag hashtag hashtag hashtag pictur
32,new queen hongkong usernam shop storm usernam slave fall feet mummi kiss mark pictur
33,dajci mi sponsor usernam
34,usernam usernam true usernam usernam
35,jlo look fire usernam sunglass httpaddr pictur
36,usernam intenso usernam numbermillion usernam gucci guilti usernam ero usernam
37,reach new level bougi gucci start target hashtag push hashtag usernam hashtag
38,usernam usernam hola cami feliz lune
39,new work vogueportugalfeatur usernam usernam lallonumberbeauti style usernam makeup usernam hair usernam cast noircast httpaddr
40,usernam usernam usernam hell trouser cost number nearli number
41,usernam usernam yaaaaaa two heart two heart two heart
42,usernam usernam usernam usernam usernam usernam breitl
43,hashtag new usernam slingback pump featur red blu web hashtag hashtag hashtag hashtag boutiqu galiano httpaddr
44,usernam usernam usernam okay tanner alreadi live breath meme time anyway
45,usernam usernam final get makeup moon face tear joy love babe
46,usernam usernam bueno dia cami espero que tu tu familia esten bien saludo desd region indic symbol letter region indic symbol letter x
47,usernam usernam say expect lawsuit pictur
48,usernam usernam usernam usernam usernam burayidi weekli news papa john slice pizza gucci robberi handbag hashtag hashtag hashtag hashtag hashtag hashtag hashtag hashtag hashtag hashtag hashtag hashtag hashtag usernam usernam usernam usernam usernam usernam usernam usernam usernam usernam pictur
49,usernam usernam usernam usernam usernam usernam usernam qs
50,usernam peopl wear fake usernam honestli annoy thing ever
51,hashtag flashtrek sneaker fwnumber usernam la zapatilla deportiva flashtrek de hashtag para ello ella durant el oinumb shop link bio httpaddr
52,piedi nesti confronto usernam hashtag hashtag hashtag hashtag nagoyapistoia hashtag usernam nagoya sushi restaur httpaddr
53,usernam pu hahui dedeisupureishitetashi hamei yue gou ru shitedu ndemashitajin hatsuitsuta katakana hiragana prolong sound mark nomidexia ji zong noosusum voguejp wwd_jp fashionpressnet burandohahao midesu gucci calvinklein tommyhilfig tomford fendi dior chanel mcqueen louisvuitton prada
54,usernam usernam take model
55,usernam usernam forev hate gucci put snake slide
56,usernam life beauti heavi black heart dress miraepari shoe usernam via usernam hashtag hashtag hashtag hashtag saint tropez httpaddr
57,visit us store today see amaz select gift set sale assist saima love usernam bamboo gift set wrap present perfect occas white medium star heavi black heart pictur
58,usernam lanza su nueva linea de decoracion con ella un sitio web que muestra el concepto de su coleccion su producto de una manera completament origin eye httpaddr
59,proximo passo vou comprar terno roxo pra nenem vamo negociar usernam pictur
60,usernam usernam ulan akpli comari gibi yazmisim ya
61,usernam usernam usernam usernam hashtag duval design garment dignitari diva usernam usernam partner w hashtag number number show usernam tix white right point backhand index emoji modifi fitzpatrick type number httpaddr tix fashion art film white right point backhand index emoji modifi fitzpatrick type number httpaddr pictur
62,usernam fay dunaway longtim muse usernam design alessandro michel number year old actress star new campaign httpaddr
63,usernam sunday funday full effect collis symbol wear usernam bikini gucci shade prissyjewel accessori sooo hot nyc hope stay cool hydrat face throw kiss xxx mccarren httpaddr
64,usernam usernam usernam pretti much go say joseph hahahahha
65,usernam usernam usernam thought real number second hella readi
66,usernam usernam pictur
67,usernam happi gonna final video video look sooooooooo amaz usernam love much proud beat heart beat heart beat heart heavi black heart heavi black heart heavi black heart heavi black heart heavi black heart heavi black heart hope great day today hope video trend soon deserv x pictur
68,usernam usernam usernam usernam thumb sign
69,usernam usernam usernam yassssww
70,shoe game girl usernam hi top back school shop hashtag kid cloth accessori usernam new item ad day hashtag hashtag hashtag hashtag hashtag hashtag hashtag hashtag pictur
71,oqi niru risangurasu dark sunglass usernam pictur
72,speak head silhouett droplet droplet usernam usernam usernam hashtag squar exclam mark httpaddr
73,wanna know folk usernam smoke weird ass shit need dat pictur
74,usernam usernam lol fashion purchas lean toward fall sadli loudli cri face
75,usernam usernam ini buat ga kah ka wkwk
76,usernam usernam sister alreadi beauti gucci x
77,usernam usernam usernam usernam usernam usernam usernam usernam usernam usernam usernam heavi black heart
78,usernam thank usernam usernam usernam usernam httpaddr
79,usernam usernam probabl
80,usernam usernam face tear joy serious ugliest thing ever seen
81,usernam usernam obsess new usernam bracelet thx amazingli awesom sa usernam help champ giggl today usernam smile face smile eye victori hand emoji modifi fitzpatrick type number number money wing black heart suit hashtag hashtag hashtag httpaddr
82,usernam usernam
83,rock usernam usernam mesh clean pictur
84,usernam oh god king usernam wya
85,usernam dont even ask that numberk rolex usernam enjoy ppl call sir face tear joy u want see view atlanti palm jumeriah beach road dubai gold presidenti suit pictur
86,go wait closer post date love usernam rabbit drew definit favorit littl guy two heart rabbit httpaddr
87,shrug emoji modifi fitzpatrick type number zero width joiner male sign fire fire usernam usernam pictur
88,usernam usernam usernam number usernam still alway hashtag team usernam usernam httpaddr
89,usernam usernam usernam gucci better make astronaut suit jeffrey reunit star
90,usernam usernam ich schwore hahahaa
91,usernam usernam usernam wow
92,usernam usernam usernam usernam usernam ooooo come gucci versac
93,tonight smell like usernam number usernam bamboo one face tear joy face tear joy bad combo
94,usernam usernam ere un amor smile face heart shape eye
95,texturesekaterinanumb hashtag hashtag hashtag usernam hashtag hashtag hashtag hashtag_shot hashtag_lightandshadow mill valley california httpaddr
96,christin usernam sunglasseswatch till death get part demand httpaddr pop app watch uncensor itun amazon googl httpaddr hashtag hashtag pictur
97,usernam usernam usernam usernam happi bday ku dizzi symbol
98,usernam eleanorjnumb play dress today usernam usernam want everyth httpaddr februari number number pictur
99,baleta gucci coleccion bamboo hashtag usernam hashtag smile face heart shape eye usernam r heavi check mark enamor de un hashtag smile face heart shape eye hashtag hashtag hashtag hashtag httpaddr
100,crystalplanet usernam packag gucciwhen neglect happen product insid httpaddr httpaddr hashtag hashtag
101,usernam hashtag number gucci snaffl loafer deficit much style engag world gone usernam mental visit guc websit right actual fanciabl classic httpaddr
102,fuck usernam pictur
103,usernam usernam usernam usernam morbier est mon fromag prefer
104,usernam usernam hermosa luciania saludo desd venezuela smile face heart shape eye kiss face close eye
105,usernam usernam usernam join selfridg usernam usernam hashtag hashtag hashtag hashtag httpaddr pictur
106,buy usernam usernam lavend denim button dress usernam pink drawstr backpack crystal stud pink jelli sandal httpaddr pictur
107,usernam usernam usernam usernam usernam usernam usernam usernam usernam _amixem usernam usernam usernam dan la legend
108,hey usernam help us get king florida tweet hashtag hashtag serious hire model pictur
109,usernam ggnumber acquistali su httpaddr hashtag hashtag hashtag hashtag hashtag hashtag hashtag hashtag hashtag hashtag hashtag httpaddr
110,usernam usernam get gucci belt pl
111,might monday crave beach hol la usernam x martin parr httpaddr pictur
112,usernam usernam fulli trend
113,without doubt usernam hashtag coll collect oh chic hashtag hashtag hashtag pictur
114,usernam usernam sava mi var
115,usernam usernam foi mesmo design que fez juro que nao e publi pictur
116,usernam usernam usernam alway love style heavi black heart smile face heart shape eye
117,usernam usernam ok gru despic
118,usernam usernam futur bright man need flower shade
119,travel style alway put togeth list finest luxuri luggag option next trip disappoint usernam hashtag usernam usernam hashtag pictur
120,usernam el crown esta aqui victori hand emoji modifi fitzpatrick type number smile face sunglass fire fire hashtag blue heart blue heart regrann usernam usernam usernam usernam stylist usernam hashtag hashtag hashtag hashtag hashtag usernam katakana middl dot katakana middl dot katakana middl dot hashtag httpaddr
121,ya mad buy pair usernam trainer street actual look like walk around hashtag hashtag hashtag hashtag hashtag hashtag pictur
122,hashtag hashtag hashtag go usernam hashtag trump tower new york httpaddr
123,usernam usernam usernam usernam usernam usernam usernam usernam usernam welcom ramili candic know know feel ram fan hashtaghashtag hashtag
124,usernam usernam pictur
125,usernam usernam usernam pictur
126,told employe yesterday back today complain say got fake gucci said wait face tear joy face tear joy face tear joy gotta love usernam
127,usernam usernam miss real gem sneez face right fam right usernam usernam usernam usernam hashtag pictur
128,usernam usernam usernam thank babe face throw kiss face throw kiss
129,usernam usernam omg ye pleas
130,usernam usernam que espera para llamar est hombr httpaddr
131,usernam usernam usernam
132,hashtag usernam new belt bag feel httpaddr hashtag
133,usernam usernam usernam short best wow omigod
134,usernam classic usernam chuck taylor usernam boot usernam httpaddr
135,usernam suggest model amaz usernam pictur
136,usernam usernam usernam look fabul sir e
137,usernam okay taehyung model yet
138,usernam koreda katakana hiragana prolong sound mark katakana hiragana prolong sound mark yu shikunatsuchiyau gucci g taimuresu mideiamu uotsuchi numbermm httpaddr usernam
139,usernam usernam cannot
140,usernam usernam im
141,like usernam suprem go buy new gucci x suprem jacketlink jacket httpaddr hashtag hashtag hashtag hashtag pictur
142,usernam order new usernam belt love
143,serdar bilgili abd deki gucci binasi icin number milyon dolar odedi httpaddr hashtag hashtag hashtag gucci pictur
144,usernam usernam yessssss
145,hashtag x usernam httpaddr camera flash usernam pictur
146,usernam usernam usernam usernam usernam usernam seem roro roro
147,usernam usernam nick
148,usernam usernam usernam shout groceri next time mari face tear joy
149,combinacion de rojo con marron de mi preferida black heart suit vestido momo_moda_dona new cinturon usernam sandalia usernam os dejo lo enlac directo la web en mi perfil de httpaddr httpaddr
150,usernam usernam usernam pictur
151,usernam usernam heavi black heart loudli cri face
152,boricua style usernam hashtag style usernam pictur
153,gucci pictur
154,x usernam wear twist intarsia metal knit headband usernam sold onlin httpaddr pictur
155,usernam letm eat finger
156,la moda si incomoda como deten el hashtag de marca hashtag hashtag hashtag usernam usernam usernam usernam usernam usernam usernam httpaddr
157,usernam usernam guauu que hermoso anillo pero lo ma bello son tu ojo que hermoso son do lucero smile face heart shape eye face throw kiss aqui tu fan enamorado te mando mile de beso
158,usernam usernam belt best need opinion shop buddi lose focu hashtag gucci httpaddr
159,usernam usernam haha sicher xd
160,usernam usernam usernam usernam usernam usernam usernam love interview nice see young kid believ whatev want life beauti
161,estamo dispon para montar la nueva campana publicitaria de usernam call us anytim xoxo pictur
162,futur usernam model person frown emoji modifi fitzpatrick type number zero width joiner femal sign hashtag pictur
163,usernam usernam usernam loos glass el rest ok
164,usernam usernam usernam usernam jerk
165,usernam usernam usernam usernam usernam usernam usernam usernam usernam usernam look beauti outfit queen grow heart grow heart kiss mark kiss mark smile face heart shape eye smile face heart shape eye
166,usernam wish pictur
167,usernam usernam usernam gorl that icon
168,usernam usernam hashtag boo usernam style top jacket eart glass usernam skirt usernam shoe usernam bag usernam hashtag httpaddr
169,usernam rosemont liter garbag trash
170,usernam usernam damn daddi
171,usernam usernam im will take cloth put closet extra storag gucci astronaut suit
172,awenz phela usernam
173,interest trend new thing wear result new demand local product boom experienti consumpt ft usernam usernam usernam hashtag hashtag hashtag hashtag hashtag hashtag httpaddr pictur
174,usernam usernam ya girl
175,need new watch band usernam watch trash hashtag
176,dont need jeezi f ing loui bag gucci bag yeah gucci bag black heart suit gucci x camillawithlov hashtag hashtag hashtag hashtag star sydney httpaddr
177,httpaddr hashtag hashtag usernam hashtag hashtag hashtag hashtag hashtag hashtag usernam usernam usernam hashtag usernam usernam usernam usernam usernam hashtag usernam usernam usernam usernam hashtag
178,usernam quak pictur
179,usernam usernam grwm moon
180,usernam usernam numberhadesgirlpdx sent name address via email bless opportun
181,usernam dammit usernam afraid give us gaudi gold slide gil meant wear coward
182,gucci detail get us everi time tiger face hashtag hashtag hashtag hashtag hashtag hashtag pictur
183,number tab open safari phone usernam piec number ipad usernam
184,usernam usernam look like borrow broken lampshad wtf wrong design make shit lol
185,usernam usernam usernam usernam hehe blue heart
186,usernam usernam usernam bien por nuestro hermano menor clap hand sign clap hand sign clap hand sign clap hand sign clap hand sign clap hand sign clap hand sign clap hand sign clap hand sign clap hand sign clap hand sign clap hand sign clap hand sign clap hand sign clap hand sign clap hand sign clap hand sign clap hand sign clap hand sign clap hand sign heavi black heart two heart beat heart grow heart
187,u g u v c n hashtag shadi usernam phenomen pictur
188,usernam usernam usernam usernam usernam usernam hashtag coach person rais hand celebr emoji modifi fitzpatrick type number person rais hand celebr emoji modifi fitzpatrick type number person rais hand celebr emoji modifi fitzpatrick type number fire fire fire pictur
189,talk one usernam usernam track suit birkin bag pretti much entir cost jeep weari face
190,usernam look miss httpaddr
191,look creativ meet craftsmanship usernam newest futurist experiment laboratori hashtag hashtag hashtag hashtag httpaddr
192,usernam usernam got sale go rn
193,usernam usernam pictur
194,absolut look forward everi podcast releas usernam recent enter competit usernam win usernam belt also enter white right point backhand index emoji modifi fitzpatrick type number number sparkl httpaddr
195,usernam
196,usernam usernam think usernam
197,usernam gucci gutsuchi ku katakana hiragana prolong sound mark rie iphon number plu ke katakana hiragana prolong sound mark su httpaddr usernam
198,usernam usernam usernam pictur
199,usernam bajan night sparkl denim dress usernam bag usernam shoe usernam bridgetown barbado httpaddr
200,usernam hello talent man name kim taehyung would amaz one runway show
201,usernam usernam usernam usernam lo que pasa es que si lo llaman opacaria su atuendo la belleza de ese nino es de est mundo smile face heart shape eye
202,usernam usernam usernam make nervou technic talk
203,usernam usernam usernam omgah face tear joy roll floor laugh
204,usernam usernam greek key dayzzz usernam photographi wear usernam usernam usernam iwearnail httpaddr
205,usernam usernam part number usernam usernam seri come pictur
206,day number new job alreadi want everi pair sunglass usernam green heart heavi black heart green heart
207,final part number usernam said empti usernam box know peopl like one alway keep box like extra special felt hashtag
208,usernam usernam sabia palabra
209,thank usernam number cute food awesom outfit httpaddr found usernam dress love httpaddr usernam shoe wait omg cute food
210,usernam besti took spotlight way street style usernam wait dress best walk street besti right away two women hold hand hashtag pictur
211,usernam hashtag camera flash cross mark eltonjohn usernam collabor fire collis symbol hashtag entri sign usernam dark sunglass hashtag white point backhand index hashtag key httpaddr follow latest hashtag hashtag brand httpaddr
212,usernam usernam
213,meant say model usernam
214,sorri work usernam pictur
215,usernam pleas monopoli collab buy
216,usernam usernam
217,usernam usernam ask nasa first
218,usernam usernam girl bye lol face tear joy crown pictur
219,usernam usernam usernam cri funni face tear joy face tear joy face tear joy face tear joy loudli cri face loudli cri face loudli cri face
220,usernam guccino boscotsuteshu itearu ai quan nome qian rashiin ke ai yu shii httpaddr usernam
221,usernam usernam man
222,usernam eye usernam usernam american footbal rockin usernam x usernam patch basebal cap statu liberti statu liberti hashtag pictur
223,usernam usernam usernam
224,usernam hashtag hashtag hashtag hashtag hashtag hashtag hashtag hashtag usernam hashtag usernam usernam hashtag usernam hashtag hashtag httpaddr
225,usernam usernam usernam pictur
226,usernam usernam usernam red colour clap hand sign clap hand sign
227,usernam grow legend like latifah busta shakim would tell great os usernam felt great wear usernam jacket last night hashtag style httpaddr
228,usernam usernam usernam usernam fernanda ere mi fantasia sexual desd que te vi ere muy sexi
229,usernam usernam sister space suit
230,j ador la nouvel collect usernam inspire par l afriqu pictur
231,usernam usernam look like basebal player face throw kiss
232,usernam may poor ugli hire model face tear joy pictur
233,usernam gotta question usernam slide uncomfort heard bad thing pl lemm know usernam usernam usernam
234,modelo da usernam httpaddr
235,usernam usernam usernam usernam honestli
236,usernam contratem httpaddr
237,usernam olha oq vc ta perdendo httpaddr
238,jean harri hoy uso un pantalon de jog usernam rayado al costado con un valor de number dolar en la historia de instagram de nick httpaddr comprarlo aqui httpaddr c usernam pictur
239,usernam hollibob heavi black heart usernam josephedwardb numberwattsm usernam mykono kikladh greec httpaddr
240,usernam hashtag hashtag
241,want usernam bag bring splash one well download listen latest episod hashtagsugarspodcast usernam talk httpaddr
242,usernam usernam would die
243,shirt usernam pictur
244,usernam usernam usernam usernam usernam
245,usernam usernam usernam look awesom
246,usernam va quedar como modelo de usernam
247,usernam usernam run usernam side obsess thing marmont hashtag hashtag hashtag hashtag target store rohnert park httpaddr
248,usernam want shoe
249,usernam usernam sponsor one episod secret life jeffre star usernam grin face smile eye smile face open mouth smile eye grin face smile eye smile face open mouth smile eye
250,everyth love babi gone deck usernam usernam usernam know parent love usernam cours ok hand sign emoji modifi fitzpatrick type number hundr point symbol pictur
251,kangana ranaut pair floral print sari pearl usernam necklac hashtag hashtag hashtag hashtag hashtag hashtag hashtag hashtag hashtag httpaddr
252,usernam yeasssssssssssssssssssssss queen usernam
253,usernam usernam way summer still smile face sunglass
254,usernam alway look fabul especi hashtag yesterday gorgeou si wore hashtag color usernam sweater girl hashtag check girl httpaddr
255,usernam usernam nao sei que e mai lindo teu rostinho angel ou oculo
256,usernam usernam relat anyth harri releas collect gucci model jbdnsdb hashtag hashtag hashtag usernam
257,serdar bilgili abd deki gucci binasi icin number milyon dolar odedi httpaddr hashtag hashtag hashtag gucci pictur
258,usernam give uk region indic symbol letter g region indic symbol letter b telephon number custom servic
259,yo nose porqu carajo lo de usernam han contratado mi bebe usernam para ser modelo osea que mierda le pasa ahre sorri sorri alter face tear joy two heart two heart two heart two heart chocol bar chocol bar mi king mi queen usernam usernam usernam usernam pictur
260,usernam usernam work women symbol
261,usernam want work usernam usernam usernam
262,know one usernam memor print design grace kelli httpaddr pictur
263,usernam usernam
264,usernam g u c c sparkl g u c c sparkl goo upsid face ad new member usernam famili collect yellow heart simpl leather belt perfect cinch flowi dress person rais hand celebr firm believ treat httpaddr
265,usernam usernam friday sparkl continu hashtag hashtag hashtag hashtag hashtag hashtag hashtag hashtag hashtag usernam usernam usernam usernam httpaddr
266,peak island fashion show usernam vs wayfar love island pictur jone land
267,gucci plz sponsor usernam
268,usernam usernam get readi rocket yaaaaa rocket face tear joy
269,favorit peopl head toe usernam pictur
270,gustan mucho toda la foto que usernam sube instagram
271,usernam usernam usernam like much
272,apr gap voila que usernam et usernam font la promot du hashtag dan le dernier numero du magazin rubriqu mode best number number remarquez l argumentair bidon invoqu par le magazin le march doit cesser de fair la court echel l islamis pictur
273,usernam usernam usernam usernam usernam usernam usernam usernam usernam hey peter imagin receiv lot request sponsor cooper agreement day therefor concentr us alreadi exist cooper agreement pleas understand us wrong paint wonder blue heart
274,usernam look miss fool pictur
275,usernam usernam love stylist element photo background light sparkl backdrop bag beauti love custom person letter also pant intrigu appeal letter word pair snake imag patch
276,usernam usernam
277,usernam name kim mingyu popular kpop group usernam pleas contact model job pictur
278,usernam tri find size gnumber men uk size hashtag
279,usernam pleas hire kim taehyung usernam thank httpaddr
280,usernam usernam usernam usernam com toda essa beleza gent nem perceb entorno da foto face tear joy face tear joy
281,usernam usernam happi belat birthday beauti spirit rainbow
282,usernam usernam beri beri excit sad httpaddr punjabi popstarlov u usernam paji rais fist full support usernam boy pictur
283,usernam rock usernam
284,bravo usernam pictur
285,nan usernam il ont merd la ptn loudli cri face face tear joy pictur
286,mean usernam usernam pictur
287,year watch usernam cant deni fact want usernam tracksuit smile face heart shape eye drool face
288,usernam usernam usernam usernam label queen face throw kiss
289,wonder feel like wear usernam design dress bet feel soft fuzzi empow
