,tweet
576,elton usernam fashion geniu alessandro michel speak perfect partnership hashtag wardrob new httpaddr httpaddr pictur
577,usernam usernam usernam usernam usernam gy geen noeuw joggingsbroek nodig mss dit een opti face tear joy face tear joy
578,usernam usernam usernam usernam usernam hand utfo ya cold wanna httpaddr
579,usernam usernam usernam usernam httpaddr
580,hashtag excit tell hashtag relaunch hashtag hashtag httpaddr hashtag usernam hashtag hashtag hashtag hashtag hashtag hashtag pictur
581,usernam defin great usernam usernam fistsupafrosout yarashahidi hashtag hashtag hashtag hashtag hashtag hashtag hashtag hashtag hashtag hashtag httpaddr
582,dear usernam wish rich enough wear cute shoe cri face
583,usernam usernam usernam usernam httpaddr
584,usernam usernam __mackk happi birthday fam hundr point symbol
585,usernam hoe better stop sleepin beauti httpaddr
586,usernam usernam bet world drum drumstick
587,usernam mi nuevo labial de usernam velvet matt sheer mi nueva rinonera usernam hashtag hashtag hashtag hashtag hashtag hashtag hashtag hashtag hashtag httpaddr
588,usernam usernam usernam usernam usernam usernam usernam usernam usernam usernam usernam usernam usernam usernam usernam pictur laugh factori
589,usernam usernam lol
590,usernam omg usernam turtl made face tear joy pictur
591,usernam hire kim taehyung usernam readi pictur
592,mix usernam hashtag httpaddr solid tee usernam hashtag pictur
593,usernam usernam usernam full face zero graviti would cool fuck
594,usernam new usernam think face
595,usernam usernam stan icon
596,usernam usernam nice one seen httpaddr pictur
597,usernam usernam usernam que infierno el que viven lo animalito causa de la lana de angora mohair es demasiado disappoint face cri face cri face cri face
598,hello usernam hashtag_yourself_ji _answer hashtag pictur
599,tomhardi usernam shot usernam style usernam usernam septemb httpaddr
600,usernam rhyton sneaker boast chunki silhouett also boldli stamp monogram logo black rightward arrow httpaddr pictur
601,sign usernam usernam httpaddr
602,could model guy give call wink face usernam usernam usernam usernam usernam usernam usernam usernam usernam hashtag hashtag hashtag pictur
603,usernam hire ili pictur
604,usernam usernam bale dm pl
605,usernam usernam usernam amazingggggg cloth
606,piec usernam usernam dope pictur
607,adam lambert ig usernam usernam hashtag httpaddr
608,deixar aqui foto da campanha que usernam fez para usernam black heart suit black heart suit hashtag hashtag pictur
609,blue heart gucci g timeless stainless steel round dial unisex watch yanumb shop new gucci httpaddr hashtag hashtag hashtag usernam pictur
610,new video usernam ig page usernam usernam httpaddr httpaddr
611,usernam usernam usernam usernam usernam stadium statu
612,everyth usernam httpaddr
613,plan think face usernam pictur
614,usernam usernam usernam farewel tour see live bucket list
615,usernam week want httpaddr usernam hashtag
616,usernam wrap present herb rose clink glass bottl pop cork usernam hashtag hashtag hashtag hashtag hashtag hashtag hashtag hashtag hashtag hashtag hashtag hashtag hashtag httpaddr
617,usernam usernam number employe paid moneysymbnumb month
618,usernam polaroid stori part v usernam signatur number lit fire httpaddr hashtag hashtag hashtag hashtag hashtag hashtag hashtag hashtag hashtag hashtag hashtag hashtag hashtag hashtag hashtag hashtag hashtag
619,usernam usernam usernam usernam usernam usernam usernam usernam usernam _amixem usernam usernam usernam hashtag
620,usernam product placement basketbal wive season fire
621,usernam usernam pictur
622,hashtag hashtag hashtag hashtag fay dunaway style icon new usernam campaign prove httpaddr via usernam
623,point usernam hashtag weekend usernam horsebit usernam tenant cultur usernam concret poetri httpaddr
624,usernam usernam hashtag
625,usernam usernam usernam usernam usernam usernam like
626,usernam usernam usernam mei tian ban ji menzuguan nonumberji noguccinomisenoheng nioruyo katakana hiragana prolong sound mark face throw kiss
627,usernam usernam usernam usernam usernam usernam usernam usernam usernam usernam sound cool italian la mia ramiglia rais hand finger splay emoji modifi fitzpatrick type number grin face call hand emoji modifi fitzpatrick type number
628,usernam usernam philli need extra let know
629,usernam usernam usernam usernam usernam usernam usernam usernam usernam usernam sofa
630,usernam usernam usernam cannot wait c new garb number vega decor fashion excel u r best stage sir elton music score wink face
631,usernam usernam usernam hire brudda
632,usernam usernam get r e n c h ed launch event camera flash usernam theory__ gucci jcrewzara tiffanyandco httpaddr
633,psa usernam hire loudli cri face loudli cri face smile face heart shape eye smile face heart shape eye httpaddr
634,let ray light run free black sun ray dizzi symbol hashtag hashtag bangpinedafashion balenciagaonlin usernam usernam bangbangstylecrew quezon citi philippin httpaddr
635,usernam usernam new hous tour mar come soon
636,usernam usernam hermosa
637,usernam usernam usernam abla sana ozel baslik cikartmislar
638,last day grab fantast deal gucci guilti black rang black heart money mouth face psnumber today miss parti popper usernam usernam usernam pictur
639,usernam hire
640,usernam usernam que tenga un excelent dia mi cami bella revolv heart hashtag
641,usernam usernam usernam usernam usernam usernam usernam usernam usernam usernam usernam medal add glamour best
642,usernam usernam revers hand middl finger extend emoji modifi fitzpatrick type number number jaja
643,usernam usernam face throw kiss
644,usernam usernam usernam usernam usernam belt everyth love
645,usernam usernam lit day slept wake sleep bank listen hermusicofficialhair inform desk person emoji modifi fitzpatrick type number zero width joiner femal sign usernam mouth usernam hashtag sunglass smile face sunglass usernam httpaddr
646,ye took daughter usernam school shop hashtag pictur
647,usernam usernam usernam usernam owe big style least usernam tracksuit hashtag
648,usernam usernam hard believ one size websit stock
649,usernam usernam yass think person gonna rock honest
650,usernam ultim instagram worthi sunglass guid httpaddr hashtag usernam hashtag style hashtag style usernam usernam hashtag usernam usernam hashtag fashion usernam hashtag usernam hashtag hashtag
651,usernam look like usernam santa suit santa thiccc christma tongu father christma emoji modifi fitzpatrick type number number
652,usernam usernam usernam hmmm
653,usernam usernam pictur
654,usernam ok get usernam air freshen uber next time
655,usernam usernam jacket gorgeou collis symbol collis symbol usernam
656,fewgot drunk wastedand sleep gonna dream httpaddr usernam usernam pictur
657,love architectur creativ build hashtag forget name casino crazi number main tower tilt plu usernam usernam usernam think usernam pictur
658,usernam see usernam open usernam packag arriv mail funniest happiest one ever seen face tear joy smile face open mouth smile eye packag hashtag
659,told usernam make denim pl stop
660,one shoot spot hashtag popular store usernam mani la vega spot visual go rich pictur
661,usernam hashtag extens usernam f w number campaign beauti purpl heart httpaddr hashtag hashtag hashtag hashtag hashtag hashtag hashtag hashtag hashtag hashtag httpaddr
662,usernam usernam hundr point symbol
663,usernam usernam hashtag hashtag hashtag hashtag hashtag hashtag hashtaghashtag hashtag hashtag httpaddr pictur
664,usernam usernam hola camila smile face heart shape eye face throw kiss
665,need usernam usernam colab httpaddr
666,hashtag usernam gucci tailor fall winter number look number gucci origin gg loafer gucci team motif moneysymbnumb httpaddr pictur
667,usernam usernam usernam pictur
668,usernam usernam usernam usernam usernam usernam usernam usernam kkkkkkkkk amei
669,usernam httpaddr
670,usernam usernam numberhadesgirlpdx omg fragranc loudli cri face smile cat face heart shape eye
671,usernam usernam que tierna te ve lucianita smile face heart shape eye smile face heart shape eye smile face heart shape eye smile face heart shape eye smile face heart shape eye
672,usernam pictur
673,usernam pictur
674,usernam usernam usernam usernam lolol oh god
675,usernam usernam want one pleas
676,usernam usernam usernam love
677,usernam pleas let man one model mean look httpaddr
678,usernam hehe usernam usernam diliman colleg architectur httpaddr
679,usernam get free ace leather sneaker broke pensiv face
680,usernam usernam hola cami buena reflexion la de hoy te quiero
681,usernam usernam normal day life jeffre star
682,thank usernam usernam usernam hashtag love could made hashtag without much gratitud help us bring histor stori screen inspir next gener women reach dream httpaddr
683,think love usernam
684,usernam usernam usernam firefight thirti year psnumber number monthli incom
685,usernam usernam usernam smile face heart shape eye smile face heart shape eye smile face heart shape eye crown
686,usernam usernam usernam live photo look amaz kiss mark
687,usernam usernam ese rostro angel la paro viendo en televis saludo
688,love author appreci good bag usernam master thrill share vintag usernam usernam celebr latest must read tiffani blue usernam httpaddr
689,usernam usernam omg ye
690,usernam make famili valu polit hashtag hashtag hashtag hashtag usernam buy boss pictur
691,usernam kinda want anoth campaign usernam
692,usernam usernam icon
693,usernam pleas casatu mykono httpaddr
694,usernam avet un modello pronto per voi httpaddr
695,usernam mlb collect beyond clever choos go broke get httpaddr
696,usernam usernam usernam see happen
697,usernam httpaddr
698,usernam usernam omg mood loudli cri face smile face heart shape eye clap hand sign emoji modifi fitzpatrick type number number
699,usernam usernam campaign manag best start sponsorship campaign nomin school support huge problem depart ask sash hashtagknumb
700,one favorit summer look usernam usernam usernam hashtag love hashtag httpaddr
701,usernam usernam usernam usernam
702,usernam usernam usernam extraaaa need concept jeffre tell us happen haha
703,need usernam usernam collab
704,usernam usernam yaaaa
705,usernam usernam face tear joy face tear joy hear usernam endors right thing usernam
706,usernam que espera por tener est bombon usernam httpaddr
707,usernam usernam yesss honey
708,lovin new buddi usernam heavi black heart heavi black heart heavi black heart pictur
709,usernam back realiti money sens shop usernam httpaddr
710,var good guchi face tear joy roll floor laugh usernam pictur
711,usernam usernam usernam gorl
712,ny nait region indic symbol letter u region indic symbol letter hashtag hashtag wear malasaniaok usernam houseofherrera en number fifth rooftop bar penthous httpaddr
713,usernam usernam number probabl two three time price wardrob
714,usernam usernam awesom face throw kiss face throw kiss
715,usernam usernam icon face tear joy
716,heavi black heart heart ribbon two heart purs high heel shoe chocol bar weight lifter zero width joiner femal sign flex bicep smile face smile eye life hashtag amp usernam hashtag share usernam w cowork yesterday cute much enjoy httpaddr
717,usernam usernam hashtag
718,usernam usernam usernam usernam fall number cover usernam httpaddr
719,usernam usernam usernam look nice think look much like bird meme
720,usernam usernam usernam new summer sandal stori usernam prop stylist michelle_in_a_handbasket fashion director usernam camera flash jonathon kambouri utopianyc hashtag hashtag usernam usernam httpaddr
721,usernam gotta make diaper stop shit mf
722,hello usernam could say hello littl beauti usernam number battl cancer number yr broken heart sadli cancer win end life care broken heart wish receiv tweet famou peopl tv famou pleas sparkl heart hashtag pictur
723,usernam usernam pictur
724,watch usernam magic awnumb campaign jelli wobbl cake throw fun shortcak httpaddr pictur
725,usernam usernam yesss siss
726,usernam get bodi wet bust like pistol tripi thirtnumbern hashtag hashtag hashtag hashtaghashtag hashtag usernam usernam httpaddr
727,retir goal vintag usernam collector
728,usernam black heart pictur
729,usernam thumb sign emoji modifi fitzpatrick type number thumb sign emoji modifi fitzpatrick type number thumb sign emoji modifi fitzpatrick type number usernam usernam httpaddr
730,wanna usernam add
731,usernam usernam wadawww
732,usernam big up usernam send new shade sun face httpaddr pictur
733,usernam see vibe shrug emoji modifi fitzpatrick type number zero width joiner male sign httpaddr
734,usernam usernam usernam usernam usernam usernam usernam usernam usernam happi hashtag
735,usernam exactli disgrac mayb usernam could assist sin e usernam remors
736,usernam usernam usernam
737,usernam usernam icon
738,usernam usernam usernam usernam usernam usernam usernam usernam
739,usernam usernam usernam gentleman never go style ok hand sign emoji modifi fitzpatrick type number hashtag hashtag hashtag hashtag hashtag hashtag hashtag httpaddr usernam shirt usernam usernam usernam httpaddr usernam usernam pictur
740,pool day classic usernam hashtag hashtag hashtag hashtag hashtag hashtag hashtag hashtag hashtag hashtag hashtag hashtag hashtag hashtag httpaddr
741,usernam usernam usernam face tear joy roll floor laugh face tear joy hey get richard branson spaceship could happen soon
742,usernam usernam usernam test actual buy
743,usernam usernam anyon make list everi singl usernam approv product watch everi singl video sephora struggl
744,usernam usernam ne nao cr ele fez um stori na loja da usernam com usernam mostrando bagulho
745,usernam find thank pictur
746,usernam usernam drop money fake usernam usernam usernam least look rich hundr point symbol gem stone
747,usernam usernam welcom back planet inform desk person zero width joiner femal sign pictur
748,usernam go round zara push hashtag hashtag hashtag hashtag hashtag hashtag hashtag hashtag hashtag hashtag hashtag hashtag httpaddr
749,usernam quando vc se empolga com look e fotografo ate uma banca de jornal ja vira um book grimac face face tear joy smile face heart shape eye see evil monkey beauti usernam look usernam casaco usernam style usernam camera flash usernam pictur
750,usernam f ck yeah usernam camera flash kg_dutch httpaddr
751,usernam linea usernam en todo el closet verd rojo negro hashtag httpaddr
752,usernam usernam look cute jeffre smile face heart shape eye smile face heart shape eye
753,neckti harri estava usando uma calca da usernam de moneysymbnumb number dolar aproximadament moneysymbnumb number instagram stori nick luisa pictur
754,usernam plain simpl usernam day night smile face sunglass hashtag athlet shoe support usernam extra thumb sign hashtag hashtag hashtag hashtag httpaddr
755,usernam usernam nice
756,tough time usernam smile face open mouth smile eye rabbit face hashtag aspirationcoin usernam kyoto japan httpaddr
757,regrann dvlstylist usernam usernam unicef stylist dvlstylist hashtag hashtag hashtag hashtag hashtag ktencernumb katakana middl dot katakana middl dot katakana middl dot hashtag hashtag pictur
758,big love usernam link dapper dan person fold hand emoji modifi fitzpatrick type number good look hip hop hous gucci
759,happi number month gorgeou thing forev grate usernam sparkl heart pictur
760,usernam usernam te imagina hyunjin modelando para gucci estoy muriendo
761,usernam usernam usernam look awesom stun heavi black heart look happi smile face smile eye
762,usernam usernam review baunyaa
763,usernam usernam gucci boy kim taehyunggg usernam hashtag hashtag
764,surpris usernam usernam interior car
765,usernam usernam usernam stun ever smile face heart shape eye face throw kiss
766,usernam usernam goal smile face heart shape eye person rais hand celebr emoji modifi fitzpatrick type number hashtag
767,usernam make iphon x case
768,heavi black heart gucci usernam usernam pictur
769,usernam usernam usernam diosa mi amor tongu heart arrow heart ribbon purpl heart grow heart
770,get song yunhyeong brand ambassador compani treat shit help prove wrong treat like usernam usernam usernam usernam usernam usernam
771,usernam usernam usernam peccato non sono un vestito da gucci
772,usernam usernam annem bana kucukken bunun beresini ormustu
773,usernam usernam usernam lmfaoo best thing ever
774,usernam usernam usernam usernam look beauti crown four leaf clover green heart
775,usernam usernam usernam great
776,usernam usernam usernam usernam usernam bless person fold hand
777,usernam usernam usernam usernam usernam usernam usernam got
778,gucci contrast brutal old world luxuri new london store httpaddr pictur
779,usernam uff gucci sign alreadi usernam pictur
780,usernam usernam shirt dope
781,perfect comfort dress shopninaleonard wore boat morn go sunday brunch glass usernam handbag amazon item link bio httpaddr
782,miss usernam taehyung king aesthet taesthet smile face heart shape eye hashtag hashtag hashtag hashtag hashtag hashtag hashtag hashtag hashtag hashtag hashtag usernam sparkl purpl heart tiger face pictur
783,usernam usernam usernam news headlin beauti guru jeffre star goe space makeup retriev wig found sister jame reach number mil
784,hashtag hashtag tomorrow usernam hashtag show brows shop hashtag smile face smile eye usernam usernam usernam usernam usernam usernam usernam usernam pictur
785,usernam trash liter pay name flop trash shoe trash pant trash shirt trash
786,usernam usernam con esa sonrisa esa linda cara encandila pasar un buen domingo con esta imagen solo seria bueno sino un maravilloso dia encanto de mujer face throw kiss smile face heart shape eye hug face heavi black heart tulip
787,usernam fuck see call man yet skull httpaddr
788,calca que harri esta usando e da usernam e custa moneysymbnumb dolar aproximadament moneysymbnumb reai pictur
789,ummmm actual sell usernam usernam usernam bag burlington coat factori wtf find
790,usernam usernam usernam usernam usernam usernam oh yeah mani equin twitter get better wordsmith edit copi
791,usernam usernam usernam usernam would consid includ afghan model never ever repres women intern fashion industri reach gucci
792,usernam usernam usernam hire model alreadi
793,usernam usernam usernam usernam heavi black heart heavi black heart heavi black heart heavi black heart
794,usernam sign boy hoe stop sleep fkajskab httpaddr
795,usernam usernam hola mi cami bueno dia
796,sera que usernam gosta de mim tanto quanto eu gosto dela httpaddr
797,usernam
798,usernam usernam shyh arab letter alef lan arab letter alef glb arab letter alef lm arab letter alef rk arab letter alef arab letter alef rt tstlhm mn arab letter alef l arab letter alef shi arab letter alef arab letter hamza arab letter alef lqdym old gold
799,usernam usernam usernam take usernam see new usernam suit everyshow knock knock joke monologu make audienc scream play kiwi song end show tlling treat peopl kind
800,spot juli issu usernam usernam wear pair overs hashtag sunglass hashtag hashtag hashtag tom craig stylist leith clark pictur
801,usernam usernam ere tan bella como un diamant adema gusta tu sencillez humildad que trasmit nunca cambi heavi black heart heavi black heart smile face heart shape eye smile face heart shape eye face throw kiss face throw kiss
802,usernam usernam usernam usernam bili mo ako hahah
803,hashtaghashtaghashtag paul usernam custom usernam custom hashtag custom usernam custom httpaddr
804,usernam gucci leather web horsebit loafer httpaddr via usernam
805,usernam usernam know usernam alway best
806,usernam usernam usernam usernam usernam usernam
807,usernam usernam mira lo que te esta perdiendo loco reacciona
808,usernam eai vamo tomar jeito ou ta dificil taehyung modelo da gucci ja httpaddr
809,usernam usernam omg would crown icon crown sparkl heart sparkl heart sparkl heart rainbow
810,usernam lust nude usernam usernam anyon fanci send psnumberk way face tear joy face tear joy roll floor laugh smile face heart shape eye england httpaddr
811,usernam usernam fire man danc emoji modifi fitzpatrick type number number
812,hashtag shoutout usernam good look usernam hook team flex bicep emoji modifi fitzpatrick type number number order ship week pictur
813,usernam httpaddr
814,usernam usernam queen
815,usernam usernam take man liter scream model
816,usernam usernam usernam usernam usernam fuck love
817,usernam usernam usernam usernam vc e bela como um gol ao number segundo tempo sua linda smile face heart shape eye smile face heart shape eye
818,usernam usernam usernam lookin sharp
819,usernam glen luchford favorit fashion photograph look forward see work gucci futur well done gucci
820,usernam usernam twitter say otherwis pictur
821,usernam usernam
822,usernam la tla la senya weitsi face tear joy httpaddr
823,new instagram post usernam hashtag httpaddr pictur
824,usernam usernam think would absolut slay pink astronaut suit girl better get pink helmet
825,usernam usernam pictur
826,usernam usernam el dia en que tengo que levantar la number number de la manana pensar que estoy llegando tard lo peor que raro que te gusten lo lune yo lo odio face tear joy heavi black heart
827,usernam usernam usernam yall fuck fast calm pleas pictur
828,usernam troll usernam next door think face think face think face pictur
829,hi guy need legit check gucci belt thank cheer usernam hashtag hashtag hashtag hashtag hashtag hashtag pictur
830,usernam usernam get readi rocket
831,might prefer littl dress usernam lallonumb mention leg second cover thank usernam bold brilliant interview httpaddr
832,usernam usernam usernam
833,usernam gang gucci gang gucci gang httpaddr
834,usernam usernam usernam miss httpaddr
835,tomorrow get httpaddr beyond dominion offwht usernam pictur
836,usernam hashtag jacketuniqlo camisol zara pant usernam loafer usernam necklac usernam ringsmr_casanova_eyewear sunglass usernam viarepubblicabag httpaddr
837,usernam usernam bet would lol
838,witch saw futur snake usernam resort number close up detail pictur
839,usernam warn better get beauti model late he break internet right asdfghjkl httpaddr
840,usernam liter tri place phone order number day bare answer phone store associ obvious uninterest make sale high end brand expect better custom experi
841,usernam usernam usernam usernam linda smile face heart shape eye smile face heart shape eye smile face heart shape eye smile face heart shape eye smile face heart shape eye smile face heart shape eye smile face heart shape eye smile face heart shape eye smile face heart shape eye smile face heart shape eye smile face heart shape eye smile face heart shape eye smile face heart shape eye smile face heart shape eye smile face heart shape eye smile face heart shape eye smile face heart shape eye smile face heart shape eye smile face heart shape eye smile face heart shape eye smile face heart shape eye smile face heart shape eye smile face heart shape eye smile face heart shape eye smile face heart shape eye smile face heart shape eye smile face heart shape eye smile face heart shape eye smile face heart shape eye smile face heart shape eye smile face heart shape eye smile face heart shape eye smile face heart shape eye smile face heart shape eye
842,usernam usernam omg face tear joy face tear joy
843,smart funni blackisod number usernam igtv squad touch philli amanda voic give first show come back head igtv see hashtag hashtagtour eye usernam httpaddr pictur
844,gone make casefor iphon x usernam
845,usernam usernam httpaddr happen clap hand sign emoji modifi fitzpatrick type number rocket usernam
846,usernam doe think design pictur
847,usernam usernam like seem like reason request smile face smile eye
848,usernam usernam usernam usernam voce e mai foda ber kkkkkkkkk
849,usernam usernam usernam usernam du geni ce compt clairement rate
850,monday worst face stuck tongu tightli close eye hashtag usernam usernam usernam usernam usernam usernam hashtag hashtag hashtag usernam usernam hashtag usernam hashtag hashtag usernam hashtag pictur
851,closet got usernam drip
852,usernam lead luxuri design usernam usernam launch latest boutiqu usernam usernam httpaddr hashtag hashtag hashtag hashtag hashtag hashtag hashtag hashtag pictur
853,brother baroqu elton john meet usernam alessandro michel httpaddr via usernam pictur
854,usernam usernam plz person fold hand emoji modifi fitzpatrick type number number
855,usernam small orang diamond fashion fab news small orang diamond usernam septemb issu includ queen b beyonc wear white usernam dress floral headdress usernam cover httpaddr
856,usernam usernam usernam usernam usernam still worri bro
857,taehyung model contract usernam httpaddr
858,usernam usernam see makeup space video slightli smile face
859,usernam usernam usernam ver si tienen talla smile face heart shape eye smile face heart shape eye smile face heart shape eye smile face heart shape eye
860,usernam usernam usernam usernam maravilhosaaaaaaaaaaa
861,smile face sunglass gotta luv usernam usernam shade natur freckl smile face heart shape eye heavi black heart camera scap hashtag ig httpaddr pictur
862,usernam usernam make space would scene
863,usernam usernam b k gibi
864,usernam usernam give money usernam support actual space travel
865,face well structur need model usernam somethinggggg
866,usernam usernam un nuevo dia de inicia black sun ray empezar escribir nueva historia person fold hand emoji modifi fitzpatrick type number number
867,usernam koretong xing zhe nigosheng dan ji nian dexian shang shitaratabunnu rarerudarouna hashtag hashtag hashtag hashtag hashtag niyu katakana hiragana prolong sound mark yo katakana hiragana prolong sound mark ku yanki katakana hiragana prolong sound mark su tm katakana hiragana prolong sound mark subo katakana hiragana prolong sound mark rukiyatsupu httpaddr usernam
868,recent met usernam event rock usernam fanni pack said damn fresh ever sinc see everywher around lo angel
869,usernam cheat usernam usernam face tear joy pictur
