,tweet
1173,usernam ik fuck see fine specimen httpaddr
1174,usernam usernam pleas care space usernam person fold hand emoji modifi fitzpatrick type number want safe
1175,usernam usernam usernam usernam usernam usernam usernam never pedimo nada pl usernam
1176,usernam usernam istanbul istanbul httpaddr
1177,usernam usernam numbershades_mor numberhadesgirlpdx pictur
1178,usernam usernam usernam usernam usernam usernam well said haha ok hand sign emoji modifi fitzpatrick type number purpl heart x
1179,cover shoot kathniel wear newest collect usernam daniel pnumber numberkathryn pnumber numberthey also wore gucci collect shoot know price lmao pictur
1180,saia tradicion identidad e estilo hashtag camiseta zara cinto usernam obrigado gustavoreisnumb hashtag hashtag hashtag hashtag hashtag httpaddr
1181,usernam usernam demet akalin alsin ona yakisir lasfmdkw
1182,hashtag excit tell hashtag relaunch hashtag hashtag httpaddr hashtag usernam hashtag hashtag hashtag hashtag hashtag hashtag
1183,back school flexin usernam flex bicep pictur
1184,usernam usernam outta world girl
1185,usernam usernam pictur
1186,usernam bag make last time happen bag went hashtag number week usernam usernam usernam cloth
1187,strike pose usernam beauti usernam fashion destin hashtag hashtag hashtag hashtag hashtag hashtag hashtag hashtag hashtag hashtag hashtag hashtag pictur
1188,soooo get usernam usernam make collab
1189,usernam usernam hola mi bella nina
1190,usernam give anoth campaign alreadi pictur
1191,usernam usernam makeup space
1192,zapato que hacen feliz usernam pictur
1193,wanna get someth made usernam
1194,usernam usernam usernam stun
1195,usernam usernam siempr tan bella crown tulip two heart bouquet
1196,love new bag usernam nice see usernam style inspir piec smile face smile eye heavi black heart pictur
1197,hashtag usernam hashtag sparkl sparkl sparkl hashtag hashtag hashtag hashtag hashtag hashtag hashtag hashtag hashtag hashtag hashtag hashtag hashtag hashtag hashtag httpaddr pictur
1198,got usernam back usernam hand pictur
1199,usernam heavi black heart usernam dark sunglass white medium star glow star sparkl dizzi symbol hashtag hashtag hashtag hashtag hashtag hashtag hashtag hashtag hashtag hashtag hashtag hashtag amsterdam centraal httpaddr
1200,usernam usernam jue dui zhao konaseruhazu heavi exclam mark symbol yu mitaidakara nuan kaig hao shiteyu shii
1201,photo credit usernam usernam usernam usernam usernam usernam hashtag hashtag hashtag usernam hashtag hashtag usernam usernam pictur
1202,usernam gucci medium backpack interlock g print number british pound real bargain httpaddr via usernam
1203,alessandro michel introduc stylish gucci gmt automat httpaddr usernam pictur
1204,moneysymbnumb number usernam hashtag make perfect hashtag absurdli rich ny yanke fan httpaddr pictur
1205,usernam usernam need know usernam shirt httpaddr
1206,usernam usernam full face makeup space tire face ok hand sign splash sweat symbol
1207,gucci drop headband tha cultur wipipo even wear mf lol usernam aint low lol hashtag
1208,usernam luxuri brand usernam ban angora wool usernam drop sponsorship deadli hashtag much clap hand sign number peta victori anim juli pictur
1209,usernam want pictur
1210,usernam usernam usernam usernam usernam usernam usernam usernam usernam usernam usernam thumb sign emoji modifi fitzpatrick type number number sign horn emoji modifi fitzpatrick type number number pictur
1211,usernam shang shou kucuo reta athlet shoe athlet shoe athlet shoe supreme_leaks_new usernam usernam usernam newerajapan _x_x_x_x_x_x_hashtag hashtag hashtag hashtag hashtag hashtag hashtag hashtag hashtag httpaddr
1212,usernam usernam go sister space see sister star take sister shit heavi black heart white smile face
1213,usernam usernam polic car revolv light aj got drip drip rim lion realiti tv televis air weekli cabl number usernam usernam usernam usernam usernam gucci usernam givenchyoffici hashtag hashtag httpaddr
1214,wool suit leather boot star usernam cruis number men lookbook serious overdress vacat httpaddr pictur
1215,usernam idk usernam think dare remov sacr mole photoshop
1216,usernam usernam affff vo te q te mata pictur
1217,usernam usernam yoooo ok hand sign clap hand sign
1218,usernam usernam london greater london httpaddr
1219,numberg gucci usernam hashtag hashtaghashtag hashtag hashtag hashtaghashtag hashtag hashtag hashtag hashtag hashtaghashtag hashtag hashtag hashtag hashtag hashtaghashtag httpaddr
1220,usernam usernam encantan tu frase camila smile face heart shape eye two heart two heart
1221,usernam usernam even surpris point would spend much pant
1222,_knumbertterl_ usernam get glass pictur
1223,usernam sign face roll eye pictur
1224,littl touch pink beat heart hashtag nancygonzalezoffici usernam gwynn mount pleasant httpaddr
1225,siempr tenido la asombrosa cualidad de abrir lo ojo despertar de perseguirlo todo con media verdad tu aparecist con la otra mitad dijist ven dejando todo claro nada podia fallar usernam usernam hashtag hashtag hashtag hashtag hashtag hashtag hashtag pictur
1226,usernam usernam haha tom ford gucci make dive suit mayb connect stuff
1227,usernam usernam usernam usernam usernam dapperdan loudli cri face ok hand sign
1228,usernam usernam soooo cute
1229,usernam usernam usernam could five part seri call space face elon musk gotta get shit rollin
1230,usernam model guy
1231,olha q modelo vc tao perdendo usernam httpaddr
1232,yu shikatsutasotsukusugetshitari x black heart usernam hitoetomoban nian buri nihui etahatsupi katakana hiragana prolong sound mark nari jin ri hakorekarajiu niyu yi zhao teshen gong hua huo firework sparkler hashtag hashtag hashtag hashtag hashtag hashtag hashtag hashtag hashtag hashtag hashtag hashtag httpaddr
1233,usernam usernam yeassss queen princess emoji modifi fitzpatrick type number
1234,usernam usernam usernam fine
1235,usernam usernam usernam usernam lol
1236,usernam usernam usernam hahah wellll think compar contrast style pun intend
1237,usernam usernam iiiiii weari face
1238,matter si usernam sweater httpaddr
1239,usernam usernam usernam usernam hook one dem yanke cap thank corey ur best
1240,usernam new arriv usernam ny yanke mlb slipper mule ok hand sign emoji modifi fitzpatrick type number number black heart sparkl smile face heart shape eye heavi black heart black heart suit green heart victori hand emoji modifi fitzpatrick type number viber number mobil phone rightward arrow left dm pleas new york new york httpaddr
1241,usernam usernam
1242,usernam usernam usernam usernam usernam usernam usernam usernam usernam thank repli much appreci director ate look invest futur london number number juli number pop exhibit menier galleri number southwark st london senumb numberru face stuck tongu wink eye smile face sunglass
1243,usernam httpaddr usernam go babi see hashtag hashtag usernam gucci usernam usernam usernam usernam usernam hashtag hashtag
1244,usernam hire pictur
1245,news usernam bullr welcom usernam usernam boutiqu httpaddr hashtag hashtag hashtag pictur
1246,usernam usernam usernam blow mind
1247,usernam usernam pleas hire model
1248,usernam usernam usernam victoria
1249,httpaddr usernam numberfutur usernam
1250,usernam usernam usernam omfg great time cv
1251,usernam pl hire usernam taehyung next gucci model smile face heart shape eye smile face heart shape eye purpl heart
1252,usernam usernam usernam usernam usernam usernam usernam usernam usernam usernam usernam upset charger reloc start root team reloc twice pictur
1253,awnumb cyborg collect usernam creativ director hashtag work along usernam team visual effect artist help achiev vision httpaddr pictur
1254,recharg necessari usernam market quick stop usernam pretti energ ador hashtag hashtag hashtag hashtag hashtag hashtag httpaddr
1255,usernam usernam icon
1256,usernam jfkfnrkdjf que belleza por favor usernam se que espera para contratar taehyung xd
1257,usernam usernam usernam usernam ci c est le citoyen lamda qui se gare comm ca sur le passag proteg giropod arriv un prune et l autr pass avec le pinc direct la fourrier et number euro cela et arriv un artisan de me ami qui lui travaillait et pour la pub
1258,usernam usernam usernam usernam espetaculo com qualquer roupa ou sem e em qualquer lugar
1259,like weird usernam remix someth
1260,usernam new usernam hashtag store ashmoreopt ashmorec haircut zero width joiner femal sign hair ricocco_hair hashtag hashtag hashtag hashtag hashtag hashtag hashtag hashtag hashtag hashtag httpaddr
1261,httpaddr usernam usernam usernam usernam usernam usernam usernam usernam usernam usernam usernam usernam usernam usernam usernam usernam usernam usernam usernam usernam yet arriv
1262,usernam usernam smile face heart shape eye
1263,white peacock paper sculptur gown creat success collabor vicki papa vergara photograph artist frame print order enquiri galleri httpaddr visit galleri number number bluff rd black rock vic usernam usernam usernam pictur
1264,ooo usernam love pictur
1265,need come rang sunglass usernam grab design usernam smile face sunglass hashtag hashtag httpaddr
1266,usernam k e p n k c r u b
1267,usernam smuggl ingredi around world airplan bag colombia sneaker usernam japan jacket usernam year ago stanc harlem day victori hand emoji modifi fitzpatrick type number next stop cape verd region indic symbol letter c region indic symbol letter v pictur
1268,usernam usernam men cruis number lookbook feast eye imag shot martin parr cann right httpaddr httpaddr
1269,gucci gaonrainxian ding deji neng de katsuy bixin man zai noberutobatsukuworiri katakana hiragana prolong sound mark su usernam hashtag httpaddr pictur
1270,usernam usernam usernam babi
1271,usernam usernam celebr get someth usernam
1272,usernam usernam usernam worldwid
1273,usernam love monkey monkey
1274,sparkl heart usernam handbag cherri blossom white flower hibiscu hashtag hashtag hashtag hashtag hashtag hashtag hashtag hashtag hashtag hashtag hashtag hashtag hashtag hashtag hashtag hashtag httpaddr pictur
1275,ok agre real fur vaccin babi b still support non cruelti free brand like fuck usernam get actual fuck httpaddr
1276,usernam usernam would fuck live
1277,cuando usernam usernam usernam usernam dema marca se querellen contra usernam usernam dema por permitir la venta de falsificacion su amigo hashtag ver si siguen permitiendo esta actividad lo pequeno empresario perjudicado le escuchan ver pictur
1278,usernam usernam fucci
1279,usernam hi pictur
1280,pleas announc arriv usernam watch store onlin httpaddr hashtag hashtag hashtag pictur
1281,make heart smile smile face heart shape eye hashtag heavi black heart sparkl heart heavi black heart gucci hashtag hashtag hashtag hashtag hashtag hashtag hashtag hashtag hashtag httpaddr
1282,usernam usernam usernam usernam oh gosh ye
1283,heavi black heart heavi black heart numberkomuro numberhizukakomuro usernam commedesgarcon chang suo dai guan yi httpaddr
1284,usernam usernam usernam tea felt like lazi art ngl
1285,usernam usernam usernam rude
1286,hashtag grace septemb usernam cover pictur wear usernam wed dress brand cruis collect larg floral hat altern cover also wear ruffl dress usernam hashtag hashtag pictur
1287,rather wear usernam fake usernam man
1288,usernam usernam usernam usernam usernam
1289,mobil phone rightward arrow left harri wore usernam jog trouser moneysymbnumb pictur
1290,featur usernam usernam httpaddr
1291,usernam usernam hashtag number usernam usernam usernam usernam usernam usernam usernam usernam usernam usernam pictur
1292,usernam olha que vc ta perdendo usernam um deu dess te amo taeta sparkl heart sparkl two heart sparkl heart sparkl sparkl two heart heavi black heart two heart heavi black heart sparkl two heart sparkl heart sparkl sparkl two heart sparkl heart sparkl
1293,usernam patrocina smile face sunglass multipl music note
1294,decor number collect usernam want turn ordinari home fashion mansion httpaddr hashtag read httpaddr pictur
1295,usernam latest obsess cocoa wood usernam smell like spici woodsi scent market bamboo usernam anoth nice uniqu scent happi person rais one hand emoji modifi fitzpatrick type number
1296,featur usernam usernam httpaddr
1297,guy talk recent trip usernam face tear joy massiv line door around corner usernam usernam hashtag happi client referr pictur
1298,video en ig via adamlambert usernam usernam httpaddr httpaddr
1299,usernam usernam collect ur man
1300,usernam brand like usernam usernam branch handbag dress chair ceram find luxuri retail make play housewar httpaddr hashtag hashtag hashtag hashtag
1301,usernam usernam hire model purpl heart sure miss beauti model like taehyung purpl heart dizzi symbol
1302,gucci nyc gucci usernam usernam usernam hashtag hashtag hashtag pictur
1303,usernam usernam get work done heavi heart exclam mark ornament heavi heart exclam mark ornament
1304,usernam usernam yassss queennnnx
1305,account moneysymbnumb walk store pretend ritch gucci usernam
1306,usernam usernam pictur
1307,usernam usernam usernam usernam usernam live best life k u
1308,usernam usernam nasa shook
1309,bueno dia black sun ray llego el lune dia de nueva oportunidad smile face heart shape eye nueva meta nueva esperanza leaf flutter wind asi que levant sun face lucha por lo que quier heavi black heart hug face beso face throw kiss camera flash usernam dark sunglass usernam httpaddr
1310,usernam usernam perhap new cultur white peopl tri adopt person see thing wrong usernam one love humili bulli pl cultur inappropri make sound like one
1311,video camera usernam usernam usernam httpaddr pictur
1312,usernam pleas give young man model contract smile face heart shape eye httpaddr
1313,usernam orang glad monday great time today septemb client fab friend usernam usernam usernam check groom fabul detail usernam httpaddr
1314,usernam hashtag hashtaghashtag usernam tbdress hashtag usernam usernam usernam usernam look forward style httpaddr
1315,usernam usernam usernam ksnsn kissi sjje look beauti number
1316,shot gqchina wear usernam dior shot httpaddr httpaddr
1317,love usernam loafer hashtag hashtag pictur
1318,twice minahabu kuguccinoguang gao ta usernam hashtag pictur
1319,usernam usernam usernam usernam usernam usernam usernam usernam hashtag hashtag hashtag hashtag
1320,el crown esta aqui victori hand emoji modifi fitzpatrick type number smile face sunglass fire fire hashtag hashtag hashtag black heart suit hashtag hashtag regrann dvlstylist usernam usernam unicef stylist dvlstylist httpaddr
1321,usernam usernam usernam usernam usernam sparrow honest happi guy hope enjoy usernam merch bird heavi black heart bird heavi black heart smile face smile eye
1322,usernam pleas sign fine ass fuck pictur
1323,usernam usernam ask sponsor shane seri
1324,yellow heart x yellow heart hashtag made heavenli dress usernam jelli shoe aso aquamarin gold ring carolinesvedbom sunglass usernam ahmaz gel coutur polish usernam shade httpaddr
1325,usernam usernam yaaa kween
1326,usernam gucci hurawa katakana hiragana prolong sound mark purinto minibatsugu httpaddr usernam korehoshiimai isou
1327,hashtag first chapter book god wear usernam usernam usernam hashtag httpaddr pictur
1328,usernam usernam usernam know
1329,everybodi wear usernam knock off bitch afford fake hashtag
1330,usernam case notic wear usernam soho disco bag everyth see one way style httpaddr pictur
1331,luxuri brand usernam ban angora wool usernam tennesse whiskey drop sponsorship deadli iditarod much clap hand sign number usernam victori anim juli httpaddr
1332,usernam usernam usernam insan ok hand sign realli love
1333,usernam usernam usernam seen better mani still look wonder
1334,usernam usernam usernam usernam usernam usernam usernam get button up man hashtag
1335,engriet dedic tiempo ti mism ribbon lindo domingo usernam ring hashtag hashtag pictur
1336,usernam u hire yet usernam pictur
1337,honestli still wait usernam usernam creat line togeth name httpaddr custom bag shoe gucci made jeffre smile face heart shape eye x
1338,usernam usernam baunya gimana kakk
1339,nearli week sinc order usernam still receiv anyth face roll eye
1340,someth design better version prettier eye horu cloth x usernam pictur
1341,possibl favorit hashtag shot definit favorit shot numberchainz drippid usernam look like final boss face video game video game microphon smile face horn hashtag httpaddr
1342,usernam usernam usernam usernam fuck love cherri pie that amaz
1343,hashtag compania como usernam usernam usernam invierten mile de dolar anual para anunciar su producto en mural pintado mano httpaddr
1344,hashtag usernam glass smile face sunglass face tear joy face tear joy face tear joy fun happi tuesday everyon hope stay cool hashtag hashtag hashtag hashtag hashtag httpaddr
1345,usernam usernam hashtag rock hashtag glass
1346,usernam usernam usernam agre geniou design gucci date wonder cloth farewel tour jacket perfect caus gorgeu brilliant rocket singer best like alway congrat alessandro michel great choic
1347,adam ig clip usernam usernam httpaddr
1348,omgggggg yessss like get collab usernam smile face heart shape eye usernam httpaddr
1349,usernam usernam usernam casen
1350,usernam usernam usernam usernam usernam usernam usernam usernam usernam usernam usernam usernam usernam pictur
1351,usernam usernam usernam usernam usernam usernam still use bibl app phone
1352,usernam usernam pl makeup space
1353,usernam usernam usernam classic keli face throw kiss
1354,usernam usernam bettel hire man someon steal
1355,dang forgot wear usernam could match usernam pensiv face pictur
1356,usernam usernam usernam usernam um lindo diamant que brilha com tanta beleza smile face heart shape eye
1357,current live usernam liter wear everyth resort wear collect actual make weep afford anyth
1358,usernam usernam estupendo dia cami que todo en tu vida est lleno de bendicion sabe que te quiero con todo mi corazon heavi black heart
1359,usernam usernam think would get much attent ajskalksjsj wig gone
1360,googl nic nerf gucci hav audio prepar video hashtag hashtag hashtag hashtag hashtag hashtag hashtag hashtag hashtag hashtag hashtag usernam usernam httpaddr
1361,shem mani south african pronounc usernam heard gutsi gushi etc got spend power call anyth like want us fanci shop mall hashtag also butcher european name chop moni
1362,usernam chime chang usernam return major partner number hashtag festiv nyc septemb number earn ticket take action via usernam app httpaddr hashtag pictur
1363,usernam usernam ye let endors brand usernam
1364,usernam usernam usernam usernam miss maggi style go liquid littl stock left sadli
1365,usernam usernam que bella ere princesita pasala bonito manana demuestral la del verd que ere muy buena
1366,apr usernam pour son hashtag number c est usernam qui choisi hashtag et notam le usernam comm showroom de present de leur nouveau model info white right point backhand index httpaddr pictur
1367,usernam touch jo hashtag hashtag hashtag hashtag hashtag usernam home town face stuck tongu tightli close eye face stuck tongu tightli close eye outfit detail usernam x jgalliano x usernam usernam x httpaddr
1368,congrat tribeca usernam doc fund grante angel made light world premier usernam httpaddr
1369,usernam smile face heart shape eye hashtag hashtag hashtag hashtag hashtag hashtag hashtag hashtag hashtag hashtag hashtag hashtag hashtag hashtag hashtag hashtag hashtag hashtag httpaddr
1370,usernam usernam usernam jaja se creen usernam
1371,face tear joy roll floor laugh hashtag usernam usernam hashtag hashtag numbersecondstomar hashtag hashtag usernam pictur
1372,sunni sam n sea smile face sunglass microphon water wave hashtag usernam sparkl katakana middl dot katakana middl dot katakana middl dot usernam usernam catalina island httpaddr
1373,usernam heavi black heart heavi black heart ok hand sign
1374,usernam usernam golden concept
1375,watch much usernam usernam show facebook time line face tear joy pictur
1376,hire kim taehyung pleas usernam
1377,walk usernam let pour drank walk usernam fxxk rack hashtag hashtagk otw
1378,usernam lux summer usernam oxygen_model rhedmodelmanag usernam usernam dior httpaddr
1379,usernam usernam asuuuu q bella esta lucianita un besot q siga teniendo un hermoso domigo kiss face smile eye kiss face close eye
1380,throwback one favourit perfum centuri usernam hashtag time hashtag direct brand fragranc output heaven soar tendril incens httpaddr
1381,great experi thank person fold hand emoji modifi fitzpatrick type number heavi black heart usernam pictur
1382,usernam usernam usernam neighbour drive one never seen anoth keep eye peel eye
1383,usernam usernam makeup moon pleas
1384,usernam usernam una linda sonrrisa pero solo es la belleza natur que irrdia sino la belleza espiritu que sobr sale en ti muy linda lucianita heavi black heart heavi black heart heavi black heart heavi black heart heavi black heart
1385,great servic alway usernam nordstrom shock appal horrif servic reviv today usernam montreal wow get program shame realli
1386,usernam feng ziyanakut batahuraideshita smile face open mouth cold sweat gucci niyu katakana hiragana prolong sound mark yo katakana hiragana prolong sound mark ku yanki katakana hiragana prolong sound mark su tm katakana hiragana prolong sound mark subo katakana hiragana prolong sound mark rukiyatsupu httpaddr usernam
1387,camera flash usernam strut street new york citi wear usernam usernam think look amaz guy think httpaddr
1388,usernam usernam sister snap
1389,usernam make babi pink white usernam edit jacket smile face heart shape eye sparkl heart splash sweat symbol would dope pictur
1390,usernam gang alpha phi soror ame ia httpaddr
1391,usernam usernam usernam usernam usernam omg thank like ur follow instagram g httpaddr buy sweeten queen smile face smile eye smile face heart shape eye
1392,usernam numberdarl someon make new jurass park movi star usernam awesom look right go go go grin face smile eye thumb sign
1393,usernam usernam mdrrr
1394,notic babe usernam usernam usernam usernam usernam usernam usernam usernam usernam usernam usernam usernam usernam usernam usernam usernam usernam usernam usernam usernam usernam usernam usernam usernam usernam usernam usernam usernam usernam usernam usernam usernam usernam usernam usernam
1395,usernam usernam go
1396,usernam usernam well world two heart two heart
1397,usernam collect model rn usernam
1398,usernam usernam usernam usernam super usernam zeca_vitorinoag para usernam pelo incrivei julianoezuel vest usernam beleza produto usernam usernam e shiseido tudo sephorabrasil httpaddr
1399,n vai com minha cara ou n curt minha marca suav temo outra tanta marca independent n vem com essa tua marra com uma peita da usernam que tu pagou number conto na net e achar q ta batendo kkkk
1400,usernam repost usernam gucciwitab hashtag hashtag hashtag hashtag hashtag hashtag hashtag hashtag hashtag hashtag hashtag hashtag hashtag hashtag usernam pictur
1401,cant afford usernam paint face kiss mark usernam x usernam icon fashion moment crown hashtag jamescharl jeffreestar pictur
1402,usernam usernam usernam usernam usernam usernam usernam usernam usernam usernam wear ram hat around town everi chanc get thank usernam pick team clue
1403,usernam uh hi pictur
1404,ye sokor usernam king blue heart httpaddr
1405,usernam pictur
1406,need practic differ style cloth saw new usernam kid fall collect concept color style omg love hashtag pictur
1407,usernam usernam usernam usernam sound like kid cartoon
1408,usernam usernam technolog us eg china counterfeit usernam usernam product decad also steal usernam presid stand china say
1409,usernam usernam usernam usernam perdao nao e por nada nao ma diant que ocorr hoje em dia e pelo fato de eu desconhec pessoa da foto e por curiosidad alguem pode respond e benino ou benina
1410,yo usernam come thru httpaddr
1411,usernam usernam usernam ne zaman alirsin bu oldukca sik urunu roll floor laugh
1412,usernam usernam usernam usernam usernam usernam usernam usernam usernam usernam usernam usernam cool current wear one san diego pictur
1413,usernam usernam usernam smile face heart shape eye heavi black heart heavi black heart heavi black heart heavi black heart
1414,usernam usernam
1415,usernam one pictur
1416,usernam today squad usernam usernam hashtag hashtag hashtag hashtag osu castl httpaddr
1417,usernam usernam loudli cri face loudli cri face loudli cri face xxx
1418,usernam fall shoestoddl size kid size order number number number httpaddr hashtag hashtag hashtag hashtag hashtag hashtag hashtag hashtag httpaddr
1419,usernam usernam gucci pa cuando pone mi bb de modelo pictur
1420,usernam usernam person fold hand person fold hand person fold hand kiss mark kiss mark kiss mark
1421,usernam usernam nasa x gucci yass face tear joy face tear joy
1422,big fashion hous like usernam usernam usernam femal influenc essenti celebr driven luxuri good market hashtag hashtag httpaddr
1423,usernam usernam usernam ur cutw wtf julia pictur
1424,usernam usernam usernam get see like white point backhand index white point backhand index httpaddr
1425,usernam usernam harri sweeti probabl get trouser primark psnumber
1426,usernam u get kim taehyung model pleas rest bt like pleas httpaddr
1427,scream usernam pictur
1428,usernam usernam want lick man chest hair man hot
1429,even though nail polish first ever usernam purchas usernam would proud pictur
1430,usernam usernam usernam kill x
1431,neg squar latin capit letter g neg squar latin capit letter e neg squar latin capit letter neg squar latin capit letter neg squar latin capit letter h neg squar latin capit letter e neg squar latin capit letter l neg squar latin capit letter neg squar latin capit letter neg squar latin capit letter k trouser httpaddr usernam hashtag hashtag hashtag hashtag hashtag hashtag hashtag hashtag hashtag hashtag hashtag hashtag hashtag hashtag hashtag fsllso usernam pictur
1432,usernam usernam probabl right tho custom buy cloth caus know ever look good
1433,usernam get real kinki pictur
