,tweet
0,usernam long take get ship confirm purchas tuesday morn yet get type email item ship
1,usernam size got even smaller problem size alway small true fit size realli new uk measur compar size modern women twig confus pictur
2,usernam lab pictur
3,usernam usernam usernam usernam usernam amaz
4,usernam hashtag us cancel number item without contact number number item wrong size say chang size sent next size that bcuz r smaller size bigger size other refund untrustworthi horribl servic
5,usernam usernam usernam stupenda manila buona serata
6,usernam usernam usernam usernam one one sponsor famou anyth want one two outfit month
7,usernam usernam ye pleas smile face heart shape eye happili rt follow grin face
8,usernam httpaddr
9,check strawhat bucket style marni hm necklac embellish vintag wonen httpaddr usernam usernam hashtag hashtag usernam
10,sponser usernam pictur
11,usernam usernam usernam usernam usernam usernam usernam usernam usernam usernam usernam usernam usernam usernam usernam sound like good ad copi human anyth put place one human race vari shadow skin color one fashion call usernam thumb sign know scientif basi race made label httpaddr pictur
12,usernam usernam ball budget face tear joy save hous garden told even eat much face tear joy
13,usernam usernam text u
14,usernam realli cool design hashtag collect done conscious bummer see someth cool put back cuz meet hashtag cri cat face hashtag hashtag
15,usernam usernam usernam mix unrel thing lie
16,usernam hi offer free return
17,tercera vez que funciona el pago con movil en usernam usernam se arreglara alguna vez
18,usernam usernam daughter number hit puberti bloat took h get top love came tear convinc fat disgust never set foot shop took month repair damag one incid caus
19,usernam order item onlin sent wrong size
20,usernam usernam usernam thank raimonda long babi emoji modifi fitzpatrick type number number xx
21,discov usernam store today spent moneysymbnumb face tear joy
22,usernam usernam usernam usernam usernam glamor hot attract
23,usernam usernam usernam heavi black heart heavi black heart heavi black heart shorter short pa hahahaha
24,usernam usernam hello contact alshaya h sorri hear experi pleas kindli send contact inform httpaddr escal custom care thank
25,usernam usernam usernam usernam usernam usernam usernam usernam usernam usernam usernam usernam gorgeou mr
26,lazi social media want say hi wish happi friday numberhashtag usernam hashtag hashtag hashtag hashtag hashtag hashtag httpaddr
27,por favor admirad esta httpaddr yo comprando el en usernam del usernam en la zona de nino dice mi hermano tata mira esta chancla empec desconar lo mejor es que era la unica que estaba asi hizo muchisima gracia al verlo enserio xd pictur h
28,hm usernam retail line fall read upcom develop bfc partner usernam via usernam hashtag hashtag hashtag httpaddr
29,person still fuck usernam
30,usernam hashtag help lighten logist burden hashtag tackl straightforward request custom heavi hitter like usernam usernam usernam usernam usernam usernam use tech httpaddr
31,usernam usernam usernam _jdmnumber thank retail roger
32,usernam numbermoneysymb usernam
33,quick tutori uruguay flag sun nail artfor nail use el_corazon_shop number iron hard usernam goldenroselebanon color expert number usernam un get httpaddr
34,h group establish stori brand usernam httpaddr usernam usernam usernam usernam hashtag hashtag
35,aji devgn taanaajii men anttaagoni devanagari sign virama tt kaa nibhaaeng kirdaar httpaddr hashtag usernam usernam usernam hashtag hashtag usernam usernam usernam
36,usernam number number live best life shirt usernam pant forevernumbermen clutch hashtag boot usernam hashtag hashtag hashtag hashtag httpaddr
37,usernam usernam aka itchi scratchi limit edit run
38,usernam usernam total agre cat x
39,littl usernam model two heart pictur
40,usernam love usernam
41,build hashtag stand crowd world hashtag invit hashtag follow design new cloth line cours like usernam new brand hashtag httpaddr hashtag pictur
42,repost usernam band mendadak hawaii usernam jooxlivenow x usernam hibiscu httpaddr
43,usernam know right client board meet wear vintag usernam usernam dress hashtag usernam sneaker flush face
44,number year ago white point index emoji modifi fitzpatrick type number thx amaz shoot camera flash maddim usernam person rais hand celebr emoji modifi fitzpatrick type number hashtag hashtag_man hashtag hashtag hashtag hashtag hashtag hashtag hashtag hashtag hashtag hashtag hamburg germani httpaddr
45,usernam usernam zi fen nooji gadonnamonokafen katsuterunotsuteda shi yone
46,ever restock usernam usernam
47,usernam usernam usernam done
48,usernam usernam help persuad movement pleas
49,usernam usernam usernam report offic data protect
50,usernam numberflattrack usernam usernam usernam encanta tenerlo todo en comunidad smile face heart shape eye smile face heart shape eye smile face heart shape eye hashtag hashtag httpaddr
51,usernam usernam total get hate shop manipul size like affect someon
52,usernam niagara fall store come along nicelyhashtag hashtag hashtag hashtag hashtag hashtag httpaddr
53,usernam usernam sarasota airplan nyc hashtag travel look smile face sunglass bag usernam shoe usernam usernam short usernam glass usernam httpaddr pictur
54,final fit usernam size number done guy hashtag
55,hashtag ev usernam hashtag usernam hashtag hashtag hashtag hashtag hashtag hashtag hashtag hashtag hashtag hashtag hashtag hashtag hashtag httpaddr
56,usernam pleas help heavi black heart amaz httpaddr
57,usernam usernam usernam usernam hashtag hashtag hashtag hashtag hashtag hashtag usernam hashtag usernam usernam hashtag usernam usernam usernam hashtag hashtagscout hashtagscout usernam hashtag hashtag hashtag hashtag usernam pictur
58,usernam usernam usernam usernam store class number xl zara larg uk number
59,hashtag usernam home tropic furnish got us summer holiday dreamin sun face tropic drink pictur
60,usernam j aim une video usernam optimu bt bangtansonyeondan mic drop remix ft steve aoki usernam danc cover medan indonesia number
61,usernam yogareinv new top pictur
62,emerg cord leamington usernam tie number metr floor much use someon fall need use pictur
63,usernam usernam pari ile de franc httpaddr
64,usernam usernam oop shop smile face sunglass
65,jelli fish hashtag white larg squar yourfavoritealienblogg white larg squar hashtag outfit usernam clear umbrella usernam top usernam pant usernam yrusho qozmo httpaddr
66,usernam usernam usernam usernam usernam usernam httpaddr
67,_americaneagl usernam usernam
68,count day till wear fave leather jacket love instantli dress good pair boyfriend jean speak jean got usernam moneysymbnumb httpaddr
69,usernam tienda valencia aqua planta de arriba sin air acondicionado insoport para lo client inhumano para la trabajadora
70,usernam usernam sui fen tohui retaguang wofang tsuyang ninatsutamonodanayu yoqi fang hahe mozhao rasetehaoranutadanoren jian gasi niji buhazuganakar pictur
71,today serious contempl buy pair matern pant usernam look soft comfi perfect flight tomorrow eventu abl talk tri
72,usernam usernam usernam usernam usernam usernam
73,number till open usernam whitgift number peopl queue hashtag
74,numberocean recycl usernam great program old cloth usernam lose cost effect usernam want start mike clean theme song need work httpaddr shoutout numberocean usernam
75,love ironi usernam hashtag pictur
76,usernam usernam work tini mannequin size number realli annoy put great look togeth spend age scout shop item well done
77,went usernam brows end drop numbermoneysymb massiv sale hashtag
78,nicht nur dass usernam der vermutlich langsamsten liefernd onlineshop ist nein sie setzen auch rechnungsdatum gleich bestelldatum damit ist man bei dem schneckenversand und gleichzeitig vierzehntagig zahlungsfrist u u im verzug ohn uberhaupt die ware erhalten zu haben
79,alway mistak bring usernam within number feet usernam never fail come number new plain tshirt probabl alreadi number face roll eye face tear joy
80,usernam usernam number daughter appropri age size number get size number cloth ridicul
81,usernam usernam usernam size mess genuin item small medium larg fit consist
82,refus shop onlin usernam due use usernam constant miss late deliveri despit claim deliveri option hashtag hashtag hashtag hashtag hashtag hashtag
83,indian govern hike custom duti intern brand number number bid save hashtag hashtag next time go buy someth usernam usernam usernam readi pay extra buck say pictur
84,size product bought vs size box usernam need work pictur
85,usernam usernam la blanch sur une blanchela noir sur une noir
86,littl shop trip usernam face tear joy face tear joy face tear joy face tear joy
87,usernam think face medic mask pictur
88,usernam usernam gorgeou host make hashtag battl band infinit fun hundr point symbol ayesha omar stun outfit usernam usernam ear usernam makeup hashtag hashtaghashtag hashtag hashtag hashtag pictur
89,usernam disgust wrong shame fun lose custom asshol pictur
90,usernam enter usernam intern hashtag w elev co win moneysymbnumb gift card usernam httpaddr
91,usernam usernam usernam sad great life moment
92,usernam usernam great get cloth kid want day ago long shop close face tear joy roll floor laugh face tear joy love cloth
93,usernam never buy h order someth number number packag still call custom servic packag tell anyth alreadi see sign websit
94,usernam usernam usernam look fabul smile face heart shape eye smile face heart shape eye
95,usernam usernam note parcel say sent number fit usual buy number wait usernam respons
96,usernam usernam usernam usernam beauti
97,usernam usernam usernam love hair
98,usernam usernam oh love x hashtag
99,shoot star lovenumbereva hashtag yyxi esta na playlist da loja h e ela ja foi tocada na loja do usa uk video abaixo usernam e uma loja de roupa e acessorio bastant famosa na europa pictur
100,usernam usernam wonder
101,usernam usernam usernam usernam usernam usernam usernam usernam feliz mart intentar verla ma tard mucho beso
102,usernam usernam love weather could new cloth
103,usernam usernam usernam usernam usernam usernam usernam usernam usernam usernam usernam usernam aye dope person rais hand celebr emoji modifi fitzpatrick type number film
104,today rock usernam usernam usernam usernam usernam fire fire pictur
105,good thing got brow microblad went bali trip thank kacey_lo semi perman brow camera riaguiaomana round pushpin theoasiskuta bikini usernam httpaddr
106,huge potenti usernam truli impact innov fashion design w industri truli need innov ever usernam start think angela hope investor see cc usernam usernam usernam
107,usernam white cashmer sweater march number may last year failur present year success usernam skinni jean usernam think like queen queen afraid fail failur httpaddr
108,usernam usernam usernam usernam usernam usernam daddi
109,bedrovligt att hora vilka villkor usernam anstallda ny lever och att usernam int staller upp pa intervju usernam hashtag ar dalig krishant
110,usernam usernam look good laura hope great day
111,first time order usernam com usernam good first impress
112,fuck usernam pictur
113,usernam usernam usernam usernam j ai toujour di que plusieur de ce femm devraient apprendr de toi tu es petit femm fort simpl et class es croquer
114,hdhh ntyj htmyh mn arab letter alef lldhyn l arab letter alef yqymw sh arab letter alef r arab letter alef l arab letter alef sl arab letter alef w arab letter alef lshb arab letter alef lsyan arab letter hamza h arab letter alef lti r arab letter alef fq arab letter alef lft arab letter alef h w arab letter alef ml arab letter alef n yt arab letter alef l arab letter alef l q arab letter alef b ht arab letter alef llw arab letter alef ty grrn bh arab letter alef usernam
115,usernam usernam usernam dealio number get cover smile face heart shape eye
116,usernam love spread latt smile face heart shape eye face savour delici food round pushpin craftsman wolv sf ca top usernam skirt usernam craftsman wolv httpaddr
117,usernam usernam bil devanagari sign virama kul shii khaa
118,marico hay demasiada oferta en usernam blue heart
119,usernam tresberc lo voy estrenar seguidito jajaja ya te dije que era un poco ansiosa see evil monkey pero es que lo como camiseta usernam culott tresberc zapa usernam httpaddr
120,hey usernam warum gibt es eur chino nur slim man sieht den pimmel au numberkm entfernung durch die hose fit
121,usernam bad web suck launch new collab without crash
122,usernam usernam usernam usernam usernam httpaddr
123,usernam fy fan vad kasst usernam thumb sign emoji modifi fitzpatrick type number
124,enter sensiblestylist intern hashtag w elev co win moneysymbnumb gift card usernam httpaddr
125,nederland wordt jaarlijk number miljoen kilo klede bij restafv gegooid zond number klede prima geschikt voor recycl lever klede apart bij inzamelcontain inzamelpunten zoal usernam usernam en ontvang kort nieuw aankoop lee httpaddr pictur
126,usernam usernam kind thing normal take number number jeg put number number trouser certain differ size across differ compani style horrend cri cat face
127,usernam usernam usernam usernam usernam httpaddr
128,une marqu de vetement qui voil de gamin dan se pub c est normal usernam vou degout votr opportunism est scandaleux usernam usernam usernam
129,h fulli fashion shoe black usernam httpaddr pictur
130,usernam gmdesu clap hand sign mei rong shi noxiu ri smile face sunglass beach umbrella dolphin setsutoshinaitohairaitogaxun ran ndehobojin fa happi person rais one hand zero width joiner male sign top usernam xlpant usernam mshoe havaiana numberaccessori hashtag hashtag katakana hiragana prolong sound mark ran hashtag hashtag hashtaghashtag httpaddr
131,ptdrrr j sui au bout usernam le seul articl que j attendai le plu vou l avez annul loudli cri face loudli cri face broken heart
132,usernam staff said size manikin caus shop open dumb ask
133,feel seri come sparkl embrac inner goddess grow glow sparkl hashtag photograph eyemonea shay_bay_numb mua usernam ear usernam hair usernam httpaddr
134,usernam realli poor servic merryhil branch till op busi moan custom serv
135,usernam usernam wish could retweet
136,usernam usernam usernam ensur littl one fun style bright trendi rang summer outfit usernam usernam hm usernam usernam r b usernam usernam usernam hashtag pictur
137,usernam usernam yea bro got shirt usernam
138,usernam usernam thank
139,hashtag sock realli favourit thing world usernam realli great sock httpaddr camera flash andrea morleysho usernam sock usernam jean usernam hashtag hashtag hashtag pictur
140,usernam usernam usernam usernam usernam usernam usernam usernam usernam usernam usernam usernam white boy rick
141,number numberhashtag hashtag hashtag usernam love usernam hashtag usernam hashtag hashtag woman cloth usernam dress usernam ear emoji modifi fitzpatrick type number link symbol usernam pictur
142,h black sun ray summer usernam httpaddr
143,usernam hashtag_kli arab letter alef t_ arab letter alef ltrbyh_ arab letter alef ly_mtysydi slm arab letter alef n sydi wli arab letter alef l hd arab letter alef l mt qdytn arab letter alef kingsalman usernam usernam usernam usernam usernam
144,le sold selon h think face usernam usernam hashtag pictur
145,usernam usernam usernam usernam usernam usernam usernam good question
146,usernam j ai fai deux command dimanch et le coli sont toujour pa envoy pay de frai de port pour recevoir le coli un certain jour et il n est toujour pa parti de vo entrepot c est un peu chiant
147,usernam usernam usernam thought hate asian
148,usernam cherri blossom quelqu photo hier dont ce hashtag simpl mai confort pantalon usernam debardeur noir collier hashtag et chaussur usernam que j ai quitt plusieur foi pendant la soire httpaddr
149,souvenir le mond number number number h usernam le pret porter qui n aim pa le port httpaddr
150,usernam usernam usernam everyth wrote perfectli phrase good writer
151,usernam usernam usernam heart arrow heart arrow heart arrow
152,hm go rectifi httpaddr
153,great day great day blue heart camera flash photograph usernam dress stylist creativ director dress kei mill usernam usernam woman cloth shirt usernam jean pant usernam hashtag hashtag hashtag hashtag hashtag hashtag hashtag hashtag hashtag hashtag pictur
154,usernam still w shit huh httpaddr
155,usernam send wrong size order tire face tire face tire face tire face
156,usernam hashtag
157,usernam hi h anyth help get skirt two heart need pleas help thank x httpaddr
158,uygulama surekli hata veriyordu simdi uygulamaya giri dahi yapamiyorum kac sefer silip silip yukluyorum hala devam ediyor usernam pictur
159,yessss usernam guy origin mad usernam pictur
160,usernam usernam crazi ennit grin face smile eye
161,usernam usernam usernam leur magasin ont ete saccag
162,usernam usernam _iaminvictu good pictur
163,usernam usernam like number differ system measur everi chain take pretti sure even standardis concern number tag price see fit ignor rest
164,usernam usernam usernam usernam usernam usernam usernam usernam usernam usernam hashtag see v tulip grin face smile eye region indic symbol letter r region indic symbol letter usernam usernam usernam victori hand usernam usernam usernam usernam usernam usernam usernam usernam usernam usernam usernam usernam usernam usernam usernam usernam usernam usernam pictur heaven la vega
165,usernam pictur
166,sabah numbera kadar number al number ode yapan tam odem kismina gececekken sitesini bakima alan h onlin mi usernam usernam
167,usernam usernam usernam usernam usernam shmsher sinh dhiyaa ke devanagari sign virama yaacaaron kii khaanii httpaddr
168,noth beat classic black wing eyelin noth beat kickass black smokey eye go use usernam eyeshadow look say pleas httpaddr
169,usernam un dia de loquera tocarl un seno julieta perdon julieta x blusa cartera negra de usernam falda disney collect de zara calzado usernam busca en mi highlight sparkl verona httpaddr
170,usernam usernam usernam aww man fat small thank much look heavi black heart heavi black heart
171,usernam usernam beauti woman
172,usernam usernam usernam let start clubbbb two heart
173,tire usernam act like fuck stockroom cannot product fuck liar
174,usernam usernam wow explain noth ever fit h size number number almost everi shop accord measur would number number face palm emoji modifi fitzpatrick type number zero width joiner femal sign
175,let innoc scapegoat fear mistrust believ everyth see whatsapp hashtag usernam usernam usernam usernam usernam usernam usernam usernam usernam usernam usernam pictur
176,usernam pleas chang right price buy pictur
177,hashtag resist marchsunni usernam shirt h short usernam shoe usernam pictur
178,usernam bargain number old worn use pair shoe guy gener pictur
179,bag vibe match decor photo right cute tropic pineappl cushion usernam though usernam bag charm serv well httpaddr
180,usernam _juliabeii jahah ok fan allr hm saljer
181,usernam asi fueron mi look de hashtag glow star dia hashtag hashtag en moda colombiana usernam especiapap el dia hashtag de usernam glow star usernam fue otra vez una semana muy interesant llena de httpaddr
182,usernam usernam plug person fold hand emoji modifi fitzpatrick type number two heart
183,look mere fill two heart avec robe usernam solde sparkl hashtag hashtag hashtag hashtag hashtag hashtag hashtag httpaddr
184,usernam usernam usernam usernam usernam usernam usernam look good kati x
185,usernam pourquoi pa le star ne sont pa forcement cell qui ont le plu de follow sur le reseaux sociaux il deja fait plusieur pub pour usernam wink face ok hand sign emoji modifi fitzpatrick type number
186,usernam usernam haha
187,let set scene number number pm cross counti usernam walk usernam buy cute short multipl color charg employe said theyr close store close number pm x serious face roll eye pictur
188,usernam idea rest gp j baker collect go avail onlin hashtag
189,siviazizah usernam httpaddr
190,hm launch new fragranc collect number scent collect creat one world lead perfum hous givaudan hashtag httpaddr hashtag pictur
191,usernam usernam usernam snap camera flash rais fist emoji modifi fitzpatrick type number
192,usernam broken heart pictur
193,usernam tri look stock level cloth websit show item avail help pleas
194,usernam usernam usernam usernam nice outfit candac
195,x emoji modifi fitzpatrick type number come homex emoji modifi fitzpatrick type number usernam hashtag hashtag rondini_officiel hashtag hashtag hashtag london stanst airport httpaddr
196,usernam usernam usernam cultur leech
197,os animo contactar tanto con usernam como con usernam para preguntarl acerca de su posicion ant esto ataqu lo hashtag hashtag en su web tienen formulario de contacto es nada dificil encontrarlo httpaddr
198,hashtag usernam hashtag hashtag usernam httpaddr
199,usernam unsubscrib list least number time still receiv mail want take time sure breach gdpr contact discuss
200,wir fordern von usernam usernam sauber herstellung modeketten durfen die umwelt nicht zerstoren unterzeichnet httpaddr
201,dont want piec save daili look effortlessli hit us httpaddr cheap afford guy rmnumber per pc rt untuk rezeki saya sparkl pictur
202,usernam usernam
203,totalment inlov con est banador de usernam tenei uno parecido en usernam small orang diamond banador pendient h small orang diamond gafa primark en alcazar de san juan httpaddr
204,sale advis usernam hashtag hashtag hashtag number hour per weekinfo appli httpaddr pictur
205,usernam usernam usernam long shot email account redirect account check ie unsubscrib right email account
206,usernam usernam usernam usernam tu tue pour le sac loudli cri face loudli cri face face tear joy
207,wonder size martin cacer short would advertis h hashtag usernam hashtag
208,usernam u r crush pl give hoodi bday httpaddr
209,abito partir da number numbereur pero tu sei special e quello che piac te sta number number nuova collezion usernam usernam usernam hashtag
210,usernam number number cri last time went fit cloth size pick someon struggl disord eat kinda shit help feed idea bigger actual usernam
211,never buy usernam onlin even get confirm order ship sure go ahead take money account revers hand middl finger extend
212,usernam visit store oxford street cloth like size number number stock new line ask size readili avail hashtag
213,usernam contact order pleas
214,h mdesama katakana hiragana prolong sound mark se katakana hiragana prolong sound mark rushi shi zhong zui da number ninarimasuyo number numbermad hashtag hashtag hashtag hashtag xing hashtag zi lu hashtag usernam pictur
215,usernam usernam yep
216,unless usernam usernam etcc wanna sponsor face tear joy
217,usernam usernam usernam yesterday size number size number
218,n est pa meilleur celui qui vend le plu usernam vend moin que usernam et pourtant bisou plair tout le mond c plair n import qui comm dirai notr ami usernam httpaddr
219,usernam __missgem number number fan crown white point backhand index emoji modifi fitzpatrick type number
220,sick go usernam find someth like find go size size number number number stock talk target custom face roll eye face roll eye
221,usernam matern babi sale speak evil monkey smile face heart shape eye girl emoji modifi fitzpatrick type number number ooooop hashtag hashtag
222,usernam bitch could neverrrrrr face tear joy yo save grace usernam employe crazi face tear joy
223,usernam usernam becom taller plz thx
224,advertis sunday readi wear favourit usernam combo inform desk person emoji modifi fitzpatrick type number zero width joiner femal sign black sun ray shop outfit usernam take screenshot shop app white right point backhand index emoji modifi fitzpatrick type number httpaddr pictur
225,usernam usernam hatsun miku fire number unethicnumberl manufactornumberng practic number
226,usernam yall r bitch ever respect thank u play shine loona ur playlist
227,usernam worst experi h beckton store today honestli put shop rest life pleas let know complaint process
228,usernam garbag cloth garbag peopl use actual garbag fire
229,usernam usernam probabl check employe shrug emoji modifi fitzpatrick type number zero width joiner femal sign
230,usernam usernam fascinerand la en bestalln pa ett par nya birkenstock pa footway nar jag lag pa stranden sondag fann att hamta pa mitt ombud igar mandag att det kan vara en san sjuk skillnad face without mouth
231,usernam usernam usernam im number number usual buy trouser work end leav store size number wedgi tight shit self esteem
232,meant sale next year usernam usernam pictur
233,usernam usernam usernam usernam usernam usernam usernam usernam usernam usernam wherz usernam usernam time give gyan
234,usernam _itscindynumb usernam
235,usernam happi person rais one hand
236,usernam usernam numbernonumb also endors usernam usernam usernam usernam year much keep busi pictur
237,summer day best spent breezi dress high waist trouser statement tee smile face heart shape eye gorgeou blogger fashion entrepreneur usernam rock gorgeou outfit courtesi usernam grab look store smile face open mouth smile eye pictur
238,usernam usernam usernam
239,forev grate usernam cloth toddler popper collar got babi big noggin definit make dress easier pictur
240,urg una idita usernam
241,usernam question order
242,usernam usernam deja qu en magasin trouv pa le taill au dessu du number
243,usernam usernam mai wsh face tear joy
244,gave usernam entir number year ago averag size number number fit cloth httpaddr
245,usernam son model cloth look ador number year old wear h cloth pictur
246,usernam ever cheetah like cheat michi like saint michel usernam drita got back go jail teresa time face stuck tongu tightli close eye lol usernam usernam like put bullet arm obi get never hat usernam pictur
247,moneysymbnumb usernam httpaddr usernam pictur
248,usernam usernam narendramodi hm
249,young hashtag handl smile face smile eye hashtag hashtag hashtag usernam lakewood center httpaddr
