,tweet
5313,look updat sport wear moment usernam launch new campaign call togeth hashtag hashtag httpaddr pictur
5314,shop usernam shop germani play graffiti smile face heart shape eye usernam usernam usernam usernam
5315,usernam usernam usernam usernam usernam usernam usernam usernam usernam usernam usernam bulg
5316,usernam usernam love izzi sad see collabor compani brand like broken heart pictur
5317,usernam usernam usernam amaz know thank share
5318,usernam usernam lk pictur
5319,pose garden x hot pepper ear maiz carrot tomato mushroom hashtag hashtag hashtag woman hat woman hat woman hat usernam woman cloth en novosibirsk russia httpaddr
5320,usernam usernam usernam rude blatantli wrong size call babe patronis
5321,project effect offer fantast exampl valu chain engag actual look like particip rang plastic produc aquafil make nylon yard carpet textil brand usernam httpaddr hashtag
5322,saw pair ear usernam monday buy larg ear collect alreadi buttttt stop think sinc think make okay buy right
5323,usernam yo mn retourtj op number juli bij julli binnen gekomen maar heb hier nog geen bevestig e mail van gehad mijn geld terug dit gaat normaal keisnel jongen loudli cri face
5324,normal fit uk size number could bare fit size number cloth someon usernam pleas explain bizarr size current work truli damag physic mental well mani peopl especi young girl boy httpaddr
5325,im mad order number pair pant h that place buy pant took forev get everi pair wrong size wtf usernam im big mad
5326,usernam usernam top giveaway confetti ball face savour delici food smile face heart shape eye
5327,dark sunglass bring back hot sunni day park _hashtag usernam hashtag hashtag hashtag hashtag hashtag hashtag hashtag hashtag hashtag hashtag httpaddr
5328,hashtag fila el ganador de number mil peso el cort de liston checa aqui todo lo detal de la apertura de usernam httpaddr pictur
5329,usernam desper want beauti blue dress featur photo number number galleri httpaddr modest ltd collect find onlin
5330,eeyi h takma tirnagi tukurukl mi yapistirayim niy icin yapistirici koymadiniz ya usernam usernam
5331,dinosaur short epic b make butt look great peach also casual casual friday went usernam lunch break purchas skirt hashtag hashtag hashtag hashtag usernam hashtag pictur
5332,hashtag area shopper flock open h usernam httpaddr usernam pictur
5333,shout usernam make sale shirt rainbow pictur
5334,usernam usernam usernam est plu ca pre
5335,never buy onlin usernam ever ship suck
5336,usernam one favorit brand never buy anyth anymor encourag friend hashtag hashtag usernam hashtag usernam hashtag hashtag hashtag
5337,r p e green heart love short pick usernam sale green one favourit colour keep simpl today plain oliv green basic tee also h httpaddr
5338,usernam usernam u crazi mind
5339,usernam usernam usernam usernam usernam httpaddr
5340,usernam usernam usernam um shop usernam face good gestur emoji modifi fitzpatrick type number zero width joiner male sign octagon sign
5341,usernam ankl sock one wear hashtag hashtag hashtag hashtag usernam pictur
5342,usernam need hoodi httpaddr
5343,hashtag day number line list petit biscuit miguel sg lewi sza grin face smile eye wrap usernam alway look like tropic kid way smile face sunglass hashtag hashtag httpaddr
5344,usernam usernam usernam usernam usernam hollywood look fantabul
5345,usernam usernam today rock number style jean
5346,disappoint usernam cloth size size number number today bare fit size number skirt make tri number mani women take size heart sort pout face pout face
5347,usernam usernam yep similar experi yesterday buy toddler bag tot incred hashtag still market tool nearli screen non gender window look like son get girl one duck girl get boy one dinosaur usernam pictur
5348,usernam usernam smile face open mouth tightli close eye
5349,usernam usernam usernam usernam usernam hashtag hashtag hashtag httpaddr
5350,usernam usernam horribl
5351,usernam usernam keep straight face top usernam jean usernam shoe forevernumb bag usernam hashtag hashtag hashtag httpaddr
5352,usernam bring back loafer white frown face white frown face white frown face pictur
5353,hashtag movement make enough nois eventu hurt perpetr pocket intern compani like bad hashtag usernam usernam usernam usernam usernam usernam
5354,wonder usernam hashtag back stock usernam usernam httpaddr
5355,usernam usernam usernam shrink two size first wash cold water look usernam
5356,usernam search jean year alreadi sold weari face weari face weari face weari face weari face weari face weari face weari face weari face weari face weari face weari face weari face sleepi face sleepi face sleepi face sleepi face pictur
5357,usernam hi given code email recent inquiri free deliveri number code work abl assist
5358,sure usernam size xs think want weekend hashtag pictur
5359,usernam usernam usernam usernam usernam follow back bb
5360,usernam love shirt short set perfect warmer weather pictur
5361,usernam cominciar la settimana con due colori che amo azzurro e httpaddr di usernam e sandali di usernam dimenticavo buongiorno grimac face flex bicep emoji modifi fitzpatrick type number number face throw kiss heavi black heart hashtag hashtag hashtag hashtag pictur
5362,usernam usernam wild takeov begin
5363,hey usernam usernam usernam usernam usernam amaz candid tri unseat jim jone need littl profession polish could one run offic could help
5364,usernam congratul come vermont pleas send money food money
5365,usernam usernam yassss
5366,usernam usernam usernam usernam usernam usernam
5367,creat clear view usernam hashtag black heart smile face sunglass hashtag hashtag hashtag hashtag hashtag httpaddr
5368,usernam usernam usernam love
5369,usernam usernam usernam usernam branch saw smile face heart shape eye
5370,usernam usernam usernam uh oh
5371,usernam usernam go travers mountain
5372,got amaz trouser playsuit yesterday usernam reduc psnumber love heavi black heart smile face heart shape eye ultim favourit shop minut nearli entir wardrob lol face tear joy
5373,usernam usernam thumb sign emoji modifi fitzpatrick type number smile face heart shape eye
5374,world hashtag becom huge sourc global wast good see compani like usernam invest hashtag solut number number fiber use garment natur deriv today around number httpaddr
5375,usernam usernam adult much prefer men tshirt
5376,usernam order onlin first time disappoint never receiv email say stock stuff order call cs even apolog last time order onlin hashtag
5377,usernam enter usernam intern hashtag w elev co win moneysymbnumb gift card usernam httpaddr nice use prize
5378,usernam usernam usernam usernam usernam tu dice que el trabaja como sabe ah de vera que ud ni acostumbran ir al teatro pucha lo siento te alumbro existen
5379,usernam usernam usernam usernam usernam usernam aw thank darl feel sel must admit face tear joy
5380,shoutout keith model gabe amaz stylist hahaha also usernam cool lookin fit fire fire fire style enquir pl hmu httpaddr
5381,usernam usernam usernam usernam
5382,bueno dia de domingo ya sabei q soy yo mucho de ensenar hashtag por aqui pero est pantalon encanta top usernam pantalon usernam zapato httpaddr httpaddr
5383,usernam wait packag number week problem explain pleas upsid face
5384,never step foot usernam worst experi life
5385,usernam usernam usernam usernam usernam usernam usernam usernam usernam usernam usernam usernam usernam number usernam usernam usernam usernam usernam usernam usernam usernam thank share
5386,also none usernam link bottom ship email work
5387,absolut buzz usernam phone case last less one week number worth money upsid face pictur
5388,usernam usernam usernam usernam love
5389,usernam usernam summer love treat
5390,usernam usernam instead send racist shirt
5391,usernam tri check basket onlin day long item want say sold site mainten loudli cri face pout face
5392,usernam howev get refund made feel like right sale assist guarante shop
5393,usernam usernam come england wave black flag tag latin small letter g tag latin small letter b tag latin small letter e tag latin small letter n tag latin small letter g cancel tag pictur
5394,usernam sort fuck size thank xxxxxxxxxx
5395,shop usernam much said phone send back want outfit pictur
5396,usernam size alway incred small kid start shop adult section children cloth fit anymor even know pick bigger size need anywher els terribl httpaddr
5397,usernam usernam usernam idk size gorgeou ever let size make feel bad beauti blue heart heavi black heart
5398,got late birthday gift lip fixat primer seem like usernam forgot put product hashtag hashtag pictur
5399,dank usernam da hat sich doch mal gelohnt werbung pictur
5400,usernam usernam could least leav one model one cup even horrend one least peopl like choic left noth super frustrat especi come nurs bra rang alreadi minimum angri face
5401,usernam usernam usernam hashtag pictur
5402,hm use hashtag hashtag poll inform new cloth design creativ way use hashtag via usernam httpaddr
5403,usernam usernam report
5404,usernam usernam lo quieroooooo smile face heart shape eye
5405,usernam went one store buy shirt one size mannequin sell even though tag sale epic fail
5406,usernam usernam cosign hire usernam amaz transmasc model
5407,anzeig werbung heavi heart exclam mark ornament heavi heart exclam mark ornament heavi heart exclam mark ornament all oberteil gestern bei usernam entdeckt eigentlich ein musthav ein alleskonn jeden httpaddr zeitlo und viel kombinierbar dies number oberteil von httpaddr
5408,usernam usernam usernam usernam usernam haan
5409,usernam hi order onlin open packag item suit like return return receipt includ packag return item thank
5410,us watchdog group numberworkerright uncov violenc pro union worker indian garment factori suppli usernam usernam httpaddr hashtag hashtag usernam usernam
5411,usernam usernam usernam usernam usernam ye
5412,usernam usernam usernam usernam usernam sign littl cuzzo region indic symbol letter g region indic symbol letter h httpaddr
5413,usernam anyon els buy sweater juli shrug emoji modifi fitzpatrick type number zero width joiner femal sign usernam usernam vspink tri haul went live link stori bio come say hi face throw kiss got sweater httpaddr
5414,miss pop buzz news youtub link bio smile face sunglass x shirt usernam hashtag hashtag hashtag hashtag hashtag hashtag hashtag hashtag hashtag hashtag hashtag hashtag hashtag hashtag hashtag hashtag hashtag hashtag pictur
5415,usernam usernam usernam usernam usernam usernam usernam usernam usernam usernam gegu hahahaha
5416,usernam usernam usernam usernam usernam usernam usernam usernam usernam narr altra spirit lot slower call hand emoji modifi fitzpatrick type number usernam hashtag hashtag pictur
5417,saudad usernam
5418,ufff gorda comprar en usernam usernam usernam etc suck httpaddr
5419,usernam alway regret get jumper album usernam loudli cri face
5420,usernam church though
5421,rose chocol ask smile face heart shape eye smile face open mouth smile eye face savour delici food thumb sign emoji modifi fitzpatrick type number clap hand sign emoji modifi fitzpatrick type number bouquet rose chocol bar parti popper jumpsuit usernam clap hand sign emoji modifi fitzpatrick type number hashtag hashtag hashtag hashtag hashtag hashtag hashtag hashtag hashtag hashtag httpaddr
5422,happi friday everyon look like go great weekend top usernam fit shirt soft jersey number hashtag hashtag op usernam hm_kid hashtag httpaddr
5423,como interactuar con tu client de una manera creativa moderna divertida colaboracion de usernam con la cadena de moda usernam httpaddr hashtag hashtag
5424,mirror selfi though smile face heart shape eye face throw kiss smile face heart shape eye dress usernam woman boot usernam hashtag hashtag linden suit httpaddr
5425,usernam hi cancel order made
5426,usernam usernam stop shop trigger better use still shop rather keep rel posit space
5427,usernam see custom servic train still wack fix custom usernam pictur
5428,independ day special number august number usernam ground httpaddr grab favourit select fashion piec start idr numberk grab fast hashtag httpaddr
5429,usernam usernam usernam resubscrib singl mail list still think massiv wast time govern bodi charg stuff
5430,usernam usernam waist size way number waist around number number number number
5431,usernam usernam usernam usernam usernam usernam usernam usernam usernam peleperform usernam usernam ok rememb last year black commun upset h put young boy jumper deem pictur
5432,liter reason stop shop usernam absolut ridicul emot damag httpaddr
5433,usernam usernam lol
5434,screw usernam chang size return order buy anyth els fit smaller size
5435,usernam ugh ili
5436,usernam usernam number year old love incred hulk often buy tshirt boy section oh sock
5437,usernam usernam bought hoop usernam yesterday also broken time got home hashtag hashtag
5438,bought cheap khaki usernam work hoe got fake back pocket
5439,wtf usernam httpaddr
5440,usernam usernam herm custom servic appal abil deliv parcel pictur
5441,usernam usernam bought size number skirt h made feel like rubbish go usual number waist number inch sinc uk number get grip pictur
5442,usernam usernam happen notic bape bath ape mayb african bath often somehow associ wear bape blatantli advertis african identifi monkey ridicul doubl standard regard h
5443,amazingli usernam kingston size guid avail kid belt son tmrw manag blatantli tri fob say number size number number number number number number wtf hashtag hashtag hashtag weari face face look triumph
5444,acabo de flipar en la rebaja de usernam con un cartel que decia algo como de saldo por obsolescencia wtf eso hemo llegado en market para que la gent compr lo ultimo de lo ultimo ropa sin estrenar ya obsoleta hashtag hashtag hashtag
5445,usernam rain want great let rock bright red shoe weari face sparkl feliz sabado top zara skirt old usernam shoe usernam ear usernam yonker new york httpaddr
5446,usernam usernam usernam usernam usernam usernam usernam usernam usernam usernam arab letter alef hm arab letter alef lshi arab letter alef llb jmyl face tear joy smile face smile eye
5447,wimbledon inspir tablescap item form usernam usernam httpaddr pictur
5448,usernam usernam usernam usernam usernam beauti word justifi better
5449,usernam buy cloth onlin
5450,anybodi tell number ask size smallernumb max size number even sure new improv size usernam usernam hashtag pictur
5451,usernam usernam
5452,usernam usernam yep pretti much iron xl straight rang fine number number except sell store get onlin go figur utter mad mate
5453,usernam doubl plastic packag lipstick pictur
5454,sparkl pop red sea green sparkl hashtag camera flash emiliano_urq outfit usernam vandusen botan garden httpaddr
5455,usernam usernam would love treat love pregnant wife finger cross
5456,number new usernam scent choos price psnumber psnumber one would pick httpaddr
5457,usernam grand open florenc today turn danc parti hashtag hashtag hashtag hashtag pictur
5458,usernam usernam loafer size number avail ok hand sign emoji modifi fitzpatrick type number fire hundr point symbol
5459,usernam usernam usernam usernam usernam puruss aayog bnnaa caahiy
5460,good usernam usernam usernam usernam usernam httpaddr
5461,like brunett style httpaddr usernam rourg esteelaud black star twitter erika_j_hashtag ran hashtag fa hashtag hashtag httpaddr
5462,still wait item arriv usernam take long suppos today usernam
5463,social media custom servic agent usernam hashtag info httpaddr hashtag hashtag pictur
5464,usernam usernam usernam colour mood
5465,last night got drunk told usernam ladi love pictur
5466,tonight look rose rose usernam usernam usernam pictur
5467,ask kiki challeng walk usernam pull right bridg pleas
5468,usernam usernam usernam usernam usernam thank much fun creat
5469,salut usernam show world real women httpaddr
5470,usernam recent visit store one new chang london disappoint represent size size number number thing want tri largest size stock number feel fat shame averag size uk woman
5471,usernam thing return find receipt abl get refund
5472,usernam awar chang size total stab dark whether size order even fit correct make shop unpleas unnecessarili complic process shrug emoji modifi fitzpatrick type number number zero width joiner femal sign face palm emoji modifi fitzpatrick type number number zero width joiner femal sign cross mark
5473,usernam numberminbeachclean usernam usernam usernam good call ye found thame foreshor cleanup guess peopl throw toilet hashtag hashtag
5474,yo usernam heck take long ship order first time order someth onlin frankli impress
5475,httpaddr check us usernam usernam usernam usernam hashtag hashtag hashtag hashtag hashtag hashtag hashtag usernam hashtag hashtag hashtag hashtag usernam hashtag
5476,le retour de la tenu du jour dan le joli miroir de mon ancien boulot hashtag usernam et hashtag star divariu hashtag httpaddr
5477,usernam usernam might nice stop wrap consciou rang plastic think face
5478,usernam worst custom servic
5479,usernam usernam size number dress h still fit drop much weight size number shop anymor size aw
5480,usernam usernam oh ye pleas x
5481,usernam usernam usernam number tini
5482,usernam httpaddr
5483,usernam india oper also handl via handl separ handl india urgent custom sat issu bangalor center
5484,usernam sent birthday discount number discount code white frown face
5485,usernam quiero saber nada de usernam compr una bota de numbermil peso lo do mese la suela se despego cuando tengan convenio con usernam avisan
5486,usernam usernam know paramet essenti entir workout wardrob usernam usernam winner tj maxx usernam solid formula tight solid colour top
5487,usernam usernam would come handi new summer cloth thank chanc hashtag
5488,usernam choos sunderland store collect deliveri order onlin show gateshead newcastl shrug emoji modifi fitzpatrick type number number zero width joiner femal sign
5489,usernam ur custom care alway busi repli mail way initi return usernam
5490,usernam usernam usernam usernam
5491,thank usernam take thing bought shirt face palm emoji modifi fitzpatrick type number number zero width joiner male sign pictur
5492,usernam usernam usernam usernam usernam usernam usernam usernam usernam usernam u r shame ur naxali mind n soul confus ppl
5493,last summer usernam usernam summer usernam usernam time expand wardrob httpaddr
5494,command usernam est toujour en cour de traitement depui number jour loudli cri face
5495,usernam usernam pictur
5496,updat found receipt took h store uk could remov tag usernam usernam
5497,dear usernam bloodi httpaddr entir uk femal popul pictur
5498,usernam usernam babanda oyl diyordu kajekdodlf
5499,usernam rubbish experi tri purchas phone half hour free deliveri work one put manag royal wast time complet unabl purchas good
5500,usernam usernam pure hot
5501,much appreci usernam show model skin actual look like appreci bath suit bottom sold size even actual size pictur
5502,video pickup el number video lesbo cono greek dwl beeg ash peluda fag moe de edad peluda esclavo chorreolinda mandi adolescent israel com cinta leona form sari sex upskirt boob nikki usernam
5503,usernam hashtag hashtagchan hashtag wan usernam usernam usernam usernam usernam usernam usernam usernam usernam usernam usernam usernam
5504,usernam usernam oxon hill md never come back store thank humili everyon celebr independ day cannot talk ill custom right behind back realli feel demean discomfort httpaddr hashtag
5505,usernam usernam usernam usernam usernam usernam usernam usernam usernam usernam usernam usernam usernam usernam usernam definit hit usernam usernam shirt awesom rock stream lot
5506,readi usernam see rainbow citi usernam hashtag hashtag pictur
5507,usernam pleas let know find product app light blue shirt want check get right one thank pictur
5508,usernam mani retweet sign brett model need tran masc model rep httpaddr
5509,squad look super c l e n hundr point symbol ok hand sign emoji modifi fitzpatrick type number usernam dress usernam usernam dress usernam hashtag fire pictur
5510,usernam get readi spend part numberlook hot summer sale weekend check blog post store like usernam usernam hashtag hashtag hashtag hashtag httpaddr pictur
5511,usernam usernam fab prize hug face would love win dad usernam hug face hashtag hashtag hashtag pictur
5512,usernam u item list stock buy n doesnt show find stock whole time
5513,deja leur rayon sont plu en magasin et en plu leur vetement sont clairement moch et memeris apr il etonn etr en difficult il font tout de traver chez usernam httpaddr
5514,regaladm est bodi usernam httpaddr
5515,usernam hi jaquard print women coat avail store price
5516,usernam usernam
5517,trabajo quemadoyo cuando tenga mi propia marca de ropa si sobran unidad la voy destinar gent que la necesit rebaja outlet como burberri u otra marca como usernam que la quema como usernam que prefier quemarla ant de que nadi haga copia de su ropa
5518,hd arab letter alef sh arab letter alef yf klm arab letter alef btd arab letter alef arab letter hamza arab letter alef n arab letter alef arab letter alef shfth arab letter alef w bs jyt arab letter alef h arab letter alef sb hkwli rh number think face x hd arab letter alef fhm arab letter alef shi yfhmnytb arab letter alef arab letter alef shryth l arab letter alef nh msh hyk arab letter alef ltkhwyt arab letter alef l arab letter alef lm usernam pictur
5519,usernam usernam usernam ideal gusta mucho ese vestido
5520,kushner indict number would get indict usernam maroon number usernam usernam usernam number sue len usernam leon b jew know rememb agre tard su everyon get huge prison experi usernam usernam httpaddr
5521,usernam usernam usernam usernam perk wallflow
5522,usernam love driver still put parcel bin ive complain number time mean would want usernam left pictur
5523,magic air allez allez allez hashtagkickoff hashtag hashtag hashtag hashtag usernam hashtag hashtag grand hyatt manila httpaddr
5524,usernam usernam nah want ko fila shoe
5525,usernam usernam
5526,got three sweater usernam today moneysymbnumb origin valu moneysymbnumb love sale
5527,usernam usernam type pink strappi summer dress googl find load like think sold common everi one wear next soire face tear joy
5528,v usernam prosto neveroiatnoi krasoti posuda bylo kuda stavit zakupila srazu drool face pictur
5529,runner up usernam usernam
5530,usernam usernam usernam yung hangout haha smile cat face heart shape eye smile cat face heart shape eye smile cat face heart shape eye
5531,usernam fun fill workout complet without gear lookth part usernam rang new sport bra top tight trainer take track treadmil everywher pictur
5532,live stl shop usernam till contract reach hashtag usernam pictur
5533,usernam usernam love ur look
5534,usernam usernam usernam lololol wow first cheap thrill shirt
5535,usernam usernam liter sent email ask someon follow least peac let go bc god know els got away
5536,usernam usernam hashtag mediamakeupbygeorgina get_repost katakana middl dot katakana middl dot katakana middl dot eye usernam red liquid liner usernam pretti easi liner lash power mascara usernam individu eyeshadow hudabeauti mauv httpaddr
5537,usernam nu nog een modeketen die even vlot inhaakt op deze behoeft usernam usernam usernam usernam
5538,usernam inform order place never arriv custom care realli work realli acceptablethanksgiorgia
5539,usernam usernam usernam usernam usernam usernam usernam usernam usernam usernam usernam usernam usernam nahii kiya
5540,hashtag hashtag usernam usernam usernam x black heart suit httpaddr pictur
5541,dear usernam number number onlin order sent size number number size number item must disappoint like
5542,tack jennytarneberg lanet av vralsnygg usernam baddrakt tack livet de eviga celluliterna hashtag toftabeachclub httpaddr
5543,resulta que usernam se enfrenta un stock de moneysymbnumb billon de dolar sin vender como solucionara esto el titan del fast fashion httpaddr pictur
5544,outfit day sundayanoth day anoth beauti garden hubbi get quit good photo skill smile face heart shape eye usernam dress nice cool blaze sun today love httpaddr
5545,usernam usernam bought phone case even number hour ago design alreadi flake peel end day go basic disappear ridicul remov product shop abl get refund pictur
5546,usernam usernam usernam usernam usernam httpaddr
5547,good morn usernam
5548,usernam usernam usernam usernam usernam usernam usernam smile face heart shape eye smile face heart shape eye smile face heart shape eye green heart yellow heart heavi black heart
5549,usernam usernam usernam usernam usernam sir good make debat puruss aayog favourit program bin devanagari sign virama daa bol pleas rais subject strongli mani male face wrong alleg impos wife women
5550,last night want come home wear usernam dress comfort complet bargain eurnumb zara shoe best sale buy ok hand sign emoji modifi fitzpatrick type number number olhao httpaddr
5551,come back stock usernam need life pictur
5552,usernam usernam mean ur gender endzon ur sexual sport
5553,student hashtag program usernam store part outdoor visit explor daili function differ role process within store visit like add practic understand classroom train session pictur
5554,usernam usernam yieee keleg sparkl heart
5555,hashtag top usernam jean usernam shoe usernam use httpaddr number first onlin httpaddr
5556,ever feel like self esteem get big boot go shop usernam send right belong thumb sign
5557,usernam usernam usernam usernam weak grimac face grimac face grimac face
5558,amaz super help custom servic person end spend number time amount intend whoop thank fo best realli appreci usernam usernam
5559,usernam readi busi cours httpaddr officialsheersens ear usernam jacket usernam yellow top usernam hashtag hashtag hashtag kiss mark httpaddr
5560,usernam usernam hm pide seguidor en hashtag sugerencia para nueva coleccion hashtag hashtag httpaddr via usernam
5561,usernam usernam en todo quiero ir el viern uno
