,tweet
3396,love ear usernam black heart black heart pictur
3397,usernam hi bought bunch shirt wash came twist wth
3398,usernam heavi black heart pictur
3399,usernam usernam iya satsuk zhong hakatsutarachao etaraikanbi wochao eteta disappoint reliev face
3400,usernam usernam usernam legit sob recent h clothin alreadi bought largest size n get sat heap give grief aw comin someon littl bit confid averag plu woman
3401,shit hashtag hashtag forget boycott stand usernam like fuck wrong store usernam come face roll eye person fold hand emoji modifi fitzpatrick type number see evil monkey x
3402,usernam usernam usernam god avacado pear number throwback got disappoint face
3403,usernam receiv shelf daughter room paint chip bubbl dirti impress qualiti control pictur
3404,honestli super impress speed standard ship behalf usernam httpaddr wait receiv packag tomorrow pictur
3405,usernam usernam usernam usernam go valeri
3406,anyon els know ford citi mall get usernam store sheesh need secur loss prevent lbv smh think face shrug emoji modifi fitzpatrick type number zero width joiner male sign face tear joy person rais hand celebr emoji modifi fitzpatrick type number hundr point symbol hashtag httpaddr
3407,usernam oh mention got cactu smile face sunglass cactu two heart
3408,usernam next time mark item sale actual sale shop spartanburg sc h found item littl red sale tag went check cashier rung item look list sale
3409,usernam okay guy go help irk
3410,usernam usernam hahaha lukt het ni
3411,usernam zui jin inakunatsutarixiao eteshimatsutaribei shiinatosi ishi metakonoshi jie huan ku shen ku zai rilai riyakedosonnaguan xi woan tokorekarazhu itex kimasenka hashtag ninatsutaren oye e yi du xi idash hali sahenkara pictur
3412,usernam suppos receiv item within number number busi day took number busi day get moneysymbnumb ship fee refund
3413,excus usernam websit mainten three day
3414,usernam usernam actual buy everyth lol
3415,excel exampl build interact brand experi custom usernam hashtag httpaddr usernam
3416,nouveau hashtag sur le hashtag avec petit jupe ecossai de chez usernam dan une tenu chic httpaddr pictur
3417,usernam give latest inform order hashtag number balakrishnan anand
3418,usernam usernam usernam usernam usernam usernam usernam usernam usernam boom boom boom collis symbol
3419,today usernam open mall moneysymbnumb shop smile face heart shape eye good ass day
3420,someon usernam corpor releas anoth racist visual number percent
3421,usernam usernam usernam usernam usernam rainha acessivel
3422,horribl think fashion retail drive bodi dysmorphia young peopl hard standardis size across board usernam httpaddr
3423,guy actual gener manag escal issu line connect head custom servic way help usernam
3424,usernam usernam usernam usernam usernam usernam usernam usernam usernam usernam hw kwi arab letter alef arab letter alef ks jrbwh wmsh rh tkhsrw arab letter alef arab letter alef shi see evil monkey
3425,thing buy usernam jean jacket sunglass
3426,label someth plu size size make actual fit plu size person get size right usernam httpaddr
3427,usernam usernam usernam httpaddr
3428,usernam usernam live legend
3429,style tip peopl weight loss transit usernam sale haul httpaddr
3430,usernam usernam
3431,usernam usernam xia noxi mu rena madamadanumberri gasok kisounanonisutsutoan kunarukarazhong warutsuteqi chi chinozhun bei gazhui itsukanainokamon
3432,usernam usernam usernam usernam usernam usernam usernam usernam usernam usernam usernam usernam usernam usernam usernam usernam good number hear wink face
3433,usernam usernam accept
3434,number usernam usernam usernam usernam usernam usernam usernam usernam usernam usernam usernam usernam usernam usernam usernam usernam usernam usernam usernam usernam usernam usernam amen
3435,usernam usernam
3436,order number thing usernam receipt say number number came mail today pack slip say number also today email say number cancel offer number store discount store newfoundland hashtag
3437,usernam pj cloth tabl clock wise pant usernam bandana urbanoutfitt bracelet watch usernam ring usernam madeshad usernam shirt jcrewfactori httpaddr
3438,episod number hashtag detail cast director wardrob play lidia tassel ear usernam tee the_esperanza_ short usernam shoe artisan tulum httpaddr
3439,usernam usernam put deni european size differ alway buy load h spain never get stuff fit uk
3440,sadli order home deliveri usernam anymor courier servic herm incompet ignor
3441,understand talk usernam proud guy heavi black heart smile face heart shape eye hashtag hashtag pictur
3442,usernam usernam finger cross hand index middl finger cross great giveaway usernam
3443,usernam usernam usernam usernam usernam thank sir ap n ham logo ki avaj utha n ki kosi kr rheh
3444,hashtag hashtag fan ask red floral dress tonight film usernam yellow one wore usernam wooo hooo usernam kill cute dress
3445,usernam mnumber bought super soft bra usernam feel like braless
3446,hm heavi black heart commit sustain good employ heavi black heart sourc cloth fair employ love cloth would love even skirt dress pocket hashtag
3447,love usernam atm black heart pictur
3448,usernam ask dob check statu order pictur
3449,put heart mind soul even smallest act secret success shirt usernam hm_man dark sunglass fendi mumbai maharashtra httpaddr
3450,go hm woodwatch barcelona spain httpaddr
3451,usernam use uk gift voucher germani
3452,realli fall love usernam dress love flower pattern sumer model perfect hashtag hashtag hashtag hashtag hashtag hashtag hashtag hashtag hashtag hashtag hashtag hashtag hashtaghashtag httpaddr pictur
3453,elat read usernam promis ceas use mohair collect httpaddr thank right thing pictur
3454,hashtag le delegu votent l affili usernam en presenc du presid usernam directric general vice presid bienvenu tou ce nouveaux mutualist fiert que cett mutuel nou rejoign usernam usernam usernam usernam usernam hashtag pictur
3455,usernam zou ik ook worden van dat verkleden foto ik heb honger
3456,det ar klart att usernam vill salja sa billiga klader som mojligt och att dera sommerskor worldwid jobbar skitlon du bestamm var du handlar dina klader httpaddr
3457,usernam hard exchang pair faulti trouser proof purchas form bank statement make number trip store spend number minut wait return home faulti trouser wonder high street die
3458,hashtag messag still appli motiv monday outfit right size size never saw sweater usernam size xs meant httpaddr
3459,usernam usernam ya el lune tien ahi dandot amor heart arrow
3460,usernam usernam hashtag inspir hashtag usernam fire fire fire hashtag anthonyhorak hashtag usernam hashtag janalouwnumb hashtag usernam usernam usernam hashtag usernam httpaddr
3461,usernam usernam tre joli j aim beaucoup
3462,usernam usernam usernam usernam wow face tear joy face tear joy face tear joy
3463,usernam usernam usernam usernam usernam usernam usernam everytim see add women girl pant short dress pocket im call usernam usernam usernam usernam usernam usernam usernam usernam usernam usernam usernam usernam usernam usernam usernam pictur
3464,took old costum item usernam recycl dump collect bin cashier say put bag put went reach plastic bag sure destroy object
3465,usernam usernam usernam usernam usernam usernam usernam cant seem messag
3466,usernam usernam sweet ro happi sister mo face throw kiss sparkl heart love guy much two heart
3467,usernam usernam usernam amaz prize hand index middl finger cross four leaf clover
3468,usernam usernam usernam usernam otro bot number seguidor
3469,got due pay call happi god told free grin face smile eye grin face smile eye grin face smile eye liciousmina said old enough wear design face tear joy hashtag ok hand sign dark sunglass shirt usernam jean usernam man gua pi mao andreabuja athlet shoe adida httpaddr
3470,usernam usernam fun buy shirt newgat chester today lost hat old middl age fat man cream colour cricket style hat distinct co round blue ink region indic symbol letter e region indic symbol letter polic stamp littl girl cri realis help person fold hand emoji modifi fitzpatrick type number number xx
3471,usernam usernam total true definit number number size h cloth frustrat tri guess also think cloth crap qualiti buy anymor lol
3472,tengo un serio problema con usernam siempr q voy quiero llevar number camiseta
3473,saw dress usernam today knew seen someth similar hashtag hashtag pictur
3474,get london look usernam top usernam jumpsuit soooo happi number degre cooler today hashtag hashtag pictur
3475,usernam bonjour cela fait mainten number jour aujourd hui que la command est tjr en cour de traitement et que rien n bouger cela peut aller jusqu combien de jour maximum car j aimerai ne pa avoir attendr numbermoi sinon j annulerai command merci avanc
3476,usernam usernam usernam httpaddr
3477,usernam paid next day deliveri receiv wrong order
3478,usernam smile heavi black heart haut usernam ba usernam heavi black heart heavi black heart heavi black heart heavi black heart heavi black heart heavi black heart heavi black heart httpaddr
3479,usernam wtf order h nomin time date travel afternoon got inform uk mail deliveri even joke usernam
3480,beauti bengal cat name babi liter babi ador sweet cat face two heart babi featur tonight usernam anim trivia segment tv patrol blue heart ear top usernam httpaddr pictur
3481,jst wnt number sti usernam number number mnth
3482,usernam usernam usernam usernam kilaha fil ard nissa sabyan
3483,usernam usernam hashtag hashtag pictur
3484,usernam ok ok wait amaz news devast playlist worldwid usernam shop plu usernam usernam uk wowe let know hear place goe littl someth like httpaddr pictur
3485,world usernam knoxvil tn yet would absolut explod usernam step game
3486,line hip pre game jimmi buffet concert parrot feather thin usernam pictur
3487,love littl co ord set usernam link stori two heart hashtag hashtag hashtag hashtag hashtag hashtag hashtag hashtag hashtag hashtag hashtag hashtag hashtag hashtag httpaddr
3488,catch outsid frolick field grass ear rice flirti floral cherri blossom oh btw gorgeou dress charlotteruss loveee two heart pretti tassel usernam kiss mark httpaddr
3489,usernam summer clear number store get readi seriou shop usernam httpaddr pictur
3490,tropic cunt thank usernam pictur
3491,usernam usernam falta un poco de relleno pa la teta
3492,usernam usernam usernam sitter ocksa och vantar pa bocker men jag ska borja med gw nya idag atminston vantan pa aktiebockerna grin face
3493,gokigeny xue xia ping lun jia noxi chuan desu guan xi nilai techu metesi fu yong noxu xia womai imashita ding nodi kosutogao dezain h msanyori hm su qing rashii pictur
3494,usernam usernam usernam
3495,marksandspenc set hashtag academi turn staff data scientist meanwhil usernam turn hashtag hashtag increas profit usernam two prime exampl big hashtag champion hashtag httpaddr pictur
3496,usernam usernam yea whole point shop onlin avoid go mall suppos send back wait anoth number week moneysymbnumb tank top conveni
3497,usernam rt hashtag celebr wonder weather give one person chanc win psnumber usernam voucher shop bag sun face enter white right point backhand index emoji modifi fitzpatrick type number rt tweet white right point backhand index emoji modifi fitzpatrick type number follow us twitter cs appli httpaddr hashtag hashtag hashtag
3498,usernam usernam ik la dat het een fout
3499,usernam sie haben mein bestellung seit number tagen immer noch nicht geschickt und kann ich au technischen grunden auch nicht stornieren top servic niemal wieder h
3500,usernam usernam wow pictur
3501,usernam usernam time go nearest h camp till play yyxi
3502,usernam usernam usernam measur way measur size number brand essenti made cosmet chang remov size number shift everyth size review measur
3503,usernam usernam slightli differ week bought number polo top holiday differ colour brand style arriv tri number fit perfect number fit tell work
3504,usernam black kid jungl new commerci like usernam usernam answer question pleas hhhhmmmm think face think face usernam usernam usernam
3505,number number outfit lol jut wish could maintain hair everyday hashtag alway hashtag everyon explor except hashtag hashtag usernam httpaddr
3506,south devon beach bliss happili sport burnt ass spare insta swim costum sale usernam consciou purchas kimono new favourit also httpaddr
3507,usernam day need make bold statement wink face make top usernam usernam necklac gift hashtag hashtag hashtag httpaddr
3508,fix new usernam dress size appal face palm emoji modifi fitzpatrick type number number zero width joiner femal sign thumb sign emoji modifi fitzpatrick type number number hashtag hashtag hashtag pictur
3509,ask staff usernam coolest monkey jungl shirt got kick
3510,usernam usernam true think face think
3511,usernam usernam also shoot foot sale women want pay full price gaslight
3512,usernam realli bout piss u send shit number week want cloth bitch xx pout face face look triumph
3513,usernam solut usernam usernam usernam usernam usernam usernam usernam usernam usernam usernam usernam usernam usernam usernam usernam usernam usernam usernam usernam usernam usernam usernam usernam usernam usernam usernam usernam
3514,usernam usernam usernam trueee
3515,usernam usernam h
3516,hashtag hashtag hashtag hashtag hashtag hashtag hashtag hashtag hashtag hashtag entir hashtag hashtag usernam hashtag hashtag httpaddr
3517,usernam summer shop haul channel woman cloth dark sunglass httpaddr hashtag hashtag hashtag hashtag
3518,usernam realli think su pictur
3519,usernam absolut treat face throw kiss love summer cloth enjoy fabul heatwav usernam fabul smile face heart shape eye black sun ray pictur
3520,usernam citi glori movi camera ___ale_hop_ hat quayaustralia brooklyn spec hm overs armi layer shirtpakistani kurta nike crop leg birkenstock slide motown music uk httpaddr
3521,usernam done year stop buy end depress thank someth let hope usernam take note chang size
3522,hashtag perfect combo right usernam smile face heart shape eye pictur
3523,super annoy usernam custom servic inquir order late base publish process time told rep week late request cancel respons disconnect dick move usernam return everyth
3524,usernam vou ete serieux smile face open mouth cold sweat smile face open mouth cold sweat smile face open mouth cold sweat smile face open mouth cold sweat smile face open mouth cold sweat smile face open mouth cold sweat smile face open mouth cold sweat pictur
3525,usernam usernam damn
3526,hashtag hashtag quand meme larg blue circl region indic symbol letter f region indic symbol letter r car ce fut la galer avec la foli dan le metro pour rentrer face tear joy et bien sur toujour un con qui ose tout devant tout le mond en tout circonst vraiment tre joli la robe merci pour nouvel robe usernam roll floor laugh hashtag
3527,everytim see someth like onlin order shit gotta stop loudli cri face usernam usernam usernam usernam usernam usernam usernam
3528,usernam usernam long turn usernam fine
3529,usernam gorgeou host make hashtag battl band infinit fun hundr point symbol hashtag fire stun outfit usernam zara ear kaiafinejewelleri hair makeup httpaddr
3530,usernam usernam also racist
3531,justin bieber line annoy usernam like everyth realiz everi number year old favorit tour shirt
3532,hashtag hashtag usernam bought hashtag hashtag hashtag hashtag hashtag hashtag hashtag hashtag hashtag httpaddr
3533,command usernam usernam usernam usernam ca fait du bien au moral smile face heart shape eye smile face heart shape eye smile face heart shape eye
3534,usernam usernam pepsi battl band host hashtag fire stun outfit usernam zara ear kaiafinejewelleri hair makeup hashtag usernam style hashtag ayesha httpaddr httpaddr
3535,usernam usernam usernam usernam usernam usernam usernam usernam usernam usernam usernam usernam usernam usernam usernam usernam usernam usernam usernam usernam usernam usernam usernam usernam usernam usernam usernam usernam usernam usernam tt devanagari sign virama kaaliin kaang devanagari sign virama re srkaar ne hin devanagari sign virama du snto ke khilaaph saajish kaa nyaa ruup p devanagari sign virama rktt kiyaa bhgvaa aatnkvaad jism cun cun kr hin devanagari sign virama du snto ko jhuutth aur bog ke phnsaan kaa hashtag httpaddr
3536,got prettiest summer dress usernam psnumber smile cat face heart shape eye black sun ray dress hashtag
3537,usernam larg orang diamond small blue diamond g u n j u small orang diamond larg blue diamond top usernam pant usernam ear lorabylori hashtag hashtag hashtag hashtag hashtag hashtag hashtag httpaddr
3538,propos usernam close world cup final thank
3539,usernam usernam usernam usernam usernam hona chahiy isi liy aaj beti bachao ka naara dene wali neha shalini dua ne bhii apnii devanagari sign virama viikrti dii hai puruss aayogbnaan men lekin ek kmettii kaa gtthn ho jismen aurton auraadmiyon kii ttiim ho aur niss devanagari sign virama pk devanagari sign virama ss jaanc ho usmen saamaajik kaar devanagari sign virama ykr devanagari sign virama taa bhii hon vk iil bhii aur k aanuunii slaahkaar bhii kii naa aurt pchtaae naa
3540,usernam teefa troubl two heart wear usernam usernam uniqlousa httpaddr smile face smile eye smile face smile eye style usernam smile face heart shape eye hair n makeup nabila_salon lahor camera flash tayyab_akram_ hashtag hashtag hashtag httpaddr
3541,usernam usernam obsess
3542,grabe naman usernam pictur
3543,anyon els experienc mishap usernam
3544,neat composit usernam web store good time good time hashtag discov amaz usernam pictur
3545,h onlin app suck usernam
3546,usernam usernam usernam even sound possibl ur smol usernam fix ur size thank
3547,usernam custom servic peopl illiter unhelp deceit great reput uphold mess order fail appli discount call idiot gave moneysymbnumb credit moneysymbnumb order stay busi
3548,ridicul polic call tri return item usernam serious keep happen black custom pout face httpaddr
3549,usernam usernam usernam usernam usernam usernam usernam usernam usernam usernam hashtag set knew approv bruddah
3550,go usernam number sale
3551,usernam usernam usernam lmfaoooooo think
3552,mom usernam told sale go back school shop usernam h montclair plaza get lemon shirt caus twinsi want match teacher shrug emoji modifi fitzpatrick type number number zero width joiner femal sign pictur
3553,usernam usernam usernam masterpiec sparkl heart
3554,usernam usernam go airplan h
3555,usernam x usernam hoodi sold everi store numbermoneysymb pictur
3556,usernam usernam dammit girl leg skyscrap
3557,usernam usernam usernam usernam niec rather nephew absolut buy amaz shirt shame boy section though
3558,raspberri bikini le fameux bikini frambois de la pub tv usernam je croi que celui la l tout hein hashtag region indic symbol letter e region indic symbol letter hashtag hashtag hashtag hashtag hashtag hashtag hashtag hashtag hashtag hashtag hashtag hashtag hashtag hashtag pictur
3559,usernam lipstick first hair care line stori brand usernam group httpaddr pictur
3560,wednesday flower day ye know gonna rain heck usernam someon ask yesterday life answer take day everi morn httpaddr
3561,usernam usernam look amaz
3562,usernam usernam skilz
3563,ordeal h leed triniti equip sell cloth stock number min queu tri til need twice mani tip chang room usernam good job flexi time
3564,usernam hashtag feel hashtag hashtag usernam pushpin hmhome pushpin usernam pushpin hashtag hashtag hashtag hashtag green heart httpaddr
3565,usernam usernam haha preci det dar visad sambon mig igar nar hon borja kolla dagisklad till som sma
3566,steal style thread seokjin epiphani cloth usernam pictur
3567,usernam usernam shrewsburi
3568,usernam usernam laugh socal naw jk get tfo pictur
3569,usernam usernam usernam usernam usernam usernam usernam great
3570,la magia en mi empieza suced cuando descubro que yo soy eso que tanto buscaba black heart suit feliz noch hug face mi look cherri blossom top zara cherri blossom colgant cadenita puzzle_designnumb cherri blossom gafa usernam cherri blossom reloj httpaddr
3571,wow love usernam help make world better place hashtag httpaddr
3572,excit submit number panel hashtag next edit hashtag hashtag base entrepreneur usernam discuss key topic hashtag hashtag exec usernam usernam httpaddr today usernam hashtag httpaddr
3573,usernam pl make bodybuild friendli cloth loudli cri face xxl pictur
3574,glad found jumpsuit coupl day flew usernam sale psnumber bargain cx hashtag hashtag hashtag hashtag hashtag hashtag hashtag hashtag hashtag hashtag pictur cala tarida
3575,usernam get usernam face tear joy
3576,final found sell booti short men yesterday thank h usernam bought first booti short h ugh love born gay love h sell almost everyth need buy
3577,usernam enter usernam intern hashtag w elev co win moneysymbnumb gift card usernam httpaddr
3578,muy contento de participar con el gran equipo de usernam httpaddr hashtag hashtag hashtag hashtag hashtag hashtag averanda cuernavaca
3579,hm use usernam influenc tool come design latest collect target millenni hashtag httpaddr
3580,get mood fall shop inspir usernam usernam wear chic top usernam sleek pant usernam avail hashtag hashtag pictur
3581,usernam usernam usernam annoy
3582,buy usernam underwear pure red dye bucket smell wors caustic workplac pictur
3583,endless summer uk final new set usernam bournemouth httpaddr
3584,usernam usernam tropic fish happi number juli jean usernam button usernam hat usernam turn post notif ______________________________________________________ hashtag hashtag hashtag hashtag hashtag httpaddr
3585,usernam j ai recu une command sauf qu il manquait de produit ca vou arriv de prevenir vo client
3586,usernam usernam cool pleas count
3587,usernam plu websit great help usernam usernam pictur
3588,usernam locat shirt size number number yr pictur
3589,usernam usernam sure alway hit miss
3590,sympa usernam quand tu achet un jean te previent qu il peut tacher ton canap grin face hashtag pictur
3591,infin beyond make speak appar effect hashtag industri hashtag compani usernam limit harm done check usernam httpaddr pictur
3592,usernam usernam usernam usernam nice
3593,de vetement hashtag dan un number temp herb bio du coton hashtag tout doux meilleur pour l environn le homm earth globe asia australia equit produit par de adult coucou usernam dan de bonn condit de travail handshak solidair number produit achet numbereur revers usernam
3594,hey usernam love consciou cloth line effort recycl cloth could also tri carri suffici stick size number shop store throughout southern ontario rare find item size time year
3595,usernam usernam usernam slay
3596,awesom rainbow cherri blossom usernam pictur
3597,heavi heart exclam mark ornament heavi heart exclam mark ornament heavi heart exclam mark ornament usernam usernam pictur
3598,think cloth brand would realiz grade plu size catch fuck number still fuck get hire fat peopl usernam shit like happen httpaddr
3599,usernam usernam face tear joy face tear joy face tear joy
3600,usernam usernam usernam ugh mood chaotic meltdown maci abt thisbcjsjck cant stand ugh love u feel
3601,usernam usernam preeeeeach size number go h make feel like sort freak size number
3602,usernam usernam work mannequin limb drop blow cover
3603,usernam pleas partnership brand like usernam usernam usernam usernam usernam usernam usernam usernam pleas abhi take number dollar get intern investor
3604,seat seren usernam hashtag hashtag hashtag hashtag hashtag pictur
3605,thank usernam reinforc posit bodi imag say airbrush clap hand sign hashtag hashtag becom first lead retail airbrush stretch mark httpaddr via usernam
3606,style match ambit hundr point symbol short usernam revolv heart woman bunni ear hashtag mapl leaf hashtag dizzi symbol hashtag eyeglass hashtag hundr point symbol hashtag grin face smile eye hashtag fallen leaf hashtag crown hashtag bell httpaddr
3607,hashtag hashtag hashtag castawayburbank hashtag usernam hashtag hashtag hashtag hashtag hashtag hashtagplu smile face sunglass castaway burbank httpaddr
3608,usernam usernam usernam usernam barri
3609,hoy recibido el pedido que hice usernam la semana pasada aprovech que tenia la tarjeta regalo de la devolucion de la part de arriba del bikini que resulto ser diminuta ma info en lo stori de compra face tear joy httpaddr
3610,nyden usernam new brand target millenni use instagram poll inform cloth design creat buzz around new product hashtag hashtag hashtag httpaddr
3611,usernam pleas sort ur horrend size im size number mostli trouser jean etc fit size number bit loos round leg either size number fit far tight
3612,iemand leg mij uit waarom het altijd zo tere heet de usernam kleedkam broeken passen daar een hell
3613,usernam usernam album tour call hand emoji modifi fitzpatrick type number number top usernam usernam shoe usernam pavillion mall httpaddr
3614,usernam usernam yang fu ke ai ina smile face smile eye h mdemai utanokaniyan yan modakedona ww
3615,actual bought item cloth h today correct size fit perfectli well done h listen us definit shop chang size usernam usernam hashtag hashtag
3616,encantada con la atencion telefonica de usernam gratuita rapida con person muy amabl hashtag hashtag
3617,fab giveaway usernam windsoryard httpaddr
3618,usernam usernam oof
3619,cherri blossom dress usernam hashtag hashtag hashtag hashtag hashtag hashtag hashtag hashtag hashtag hashtag httpaddr
3620,usernam usernam hashtag
3621,wear linen summer read httpaddr usernam usernam pictur
3622,usernam stock numberxl menswear store like make
3623,usernam shop number number time usernam
3624,usernam want introduc fair hashtag assess tool supplier factori defin hashtag base salari min wage factori worker consist much actual need live ok life accord asia floor wage httpaddr
3625,usernam usernam reason realli shop cheap conveni commit good hour take everyth chang room size cannot reli upon annoy co topshop gone riv go putney shit place shop eye
