,tweet
1714,heey usernam zojuist een bericht mogen ontvangen dat mijn pakket van usernam bezorgd nou dit niet op on adr hashtag gaat de pakketbezorg deze weer ophalen en wel correct bezorgen
1715,usernam usernam usernam bought short size number number get number face roll eye
1716,usernam usernam lo de la grand para emitir factura es el salvaj oest en mi ultimo viaj con iberia pude obten factura por alguno concepto la del viaj tardo dia esta en un hilo antiguo
1717,usernam pleas sort fit room central cambridg store peopl walk rather wait queue number peopl
1718,favourit purchas summer vacay find usernam usernam hashtag hashtag usernam hashtag hashtag hashtag hashtag hashtag httpaddr pictur
1719,usernam usernam want shoot imagin
1720,cri usernam tri creat sustain futur loudli cri face heavi black heart earth globe america
1721,usernam usernam usernam usernam usernam usernam absolut feel face throw kiss pictur
1722,usernam alreadi coward amaz model deserv recognit httpaddr
1723,saietamhankar outfit usernam jewelri usernam style usernam hashtag hashtag hashtag hashtag hashtag hashtag hashtag httpaddr
1724,usernam way usernam usernam usernam end gender base violenc garment suppli chain directli work women leadership usernam pilot program end gbv supplier factori hashtag hashtag httpaddr
1725,usernam usernam beauti print
1726,thank usernam hashtag geneva il much usernam usernam door open air pictur
1727,usernam tambien de usernam mi encanta
1728,usernam person fold hand person fold hand person fold hand thumb sign emoji modifi fitzpatrick type number number
1729,darkskin girl x black outfit black heart top usernam jean usernam shoe usernam hashtag hashtag hashtag hashtag httpaddr
1730,usernam usernam alway ok hand sign emoji modifi fitzpatrick type number number
1731,usernam usernam oooo fab ye pleas usernam
1732,usernam shirt settl debat pleas pictur
1733,within minut get home mall put new tank thank usernam blue heart hashtag pictur
1734,usernam usernam usernam usernam usernam usernam usernam usernam usernam usernam usernam usernam usernam usernam te diria que llevara la resistencia pero de lo bueno que estoy soy irresist smile face sunglass smile face sunglass smile face sunglass smile face sunglass
1735,usernam dress avail find onlin local store pictur
1736,usernam order last wednesday next day deliveri receiv anyth email yesterday repli would love know
1737,usernam usernam je suppos qu il est possibl annul san frai command internet puisqu vou prenez du retard dan la livraison et que mon coli n arrivera donc pa temp car il eu plu que command que prevu parfait previs en period de sold non
1738,usernam enter usernam intern hashtag w elev co win moneysymbnumb gift card usernam httpaddr
1739,usernam usernam usernam usernam usernam usernam usernam usernam usernam usernam usernam usernam usernam usernam usernam usernam oooo thank info need get rainbow dnumber one kim
1740,sik beni usernam tr
1741,usernam usernam usernam usernam usernam usernam usernam face tear joy face tear joy face tear joy face tear joy face tear joy face tear joy face tear joy face tear joy steal meme plz
1742,usernam hashtag celebr wonder weather give one person chanc win psnumber usernam voucher shop bag sun face enter white right point backhand index emoji modifi fitzpatrick type number rt tweet white right point backhand index emoji modifi fitzpatrick type number follow us twitter cs appli httpaddr hashtag hashtag hashtag
1743,usernam usernam go process order submit day ago ship go vacat next week oorrr pictur
1744,usernam usernam usernam roll floor laugh roll floor laugh roll floor laugh
1745,usernam compani cultur httpaddr
1746,usernam usernam usernam usernam usernam hey listen gita dad colin spoken usernam actual said would save name plaqu
1747,usernam love hashtag wed guest look weekend round whole hashtag look moneysymbnumb skirt usernam httpaddr blous usernam httpaddr fascin httpaddr shoe usernam httpaddr pictur
1748,usernam site back trynna buy someth smh face palm emoji modifi fitzpatrick type number zero width joiner femal sign loudli cri face
1749,usernam sagen wir usernam sie sollen existenzsichernd lohn hashtag zahlen fur die arbeit innen die kleidung fur un nahen hashtag jetzt appel unterzeichnen httpaddr
1750,donc je par en voyag dan qql jour et jai toujour pa recu me maillot de chez usernam loudli cri face command que j ai pass il ya plu une semain
1751,moodboard monday marsala edit usernam usernam usernam usernam usernam usernam usernam usernam usernam usernam usernam usernam hashtag hashtag hashtag hashtag hashtag hashtag pictur
1752,region indic symbol letter p region indic symbol letter ja viram post blog link na bio ribbon ribbon region indic symbol letter g region indic symbol letter b alreadi saw blog post link bio ribbon ribbon ph camera flash francisco_costanumb francisco_costa_design vestido dress usernam blazer usernam httpaddr
1753,usernam want feel last month usernam pictur
1754,le personnel du usernam hashtag est de plu en plu desagr surtout en cabin notam lorsqu de numberh il eteign le lumier etpeut savoir pourquoi le usernam anger empech l entre numberhnumb alor qu il est note que le magasin ferm numberhnumb
1755,usernam k devanagari sign virama yaa hashtag hashtag_aayog kii tr devanagari sign virama j pr hashtag_aayog kaa bhii gtthn honaa caahi usernam usernam usernam usernam httpaddr
1756,usernam usernam hashtag store woman children
1757,way usernam suit way vintag color need white smile face
1758,h usernam instagram photo video httpaddr
1759,l enseign h ferm se port ce mercredi number aout hashtag hm httpaddr pictur
1760,definit bought usernam actual seem tri stop toxic photoshop fake cultur cloth store go buy usernam definit embrac natur beauti like cloth line creat natur fabric
1761,get today discount coupon leav use old cloth usernam store recycl
1762,usernam
1763,order stuff usernam number juli bare got today number upsid face oh still miss item expressionless face put litter place symbol
1764,usernam usernam usernam usernam good luck thea hand index middl finger cross four leaf clover
1765,cater modo usernam hashtag hashtag hashtag pictur
1766,usernam number someth fashion editor shop usernam httpaddr
1767,hot thermomet summer day disappoint reliev face shirt bikini top skirt usernam shoe usernam httpaddr
1768,pretti disappoint usernam look like refund psnumber dress mend pictur
1769,usernam usernam model
1770,usernam httpaddr
1771,usernam receiv correct item label numberin waist unabl return gave chariti shop ordwrwd sinc mani peopl problem size think usernam would get problem
1772,know open librari book hashtag hashtag hashtag hashtag hashtag usernam usernam usernam hashtag hashtag pictur
1773,excel work usernam size tini gener lot cloth go size number may ask reason behind pleas
1774,usernam usernam dammit
1775,usernam usernam fantast prize hand index middl finger cross emoji modifi fitzpatrick type number two heart
1776,usernam usernam ikea delici swedish meatbal face tear joy
1777,usernam sevgilimi salar misin kardesim
1778,buy hashtag usernam wanna sponsor cloth hashtag pictur
1779,argh usernam got home stress sweati trip town buy matern bra normal one far uncomfort heat went happili pop one find secur tag still hashtag hashtag hashtag pictur
1780,yasssss usernam person rais hand celebr emoji modifi fitzpatrick type number pictur
1781,usernam usernam need adult woman size pleas thank httpaddr
1782,let love lot usernam hashtag hashtag hashtag hashtag hashtag hashtag hashtag hashtag hashtag hashtag hashtag hashtag hashtag usernam pictur
1783,usernam usernam much
1784,style two heart hashtag hashtag hashtag hashtag usernam usernam pictur
1785,thx new fave shirt usernam sun face pictur
1786,usernam usernam usernam usernam usernam usernam usernam usernam usernam usernam usernam usernam usernam usernam usernam usernam usernam usernam usernam hindu alway react fool black question mark ornament black question mark ornament foreign kid taught gayatri mantra etc teach twinkl twinkl thing hashtag
1787,usernam usernam also realli dislik jean european size mean hard without googl know size meant tri
1788,usernam face tear joy face tear joy face tear joy
1789,usernam order last friday today item still say progress pleas help
1790,retweet connor ward usernam everi shop pleas copi primark get disabl queue ta hm specif tho pl
1791,usernam usernam lay attempt fall asleep contempl life import matter one question haunt stick head point smaller compart supermarket trolli x shop trolley short usernam blous usernam shoe usernam hashtag hashtag pictur
1792,thank usernam pictur
1793,mad angl play usernam person fold hand emoji modifi fitzpatrick type number region indic symbol letter g region indic symbol letter b pictur
1794,usernam usernam usernam
1795,hashtag tensor bangag tylenol minni mous hairbrush usernam chanel coco roug shine number lipstick small bottl httpaddr perfum ye tensor bandag hashtag pictur
1796,usernam usernam usernam usernam usernam usernam usernam
1797,gotta love swimwear brand call usernam especi bikini look good high waist two piec inspo click link httpaddr usernam usernam usernam usernam usernam pictur
1798,usernam pleas read httpaddr
1799,tebrikl usernam usernam pictur
1800,outfit usernam wear style liter everywher summer best summer london bother wear heel high heel shoe face stuck tongu tightli close eye face stuck tongu tightli close eye love khaki colour smile face smile eye face throw kiss httpaddr
1801,usernam come usernam wtf
1802,usernam usernam slightli smile face heavi black heart heavi black heart butterfli
1803,usernam usernam usernam nice big brand say want hashtag need get rid harm substanc read statement usernam usernam usernam usernam usernam usernam httpaddr hashtag usernam usernam pictur
1804,regrann usernam bianca umali iamwearingpaul usernam ribbon hair make nathan_hmua hashtag hashtag httpaddr
1805,usernam aw custom servic repli pictur
1806,usernam ye hello noth order onlin come mail receipt packag confirm actual order pictur
1807,h asiakaspalvelu puhelimits kyl harvinaisen huonoa ja muutenki ei ilmoteta missa paketti mene en kylla enaa ikina tilaa sielta mitaan face roll eye usernam
1808,usernam usernam would super
1809,hm think face think face still lookin good usernam hashtag pictur
1810,usernam usernam whoa
1811,usernam usernam need hire perfect stef amaz
1812,usernam usernam usernam shit made buy stuff
1813,sleep hashtag usernam store playlist pictur
1814,place order last tuesday still ship usernam what good
1815,usernam usernam usernam think kind size problem realli caus bodi dysmorphia
1816,usernam usernam sound like case hashtag
1817,usernam usernam usernam fashion brand destroy cloth stop worn wrong peopl excus cloth shoe recycl hashtag hashtag hashtag usernam usernam usernam httpaddr
1818,usernam usernam usernam get snack consid groceri shop onlin comfort home visit us onlin anytim usernam open number number receiv doorstep deliveri groceri item httpaddr
1819,happi sunday love life style usernam usernam hood usernam sneaker calvinklein photo usernam hashtag hashtag hashtag hashtag httpaddr httpaddr
1820,usernam ik heb een bestel gedaan met een verkeerd verzend adr kan ik dit nog ergen aanpassen heb gemaild gebeld maar geen reacti
1821,usernam usernam yep number year old chose baggi denim short boy section h yesterday girl short fit
1822,usernam usernam usernam queen
1823,usernam genuin go toilet everyth saw today size number number largest number disgust
1824,usernam usernam look amaz
1825,usernam number also wrong section incorrect titl titl dress pictur
1826,usernam usernam httpaddr
1827,dear usernam bought two dress today one one xl fit
1828,usernam usernam wow ye pleas
1829,usernam need take trip usernam
1830,usernam usernam wonder giveaway thank smile face smile eye
1831,hashtag sachin_rt iambohemia rahulgandhi yinforchang assambik adarshyadav__ ajinkyarahanenumb aliaanumb ruhiyash anushkasharma kshitijsinghnumb usernam hannantayyab ihrithik harbhajan_singh navbharattim hmhashtag_haahaakaar pictur
1832,usernam usernam size absolut worst
1833,usernam usernam usernam usernam usernam usernam usernam love set
1834,usernam usernam usernam usernam replenish choker stash prob
1835,usernam usernam usernam usernam usernam usernam usernam usernam usernam usernam usernam usernam usernam usernam usernam usernam usernam usernam usernam usernam usernam usernam usernam usernam usernam usernam usernam usernam usernam usernam usernam usernam usernam everi pincod male victim hashtag rise due famili issu everywher hashtag run sweat blood victim money paid everi media outlet would talk abt hat channel true journal hashtag
1836,usernam happi hashtag region indic symbol letter u region indic symbol letter usernam great hashtag store see recent review hashtag seri checkout httpaddr pictur number world trade center
1837,usernam usernam got shirt smile face heart shape eye usernam
1838,usernam usernam refiero la prenda que despu de number number lavada se despintan rompen sueter que se hacen enorm en una temporada aunqu lo cuid para el precio de la ropa imagin cuanto le pagan quien la hacen se yo estoy muy desacuerdo con ese tipo de marca
1839,usernam new fav hashtag hashtag appar lot word say cool serious know usernam isnt steal one heavi black heart heavi black heart heavi black heart check usernam shop httpaddr
1840,usernam usernam brilliant
1841,usernam pleas sort trouser autist peopl like thank upsid face pictur
1842,get touch usernam corpor
1843,revolut femal heavi black heart usernam hashtag hashtag werbung da markennennung missmondo httpaddr
1844,usernam version year year hypnotis slightli frown face wait long
1845,det vore kladsamt att sta upp de som tillverkar era klader usernam httpaddr
1846,wir fordern von usernam usernam sauber herstellung modeketten durfen die umwelt nicht zerstoren unterzeichnet httpaddr
1847,usernam usernam usernam usernam usernam usernam ok hand sign
1848,usernam bought easi iron shirt see happen wash black patch never expect need exchang wrote complaint alreadi repli even number day pictur
1849,usernam usernam yum
1850,usernam usernam usernam usernam usernam usernam omg loudli cri face loudli cri face heavi black heart heavi black heart fire fire
1851,neth sydd klader h fick sparken nar hon vill starta fackforen vad gor usernam och kan kambodja vara kvar hashtag httpaddr
1852,usernam hola buena tard
1853,usernam usernam wow hugot pa kuya sam
1854,usernam usernam return bathroom selfi thumb sign thumb sign broardband offici back yeah face tear joy face tear joy face tear joy face tear joy face tear joy face tear joy face tear joy face tear joy face tear joy
1855,usernam usernam would fab win
1856,choca un poco que en el usernam de corea haya xl en el de japon si tienen la talla
1857,usernam co ordin cherri blossom strawberri mushroom repost httpaddr
1858,week hashtag includ fabul video skill usernam usernam amaz podcast hashtag home inspo usernam plant inspo usernam much
1859,fall love usernam sale shoe size disappoint reliev face disappoint reliev face high heel shoe
1860,went usernam bought jean size number know typic fit small went usernam bought number usual size came home compar two pair despit full size smaller numberin larger waist actual fit hashtag
1861,usernam usernam well good luck live return within fourteen day alway ship like three week say return longer possibl fourteen day pass buy store realli want item
1862,usernam usernam ugh ye stan legend
1863,usernam konto gekundigt bei usernam registriert gerad bei usernam gewesen zum ersten mal mit hashtag mobil bezahlt einer millisekund ein traum
1864,usernam usernam stunnin nail polish emoji modifi fitzpatrick type number number
1865,egi vizcsepp eleg droplet wax gibbou moon symbol hashtag hashtag camera davidajkai ajkaimon skyiri rekaszak kingademeni rolandrab fodro kimono usernam number ft feher top fandfcloth number ft farmersort usernam number httpaddr
1866,usernam point vanish bar code h app e mail know one bother repli
1867,moneysymbnumb number moneysymbnumb sound like scam ok usernam pictur
1868,usernam usernam brill xx
1869,hashtag chez usernam test un nouveau miroir intellig qui propos de vetement et tenu en fonction de son physiqu succ garanti httpaddr v usernam hashtag
1870,usernam bonjour j ai pass command le number est le number et rien n est encor expedi est ce normal ca commenc etr long
1871,usernam littl bargain courtesi usernam x top reduc psnumber sold line might still abl get one store search crinkl top come colour hashtag top usernam belt usernam short usernam pictur
1872,usernam new vid go number numberpm use usernam reload velvet rose palett purpl heart _nyx madelein butter gloss primark top hm gold choker hashtag hashtag httpaddr
1873,exigez une remuner decent pour le ouvrier usernam signez mainten hashtag hashtag httpaddr
1874,sneak peak first ever hashtag column inspir hashtag usernam huge thank usernam usernam usernam usernam usernam help put togeth favourit pictur
1875,usernam usernam daoxorg joenglumi jsecoin trexxcoin
1876,love littl number piec set usernam kid weari face blue heart
1877,americanapparelusa babi pink bodysuit heavi black heart usernam bikini blue heart mouth httpaddr
1878,vaarwel photoshop perfecti usernam laat striemen lichaamshaar en litteken van bikinimodellen staan httpaddr pictur
1879,usernam usernam yeah
1880,usernam outfit del dia amo el color camel es tan de invierno tan elegant love heavi black heart chompa leg usernam cafarenna usernam hashtag hashtag hashtag hashtag hashtag httpaddr
1881,usernam usernam cue news stori retail report fall sale want swimsuit duffl coat
1882,usernam usernam usernam usernam usernam usernam allow ethiopian worker paid littl dollar day thought one would notic brand becom known slave wage also van heusen usernam usernam us usernam warner olga geoffrey beenesham httpaddr
1883,usernam usernam usernam usernam album
1884,littl round thing love week includ oh cute dress usernam httpaddr pictur
1885,tuskailin vanhojen mokkivaatteiden kanssa onneksi ystava tiesi kertoa etta usernam ottaa vanhat hashtag vastaan ja hoitaa kierratyksen hashtag hashtag pictur
1886,gorgeou somewherebetween_styl hashtag much love dress dress usernam amaz thing moment httpaddr
1887,happi friday love grow heart current obsess latest usernam hashtag campaign ok hand sign emoji modifi fitzpatrick type number number gorg blous psnumber smile face heart shape eye im also regret buy match trouser face palm emoji modifi fitzpatrick type number zero width joiner femal sign hashtag hashtag usernam london unit kingdom
1888,usernam restock best run short ever own need number pair httpaddr
1889,usernam usernam usernam usernam usernam usernam espectacular que guapa
1890,usernam pictur
1891,usernam guess one bother glue seal box terribl ship inde entir box open held togeth plastic tie never slowest ship ever pictur
1892,usernam one flag ship store nyc number st ask employe carri size number said ye carri size number store yet find size number us pant store plu size section main locat least
1893,wer kunden ignoriert verliert siespat rettungsversuch fur die hashtag realistischer kleidergrossen bei usernam httpaddr
1894,walk usernam follow employe cash regist shrug emoji modifi fitzpatrick type number zero width joiner femal sign face tear joy httpaddr
1895,usernam usernam usernam usernam usernam usernam broken heart loudli cri face crush though smile face heart shape eye
1896,usernam pardon mai usernam avait l epoqu grace au boycott effectif et la mauvais press perdu pa mal en bours esperon qu il en sera de meme pour usernam
1897,siap makan mau cari sepatu kan tu yg nyaman buat httpaddr kita ke usernam yg kelihatan malah bajunya sungwoon sm ong lgsg cek pricetag face without mouth pictur
1898,usernam usernam awt
1899,number concept car preview mid engin corvett httpaddr the_gospel usernam usernam mehmetsercanog usernam usernam quotes_lif usernam usernam usernam hrw usernam un_spokesperson usernam usernam usernam pictur
1900,usernam usernam thank
1901,usernam usernam receiv ord today item miss
1902,usernam shop client yesterday saw shirt usernam btw mention one famili scienc nerd usernam shirt insist httpaddr
1903,mani sale littl time money def enough money banknot dollar sign check katespadeni usernam juli number sale number today want see fave alway httpaddr
1904,usernam look todo tendencia un pantalon paperbag de usernam top raya tirant con boton delantero de usernam sandalia de esparto de usernam capazo de paja de zara pendient httpaddr
1905,usernam point run busi one serv wait number min walk away pictur
1906,potenti client usernam often want chatbot like usernam usernam numberflow etcth big question afford resourc financi human digit strategi need build launch scale chatbot hashtag
1907,usernam usernam usernam mdrrrrr moi je voi le meme drapeau sauf qu une equip choisi de centrer sa croix tout comm la rencontr apr
1908,follow size chart h ms websit short way small thank lot usernam
1909,forgot much rate usernam swimwear smile face heart shape eye smile face heart shape eye
1910,rt blazer short combin dream outfit usernam smile face heart shape eye hashtag hashtag hashtag pictur
1911,usernam usernam usernam usernam usernam numberbitdadblog usernam numberbitnostalgia usernam usernam usernam usernam usernam number year old son would love cat face tear joy
1912,usernam usernam terribl ship right size got item present someon got sent wrong size present late x
1913,usernam usernam usernam nope skinnier jean greater worship
1914,usernam pleas get staff westfield store number min pay ridicul number peopl queue
1915,ridicul much love usernam
1916,good usernam httpaddr
1917,usernam usernam ff never found anyth fit look good even item two size big appar
1918,h columbia gap other accus ignor disturb abus larg indian supplier httpaddr via usernam hashtag usernam usernam usernam
1919,jungl jump dior usernam unicorn face two heart clink glass heavi black heart hashtag black sun ray httpaddr
1920,usernam usernam usernam usernam lose hope love xx never say never everyth possibl heavi black heart
1921,usernam usernam rememb back size number number even fit number number pair jean h absolut devast effect confid eighteen year old
1922,usernam usernam ye queennnnn
1923,usernam cambridg wife ask tri dress store model staff member rude number talk realis custom servic
1924,everi next level life demand differ version thought balloon fleec cardigan usernam usernam hashtag hashtag hashtag httpaddr
1925,usernam drop new fuckin jean tire bring jean number year ago
1926,simpl bodycon dress pair sneaker hoop ear make perfect summer outfit add color httpaddr detail ear usernam usernam usernam usernam hashtag hashtag hashtag hashtag hashtag hashtag pictur
1927,exigez une remuner decent pour le ouvrier usernam signez mainten hashtag hashtag httpaddr
1928,usernam eur onlin rabatt aktionen auf sale artikel konnt ihr euch auch sparen wenn number der produkt bereit ausverkauft sind
1929,le camici soft morbid sono il must della stagion estiva number grin face nel nostro ultimo articolo abbiamo selezionato quell piu voga alcun anch hashtag white point backhand index httpaddr hashtag hashtag hashtag hashtag hashtag zara usernam usernam pictur
1930,hey usernam order someth certain size stock let know cancel order instead send item two size big realiz might depend item event life right way ruin plan
1931,usernam usernam usernam usernam usernam tradueixen gender per gendr es queden tan ampl ole tu
1932,usernam put new playsuit first bought recent store alreadi broke tri tighten strap fell apart great qualiti pictur
1933,white point backhand index emoji modifi fitzpatrick type number number usernam hashtag httpaddr
1934,usernam usernam usernam tri cleanfox httpaddr use gmail excel app auto unsubscrib delet email block incas unsubscrib work
1935,usernam usernam usernam aww love said video think tweet especi actual day
1936,ikea usernam usernam domin rank number valuabl brand nordic usernam httpaddr hashtag hashtag hashtag hashtag hashtag hubtamperehashtag hashtag hashtag hashtag hashtag hashtag hashtag
1937,usernam usernam usernam usernam usernam usernam usernam usernam usernam usernam usernam usernam usernam enough travel light love two heart sunglass dark sunglass shoe high heel shoe
1938,usernam ruin cloth dogshit logo tho
1939,usernam usernam usernam usernam usernam usernam usernam numberupireland numberup usernam usernam love
1940,usernam usernam usernam size ridicul bought stripi shirt three size bigger button still gape plu size section huge new westfield store consist two unmark rack joke give money
1941,usernam usernam usernam usernam usernam usernam usernam usernam usernam usernam usernam usernam usernam usernam usernam usernam usernam usernam usernam dejam algo aunqu sea el palito chupao anda
1942,usernam girl view photo usernam outfit usernam shopmatalan hashtag hashtag hashtag hashtag hashtag hashtag hashtag hashtag hashtag hashtag hashtag hashtag httpaddr
1943,usernam usernam usernam usernam great news great song face stuck tongu wink eye thumb sign
1944,usernam usernam good grief
1945,made hashtag two weekend hang wink face short dress super comfi moneysymbnumb usernam person rais hand celebr emoji modifi fitzpatrick type number definit recommend everyon stapl black dress httpaddr
1946,usernam rememb order creas face tear joy face tear joy pictur
1947,usernam usernam burada gecen gun hava number dereceydi hala magazalarda yun kazak var
1948,hashtag usernam jean boot usernam bag usernam pictur
1949,usernam yall gonna fix new app na cart still full purchas
1950,usernam usernam well
1951,usernam sign man twin usernam httpaddr
1952,usernam usernam usernam usernam usernam httpaddr
1953,mijn pakketj van de usernam zou vandaag aankomen maar wij waren niet thui du kreeg ik een kaartj dat het bij de buren ligt maar daar ligt het ook niet broken heart
