,tweet
1956,usernam usernam usernam usernam drake ol blackfac emot industri plant mf like kendrick
1957,gurrrrrrrl know u want dih dickkkkkkkkkk usernam hashtag hashtag
1958,bring west coast gangsta rap back number top da chart instead copi cat auto tune clone usernam usernam usernam usernam usernam men tell stori half popul never encount fact hashtag hashtag hashtag
1959,peopl gonna shoot day usernam usernam usernam usernam usernam usernam usernam usernam usernam
1960,either usernam usernam star usernam danger httpaddr
1961,usernam usernam forev inspir usernam thank god
1962,usernam usernam cool wait long usernam end leav pleas play hard get
1963,vote usernam ae lead villian kilmong like role usernam dragon posit usernam player guid like method httpaddr
1964,usernam realli look forward see act futur take wicha sinc feel proud see usernam amaz prop done much gener art hiii power
1965,usernam perform usernam right pure geniu hand incred watch thank person fold hand hashtag hashtag hashtag hashtag
1966,usernam usernam usernam usernam usernam usernam usernam _terminator_number_ u call doom goat ili
1967,hashtag usernam kill amaz perform
1968,moment numberc shoot usernam last episod power liter cri usernam play role well forgot kendrick realli thought slow crackhead die face tear joy face tear joy
1969,numberc usernam usernam great perform
1970,play rich kid kendrick lamar new freezer hashtag usernam httpaddr
1971,usernam kill part power face tear joy face tear joy face tear joy face tear joy face tear joy expect act homeless nigga
1972,work usernam epic show yesterday n fist bump usernam hotel breakfast morn n rainbow appear life bless
1973,need still usernam httpaddr
1974,skip sleep watch usernam usernam hashtag pictur
1975,hashtag greatest usernam x usernam hashtag cc usernam
1976,usernam usernam usernam bitjchhhajhdhsba whatttt tffff anguish face anguish face dizzi face
1977,super mandatori speak head silhouett usernam usernam httpaddr
1978,usernam usernam good make tampa show folk went specif see sza love usernam seen
1979,usernam incred
1980,sit porch listen usernam smokin start rain hashtag
1981,usernam usernam watch episod mr lamar phenomen
1982,usernam usernam usernam usernam usernam usernam ok let second act list corpor lit hashtag moneysymbtwtr pictur
1983,usernam nigga said chicken dinosaur roll floor laugh
1984,usernam maxxyshaw mark word usernam nomin possibl win emmi perform hashtag guest role lace power httpaddr
1985,usernam play hell role hashtag
1986,hashtag hundr point symbol hashtag poohjankin katakana middl dot katakana middl dot katakana middl dot us talent us multi talent usernam kill role power_starz love see underdog becom httpaddr
1987,usernam see u trynna thumb sign rather good music usernam usernam u see usernam battl usernam yet time
1988,usernam usernam lmao stop face tear joy face tear joy face tear joy
1989,usernam usernam
1990,thank god rap usernam person fold hand emoji modifi fitzpatrick type number crown
1991,usernam usernam wowowowowx
1992,usernam usernam one best thing seen number roll floor laugh
1993,usernam usernam kendrick hope becom regular power
1994,usernam usernam usernam
1995,usernam usernam usernam usernam httpaddr
1996,numberc usernam perfect
1997,headphon new freezer usernam x usernam vertic traffic light hashtag w usernam fire hashtag multipl music note hashtag hundr point symbol
1998,usernam play lace usernam hashtag
1999,usernam usernam mr kunta roll floor laugh roll floor laugh roll floor laugh roll floor laugh roll floor laugh ur dad u live face scream fear face scream fear face scream fear would face u come like white point backhand index u real hippi ey face tear joy face tear joy roll floor laugh roll floor laugh httpaddr
2000,usernam usernam forgot add usernam usernam liiiiist
2001,usernam one favorit scene httpaddr
2002,usernam numberc usernam usernam usernam usernam may never get job televis word aint alway nice lmao love show lord know
2003,king music tv usernam httpaddr
2004,yo usernam need anoth album bro fire fire fire fire goat
2005,gkmc usernam definit one best decad thank
2006,usernam usernam back shit love franklin complex charact get behind start time push biggest owner black ppl sinc slaveri eye write good cabl tv usual reserv usernam
2007,usernam usernam trump answer mani name flush face
2008,usernam usernam funniest thing seen omg roll floor laugh
2009,power love usernam cameo mhen nigga fire fire fire fire
2010,usernam usernam usernam usernam usernam usernam usernam thank person fold hand emoji modifi fitzpatrick type number number blue heart
2011,usernam usernam usernam httpaddr
2012,usernam usernam usernam usernam usernam usernam say hello jan one lucki girl x jan
2013,kendricklamar unico homem vivo que merec respeito
2014,hashtag take boardroom use whiteboard minut door open laptop start blare mid song new freezer usernam usernam tri figur hashtag mine insight noth see smile face open mouth cold sweat hashtag hashtag hashtag hashtag
2015,usernam let start oldi goodi steve laci teenag make smash hit usernam usernam use iphon httpaddr
2016,usernam need ad usernam usernam usernam usernam list asap smile face sunglass smoke symbol
2017,favorit song time favorit album time thank usernam person fold hand emoji modifi fitzpatrick type number pictur
2018,say big rich town hashtag hashtag week episod power usernam crack head face tear joy roll floor laugh face tear joy roll floor laugh face tear joy face tear joy face tear joy face tear joy face tear joy roll floor laugh roll floor laugh numberc fukin geniu maaayn
2019,usernam hii power httpaddr
2020,usernam bless aspect art entertain hashtag good hell fire fire fire
2021,love humbl skrillex remix usernam usernam
2022,call spoiler recap review rundown yesterday episod power happi birthday featur usernam found httpaddr hashtag
2023,saw usernam usernam doibl take like pictur
2024,usernam usernam usernam pictur
2025,usernam usernam numberc usernam usernam usernam
2026,usernam usernam love show
2027,usernam good let take minut appreci bewitch headlin throwback stage ep year hashtag
2028,usernam lace fire fire fire fire fire fire fire fire fire fire blackman get banknot dollar sign
2029,usernam got fast track rap
2030,usernam mean could pull usernam releas album uncut per usernam petit shrug emoji modifi fitzpatrick type number zero width joiner male sign
2031,usernam call usernam usernam usernam usernam usernam usernam usernam whole mob usernam usernam mozzi get brakkin make event number also
2032,vibe j cole x kendrick lamar type beat prod marcu _aggression_ rowel sr aggressionnumb via usernam httpaddr hashtag hashtag hashtagsal hashtag hashtag hashtag usernam hashtag usernam
2033,usernam _bornadiva_ face tear joy face tear joy thank fam
2034,usernam usernam usernam httpaddr
2035,usernam nail hashtag face scream fear hundr point symbol flush face flex bicep emoji modifi fitzpatrick type number
2036,usernam usernam knew sound familiar pictur
2037,usernam usernam usernam usernam numberrhythmfm drop post usernam ft usernam
2038,usernam final realiz usernam hashtag face open mouth unknowingli watch number scene twice recogn dope perform cool addit cast fire fire hundr point symbol hundr point symbol hashtag hashtag hashtag hashtag
2039,usernam usernam
2040,travi need drake album hit thing last album kendrick number rapper threat list j cole kendrick hendrix usernam usernam usernam
2041,thought usernam amaz job hashtag clap hand sign emoji modifi fitzpatrick type number clap hand sign emoji modifi fitzpatrick type number clap hand sign emoji modifi fitzpatrick type number laugh unreal pictur
2042,pedal backward live old fashion usernam two heart
2043,usernam usernam usernam usernam fireee fire
2044,usernam incred job hope see act realli natur
2045,usernam usernam usernam usernam total agre breakdown
2046,usernam numberc ye
2047,updat usernam first artist sinc usernam chart album number week speaker three sound wave white heavi check mark via usernam pictur
2048,usernam barbi dream number version usernam control vers hear evil monkey hear evil monkey hear evil monkey see evil monkey see evil monkey see evil monkey speak evil monkey speak evil monkey speak evil monkey
2049,need usernam tini desk concert doh usernam make happen plz
2050,usernam think orch compos use form humbl els signal also listen usernam
2051,need usernam usernam collab someth life aint fair httpaddr
2052,usernam sh hashtag number week billboard httpaddr
2053,face tear joy roll floor laugh good gob usernam hope last time see power httpaddr
2054,usernam keep get better better last night episod top notch usernam brilliant ok hand sign fire
2055,saw usernam episod usernam httpaddr dude clap hand sign emoji modifi fitzpatrick type number clap hand sign emoji modifi fitzpatrick type number
2056,usernam usernam usernam numberc usernam usernam point pleas keep dominick show benni bring mob edg
2057,yo usernam got show man budapest readi let start parti smile face open mouth hashtag
2058,littl danc kinda kill face tear joy face tear joy face tear joy face tear joy face tear joy face tear joy face tear joy face tear joy face tear joy face tear joy face tear joy face tear joy face tear joy face tear joy face tear joy face tear joy face tear joy face tear joy face tear joy face tear joy face tear joy face tear joy face tear joy face tear joy face tear joy face tear joy usernam usernam usernam httpaddr
2059,usernam usernam usernam usernam usernam usernam usernam usernam usernam usernam pictur
2060,aye usernam act face tear joy face tear joy face tear joy
2061,usernam kill part power face tear joy face tear joy face tear joy
2062,usernam usernam usernam rip
2063,usernam usernam usernam usernam pictur
2064,number usernam number usernam
2065,usernam usernam usernam usernam help gibson twin teen activist head colleg httpaddr
2066,usernam usernam usernam usernam usernam usernam usernam usernam usernam usernam httpaddr pictur
2067,usernam usernam usernam great interview
2068,usernam usernam got game microphon fire fire fire
2069,usernam wish usernam drop surpris album take album year like alway everyon drop album
2070,usernam act yo hashtag real artist clap hand sign emoji modifi fitzpatrick type number clap hand sign emoji modifi fitzpatrick type number clap hand sign emoji modifi fitzpatrick type number clap hand sign emoji modifi fitzpatrick type number clap hand sign emoji modifi fitzpatrick type number
2071,usernam need hear kendrick lamar ft kdot song shrug emoji modifi fitzpatrick type number zero width joiner male sign
2072,usernam numberc kendrick give therapi session fr
2073,usernam usernam play role well
2074,usernam drake time sampl song like pound cake origin usernam ddlovato feel better httpaddr
2075,usernam usernam numberc usernam usernam usernam crackhead almost make past one episod
2076,back watch hashtag usernam act debut seen tweet much shit sinc new season premier sneez face
2077,usernam usernam usernam love kendrick much way beyond year glad see everyth want life kill ittttt
2078,usernam usernam usernam usernam usernam usernam
2079,go make collab usernam like promis fam lol httpaddr
2080,_discopedia hoje especi realcoleworld usernam na _discopedia se eu foss voce chegaria cedo rs httpaddr
2081,usernam channel inner chri rock role hashtag
2082,dear usernam got bring usernam back episod hashtag hashtag pictur
2083,person still upset usernam usernam drop joint album hashtag pictur
2084,babi rt usernam name name ask tell httpaddr watch starz app httpaddr pictur
2085,anyth usernam
2086,usernam usernam unamus face
2087,spend whole check see usernam usernam go bar bar
2088,man usernam actin hashtag play crackhead roll floor laugh pictur
2089,usernam usernam usernam usernam yup shit still fire fire fire till day
2090,ride miami inumb bump hashtag roc jelk moment u live usernam usernam
2091,usernam usernam usernam usernam usernam usernam usernam dislik king youth
2092,love sm usernam
2093,nike cortez kenni iii athlet shoe xiang madekatsukoii smile face sunglass usernam hashtag hashtaghashtag pictur nike lab manumb
2094,furri movi way switch car _____ ______________________ kendricklamar usernam hashtag hashtag hashtag httpaddr
2095,hashtag usernam king kunta hashtag usernam usernam usernam hashtag hashtag hashtag
2096,need usernam x usernam collab shit wud b magic fire
2097,usernam new episod hashtag everyth person rais hand celebr emoji modifi fitzpatrick type number
2098,usernam usernam numberc tell get grammi award readi hundr point symbol
2099,usernam usernam usernam usernam usernam ye pictur
2100,usernam perform hashtag last night extrem impress guy futur act sure powernumb
2101,algun dia quiero tener el malandrismo de usernam el swag de usernam el flow de usernam fire drool face
2102,fake humbl ju cuz ur ass insecur usernam jakefromktown
2103,hahahah multipl music note music note biyombo humbl sit multipl music note music note usernam usernam httpaddr
2104,usernam numberc pictur
2105,usernam usernam numberc nasti muthafucka face tear joy fire thumb sign
2106,must say usernam realli kill perform hashtag week even though charact crackhead lol depth intellect shine glad kanan kill em person rais hand celebr emoji modifi fitzpatrick type number clap hand sign emoji modifi fitzpatrick type number
2107,usernam usernam exactli song basic number checklist come age lesson
2108,usernam good job power yesterday ya catch gem geesh
2109,usernam need usernam usernam colab man person fold hand emoji modifi fitzpatrick type number fire
2110,usernam usernam hashtag pic took usernam usernam former nba star usernam backstag hashtag show number hashtag hashtag httpaddr
2111,usernam usernam usernam usernam dm
2112,usernam usernam son lamar power
2113,hashtag dont kill vibe remix f jay z usernam httpaddr pictur
2114,seen usernam live number number time wit histor moment torch pass legend stage reason favorit k dot show thu far pictur
2115,usernam performancx latest episod usernam pictur
2116,usernam great episod well play usernam might see act field often
2117,usernam usernam numberc big ya dig face tear joy face tear joy face tear joy
2118,usernam usernam usernam usernam usernam usernam usernam usernam usernam usernam usernam dope
2119,usernam blind woman think face
2120,usernam usernam usernam drake
2121,usernam usernam numberc numbergoodynumb doesthat mean defo anoth seri kendrick caus season show get better
2122,usernam best episod charact usernam yet pleas make spin show hashtag
2123,usernam usernam usernam usernam usernam usernam usernam usernam usernam usernam usernam usernam lucki enough thumb sign
2124,pushpin usernam basari kemerin oyunculuk da httpaddr detaylari icin tiklayin wink face httpaddr
2125,usernam usernam numberc usernam
2126,usernam usernam usernam usernam usernam
2127,usernam usernam usernam usernam never start
2128,usernam hi
2129,usernam deserv project usernam next summer
2130,usernam think abstract way make messag hard dechyp like told spanish guy think much head would get blown
2131,usernam haha u hashtag hashtag numberc ye ye ye love crew hashtag
2132,usernam usernam numberc ye u remark job let see
2133,usernam usernam usernam usernam usernam usernam usernam usernam usernam usernam usernam usernam dope ass list thank man fire
2134,usernam usernam dont stop bluf drop project still wait face tear joy pictur
2135,usernam bout make start watch power first time face tear joy shrug emoji modifi fitzpatrick type number zero width joiner male sign
2136,usernam usernam rap album outsold gener edm pop fad fave face tear joy
2137,httpaddr usernam usernam usernam usernam usernam usernam usernam numberfutur usernam usernam
2138,futur usernam usernam cudi usernam top hashtag song number pick x httpaddr
2139,usernam usernam usernam thang
2140,woah check review debut album preview compar usernam usernam childish gambino thank usernam hashtag httpaddr pictur
2141,kendrick lamar amaz rapper decent actor guy wrong usernam usernam hashtag face tear joy clap hand sign person rais hand celebr hundr point symbol
2142,usernam hashtag hashtag hashtag usernam usernam usernam usernam bad blood httpaddr
2143,usernam perform hashtag impecc look forward see lace
2144,usernam usernam nah let rap good
2145,gkmc de mi marido usernam tien number semana en el top number de billboard
2146,usernam usernam kendrick play crackhead role better chri rock new jack citi
2147,usernam usernam usernam need tde know bsc person fold hand emoji modifi fitzpatrick type number hundr point symbol
2148,usernam usernam face tear joy face tear joy great
2149,usernam hashtag usernam pret pour usernam usernam usernam usernam usernam thumb sign tongu
2150,usernam still wait someon call candi man
2151,remix america beat keep gambino add usernam usernam keep idea
2152,usernam roll floor laugh httpaddr
2153,usernam usernam usernam total agre
2154,usernam beauti thank usernam featur brown skin women video crown us alway pictur
2155,usernam usernam usernam usernam app numbermo
2156,usernam para usernam
2157,usernam check new singl imagin produc usernam httpaddr hashtag hashtag hashtag hashtag hashtag hashtag
2158,usernam kill hashtag got lot talent brother person rais hand celebr emoji modifi fitzpatrick type number
2159,excit second usernam show norway year lit hashtag hashtag hashtag hashtag hashtag
2160,miss usernam
2161,fanci usernam year person fold hand emoji modifi fitzpatrick type number number got ticket grab number combin enclos keycap thank usernam person rais hand celebr emoji modifi fitzpatrick type number number could see usernam usernam amp usernam smirk face pictur
2162,usernam usernam say name answer pudintan name dumb monday ask tell get correct
2163,usernam usernam usernam usernam usernam signe weak
2164,usernam usernam usernam usernam let goooooooooo usernam usernam
2165,usernam numberc leverag
2166,debat usernam usernam unnecessari like compar mj princ great make impact black commun let stop argu better enjoy great hashtag
2167,usernam usernam get skull
2168,usernam usernam name
2169,dooooop boy usernam play role soo well clap hand sign clap hand sign httpaddr
2170,numberc ask usernam play crackhead hashtag think face
2171,wow took whole min clock usernam usernam let hope make career
2172,usernam usernam usernam usernam amaz job new track man check httpaddr limit time promo sale bless
2173,usernam usernam usernam true
2174,usernam usernam wait see u ep x
2175,usernam usernam need spiritu mental guidanc
2176,yo usernam actual kill hashtag charact funni af haha philosoph crackhead great act debut
2177,usernam usernam usernam
2178,usernam _lgplay go act like snoop new york huh
2179,like usernam role
2180,usernam usernam usernam usernam usernam wowwwwwwwwwww icon
2181,usernam ft number artist u think httpaddr
2182,dedic x usernam usernam get hype whole hoe
2183,usernam usernam funni stitch glad k kill
2184,kind want watch usernam watch usernam thang hashtag goat
2185,usernam power
2186,feel like due new usernam album
2187,usernam usernam realli bro
2188,love usernam feat usernam hashtag hashtag hashtag pictur
2189,sorri white race shot hashtag usernam say escap holler want ra dawg drmr wondaland hashtag hashtag httpaddr
2190,usernam l artist que je detest cross mark l artist surcot cross mark l artist sou cote numberglamszn l artist que j ador usernam l artist avec la meilleur imageri usernam usernam l artist que j kiff en secret homo cross mark le g usernam
2191,usernam usernam big protesthelp impeachhashtag httpaddr
2192,usernam nice roll play hashtag
2193,usernam usernam clown face tear joy face tear joy face tear joy skull skull
2194,usernam numberc episod usernam cutthroat hashtag
2195,person fold hand emoji modifi fitzpatrick type number crown goat x usernam take em next level earth globe europ africa aint prepar hit em tht mfkin heat fire face look triumph fire hashtag hashtag hashtag hashtag hashtag hashtag pictur
2196,usernam fuck great hundr point symbol hundr point symbol laugh great roll floor laugh hashtag
2197,one favourit music vid ever httpaddr hashtag hashtag usernam pictur
2198,usernam usernam yam brought outta richard pryor
2199,combin vibe usernam usernam usernam usernam usernam usernam creat bring togeth make whole new sound glorifi jesu life complet smile face sunglass hashtag
2200,peopl getter majorli piss usernam hashtag hashtag
2201,usernam usernam usernam aye talk
2202,speak rap usernam anoth masterpiec soon pleas thank
2203,usernam someon ask proof black peopl hebrew show em evid hashtag httpaddr
2204,usernam usernam still feel way
2205,usernam cameo role hashtag absolut gold
2206,love hashtag meh dope tv show usernam u kill bruv gud job fif numberc get strap hundr point symbol
2207,usernam kung fu kenni martial art uniform play power insan fire hope show hashtag
2208,say govern truth politician alway mislead youth head answerhead futur kendricklamar untitl unmast pictur
2209,final caught hashtag usernam smile ear ear good
2210,kendricklamar explain usernam role httpaddr pictur
2211,usernam usernam usernam usernam httpaddr
2212,usernam usernam usernam bout discuss shirt
2213,usernam cameo power clap hand sign clap hand sign clap hand sign hashtag numberc
2214,produc usernam usernam usernam would sound like pictur
2215,usernam number billion time influenc usernam music got whole world lingo u see know kick flava
2216,power great thank httpaddr thank usernam readi multi talent ass fire fire fire fire fire fire fire
2217,usernam heart arrow
2218,could date one celebr would ladi got kendricklamar usernam usernam
2219,looool see usernam hashtag
2220,usernam usernam usernam god plan drake
2221,usernam absolut amaz great job love
2222,usernam usernam usernam congrat
2223,usernam hashtag nigga kill person rais hand celebr person rais hand celebr
2224,usernam usernam usernam
2225,fact usernam play junki power made show number time better man act
2226,usernam usernam usernam first rapper usernam number week usernam chart albumvia usernam hashtag hashtag hashtag hashtag hashtag usernam pictur
2227,usernam usernam usernam usernam usernam great
2228,la gent se arremolina en el escenario princip del usernam para ver el potent acto de usernam fire pictur
2229,usernam aye bro come anoth album buy vip ticket tour meet thank advanc
2230,need usernam hashtag
2231,numberc kill intro hashtag fire fire fire fire fire undercov liar lie cover look bitch eye tell babi love inspir usernam repris role sinc play crazi card episod number
2232,usernam usernam saenpeurani deo manhi hajianhgessnya
2233,usernam inspir alway
2234,usernam know like usernam want show
2235,usernam play heck role usernam numberc great addit ok hand sign hashtag pictur
2236,usernam usernam usernam usernam top number number
2237,usernam usernam usernam usernam king crown boss roff
2238,want free tde merch jayrock usernam usernam usernam usernam pl billi pictur
2239,usernam usernam ja twordt dan tijd e
2240,usernam usernam usernam dudeee hate much face tear joy face tear joy face tear joy face tear joy cross fade af car anisah kept stare crack head ass girl tryna fight smile face open mouth cold sweat
2241,usernam usernam tu coco fire fire ok hand sign emoji modifi fitzpatrick type number
2242,usernam usernam numberc kendrick deff thing turn hashtag anoth empir cameo
2243,usernam drop crackhead kendrick vers
2244,grab limit edit usernam damn album vinyl hashtag pictur
2245,usernam usernam damn perfect combo perfect time
2246,usernam usernam two tryna big em usernam
2247,usernam usernam dope
2248,usernam usernam usernam fuck love steve laci
2249,usernam usernam numberc hashtag_up nigga like nigga shit
2250,contando lo dia para ver por fin usernam en conciertooooooo
2251,let go airplan usernam usernam pictur
2252,usernam amaz job hashtag limit potenti human true definit talent
2253,saw episod usernam usernam guy insan love part hashtag hashtag hashtag
2254,usernam usernam nice
2255,usernam multipl music note multipl music note multipl music note missmewithth uatourrist multipl music note multipl music note iwannaseeanotheroneofyouractingsuperstageshowsonthscreen sir crown
2256,usernam usernam usernam mixtap kendrick lamar jay rock sleep til nyc hashtag httpaddr usernam usernam usernam
2257,usernam gotta african tour damn
2258,usernam went cray hashtag face tear joy face tear joy face tear joy face tear joy pictur
2259,te amo usernam si veni al lolla te voy amar ma
2260,realli freestyl true stori time pass throne usernam
2261,realli numberc realli face cold sweat neutral face decid use usernam usernam face tear joy face tear joy face tear joy pictur
2262,diss usernam usernam usernam roll floor laugh x enjoy ok hand sign pictur
2263,usernam usernam face tear joy
2264,usernam usernam usernam usernam duhhh drool face beat heart
2265,usernam guest appear usernam last episod usernam lit fire fire fire fire congrat numberc cast flex bicep
2266,usernam usernam concert nc love cardi kendrick aaaaayi pictur
2267,usernam great job would love see episod
2268,usernam usernam usernam usernam real straight trashh pile poo pile poo
2269,usernam usernam usernam usernam break hip
2270,usernam usernam drop collab dissect america black boy joy love togeth releas timeless project usernam
2271,gonna see usernam lit fire
2272,usernam usernam usernam usernam usernam usernam usernam usernam usernam usernam usernam usernam dont consid tron network man record artist get involv make chang want see get sucker tron net
2273,usernam usernam hashtag hashtag
2274,usernam act deep smart
2275,usernam usernam usernam squar
2276,usernam maaannn kill need regular show fire fire fire fire
2277,usernam usernam ask name go away
2278,episod usernam aggrav usernam bodi role
2279,usernam usernam shit drop soon
2280,kendrick lamar sur pimp butterfli et damn kendricklamar usernam pictur
