,tweet
3838,usernam ur perform power realli good realli sent chill down spine k gun ur back u said httpaddr whole interact httpaddr act httpaddr amount respect numberc look like og bicycl
3839,usernam usernam usernam stay whip lol look bomb
3840,exactli pool locat usernam
3841,usernam usernam usernam usernam usernam usernam usernam usernam wat name song dude
3842,usernam usernam usernam usernam usernam lmfaooo well actual gonna use drake futur one bad exampl good song pictur
3843,usernam play tf outta role hashtag
3844,usernam usernam usernam usernam usernam name manni plu tnastii sound better
3845,kill role big bro usernam usernam
3846,person fold hand emoji modifi fitzpatrick type number person fold hand emoji modifi fitzpatrick type number person fold hand emoji modifi fitzpatrick type number usernam battl rap huge statement hashtag httpaddr
3847,usernam kill role power good job
3848,usernam usernam usernam usernam name lace
3849,usernam thought track usernam
3850,usernam usernam need kendrick lamar interview time
3851,usernam power roll floor laugh person rais hand celebr emoji modifi fitzpatrick type number
3852,usernam usernam usernam usernam obvious
3853,usernam usernam also keep go back part deliveri content beat goe say word misplac great let give produc credit whole thing strap well togeth yam
3854,usernam usernam usernam usernam usernam usernam usernam usernam usernam usernam usernam well cousin flag
3855,usernam hilari hashtag great actor
3856,usernam gettin old school kung fu flick sound effect
3857,usernam usernam bruh alreadi happen
3858,usernam great job everi person live hood relat guy harmless deadli
3859,friend kendrick lamar hashtag level lion face usernam lion face hashtag hashtag hashtaghashtag white point backhand index hashtaghashtaghashtag hashtag hashtag lo angel california httpaddr
3860,usernam wtf ah
3861,usernam look good still whyyyyyy
3862,usernam need get back shit voic dope street dream usernam dope track special deliveri still favorit track
3863,usernam star hashtag best thing ever face tear joy face tear joy
3864,usernam number kendricklamar number numberpac number na number eminem number biggiesmal number jayzclassicbar number liltunechi number jcolenc number sarkodi number mslaurynhil number kanyewest
3865,usernam watch power last night u think what ur take usernam aka lace
3866,usernam usernam usernam usernam cours yellow heart
3867,usernam usernam hell nag like crack head kenni
3868,kung fu kenni made sing loudli cri face person fold hand emoji modifi fitzpatrick type number excit best black heart black heart black heart hashtag hashtag usernam pictur
3869,usernam hashtag kendrick lamar cut grow closer usernam usernam httpaddr
3870,kung fu kenni play role usernam crackhead pretti good man got skill usernam
3871,usernam usernam usernam kill bro great cast choic btw throw anoth pod dude know minut lol hashtagb
3872,usernam usernam usernam welp guess mma pay starz packag
3873,numberc power joke keep get better better usernam act surprisingli great got juic congrat great job awesom show good act everyon bless
3874,usernam usernam usernam list
3875,usernam liter goat even
3876,usernam friend world enemi lord
3877,usernam power everyth bet even realli pay attent shit say tho weari face face tear joy
3878,usernam usernam usernam usernam usernam usernam hashtag tblandinier
3879,usernam smash last night usernam fire hashtag hashtag
3880,usernam usernam usernam usernam hahahaha
3881,proper love tune hashtag usernam
3882,usernam usernam usernam bill wither drum mix perfectli sure cuz u usernam
3883,usernam usernam usernam amem que minha mob tem vario preto foda e cheio de talento logo meno ele tao ganhando mundo
3884,usernam usernam awesom episod
3885,pride lead destruct arrog downfal proverb number number gnbin word kendrick usernam sit humbl god word never chang httpaddr
3886,chale better sark die usernam still got futur like usernam
3887,usernam usernam
3888,nah usernam need gone slide one time httpaddr
3889,love kendricklamar httpaddr
3890,usernam usernam usernam usernam usernam usernam usernam usernam usernam usernam usernam usernam goe show get involv promot tron help take mainstream instead sit back wait hope stress whether price gonna go get involv tronit time help take tron new height
3891,number honest like usernam good kid citi think friend anymor
3892,fear usernam httpaddr
3893,usernam usernam usernam usernam brooooo say rapper like usernam exist opinion drake goat
3894,usernam talk usernam ye best thing ever face scream fear person fold hand emoji modifi fitzpatrick type number also seen usernam usernam usernam usernam usernam usernam usernam usernam usernam usernam sunday usernam usernam smile face heart shape eye
3895,usernam usernam usernam usernam
3896,usernam usernam new freezer rule day get view everi dayget bitch tan pool everi day get cliqu plan give jewel everi day pictur
3897,usernam httpaddr
3898,watch usernam power usernam play back gave life honestli pictur
3899,usernam usernam da fuk suppos kind respect left auto tune dumb line mind numb brain cell kill rap pop star somebodi pleas stop usernam stop usernam whilst come syllabl ish damn pictur
3900,usernam see episod usernam week clap hand sign emoji modifi fitzpatrick type number clap hand sign emoji modifi fitzpatrick type number clap hand sign emoji modifi fitzpatrick type number clap hand sign emoji modifi fitzpatrick type number kill
3901,usernam clap hand sign emoji modifi fitzpatrick type number clap hand sign emoji modifi fitzpatrick type number clap hand sign emoji modifi fitzpatrick type number pictur
3902,great actor clap hand sign emoji modifi fitzpatrick type number clap hand sign emoji modifi fitzpatrick type number usernam hashtag httpaddr
3903,usernam actor like
3904,usernam numberc watch finish season number
3905,final watch usernam usernam kill person rais hand celebr emoji modifi fitzpatrick type number clap hand sign emoji modifi fitzpatrick type number hashtag
3906,usernam kill spanish nigger role usernam big numberc pictur
3907,radio speaker one sound wave usernam ambassadornumbergoodmus name usernam hashtag hashtag hashtag hundr point symbol hundr point symbol pictur
3908,pretti cool exchang hello usernam morn run
3909,usernam kendricklamar continu make histori httpaddr
3910,hear feel gon alright nigga gon alrightnigga gon alrightw gon alright multipl music note genio usernam
3911,usernam usernam usernam usernam usernam usernam usernam usernam usernam usernam usernam usernam bitcoin better
3912,usernam usernam love
3913,usernam usernam usernam sooo talent didnt even realiz
3914,made usernam go hard control
3915,usernam got songz u
3916,usernam usernam usernam httpaddr
3917,te amo usernam
3918,usernam usernam usernam usernam usernam usernam dre sign macklemor wtf face tear joy face tear joy face tear joy
3919,usernam usernam number snyn b arab letter alef lmj arab letter alef l ny wl arab letter alef kyf
3920,usernam bzg
3921,usernam thank inspir boy pictur
3922,solo yo veo parecido star de usernam usernam parecido god woman linchen hashtag pictur
3923,usernam yerp
3924,ah guy great loudli cri face loudli cri face fire fire fire usernam httpaddr
3925,show hashtag televis usernam ft usernam star smash hit music video channel dstv number gotv number
3926,fact usernam gave us tpab still want crazi
3927,usernam usernam amaz charact strong still abl express vulner great actor beauti clap hand sign emoji modifi fitzpatrick type number clap hand sign emoji modifi fitzpatrick type number clap hand sign emoji modifi fitzpatrick type number heavi black heart
3928,beam eighth note king dead usernam hashtag httpaddr
3929,usernam httpaddr
3930,numberhoot usernam rexxliferaj drake kendricklamar yg
3931,usernam usernam usernam usernam usernam hashtag usernam usernam
3932,usernam usernam number usernam usernam usernam usernam usernam usernam usernam usernam usernam usernam
3933,usernam usernam usernam usernam usernam usernam usernam usernam usernam usernam usernam usernam usernam usernam usernam usernam usernam usernam usernam usernam usernam usernam usernam httpaddr
3934,usernam usernam corn cobb yellow
3935,usernam usernam usernam smile face heart shape eye smile face heart shape eye smile face heart shape eye smile face heart shape eye smile face heart shape eye smile face heart shape eye smile face heart shape eye httpaddr
3936,babi love u usernam
3937,usernam usernam would even better
3938,usernam usernam numberc nasti loudli cri face loudli cri face loudli cri face loudli cri face loudli cri face kendrick like best pooki new jack hashtag strap
3939,watch power usernam hella job hundr point symbol
3940,hashtag usernam np star ft usernam usernam
3941,shit chang till get wash yo ass nigga grandmama usernam
3942,usernam forev favorit rapper bro
3943,usernam liter want show greatest work seen
3944,yeah late usernam hashtag everyth hashtag
3945,usernam usernam usernam usernam face tear joy face tear joy okay bro face tear joy face tear joy
3946,usernam feel get everi time memo memo fire
3947,usernam damn cool time best rapper actor heavi black heart heavi black heart pictur
3948,usernam usernam usernam greatest album time tbh
3949,usernam kill role power sign horn emoji modifi fitzpatrick type number
3950,imma need number rawest nigga drop tht album usernam usernam nd featur rawest nigga face tear joy usernam
3951,usernam usernam usernam usernam love song much aunti shine make usernam nko abeg give us trivia na pleasee
3952,usernam drop heat freestyl usernam help reviv lost art
3953,usernam power loudli cri face loudli cri face face tear joy yoo sinc speak spanish man look like crack head face tear joy face tear joy face tear joy
3954,get usernam usernam next
3955,hashtag heavi heart exclam mark ornament hashtag speaker three sound wave black panther usernam w usernam x usernam multipl music note multipl music note number radio pictur
3956,usernam usernam usernam usernam usernam usernam usernam usernam usernam usernam usernam usernam usernam usernam kendricklamar usernam usernam white point backhand index emoji modifi fitzpatrick type number time use name use game httpaddr
3957,usernam usernam wait watch
3958,usernam usernam usernam damn thing may futur act
3959,usernam golden globe worthi perform fire fire fire fire favorit guest spot ever person rais hand celebr smile face heart shape eye
3960,usernam usernam usernam usernam pictur
3961,usernam usernam usernam usernam usernam usernam le magazin hashtag avec usernam
3962,hashtag blow high member usernam hashtag httpaddr pictur
3963,seen usernam first time usernam play role well lol clap hand sign emoji modifi fitzpatrick type number clap hand sign emoji modifi fitzpatrick type number
3964,yeah favorit artist usernam power anoth reason want catch httpaddr
3965,yo usernam actor hand bodi role flex bicep emoji modifi fitzpatrick type number face look triumph hundr point symbol
3966,usernam usernam even realiz found charact compel listen writer hollywood usernam pleas thank nice done sir thumb sign emoji modifi fitzpatrick type number thumb sign emoji modifi fitzpatrick type number hashtag hashtag
3967,usernam power epic
3968,basic usernam everyth never knew need hashtag
3969,nigga nigga nigga face tear joy face tear joy face tear joy usernam usernam ssnnumber epinumb funniest thing today
3970,new collab project usernam usernam would dope
3971,usernam king usernam
3972,usernam great job hashtag
3973,usernam savag moneysymbmoneysymbhol king crown shimmi ya shimmi ya shimmi ya httpaddr fire fire fire fire fire
3974,usernam numberc salut u mr jackson true boss creat opportun
3975,sincer hope see lot usernam charact lace hashtag good could like joey badamoneysymbmoneysymb mr robot hashtag
3976,rapper dislik usernam overr rapper usernam underr rapper usernam rapper like usernam rapper secretli like usernam favorit rapper time usernam g usernam httpaddr
3977,usernam go nomin usernam hashtag mvp pass ball usernam ran player slam dunk
3978,usernam usernam collab album httpaddr
3979,usernam usernam usernam usernam usernam usernam usernam usernam usernam usernam usernam buri aliv
3980,usernam usernam like
3981,usernam usernam laugh kill loudli cri face
3982,numberc usernam usernam know build kanan realli tariq father
3983,spite chant thank usernam still fire fire
3984,usernam fantast man brilliant perform hundr point symbol fire ok hand sign emoji modifi fitzpatrick type number
3985,usernam easter fool rooster egg hashtag rais fist emoji modifi fitzpatrick type number x httpaddr usernam mauricejordannumber_ hashtag hashtag hashtag hashtag hashtag hashtag usernam usernam httpaddr
3986,say usernam cut minut gotta wonder poppin point heat check
3987,usernam best actor earth globe america idgaf peepz concur nigga kill role
3988,usernam charact usernam fuck dope
3989,usernam usernam usernam usernam bless bro
3990,usernam usernam usernam name app
3991,usernam
3992,us pure album sale usernam damn number number number total
3993,usernam usernam shirt came mail part tde apparel collect got kendrick shirt hat championship tour merch new sza shirt next item usernam cortez pictur
3994,usernam quot usernam usernam tonight offici seen heard pictur
3995,usernam repost usernam usernam made debut act appear numberc tv show hashtag number day ago appar realli good mayb kendrick could becom anoth rapper also kick act career hashtag hashtag hashtag hashtag hashtag hashtag hashtag pictur
3996,usernam usernam
3997,usernam il un visag innoc avec un style mysterieux ca kill koi wink face
3998,august flush face juli hellish long today playlist full usernam usernam usernam need hustl spirit motiv get back great pictur
3999,usernam usernam usernam awesom job talent young man kudo need see lace
4000,peopl extens list scumbag claim moral cover slaveri abus tortur robberi attempt murder usernam usernam usernam usernam usernam usernam usernam usernam httpaddr
4001,kendrick good actor usernam
4002,usernam usernam numberc get know elena psarro aka cata number help u xx
4003,usernam poetri
4004,usernam usernam usernam usernam usernam usernam usernam classic pictur
4005,honestli want meet usernam sing song love
4006,usernam usernam check dude ryan parker remix usernam alright gon read write httpaddr usernam usernam hashtag hashtag hashtag hashtag hashtag hashtag
4007,aye usernam play tf part clap hand sign emoji modifi fitzpatrick type number face tear joy hashtag
4008,usernam kendrick kendrick kendrick u greatest seed plant bear fruit bear fruit enjoy luv ya brotha u phenomen pictur
4009,usernam usernam watch snowfal get lol
4010,love usernam littl cameo hashtag power_starz numberc
4011,usernam usernam listen get high karma young royalti karma young royalti hashtag hashtag httpaddr god bless thank
4012,usernam usernam usernam usernam kill song black panther face scream fear one fav
4013,usernam usernam usernam usernam star play httpaddr
4014,usernam creas new power episod face tear joy face tear joy
4015,usernam usernam usernam
4016,usernam usernam usernam numberc lovett hashtag
4017,usernam bid power episod loudli cri face face tear joy
4018,usernam usernam usernam usernam usernam usernam usernam usernam usernam usernam definit line throw usernam
4019,usernam usernam section number smile face heart shape eye
4020,usernam usernam usernam usernam usernam usernam usernam usernam usernam usernam usernam usernam usernam usernam usernam usernam usernam usernam usernam usernam usernam usernam usernam usernam usernam usernam usernam usernam usernam usernam usernam usernam usernam usernam usernam usernam dig mostra pau
4021,usernam usernam lololol ti song mate
4022,usernam usernam usernam usernam usernam usernam usernam usernam usernam usernam usernam usernam usernam usernam usernam usernam usernam usernam usernam usernam usernam usernam httpaddr
4023,kendricklamar fuck brilliant usernam usernam hashtag
4024,usernam usernam usernam usernam kendrick right
4025,usernam face tear joy face tear joy face tear joy face tear joy
4026,somehow becom thing would like backstag vip front row ticket squad worri like number friend lot peopl usernam
4027,usernam never donald trump usernam alway barack obama usernam
4028,usernam usernam hot yellow
4029,usernam alway feel go act caus work god gangsta much
4030,usernam usernam usernam usernam usernam usernam usernam usernam usernam usernam usernam usernam anytim bro
4031,coffe bean beat usernam sound lot like beat usernam usernam unreleas temptat song
4032,mood usernam control
4033,best rapper three usernam usernam usernam
4034,usernam gone one best actor ever bodi guest role hashtag usernam effortless easi
4035,usernam u fire usernam numberc
4036,usernam usernam saw charact act amaz
4037,dope usernam usernam thumb sign emoji modifi fitzpatrick type number ok hand sign emoji modifi fitzpatrick type number fist hand sign emoji modifi fitzpatrick type number person rais hand celebr emoji modifi fitzpatrick type number open hand sign emoji modifi fitzpatrick type number sign horn emoji modifi fitzpatrick type number call hand emoji modifi fitzpatrick type number water buffalo hashtag hashtag hashtag hashtag hashtag heavi black heart hashtag hashtag multipl music note httpaddr
4038,usernam usernam usernam usernam usernam ok get year
4039,usernam usernam usernam httpaddr
4040,usernam pictur
4041,usernam realli good usernam would love see act hashtag hashtag
4042,usernam well still wait httpaddr
4043,start listen usernam
4044,club sign musician nowaday usernam usernam pictur
4045,usernam usernam __alexmtz__ eye eye eye
4046,usernam usernam deserv aoti tho
4047,yo usernam snap power role loudli cri face loudli cri face ok hand sign emoji modifi fitzpatrick type number
4048,usernam usernam usernam usernam usernam usernam hashtag sur usernam usernam
4049,usernam love perform power
4050,rapper dislik usernam overr rapper usernam underr rapper usernam rapper like usernam rapper secretli like usernam favorit rapper biggi count dead usernam g usernam
4051,usernam hit tootsi roll hashtag man die classic episod
4052,numberc usernam hashtag hashtag think pictur
4053,usernam love part power natur act person rais hand celebr emoji modifi fitzpatrick type number sure hope becom regular show person rais hand celebr emoji modifi fitzpatrick type number hashtag hashtag hashtag hashtag hashtag hashtag person rais hand celebr emoji modifi fitzpatrick type number
4054,usernam usernam usernam damn
4055,usernam usernam usernam usernam usernam usernam usernam usernam usernam usernam hashtagday hashtag hashtag pictur
4056,love usernam usernam crae crae smile face heart shape eye
4057,money tree money move money wing multipl music note usernam usernam hashtag hashtag hashtag hashtag hashtag hashtag hashtag hashtag pictur
4058,usernam numberc ye thing great job trophi
4059,good kid citi greatest usernam album ever everi song fire swear
4060,yup usernam hashtag everyth pictur
4061,usernam shit got real
4062,usernam usernam night super lit
4063,usernam thing episod usernam
4064,usernam usernam know skull
4065,usernam gemini brother usernam phenomen thing god bless surpris number rais fist emoji modifi fitzpatrick type number gem stone slightli smile face
4066,usernam usernam usernam usernam usernam got bar bro fire fire fire fire
4067,usernam usernam usernam usernam old mean bop still
4068,hashtag start day listen usernam pictur
4069,usernam usernam usernam usernam usernam usernam usernam usernam usernam usernam usernam lil xan top number fosho
4070,usernam usernam usernam usernam usernam usernam usernam usernam usernam usernam usernam vers year beyonc freedom guest vers weak kendrick though pictur
4071,usernam sooo proud
4072,usernam usernam great power
4073,usernam usernam usernam usernam right
4074,usernam ny voic ny sound reason still respect flex make sure ny get assimil southern sound new yorker simpli talk like ny lead follow ny push guy like usernam yet cali push usernam
4075,element person rais hand celebr camera flash person rais hand celebr usernam hashtag artboysattva pictur
4076,usernam play hell outta fein hashtag
4077,usernam kill great job usernam
4078,usernam hashtag craaaaazi shit dope
4079,ummmm none talk usernam outstand work crack head usernam havent seen amaz crack head work sinc usernam pooki clap hand sign emoji modifi fitzpatrick type number clap hand sign emoji modifi fitzpatrick type number clap hand sign emoji modifi fitzpatrick type number clap hand sign emoji modifi fitzpatrick type number clap hand sign emoji modifi fitzpatrick type number clap hand sign emoji modifi fitzpatrick type number clap hand sign emoji modifi fitzpatrick type number clap hand sign emoji modifi fitzpatrick type number
4080,mannn usernam perform power classic get man show face tear joy person rais hand celebr emoji modifi fitzpatrick type number
4081,usernam usernam usernam usernam usernam two talk pictur
4082,usernam shake hashtag rise httpaddr
4083,usernam need usernam big screen
4084,absolut love usernam charact power face tear joy face tear joy hashtag
4085,usernam usernam pictur
4086,wait usernam hashtag speak spanish thumb sign emoji modifi fitzpatrick type number clap hand sign emoji modifi fitzpatrick type number clap hand sign emoji modifi fitzpatrick type number
4087,usernam nasti nigga hehe face tear joy face tear joy face tear joy
4088,usernam realli power flex bicep emoji modifi fitzpatrick type number number
4089,see usernam play lace last night episod power us ctfu play role well hashtag
4090,usernam doubt usernam show fan usernam httpaddr
4091,usernam usernam hashtag usernam good kid citi notch number week usernam top number becom fourth hip hop album reach mileston httpaddr pictur
4092,usernam usernam joseph class act got big follow u k ok hand sign
4093,usernam usernam usernam bro guy perfect
4094,usernam usernam probabl wrote hand drake x
4095,usernam usernam usernam usernam usernam usernam usernam usernam usernam usernam usernam need music dapp hashtag network wink face
4096,usernam usernam legit thought look like idress elba
4097,usernam bad muthafuck l kill shit power yo googl see hashtag hashtag
4098,usernam usernam usernam usernam usernam usernam usernam usernam usernam usernam usernam usernam im save album internet number smile face sunglass
4099,usernam usernam good hate wait week watch next episod loudli cri face
4100,fact usernam answer question said want collab usernam made day much
4101,usernam usernam usernam usernam usernam usernam usernam usernam usernam usernam usernam usernam usernam sell sell sell
4102,major usernam mood black heart
4103,usernam good rap music usernam usernam usernam usernam usernam usernam know other first one come mind
4104,usernam crackhead kenni
4105,usernam usernam usernam usernam usernam usernam realli see low pure bad thing pure stream matter consumpt fan love music less numberk sp first week us good
4106,realli care new rap music much love usernam much shrug emoji modifi fitzpatrick type number number zero width joiner femal sign fire
4107,usernam usernam x noth talent
4108,usernam usernam usernam usernam usernam usernam pictur
4109,usernam beat ft usernam usernam eye httpaddr
4110,usernam usernam number smh guess want sale drop like view last year usernam usernam usernam usernam httpaddr
4111,usernam usernam usernam usernam song hard fire
4112,today spin transcend work becam first outsid jazz classic genr win pulitz prize even usernam best album fire httpaddr pictur
4113,usernam usernam usernam usernam yeah love
4114,end next year want produc number top artist number kendrick number httpaddr wale kendricklamar usernam usernam
4115,e l e e n leaf flutter wind usernam topdawg time last year wreck die mani time lost peopl count truli bless say httpaddr
4116,usernam headphon dna usernam usernam revers hand middl finger extend emoji modifi fitzpatrick type number revers hand middl finger extend emoji modifi fitzpatrick type number revers hand middl finger extend emoji modifi fitzpatrick type number revers hand middl finger extend emoji modifi fitzpatrick type number hashtag hashtag httpaddr pictur
4117,radio usernam beam eighth note play usernam ft usernam wanna know w usernam usernam hashtag
4118,usernam usernam usernam usernam usernam usernam usernam
4119,look forward day usernam usernam creat album person rais hand celebr emoji modifi fitzpatrick type number person rais hand celebr emoji modifi fitzpatrick type number person rais hand celebr emoji modifi fitzpatrick type number usernam usernam usernam hashtag hashtag hashtag hashtag hashtag hashtag hashtag hashtag hashtag
4120,usernam shii smile face heart shape eye fire fire sparkl httpaddr
4121,usernam cameo hashtag top notch like pooki reborn ok hand sign emoji modifi fitzpatrick type number ok hand sign emoji modifi fitzpatrick type number ok hand sign emoji modifi fitzpatrick type number
4122,usernam pictur
4123,usernam usernam way
4124,usernam usernam dude alway look pain
4125,usernam usernam tv gold hashtag
4126,realli tri give usernam shot made less number track play list bitten lyric get play round
4127,usernam watch usernam fabul good act
4128,hey usernam number week number day rage usernam usernam usernam usernam bbi
4129,fred look like usernam face tear joy
4130,usernam usernam si armi
4131,posti usernam victori hand emoji modifi fitzpatrick type number number hashtag tokyothreetid bangxganji hashtag handshak smile face open mouth smile eye camera flash usernam hashtag katakana hiragana prolong sound mark n hashtag katakana hiragana prolong sound mark hashtag sangolai dian chang suo tokyo three tide httpaddr
4132,let talk usernam kill role power face scream fear face scream fear
4133,yo usernam part hashtag legendari
4134,usernam strnumber ju found savant g call dat usernam whole otha notha vast undiscov world planet talent damnit show us side ratchet vanguard lik beauti hashtag pictur
