,tweet
5674,usernam x usernam tape fire fire fire usernam numberfutur usernam jay z featur loudli cri face volcano
5675,usernam usernam usernam usernam usernam yeah show power last week
5676,usernam usernam usernam usernam record come kendrick need drop someth soon otherwis peopl forget real hiphop yeah dont count black panther album album
5677,hashtag hashtag w usernam usernam radio redempt usernam x usernam x usernam pictur
5678,usernam usernam usernam stoooop
5679,usernam part power hashtag kill face tear joy roll floor laugh
5680,rapper year everi year millennium featur usernam usernam usernam httpaddr
5681,usernam usernam usernam creep guy eye say decept well
5682,usernam usernam usernam usernam usernam hit dm hottest artist virginia eye talent
5683,usernam top number actor lmao
5684,usernam usernam numberc fire feel made lot adkin
5685,usernam usernam thank grin face smile eye
5686,usernam great job person fold hand emoji modifi fitzpatrick type number httpaddr
5687,hashtag usernam ft usernam wanna know hashtag hashtag hashtag
5688,hate peopl feel entitl hashtag usernam
5689,usernam
5690,get use get itlik top red charger usernam
5691,usernam usernam usernam love job kendrick made forget great job rest cast crew
5692,usernam kill role lace usernam httpaddr
5693,happi number birthday usernam hot number even eight year research still much new inform discov studi without doubt usernam citi fascin chart entri time pictur
5694,usernam usernam fact
5695,see usernam make act debut power_starz outstand even reason fan ear quiet storm design hashtag hashtaghashtag httpaddr
5696,zavtra v noch na voskresen e uezzhaem v khel sinki na festiv usernam dniom ugaraem vecherom prygaem pod usernam fire fire fire
5697,one talk usernam power scene funni af
5698,usernam power dope perform hope see hashtag hashtag hashtag smile face sunglass eye
5699,usernam usernam ntel realli fuck network sinc saturday even download favorit show loudli cri face loudli cri face loudli cri face loudli cri face
5700,usernam usernam need start season one
5701,usernam power everyth know need hashtag
5702,usernam usernam usernam usernam usernam usernam usernam usernam usernam usernam usernam forget usernam
5703,usernam usernam usernam usernam usernam usernam usernam usernam usernam usernam usernam usernam usernam usernam usernam usernam usernam usernam haha feel especi catalogu like kendrick yea understand especi lyric lot surfac level stuff
5704,man usernam dirti face tear joy hashtag hashtag
5705,usernam usernam usernam mugiwara gnabri
5706,usernam good job hashtag
5707,rapper dislik numberixnumberineoverr rapper usernam rapper usernam love usernam secretli like n afavorit rapper time usernam g usernam
5708,yo usernam sooooooooo good usernam believ good win best guest role next year period fight someon pictur
5709,usernam usernam numberc kendrick cameo awesom interest bet took line sequenc mash would make music hit
5710,imperfect beauti bless usernam
5711,usernam usernam usernam usernam hope true omari cuz want see win especi dre without angela
5712,usernam ton gard du corp est aussi balais que le mien pictur
5713,usernam usernam usernam usernam usernam bet
5714,usernam usernam usernam usernam usernam usernam numbermx usernam usernam ador
5715,usernam httpaddr
5716,usernam listen long road dvson hashtag hashtag httpaddr
5717,fckn love usernam weari face loudli cri face httpaddr
5718,usernam usernam usernam usernam usernam usernam usernam usernam usernam usernam usernam usernam go offic essenti list wait
5719,usernam usernam usernam usernam ye pictur
5720,usernam bucketlistnumb number number showermixnumb album year freestyl jcolenc number nice drake number attent fatjo feat usernam drenumb pray number theweeknd feat usernam number sicko mode trvisxx usernam usernam pictur
5721,wow usernam great actor musician
5722,usernam great power love charact funni entertain refresh thumb sign thumb sign two thumb
5723,video numberc talk usernam usernam usernam httpaddr hashtag pictur
5724,usernam usernam write noth heard live mansion rap stole usernam usernam guess shout mile davi usernam yall share bar usernam rapper copi copi copi numberchainz hashtag naw good stuff said clap hand sign emoji modifi fitzpatrick type number
5725,usernam usernam usernam definit gonna happen right mr west
5726,usernam usernam usernam usernam usernam usernam usernam usernam usernam usernam usernam usernam usernam usernam tag music industri journalist tron answer underpaid music industri usernam check bro hashtag usernam
5727,usernam love usernam beat
5728,yo usernam nail crackhead role usernam ep number roll floor laugh face tear joy
5729,heavi black heart usernam show us act upstag numberc yo jacket sh hehehe hehe hashtag
5730,hashtag favorit emce time usernam favorit emce today usernam favorit dj usernam favorit produc usernam number hip hop album bought stillmaticfavorit hip hop album time illmat favorit hip hop album today kod
5731,usernam usernam catarina
5732,usernam usernam __alexmtz__ usernam
5733,boycot usernam would easi kansan kill flakkahead usernam
5734,usernam usernam usernam usernam usernam usernam usernam usernam usernam rapper dislik usernam overr rapper usernam usernam underr rapper usernam rapper love usernam rapper secretli like usernam favorit rapper time usernam usernam g usernam quot
5735,usernam usernam usernam fire fire fire
5736,usernam numberc number cent book rememb god smile face halo smile face open mouth bless pictur
5737,usernam way find specif song got pull librari us anywher els usernam heart part iv miss realli fuck day
5738,usernam usernam ya drop year everyon els
5739,camisa oasi kkkkk vai se fuder fdp usernam httpaddr
5740,usernam usernam usernam usernam shit spent number minut look handl gave bro sorri happen ye legend
5741,dream met usernam talk immens appear power great music fuck dope
5742,usernam usernam joseph love charact soo much heavi black heart heavi black heart
5743,last night dream usernam hang ask start listen music said drop look detox fire fire cloud cloud hashtag hashtag
5744,usernam usernam usernam usernam usernam usernam usernam usernam usernam numberixvmg usernam usernam hashtag mi presentahashtag prod tauzen sirubi hashtag httpaddr hashtaghashtag si le gusta gracia por su tiempo
5745,numberc knan usernam lace get fuckn strap httpaddr
5746,usernam usernam usernam usernam usernam exactli also damn sold much track like humbl dna loyalti love peopl look day smart move kendrick
5747,usernam ou e usernam ou nem precisa falar pode ir dormi
5748,usernam usernam usernam usernam usernam noth ever without princ
5749,feat usernam usernam e melhor q existiu espero minimo mai dua musica dess number junto
5750,usernam usernam usernam usernam best
5751,usernam face look triumph person rais hand celebr emoji modifi fitzpatrick type number nasti nasti nigga face tear joy deserv grammi numberc good choic nigga rais fist emoji modifi fitzpatrick type number actor role one could play role better
5752,usernam hashtag epic btw hilari face tear joy face tear joy
5753,kendrick add act list thing great face tear joy ok hand sign emoji modifi fitzpatrick type number clap hand sign emoji modifi fitzpatrick type number usernam httpaddr
5754,greatest usernam usernam w usernam hashtag man zero width joiner microphon
5755,usernam por que tao perfeito aaaaa number voce tem tido uma influencia tao grand quanto usernam de um outro ponto de vista como se fossem dua grand forca culturai
5756,think hard shit blow mind hashtag hashtag hashtag hashtag numberc usernam hashtag pictur
5757,usernam usernam usernam clap hand sign emoji modifi fitzpatrick type number
5758,usernam usernam usernam usernam usernam usernam usernam usernam usernam usernam usernam sign prome quick play team pleas
5759,usernam usernam money treesalrightswim poolsdnam citi
5760,power hashtag usernam find purpos writer challeng report race america backstori behind histor decis award usernam pulitz httpaddr
5761,usernam usernam awesom clap hand sign emoji modifi fitzpatrick type number
5762,usernam usernam get enough song batteri music note speaker three sound wave ok hand sign victori hand usernam usernam pictur
5763,usernam
5764,usernam best thing tv hashtag
5765,usernam usernam usernam usernam numberc usernam usernam awesom guest star
5766,usernam put great show good perform man thought provok line
5767,usernam usernam loyalti
5768,clap hand sign clap hand sign go boy ctfu watch power face tear joy face tear joy face tear joy know someon like hood congrat usernam httpaddr
5769,usernam usernam usernam usernam
5770,usernam usernam usernam alon brother happi person rais one hand emoji modifi fitzpatrick type number zero width joiner male sign happi person rais one hand emoji modifi fitzpatrick type number zero width joiner male sign
5771,usernam rip person rais hand celebr emoji modifi fitzpatrick type number person rais hand celebr emoji modifi fitzpatrick type number person rais hand celebr emoji modifi fitzpatrick type number person rais hand celebr emoji modifi fitzpatrick type number kdot presid
5772,kendricklamar awesom job debut hashtag hashtag
5773,recap week episod usernam usernam fire fire fire hashtag power episod recap k dot convinc crackhead unholi allianc tariq say chest ghost need help bso httpaddr pictur
5774,au fait merci pour damn usernam
5775,goal biggest best rap artist goal make dope music collab favorit artist like usernam usernam usernam usernam usernam usernam usernam usernam usernam usernam usernam usernam usernam
5776,usernam kendricklamar album good kid citi offici billboard number chart number week make hip hop artist usernam achiev feat httpaddr
5777,usernam usernam lol thank
5778,usernam usernam usernam
5779,lol usernam great job power face tear joy face tear joy thought much man httpaddr
5780,usernam usernam ok hand sign emoji modifi fitzpatrick type number hashtag
5781,husband power like babi usernam pensiv face
5782,usernam pleas drop album year drake get grammi
5783,usernam fire act
5784,say bro wait anoth year usernam
5785,usernam yo come nigeria yo gat huge fan bro
5786,hashtag hashtag usernam hashtag hashtag hashtag hashtag hashtag hashtag hashtag hashtag hashtag httpaddr
5787,rapper favourit hashtag hashtag usernam usernam hashtag usernam usernam hashtag hashtag
5788,ayyyy usernam phenomen hashtag
5789,se voce foss largado numa ilha deserta quem levaria junto man woman hold hand maconha e usernam httpaddr
5790,usernam usernam usernam usernam usernam hope work someth one day song eminem good think kendrick collab world hashtag
5791,top number like drop dope project everydaystrugg usernam usernam usernam usernam number usernam usernam number usernam number usernam number usernam number numberfutur number usernam number usernam number usernam meek cardi logic hashtag
5792,usernam look magic
5793,cool time usernam get beat httpaddr
5794,usernam usernam drop collab album pussi httpaddr
5795,usernam kill role hashtag last night fire rais fist emoji modifi fitzpatrick type number
5796,usernam usernam credit song common misconcept look blond offici credit
5797,nice one usernam httpaddr
5798,three year later still believ one greatest song ever record usernam usernam httpaddr hashtag
5799,met plug work live two block away honestli sinc move real urg smoke say someth realli becom product environ listen art peer pressur usernam
5800,dope remind usernam key usernam httpaddr
5801,hashtag usernam number number hashtag usernam hashtag featur usernam produc usernam usernam fire hashtag pictur
5802,usernam usernam numberc usernam usernam usernam usernam usernam usernam usernam usernam usernam usernam usernam
5803,need anoth collabor usernam fire collabor usernam usernam better new singl lol ye usernam kill role usernam httpaddr
5804,usernam numberc sure brilliant hashtag hashtag
5805,usernam hashtag usernam complet geniu wait see relationship develop hashtag hashtag
5806,love usernam httpaddr
5807,usernam usernam httpaddr httpaddr
5808,show album usernam person fold hand emoji modifi fitzpatrick type number httpaddr
5809,ngl like usernam power think face
5810,usernam usernam usernam intellectu junki oh yeah thst definit norm
5811,usernam haai kendrick lamar men ask one question onest leng father numberpac pictur
5812,knew gonna big ya dig xget strap hashtag usernam usernam pictur
5813,power man whole lot go kendricklamar brotha need act g
5814,usernam god rap bro skull skull syring dash symbol
5815,usernam phenomen job k l boogi killa lyric ktodamuhfuckinl smile face sunglass
5816,usernam hurri bro
5817,usernam pleas usernam
5818,usernam usernam usernam usernam black friday fire fire fire give us album person fold hand
5819,usernam usernam usernam httpaddr
5820,usernam never heard usernam guess sad day son get tf outta russ shit
5821,usernam amaz actor man scene usernam best seen show love show wonder wrote line perfect ha nasti nasti nigga heheh lmao
5822,usernam usernam usernam usernam person rais hand celebr eye
5823,yo think usernam usernam usernam usernam usernam usernam usernam usernam usernam usernam usernam smoke tour number
5824,damn usernam soooo fuck good hashtag
5825,dream best mate usernam hook usernam life
5826,still wait joint album usernam usernam httpaddr
5827,ya think usernam usernam last night grin face hashtag usernam hashtag hashtag
5828,usernam usernam forget bi h kill vibe
5829,woahkay woahkay cue usernam walk song httpaddr
5830,til usernam birthday
5831,usernam love much cri face
5832,best epsisod season face tear joy face tear joy face tear joy usernam usernam
5833,usernam usernam hashtag shout favorit
5834,usernam usernam episod awesom kendrick seem like act year brilliant
5835,usernam kill
5836,usernam usernam usernam usernam usernam usernam love smile cat face heart shape eye smile cat face heart shape eye smile cat face heart shape eye
5837,usernam usernam talent
5838,usernam new episod power brillient face tear joy face tear joy
5839,usernam usernam usernam agre track youtub lyric breakdown dope af
5840,usernam usernam great work kendrick
5841,real usernam usernam make collabor album
5842,saw follow usernam twitterproof pretti cool
5843,love lace usernam httpaddr
5844,usernam usernam usernam usernam ye smile face heart shape eye pictur
5845,usernam usernam usernam usernam usernam usernam usernam usernam usernam usernam pictur
5846,cowork meet usernam greatest day life dude son pictur
5847,usernam kung fu kenni beat liu kang usernam might need talk drizzi
5848,usernam usernam kill role
5849,usernam said comfort usernam driveway sit humbl felt usernam hashtag
5850,usernam usernam usernam usernam usernam usernam hashtag tblandinier
5851,usernam usernam usernam usernam usernam usernam love beat goddamn
5852,top number number usernam number usernam number usernam number usernam number usernam
5853,usernam usernam usernam usernam
5854,usernam aye get kung fu kenni last name cortez
5855,usernam usernam httpaddr
5856,usernam repost usernam via usernam kendricklamar speak truth also reason usernam drake best hashtag hashtag hashtag hashtag hashtag hashtag hashtag hashtag hashtag hashtag hashtag hashtag hashtag hashtag hashtag hashtag hashtag hashtag hashtag pictur
5857,need new fire ass song usernam
5858,perform hashtag usernam person rais hand celebr emoji modifi fitzpatrick type number
5859,usernam usernam usernam inspir
5860,usernam usernam usernam usernam usernam usernam usernam usernam usernam get usernam usernam hashtag hashtag crown pure fire fire fire fire fire fire fire hashtag httpaddr
5861,usernam last episod power though face tear joy heavi black heart
5862,usernam money would usernam usernam usernam pictur
5863,cannot take usernam serious crackhead usernam face tear joy
5864,word usernam roll stone interview pictur
5865,usernam usernam usernam usernam usernam usernam usernam usernam usernam usernam usernam usernam usernam usernam httpaddr greas summer night hd number
5866,usernam kill power last night thought hard face tear joy face tear joy face tear joy numberc make good team flex bicep
5867,usernam usernam number numberc last minut chang script
5868,power got damn lost face palm emoji modifi fitzpatrick type number zero width joiner femal sign shoutout usernam number killin part fire hundr point symbol
5869,kin crase wey usernam chop e act last usernam episod sabi market dem dey sell naija hashtag hashtag hashtag
5870,httpaddr king dead king usernam pictur
5871,want kanan lace spin hashtag numberc usernam
5872,usernam usernam messag mike hashtag
5873,usernam numberc usernam numberpm usernam much feel sad charact show next week would rather watch someth charact cheer see appeal
5874,usernam amaz usernam person rais hand celebr emoji modifi fitzpatrick type number fire fire
5875,biggest usernam usernam fan known man inform desk person
5876,usernam jay drop album httpaddr
5877,usernam usernam great job kendrick didnt even know
5878,rapper dislik gonna group trapper aint tryna wast time usernam rapper usernam underr rapper usernam like usernam secretli like areecefavorit rapper time usernam usernam
5879,usernam httpaddr made whole episod last night hashtag man weari face loudli cri face roll floor laugh
5880,hashtag xxx feat unumb usernam hashtag httpaddr pictur
5881,power still weak shit week exclud usernam best
5882,tri organis sort draw realli sure shrug emoji modifi fitzpatrick type number zero width joiner femal sign usernam usernam usernam usernam pictur
5883,usernam tryin get hashtag cheapest way possibl see usernam usernam usernam usernam hit link bcoopradionumb hashtag hashtag hashtag httpaddr
5884,everybodi gon respect mnangagwa vendor front gun live forev usernam usernam
5885,usernam given ghost tasha tommi dre riq much stress expect usernam charact lace figment kanan imagin due respons felt raina death hashtag hashtag
5886,usernam upsid face upsid face usernam usernam usernam usernam
5887,concentr work today know new ep usernam wait lol must say usernam simpli brilliant brilliant person fold hand person fold hand person fold hand
5888,damm usernam respond httpaddr
5889,usernam usernam awesom shouldwork usernam sure scene fire hashtag
5890,usernam usernam ador crackhead good job sparkl
5891,usernam danggggggg hella realiz hashtag
5892,usernam usernam usernam usernam usernam usernam usernam knock imagin dragon newer stuff realli sound like rock
5893,usernam dude cannot believ phenomen perform truli geniu
5894,usernam fuck solid usernam dope person rais hand celebr emoji modifi fitzpatrick type number clap hand sign emoji modifi fitzpatrick type number
5895,usernam usernam ye love tommi alway fave two heart two heart
5896,artist never fuck usernam usernam usernam usernam usernam
5897,usernam dope ass crackhead usernam pretti wise
5898,meu deu todo deveriam assistir seri usernam e serio depoi dess episodio nao tem como vou escrev um httpaddr e por conta da participacao usernam nao juro mesmo sendo httpaddr puta que pariu
5899,need usernam everi episod power
5900,usernam usernam usernam usernam aftermath get last laugh
5901,usernam usernam usernam forreal
5902,gonna get usernam usernam collab album want usernam usernam collab album face look triumph face look triumph
5903,day number year ago kendricklamar damn tour pictur
5904,courtneykemp sat usernam discuss brought hashtag connect charact lace watch full interview httpaddr pictur power usernam juli number number lamar httpaddr
5905,usernam
5906,usernam usernam watch mike mr nice guy riley usernam pass usernam ticket embarrass number number season hashtag hashtag hashtag hashtag
5907,usernam great perform power episod
5908,watch power usernam kill hilari spanish accent perfect
5909,fuck anyon f usernam numberc jheeez usernam jheez angi ghost hashtag fuck riq staff label motherfuckin crew
5910,hashtag usernam usernam godfath hashtag hashtag usernam channelnumb
5911,usernam usernam usernam usernam usernam httpaddr
5912,get usernam hype first get
5913,usernam usernam puddin tain
5914,flex swole like aha yeahyou feel type way aha yeahev sinc young manal want gunmanshoot chart better run manya gotta see manhashtag kendricklamar love song
5915,usernam usernam remind young snoop dogg
5916,numberc usernam join power best seri world gener gener valu pictur
5917,usernam heavi black heart u
5918,usernam numberc ye hope see return
5919,honestli think usernam underr come number collabor hip hop artist like work usernam usernam n even numberfutur earli work usernam terribl either top tier
5920,airplan make nois park swear sound exactli like begin humbl usernam
5921,greatest rapper time usernam
5922,usernam usernam usernam usernam usernam usernam usernam
5923,final watch usernam hashtag episod pretti good kendrick act skill
5924,realli thought convo clever brilliant wink face ok hand sign waverli grief give rise much confess doc shakespear waverli kendrick lamar smile face open mouth cold sweat smile face open mouth cold sweat smile face open mouth cold sweat smile face open mouth cold sweat smile face open mouth cold sweat usernam usernam usernam usernam usernam usernam smile face open mouth smile eye hashtag pictur
5925,hashtag usernam much dollar cost usernam usernam usernam usernam usernam
5926,usernam usernam usernam usernam usernam usernam ok dawg
5927,usernam pl come feet hurt ignor boo er loser rieanna compton xxxx
5928,usernam usernam vai
5929,hashtag trend around world earth globe america usernam
5930,k talk usernam perform usernam week incred act part
5931,usernam get moment check hashtag hashtag usernam pictur
5932,usernam usernam usernam numberc remain show got scare k pull gun
5933,one messiah one king one god name usernam thank gift life pictur
5934,usernam usernam kkk ama wado neodo mosgago nado mosgaldeu
5935,new def jam game pleas let fight usernam usernam httpaddr
5936,thank hashtag invit us speak connect music mental health microphon headphon includ usernam usernam usernam usernam usernam hashtag pictur
5937,number emmi outstand guest actor drama seri goe usernam usernam season number episod number awesom awesom awesom white medium star pictur
5938,usernam number number number number five greatest rapper aliv
5939,saw kendrick power usernam usernam hashtag pictur
5940,numberc kendrick lamarkendrick lamar usernam next superstar join numberc super thrill seri httpaddr kendrick lamar thriller offici facebook httpaddr
5941,beam eighth note hashtag untitl number number number usernam hashtag httpaddr
5942,damn collis symbol usernam legend hashtag usernam hashtag hashtag hashtag kiss mark kiss mark kiss mark oyafestivalen httpaddr
5943,hahaha usernam kill power snumber episod number person rais hand celebr emoji modifi fitzpatrick type number person rais hand celebr emoji modifi fitzpatrick type number person rais hand celebr emoji modifi fitzpatrick type number person rais hand celebr emoji modifi fitzpatrick type number
5944,make sure got everybodi usernam usernam usernam usernam usernam usernam usernam usernam usernam hashtag
5945,usernam usernam usernam would fuck great song
5946,best dope fiend ever great job usernam numberc usernam usernam
5947,usernam black heart suit hundr point symbol
5948,usernam usernam usernam new freezer
5949,usernam usernam usernam usernam usernam
5950,wonder usernam would like exchang usernam think face httpaddr
5951,usernam kill spanish power face tear joy flakahead
5952,time last year saw usernam rememb awe much love receiv crowd like never seen
5953,usernam usernam watch actual dope good actor
5954,usernam kill role wow wow wow psnumberenumb replay
5955,usernam kenni oscar
5956,usernam usernam collect call
5957,usernam amaz fire hundr point symbol
5958,usernam usernam usernam best rapper world
5959,album still rotat usernam rais fist emoji modifi fitzpatrick type number pictur
5960,usernam said numberc last episod usernam pictur
5961,good kid cole world album black hippi album usernam
5962,congratul usernam anoth mileston career releas debut album good kid citi usernam report remain chart number consecut week pictur
5963,offici goat usernam pulitz rappingx like wtf break door pictur
5964,usernam usernam usernam mariachi tikal de lo bueno lo mejor whatsapp number number number number la oferta hoy dentro fuera de la capit de guatemala llameno ya dese el lujo escuchando musica de ayer hoy precio economico para ust la number hora pictur
5965,usernam httpaddr
5966,usernam x usernam next pl ear eye httpaddr
5967,usernam amaz job power clap hand sign
5968,usernam usernam ear emoji modifi fitzpatrick type number fella got mad skill voic
5969,come hour usernam cover usernam appear usernam plu rest hashtag shay shay listen live usernam usernam hashtag httpaddr
5970,usernam made dopest statement play crackhead usernam truli show devot craft
5971,usernam usernam usernam legend person rais hand celebr emoji modifi fitzpatrick type number number
5972,usernam usernam usernam usernam httpaddr
5973,usernam usernam napulot lang pap hehe
5974,btw usernam im still wait collab album w usernam
5975,usernam usernam usernam trust
5976,kendrick lamar httpaddr usernam pictur
5977,readi see usernam usernam parti popper
5978,usernam numberc usernam usernam lol
5979,usernam chief kendrick
5980,usernam man perform ripe hope see project
5981,hashtag star usernam ft usernam hashtag hashtag hashtag hashtag
5982,babi lookin like shaquil sunflow smile face heart shape eye smile face heart shape eye would still take n nurs lil junki ass back saniti face tear joy smile face open mouth cold sweat usernam pictur
5983,usernam usernam one day
5984,usernam usernam usernam act thirsti
5985,usernam said beat yo ass beat yo ass twice still hereseven year old think run hous nigga gon fear fear one els felt
5986,kung fu kenni usernam httpaddr
5987,usernam usernam hashtag voti
5988,usernam usernam usernam usernam alway say realli wanna someth make time top dawg tde final came black hippi album wanna collab album cole kendrick
