,tweet
0,usernam pride gonna get kill usernam
1,hashtag usernam usernam smile face sunglass dancer man danc radio headphon bad blood usernam usernam httpaddr hashtag
2,play rnb wed radio love feat zacari usernam listen onlin httpaddr pictur
3,usernam usernam usernam male mildli annoy femal use emoji
4,usernam wait usernam usernam collab usernam usernam collab like pictur
5,usernam usernam usernam usernam usernam usernam usernam usernam usernam usernam usernam
6,usernam usernam usernam usernam came httpaddr
7,usernam httpaddr
8,usernam see next week boy usernam
9,usernam act amaz pictur
10,usernam usernam usernam httpaddr
11,usernam usernam loyalti rihanna impact
12,usernam usernam usernam ok drake take care sinc number
13,day hashtag remix usernam crazi httpaddr
14,usernam headphon love ft zacari usernam usernam httpaddr pictur
15,usernam nasti nasti n line kill face tear joy face tear joy face tear joy nice one kendrick hope see hashtag fam
16,usernam usernam konohamaru sarutobi one favorit naruto charact fire hundr point symbol origin upload date apr number number song king dead usernam usernam numberfutur httpaddr
17,still wait joint album drop ahem usernam usernam inform desk person emoji modifi fitzpatrick type number zero width joiner femal sign pictur
18,usernam usernam usernam usernam sza best new artist
19,usernam usernam usernam somewhat appropo
20,usernam play role nice
21,usernam act hashtag fire fire fire
22,usernam usernam usernam classic debat
23,usernam usernam usernam mean drake done right usernam west coast win
24,hand usernam emmi alreadi
25,usernam real g goat leav tear act power loudli cri face
26,usernam usernam damn right ok hand sign emoji modifi fitzpatrick type number pictur
27,usernam ft usernam autumn leav song calm
28,pt number hear whole album usernam usernam usernam usernam
29,usernam realli thing usernam
30,never met anyon usernam list httpaddr
31,usernam usernam seen uncl k act
32,usernam lace clap hand sign emoji modifi fitzpatrick type number clap hand sign emoji modifi fitzpatrick type number clap hand sign emoji modifi fitzpatrick type number usernam numberc power_starzhashtag hashtag pictur
33,anyon notic usernam crack head last week hashtag episod
34,usernam said think think face hard shit gon blow ya mind felt hashtag word joiner word joiner
35,yo go glenn coco usernam ps gang member tourist lmaoooooo usernam kendricklamar pictur mall number
36,usernam usernam name
37,usernam usernam usernam usernam tour u go continu black friday usernam
38,usernam put air caus worth thumb sign thumb sign
39,usernam vote almost everi day usernam deserv accolad usernam last year usernam number number camil
40,top number albun pop de number ate momento na minha humild opiniao number isol usernam number invas privaci usernam number dirti comput usernam camila usernam number black panther album usernam usernam usernam usernam etc
41,usernam usernam numberc need learn use strap
42,usernam mani rt come eat dinner famili home
43,ceo usernam walk stage usernam dna goat
44,watch power see scene usernam lol face tear joy
45,need stop tri god remix usernam somebodi make happen
46,usernam tire face pictur
47,ceo introduc mother face throw kiss bring usernam quot usernam lunch person rais hand celebr hashtag pictur
48,usernam usernam pictur
49,woman woman love creation came god confirm usernam
50,grow golden age hip hop lovinnnn blue heart usernam kod shit usernam httpaddr bring dual album king crown usernam httpaddr
51,realli wanna hear usernam stop tryna god usernam
52,usernam crush latest episod usernam httpaddr
53,wow usernam truli never releas bad project
54,also gone alright kendricklamar pictur
55,usernam inspir shirt one popular hashtag httpaddr
56,usernam usernam usernam usernam usernam definit usernam slightli smile face
57,usernam piec usernam wrote session host usernam int l usernam elton john usernam chastis jay z usernam usernam frank ocean noth fight hiv lgbtqia relat stigma x httpaddr
58,usernam usernam usernam usernam bad dude gener
59,usernam pictur
60,usernam kill part power_starz clap hand sign clap hand sign clap hand sign httpaddr
61,usernam usernam usernam usernam king
62,love de usernam es el puto paraiso
63,usernam number number doubl heavi black heart ok hand sign trick everi time roll floor laugh roll floor laugh listen usernam swim pool extend version drink everi time say drink either one great
64,usernam usernam usernam right care gentrif happen new resid would want gone
65,usernam numberc usernam kanan
66,usernam charact power help pass nurs exam mental health person rais hand celebr emoji modifi fitzpatrick type number
67,yall see usernam power bro thing
68,usernam usernam si lol wtf
69,usernam k dot got flame wait fire fire pictur
70,usernam pictur
71,usernam usernam usernam usernam usernam usernam usernam usernam usernam usernam usernam damn fire fire fire fire fire ok hand sign ok hand sign water wave water wave water wave
72,usernam guy keep usernam rest show
73,mean end usernam scene hashtag nigga nigga nigga face palm zero width joiner femal sign
74,numberfutur ft usernam mask remix httpaddr pictur
75,album genr spent longest usernam top number number hip hop usernam damn number week pop usernam divid number r b usernam numberk magic number rock usernam evolv number countri usernam room number httpaddr pictur
76,usernam usernam usernam know
77,hashtag usernam kendrick lamar made act debut week episod power_starz fire person rais hand celebr emoji modifi fitzpatrick type number movi camera hashtag numberc httpaddr
78,usernam think signal link real quick usernam give peopl fire close summer
79,oii usernam act power sick look like propa nitti
80,usernam usernam sure good play crackhead face tear joy
81,world celebr white spade suit u earth globe america cloud usernam pictur
82,astroworld come need album usernam content rest year notic
83,usernam usernam wow
84,usernam face tear joy face tear joy ok hand sign hashtag
85,usernam forev consciou face tear joy flex bicep emoji modifi fitzpatrick type number rais fist emoji modifi fitzpatrick type number usernam episod number
86,gon alright usernam hashtag hashtag hashtag pictur
87,portrait usernam drew blue pen crown pictur
88,thing imagin actual happen real life situat artifici think face kendricklamar
89,usernam usernam basketbal hoop sparkl heart mouth eye
90,usernam e usernam qual dess e aposta para usernam number usernam twentyonepilot flo_tweet tylerthecr postmalon kendricklamar trvisxx dualipa troyesivan hayleykiyoko bornsmus panicatthedisco billieeilish thewombat izarealhashtag
91,come usernam plenti polit hip hop plenti real qua real check usernam usernam listen usernam usernam usernam usernam
92,usernam usernam usernam usernam usernam na tracklist post
93,usernam much dollar realli cost
94,usernam usernam usernam usernam found next user follow weari face face tear joy open book person fold hand latin cross latin cross
95,usernam usernam usernam usernam usernam usernam lil sky goat
96,usernam numberc ye
97,usernam usernam usernam usernam ye one best
98,usernam usernam usernam hashtag
99,usernam usernam go stop play drop album togeth
100,took spanish could learn usernam say collard green
101,funniest look usernam nigga legit weirdo face tear joy pictur
102,usernam numberc power flex bicep
103,usernam usernam well fav usernam soooo
104,point thought usernam kanaan numberc accomplic happen murder weapon arrest crime hashtag kill big up hashtaghashtag pictur
105,usernam usernam usernam agre care anybodi say pooki gator best crackhead lace came along
106,heard usernam hashtag might start watch
107,usernam realli becam charact look eye k gonna shoot oscar ur futur cultur
108,usernam usernam usernam usernam usernam usernam usernam usernam usernam usernam usernam numberlack numberchainz name seriou vibe
109,camera ignor usernam perform power charact brilliant hashtag httpaddr
110,dead negro associ usernam httpaddr
111,serious need collabor album usernam usernam heavi black heart cri face loudli cri face loudli cri face loudli cri face
112,usernam power ok hand sign emoji modifi fitzpatrick type number
113,usernam usernam everyth face tear joy face tear joy face tear joy
114,respect usernam great job usernam
115,usernam numberc hea mea
116,usernam releas new music plz
117,usernam usernam usernam usernam usernam usernam usernam usernam usernam usernam numberavag usernam usernam usernam usernam usernam httpaddr
118,usernam usernam usernam omg jel
119,omg usernam usernam everyth
120,got time wast time gotta make time usernam
121,usernam seen power bro need lace ep asap
122,usernam usernam usernam kendrick kill role
123,usernam usernam usernam mark sponsor post clearli ad follow kendrick follow starz mark ad ad law
124,usernam u done good boy u know u know hashtag
125,usernam drop album pl
126,usernam usernam usernam usernam usernam usernam hashtag usernam
127,today spoke usernam debat queen park work inspir may inspir other courag hold stori strength resist fear passion integr respect video come soon purpl heart parti popper purpl heart
128,usernam usernam usernam fave alway got giant step
129,usernam pleas make lace seri regular usernam dope bodi charact
130,usernam joke pretti good actor
131,speaker three sound wave mani drink remix hashtag region indic symbol letter u region indic symbol letter american singer usernam usernam throwbackgreat intern record hashtag lunch tyme show region indic symbol letter g region indic symbol letter h httpaddr
132,usernam check hashtag hashtag right usernam groovyq usernam n usernam usernam hashtag hashtag hashtag hashtag hashtag httpaddr
133,one first song lol logicnumb numberixvmg usernam usernam usernam usernam usernam usernam usernam usernam usernam hashtag hashtag hashtag hashtag hashtag pictur
134,usernam usernam usernam usernam usernam check number letter usernam
135,usernam usernam saw commerci thought would never actual touch power degre plot n context figur
136,usernam usernam kendrick lamar awesom job
137,kendrick lamar rapper prove rise star number cent power fist hand sign usernam numbercenthashtag hashtag hashtag hashtag hashtag hashtag hashtag hashtag hashtag hashtag hashtag hashtag hashtag hashtag pictur
138,usernam hashtag hashtag hashtag hashtag star usernam ft usernam hashtag w shinebegho hashtag
139,usernam damn loudli cri face face tear joy face tear joy face tear joy face tear joy face tear joy httpaddr
140,usernam power face tear joy face tear joy
141,hashtag ok usernam final listen music great act
142,got done watch last night episod usernam alway fire fire fire usernam debut extra fire fire fire fire
143,new jame bond gon black meblack brown hazelnut cinnamon black teaand beauti usernam usernam usernam httpaddr
144,usernam usernam yeah pretti tough
145,usernam play tf charact power hashtag face tear joy face tear joy face tear joy face tear joy
146,got real kill shit caus dna usernam
147,usernam usernam numberronaldinho usernam usernam usernam usernam usernam
148,usernam smash stage hashtag hashtag still kill game even act hashtag power_starz hashtag hashtag hashtag hashtag hashtag hashtag hashtag httpaddr
149,usernam superb power hope charact stick around awhil
150,someon make anoth film la gang get usernam usernam music creativ direct get gift kid school area help film make authent gritti person fold hand emoji modifi fitzpatrick type number
151,usernam usernam numberc solid cameo
152,kendricklamar perform dna humbl number httpaddr
153,usernam hella funni power face tear joy face tear joy
154,usernam usernam usernam usernam httpaddr
155,usernam usernam usernam kendrick awesom episod talent brother thumb sign emoji modifi fitzpatrick type number
156,usernam numberc nasti lol funni episod hashtag
157,usernam smoother click full imag twitter crop white space forc eye uncomfort way pictur
158,yuuuuuuuurrrrr usernam need help ticket weari face weari face weari face pictur
159,easi bake still one hardest song ever creat usernam usernam usernam undef
160,usernam usernam gone make album togeth need street
161,usernam usernam usernam real right sleep usernam usernam httpaddr
162,usernam usernam usernam album incred bravo mr lamar
163,usernam httpaddr
164,usernam hope see power
165,usernam kill role power_starz hashtag done michaelperryart sanctuarytattoogalleri tattoo artist sign free httpaddr today hashtag hashtag httpaddr
166,think need appreci usernam crew damn clean version mani edit rewrit appreci
167,usernam usernam usernam fasho snatch torch
168,hashtag tryna tell u yall better keep usernam loop
169,usernam name
170,usernam usernam finess racial slur counterfeit yeah white hell
171,lol okay usernam see play usernam swimmingpool background music number number
172,usernam usernam pulitz winner
173,acho que part mai interessant da discografia usernam e que podemo relacionar de perto tpab com quinca borba machado de assi
174,usernam usernam start send file get collab tape world realli wait hashtag hashtag lol httpaddr
175,number usernam kendricklamar youngthug trvisxx gherbo playboicarti numbergunnagunna
176,usernam usernam usernam usernam usernam usernam usernam usernam usernam colekendrick
177,usernam usernam bage
178,thought bou hard man usernam httpaddr
179,usernam current usernam usernam use usernam heart melt
180,usernam headphon humbl usernam usernam song day httpaddr pictur
181,usernam usernam usernam spike ya self esteem new jame bond gon black rapsodi complexion w usernam fire
182,usernam great person rais hand celebr emoji modifi fitzpatrick type number person rais hand celebr emoji modifi fitzpatrick type number person rais hand celebr emoji modifi fitzpatrick type number
183,usernam usernam usernam usernam usernam pictur
184,peak know everi word money tree usernam
185,usernam usernam awesom memori thank guy pictur
186,ever see usernam first thing say nigga nigga nigga face tear joy face tear joy line forev stuck face love hashtag usernam numberc
187,usernam usernam usernam know usernam hiii power usernam produc shit
188,usernam congratul turn entir african american popul us usernam said donald trump chump know feel punk
189,usernam usernam usernam usernam number track number skit issa classic shrug zero width joiner male sign
190,usernam usernam usernam usernam usernam sok kidesu pictur
191,left stroke went viral usernam usernam hashtag pictur
192,usernam usernam still ya album naaaah extra song target edit need answer lol hashtag
193,usernam wonder someth gonna come shoe gun stay
194,usernam usernam usernam usernam
195,love see usernam hashtag fire fire fire
196,highest perform monet talent usernam usernam usernam usernam usernam usernam incred forward think team dedic attorney person manag busi manag account tour manag
197,nasti nasti nigga usernam voic
198,usernam listen chop n skrew instrumentalr nigga nigga nigga nigga usernam voic synth chord progress fuck fire fire fire fire fire fire fire lil fire fire fire babi lmao naw shit banana g hashtag product
199,usernam play role good
200,usernam hashtag loudli cri face loudli cri face loudli cri face loudli cri face
201,usernam clap hand sign emoji modifi fitzpatrick type number usernam amaz forgot realli mark good perform hashtag
202,man usernam amaz usernam last night
203,kendrick best album pimp butterfli usernam
204,usernam usernam usernam come usernam tree
205,best rapper next usernam usernam cole usernam httpaddr
206,safe say oslo big kung fu kenni fan fire usernam usernam pictur
207,usernam usernam wait see
208,usernam usernam usernam usernam usernam usernam need go check finish product caus fire fr
209,usernam usernam usernam face tear joy slick
210,usernam usernam love hope see ya
211,usernam usernam usernam usernam wildddd
212,usernam gold usernam
213,usernam skwattacyph rikyrickworld stay shiningth weekend x usernam pray black panther soundtrack usernam backtdk macassett domoroza go number number usernam coffe pictur
214,usernam perform usernam simpli amaz
215,usernam numberc usernam usernam ikr jess
216,usernam win rave usernam appear httpaddr share googl feed
217,usernam usernam bang stevi
218,kendricklamar need call home like batman summon bat back cave httpaddr
219,usernam good lad kendrick
220,usernam act new episod hashtag swear could would say everyth said given day
221,usernam usernam usernam usernam usernam usernam usernam usernam usernam usernam usernam lol
222,soo anybodi els see usernam kill crackhead perform last night think face fire fire ok hand sign emoji modifi fitzpatrick type number hashtag
223,usernam usernam see pastor give promisewhat today raptur complet tarnishedth truth set free complet honesty die thirstyou die thirstso hop water pray work
224,usernam usernam usernam goat goat
225,usernam dead pre prd usernam offici version listen like comment retweet hashtag hashtag usernam usernam usernam usernam usernam usernam usernam usernam usernam usernam usernam usernam usernam usernam press play fire fire fire fire pictur
226,httpaddr usernam cosign real sleep usernam hit link bio support white point index white point index white point index white point index white point index white point index hashtag hashtag hashtag hashtag httpaddr
227,usernam lace
228,usernam usernam man power
229,usernam hashtag hashtag def need pop cameo along side hashtag httpaddr
230,que privilegio ver usernam en vivo lym
231,httpaddr usernam give us chanc bro
232,best rapper right number kendricklamar number jcolenc number drake
233,usernam rather live like god die find realli think hashtag
234,power came two day ago still get well usernam play lace
235,usernam usernam sen patlat bisey de kims yarisamasin
236,usernam usernam play role everi inner citi kid relat love show drop everyth sunday wife addict plot turn charact suspens keep us glu tv even watch twice night miss noth
237,usernam usernam usernam usernam usernam usernam usernam usernam usernam usernam usernam sold spare
238,usernam usernam numberc write k dot script futur nah eye perform last week episod deserv
239,predict album bigger banger usernam next album need kendrick
240,usernam fwiw think drake earlier album much better recent one recent stuff good hit lot skippabl song earlier work could listen without httpaddr tough keep put qualiti stuff usernam master
241,usernam httpaddr rt
242,usernam usernam usernam usernam premonit
243,get god phone usernam
244,atualizei meu nome para contemplar outro elemento da minha ascendencia real usernam e lebron usernam bicho ja tem rei na e rei memo
245,usernam absolut kill hashtag ok hand sign emoji modifi fitzpatrick type number fist hand sign emoji modifi fitzpatrick type number fire
246,offend feel sorri feel sorri usernam loss worth win usernam
247,usernam usernam mad man hilari nasti lol
248,usernam hashtag hashtag hashtag hashtag sziget festiv offici httpaddr
249,fuck love kendrick face tear joy face tear joy heavi black heart usernam hashtag
250,im savag im asshol im kinghashtag usernam
251,usernam ok hand sign
252,love everi genr hip hop opera shrug emoji modifi fitzpatrick type number zero width joiner male sign number favorit usernam usernam usernam eye eye judg smirk face httpaddr
253,usernam usernam numberc proud hard work curti proud hun
254,usernam usernam pure platinum essenci
255,usernam usernam usernam usernam usernam usernam kill vibe usernam usernam usernam usernam usernam usernam usernam httpaddr httpaddr
256,usernam numberc hey guy love u watch power west africa
257,god bless usernam real goat person fold hand emoji modifi fitzpatrick type number number fire princ emoji modifi fitzpatrick type number number goat thank kendrick lamar music love sinc number realli know thank throw hard music touch one feel music best keep listen fire
258,usernam usernam usernam usernam realiz wait see finish product saw phenomen fire fire fire
259,usernam wait usernam hashtag
260,usernam love
261,usernam usernam usernam usernam usernam queen
262,usernam love usernam hashtag httpaddr
263,usernam usernam usernam usernam hashtag
264,ye ye ye take year get right especi master craft l nearli usernam level hashtaghashtaghashtaghashtaghashtag httpaddr
265,usernam usernam usernam appreci love heavi black heart person fold hand emoji modifi fitzpatrick type number
266,head hashtag usernam usernam
267,usernam pictur
268,usernam fuckinamaz hashtag httpaddr
269,usernam usernam usernam usernam usernam usernam live somewher peopl type
270,usernam way number old number b fan n ova k l social correct help n fan n ova lace hashtag n
271,thought straight fire bring usernam king kendrick httpaddr
272,pick usernam usernam call em tri shit want one httpaddr
273,usernam usernam epic clap hand sign emoji modifi fitzpatrick type number clap hand sign emoji modifi fitzpatrick type number clap hand sign emoji modifi fitzpatrick type number
274,usernam numberc would say stereotyp want play guy good job question
275,usernam usernam prolli got hella beat track could slide
276,usernam usernam kendrick drop soundtrack movi could easili album
277,usernam mute kid hole usernam
278,usernam usernam humbl fire fire one day mayb skrillex notic face tear joy love sinc number red rock hope see bot fan girl harddd lol usernam usernam usernam pictur
279,usernam numberc well done incorpor knowledg rais fist emoji modifi fitzpatrick type number rais fist emoji modifi fitzpatrick type number rais fist emoji modifi fitzpatrick type number httpaddr
280,usernam usernam usernam let hope tellin truth roll floor laugh
281,usernam great actor uhm nooooo need music leav us like rhi rhi face tear joy face palm emoji modifi fitzpatrick type number zero width joiner femal sign
282,everybodi geek cuz usernam gave us god woman let forget usernam usernam gave us god fair sexi nasti
283,usernam h still time favorit song shit relax
284,nigga corner thought show well nigga guess hashtag usernam pictur
285,usernam quick freestyl fire fuckin around usernam usernam song hashtag collis symbol fire check let kno ya think fr eye think face hashtag hashtag hashtaggetthishappen httpaddr
286,usernam usernam numberc httpaddr
287,usernam usernam remix hashtag hashtag pictur
288,usernam better actor usernam pretti much better everyth accept moist aubrey got titl
289,usernam humbl il cazzo ritardo di number minuti con una folla che lo aspetta gia da ore hashtag
290,usernam usernam usernam usernam usernam usernam fire fire
291,one use mask instrument numberfutur ft usernam african way titl song hashtag link download httpaddr rt pictur
292,usernam usernam remind usernam everyth remain raw video intro woo haa
293,usernam amaz power
294,usernam usernam stupid line
295,usernam usernam usernam usernam usernam usernam usernam usernam usernam usernam usernam usernam usernam usernam usernam usernam usernam usernam usernam numberc httpaddr
296,numberc usernam heavi black heart heavi black heart heavi black heart heavi black heart heavi black heart lace white smile face
297,hope usernam pursu act role absolut amaz usernam
298,usernam numberc esta seri esta de la ptamr clap hand sign clap hand sign
299,goodmorn black sun ray new week new sound new mindset playlist featur usernam usernam usernam usernam usernam usernam usernam usernam usernam usernam usernam usernam usernam usernam httpaddr
300,usernam bein tha nit bean power gassss loudli cri face roll floor laugh time gotta give man like kendrick smash role x
301,usernam usernam forgot power even thing lmaooo
302,usernam usernam person rais hand celebr emoji modifi fitzpatrick type number ok hand sign emoji modifi fitzpatrick type number
303,play multipl music note goosebump yehmenumb remix usernam ft usernam dancer hashtag region indic symbol letter g region indic symbol letter h w usernam microphon usernam headphon u n e radio usernam hashtag
304,usernam usernam lmao
305,usernam usernam second thought k gonna pull trigger kendrick smile face open mouth cold sweat thank god
306,usernam usernam someon need shower
307,usernam usernam use idiot
308,usernam usernam usernam hashtag usernam speak favorit rapper right usernam usernam usernam usernam usernam hashtag hashtag hashtag hashtag hashtag hashtag pictur
309,thank usernam pictur
310,usernam usernam httpaddr
311,dark light guess put us blender come colour roll floor laugh roll floor laugh roll floor laugh roll floor laugh roll floor laugh usernam kill part power fire fire fire fire
312,tell whatcha gonna confront nothin new bring bullet bring sword bring em bring truth usernam pictur
313,usernam usernam pictur
314,fact usernam kill perform power shock hashtag
315,el modo en que usernam utilizo el legado del incompar bori gardin siempr maravilla httpaddr
316,usernam ab soul usernam
317,usernam usernam usernam usernam good
318,usernam person fold hand emoji modifi fitzpatrick type number number
319,usernam usernam numberc got nigga like pictur
320,knock rap concert bucket list list usernam come tucson septemb mike_stud hope announc tour soonand long shot usernam usernam usernam
321,took heart part number appl music right ever sinc kendricklamar bro
322,usernam la see usernam usernam usernam fight video game epic
323,shout usernam dopest jean commerci usernam
324,move usernam around citi alway use tell mc pass mic man hashtag aka usernam wink face alway begin polic car revolv light polic car revolv light polic car revolv light polic car revolv light polic car revolv light hashtag hashtag httpaddr
325,usernam usernam usernam anytim listen album like watch happen classic
326,usernam numberc usernam shit funni face tear joy pictur
327,one best collab long time usernam usernam love pump song pictur
328,le king usernam ete imperi hier soir au usernam crown recit un concert fou httpaddr hashtag pictur
329,usernam usernam usernam usernam usernam pictur
330,want meet usernam bad
331,usernam usernam look like vien
332,usernam wonder made look fuck lol
333,usernam guy croatia wrote lyric wall first thing see wake httpaddr pictur
334,usernam numberc big factz number
