,tweet
0,hell wrong usernam server late mani cant connect error pout face usernam
1,phone usernam technic support today phone answer minut problem solv simpli hashtag thank guy
2,usernam cahoot usernam
3,usernam usernam nest thermostat especi smug
4,usernam usernam get back onlin adjust thermostat moneysymbmoneysymbmoneysymb sun face fire fire fire
5,today shell shocker usernam learn thermostat number gener moneysymbnumb httpaddr pictur
6,usernam usernam usernam mine
7,usernam usernam tell kid go adjust thermostat smile face open mouth smile eye
8,thank usernam littl hashtag releas product timescal releas uk eu stagnat brand along limit make confid make futur purchas
9,usernam usernam usernam real think
10,noth issu usernam thermostat downstair effect goe offlin everi day multipl time per day last week half pictur
11,usernam hey nest product ever come hong kong
12,usernam take camera ui notif good throw audio alert remov motion bam hashtag thank later hashtag hashtag
13,email arriv introduc usernam doorbel smile face sunglass look websit intrigu see price psnumber roll floor laugh close websit hashtag hashtag
14,usernam thank reach help
15,usernam sold usernam never work look forward reliabl altern
16,question usernam usernam number differ humid thermostat humidstat sit right besid pictur
17,usernam pleas tell nest doorbel bought us work u k
18,usernam look like im gonna find differ thermo stat use nest hashtag
19,usernam usernam yeah know happen nowaday
20,usernam usernam definit alexa total pain sometim hue light use siri big stuff
21,usernam usernam parent happi
22,usernam april use number hour less energi march thank usernam thermostat httpaddr hashtag hashtag
23,googl nest review usernam httpaddr via usernam
24,talk usernam via twitter dm still lame still disappoint anyon need smart tstat mayb look usernam
25,usernam earn number usernam leaf june number area thermostat help save httpaddr hashtag
26,usernam let test nest secur also itali thank
27,usernam usernam usernam excel work guy
28,usernam zero innov year much opportun hashtag
29,usernam usernam shhh blow cover guy
30,gener usernam outag
31,got hashtag usernam even though kept suggest pro instal super easi love doorbel far
32,wrote whole page usernam improv custom support need hobbi
33,usernam uzh numbertyi den ne rabotaet sistema otopleniia pozharnaia signalizatsiia podkliuchennaia k umnomu termostatu nest okazalo vy zablokirovali ikh ip number number pozhaluista razblokiruit usernam usernam hashtag hashtag pictur
34,number year mo mo tri cancel monthli usernam subscript video unknown error keep conveni occur think error unknown hashtag
35,usernam usernam usernam usernam usernam ye usernam thermostat new connect applianc v entertain cours unlock door app much come k b smile face sunglass hashtag
36,usernam work alexa
37,usernam disconnect usb outdoor camera run cabl drill hole eg window frame hide cabl power suppli
38,usernam usernam usernam amaz home assist x
39,usernam usernam number small town vfd almost everyon one inlaw father brother nephew cousin serv help keep austin cnti tx safe beauti
40,usernam usernam
41,usernam usernam usernam chego roku number ne number kak minimum number rka luchsh za schiot podderzhki numberk hdr
42,new youtub video usernam post httpaddr setup instal nest cam iq outdoor httpaddr hashtag hashtag hashtag hashtag hashtag hashtag
43,happi father day love piec copywrit usernam month email hashtag hashtag hashtag pictur
44,usernam usernam hard pill swallow decid go nest everyth order httpaddr payment tell number number week ship would say backord start guess find someth els mayb hashtag hashtag hashtag
45,usernam usernam model vpn fix way lot peopl work home sound like good gadget review yt
46,anoth smart devic ad home usernam pictur
47,usernam think would great
48,usernam product complet useless
49,usernam usernam hate think get couch chang thermostat
50,usernam number camera add realli quickli want add afford reason nest camera super nice like usernam said realli frustrat price add usernam got right
51,okay realiz first world problem got new usernam camera captur moment beauti
52,usernam like camera servic work
53,usernam usernam whoa
54,usernam power sourc usb
55,list hong kong tech acceler cowork space httpaddr hashtag hashtag hashtag hashtag usernam usernam usernam usernam usernam usernam usernam usernam
56,pleas invest busi ventur doorbel shriek ring mayb one piteou wail look usernam usernam hashtag hashtag
57,bonjour usernam avez vou une date de sorti officiel pour hashtag usernam usernam
58,usernam thank thought would neat idea shrug emoji modifi fitzpatrick type number number zero width joiner male sign
59,usernam usernam air condit stop remot pictur
60,usernam usernam usernam pictur
61,usernam rep never touch equip support never call back number rep never provid resolut moneysymbnumb drain worst support ever receiv lack rep even get supervisor involv help wait week supervisor callback
62,usernam amen
63,usernam app let login iphon ipad think face pictur
64,usernam usernam tell monkey
65,adopt usernam hello earli lose moneysymbnumb free usernam home mini hashtag pictur
66,usernam alreadi system remov replac manual system work perfectli half cost system gimmick
67,usernam done
68,usernam usernam usernam surpris wonder work devic still sure plan besid implement current product senior space much usernam current offer glad see need implement well
69,okay usernam let make sure understand get notif everi time car drive past driveway appar somebodi either hand knee handstand appear either concret vomit regist pictur
70,usernam usernam usernam usernam usernam usernam
71,usernam heavi black heart usernam happi usernam censor conserv voic block promot ad includ one sorri
72,usernam spent total number hour phone support far number hour listen hold music hashtag hashtag hashtag
73,usernam usernam great love video qualiti great
74,usernam get notifi rush hour end pictur
75,usernam usernam budget winner con expens price usernam honeywel moneysymbnumb cheaper plu need c wire power adapt pleas make correct httpaddr
76,hashtag video doorbel power hashtag hashtag engin everythingrf usernam usernam usernam usernam hashtag hashtag hashtag hashtag httpaddr
77,usernam usernam usernam go ring keep option open homekit alexa googl home
78,usernam usernam usernam phone pin
79,got usernam excit energi effici new home httpaddr
80,usernam usernam hashtag thank take care issu patient complet pictur
81,make usernam thermostat smarter usernam usernam usernam httpaddr pictur
82,usernam thermostat worst product ever bought simpli work
83,nest usernam alway difficult view past video everyth els work great number time tri look back endless spin blue circl app webbrows numbergbp internet differ locat matter fix pleas
84,power back hashtag thank usernam cam abl talk directli firefight camp yard save hous still scene make httpaddr
85,usernam dusti sniff
86,usernam glad nobodi home hear yell hashtag respond first time alexa usernam got nest hello want ring alexa instead phone though hope next updat
87,usernam hey usernam know mani time complain told termin offenc yet keep happen somethingcaught hashtag httpaddr via usernam
88,usernam got rid
89,usernam smoke detector went number numberam morn wonder made mistak get ioc smoke alarm hope hack
90,dear usernam remov watch extens app sinc show spin around nest logo crash useless
91,number drop energi use month love usernam hashtag hashtag control allow never go back one pictur bill moneysymbnumb bill get low moneysymbnumb pictur
92,usernam beauti door
93,usernam usernam hi jake sorri respond sooner go dm make sure concern address fulli grate get feedback well correct breakdown experienc along way
94,usernam number quid doorbel astonish face astonish face
95,usernam perfect one never find key face tear joy would
96,usernam homekit support
97,usernam oh realli oh shame hope soon thank respons though much appreci smile face smile eye
98,usernam usernam problem
99,usernam heck pictur
100,usernam usernam ye becom addict smoke detect adt eventu switch someth homemad get camera instead shitti servic
101,usernam idea case usernam camera move us netherland plan bring us
102,proud announc ad usernam learn thermostat rang fantast product httpaddr shop black rightward arrow httpaddr may even chanc get hand one keep eye peel pictur
103,usernam hahahaha face tear joy
104,anyon got experi usernam usernam usernam advic recommend appreci thank
105,usernam devic sinc juli number restart multipl time request email move usernam
106,usernam problem connect nest server central florida one els issu
107,usernam usernam yeah happen us yesterday connect camera wi fi issu work mobil network either use babi monitor pleas fix
108,usernam smart hashtag peopl say smarter usernam moneysymbnumb father day httpaddr
109,new usernam hello recogn dog dog barron hashtag hashtag pictur
110,usernam usernam number number sever busi day review post approv team store also happi speak provid assist troubleshoot issu experienc nest unit
111,usernam nest access custom video
112,usernam usernam usernam better train need thank call help today seem simpl enough
113,usernam love usernam
114,usernam april use number less hour energi march thank usernam thermostat httpaddr hashtag hashtag
115,usernam usernam someon pleas explain start call jr hour half ago sit home number degre florida hold last number minut girlfriend cat dog sweat pajama unaccept
116,usernam get copi sale receipt thermostat purchas made
117,usernam usernam one year recommend check ga electr provid rebat got moneysymbnumb nest moneysymbnumb sale nest moneysymbnumb ga rebat moneysymbnumb electr rebat total cost moneysymbnumb
118,usernam usernam usernam usernam driver take leak end driveway deliv packag keep honest
119,best leverag hashtag know usernam usernam usernam httpaddr pictur
120,usernam nest app connect nest servic problem
121,usernam accord smoke alarm offic burn three time morn pleas advis
122,usernam usernam usernam usernam usernam usernam usernam put ive got mine high level porch put next breaker switch stair ceil void etc look bigger enclosur numberxxnumberxnumb
123,want good deal usernam secur system think mayb need dog thank usernam hashtag pictur
124,usernam mm hm wait hear someon dept good thing hold breath
125,usernam thank make transit smart home easi pictur
126,usernam usernam usernam smoke detector use
127,usernam hey guy get app fix see camera thank
128,usernam someon trip chord desper want usernam back monitor daugher sleep pictur
129,nest guy awar issu eastern canada cannot connect app thermostat
130,usernam got hello today like far chanc see echo app visitor announc
131,wast money buy bunch usernam smoke detector sell ebay throw trash hashtag hashtag hashtag hashtag pictur
132,usernam usernam usernam usernam usernam usernam usernam wtf frown face open mouth
133,usernam usernam usernam lol far good fire
134,usernam yeah love reason though upgrad number gen replac whole system
135,usernam e
136,believ control thermostat couch like get hot lemm pull phone adjust c roll floor laugh face tear joy victori hand shout usernam make dream possibl
137,usernam pictur
138,usernam best thermostat avail yet absolut hate control everyth hous hashtag hashtag hashtag except hashtag point clearli choos make devic compat competit reason remind daili
139,power peopl usernam power project got supercharg fwa httpaddr simpl power site peopl search zip code find fund local aid program fight energi poverti visit httpaddr pictur
140,usernam usernam yike
141,usernam mine look similar love usernam
142,usernam facepl broken stay charg need new one
143,usernam caught hashtag httpaddr via usernam
144,hindii pt devanagari sign virama rkaaritaa div ke shubhavsr pr sbhii pt devanagari sign virama rkaar bhaaiyon ko bhut bhut bdhaaii detii hun aap sbhii bebaak aur niddr hokr apnii lekhnii se sbhii kh br phuncaat rhe aap sbhii kaa naam shikhr kii uuncaaiyaan p devanagari sign virama raap devanagari sign virama kre bbitaa akhilesh tivaarii httpaddr usernam usernam usernam abpnewstv
145,moos move faster monday morn sleep face actual footag client sent us morn usernam camera hashtag hashtag hashtag httpaddr
146,usernam ad day usernam hello instal surpris custom father day httpaddr pictur
147,usernam invest suit camera thermostat initi pleas function new extern iq sever softwar problem nest support team seem unabl help lot time wast resolut frustrat
148,usernam hi wifi went work morn home wifi back nest black screen mani thought wifi drain batteri
149,usernam usernam lot grass cut
150,usernam usernam see interest iot applic hashtag ap could integr tv stb someth like usernam smoke detector devic hous connect back gateway via ethernet moca wifi would love see poe
151,usernam usernam usernam usernam well alreadi bought nest
152,usernam home deliveri driver appreci high pay job instead complain deliveri travel truck porch usernam camera frequent watch up motto like purpl promis usernam offer hashtag
153,usernam thank take care busi httpaddr
154,usernam usernam wait deliveri number replac smoke co detector hope one wake number numberam fals alarm beep incessantli sensor broken
155,hashtag usernam record next episod smart thermostat usernam usernam step new market integr secur system usernam usernam usernam usernam interest one know usernam
156,got usernam instal apart smile face sunglass
157,usernam avail ireland
158,usernam give us one hashtag quot need technolog build meaning better experi check usernam exampl pictur
159,usernam let keep famili safe usernam receiv moneysymbnumb nest secur pack add new line nest awar plan stop usernam next christma tree number backu ave hashtag hashtag pictur
160,fantast custom support usernam impress
161,hey usernam usernam io number updat possibl homekit roadmap
162,usernam usernam four aa batteri
163,wir haben die usernam protect rauchmeld getestet gute qualitat fur einen nicht gunstigen prei hashtag httpaddr mw pictur
164,usernam usernam ye
165,global smart ac control market number number top key player usernam usernam usernam usernam hashtag usernam inc hashtag usernam smart ac control market expect reach valuat usd number number million end httpaddr sampl httpaddr
166,help pleas number number minut hold answer hashtag usernam simpl custom request pleas
167,usernam temperatur sensor instal one httpaddr hashtag hashtag
168,usernam hug face thumb sign sparkl heart
169,usernam usernam usernam usernam usernam usernam usernam leav alon think usernam year bumbl bee tickl sting
170,usernam usernam earth globe europ africa k r fire loudli cri face sneez face drool face x nauseat face sleep face zipper mouth face face thermomet xx face look triumph fire africa paid voodoo oh back dash symbol
171,fill joy heat gener stat electr boiler week total control heat last love fact come home late work boost hot water phone hashtag usernam hashtag hashtag pictur
172,usernam doorbel camera pain constantli turn without notif mayb tri ring
173,usernam hello usernam deliveri driver ring usernam doorbel especi doorbel glow disc design specif deliveri driver miss pictur
174,usernam usernam never understood disdain nest nearli everi hvac guy test system connect two wire run exactli nest
175,usernam get statu bar icon indic lock unlock statu glanc nest x yale lock
176,usernam instal hashtag impress also get number day free trial awar cloud servic sure get alreadi would like tri first buy
177,usernam uk need offer transform chime combin work household uk set mine took day build combin part like lego set simpl setup
178,googl usernam want creat hashtag devic senior citizen httpaddr via usernam hashtag hashtag hashtag
179,usernam number usernam hope heavi check mark pray heavi check mark rain danc heavi check mark mother natur got way alway time set sprinkler haul hose aggrav world largest fresh water suppli great lake front yard front yard usernam cam pictur
180,usernam damn hack usernam cam
181,usernam box receiv return mail carrier usernam captur anoth one httpaddr
182,usernam usernam usernam appreci respons thank
183,usernam
184,usernam usernam usernam team hive
185,usernam sometim hello doorbel lose internet connect middl night reestablish connect sound chime way silenc sound night startl awoken numberam random chime disturb featur pleas
186,usernam usernam big thank guy hello roadshow today cumbernauld prize outstand instal hello tomorrow materi yesss electr brilliant thank guy pictur
187,usernam make batteri one ill ill stick ring doorbel shame rest hous nest
188,usernam usernam better pictur
189,usernam usernam updat outag would like abl see sleep babi
190,usernam usernam usernam usernam httpaddr let fam
191,usernam u r garbag know charg earli adopt ur startup recommend u number everi number even check motion alert w pay usernam usernam go crush u
192,usernam usernam look hashtag woodhashtag hashtag hashtag rickthano usernam
193,usernam nest seem complet glad thermostat
194,usernam safe natur build home around usernam hashtag hashtag pictur
195,usernam usernam usernam basic number internet bandwidth go toward nest send gif dog
196,tonight neighbor hous get alert usernam smoki go home find toaster short fire expens purchas paid tonight
197,usernam theoret give distanc let pretend obstacl way best light possibl wonder place camera base inform
198,usernam custom servic screw nest told reset promis disconnect hvac system ac hous nearli number degre hold nearli number hour
199,usernam thank would great chart graph avail show highest lowest temp day month year grin face
200,husband broke c tri instal new usernam sun face happi hashtag yall
201,usernam usernam usernam usernam usernam usernam usernam usernam thank includ us hashtag
202,usernam usernam usernam usernam usernam usernam wish list hashtag
203,usernam usernam usernam offlin event sightlin mine occur averag twice per day exactli length exactli two hour apart
204,anyon tell keep hous full usernam stuff instead move usernam stuff invit nest cannot differenti want pay nest want add iot less moneysymbnumb switch lock pro con
205,usernam usernam sure way usernam camera eventu went offlin number hour pictur
206,man realli want get usernam smoke alarm ancient one hous went collect nut would need replac number alarm thing number time price normal alarm come
207,sce put usernam thermostat new energi effici usernam c system money face tear joy got discount love ya
208,usernam anyon work phone tonight queue hour issu thermostat week never get ahold anyon
209,hey usernam someth appear right friday add usernam thermostat idea pictur
210,usernam updat ur app n live video still work iosnumb beta number also work beta number number pleas updat ur app one time slow develop cycl usernam gear work iosnumb
211,usernam normal doorbel
212,usernam usernam hashtag hashtag
213,good lord usernam way drop ball wait nearli numberyr doorbel compat wi stuff find releas need separ dodgi old tradit door chime smart wifi plug chime unit twice price ring system
214,usernam usernam boven verwacht
215,well usernam thermostat randomli fell wall broke guess gonna hot one today texa hashtag hashtag
216,usernam usernam usernam usernam usernam usernam ah replac thermostat apart unfortun actual love nest stuff back hous nashvil
217,usernam usernam tag usernam
218,use usernam creat custom holder new usernam outdoor cam use bird cam hashtag pictur
219,usernam usernam usernam usernam
220,usernam usernam worri would wash away would love
221,usernam usernam keep happen amount money paid three thermostat plu six camera plu nest awar result back back outag
222,wonder usernam bought either usernam yet seem like obviou fit
223,usernam usernam thing use power
224,usernam usernam usernam usernam dog cat face tear joy
225,usernam usernam well
226,usernam go spend thousand replac blind door sentiment item ruin mention hundr dollar electr bill outrag thermostat allow home heat high mani day
227,head ai usernam founder usernam head usernam speech recognit cto usernam co founder usernam vp tech usernam one thing common earli number work small silicon valley startup never heard astonish face wow httpaddr
228,usernam usernam usernam agre nearli larg enough numberm home smart thermostat year across usa usernam could probabl move around number total ca load httpaddr
229,usernam usernam usernam run usernam protect solut go add see give us
230,usernam usernam usernam tell next time run
231,usernam usernam usernam research nest mostli wife shut earli discuss worth purpos leaf use cover junk
232,hey usernam neighbor rescu cat roof weekend chanc go back get footag notifi
233,usernam usernam usernam wish even dog dog least think check toddler stole wallet desk
234,usernam thank inform
235,usernam usernam turn self lock app
236,usernam love great hate bad
237,usernam one job usernam hello pictur
238,usernam usernam use hashtag hashtag multiroom speaker hous mayb nice new featur
239,usernam usernam think peopl complet satur number time tire advert everywher tell stori get creativ never import run add retarget react stori pitch usernam usernam etc actual look
240,usernam usernam number day still respons custom complaint
241,usernam usernam get nest app stop overrid disturb set phone use samsung galaxi note number nation carrier mobil updat nest app one overrid phone disturb
242,live usernam cam feed usernam offic pictur
243,usernam usernam usernam usernam tech compani usernam usernam usernam etc know advantag custom servic addit good product servic appal sluggish product work continu use nest mani option
244,usernam thank thank innov doorbel bless littl gadget camera imag video crisp sharp add user friendli softwar abil filter content histori worth everi penni pictur
245,usernam usernam deal web servic httpaddr everi time attempt valid login hit httpaddr add string return number forbidden attempt leav custom login screen realli
246,hooray usernam usernam servic servic restor
247,usernam usernam usernam usernam usernam colleg refresh finalist usernam usernam usernam go away goodi usernam usernam usernam usernam usernam keep watch updat day continu winner announc pictur
248,slightli sad excit new thermostat nest pictur
249,usernam usernam nope homebridg nest cam plugin httpaddr
250,usernam pleas get homekit integr pleas
251,anoth day anoth usernam outag third day row think face could anyth usernam acquir compani usernam pictur
252,usernam right brand new nest iq work fine day appar morn pictur
253,usernam usernam recommend usernam want someth comprehens badass
254,cheeki boiler instal updat use usernam ecofit pure usernam magna clean control usernam thumb sign emoji modifi fitzpatrick type number number pictur
255,usernam android app suck
256,nest temperatur sensor launch uk europ nest say due differ heat system offer altern set european user differ uk precis need usernam usernam
257,need help go get hashtag denversbdc hashtag hashtag hashtag usernam hashtag hashtag hashtag hashtag hashtag hashtag hashtag hashtag httpaddr
258,usernam usernam sorri usernam whether approach friend hous colleagu complet stranger use usernam facial recognit technolog identifi face without httpaddr usernam hashtag hashtag hashtag httpaddr
259,usernam heavi black heart heavi black heart heavi black heart heavi black heart person rais hand celebr emoji modifi fitzpatrick type number person rais hand celebr emoji modifi fitzpatrick type number person rais hand celebr person rais hand celebr emoji modifi fitzpatrick type number person rais hand celebr emoji modifi fitzpatrick type number number earth globe america usernam
260,usernam usernam pineappl ground also sick shirt
261,hashtag dessa semana e especi primeira vez que minha filha atuou como fotografa cobrindo evento catapulta usernam cowork em vitoria es pictur
262,usernam earn number usernam leaf may number area thermostat help save httpaddr hashtag
263,usernam usernam yep
264,usernam usernam usernam realli nail custom servic opportun situat present amaz
265,usernam usernam lol love whole hous nest door bell thermostat
266,usernam usernam idea colbi one set origin came password end problem face tear joy
267,usernam usernam resolut issu number degre hashtag hashtag pictur
268,usernam hi nest x yale lock come uk
269,also thought usernam ever consid triag support ticket base prioriti like mayb someon whose c work number temp import someon connect nest app ridicul wait number hour hold
270,usernam unexplain appl hashtag httpaddr via usernam
271,usernam hashtag
272,hashtag resid messag regard trespass safeti awar usernam video alley httpaddr
273,usernam thermostat suck let hous get number degre even though number outsid sinc nobodi day guess number hour way number thank noth
274,usernam excel ask missu one eye come match color everyth would slate usernam
275,dyk usernam work usernam light trigger light base motion occup alarm nest product hashtag hashtag hashtag hashtag hashtag watch quick video httpaddr
276,usernam earn number usernam leaf may number nester thermostat help save httpaddr hashtag
277,usernam usernam honestli sell nest camera websit suck mobil app suck view multipl camera simultan option play back numberx numberx speed
278,usernam usernam thank need system number stage heat singl ac integr everyon devic
279,usernam usernam share knowledg collabor win around usernam usernam usernam usernam
280,blazin hot hashtag hashtag hashtag usernam pictur
281,usernam camera system made high tech gladi cravitz pictur
282,usernam usernam get usernam
283,usernam usernam usernam great packag
284,usernam usernam easi peasi make solder iron ac invert number gaug wire dc batteri pack ya idea wait nest
285,happi fight hashtag today usernam rush hour reward program usernam httpaddr httpaddr
286,usernam pro tip mind yo fuckin busi
287,sooooo connect issu usernam app come fio mobil lte usernam
288,usernam usernam usernam httpaddr
