,tweet
4080,usernam usernam may number number number pm
4081,heartwarm father day surpris usernam nest hello warn may caus water eye httpaddr
4082,plan releas heat detector usernam
4083,usernam usernam
4084,usernam pictur
4085,usernam usernam usernam usernam usernam light liter sort person sometim grin face smile eye pictur
4086,usernam usernam check insur co discount mine gave moneysymbnumb yearli pretti much paid
4087,hey usernam decid thermostat ecobe sensor motion detect pipelin
4088,usernam spent numberhr tech support tri setup googl assist featur new expens nest iq cam still resolut extrem frustrat employe understand googl nest part compani constantli pass buck
4089,usernam usernam usernam work like dream reason look forward winter
4090,usernam usernam usernam usernam usernam usernam
4091,hey usernam usernam overcharg nest awar renew phone numberx today tri straighten time hold number minut pout face
4092,usernam usernam usernam everyon httpaddr view need ring system numer configur
4093,usernam love outdoor iq cam far instal door bell soon nest app io select rington camera motion door bell motion also plan ringer accessori doorbel similar ring chime
4094,usernam usernam dad love deal pictur
4095,usernam disappoint reliev face b b want one get usernam doorbel think face
4096,usernam absolut amaz new hous number larger old hous middl summer power bill number less previou bill ok hand sign emoji modifi fitzpatrick type number
4097,usernam keep randomli decid thermostat set number degre matter often chang schedul know fix
4098,experienc technic difficulti hold usernam usernam number minut oh night hashtag hashtag hashtag hashtag pictur
4099,usernam usernam oh tv mani year number
4100,usernam app work even log laptop
4101,usernam offer pay insist leav cheap thing wall
4102,usernam usernam hello doorbel camera show offlin network connect blue ring doorbel went offlin number numberpm eastern third time sinc purchas done pictur
4103,usernam probabl ring
4104,usernam usernam number nest work great easi instal easi oper app
4105,usernam usernam go home depot give free googl home mini purchas bought one love nest far
4106,usernam babi room cold live room warm nest temperatur sensor let choos right temperatur right want hashtag hashtag hashtag httpaddr
4107,usernam ship asia nest yale lock
4108,anoth month save heavi dollar sign thank usernam leaf flutter wind leaf flutter wind leaf flutter wind pictur
4109,usernam given sold usernam devic current use usernam hello doorbel usernam outdoor camera homebridg usernam
4110,usernam usernam longer work mine well
4111,usernam usernam let usernam compet usernam arlo
4112,usernam custom also develop voic heard still wait api temperatur sensor releas month ago
4113,usernam terrifi love ai hous monitor behavior chang thermostat without get fabul
4114,usernam router die replac process chang wifi user frieldli number devic bteer way usernam
4115,usernam usernam least throw
4116,usernam usernam would love seen
4117,usernam come vr number number songwrit cafe met johann verschaev van jet muda kunstencentrumza number number royal wed op groot scherm nestwo number number ep releas parti jef dhaes usernam mijn eerst afstuderend httpaddr
4118,usernam usernam usernam mine give warn beep keep key backup everi set car key one hidden nearbi brand similar
4119,usernam usernam money spend air condit
4120,usernam cat smile face heart shape eye shrug zero width joiner femal sign httpaddr
4121,usernam usernam shame use voic heat hot water request year uk user realli simpl code chang noth
4122,wifi enabl usernam hello hashtag instal hashtag person compel offer hashtag properti guest resid alik enjoy significantli reduc expect hashtag hashtag audio hd qualiti pictur
4123,usernam amazonhelp appreci driver take pic deliv packag doorstep toss bail techniqu caught hashtag httpaddr via usernam
4124,usernam usernam well costli bug bug wait bug free softwar pictur
4125,usernam usernam usernam mailman throw semtex land sentri gun everi morn deliv mail
4126,think time new thermostat system usernam seem keep servic oper day
4127,usernam littl ridicul link number usernam thermostat known issu month
4128,usernam buy nest product support homekit
4129,usernam nest servic hard last hour statu page recogn number chat queue seem indic alon pictur
4130,honest instal usernam camera hous thought would see creep know creep number month later front back yard creep free person rais hand celebr emoji modifi fitzpatrick type number number
4131,usernam usernam usernam usernam solut us buddi go honeywel ecobe next amazon need get product space
4132,alway want support usernam httpaddr
4133,hey usernam usernam uk get guard b would awesom protect act extens hello chime guard siren
4134,usernam usernam get thing thermostat app
4135,usernam usernam love nest ranch easier regul temp look new sensor accessori came improv temp certain room
4136,usernam usernam fun follow twitter man see ya
4137,usernam usernam usernam well ridicul way overrid correct temp hous
4138,usernam kitten love voyeur
4139,think usernam cost us upstair never cool right downstair gave year done glitchi usernam sorri cheat back pictur
4140,usernam usernam usernam usernam usernam smart apart make beauti set dress
4141,usernam usernam interest although look like late
4142,usernam usernam nestuk_
4143,thrill usernam number day option let chang number day record without cancel resubscrib consum friendli
4144,usernam usernam heat boil hot hashtag
4145,usernam usernam get batteri oper smoke alarm get notifi hous burn gone
4146,stay comfort summer heat manag usernam thermostat energi usag watch phone alexa slack simplecommand hashtag hashtag hashtag pictur
4147,usernam vs usernam cam also moneysymbnumb vs moneysymbnumb far usernam lead oh local storag plu pictur
4148,usernam usernam usernam usernam usernam say hot upstair cold downstair run system possibl regul cannot unless control damper possibl never seen home hvac anoth fanci stat app
4149,uninstal usernam thermostat terribl number degre taught number degre insid comfort usernam
4150,nest energi leaf get
4151,well play usernam fuji noth httpaddr pictur
4152,usernam usernam usernam usernam ring previous went skybel new home
4153,usernam usernam disappoint tbh multipl compani august ring promis homekit doorbel even sold firmwar updat homekit support seemingli come forev never releas seem like problem appl end manufactur
4154,usernam
4155,hey usernam fact chang wifi password requir remov nest protect ceil set scratch terribl user experi hashtag hashtag usernam
4156,usernam usernam ripoff number buck month unlimit camera least number cam extra charg
4157,time upgrad backend infrastructur hashtag hashtag blame usernam hashtag hashtag pictur
4158,hashtag follow usernam thermostat get credit usernam bill enrol rush hour reward detail httpaddr pictur
4159,usernam usernam yeah certainli purchas usernam product unless releas option remov banner give buck take never go want nest awar banner sour brand
4160,usernam android app great damn near seamless alway want nativ usernam app one app work hi sono mani
4161,usernam hilari
4162,usernam usernam fanci
4163,usernam usernam still issu auto schedul app thermostat still auto schedul sure effici email support take way long respond sorri complain help pleas thank much
4164,usernam usernam usernam thought still topeka get kcpl servic
4165,usernam katakana middl dot chao shao ren shu deyou ndabo katakana hiragana prolong sound mark da katakana hiragana prolong sound mark zo katakana hiragana prolong sound mark n katakana middl dot chu metenouablian xi hui xia ban qi hada hui chu ru katakana middl dot bao danji usernam katakana middl dot fei yan ninaruqian noyuan qi naqe noan _ hashtag zi fen gaxuan bujin nian shang ban qi nonumbermei pictur
4166,usernam usernam oh total star haha
4167,usernam usernam usernam usernam usernam absolut two instinct core tenet
4168,usernam instal nest hello great devic found schedul quiet time main reason bought hello ring notic other ask featur well pleas add featur expec
4169,usernam usernam happi guy
4170,usernam guy beg class action suit obviou low ball free user camera never load say offlin usernam usernam usernam
4171,usernam hide video captur devic bush record entri httpaddr httpaddr
4172,usernam usernam timelin plan nest x yale lock nest hello integr system like ifttt
4173,go solar get free usernam httpaddr
4174,usernam usernam imma throw pictur
4175,usernam air filter remind hashtag yet trigger chang filthi filter accord
4176,usernam guy commiss pleas fix aw io app thank white smile face
4177,thank usernam respond tip diagnos happen tri get bottom
4178,usernam usernam point usernam cam creat usernam account behalf broadcast
4179,usernam usernam ton peopl
4180,usernam usernam must intox rose bush comfort sleep
4181,fact usernam right make feel better week
4182,usernam usernam usernam hi guy one first alarm avail europ number pleas provid useful inform european would love know heavi black heart hashtaghashtag
4183,usernam pleas send statu concern fall number number via e mail
4184,usernam usernam need numberv numberv
4185,usernam usernam usernam numberfingering usernam
4186,usernam got new nest cam incap stay connect wifi older one flawless one brutal known issu
4187,usernam thank xx
4188,excit usernam hello doorbel
4189,usernam love review product dm contact pleas thank
4190,usernam hour three usernam technic support everi ten minut repeat process insan wonder usernam give shit away free support anyth build
4191,usernam usernam win
4192,fantast technolog howev never buy usernam usernam product simpl reason trust secur second rate collect data custom use sell highest bidder refus product
4193,usernam usernam usernam mine still work youtub set even common wire set
4194,usernam usernam brand new replac httpaddr ecofit pure number combi boiler instal today system addit includ usernam hashtag number gener usernam learn thermostat usernam httpaddr
4195,usernam much cost instal
4196,usernam usernam pick thermostat work best equip nest fantast go add doorbel camera nest well also nest realli work well amazon echo
4197,usernam product gave arriv go home earli instal everyth person rais hand celebr pictur
4198,usernam guy keep moon secur camera stop pictur
4199,think becom patient adult proof point wait hold nest support number hour number minut count far still human interact v calm number call answer usernam usernam
4200,usernam pleas fix system asap httpaddr
4201,nest usernam would realli like see abil backup migrat nest thermostat schedul new gen model seem crazi upgrad gen number gen number manual recreat schedul pictur
4202,usernam usernam mean chib
4203,usernam usernam usernam usernam look great brick wall
4204,usernam app spam notif daili great way get thermostat thrown garbag time buy usernam pictur
4205,usernam thank refer ecobe home iq featur record indoor outdoor set temperatur pictur
4206,usernam usernam usernam usernam plain lazi man
4207,usernam place year
4208,usernam usernam usernam nest love
4209,thermostat set keep creep usernam run team immigr grandma
4210,usernam usernam usernam usernam usernam let know help
4211,usernam great dandi tech compani til need custom servic intern depart could commun well product usernam
4212,usernam usernam usernam usernam usernam usernam usernam shit
4213,bet hous half comment usernam app paid usernam usernam usernam fear drive sale pictur
4214,usernam usernam usernam agre interest programm thermostat care less control phone suggest valu programm one
4215,usernam usernam usernam usernam usernam use hashtag deriv data move busi forward via usernam httpaddr
4216,httpaddr hashtag usernam
4217,cook cast iron realli emerg button come usernam face tear joy
4218,usernam usernam
4219,today shell shocker usernam learn thermostat number gener moneysymbnumb httpaddr pictur
4220,usernam usernam usernam usernam usernam usernam usernam usernam usernam astonish comment door bell clearli limit demograph suspect group openli accept amazon echo listen everi word say
4221,three bedroom number bath gorgeou hashtag number avocet way hashtag neighborhood hashtag avail washer dryer deck w view usernam home system number car garag w lot storag space shuttl downtown sf httpaddr pictur
4222,usernam usernam face tear joy
4223,usernam usernam usernam usernam netatmo presenc outdoor vouch definit ye homekit ad market via updat nice believ welcom updat time summer number
4224,usernam alreadi got resolv guy
4225,recov hashtag check good commentari usernam usernam chang thermostat design game httpaddr
4226,usernam pleas
4227,usernam kudo amaz custom support help get hashtag thermostat instal function truli outstand servic white medium star white medium star white medium star white medium star white medium star
4228,usernam freakin cool
4229,third replac usernam usernam humid insuffer world frustrat home decid make work product anymor worri everi person know want buy nest product convinc otherwis
4230,nestsupport number minut hold one answer subscrib servic custom servic like nest guard keep go httpaddr help understand httpaddr usernam
4231,usernam smart thermostat help keep home perfect httpaddr usernam learn thermostat learn schedul heat need spread cost number month interest free buy ee httpaddr pictur
4232,usernam moneysymbnumb secur system go bed like make feel secur pictur
4233,usernam usernam usernam usernam oh nice also let know like academ environ kind like someon someon took ann arbor dip tennesse took snow away realli think potenti place live
4234,usernam usernam usernam look like good idea wall look great replac larger thermostat
4235,usernam updat nest secur avail europ franc especi pictur
4236,usernam invit let talk talk knew sold guy said usernam usernam sentenc offer usernam hashtag hashtag pictur
4237,usernam june use number hour less energi may thank usernam thermostat httpaddr hashtag hashtag
4238,usernam usernam number nest thing disappoint nest listen hundr like thousand custom feedback board io user probabl account good proport user base want hashtag support without hashtag wake usernam
4239,disappoint usernam outdoor camera without expens hashtag subscript expens continu pay moneysymbnumb month notifi squirrel dig front yard without hashtag nest cam expens webcam thumb sign emoji modifi fitzpatrick type number
4240,usernam proactiv share usernam video usernam mischief happen neighbor share law enforc act quickli usernam way regist camera
4241,usernam thermostat switch manual mode without heat link press yesterday today advis prevent
4242,usernam usernam usernam usernam us well babi monitor
4243,usernam love ring doorbel camera watch disappoint face solicitor ignor grin face smile eye grin face smile eye hashtag
4244,usernam usernam wow go text next week come thank good everyon ok
4245,usernam good could spot check us help submiss issu usernam across usernam vice versa nightmar compliant one fess system issu
4246,usernam usernam outag cannot connect camera io app onlin servic
4247,hashtag time laps last week hashtag hashtag hashtag hashtag hashtag usernam hashtag httpaddr
4248,usernam hahahaha
4249,usernam usernam need hammer drill one
4250,usernam number minut count hold custom support busi accept usernam hashtag hashtag
4251,usernam may want check compani spell tweet grin face
4252,dsp usernam camera keep notifi dog bark yell go go cap hashtag hashtag
4253,usernam control phone need get one httpaddr
4254,usernam number hour wait time phone alreadi hour number min troubleshoot nest thermostat exactli best use timehashtaghashtaghashtag
4255,usernam hvac tri blame nest work week blown fuse hvac possibl
4256,usernam thermostat follow instruct danger close thrown
4257,usernam usernam smoke cm detector definit good invest home famili
4258,happi monday us check weekli digest featur usernam hashtag usernam keynot address japan us innov award new fund round updat hashtag httpaddr usernam hashtag hashtag hashtag hashtag
4259,usernam usernam omg cat total enjoy life rainbow grin cat face smile eye
4260,usernam wonder mani million custom still certainli reinvest money usernam
4261,usernam usernam actual met door goe laugh babi monitor happen
4262,use usernam pleat media filter like put build recommend fan cycl everi night help circul offer great filtrat air check usernam model build pictur
4263,unexpect bonu instal usernam hello video doorbel solicitor give see side note solicitor segway scooter hashtag pictur
4264,number hour phone call usernam fix thermostat honestli say hand best custom servic franklin gem want usernam stuff hous smile face heart shape eye smile face heart shape eye smile face heart shape eye
4265,say far nest hello biggest junk rewir put new numberv transform doorbel ringer crap still constantli goe offlin spotti pixel video wifi strength solid gotten ring usernam usernam
4266,switch thermostat eco mode app keep tell problem connect usernam servic help usernam
4267,usernam usernam usernam usernam sodayo katakana hiragana prolong sound mark koreyi shang nimos aru grin face smile eye
4268,usernam without homekit support deeper alexa skill soon featur like siri shortcut way valuabl close ecosystem
4269,usernam usernam best usernam home usernam deal compet usernam hashtag usernam usernam usernam httpaddr
4270,usernam usernam usernam nest thermostat regret purchas work wonder well worth price tag
4271,nest fulli integr usernam solut googl home googl assist look provid hashtag servic distribut energi resourc hashtag manag system competit get tough hashtag httpaddr via usernam
4272,usernam hey usernam stop thermostat switch eco everi number minut connect phone gp locat want
4273,usernam usernam usernam go nest support page troubleshoot hope help httpaddr
4274,usernam usernam wish smoke detector merguez set reason
4275,hashtag usernam point peopl toward free onlin resourc help build hashtag great practic toolkit look trigger support innov social sector httpaddr usernam usernam pictur
4276,usernam well newer camera better kinda defeat purpos peopl respond immedi ask question camera never hear
4277,usernam possibl downgrad subscript nest awar e start thirti day move ten day subscript
4278,usernam nest httpaddr yasam tarzi usernam
4279,usernam usernam usernam yeah big bummer nest cam smoke conumb detector thermostat none work homekit unfortun product good nest item
4280,usernam usernam usernam usernam need fix immedi
4281,usernam usernam
4282,usernam loudli cri face loudli cri face loudli cri face loudli cri face loudli cri face loudli cri face loudli cri face
4283,sad cancel usernam sinc servic work month wifi hashtag pictur
4284,usernam spi network buy hashtag hashtag hashtag hashtag hashtag hashtag hashtag hashtag
4285,usernam usernam usernam put
4286,usernam usernam difficult determin usernam usernam usernam oper distanc motion detector singl import fact final found arlo number ft still find ring nest ring say stick number ft fwiw
4287,usernam usernam nevah shadi email practic shall punish
4288,usernam usernam mallori custom wish switch nest system depend individu account cours will work option avail respond privat messag catherin p
4289,usernam usernam get spray
4290,usernam usernam nest support page mention issu
4291,usernam usernam dank googl x face savour delici food see evil monkey
4292,moneysymbnumb product usernam usernam hashtag pictur
4293,usernam usernam guy offer discount arrang nonprofit chariti work hors rescu want protect barn
4294,hous get smarter usernam usernam work togeth help us thumb sign emoji modifi fitzpatrick type number pictur
4295,usernam usernam usernam iot
4296,usernam link protect camera sound alarm movement detect even pay extra
4297,usernam usernam usernam usernam drawback lack appl homekit support time look whether ad sinc
4298,usernam usernam usernam back
4299,usernam usernam issu keep eye newborn afternoon goat goat hashtag know walk hashtag middl night great fun
4300,usernam usernam usernam liber climat chang action plan build home cost improv energi effici estim moneysymbnumb mani initi costli way reduc ghg would rather see money spent clean water number nation etc hashtag httpaddr
4301,usernam usernam usernam usernam usernam usernam custom care team alreadi look issu pleas assur resolv earliest
4302,usernam noth like yell custom servic agent tri get help thermostat user friendli problem still solv terribl custom servic purchas usernam
4303,usernam usernam love product look ad someth like httpaddr friend ring help
4304,thing like motion sensor usernam explor way assist older adult hashtag safe independ home long possibl hashtag httpaddr
4305,usernam usernam usernam tri set still wait hold seem serious terribl job commun issu nest much better pictur
4306,usernam usernam usernam usernam happi number instal usernam team hashtag
4307,usernam app spin never fulli open io number
4308,usernam still pay pension past employ detail cancel cash
4309,usernam usernam usernam look like profession job think first heist
4310,jorg chediek usernam usernam brief particip usernam usernam hashtag number process deliber south south cooper hashtag hashtag pictur
4311,usernam nest io app connect nest servic se michigan
4312,usernam gabe made usernam debut today show cool tech babi room includ usernam cam nest protect usernam home ton usernam light think even one yet hashtag httpaddr
4313,usernam usernam usernam rememb two year ago usernam unilater chang privaci polici favour agre stop use devic disconnect got retail sold refund money
4314,_engagi podcast chat elizabeth merrick may custom strategist usernam listen httpaddr hashtag hashtag hashtag pictur
4315,usernam wonder custom support
4316,usernam love
4317,usernam usernam actual work offic
4318,celebr hashtag instal new usernam doorbel hashtag hashtagmasc hashtag httpaddr pictur
4319,usernam usernam interest partnership
4320,usernam usernam usernam okay check promis
4321,cc usernam usernam __apf__ usernam httpaddr
4322,usernam usernam besid thermostat think nest thought make invest
4323,usernam love usernam app adjust home ac schedul turn even adjust home lazi move couch wink face hashtag
4324,usernam usernam usernam usernam usernam bless convo compar two
4325,usernam lol cute kitti play land meoweee
4326,awesom thing usernam cam check hous away check pet work hear doorbel rang see anyon came hous
4327,usernam usernam love ring doorbel system last year son bike stolen front porch numbermin got home video doorbel post local fb group share numberk time got back number day later amaz technolog today smile face smile eye thumb sign emoji modifi fitzpatrick type number number
4328,gotten nest would never known hous haunt thank usernam
4329,yer look proud new owner usernam thermostat pictur
4330,usernam
4331,usernam usernam usernam usernam well guess rush deliveri might littl much roll floor laugh
4332,get help hot summer night usernam usernam read review httpaddr hashtag hashtag hashtag
4333,usernam number gen stat absolut flawless number year howev app connect error thermostat heat link green stat work boiler fine app android iphon come hnumber error idea
4334,two year ago replac air condition june replac thermostat usernam thermostat talk seriou energi save moneysymbnumb moneysymbnumb month pictur
4335,usernam usernam that great
4336,usernam homekit support
4337,electr light bulb innov opportun everyday life see someth could done easier say usernam cto usernam hashtag pictur
4338,usernam usernam stuck time warp dead number year
4339,usernam usernam thank knew meant wink face hope work
4340,usernam usernam tea burnin hawt
4341,usernam thank usernam usernam send latest product free test integr fibaro smartthingsw still look compat trv radiat thermostat either usernam usernam tri build econom smart home mass
4342,hey usernam hold number minut speak someon tech support even log account right
4343,usernam usernam usernam httpaddr
4344,usernam home away assist beyond joke complet unfit purpos
4345,usernam paul usernam talk usernam usernam usernam usernam hashtag httpaddr
4346,usernam usernam number year old stole dog food
4347,usernam usernam usernam usernam usernam rtfm httpaddr
4348,usernam plan nest progress web app pwa would great final offici app window number
4349,usernam secur realli come protect nest sign noth els would great advertis unfortun moneysymbnumb purchas one like leav adt sign hashtag
4350,usernam usernam usernam ok got back
4351,usernam usernam myinfin app thermostat aw server alway constantli chang hand never problem usernam
4352,desper usernam cam stop cut everi devic imagin wast money would recommend pictur
4353,bought usernam setup homebridg control usernam usernam roomba homekit pictur
4354,usernam usernam thank feedback justin pass idea along team
4355,usernam usernam much point import think doorbel need backend infrastructur place interest featur smart home integr
4356,usernam usernam usernam usernam thought sure could use sure want nomin us zip code number
4357,usernam usernam sweet sound good
4358,usernam usernam nest dead purchas googl homekit like happen
4359,usernam usernam usernam usernam usernam usernam usernam usernam usernam usernam usernam usernam usernam usernam usernam need blanket sleep tracker integr nest calibr optimum sleep temperatur
4360,usernam usernam aka charg think get away market research flaw better altern lower price
4361,usernam littl kid red shirt
4362,number fewer hour look like achiev realiz heat may usernam thermostat repeatedli turn middl night wast number hour ga electr smart thermostat inde pictur
4363,usernam usernam usernam usernam usernam usernam would awesom
4364,brand new usernam think temp hous number degre think usernam pictur
4365,usernam usernam shame love nest especi london schedul turn heat wake
4366,usernam usernam usernam feedback peopl either within thread httpaddr
