,tweet
2630,usernam number work compani video doorbel time seem like novelti today pictur usernam video doorbel integr alexa googlehom bed ridden elderli person see door even accept packag could possibl
2631,usernam usernam tri go actual support instead twitter realli good support chat
2632,usernam usernam definit littl know alreadi know local bobbi live next door
2633,usernam usernam look like hot middl night still number tire face tire face tire face tire face
2634,usernam usernam renew quick respons fast ship purchas thank
2635,instal new usernam product home joy process
2636,usernam usernam usernam depart fire engin guy battl insan fire anywher us statu liberti brutal year hashtag cri face mani deadli fire past winter lost brave soul broken heart person fold hand emoji modifi fitzpatrick type number broken heart everi firefight deserv huge pay rais money bag hashtag hashtag hashtag hashtag pictur
2637,usernam usernam usernam usernam usernam usernam nice work ok hand sign
2638,usernam new doorbel gadget capabl open build door gate like electr intercom buzz peopl
2639,usernam black man door matter time turn racist
2640,thing made tear today usernam father day ad
2641,usernam usernam get one hashtag
2642,usernam camera continu lose connect ipad phone still connect anyth fix problem
2643,usernam usernam usernam good
2644,usernam usernam peopl say room temperatur mean number degre temperatur room room wrong
2645,usernam shitti busi model number camera need footag cop buy servic get clip hold number min usernam told old footag delet bought servic wtf one hashtag hashtag hashtag
2646,usernam spray immedi
2647,usernam disappoint nest custom support number minut hold tri reach agent rectifi defect camera even abl reach live person call hashtag hashtag hashtag pictur
2648,usernam c problem bought hous end buy usernam thermostat user error figur origin one got nest good luck
2649,usernam usernam usernam usernam also anoth thread usernam w jaw drop statist stalk sourc httpaddr
2650,usernam usernam usernam usernam usernam absolut qualiti mate
2651,hashtag hat die intelligent videoturklingel nest lanciert die klingel warnt und informiert per app uber besuch usernam httpaddr pictur
2652,usernam usernam usernam usernam halt halt halt wir lesen nicht manuel ab wir haben doch usernam und wir pladieren dafur smart home neu zu definieren
2653,usernam usernam issu instal american version
2654,usernam updat would find use two number pack
2655,usernam usernam usernam usernam usernam love job clap hand sign emoji modifi fitzpatrick type number number
2656,usernam thermostat suddenli say offlin app still connect internet done troubleshoot still issu
2657,usernam chanc releas date nest temperatur sensor us folk uk region indic symbol letter g region indic symbol letter b
2658,usernam usernam usernam caught root around garbag full raccoon costum put spook want make sure
2659,biggest gripe usernam day usag get leaf competit natur frustrat
2660,bad thing nest cam husband know go offic steal chocol usernam
2661,usernam usernam probabl send one
2662,usernam usernam pictur
2663,add modern secur usernam hashtag nest x yale lock psst usernam gave excel review httpaddr pictur
2664,note self watch dog usernam camera thunderstorm work travel town brutal broken heart dog cloud lightn slightli frown face
2665,usernam app log reason vacat without password product worthless number day
2666,usernam
2667,usernam basic screw psnumber door bell front door wonder long last get stolen
2668,usernam nest secur breach got email sound like
2669,anyon recommend nest camera consid instal hous weekli cardiac induc collaps ashleigh see time check unconsci etc usernam usernam usernam cctv outsid properti door insid
2670,usernam hello anybodi sorri holiday burgl
2671,usernam usernam numberren kitenainda
2672,usernam amen
2673,usernam usernam ummm someon threw cat better real
2674,usernam earn number usernam leaf june number area thermostat help save httpaddr hashtag
2675,usernam track info say attempt deliveri home day deliveri card door usernam outdoor camera show anyon even approach hous pout face pout face pout face
2676,hi usernam third time week thermostat offlin known defect smart tv onlin phone tablet connect go
2677,usernam usernam experi usernam coupl week usernam instal well
2678,usernam usernam usernam feel like busi degre design get someon job happen get job need structur specif set task complet uniqu perspect allow think len see obviou opportun
2679,usernam absolut joke transform suppli need least numberv thought
2680,usernam thank thermostat work underfloor heat system
2681,hello usernam love improv audio nestcam iq old nestcam googl assist integr nice camera alert everi time see made facial recognit irrelev turn featur
2682,usernam usernam video review
2683,set usernam thermostat shut turn certain outsid temp without use number parti resourc like ifttt
2684,ever sinc instal usernam home electron make click nois air
2685,usernam think would paid usernam numbermm texa thermostat data month data sale busi tri number year ago got told pound salt roll floor laugh amaz much data worth certain period usernam interest hashtag
2686,usernam guy definit hurt influenc need httpaddr reach
2687,usernam usernam usernam problem hous got rob holiday day come back find hous broken number hour good enough subscript requir
2688,usernam usernam usernam usernam yup say deal get well play devic probabl biggest factor think pretti compar otherwis
2689,usernam usernam nest nest nest
2690,tri access usernam hello io app keep get error say problem connect nest servic tri minut forc quit app sever time without luck wifi lte
2691,still usernam cam iq outdoor great price month long httpaddr
2692,usernam usernam thank info thumb sign emoji modifi fitzpatrick type number
2693,usernam usernam problem
2694,smart home tech compani usernam hope make advanc help senior citizen live independ longer use tech httpaddr via usernam pictur
2695,usernam hashtag hea pictur
2696,usernam usernam unconscion
2697,news updat nest x yale lock abl unlock automat arriv home phone present mayb abl use nest tag usernam usernam usernam
2698,usernam usernam
2699,usernam usernam usernam actual wife
2700,usernam thermostat usernam includ usernam usernam usernam come hive pictur
2701,love hold number minut usernam usernam wait someth quick easi fix still wait pick
2702,shop great select hashtag hashtag product httpaddr hashtag hashtag usernam usernam hashtag pictur
2703,usernam thermostat gone rogu listen hold music number minut count ridicul pictur
2704,usernam usernam usernam usernam usernam hashtag
2705,usernam super done trick thank quick repli link inform pictur
2706,usernam happen person thing ring bell cctv record everyth doorbel rung
2707,usernam diet
2708,usernam usernam ha usernam love neighborhood featur lot fun particularli hashtag roll floor laugh
2709,usernam set around number hour
2710,usernam fee store video crazi especi consid qualiti servic realli bad stream
2711,usernam usernam usernam one know back oh number
2712,usernam usernam usernam
2713,thank usernam good product nice notif idiot garden pictur
2714,usernam usernam usernam call rush hour reward httpaddr
2715,hashtag lo hizo por escrito lo que usernam despeja duda hashtag usernam usernam usernam usernam usernam usernam usernam usernam usernam usernam usernam usernam
2716,usernam usernam guy top actual problem usernam faulti hello usernam epic httpaddr point go switch httpaddr get back
2717,usernam usernam usernam usernam usernam usernam pictur
2718,usernam earn number usernam leaf june number nester thermostat help save httpaddr hashtag
2719,usernam great hope get go thank
2720,tri subscrib right countri usernam offer number length list possibl subscript see ember behind facepl hard parp
2721,usernam usernam hahahaha die bacon super tricki tbh
2722,usernam usernam oof
2723,usernam usernam number frigid realli
2724,usernam best video watch day father help get tear eye well done
2725,usernam usernam httpaddr
2726,construct usernam cam usernam solar make number day timelaps think face usernam pictur
2727,usernam get push notif babi roll otherwis move usernam camera roll everi night numberpm super cute phone vibrat look number clock roll
2728,usernam roll floor laugh face tear joy roll floor laugh face tear joy grin face smile eye grin face smile eye httpaddr
2729,usernam work thank
2730,usernam truli hideou shot sharma comfort hashtag
2731,usernam integr announc usernam httpaddr
2732,usernam pictur
2733,usernam usernam usernam thank
2734,usernam imo realli shine group drop music etc also use alarm usernam integr white brown nois night definit sometim voic messag user
2735,usernam usernam usernam usernam bounc door litter see mark water slide porch one bounc even seen omg privileg sound like number year old retire noth els better
2736,usernam usernam would updat privaci polici includ homekit face palm emoji modifi fitzpatrick type number zero width joiner male sign
2737,usernam usernam usernam usernam usernam usernam usernam usernam usernam sting realli annoy happen except tree bumbl littl feisti live let live
2738,usernam remov hashtag role usernam ceo fold compani home product team httpaddr pictur
2739,stuck hold nearli number hour usernam tri get usernam can work seem unabl actual get someon line help lack help issu go month multipl phone call embarrass
2740,usernam cat face cat face cat face cat face cat face
2741,usernam usernam think comment probabl clarifi guy climb number fenc sleep lock backyard right master bedroom window front yard would poke stick told go home
2742,instal usernam doorbel alreadi caught creeper pictur
2743,usernam usernam usernam usernam lmk porfi
2744,alarm keypad motion sensor brain httpaddr httpaddr hashtag usernam pictur
2745,usernam buy nest hello store nest send googl mini
2746,usernam think grow hous complet usernam surveil like
2747,realli love usernam system stream poor bandwidth chanc see nbn year matter even new york still home hashtag hashtag hashtag hashtag pictur
2748,usernam deal websit work cant log even reset password wont buy door lock nest gotta reliabl
2749,usernam hashtag away answer door import call back
2750,usernam usernam usernam bei mir schon white smile face
2751,nerdi notic usernam thermostat usernam reunion hous hous garden
2752,usernam usernam usernam lol pictur
2753,wait realli hot shut ac instal usernam obx port alreadi taken wnumber line place ynumber adam northern california usernam spend number hour togeth phone realli bond pictur
2754,usernam httpaddr
2755,usernam usernam usernam neat open hous door car doubl check back door lock bed turn ac bed lot bed lol
2756,leav usernam repair httpaddr pictur
2757,usernam key fail get brilliant
2758,usernam usernam face tear joy orrrrr send outsid way call dog day summer
2759,usernam usernam next upgrad nest cam includ forcefield tech ensnar crook hashtag head easi pick
2760,usernam suggest would cool api enrol flow tailor toward person usag requir overhead commerci app setup need fill websit support url product descript etc autom home instal
2761,usernam usernam poor pupper sign cat antifa loudli cri face
2762,usernam day like end go buy ten usernam project
2763,new usernam hello video doorbel qube test bed today hashtag put product specifi use pace make sure deliv best qualiti user experi client q u b e n httpaddr pictur
2764,hvac contractor like smart thermostat case usernam involv put bullet find lousi control even pleasant homeown use httpaddr
2765,usernam usernam usernam nest protect two differ warn one smoke anoth carbon monoxid never gone tap run test show warn also mine number
2766,usernam earn number usernam leaf june number area thermostat help save httpaddr hashtag
2767,usernam usernam usernam thought appreci httpaddr
2768,usernam usernam oh ye know situat well
2769,usernam usernam usernam usernam usernam dude connector use wire crimp end
2770,usernam promptli thank
2771,usernam usernam numbersuperstar usernam pretti good also
2772,usernam usernam usernam usernam mandat qualifi contractor instal
2773,usernam look like servic
2774,usernam usernam kama cat face
2775,thermostat keep turn hashtag usernam better get technolog togeth usernam
2776,usernam usernam thank make home complet secur alarm lock sensor lock went offlin support figur go back simplisaf
2777,usernam usernam usernam tri get nest thermostat talk one ewelink switch take forev sync advis
2778,usernam earn number usernam leaf june number area thermostat help save httpaddr hashtag
2779,usernam usernam lol probabl measur deliveri per hour
2780,usernam usernam smoke alarm kitchen
2781,okay usernam sort outdoor weatherproof power socket stick practic pictur
2782,usernam wow someon need parent child otherwis afraid better lock car key one drive number month
2783,usernam want warn consum compani worst custom servic would recommend purchas product hold hour
2784,usernam usernam usernam stupid
2785,usernam app suck amateur crash shit
2786,usernam nest protect work either product useless
2787,usernam usernam usernam well anoth number marriag miss intern friend number ask water number wait sun porch vika come home night
2788,usernam got temperatur sensor want say setup easi pleasur well done thank bedroom much comfort summer
2789,usernam made day look like grandson
2790,usernam stockhold employe happi custom coupl year run quit certain smart thermostat pay energi save coupl hot summer month spend money save lot money long run
2791,usernam want custom wait happi lose im rude get ask question custom easier say would wait realli want hashtag batteri version soon
2792,usernam _itsjp phew oven ruin
2793,use usernam watch kid get terror use _rachio spray play backyard hour away peak number usernam pictur
2794,usernam usernam
2795,usernam pictur
2796,usernam love new outdoor cam ever one power via poe hardlin network better speed
2797,yokymatsuoka innov usernam hashtag pictur
2798,hey usernam gen number thermostat furnac blower flick everi second c unit continu run pro said replac mani gen number unit issu updat push prevent
2799,thank usernam featur hashtag hashtag hashtag stun modern develop complet w option add usernam tech home packag read httpaddr hashtag hashtag hashtag hashtag
2800,usernam servic suck
2801,laugh ass usernam usernam outdoor iq pick daddi long leg alert see person everi time check person creepi leg hahaha
2802,usernam may allah count us among pass true way usernam presid
2803,usernam hold moneysymbnumberk order hostag number number week one item back order appar polici prevent employe right thing hashtag
2804,usernam usernam set use locat inform precursor record set record home anyway
2805,usernam usernam log nest cam mobil applic websit wifi lte keep get long wait prompt sent back sign screen reason someth go
2806,useless yet fun video put togeth yard work yeah right yard work number cup coffe hand enjoy usernam hashtag watch httpaddr
2807,usernam hoy hashtag del hashtag usernam protect number gen el mejor detector de humo co del mercado os lo vai httpaddr
2808,usernam usernam doorbel nest hello expens franc number usd number eur sell nest hello number eur price one includ afford
2809,usernam usernam omg feel bad u nest face tear joy
2810,usernam usernam realli like new set screen much prefer rotat icon option interfac via account choos perhap even make user customiz
2811,usernam absolut worst custom servic usernam hashtag
2812,think get proper hashtag tuh hous usernam usernam
2813,usernam better question spear wall
2814,usernam usernam buy honeywel wifi thermostat put app phone control
2815,usernam usernam link smoke conumb detector outdoor camera way could voic signal peopl pass potenti hazard call emerg servic
2816,alway top knowledg usernam hello event stadium mk hashtag hashtag hashtag pictur
2817,usernam april use number less hour energi march thank usernam thermostat httpaddr hashtag hashtag
2818,usernam earn number usernam leaf june number nester thermostat help save httpaddr hashtag
2819,usernam usernam httpaddr
2820,omg hold usernam hold music worst enough drive mad guy tri anger custom annoy music hashtag
2821,hashtaghashtag devanagari sign virama nnb devanagari sign virama rh devanagari sign virama m_kbiironli kabir creator creation worthi worship worship usernam usernam usernam usernam usernam usernam pictur
2822,usernam send sampl one
2823,usernam usernam realli nice could allow siri control thermostat
2824,purchas instal usernam secur easi instal pretti disappoint wish could hear base station announc door open way quiet option increas volum moneysymbnumb price point expect much thank god return
2825,purchas ring doorbel day get deliv usernam releas hello gut wait age hello releas give need video doorbel
2826,usernam usernam usernam pictur
2827,usernam curios way unlearn familiar face
2828,tfw one usernam camera power sure hell catch two ruffian throw rock front door tri steal bike expressionless face expressionless face expressionless face expressionless face expressionless face
2829,usernam nest youtub channel got termin caus see pictur
2830,usernam usernam number number optim
2831,one product absolut satisfi usernam work sinc wifi upgrad load time video playback fantast around excel user experi thumb sign emoji modifi fitzpatrick type number number
2832,usernam suppos reli alarm system app go everi day
2833,usernam hashtag kitti kitti kitti second thought mayb pictur
2834,usernam usernam thank god neighbor concern privaci right els would found car face roll eye
2835,today shell shocker usernam learn thermostat number gener moneysymbnumb httpaddr pictur
2836,usernam usernam number night row cool work pictur
2837,look exactli like beach usernam pictur
2838,one enough bandwidth usernam dsl line properli oper usernam iq camera tell usernam deliveri driver sit tight unlock door use usernam smart lock drop packag hashtag pictur
2839,usernam hold long even use usernam yale lock none code work pictur
2840,usernam may use number less hour energi april thank usernam thermostat httpaddr hashtag hashtag
2841,usernam usernam everi man relat bro
2842,usernam earn number usernam leaf june number area thermostat help save httpaddr hashtag
2843,hey usernam usernam previous bought two nest thermostat number nest protect bought instal two nest yale door lock consider ad lock unlock capabl appl watch app would use lte watch user thumb sign person fold hand
2844,usernam usernam pictur
2845,usernam usernam great
2846,usernam _antnumber_ pictur
2847,usernam usernam usernam usernam okay egg georg go anonym sourc admittedli know noth product purchas advic
2848,usernam thermostat instal hashtag nj call txt number number number anytim number number fast free quot heavi black heart like work pleas follow us white point index hashtag hashtag hashtag httpaddr
2849,usernam usernam sound like fun
2850,usernam got plenti stock usernam httpaddr httpaddr
2851,usernam usernam need pad cell
2852,usernam usernam happi engag week rocket get hashtag follow httpaddr
2853,usernam usernam long term loan
2854,usernam unamus face rt usernam wife cook hashtag thank usernam quickli inform need supervis hashtag pictur
2855,usernam black heart suit usernam thermostat smoke carbon dioxid detector think ad hashtag next
2856,usernam anyth usernam
2857,usernam usernam usernam usernam usernam usernam thank hashtag profession
2858,usernam unter druck der mitbewerb jetzt kommt smart klingel in vernetzt hau httpaddr pictur
2859,usernam cool face scream fear httpaddr
2860,usernam close deal hook custom usernam super excit find go pay less get sparkl heart sparkl heart sparkl heart hashtag hashtag hashtag hashtag hashtag hashtag hashtag hashtaghero hashtag pictur mt vernon sq number st convent center metro station
2861,big shout usernam saw poor nan fall could rewind see happen tell mic help way wait paramed send video incid doctor saw happen hashtag hashtag
2862,usernam usernam usernam hahaha ye
2863,usernam usernam
2864,usernam would gladli pay moneysymbnumb even moneysymbnumb garag door open work number time least one beep million time someth goe wrong resolv problem quickli phone gravi nest interest
2865,vaa krishnamurthi usernam present hashtag googl hashtag know sure usernam hashtag stay opinion revolutionari protocol make iot easier safer enforc right way httpaddr
2866,usernam love see way hashtag hashtag earn number usernam leaf june number area thermostat help save httpaddr hashtag hashtag
2867,usernam thing wireless report smart meter instal snoop invas util compani thank
2868,averag memelord level usernam damn high usernam number
2869,hashtag protect custom home busi usernam hashtag flex bicep come visit usernam usernam connect hashtag pictur mobil
2870,thank usernam instal usernam hashtag usernam see door without look window hashtag
2871,usernam woke morn power outag reward rush hour afternoon oop forgot notifi us number outsid comfi number insid dog hashtag pictur
2872,usernam usernam agre love upgrad number new design temp sensor compat idk moneysymbnumb current one work
2873,anyon actual know usernam leaf realli mean
2874,usernam usernam usernam yike congrat grow famili
2875,usernam usernam usernam tire face
2876,usernam _steveab usernam mani leaf year
2877,usernam usernam usernam refrain retweet doubt farm fresh mortifi like rest us fuck deliveri driver hope karmic retribut follow pain life httpaddr number shitstain human number
2878,watch hashtag usernam httpaddr
2879,usernam hi would nest indoor camera alert dog move around start bark
2880,usernam usernam
2881,usernam usernam usernam need kind real time messag servic
2882,usernam use hi g
2883,usernam usernam far good leaf flutter wind
2884,usernam usernam usernam usernam usernam usernam usernam usernam schaan region indic symbol letter l region indic symbol letter liechtenstein say xx face throw kiss
2885,usernam usernam app still work pictur
2886,usernam chanc night mode io app would great switch automat sun set
2887,usernam wife number kid want thank fals fire alarm sound hour night day multipl day amaz tri calm fear product expens garbag work hashtag hashtag
2888,need pull trigger one temperatur sensor thermostat downstair hall upstair offic still get littl toasti buy usernam though total worth
2889,one reason despis drm among mani other someth usernam httpaddr
2890,usernam know power richmond hill usernam
2891,usernam usernam must veggi garden sprinkler tweet think face
2892,usernam usernam take hammer thing like awan hillari subpoena
2893,usernam usernam usernam usernam usernam interest consid get nest probabl given inform
2894,usernam love camera quit honestli usernam much usernam free cloud storag level plan compet
2895,usernam get era soooo burdensom carri key realiz woman carri babi insid bodi number month honey womb free need someplac put key
2896,usernam hello anoth great review worri instal give mr electr call instal competit rate httpaddr pictur
2897,usernam sure
2898,huge shout jr hashtag support center senior support associ stay phone hour turn error fault never short discourt say usernam best technic support ever use
2899,usernam usernam nest thermostat worth think reason want chang temperatur hous whist odd occas mayb
2900,usernam usernam usernam one mate chang realli almost boiler compat due work like normal thermostat
2901,usernam wait usernam app start work hashtag pictur
2902,usernam usernam usernam bought yet rakutan sale moneysymbnumb today
2903,usernam usernam usernam joe area manag ask rememb date infract way could better determin carrier rout day rd
2904,usernam video doorbel usernam one
2905,usernam fyi vacat littl cayman dive boat dive read heatwav boston use app turn c kitti home ok ok hand sign pictur
2906,live footag tri troubleshoot usernam pictur
2907,usernam hi nest author draw product design tri reach design team want includ case studi nest product develop cycl second edit book hard time get design help
2908,usernam usernam usernam love see
2909,usernam psnumber far expens hashtag offer psnumber last week
2910,usernam manag thermostat keep say servic avail
2911,usernam ye
2912,usernam awar usernam servic cam work
2913,usernam usernam usernam alreadi thought wear pant pictur
2914,usernam usernam usernam achiev energi save program much cheaper thermostat peopl need stop lazi stupid
2915,usernam usernam ye unplug
2916,great job usernam doorbel perform flawlessli need face roll eye hashtag pictur
2917,last day hashtag still time enter chanc win usernam hello hashtag hashtag pictur
2918,usernam hi come best camera live feed half green bottom make useless
2919,usernam usernam usernam hi michael right hope abl use nest sensor futur temp sensor ecobe sensor work hub app
2920,hot shop new home week usernam set numberdegf model home gardner grove httpaddr usernam numberpm numberpm sat sun numberpm numberpm wfree air condition home damson crest httpaddr
2921,usernam usernam usernam lmao face roll eye like shit alil crispi
2922,usernam usernam usernam usernam work homekit
2923,usernam usernam im boat nest app got nest wouldnt go downstair arrrg
2924,merci enorm usernam de avoir fait parvenir la nouvel nest cam iq exterieur pour mon hashtag usernam usernam httpaddr pictur
2925,usernam whoever design ui app fire use case basic everi video base ui user want defin point save clip get want save surplu miss footag see evil monkey
2926,usernam caught hashtag httpaddr via usernam
2927,congrat usernam usernam truli terribl custom support spent moneysymbnumberk product half arriv hour w custom servic later apolog figur dont blame us phone number ship compani show
2928,hey usernam servic
2929,usernam usernam big problem system turn nest cam monitor babi updat go fix
2930,everi time bird fli near usernam doorbel get alert phone know mad bird amaz doorbel qualiti
2931,usernam usernam ac went last month never made past number degre believ
