,tweet
1165,thank give peac mind keep famili safe usernam hashtag
1166,usernam love product big fan chanc get stand alon home base screen allow see camera accessori without use phone pleas
1167,usernam usernam httpaddr
1168,usernam usernam absolut amaz wow
1169,anyon feedback usernam hello current usernam doorbel tire video crash slow respons speed assum custom servic answer sinc stop respond
1170,usernam disabl notif usernam camera much use mani fals alarm
1171,usernam usernam crap appl homekit support great product support understand take time appl homekit around year pictur
1172,come see team usernam next week let talk hashtag hashtag win usernam secur system hashtag hashtag usernam httpaddr
1173,usernam usernam iya dong yuan de nihaxian zhou gamatsukusunanod hakohada kikushinakutemo
1174,usernam usernam instal alarm system today make feel good purchas
1175,usernam usernam
1176,today privileg firesid chat usernam cto usernam usernam break women silicon valley womenom japan confer usernam pictur
1177,usernam usernam wait hold number minut help nest yale lock ship wrong part respons number week later terribl custom servic base invest
1178,usernam ur app big disappoint nest promot save energi yet limit histori number day shame u hashtag
1179,usernam usernam go bigger monster
1180,forget turn bedroom light electr light bulb left hous hous garden flip switch work friend even vacat usernam usernam use app phone control electr cool secur well pictur
1181,usernam usernam safari usernam usernam usernam strong name entic us dig deeper tri understand stori start gabriel zamora explor metaphor make power name via usernam black rightward arrow httpaddr hashtag pictur
1182,usernam ever sinc ad camera seem keep thermostat onlin daili frustrat pictur
1183,love get monthli report usernam httpaddr
1184,today shell shocker usernam secur alarm system starter pack moneysymbnumb httpaddr pictur
1185,usernam definit tell differ old compani like usernam new compani usernam nest peopl spent hour phone tri get someth work carrier call carrier basic thermostat support basic f moneysymb
1186,usernam import googl home work well servic disney fairytal stori us sinc nest iq cam googl assist vs wonder nest hello work well outsid us googl home
1187,stalk husband usernam cam play fortnight pictur
1188,disappoint usernam dropcam stop work basic told usernam bad got bought shrug zero width joiner male sign
1189,usernam check usernam power project great design anim httpaddr congrat usernam great work award hashtag hashtag pictur
1190,usernam usernam usernam usernam usernam usernam moge ci polec usernam na start dostaniesz numberzl ode mnie
1191,usernam hello love nest smoke detector thermostat thursday night fridg caught fire nest system save us could add nest spoken word laundri room pictur
1192,usernam home doorbel goe offlin way frequent multipl time per week number minut time wifi great cut power restor resolv issu hard reboot tip
1193,usernam though realli see discern pattern nest seem disagre optim temp meh
1194,usernam usernam ever batteri version like put one door power one
1195,usernam work alexa echo
1196,usernam best showcas usernam app show thermostat much app nice integr option system like usernam make httpaddr
1197,usernam usernam usernam
1198,usernam usernam wors product custom servic talk multipl peopl number hour solut number degre hous way want spend friday night
1199,usernam welcom villag httpaddr
1200,usernam usernam usernam love googl home mini big brother go hear lot bad joke usernam face tear joy smile face heart shape eye
1201,marbl homewar rang current sale websit altern come make one day workshop httpaddr come creat littl set httpaddr
1202,usernam usernam everi week random huge temperatur chang thrown pleas help pictur
1203,set new usernam cam terrifi wife catch nap afternoon flush face
1204,nest power project nest social caus project rais awar number million struggl high energi bill us httpaddr usernam usernam
1205,usernam usernam usernam usernam love luca thank share
1206,usernam usernam usernam pictur
1207,usernam usernam nice video danni think silent doorbel schedul would nice addit nap time silenc face recognit piec nice
1208,usernam httpaddr
1209,usernam make easi nosi lazi
1210,usernam sure
1211,usernam usernam glad saw order one today cancel buy one holiday
1212,read usernam ad anthem httpaddr pictur
1213,usernam usernam put hold let know cost tomorrow stand
1214,usernam usernam product free product
1215,usernam pick default face would still nice addit thumb sign
1216,usernam eta get nest servic back run
1217,usernam usernam outsid camera onlin hello thermostat still offlin
1218,usernam avail date europ thx
1219,usernam usernam usernam usernam usernam usernam pay attent continu act smart make look bright
1220,usernam usernam usernam must motion activ take least number second start
1221,usernam usernam googl
1222,usernam usernam usernam guess usernam one either usernam compani use great throughout unfortun product servic terribl
1223,usernam best invent ever get bed need turn ac lower person rais hand celebr emoji modifi fitzpatrick type number
1224,numberurbanbuild usernam usernam usernam back tool today busi panel front room paslod blackanddeckerhom festool merciecaltd aplaceinthesunoffici usernam usernam usernam numberurbanbuild hashtag httpaddr
1225,phone usernam think thermostat fire lightn strike yesterday attempt see fixabl replac damn difficult dude want repeat bred
1226,usernam usernam husband joke want thing pictur
1227,usernam usernam
1228,usernam blue heart green heart
1229,usernam think app phone utilis numberd touch come
1230,usernam usernam girl come ga number everyday get use
1231,usernam usernam best
1232,usernam usernam usernam need fan would lot work want
1233,usernam usernam yeah auto eco away mode stupid recov number bedtim matter kind ac stay cool pc
1234,usernam low email promo introduc temperatur sensor usernam wonder realli enjoy nest line product click low websit immedi buy one new gadget
1235,usernam usernam temperatur sensor avail uk us month
1236,usernam usernam
1237,usernam usernam lmao
1238,usernam usernam start issu
1239,usernam guy make sound like found clip littl creepi
1240,usernam look like everyth back onlin thx
1241,usernam usernam usernam everi day angri face
1242,usernam usernam need purchas anoth usb c usb c cabl iq outdoor nowher onlin seem sell numberft cabl hashtag
1243,usernam great anoth devic that app number year alreadi
1244,usernam usernam netj zag namelijk dat het bij coolblu nog pre orderen
1245,usernam usernam wife quick reassur fine male cook hashtag would alot messag usernam hashtag hashtag hashtag hashtag hashtag etc grin face pictur
1246,usernam denk je er na om de usernam video deurbel aan te schaffen en je beltrafo niet geschikt met de volgend trafo dit eenvoudig aan te passen hashtag hashtag hashtag httpaddr
1247,dope usernam offer train code set app httpaddr
1248,usernam got new outdoor camera keep get error code number tri connect follow troubleshoot instruct still error
1249,usernam april use number less hour energi march thank usernam thermostat httpaddr hashtag hashtag
1250,usernam usernam face tear joy face tear joy
1251,usernam right hacker unlock door robber friend
1252,chang manag scari ceo usernam recent step step away own compani usernam firm reorgan without lose great peopl httpaddr
1253,usernam usernam usernam usernam usernam hashtaglif grin face marshal dr pete check httpaddr shoot us dm inform love welcom rachio famili lo rachio team
1254,usernam usernam wait croc pictur
1255,product httpaddr read mind usernam heavi black heart hashtag
1256,usernam door lock bell protect camera yesterday save hous biz trave open door fireman spoke bell abl stop fire time awesom nest life pictur
1257,usernam better free retro game httpaddr
1258,usernam usernam thought usernam thermostat minut face palm emoji modifi fitzpatrick type number number zero width joiner male sign
1259,well due lack interest custom requir shortli sell usernam doorbel buy usernam perman record
1260,usernam usernam save number number number number kwh enough energi shave everi man face number number time number movemb fals hashtag
1261,still think great help usernam last night appreci help
1262,usernam anyon els unabl get energi histori iphon app sinc last week wednesday open app energi histori indic come back tomorrow see thermostat well tomorrow come gone
1263,usernam caught hashtag httpaddr via usernam
1264,usernam rrrrr
1265,usernam thermostat last product buy need connect server connect thermostat glad chose blink camera abl connect thermostat pay bill seem unreason
1266,usernam usernam need
1267,usernam usernam save number number number number kwh enough energi power electr bike everi dad america number number mile httpaddr hashtag
1268,usernam usernam usernam welcom
1269,usernam choos someon great hardwar plan softwar buy hardwar go cool obsolet usernam usernam hashtag hashtag
1270,realiz number number number yr old usernam glitch like design flaw usernam requir power extend kit instal home without common c wire steal havoc power glitch temperatur differ larg httpaddr
1271,usernam wow great unexpect much appreci long term nest custom thank
1272,usernam usernam usernam usernam buy ring doorbel work alreadi
1273,usernam hey usernam pitch black dark room nest thermostat turn absolut reason devic go dim max bright blind
1274,usernam usernam usernam usernam usernam mine never learn anyth
1275,usernam usernam would ever thing fear face anyway lyyi lauren till edg heart revolv heart revolv heart revolv heart
1276,usernam need one contact asap brought usernam usernam thermostat store suppos come free usernam home mini per site never receiv one call cust serv woman confirm ship number system downward black arrow wud call bak never
1277,usernam usernam love home
1278,usernam usernam usernam welcom team
1279,usernam studio usernam materi releas worldwid soon pictur
1280,usernam usernam usernam usernam rear flue boiler look much neater top work
1281,usernam usernam usernam ok thank creat gmail filter solv problem internet cam flakey got dozen email per day
1282,hey usernam number peopl today push camera actual doorbel button chanc creat sticker put button peopl know ring pictur
1283,usernam httpaddr
1284,usernam address question transpar
1285,like usernam decid turn whenev want even crank way cold hashtag
1286,usernam newest piec look usernam hashtag devic model compani succeed hashtag httpaddr pictur
1287,usernam awesom usernam usernam surveil equip usernam check hashtag right roll call laugh usernam httpaddr
1288,usernam usernam usernam usernam presid usernam big bird usernam receiv lifetim achiev award momentum tech confer hashtag hashtag hashtag hashtag hashtag hashtag hashtag hashtag httpaddr
1289,usernam usernam thermostat great though pretti much forgotten set temperatur sinc work well nest ring new addit great see hous happen town
1290,number min phone far hold tech support usernam usernam hashtag
1291,usernam usernam appl homekit ecosystem hous instal homebridg asap incred miss link run spare raspberri pi ask siri control thermostat yay httpaddr
1292,oh shame look great finger cross earli number usernam
1293,usernam usernam even poopl snoot
1294,usernam usernam usernam nest add support yeah plausibl
1295,usernam realli realli realli realli realli realli need start work split system
1296,usernam usernam usernam sorri hear david onlin command reli connect enabl moneysymbnumb interact monitor plan also plan award win monitor servic cellular backup smart alert unlimit simplicam record includ
1297,well usernam outdoor power suppli ate even year guess technolog tax
1298,moment get first usernam cam keep track doggo realiz current homeown hous negoti final detail heard everi word said hous replay mani time want flush face hashtag
1299,usernam usernam bother mean entertain ye roll floor laugh
1300,usernam way check indoor humid histori
1301,usernam usernam go nest thermostat great better yet use nest cam product bundl well control one app play
1302,usernam usernam number way hot messs number pool drink numberbarrelbrew littl old usernam
1303,usernam usernam seem like everyth servic statu websit say normal use camera babi monitor secur camera ok especi sinc pay extra subscript
1304,usernam someon help get info replac ship usernam help iv go round round support agent number day info ship
1305,spot usernam thermostat pictur beauti design keep comfort help save energi secret dvele home compat usernam product pictur
1306,usernam usernam support homekit trash put litter place symbol
1307,usernam usernam poor bart man persev face
1308,usernam hashtag hashtag hashtag usernam httpaddr via usernam
1309,usernam receiv shed hashtag hashtag email hope vendor hashtag well usernam usernam httpaddr
1310,love wake power weari face hous hot control usernam
1311,gold foil frame never shine bright sparkl thank gorgeou photo httpaddr pictur
1312,usernam awesom heavi black heart technolog
1313,usernam usernam similar problem account sinc dropcam delet account reset work twice made chang side incident lot problem dropcam think newer servic layer cam blow bad expr
1314,usernam usernam awesom thank
1315,usernam usernam usernam like abl lock nest certain temp rang housem eff day home also give prop number year warranti origin number gen die number year sent refurb number gen replac
1316,usernam sent dm thank
1317,usernam usernam run woman go smile face open mouth
1318,usernam usernam updat app scrub abil video stream stop work help
1319,usernam april use number less hour energi march thank usernam thermostat httpaddr hashtag hashtag
1320,usernam minut nov number hashtag httpaddr via usernam
1321,got phone adam usernam custom servic awhil sinc treat well custom compani good job nest adam clap hand sign emoji modifi fitzpatrick type number
1322,featur energi poverti person stori hard number usernam hashtag put issu map hashtag hashtag httpaddr
1323,happi hashtag mani smart innov compani help make hous build comfort safe energi effici usernam usernam usernam usernam usernam _rachio usernam usernam pictur
1324,usernam nest look creat product help hashtag httpaddr
1325,usernam make great paper weight set httpaddr
1326,usernam usernam usernam move bigger place
1327,usernam ye think michel said call nest amaz
1328,usernam earn number usernam leaf june number nester thermostat help save httpaddr hashtag
1329,oh man spent last number minut laugh loud hashtag clip great laugh usernam keep
1330,usernam cam truli captur import moment live pictur
1331,becom popular product usernam rate usernam rang httpaddr hashtag hashtag usernam httpaddr
1332,usernam usernam mean imagin home invas happen want camera record possibl even though concern happen away
1333,usernam thermostat stay charg long happi
1334,usernam usernam usernam hashtag front door get front coz face tear joy pictur
1335,usernam make nest thermostat brass pleas hashtag
1336,usernam usernam look usernam
1337,usernam usernam add list
1338,trust usernam instal usernam thermostat httpaddr httpaddr origin ac unit brand new hous wont power httpaddr told next open schedul next wed im call civil lawyer sue defens laywer fix ac tomorrow
1339,usernam usernam usernam hope stuf anim look pretti real video
1340,watch happen number number usernam broadcast watch hashtag usernam httpaddr
1341,multipl music note live futur multipl music note usernam pictur
1342,usernam usernam usernam everybodi aliv usernam drink enough water worri fear face
1343,wish usernam would partner health system get cam nicu parent could see babi use temp code someth auth hate abl see littl guy hashtag hashtag hashtag
1344,mani custom usernam lose get board appl know least one know mani product would buy think face
1345,usernam wait turn chat hour got number inlin app froze number line
1346,servic like usernam usernam seem work well want make sure usernam hardwar
1347,usernam usernam awesom
1348,inconveni tri deliv messag thank clever doorbel usernam httpaddr
1349,hot af thank god usernam come home nice cool home
1350,usernam cute dog run loos get hit car
1351,moment usernam locat servic continu flawless usernam homekit continu buggi come appl make product let verifi work correctli accur pleas hashtag pictur
1352,hey usernam feel like program temperatur sensor devic allow window usag set hour section day bed number number earli set temp bedroom
1353,hey usernam pleas brethren act peopl respect to fine print therein willli nilli product consum product must correct httpaddr time stand right side histori httpaddr
1354,usernam usernam close speak loudli distract leopard scare impala
1355,usernam earn number usernam leaf june number area thermostat help save httpaddr hashtag
1356,usernam person dress thing
1357,usernam stock latest hashtag product shop inventori usernam product today httpaddr pictur
1358,usernam dertermain tenaci kid
1359,usernam seem way find serial number without take camera
1360,usernam usernam heat system number cam bring expens doorbel crazi whoever decid psnumber cheap along us find none exist transform mad cancel subscript cam go back free servic
1361,usernam usernam away mode alway turn forget near home
1362,usernam usernam never buy use product
1363,bought first iot devic home usernam protect decid perfect ecosystem eventu go buy usernam number mean need buy number parti hub detector trigger hvac fan emerg
1364,usernam usernam yea think year scare tactic busi weirdest thief ever heard tho switch bike seat
1365,usernam flaw logic set number leav hous time sound check protect schedul set thermostat lower time hashtag hashtag
1366,usernam cool thank let know
1367,usernam usernam checkout lose usernam payment option hashtag subscript cart get abandon cart
1368,usernam _mnumber mr arab letter alef arab letter alef lw arab letter alef hd l arab letter alef zm yhdi arab letter alef lnyrd arab letter alef lli bd arab letter alef khlh
1369,nest smoke detector went crazi today shut shut connect thermostat sure smart home technolog hashtag usernam
1370,usernam usernam oof need know get usernam german qualiti usernam
1371,usernam usernam thank mate hope well
1372,usernam usernam usernam usernam usernam done
1373,usernam system camera thermostat protect unavail
1374,got usernam camera instal never life ever interest monoton thing happen near front door
1375,sinc upgrad latest version nest app io get usernam usernam usernam pleas help pictur
1376,love usernam thermostat
1377,usernam usernam unsubscrib pleas way unsubscrib link without sign login josh httpaddr
1378,number classic number taken usernam number sure babi love hope let wifey sleep httpaddr
1379,usernam requir power tradit doorbel thu requir rewir electrician ugh
1380,usernam made big mistak doorbel batteri pack one uk wire door bell
1381,usernam custom servic answer phone call good need assist
1382,instal two usernam protect smoke co alarm httpaddr
1383,usernam activ timelin black except motion happen number best cam numberpm yesterday
1384,shout usernam thermostat electr bill pass moneysymbnumb blast ac home old place tradit thermostat would moneysymbnumb bare home
1385,usernam usernam usernam thing us tri tri bother return three got ecobe work alexa love
1386,today shell shocker usernam learn thermostat number gener moneysymbnumb httpaddr pictur
1387,final got usernam time get rid thermostat hate grin face smile eye
1388,usernam usernam usernam thank much sweetest hashtag
1389,usernam still experienc tonight
1390,captur first crime move one usernam cam garag hashtag pictur
1391,usernam usernam honeywel programm awesom
1392,usernam servic
1393,usernam usernam usernam wanna replac wall hous yeti insul
1394,usernam usernam hahaha quit sure think daddi longleg spider
1395,usernam understand sign rush hour reward dont problem temp adjust temporarili point better solut like plug local electr outlet send wireless signal control board
1396,usernam usernam amaz face tear joy
1397,la disrupcion de tu modelo de negocio pued llegar desd cualquier flanco usernam hashtag usernam hashtag han entrado de lleno en el negocio de la seguridad en el hogar la empresa pictur
1398,month swap one thing start bill cycl see impact two biggest chang usernam thermostat bill drop moneysymbnumb usernam bill drop moneysymbnumb number month nest pay number year bulb
1399,usernam thank
1400,usernam usernam
1401,usernam usernam usernam either way usernam definit want one
1402,usernam funni
1403,usernam usernam ridicul
1404,usernam usernam focu temperatur control door bell someth plan
1405,usernam usernam usernam usernam make good point big compani play game goe way perfect littl consum world would like see interoper platform may best devic win
1406,usernam next time buy usernam
1407,instal usernam camera offic smart simpl hashtag
1408,usernam usernam wow judg say court usernam sew copi whole interfac concept usernam
1409,usernam come soon
1410,hey usernam got eta ad usernam partner
1411,de poezen hebben aan de usernam thermostaat gedraaid gevolg ding staat al uren op number graden echt bizar heet binnen pensiv face
1412,usernam add doorbel lose thermostat wish usernam would fix compani noth problem support terribl favor get usernam usernam wish ugh hashtag hashtag hashtag
1413,hey usernam usernam usernam whoever charg reset camera obv box came pictur
1414,usernam usernam cya loudli cri face loudli cri face wave hand sign emoji modifi fitzpatrick type number number
1415,usernam usernam issu
1416,usernam tri use usernam home away assist caseta nest cam detect person away light turn make look like home hashtag hashtag httpaddr pictur
1417,usernam yep updat work number sec realli start lose trust usernam inconsist
1418,usernam loudli cri face cri
1419,usernam usernam usernam oh extrem uncool hope make right httpaddr flip side holi smoke congrat addit famili
1420,look usernam usernam eye httpaddr
1421,usernam usernam one never stop hate hard control think smarter turn heat ride home airport time nice mostli stylish look piec crap
1422,usernam need child lock close lock key cabinet
1423,usernam hi john tri altern easier send dm usernam
1424,usernam yoki matsuoka googl nest help save money energi usernam via usernam httpaddr
1425,hey usernam numberlb dog person want notif someon intrud home dog decid lick ass
1426,usernam usernam usernam programm thermostat number year best
1427,usernam pick usernam recent bum voic control limit googl assist chang temp unl away mode ask turn ac start drive home would awesom
1428,usernam usernam pictur
1429,usernam usernam hello video doorbel solv problem check review httpaddr hashtag pictur
1430,usernam custom support httpaddr time complain camera offlin cut httpaddr httpaddr doldno servic custom servic fragment
1431,usernam spent last two day phone tech support keep told call back resolv problem still rec call back yet custom support indiffer guess return thermostat go usernam instead
1432,usernam usernam smart home httpaddr
1433,rewir thermostat support usernam bought minor home improv make feel like man
1434,anyon know usernam hashtag connect compat usernam usernam usernam
1435,usernam usernam good
1436,usernam thermostat usernam self drive car next subway car individu regul temperatur ice box summer usernam hashtag
1437,usernam usernam usernam read full thread believ cheek nest select repli best answer despit address issu hand realli drop ball
1438,usernam usernam thought touch thermostat everi dad ever
1439,usernam usernam pictur
1440,usernam usernam thank help perspect go investig hous next weekend see thermostat actual
1441,usernam usernam usernam usernam usernam usernam usernam usernam usernam usernam usernam usernam usernam usernam usernam attach dyson vacuum cleaner use gentl suction place need hook via ifttt alexa googl assist siri integr alexa flip pillow cool side
1442,usernam usernam usernam usernam
1443,lmao dope rt usernam wife cook hashtag thank usernam quickli inform need supervis hashtag pictur
1444,stupid usernam fine weather okay break yet moment might actual need heat dri wet cloth scotland august regret purchas tech buy past year pensiv face pictur
1445,usernam hi tri subscrib nest awar sever hour store constantli back thank
1446,usernam usernam address yet would thermostat bottom realli screw seem like realli poor layout
1447,usernam may use number hour less energi april thank usernam thermostat httpaddr hashtag hashtag
1448,usernam get stuff togeth app hashtag hashtag
1449,usernam usernam tri logitech cam
1450,usernam usernam
1451,usernam usernam ball chain
1452,usernam usernam hey angela pretti great surpris enjoy nest thank choos veteran energi
1453,hi usernam nest x yale avail uk market
1454,usernam usernam usernam usernam number dog
1455,usernam
1456,usernam recommend _rachio sprinkler autom work usernam httpaddr add use httpaddr yard use number gallon tank use varieti liquid fertil think good number number year sinc own one
1457,usernam usernam intens emot roller coaster first tweet readi
1458,crap rain hashtag intens today rainwat gutter knock number usernam hashtag thank good highway bar usernam instal zero damag video caught usernam camera
1459,usernam usernam tag wrong compani hint face tear joy pictur
1460,usernam usernam runway car
1461,usernam someth wrong deal usernam hashtag hashtag
1462,get hashtag readi summer moneysymbnumb usernam usernam hashtag httpaddr hashtag pictur
1463,n hashtag usernam gone httpaddr pictur
1464,yesterday httpaddr find stove entir time entir hous fill ga detector batteri dead boy fine let mistak like happen upgrad usernam protect system
1465,usernam usernam yeah get toss get lean toward hardwir one thank smile face smile eye
1466,usernam usernam cool either someon toss cat fell neither funni stop promot
1467,usernam eurosong op groot scherm usernam iedereen welkom kom feesten met on hashtag pictur
1468,usernam usernam happen server network work fine us connect server
