,tweet
4886,usernam usernam usernam dumb face tear joy pictur
4887,usernam usernam pictur
4888,usernam usernam
4889,pleas usernam perform come see tour modern day save
4890,hashtag crown usernam went black heart
4891,usernam usernam de nada ahr que jajaja
4892,usernam everybodi nola drive downtown bump queen princess emoji modifi fitzpatrick type number issahit
4893,usernam llc stand long live cardi
4894,usernam face open mouth cold sweat face open mouth cold sweat face open mouth cold sweat face open mouth cold sweat queen song good pictur
4895,young endors messag usernam httpaddr
4896,usernam usernam usernam usernam usernam stop second line like damn writer behind pictur
4897,usernam would love usernam album togeth weari face would epic hashtag hashtag
4898,track queen necklac order usernam
4899,usernam peep chun li vibe give llc nicki realli snap album bodi work periodt eye dagger knife fire hashtag hashtag hashtag hashtag hashtag hashtag hashtag hashtag hashtag pictur
4900,usernam goe queen realli goe barbi dream reppin barbi ting tea shade b tch offens ms minaj may god continu bless journeri place truest regal queen rap crown pictur
4901,thought knew haha guess thought knew well babi guess queen usernam
4902,usernam releas queen world httpaddr
4903,usernam _eternallymaraj fat ass fact
4904,liter fast forward usernam vers incred httpaddr
4905,usernam usernam usernam go tf awf
4906,pink friday queen drop usernam pictur
4907,usernam usernam te amo
4908,usernam si got damn nerv face roll eye
4909,usernam gonna pretend nicki minaj say bardi ganja burn
4910,usernam come traci chapman likea chipmunk come httpaddr
4911,usernam usernam addict song pictur
4912,usernam usernam tast jump queen deserv grammi heavi black heart crown unicorn face fire fire fire
4913,freitag ist endlich da heiss ersehnt neue album von usernam erschienen welch entwicklung die kunstlerin durchgemacht hat siehst du im video von massiv attack uber flame bi zu bed ist all dabei httpaddr
4914,usernam luchsh vam hurri dobavleniem k novym relizam al bom usernam hashtag hocho hocho pictur
4915,usernam say queen need talk pictur
4916,usernam usernam httpaddr hashtag hashtag hashtag hashtag hashtag hashtag usernam hashtag hashtag hashtag hashtag hashtag hashtag hashtag usernam hashtag
4917,everi time get high think usernam face stuck tongu wink eye know high day long hashtag
4918,play hashtag sinc drop love everi song album hashtag usernam
4919,usernam usernam usernam well pictur
4920,usernam love song nic weari face bop wish mad album pictur
4921,usernam need locat caus pictur
4922,coco usernam usernam fire heavi black heart
4923,usernam hashtag target exclus drop fire
4924,usernam usernam lmao call bs music
4925,usernam sooooooo gonna talk song whet pictur
4926,stop compar usernam usernam stop compar usernam usernam stop compar usernam usernam stop compar usernam usernam stop compar usernam usernam stop compar usernam usernam
4927,usernam usernam real queen rap
4928,usernam usernam httpaddr
4929,usernam usernam queen purpl heart
4930,usernam hashtag fire fire fire gotta get fire fire visual one clap hand sign emoji modifi fitzpatrick type number clap hand sign emoji modifi fitzpatrick type number clap hand sign emoji modifi fitzpatrick type number
4931,need roman tho long loudli cri face usernam httpaddr
4932,usernam usernam usernam legend
4933,usernam usernam usernam clearli lol bc find smile face open mouth cold sweat
4934,usernam ye ye
4935,usernam httpaddr
4936,usernam usernam usernam nah caus rehash play biggi hard white barbi dream alreadi get lot attent without singl gener
4937,usernam periodt
4938,usernam usernam usernam usernam usernam usernam usernam usernam usernam usernam would dope
4939,sure get usernam wallpap zedg premium hashtag hashtag hashtag httpaddr httpaddr
4940,usernam usernam thought fire face tear joy
4941,usernam usernam usernam usernam usernam usernam drake media team pull screenshot skull pictur
4942,usernam usernam love
4943,usernam hashtag album solid realli like song chun swae trash could left hook atroci
4944,usernam usernam usernam fact usernam trade ya big homi yall loyal street ever pull bx see understand never went hard speak bro
4945,nicki straight murder queen album smile face heart shape eye crown usernam got rapper sweat splash sweat symbol face tear joy
4946,usernam marri pl love u
4947,usernam usernam usernam pictur
4948,usernam mayun u gotta indecis ur handl chang mine usernam face tear joy
4949,usernam usernam usernam dead throw tweet casket
4950,usernam good form fire fire fire
4951,llc singl tho usernam
4952,pop ten got yellow usernam llc fuck bar bitch game monopoli ten yellow monopoli refer caus bitch shit hashtag
4953,usernam pictur
4954,usernam usernam help bebeharmon togeth hashtag hashtag usernam
4955,song pick even heard usernam favorit probabl everyon els well crazi hashtag shrug emoji modifi fitzpatrick type number zero width joiner femal sign
4956,usernam love
4957,usernam impress stay relev domin rap game femal rapper icon
4958,usernam usernam usernam usernam usernam usernam ever scream r u amish wtf ur attent buy stream sweetner platform august number sparkl heart sparkl usernam
4959,en parl de l album de usernam qui est sooooooo beauti heavi black heart je l ai gentiment achet sur itun et beh j en sui fier face tear joy smile face heart shape eye hashtag
4960,usernam went hashtag
4961,usernam usernam said got song futur releas soon
4962,usernam oh nic sorri beauti loudli cri face smile face heart shape eye
4963,usernam album fire
4964,chill listen usernam queen
4965,talk usernam album damn queen inde
4966,usernam usernam usernam usernam usernam usernam usernam usernam usernam pleas stop make dumb excus nicki stream femal list pint blank accept stay press
4967,new usernam album absolut incred start finish
4968,usernam usernam hashtag hashtag usernam
4969,usernam usernam usernam usernam least got babi name ever want kultur live way better
4970,usernam album slap x black heart
4971,nicki vote wait nicki wanna cri right usernam
4972,edit metadata barbi tingz make track number queen usernam pictur
4973,listen usernam new album hashtag httpaddr pictur
4974,usernam te amo face throw kiss two heart heavi black heart
4975,god woman name usernam
4976,usernam usernam yassss
4977,usernam pictur
4978,hashtag nickiminaj thank god hundr point symbol fire heavi black heart
4979,usernam pictur
4980,ever abl listen ever usernam
4981,usernam first day tour hashtag hashtag hashtag hashtag hashtag hashtag pictur
4982,favourit hashtag usernam pictur
4983,usernam si even know anyway next pictur
4984,usernam usernam usernam usernam usernam usernam cardi b fire fire
4985,usernam usernam nicki never disappoint heavi black heart
4986,dzo usernam fine asf httpaddr
4987,usernam usernam usernam usernam usernam usernam usernam qem
4988,usernam gave want queen album fire
4989,usernam put litter place symbol put litter place symbol put litter place symbol put litter place symbol put litter place symbol put litter place symbol put litter place symbol put litter place symbol put litter place symbol put litter place symbol put litter place symbol put litter place symbol put litter place symbol put litter place symbol put litter place symbol put litter place symbol put litter place symbol put litter place symbol put litter place symbol put litter place symbol put litter place symbol put litter place symbol put litter place symbol put litter place symbol put litter place symbol put litter place symbol put litter place symbol put litter place symbol put litter place symbol put litter place symbol put litter place symbol put litter place symbol put litter place symbol put litter place symbol put litter place symbol put litter place symbol put litter place symbol put litter place symbol put litter place symbol put litter place symbol put litter place symbol put litter place symbol put litter place symbol put litter place symbol put litter place symbol put litter place symbol put litter place symbol put litter place symbol put litter place symbol put litter place symbol put litter place symbol
4990,usernam usernam usernam usernam usernam realli gotta drake phone
4991,usernam usernam usernam guuuuurl wooork love hashtag
4992,whatev say mr majesti usernam pictur
4993,much money neva need suga daddi usernam pshh
4994,usernam fuck witcha caus kno yo struggl hous burnin ta sleepin condit feel ya church hous ta trap hous feel ya keep grindin hashtag hashtag hashtag pictur
4995,usernam si said shrug emoji modifi fitzpatrick type number zero width joiner male sign pictur
4996,usernam pictur
4997,nickiminaj realli went hard barbi dream verifi number one spot hashtag pictur
4998,drag usernam
4999,usernam usernam usernam aw like
5000,usernam usernam usernam name
5001,bpppin sir ig stori crown fire usernam
5002,usernam usernam usernam gp help loudli cri face
5003,usernam bro fuck loudli cri face pictur
5004,usernam usernam yass two queen
5005,number hour hashtag crown usernam pictur
5006,rugg react everi time listen barbi dream usernam usernam loudli cri face pictur
5007,usernam usernam usernam word u listen full album trash rit
5008,usernam butttt expressionless face knew someth httpaddr
5009,usernam usernam big heart brilliant mind deserv love world honest beauti insid love proud big fan alway support heavi black heart pictur
5010,usernam wait person fold hand
5011,usernam httpaddr
5012,usernam nah jack feel neglect httpaddr
5013,usernam usernam pictur
5014,scream usernam wemt pussi popin virgin bride face tear joy loudli cri face httpaddr
5015,usernam oh realli neck sissss face look triumph pictur
5016,usernam realli tore favorit rapper new asshol
5017,usernam give number want talk pictur
5018,usernam usernam beyonc cohes
5019,play nicki minaj chun li usernam httpaddr
5020,final listen queen letssssss gooooooooooo smile face heart shape eye usernam
5021,usernam usernam collab
5022,barbi dream usernam
5023,usernam legaci undon
5024,usernam usernam pictur
5025,current listen hashtag usernam
5026,usernam usernam usernam usernam usernam usernam
5027,usernam usernam eye black heart suit
5028,ayo dj drop beatmi gun fall drop heat ye tf bitch usernam pictur
5029,usernam tell si know regga version anyway foh
5030,anyon want pay colleg would amaz usernam usernam usernam usernam usernam usernam usernam
5031,usernam usernam usernam usernam httpaddr
5032,usernam usernam usernam dope song love
5033,usernam usernam usernam usernam usernam usernam pictur
5034,usernam usernam pictur
5035,call usernam trash strung chlamydia ridden pussi part joke know take said would slap husband dick meant
5036,usernam bettah pick one bettah right one
5037,beyonc queen want much queen togeth usernam pictur
5038,usernam usernam whatsapp group lol femal rapper scope
5039,let translat simpleton usernam hot garbag usernam httpaddr
5040,barbi dream exact reason fell love usernam first came heavi black heart heavi black heart heavi black heart
5041,usernam usernam put song repeat tho si
5042,want miley guest hashtag usernam heavi black heart heavi black heart
5043,usernam usernam nubian queen spoken roman librari close close lock key fire fire fire hahaha baaaaaaaaaack pictur
5044,usernam person rais hand celebr emoji modifi fitzpatrick type number person rais hand celebr emoji modifi fitzpatrick type number person rais hand celebr emoji modifi fitzpatrick type number person rais hand celebr emoji modifi fitzpatrick type number person rais hand celebr emoji modifi fitzpatrick type number person rais hand celebr emoji modifi fitzpatrick type number person rais hand celebr emoji modifi fitzpatrick type number person rais hand celebr emoji modifi fitzpatrick type number
5045,usernam usernam trash
5046,usernam sorri ft na actual thing
5047,usernam wow
5048,disrespect barbi dream mention name usernam httpaddr
5049,usernam usernam benz song realli came collect thing
5050,usernam next babe pregnant woman emoji modifi fitzpatrick type number
5051,usernam grate
5052,idgaf none httpaddr fire lover dancehal earli number rap track bang yesss bad gyal mash di place usernam collis symbol collis symbol pistol pistol
5053,usernam usernam number day ariana releas sweeten
5054,usernam happen
5055,usernam usernam usernam hi
5056,usernam wtf
5057,usernam usernam usernam kegor gale swabe leno roga ngwana batho ka languag ye gasa e understandeng usernam
5058,usernam usernam usernam girl stfu thank face throw kiss
5059,di sh ridicul person rais hand celebr emoji modifi fitzpatrick type number fire straight fye usernam hashtag hashtag hashtag pictur
5060,usernam spotifi playlist updat new music usernam usernam usernam usernam usernam usernam usernam usernam usernam usernam usernam usernam usernam usernam usernam usernam usernam usernam httpaddr
5061,usernam usernam team usernam httpaddr fire fire fire hashtag hashtag hashtag hashtag hashtag hashtag hashtag hashtag hashtag hashtag hashtag hashtag httpaddr
5062,usernam usernam usernam usernam usernam damnn son
5063,usernam usernam mulher fala comigo
5064,usernam best femal rapper period
5065,usernam usernam yessss nicki would bodi look pictur
5066,girl bump new usernam earlier bruh wildin shit go hard fuck cap
5067,usernam sooo explain barbi dream show lyric usernam bih im tri learn lyric smile face open mouth cold sweat hashtag
5068,okay new usernam album freak fantast
5069,usernam usernam mad bitter realli jealou choos one time
5070,usernam pictur
5071,think school loan usernam wait help mine everyth help face throw kiss
5072,owwwwwwww usernam loudli cri face loudli cri face loudli cri face heavi black heart httpaddr
5073,usernam usernam usernam usernam chart lol fall make million broke lol
5074,usernam usernam feaaaaaaaaat
5075,usernam usernam usernam usernam cring
5076,love nina love usernam httpaddr
5077,usernam good form goe hard shit repeat muhfuggin day
5078,hhhhhhhhhhhhhhhhhhhhhhhhhhhhhhhhhhhh loudli cri face real queen crown usernam pictur
5079,usernam usernam tea teacup without handl
5080,usernam usernam cool
5081,usernam album good sleep voic new moon face know im crazi sleep powerful rap song broken heart ok hand sign emoji modifi fitzpatrick type number number
5082,hashtag hashtag usernam barbi dream unicorn face fire miami unicorn face fire coco chanel unicorn face fire sir unicorn face fire pictur
5083,record usernam usernam
5084,everi rapper mention hashtag track like face tear joy face tear joy usernam usernam hashtag hashtag pictur
5085,urgh love shadi queen usernam smile face heart shape eye smile face heart shape eye httpaddr
5086,usernam chun queen today face tear joy
5087,usernam enemi friend somehow becam one usernam person rais hand celebr emoji modifi fitzpatrick type number person rais hand celebr emoji modifi fitzpatrick type number person rais hand celebr emoji modifi fitzpatrick type number person rais hand celebr emoji modifi fitzpatrick type number person rais hand celebr emoji modifi fitzpatrick type number person rais hand celebr emoji modifi fitzpatrick type number httpaddr
5088,usernam usernam queen crown stuff x
5089,usernam usernam usernam usernam usernam usernam usernam usernam usernam smile face heart shape eye
5090,usernam numberc usernam usernam usernam usernam usernam usernam usernam usernam usernam usernam usernam usernam usernam usernam
5091,usernam aww si hate face palm emoji modifi fitzpatrick type number zero width joiner femal sign address get shrug emoji modifi fitzpatrick type number zero width joiner femal sign
5092,hashtaghashtag nickiminaj na bonu track httpaddr pictur
5093,usernam usernam lmaoooo unexpect scrollin loudli cri face loudli cri face loudli cri face loudli cri face
5094,nickiminaj pl make longer version number lit number late interlud number second enough hook good
5095,hey proud usernam nice album girl
5096,usernam one realli good fire fire fire pictur
5097,usernam usernam lot peopl seem like base youtub comment say glad nicki delay album mean imo bad sound like pink friday roman reload opinion pictur
5098,usernam usernam usernam usernam yea bia sing trash bro lol face tear joy
5099,usernam usernam easi girl babi
5100,usernam tell traci run one pictur
5101,usernam _eternallymaraj wait documentari
5102,usernam usernam omg imagin collab wig
5103,usernam snap everyon though lol
5104,usernam usernam need know work version studio insid addit expect please
5105,take step back look mirror hour straight yesterday product usernam
5106,usernam say deni us icon track
5107,usernam usernam usernam usernam usernam usernam press know cardi compet anyon lmao minaj stan stay press babi
5108,usernam someon pleas explain went purchas hard copi hashtag alreadi purchas phone pre order told hard copi releas august number someon pleas explain confirm think face think face think face
5109,usernam usernam number billboard hot number pictur
5110,usernam love
5111,usernam usernam love u
5112,fuck numberx night peac nickiminaj accur afffff lmaoo
5113,listen usernam ft usernam sorri make hashtag due clearanc issu pictur
5114,usernam move usernam smile face heart shape eye smile face heart shape eye smile face heart shape eye smile face heart shape eye hug face
5115,usernam usernam usernam nobodi could made album like httpaddr flow versatil transit punchlin stori metaphor httpaddr hashtag creativ usernam bodi pictur
5116,usernam never felt empow power like strong fuck woman listen album first time hashtag album lifetim stand damn proud queen demand treat
5117,got bitch shook shock stun gun usernam httpaddr
5118,nicki came haaaaaaardx smile face horn fire usernam crown crown
5119,sooooo usernam mv get hashtag si face stuck tongu wink eye ok hand sign emoji modifi fitzpatrick type number number fire fire
5120,usernam usernam pictur
5121,usernam look stun queen cover
5122,concert si litti im readi drop low good form usernam
5123,usernam um arent mixtap tidal massiv attack song shit hashtag
5124,usernam thank alway great
5125,usernam usernam usernam ___lenanumber___ come g mean greatest time one person group peopl
5126,listen new usernam
5127,usernam usernam usernam usernam lauren open halsey noth solo releas feat stranger night back never know shrug emoji modifi fitzpatrick type number zero width joiner male sign white smile face
5128,pelo meno eu escrevi todo rap que cuspi usernam dando aquela cutucada em artista que nao escrevem nem seu proprio tweet
5129,usernam usernam usernam usernam
5130,nickiiiiiiiiiii usernam love ya pictur
5131,usernam usernam ok bc wonder alway suspend acc
5132,usernam usernam usernam usernam usernam usernam usernam usernam usernam usernam usernam good
5133,usernam barbi dream video concept big pink barbi hous everybodi mention doll look makeup play around
5134,usernam usernam usernam black exel
5135,usernam deserv sorri perfect summer song pictur
5136,usernam play usernam usernam sorri httpaddr via usernam
5137,usernam never stop listen mani year thank masterpiec queen crown heavi black heart love
5138,usernam usernam smile face heart shape eye smile face heart shape eye heavi black heart
5139,usernam usernam nickiminaj sorri new usernam assisst track httpaddr listen via usernam
5140,exactli usernam loudli cri face loudli cri face loudli cri face loudli cri face httpaddr
5141,usernam tap usernam post queen leakstream sorri fire eye httpaddr
5142,usernam usernam usernam usernam usernam last number line hurt cannot deal alexa play marvin room pictur
5143,drake worth hundr milli alway buy shit know pussi wet cri shit usernam
5144,usernam usernam usernam usernam usernam usernam usernam usernam usernam usernam usernam usernam usernam sem voz que esmurra sua fav
5145,usernam usernam hashtag unreleas song queen
5146,usernam usernam usernam usernam lil kim beehiv sinc number
5147,usernam barbi dream need mv peopl talk scene situat exampl scienc walk young thug dress room steal cloth loudli cri face loudli cri face would hilari icon face tear joy face tear joy fire fire
5148,usernam usernam usernam usernam usernam fuck omg pictur
5149,usernam usernam exclus usernam debut new usernam ft na sorri httpaddr hashtag
5150,usernam usernam usernam usernam usernam usernam usernam never know role play help keep go help write book much inspir gener bless book number two pictur
5151,usernam httpaddr
5152,usernam usernam album put litter place symbol put litter place symbol put litter place symbol
5153,usernam im go lie hashtag hashtag
5154,usernam love sparkl sparkl k thank bye
5155,usernam problem wait anoth week si im apart
5156,alllll listen rn usernam httpaddr
5157,usernam _eternallymaraj tea
5158,usernam new album queen fire even gonna listen whole month goodby everyon imma go tryna embodi queen pictur
5159,oh god usernam wild barbi dream
5160,listen barbi dream usernam pictur
5161,need hashtag music video nickiminaj heavi black heart heavi black heart weari face
5162,usernam usernam usernam aaaaaaaa
5163,nicki pleas discard sorri song everyth burst girl fire unicorn face fire fire fire fire fire fire fire usernam usernam hashtag
5164,usernam usernam love peopl get differ straight
5165,barbi dream goe hard usernam come everyon
5166,usernam usernam usernam reason lil kim missi fuck yo ass
5167,usernam si gonna say fuck find pictur
5168,usernam wait outsid beat number studio thursday like pictur
5169,usernam song replac think face
5170,usernam well track number go add merch album download
5171,usernam whoooo pictur
5172,usernam _eternallymaraj realli go
5173,truth told usernam queen rap forev cardi b
5174,nicki minaj lach la pist sorri en featur avec na httpaddr hashtag hashtag usernam usernam pictur
5175,usernam nickiminaj person fold hand person fold hand loudli cri face loudli cri face broken heart broken heart ok hand sign ok hand sign skull skull dancer dancer flex bicep flex bicep revolv heart revolv heart broken heart loudli cri face loudli cri face person fold hand smile face horn smile face horn httpaddr
5176,usernam know imma hashtag anthem track album hashtag hashtag lord person rais hand celebr emoji modifi fitzpatrick type number hashtag httpaddr
5177,usernam head si page pictur
5178,hashtag would love hear majesti usernam new album hashtag heavi black heart fire collis symbol optic disc
5179,usernam cardi voodoo hit
5180,multipl music note pose nicki block unless sell nicki crack multipl music note usernam smile face sunglass multipl music note multipl music note multipl music note hashtag pictur
5181,cha im shi reaction usernam barbi dream shit need reaction saw shit inli post last night roll floor laugh peep though young thug tri dress cant deal lmao
5182,track number hashtag would usernam
5183,hey usernam good form next singl video ft usernam ok hand sign emoji modifi fitzpatrick type number clap hand sign emoji modifi fitzpatrick type number clap hand sign emoji modifi fitzpatrick type number
5184,usernam barbi dream way
5185,usernam usernam usernam pictur
5186,usernam usernam hook lover
5187,usernam pictur
5188,usernam hello nicki heavi black heart name kamila hope help pay studi univer dream enter opportun pay hope help
5189,usernam ya yax unicorn face unicorn face
5190,usernam usernam usernam stream buy queen
5191,usernam usernam usernam usernam usernam
5192,usernam barbi dream usernam enter top number us spotifi chart pictur
5193,lol usernam cardi b must listen new usernam album cri hashtag nicki minaj goodby cardi b career
5194,usernam usernam well traci chapman lost check know song would sold
5195,usernam queen yaz wenza amasimba everywher caus havoc hhaybo khuzani pictur
5196,usernam good form need next singl club radio banger hashtag hashtag hashtag hashtag
5197,instead apolog say switch like faggot say switch like sissi usernam realli let peopl right intersect talk care issu effect capitalist busi woman
5198,usernam usernam talk trash tweet
5199,usernam shut gonna surpris us pictur
5200,took traci chapman show nicki fan relev si still shake dancer hashtag si still ghost know usernam tell usernam u r spider web lie hashtag
5201,barbi dream slappsss usernam hashtag
5202,usernam nip tuck fire person rais hand celebr emoji modifi fitzpatrick type number hashtag two heart
5203,usernam queen fuck number time night peac icon
5204,usernam usernam deberia hacer como normani conseguir una collab
5205,usernam good job post
5206,usernam speak head silhouett aint fat nigga tellin whst sint eatin person rais hand celebr emoji modifi fitzpatrick type number hashtag hashtag hashtag hashtag hashtag
5207,usernam play song hashtag hashtag hashtag upcom tour think face heavi black heart hashtagbarb hashtag
5208,usernam usernam queen support queen smile face smile eye love heavi exclam mark symbol
5209,wait nickiminaj let go joint featur usernam hit vibe right httpaddr pictur
5210,usernam usernam queria ta de repeat com expect ma vc nao lanca versao estudio mentira amor pode lancar teu tempo eu espero viu te amo ma seja rapida
5211,usernam download hot number app word usernam go
5212,usernam ishhhh broken heart pictur
5213,usernam hashtag hashtag pictur
5214,usernam majesti come see crown eye heard sneez face
5215,reaction usernam hashtag pictur
5216,usernam must think forgot documentari face tear joy
5217,hashtag hashtag hashtag usernam poopin si fire sparkl heavi black heart sparkl unicorn face clap hand sign emoji modifi fitzpatrick type number heavi black heart grow heart fire pictur
5218,happi imagin much save world save wait long thank u nicki heavi black heart fire crown kiss mark never disappoint heavi black heart white medium star usernam hashtag pictur
5219,usernam queeeeeeeeeeeennnn
5220,usernam usernam got new tattoo eye
5221,usernam damn
5222,get butterfli stomach think see evil monkey usernam
5223,usernam usernam httpaddr
5224,usernam numberixnumberin hey bro get number thousand million togeth famili hood tire poor
5225,usernam usernam cual es tu cancion favorita hashtag dancer emoji modifi fitzpatrick type number number
