,tweet
1427,hashtag amaz album usernam love grow heart grow heart hundr point symbol fire
1428,usernam said cant fuck numberx week peaceeee victori hand emoji modifi fitzpatrick type number realli numberx week face tear joy
1429,usernam anaconda want none unless bun hun
1430,usernam better good excus usernam album tho eye eye eye eye eye eye
1431,usernam usernam usernam usernam pictur
1432,usernam usernam usernam thing nicki differ femal rapper number spit pay homag biggi
1433,usernam love queen aha live come see smile face heart shape eye see evil monkey heavi black heart
1434,usernam love much queen heavi black heart loudli cri face crown
1435,usernam came head hard white xxx
1436,usernam face tear joy face tear joy face tear joy face tear joy face tear joy face tear joy
1437,invit jacke listen session usernam httpaddr
1438,usernam usernam usernam httpaddr
1439,stan forev heavi black heart usernam pictur
1440,usernam imma number lit number late fuck good interlud unamus face weari face
1441,usernam queen rap
1442,usernam usernam usernam httpaddr
1443,usernam usernam name drop whole rap game get put island
1444,ju heard barbi dream piss usernam pictur
1445,usernam true hashtag
1446,usernam usernam pictur
1447,usernam usernam good
1448,usernam oh nah yall mf got mess usernam usernam period
1449,usernam call everi motherfuckaa piec smile face heart shape eye smile face heart shape eye smile face heart shape eye spirit queen
1450,report mma still enjoy tune anyway bop clap hand sign usernam
1451,usernam come see tell us queen crown
1452,usernam oh dead husband name gari jealou tri kill dont want happi shit come wendi william show that watch supposs work soap
1453,usernam usernam usernam usernam usernam use safari pictur
1454,usernam usernam roll floor laugh roll floor laugh girl u crazi lol
1455,usernam pictur
1456,usernam usernam usernam usernam usernam usernam
1457,usernam us hashtag
1458,lie usernam teach pronounc design name correctli time lmao
1459,get hashtag tonight x usernam pictur
1460,usernam miss pictur
1461,listen barbi dream way home got pull took jail usernam su blame album took face palm emoji modifi fitzpatrick type number zero width joiner femal sign refund moneysymbnumb sneez face
1462,usernam usernam whooo new version queen delux
1463,usernam usernam usernam stun
1464,usernam finish listen hashtag eargasm fuck love heavi black heart
1465,liter stress learn new track usernam drop australian date
1466,give ask lend bodi gotta king statu get bodi fuck yeah caus queen embodi inform desk person hundr point symbol crown usernam felt shit
1467,usernam numberfutur releas httpaddr
1468,congratul releas queen httpaddr via usernam usernam barbz would like say thank two heart hashtag hashtag hashtag hashtag hashtag hashtag
1469,eventhough miss hashtag block instagram like number year ago caus said back drake wayn meek break still fuck even crazi nick usernam pictur
1470,visual good form mandatori point hashtag usernam pictur
1471,usernam album hashtag scari good
1472,usernam quot usernam watch real life jeffre star seri stan httpaddr
1473,usernam pictur
1474,usernam usernam trash sanit
1475,boredom alway strike work listen usernam album hashtag get thru day heavi black heart pictur
1476,usernam si fair pictur
1477,usernam regrann usernam hush face face tear joy hashtag hashtag httpaddr
1478,hashtag usernam hashtag fire fire fire
1479,guy hashtag fuck good usernam love sinc day number fire
1480,usernam send number pictur
1481,omg love ganja burn song right smile face heart shape eye whole thing vibe usernam
1482,usernam usernam usernam usernam usernam usernam usernam usernam album came stay press girli pictur
1483,usernam usernam queen bish number
1484,usernam bring man thursday sister usernam
1485,get high af slurpe grindr stranger stream queen usernam w headphon thank u pictur
1486,rather male femal u gotta admit noth els solidifi usernam queen rap queen
1487,listen hashtag person rais hand celebr person rais hand celebr person rais hand celebr usernam
1488,lo siento usernam pero queen como que va
1489,usernam usernam te amo
1490,usernam usernam deserv work hard n ppl hate hard keep win n prove hater wrong love u usernam
1491,usernam queen princess emoji modifi fitzpatrick type number
1492,usernam usernam usernam httpaddr
1493,person rais hand celebr person rais hand celebr person rais hand celebr person rais hand celebr person rais hand celebr hashtag majesti feat eminem labrinth usernam hashtag httpaddr
1494,usernam _eternallymaraj song didnt make break album shrug zero width joiner male sign that fact
1495,usernam went queen person rais hand celebr emoji modifi fitzpatrick type number number clap hand sign emoji modifi fitzpatrick type number number
1496,usernam usernam usernam boo achiev bring anywher high bb hot number take guess even much
1497,usernam usernam alreadi classic
1498,usernam queen crown sampl five majesti like fave part
1499,never person huge fan usernam damn album pretti fire fire
1500,tell eat cooki caus good himand eat cooki got good form usernam
1501,usernam usernam usernam hehehehehh roll floor laugh roll floor laugh face tear joy roll floor laugh face tear joy roll floor laugh
1502,usernam usernam usernam two queen togeth die peac
1503,usernam mayb someon wink leak pictur
1504,usernam fuck somebodi bring speed
1505,usernam usernam queen
1506,usernam usernam sorri lol pictur
1507,usernam usernam song usernam usernam hashtag hashtag pictur
1508,usernam usernam usernam normani first member debut solo album rt
1509,usernam usernam numberixnumberin new york new york httpaddr
1510,usernam usernam sister smile face heart shape eye smile face heart shape eye
1511,usernam usernam usernam usernam usernam usernam queen rap top number n number stream queen pictur
1512,feelin like barbi tonight usernam face throw kiss face throw kiss face throw kiss pictur
1513,moi en ecout queen nicki love u usernam pictur
1514,usernam usernam usernam traduzam critica da varieti usernam
1515,usernam usernam usernam usernam usernam guess iggi level includ convers
1516,usernam numberixnumberin usernam usernam usernam usernam time
1517,hashtag usernam barbi dream got shock eye pictur
1518,usernam fine
1519,usernam usernam pictur
1520,drop gun sure drop heat two heart unicorn face x usernam
1521,hashtag usernam gimm ganja burn extraterrestri alien
1522,queen happier usernam pictur
1523,usernam pictur
1524,usernam lol listen song sing ganja burn kept hear ganja burn bc loyal titl face tear joy face tear joy face tear joy
1525,usernam da album issa killer hail queen person rais hand celebr
1526,get usernam nock everyon favorit rapper
1527,fire queen usernam deal
1528,hashtag fire fire fire fire fire heavi black heart heavi black heart heavi black heart usernam
1529,usernam usernam reaaaaal though song favorit mine run hide ganja burn
1530,queen get lyric hashtag hook rest world deal later hug face usernam
1531,usernam wish happi birthday slightli smile face
1532,usernam repeat usernam hashtag pictur
1533,what issu usernam pictur
1534,let say made right choic keep date si queen icon black heart suit love usernam pictur
1535,usernam purohui katakana hiragana prolong sound mark rubian watsutashihuorowa katakana hiragana prolong sound mark monumberyi xing kisou princess emoji modifi fitzpatrick type number white heart suit arubamul shimimi katakana hiragana prolong sound mark pictur
1536,usernam usernam wouldv kill fr like get mofuckin strap
1537,fuck gon beat number lose attitud run credit card chun swae usernam everi bit face tear joy face tear joy face tear joy
1538,usernam usernam said girl get poppin put wishlist hashtag hashtag hashtag fire fire direct hit find babi daddi httpaddr
1539,usernam usernam wah
1540,usernam usernam lmk get bc link pictur
1541,usernam usernam usernam nickixnormani soooo queen delux edit
1542,usernam usernam ummm pictur
1543,_eternallymaraj soooooo appl music usernam wonder heavi black heart pictur
1544,usernam stop play face honeyyy spend money tour better sign
1545,usernam usernam hello name mario campanella phone current number number number text like music httpaddr
1546,hashtag hashtag usernam truli queen hip hop
1547,usernam usernam usernam usernam number kiss mark pictur
1548,_eternallymaraj hey si usernam could follow dream sinc number realli dream girl love alway support pleas follow person fold hand emoji modifi fitzpatrick type number heavi black heart crown unicorn face
1549,usernam usernam usernam numbereverharmonumb hashtag hashtag hush face hush face hush face hush face hush face hush face hush face
1550,chri tobon stream queen usernam appl music
1551,hashtag nip tuck usernam
1552,usernam usernam usernam pictur
1553,usernam httpaddr
1554,goodnight love usernam
1555,usernam usernam nice cover
1556,usernam snap hundr point symbol person rais hand celebr clap hand sign
1557,usernam usernam usernam usernam usernam bruhhhhhh
1558,usernam get name hard white loudli cri face
1559,usernam pictur
1560,usernam usernam would fire fire fire weari face push babi daniel way imma cri fr loudli cri face
1561,nip tuck whole mood nail polish emoji modifi fitzpatrick type number hashtag usernam hashtag pictur
1562,usernam meet tacki shatter hous pictur
1563,usernam shrug zero width joiner femal sign shrug zero width joiner femal sign pictur
1564,usernam hear usernam said god disrespect lmao
1565,pleas forgiv tweet next week usernam hashtag album great thou art
1566,usernam usernam usernam usernam thank
1567,usernam queen india kindli accept regard number father took loan studi pay ask help pm manag refus silli repli heard chariti help peopl came person fold hand pleas help
1568,run hide x usernam
1569,usernam forgot molest brother bitch httpaddr
1570,usernam usernam usernam artist disciplin face stuck tongu wink eye
1571,usernam usernam liter reaction x went
1572,usernam ganja burn fav song album hard pick tho
1573,okay usernam let get team updat queen music platform remov bed act like never happen replac sorri feat na fire fire fire fire caus idk song make cut think face
1574,usernam hold babi shake weari face weari face weari face
1575,usernam usernam smile face heart shape eye smile face heart shape eye smile face heart shape eye smile face heart shape eye smile face heart shape eye queensss nicki lauren smile face heart shape eye smile face heart shape eye smile face heart shape eye smile face heart shape eye smile face heart shape eye
1576,usernam album realli fire fire fire fire fire fire fire
1577,usernam nigga nicki minaj na song sorri way show us togeth grin cat face smile eye grin cat face smile eye
1578,usernam usernam usernam lmfaooooooooooo
1579,usernam usernam yeee smile face heart shape eye smile face heart shape eye smile face heart shape eye
1580,usernam usernam usernam usernam _spacetitan usernam pen faster googl chrome use safare
1581,usernam usernam record
1582,passando pra deixar registrado aqui que minha musica preferida album novo da usernam e majesti com eminem que musica pqp heavi black heart heavi black heart heavi black heart hashtag
1583,usernam usernam usernam usernam nicki minaj sampl tupac
1584,usernam usernam ooooop weari face weari face weari face weari face weari face weari face face tear joy face tear joy face tear joy face tear joy face tear joy face tear joy face tear joy face tear joy face tear joy face tear joy face tear joy face tear joy face tear joy
1585,usernam pictur
1586,usernam onika tanya maraj bring yo whole azz chea keepin good music us fareal that dewin pictur
1587,usernam usernam queen usernam crown
1588,queen album fire fire fire usernam
1589,usernam olha barbi dream nasceu de dream number hashtag usernam httpaddr
1590,nickiminaj get track princess emoji modifi fitzpatrick type number person rais hand celebr emoji modifi fitzpatrick type number like step someon new white kick purpos eye face tear joy face tear joy shrug emoji modifi fitzpatrick type number zero width joiner femal sign hashtag hashtag coco chanel nicki minaj foxi brown usernam httpaddr
1591,usernam usernam usernam usernam come see soon
1592,vibin new usernam hashtag album listen httpaddr pictur
1593,usernam period everybodi tryna wit tha win team sudden
1594,usernam pictur
1595,yo trend usernam pictur
1596,usernam drpped one funniest song year hip hop stop smile barbi dream channel biz big dolemit joint run back like number time today
1597,come see usernam loudli cri face sparkl heart loudli cri face sparkl heart httpaddr
1598,usernam usernam usernam usernam usernam usernam usernam tea stream queen pre order sweeten
1599,usernam chanc get back togeth truli new boy
1600,love cardi b hope everyon know usernam rap make better music
1601,usernam usernam hope fuck dude name lol lawd
1602,mayb togeth much world confirm longer thing usernam
1603,usernam si pictur
1604,usernam want person levi jacket jacket everi fuck thing
1605,usernam pictur
1606,come see usernam queen album scream entir song wrong xx face cold sweat hashtag
1607,let talk sex usernam
1608,usernam hurri make happen hashtag httpaddr
1609,bed listen ear emoji modifi fitzpatrick type number hashtag fire swear need music headphon right life smile face smile eye person fold hand emoji modifi fitzpatrick type number sneez face hundr point symbol x usernam
1610,listen rli feel like get second album number eye eye eye eye usernam
1611,usernam usernam hard white sound badass
1612,usernam usernam pictur
1613,nickiminaj bed feat usernam surpass number million stream spotifi nicki number ariana number song achiev httpaddr
1614,rest year usernam hashtag hashtag hashtag pictur
1615,confirm usernam alway top worth money hashtag hashtag pictur
1616,usernam usernam nail clap hand sign emoji modifi fitzpatrick type number
1617,llc omg fire fire fire usernam pleas rt
1618,hashtag top bottom think face think face said fuk em fuk em bring lube fuk em bring lube face tear joy face tear joy face tear joy face tear joy face tear joy heavi black heart fire hashtag usernam hashtag
1619,usernam man listen hand love album keep
1620,usernam pictur
1621,usernam mi nah lie yuh n usernam da bloodclot tingz big rass chune fire fire fire fire fire
1622,ig cuando la reina te pide que recre tu presentacion en lo billboard tu lo hace te quiero millon mobil phone rightward arrow left comentario de normani en el post de usernam pictur
1623,queen x usernam love x cartersmood remain number
1624,usernam ye
1625,nickiminaj pleas stop sing
1626,usernam usernam icon kkkkkkkkkk
1627,usernam bout leak anyway eh pictur
1628,usernam said done fast pray cleans bodyabstain sex zen bodyi givin ask lend bodygotta king statu give men bodyfuck yeah caus queen embodi fuck felt pictur
1629,usernam usernam usernam
1630,usernam get documentari upsid face upsid face upsid face upsid face upsid face
1631,usernam wonder track pictur
1632,usernam laurenjauregui one video see happi sing song first time brazilian fan pictur
1633,usernam usernam boi
1634,usernam sorri hear queen delux album khuz si pictur
1635,usernam usernam say someth bruh
1636,usernam usernam usernam nicki queen rap young ariana run pop stream queen sweeten releas august number
1637,usernam made uber driver buy queen album gonna give low rate hug face loudli cri face loudli cri face loudli cri face loudli cri face hashtag hashtag pictur
1638,bogu think usernam album hashtag ga speak head silhouett rappin like realli rap think may review song like scorpion thank great cd love
1639,mixtap queen album girl share life world legaci usernam
1640,come see beauti song weari face heavi black heart proud mommi drop hashtag usernam unicorn face sparkl heart love deserv everyth come way heart decor pensiv face
1641,usernam usernam pleas releas expect put repeat rest life
1642,usernam pictur
1643,usernam pictur
1644,birthday homegirl request usernam super bass hashtag
1645,usernam usernam atlant record tryna stop bag onikavodoo shit work hard unicorn face unicorn face unicorn face face tear joy face tear joy face tear joy
1646,okay nicki minaj song barbi dream si spill bean mouth like face scream fear x hush face whole time usernam
1647,usernam swear listen come see least number time today
1648,usernam usernam favourit song
1649,usernam usernam shit wack u got homi na look crazi outchea
1650,see usernam si got cutest babi httpaddr
1651,usernam princess emoji modifi fitzpatrick type number httpaddr
1652,yike crown fire crown fire crown fire crown fire crown fire usernam httpaddr
1653,nicki need put sorri itun person rais hand celebr emoji modifi fitzpatrick type number person rais hand celebr emoji modifi fitzpatrick type number weari face weari face hashtag hashtag usernam
1654,hashtag barbi dream fire fire fire fire usernam pictur
1655,usernam usernam queen
1656,usernam nobodi safe around bitch diss drake
1657,usernam nah good would put song lie face issa good thing aint wait
1658,usernam usernam llc next runner
1659,usernam usernam payola
1660,anyon talk trash nicki hope learn lesson queen rap cardi b cardi go back pole usernam pictur
1661,usernam usernam say bad lol wrong
1662,usernam usernam traci crippen traci chapman number differ peopl lol
1663,get marri famili ugh usernam usernam pictur
1664,usernam usernam lmfaoooo
1665,usernam jte kiff tu fait plaisir avec cett album bebe
1666,mood usernam two day face tear joy heavi black heart hundr point symbol
1667,wish number lit number late longer omg loudli cri face usernam hashtag
1668,usernam usernam yesssssssssss
1669,stone af hashtag got drool face grow heart fire usernam hashtag
1670,usernam usernam usernam gotten play longev lie
1671,hashtag face scream fear face scream fear face scream fear face scream fear face scream fear usernam miss foxxi vers thoughhhhhh bruh
1672,usernam usernam nope si keep glad album
1673,usernam si album phenomen fire one question tho tf ball video need visual honey
1674,liter mini hiatu twitter life realli sinc listen queen album usernam
1675,usernam usernam usernam usernam usernam usernam queen rap lead pack back
1676,usernam love fact album finish well fire fire fire fire fire tell suppos releas number number releas pressur come cardi b
1677,best song hashtag imo usernam pictur
1678,plan asia tour x hashtag hashtag usernam
1679,usernam ima anyway
1680,usernam usernam usernam ainda bem q irma diss nao
1681,barbi dreamz x usernam
1682,usernam girl wig snatch way went face tear joy face tear joy face tear joy em like face palm emoji modifi fitzpatrick type number zero width joiner femal sign
1683,usernam mood pictur
1684,usernam mean
1685,wanna know writer shade usernam think eye hashtag
1686,usernam take part
1687,usernam girl f shit anyway pictur
1688,best could weari face usernam hope somewhat good loudli cri face hashtag x fire pictur
1689,queen usernam httpaddr
1690,novyi al bom niki vyshka sign horn emoji modifi fitzpatrick type number number sign horn emoji modifi fitzpatrick type number number sign horn emoji modifi fitzpatrick type number number revolv heart revolv heart revolv heart smile cat face heart shape eye smile cat face heart shape eye heavi black heart heavi black heart heavi black heart heavi black heart love nicki russia love heavi black heart hashtag hashtag nickiminaj
1691,ever becom rapper go make song men done dirti inspir usernam
1692,usernam would make number lit number late fuck short pictur
1693,usernam usernam lol love good time actual almost everi day pictur
1694,usernam usernam usernam damn boi slow tf shook
1695,usernam pictur
1696,usernam ft usernam sorri hashtag unreleas music listen usernam usernam httpaddr hashtag hashtag hashtag hashtag hashtag pictur
1697,cant stop spinnin hashtag nickiminaj smile face heart shape eye smile face heart shape eye smile face heart shape eye smile face heart shape eye
1698,usernam usernam weari face face tear joy face tear joy face tear joy hashtag hashtag httpaddr
1699,get much babi kill album usernam alway queen period
1700,usernam usernam oh dear
1701,usernam usernam said give cloth back loudli cri face loudli cri face
1702,usernam usernam usernam usernam usernam httpaddr
1703,excit see usernam spittin llc live hashtag
1704,usernam usernam collab
1705,usernam tell simpl hoe llc face roll eye
1706,promot album bitch usernam
1707,usernam usernam usernam b
1708,usernam headphon truffl butter feat drake lil wayn usernam usernam hashtag httpaddr pictur
1709,usernam usernam ummmmm queen lauren follow
1710,bruhhh usernam murder everyon hashtag fire fire fire fire fire fire fire hashtag dream
1711,majesti gonna next radio radio go song hurr fire crown usernam
1712,say usernam new album pretti good multipl music note
1713,open door someon stop end driveway start yell slowli close door yell back buy hashtag itun tire face tire face usernam
1714,usernam barbi dream next singl
1715,tf suppos learn eminem vers hashtag usernam pictur
1716,usernam usernam httpaddr
1717,fire candl crystal ball pill weari face collis symbol bomb loudli cri face usernam usernam usernam usernam usernam usernam richthekid npktwicesa torylanez youngthug rikyrickworld bcfmoneymannumb numberfutur kanyewest reasonhd usernam nickiminaj migo umghashtaghashtaghashtag httpaddr
1718,usernam u realli bitch face tear joy fire
1719,u singl handledli annihil u know everi rap bitch build likeeeee crown hashtag usernam
1720,woah woah fuck woah usernam nasti na hashtag bitch im sorri vocal fuck flow bar x fire hashtag
1721,usernam wanna place sorri album
1722,usernam there alway soundcloud slightli smile face
1723,usernam lie said album drop bitch go cri car come see got drown pictur
1724,hashtag vibe smile face sunglass smile face sunglass dash symbol dash symbol dash symbol hashtag usernam
1725,obsess hashtag omg ya usernam
1726,usernam bust shot suck appli
1727,usernam straight bulli face tear joy face tear joy face tear joy face tear joy face tear joy face tear joy hashtag
1728,slow wind pon dyem _ win da wy aist bad byal grind man absolut noth type beat yoh nicki mnige bafwethu person rais hand celebr fire person rais hand celebr fire loudli cri face guy usernam loudli cri face still shook foxi person rais hand celebr fire number never understand sever featur okay skip tweet loudli cri face pictur
1729,hear usernam feat usernam song though eye eye
1730,usernam usernam omg usernam lock amaz
1731,peopl like nicki know authent si write rap metaphor punchlin ass realli icon crown usernam
1732,usernam pleas love u much queen
1733,fuck number time night peac psa twitter bio usernam new album drag queen coincid think
1734,okkk usernam go
1735,usernam album fire fire
1736,usernam wait usernam take album httpaddr
1737,usernam usernam usernam said wide set vagina heavi flow bad thing
1738,usernam parec que sera lancada na versao delux album queen da usernam exclusivament tidal uma cancao em parceria com kati perri pictur
1739,usernam camera minajsreign usernam mcqueen see guy tmrw morn httpaddr
1740,obsess ganja burn usernam
1741,usernam ridicul understand usernam love n word enjoy say even sampl smh
1742,wonder nicki gonna say barbi dream part number think face think face usernam
1743,usernam pictur
1744,usernam usernam quero feat
1745,usernam usernam usernam usernam shook fuck statement unse pictur
1746,usernam get clear use dream joint caus shit trash smmfh noth special
1747,usernam usernam collab
1748,listen usernam album bad memor say like llc joint swae lee minu hook
1749,realli want usernam collabor usernam
1750,usernam good music hashtag
1751,usernam goe retir money could earn song pictur
1752,shout queen usernam amaz album hashtag realli domin femal rap game pictur
1753,obsessss usernam new album bitch realli queen person rais hand celebr emoji modifi fitzpatrick type number person fold hand emoji modifi fitzpatrick type number person rais hand celebr emoji modifi fitzpatrick type number
1754,usernam pictur
1755,usernam usernam queen support queen princess emoji modifi fitzpatrick type number number
1756,usernam omgggggggggggg ahhhhhhhhhhhhhhhh fuck happi sir x futur whole fuck album bitch xoxo
1757,usernam someon pleas translat loudli cri face
1758,usernam pictur
1759,would like see nicki pregnant ye cours nicki gonna rlli good mother heavi black heart babi emoji modifi fitzpatrick type number babi bottl hashtag hashtag hashtag usernam
1760,usernam usernam usernam usernam usernam usernam usernam bad boy
1761,usernam ndndndndnnd
1762,usernam oh idk seen movi shrug emoji modifi fitzpatrick type number zero width joiner male sign realli promot usernam hashtag tl inform desk person emoji modifi fitzpatrick type number zero width joiner male sign plu love what love got upsid face upsid face pictur
1763,check hashtag usernam httpaddr hashtag eighth note beam eighth note
1764,usernam yall ass chillin si shrug emoji modifi fitzpatrick type number number zero width joiner male sign
1765,yesss usernam nail polish emoji modifi fitzpatrick type number revolv heart face throw kiss pictur
1766,love usernam
1767,usernam one bad bitchhh weari face weari face weari face unicorn face hashtag hashtag pictur
1768,ya nicki usernam hashtag hashtag pictur
1769,usernam usernam help went number target number best buy buy album dont astonish face astonish face astonish face astonish face astonish face astonish face loudli cri face loudli cri face tire face tire face tire face tire face
1770,usernam usernam usernam usernam usernam usernam queen nicki
1771,usernam love ya traci think know real queen folk
1772,barbi dream usernam far best song ever heard dj khalid roast roll
1773,usernam usernam usernam usernam hashtag listen song nicki minaj new album platinum understand
1774,usernam usernam like realli lit man
1775,usernam slay nicki slay queen slay chun li purpl heart
1776,usernam usernam usernam usernam usernam usernam queen barbi
1777,usernam usernam queen hashtag hashtag usernam love
1778,swear hashtag hashtag way talk usernam hashtag album hashtag
1779,usernam usernam disrespect usernam manner foh
