,tweet
3182,usernam usernam nip tuck heavi black heart heavi black heart heavi black heart heavi black heart fire sneez face tongu
3183,usernam gimm address pictur
3184,usernam ganja burn hard white thought knew number lit number latecom see
3185,usernam someon pleas explain
3186,usernam cant even breath hashtag never heard someth hard fkin life send oxygen usernam hashtag hashtag
3187,usernam usernam usernam roll floor laugh roll floor laugh roll floor laugh
3188,usernam said
3189,badasss coupl ethandolan usernam smile face horn pictur
3190,hashtag nickiminaj httpaddr style pictur
3191,usernam make song hashtag first album usernam
3192,usernam usernam yo like two collab pleas
3193,usernam usernam usernam usernam usernam
3194,usernam number tryna see sumn
3195,usernam whole album fire smile face horn loveeee revolv heart revolv heart revolv heart revolv heart
3196,even though hashtag go realli see anybodi talk hashtag usernam liter snatch fuck wig thought secur weari face hashtag hashtag pictur
3197,usernam put soundcloud
3198,usernam usernam love song love
3199,sorri loudli cri face loudli cri face love get peopl think unamus face usernam
3200,usernam write hand emoji modifi fitzpatrick type number fire work hard queen rap loudli cri face nerd face smile face halo person fold hand emoji modifi fitzpatrick type number hashtag pictur
3201,usernam usernam usernam usernam usernam taylor blackpink gaga xtina stan face throw kiss face throw kiss ur welcom
3202,usernam usernam hahahahahahahahahahahahahahha face tear joy roll floor laugh
3203,usernam usernam gay album todo ta ta uma delicia
3204,usernam numberso usernam usernam usernam usernam usernam usernam usernam usernam usernam usernam hi erika pleas play beauti remix bazzi ft camila black heart suit
3205,usernam pussi wetter b drake cri shit c pussi wet af know boy cri like babi similac lol lmno hashtag
3206,llc fuck bounc bitch smile face heart shape eye fire usernam hashtag
3207,usernam album da usernam hashtag pictur
3208,usernam album greatest femal rap album heard
3209,usernam pictur
3210,bruhh usernam snap barbi dream fire fire
3211,usernam usernam usernam usernam usernam oh man found twitter rememb drop song soundcloud free mind song still hard shit
3212,usernam usernam fuck fuck pictur
3213,usernam expect coco chanel music video soon ask number friend eye two heart
3214,usernam usernam usernam usernam u press tho
3215,usernam usernam pictur
3216,usernam usernam love u
3217,usernam gurl barbi dream need singl see hashtag hot number
3218,okay usernam soooo believ got way fuck would drop hashtag think someon thought awhil nun less got fuck face tear joy hashtag pictur
3219,usernam chun swae sir majesti barbi dream ganja burn
3220,llc nicki minaj usernam fire fire pictur
3221,girl collab usernam httpaddr
3222,usernam usernam queen
3223,hashtag hashtag usernam serv full cours hashtag hashtag
3224,want wait noam still go complain sorri absolut nickiminaj
3225,usernam usernam yesssss collab
3226,usernam usernam usernam usernam usernam usernam usernam cardi talent part could left put mouth mic read written nice beat mean talent go
3227,usernam usernam usernam usernam usernam usernam usernam si savag like
3228,usernam usernam te amo
3229,thank barbi usernam help mestream hashtag appl music spotifi
3230,usernam _thelifeofki feel corni loudli cri face
3231,usernam album go fuck piss usernam anoth number oakland california httpaddr
3232,usernam usernam lauren michel angel babi love need studio version expect need beauti song pleas make babi black heart suit
3233,usernam target preorder sold heavi black heart hashtag pictur
3234,majesti best song hashtag fact sorri make rule usernam face throw kiss
3235,put ya hand hold run money hashtag hashtag usernam pictur
3236,swear see anoth nigga reaction listen usernam whole song hashtag pull
3237,usernam numbersosqueennumb face tear joy face tear joy
3238,usernam numberso usernam usernam usernam usernam usernam usernam usernam usernam usernam usernam radio radio great thumb sign even love heavi black heart znumber
3239,usernam usernam usernam swear knew nicki got
3240,usernam usernam throw pussi httpaddr
3241,usernam usernam usernam usernam usernam usernam
3242,forgotten documentari usernam pictur
3243,usernam know barbi dream thought knew hard white far person rais hand celebr emoji modifi fitzpatrick type number pictur
3244,usernam nic wed si weari face sorri whole love stori
3245,still get documentari usernam
3246,dead woke danc usernam new album sleep
3247,loyal usernam fan sinc day one still remi funni bitch tri crush hoe care bout hashtag act like love shi u fake anyway httpaddr luv u nick yellow heart
3248,usernam usernam pictur
3249,usernam lil barbi dream song ok still hate shrug emoji modifi fitzpatrick type number zero width joiner male sign
3250,usernam never trust broke hoem broke hoe pictur
3251,usernam credit numberc south side stand bitch usernam realli problem kill shit smile face open mouth tightli close eye get strap hashtag httpaddr
3252,slight obsess new usernam album smile face heart shape eye
3253,better secur strap period usernam
3254,usernam said hate could never measur hate could never one need hashtag pictur
3255,forgot usernam httpaddr
3256,yo usernam refer pull realli got ya listen researchinnn like america next top model call yaya get fortun ima antm die hard tho smile face open mouth cold sweat
3257,usernam babi need queen merch nurseri grin face smile eye
3258,usernam httpaddr
3259,omg usernam hashtag album best album ever geeeeeez accccolad itiki majesti chun swae rich sex barbi dream
3260,usernam usernam usernam usernam usernam usernam number underr artist goat ella entri sign x
3261,fuck usernam album fuck good get sweeten number day song fuck good tho sparkl pictur
3262,usernam realli thought nasir call quit still great term awe babi love hashtag hashtag
3263,usernam made mistak pictur
3264,fuck bitch usernam roll floor laugh
3265,queen album got like usernam pictur
3266,usernam si surpris us give us song number love loudli cri face heavi black heart
3267,usernam usernam band camp day tea
3268,usernam usernam love
3269,chun swae fire fire usernam
3270,usernam l love good form fire
3271,usernam usernam usernam usernam usernam usernam kindli click link watch new video full limelight forget share httpaddr
3272,yooo usernam damn thing fire hashtag
3273,usernam usernam usernam adon esta music want damn music
3274,love queen give vibe differ album one like masterpiec heavi check mark heavi check mark heavi check mark two heart two heart two heart two heart two heart two heart two heart two heart two heart two heart two heart smile face heart shape eye smile face heart shape eye smile face heart shape eye smile face heart shape eye smile face heart shape eye smile face heart shape eye smile face heart shape eye smile face heart shape eye smile face heart shape eye smile face heart shape eye multipl music note multipl music note multipl music note multipl music note usernam
3275,usernam usernam te amo
3276,usernam queen kinda lit hmmmm
3277,usernam usernam usernam whatev said aint opinion went like pictur
3278,usernam usernam usernam usernam queen support queen crown stream queen preorder sweeten heavi black heart
3279,usernam usernam stop dont tell
3280,slap usernam ass sound like rubber band pop hashtag
3281,hashtag hashtag ft hashtag usernam usernam
3282,usernam usernam stop listen
3283,hashtag usernam vers fefe still stuck head pictur
3284,traci got fast car hu face tear joy automobil hashtag usernam pictur
3285,usernam realli want see usernam hashtag person fold hand emoji modifi fitzpatrick type number person fold hand emoji modifi fitzpatrick type number realli want meet model xx btw hashtag perfect smile face heart shape eye fire
3286,wish usernam left regga singer foxi brown rapper sampl hashtag
3287,usernam usernam usernam
3288,unlik lot hoe whether wack litat least say wrote everi rap spit yesssssssssss queeeeen usernam
3289,numberraw numberraw rich sex ft lil wayn usernam l free mobil app buy httpaddr pictur
3290,realli hope usernam see quit peopl follow like retweet could one
3291,usernam usernam usernam sleep fire song got big vibe lyric point
3292,imagin usernam go barbi dream studio go loudli cri face loudli cri face loudli cri face
3293,usernam pictur
3294,usernam releas number studio album hashtag number day number birthday hiphop crown
3295,usernam usernam caus stole nail polish emoji modifi fitzpatrick type number nail polish emoji modifi fitzpatrick type number nail polish emoji modifi fitzpatrick type number nail polish emoji modifi fitzpatrick type number nail polish emoji modifi fitzpatrick type number nail polish emoji modifi fitzpatrick type number nail polish emoji modifi fitzpatrick type number nail polish emoji modifi fitzpatrick type number nail polish emoji modifi fitzpatrick type number nail polish emoji modifi fitzpatrick type number
3296,usernam kill queen httpaddr fav barbi dream hard white llc ganja burn majesti fire fire fire fire fire fire fire
3297,hope hand index middl finger cross emoji modifi fitzpatrick type number usernam perform dream number transit barbi dream tour
3298,usernam usernam usernam httpaddr
3299,day broke replay button hashtag usernam
3300,usernam usernam even best rap album year titl still belong usernam kod album
3301,love queen got die hard team know usernam
3302,usernam usernam usernam usernam epic right
3303,usernam usernam fun littl diddi isnt bitch
3304,yo barbi dream wtf went nut usernam
3305,listen usernam good form pictur
3306,usernam expressionless face
3307,usernam usernam repeat
3308,usernam usernam usernam l
3309,usernam usernam lol fire queen
3310,love outro see appreci usernam
3311,usernam love hashtag si pictur def jam record
3312,usernam coco chanel fire
3313,usernam montreal need tour date hashtag would love see hashtag pictur
3314,let say entir album classic bop classic bop serious weak track fire hashtag usernam
3315,usernam like song shrug emoji modifi fitzpatrick type number zero width joiner femal sign
3316,usernam usernam enjoy like hear happili marri coupl finish sentenc flow realli well
3317,usernam outdid barbi dream shit savag loudli cri face roll floor laugh
3318,home runnin like griffey switchin like sissi nigga iffi bitch tune switchin take em jiffi crown fire hashtag hashtag hoe switch shrug emoji modifi fitzpatrick type number zero width joiner femal sign usernam love brain x fire heavi black heart
3319,usernam kinda still glad wait bum barbi dream right wait one day
3320,usernam _nmv usernam usernam number
3321,hashtag shakin ass get readi usernam
3322,usernam yesss person fold hand princess emoji modifi fitzpatrick type number
3323,usernam album artist httpaddr
3324,ayo hashtag usernam fuck bop like whole album hashtag go buy stream
3325,queen issa bop sparkl usernam
3326,usernam _eternallymaraj cours twitter barbz hype trash song face roll eye
3327,usernam usernam favourit song
3328,usernam well girl wee def
3329,usernam blast hashtag hashtag morn number number number number neighbor come knock door u turn kid sleep lucki mini hashtag anyway
3330,usernam usernam usernam pictur
3331,still got hashtag repeat usernam ate ok hand sign emoji modifi fitzpatrick type number hashtag
3332,usernam usernam aww glad know use screen record function phone
3333,usernam usernam love much
3334,gusto el nuevo disco de usernam pictur
3335,usernam usernam usernam u
3336,look vile nicki fan fan swipe usernam pictur
3337,song hashtag album nickiminaj snap like omg loudli cri face
3338,usernam usernam wig loudli cri face face tear joy
3339,usernam well pictur
3340,still hittin boo keep usernam
3341,usernam usernam info chico estamo nominado mejor fandom en lo teen choic number vamo en el numberdeg puesto con el number recuerden que lo rt valen solo la respuesta tweet asi que vayan twitter votar hashtag hashtag usernam bananahansen
3342,usernam usernam usernam much everyth love sell first week oh
3343,usernam fav song sir wish would let futur whole next album numberfutur yall gone learn goat best song hand boo congrat ya new album x person rais hand celebr clap hand sign clap hand sign clap hand sign
3344,listen album like rest world nicki stan like usernam support hashtag
3345,listen hashtag usernam usernam httpaddr
3346,usernam usernam usernam thank much x
3347,_kirstymatthew usernam wtf
3348,usernam usernam u trash bar line sick
3349,usernam pleas releas sorri w na need bop right nooowwww ili queen
3350,usernam usernam usernam perform
3351,usernam usernam si snap whew fire fire
3352,usernam pictur
3353,usernam snap lace front pictur
3354,usernam usernam usernam usernam what ethan grayson starter pack face tear joy face tear joy happi person rais one hand emoji modifi fitzpatrick type number number zero width joiner femal sign happi person rais one hand emoji modifi fitzpatrick type number number zero width joiner femal sign happi person rais one hand emoji modifi fitzpatrick type number number zero width joiner femal sign happi person rais one hand emoji modifi fitzpatrick type number number zero width joiner femal sign happi person rais one hand emoji modifi fitzpatrick type number number zero width joiner femal sign
3355,usernam usernam usernam work amaz love face scream fear smile face heart shape eye
3356,usernam usernam usernam usernam fan sir
3357,usernam usernam fr
3358,feel like hashtag next singl least one singl bop deserv music video fire fire fire hashtag usernam x usernam x usernam sparkl heart collis symbol smile face sunglass hashtag
3359,usernam usernam usernam usernam usernam usernam usernam part twitter number though face tear joy face tear joy
3360,usernam _nmv sjksjjsjjk
3361,usernam nip tuck loudli cri face loudli cri face say use curv nigga like youskrr skrr swerv nigga like youeven though heard might doi get concern caus like damn loudli cri face loudli cri face loudli cri face loudli cri face loudli cri face loudli cri face loudli cri face loudli cri face loudli cri face
3362,new music end weekend afternoon checkout usernam shay inumb usernam queen album usernam medicin ep smile face sunglass sign horn emoji modifi fitzpatrick type number thank later hashtag
3363,usernam usernam love heavi black heart heavi black heart heavi black heart heavi black heart
3364,usernam usernam usernam usernam tea
3365,usernam
3366,convinc usernam never go acknowledg dramat read anaconda
3367,usernam usernam want put expect repeat
3368,usernam usernam come europ black heart suit black heart suit black heart suit
3369,yo usernam ruin great song usernam handl
3370,usernam usernam yo ass tho
3371,thank barbi dream music soul fed usernam
3372,usernam usernam usernam usernam usernam usernam httpaddr
3373,usernam usernam outtro follow coco chanel smile face heart shape eye fire fire fire
3374,usernam would u tweet
3375,come see usernam oof tire face loudli cri face that type song ok hand sign emoji modifi fitzpatrick type number smile face heart shape eye face throw kiss grow heart swear first number time heard song gave goosebump everywher ok hand sign emoji modifi fitzpatrick type number sparkl
3376,nicki need music video majesti usernam
3377,usernam um pictur
3378,usernam usernam usernam usernam usernam usernam probabl mar pictur
3379,know biggi heard barbi dream proud usernam right song fuck kill
3380,shouldv made album love usernam start stan httpaddr
3381,usernam deni queen live pictur
3382,usernam ok cute pictur
3383,usernam usernam want thank chang life make believ dream make realiz dream make love someon far away want thank make happi strong want thank everyth
3384,usernam knew worth hashtag hashtag httpaddr
3385,usernam spent lunch break listen album part epic moment proud nicki reliev face reliev face hashtag hashtag hashtag hashtag pictur
3386,usernam usernam usernam usernam usernam usernam usernam usernam usernam usernam free fall number week top number left top number sinc releas april tf mean free fall featur ariana lastest featur tlic promo singl without radio promo
3387,confesso que viciado muito novo album de usernam hahahaha
3388,usernam wanna make chang ganja burn swap na song real quick one look pictur
3389,chun swae fuck fire repeat nightttt fire fire fire fire fire fire fire fire fire fire fire fire fire fire fire fire fire fire fire fire fire fire fire fire fire fire fire fire fire fire fire fire usernam usernam hashtag
3390,usernam usernam usernam usernam usernam drake fan pictur
3391,ok ganja burn anoth level slayag omg tk ow explain perfect hashtag usernam
3392,alright lie usernam new album pretti hype
3393,usernam pictur
3394,usernam dead listen barbi dream lmfaoooooo
3395,usernam album fire fire fire face tear joy face tear joy
3396,real queen know what ok hand sign emoji modifi fitzpatrick type number smirk face usernam two heart hashtag pictur
3397,usernam ill hit quit give af famou
3398,thurst new album drool face smile face heart shape eye weari face hashtag usernam pictur
3399,usernam usernam would dope
3400,usernam omg
3401,said man fetti wap nigga stay eye shit nigga got one eye weari face nickiminaj
3402,usernam usernam mood
3403,usernam usernam hashtag fire collis symbol collis symbol
3404,usernam usernam cute
3405,usernam thank queen radio fan number im big willi bike gear
3406,usernam usernam usernam usernam usernam usernam usernam usernam usernam someon go check cardi lmfaoooo
3407,usernam pictur
3408,lil makeup look queen usernam pictur
3409,cada cancion es lo ma toda son mi favorita lit hashtag usernam heavi black heart
3410,wait usernam swore sorri shelli thunder song first place mad album weari face jamaican cri
3411,cannot wait wear everi singl day fuckkkkk hashtag usernam pictur
3412,usernam usernam bihhhh snap
3413,sad see peopl get offend jealou someon success look usernam usernam usernam success artist yet support bambbbbb releas fantast album face ok gestur emoji modifi fitzpatrick type number zero width joiner male sign god bless
3414,usernam usernam uh yeah want retweet pile poo weari face roll floor laugh roll floor laugh roll floor laugh
3415,usernam si got anoth question na offici kingdom daddi pictur
3416,usernam usernam usernam buy stream queen pictur
3417,camp friend asleep time give queen medic listen stargaz usernam fuck ador album surpass expect liter everyon around n n n g
3418,usernam slide track dm thank
3419,usernam would ever consid creat eyeshadow vault like eyeshadow palett repres album least one eyeshadow palett queen pictur
3420,tell eat cooki caus good kiss cat face close eye tongu eat cooki got good form usernam hashtag hashtag hashtag hashtag fire fire fire
3421,guy understand great hashtag like damn crown crown crown everytim listen freak shit usernam
3422,usernam usernam usernam usernam usernam second line pictur
3423,chun swae face look triumph fire usernam
3424,usernam thank much song heavi black heart heavi black heart httpaddr
3425,usernam usernam usernam usernam usernam ili
3426,usernam usernam usernam que ela chamou ele de gordo
3427,usernam pictur
3428,usernam usernam snap new work music
3429,usernam usernam pictur
3430,usernam bop
3431,usernam usernam eye usernam
3432,usernam usernam usernam obvious know noth histori hip hop therefor opinion much invalid
3433,usernam congrat album usernam hashtag
3434,usernam usernam
3435,four year usernam new album hashtag fire httpaddr
3436,usernam usernam heavi black heart
3437,nicki new album tho fire usernam
3438,usernam u better give hashtag fireburn treatment either need video singl treatment
3439,usernam usernam usernam usernam usernam usernam usernam fuck cardi b
3440,usernam usernam usernam usernam usernam face tear joy face tear joy face tear joy face tear joy guy
3441,miss hear usernam drop bomb usernam usernam listen hotnumb app httpaddr pictur
3442,usernam queen fuckin bop
3443,yooo usernam clown barbi dream face tear joy skull
3444,even today tell favourit hashtag cri face smile face open mouth cold sweat loudli cri face loudli cri face usernam u end whole life good job wink face heavi black heart heavi black heart obsess face stuck tongu tightli close eye
3445,usernam usernam night face throw kiss face throw kiss face throw kiss face throw kiss
3446,wish fav usernam would follow face roll eye love face throw kiss hashtag hashtag hashtag
3447,beyonc good form usernam hashtag hashtag pictur
3448,never mention anoth femal rapper except usernam femal rapper year httpaddr
3449,usernam usernam usernam basic nicki song na use sampl traci get clear time gave us option either push back august number keep august number barbz chose number soooo nicki plan releas song littl aft
3450,preciso de um clipe ofici da coco chanel obrigada de nada usernam play face tear joy pictur
3451,usernam pictur
3452,muito obrigada usernam pelo video da normani
3453,usernam bitch live wanna talk
3454,final got top favorit queen album barbi dream hard white llc chun swae goodform fire fire usernam hashtag
3455,date get mix signal song face roll eye usernam
3456,hashtag usernam label fuck nut defend one queen rap anybodi tri bring femal rapper stay relev number year without drop fking album baddest bitch realest bitch
3457,usernam httpaddr
3458,queen usernam go live tonight hashtag eye x
3459,usernam explain maam pictur
3460,usernam usernam usernam usernam usernam bad pensiv face
3461,hashtag usernam best album yet fire fire fire fire pictur
3462,usernam usernam best song xxx
3463,traci chapman song lyric bridg burn come back one day haunt face tear joy face tear joy face tear joy face tear joy face tear joy face tear joy face tear joy face tear joy hate train driven wheel boo karma wheel turn see trainwreck driven usernam
3464,usernam usernam usernam usernam usernam usernam like pictur
3465,usernam heavi exclam mark symbol heavi exclam mark symbol heavi exclam mark symbol heavi exclam mark symbol heavi exclam mark symbol httpaddr
3466,usernam nickiminaj usernam rap gangsta love new record sorri song make cut queen httpaddr
3467,usernam usernam usernam usernam threaten skull almost feel bad
3468,usernam delux edit wanna look like ungrat need know heheh crown
3469,usernam hashtag biggest gag time hashtag fact usernam eat pussi wife happi pussi known catfish list groupi hashtag hashtag brother touch child lmao bet
3470,hashtag majesti usernam feat usernam play deadpool monopoli smile face horn hashtag httpaddr
3471,usernam hashtag quak boot love
3472,gotta king statu get ya bodi fuck yeah caus queen embodi queen usernam crown hashtag hashtag still line though person bow deepli emoji modifi fitzpatrick type number zero width joiner femal sign sparkl pictur
3473,usernam real hashtag sorri cardi zebi stac obok krolowej trzeba robic co wiecej niz bengeri radia fire
3474,usernam usernam caus make sens pictur
3475,usernam pictur
3476,usernam usernam well httpaddr
3477,usernam usernam link huhu
3478,algun dia dejar de darl tanto clockwis rightward leftward open circl arrow hashtag de usernam pictur
3479,usernam pictur
3480,usernam usernam usernam usernam usernam usernam usernam bad boy red velvet
3481,usernam usernam
3482,usernam album fire fire fire like snatch wig pictur
3483,usernam usernam usernam usernam noth wrong artist mix song anoth exampl real origin music becom rare
3484,usernam run hide favorit babe heavi black heart heavi black heart heavi black heart queen crown pictur
3485,somebodi get touch queen usernam realli queen gotta let know could ever doubt heard look heiress eye grow heart
3486,usernam usernam tast wbk
3487,usernam see barbi dream fire fire fire fire majesti fire fire fire fire fire fire fire fire fire fire fire fire eye eye eye flush face usernam list goe salut princess
3488,usernam hashtag album best nd realli love ur nonumb track ganja burn smile face smile eye smile face smile eye best eii u got fire ur track smile face smile eye heavi black heart two heart hundr point symbol
3489,usernam usernam bitch would door like pictur
3490,usernam new york new york new york queen album usernam qatar httpaddr
3491,realli love hashtaglateinterlud usernam fire fire fire
3492,usernam bout make nikka barbi dream ye man need see em ol video epic hashtag pictur
3493,usernam usernam hashtag fire fire fire keep thing hundr point symbol album usernam bomb hashtag hashtag victori hand emoji modifi fitzpatrick type number
3494,usernam new ghostwrit tri small
3495,usernam usernam eu te amo
3496,usernam _alli_with_an_i drake line amaz cri face
3497,usernam usernam smile inspir pictur
3498,usernam usernam lol pleas pleas pleaaeeee beg cover come see
3499,real talk need see footag usernam write record good form bc need know abl come banger song hashtag
3500,usernam never bought usernam album one love hip hop know usernam vers take heart would fight lil kim say word
3501,usernam usernam lol
3502,usernam drop number pictur
3503,usernam usernam usernam danc beat pictur
3504,hashtag hashtag usernam weekend made pictur
3505,usernam usernam usernam omg shade
3506,would great addit hashtag usernam httpaddr
3507,need sorri music video summer usernam usernam
3508,usernam aint god good
3509,usernam usernam pictur
3510,usernam usernam usernam black queen stan
3511,hi love nicki minaj think listen queen number time today thank queen usernam
3512,usernam _eternallymaraj
3513,good thing sorri clear usernam album beauti face tear joy face tear joy face tear joy
3514,usernam usernam usernam read said face roll eye face roll eye face roll eye face roll eye face roll eye pictur
3515,usernam leak
3516,winner year usernam award goe usernam barbi dream smile face heart shape eye smile face heart shape eye smile face heart shape eye smile face heart shape eye
3517,barbi dream realli song thought outsid packag girl queen princess emoji modifi fitzpatrick type number reason usernam
3518,usernam n usernam pleas make video majesti pleas need video hashtag fire fire fire fire fire
3519,usernam usernam christian server pictur
