,tweet
0,usernam usernam usernam bop
1,usernam usernam usernam normani got girl talk pictur
2,usernam queen straight fire barbi dream top track album fire person rais hand celebr emoji modifi fitzpatrick type number hashtag hashtag
3,usernam go
4,hashtag ridicul usernam
5,usernam damn si know sing fuck vocal jesu
6,usernam hashtag httpaddr
7,usernam snap like sneez face grimac face fire
8,come see self destruct weapon usernam hashtag face cold sweat
9,usernam usernam pictur
10,love album heavi black heart heavi black heart hashtag back top usernam person rais hand celebr pictur
11,life mission learn lyric mistak hesit word number word barbi dream start finish kill bitchessss hashtag usernam legendari knew pictur
12,normani dan la public instagram de usernam pictur
13,usernam usernam usernam usernam usernam loudli cri face shit bag tho fire
14,imagin usernam perform either good form barbi dream hashtag transit coco chanel bring foxi would histor moment hashtag
15,usernam usernam face tear joy face tear joy face tear joy face tear joy face tear joy self titl cohes hahahahahahahahah
16,usernam usernam smash hit come
17,usernam usernam duo fact tho
18,usernam usernam usernam look
19,usernam nicki dont play pictur
20,touch tongu close breath usernam si eye pictur
21,hashtag bitch listen hashtag usernam pictur
22,usernam usernam usernam usernam yeah mad lol
23,usernam still give us documentari
24,want usernam usernam collab fuck bad omg would favorit song everrrrr
25,usernam usernam good fine
26,fefe numberixnumberin usernam usernam elig certifi platinum unit state sell number number number unit region indic symbol letter u region indic symbol letter optic disc pictur
27,usernam usernam know deserv number wrote sksk
28,usernam usernam saw bottl store loudli cri face
29,usernam _bloody_sho nicki tweet like
30,nickiminaj usernam unit sorri httpaddr
31,usernam usernam usernam usernam fact
32,usernam queen love pictur
33,usernam usernam usernam usernam nicki aint blood tho that thing
34,amaz work usernam hashtag
35,usernam bitch get grammi feel come pictur
36,usual skip least number number song album come usernam hashtag whole thing fire fire fire two heart
37,usernam greatest femal rapper time queen queen queen crown crown crown crown crown crown crown crown crown crown crown
38,usernam quot situat wait get fight someon
39,usernam song replac
40,usernam usernam bem plena aqui esperando senhorita fazer favor de lancar seu album e eu ficar toda hora comentando
41,usernam usernam need remix llc beat fire fire fire
42,usernam usernam nicki minaj feat na sorri httpaddr usernam usernam pictur
43,usernam usernam bih good
44,realli enjoy usernam album
45,_shiyaaa usernam face roll eye face roll eye
46,new album usernam prove queen
47,usernam pictur
48,usernam usernam what ur fav song babe
49,usernam usernam usernam smile face heart shape eye smile face heart shape eye smile face heart shape eye smile face heart shape eye
50,usernam usernam usernam queen
51,usernam usernam album milenio
52,usernam httpaddr
53,rannnnn nip tuck mann face palm emoji modifi fitzpatrick type number zero width joiner male sign fire fire usernam
54,usernam usernam usernam usernam usernam safari weari face skull pictur
55,usernam get told like liter said tf big mad imp pictur
56,usernam usernam hashtag hashtag hashtag
57,usernam hater ugh
58,usernam kill bitch face palm emoji modifi fitzpatrick type number zero width joiner femal sign skull
59,usernam usernam usernam usernam usernam usernam usernam usernam usernam usernam usernam usernam usernam keep laugh sweeten
60,usernam clap hand sign emoji modifi fitzpatrick type number clap hand sign emoji modifi fitzpatrick type number clap hand sign emoji modifi fitzpatrick type number clap hand sign emoji modifi fitzpatrick type number clap hand sign emoji modifi fitzpatrick type number clap hand sign emoji modifi fitzpatrick type number clap hand sign emoji modifi fitzpatrick type number
61,usernam usernam usernam usernam liar
62,unreleas stuff got usernam smile face horn smile face horn smile face horn hashtag
63,usernam usernam usernam usernam usernam usernam usernam usernam usernam usernam usernam usernam usernam usernam usernam soco na mutant
64,usernam usernam also use outdat vocabulari bar like sissi say caught look dress like bad thing think face pictur
65,usernam usernam usernam usernam usernam stick togeth pictur
66,love usernam
67,would dm usernam hashtag
68,usernam usernam drake dj khale dead good face scream fear face tear joy
69,hashtag fire usernam
70,usernam usernam forreal x
71,epic collect number track best boldest work record date second review album queen metacrit note number album usernam usernam pictur
72,jealousi diseas die slow face throw kiss usernam yike fire hashtag unicorn face pictur
73,usernam usernam hahahaha new song barbi dream face tear joy face tear joy
74,usernam usernam titl silli
75,usernam usernam usernam usernam usernam what dont know come letter
76,usernam usernam bad bitch tingz usernam smile face heart shape eye
77,numbertimez hashtag sorri usernam usernam
78,aaaaah haaaaaaaaa say usernam laugh httpaddr
79,usernam niiiickiiii
80,usernam pictur
81,usernam usernam
82,usernam usernam usernam bop
83,yo stop listen barbi dream like usernam ever kill shit weari face fire hundr point symbol
84,unicorn face stan queen usernam everywher even host crown pictur
85,usernam pictur
86,hashtag hashtag hashtag hashtag hashtag hashtag hashtag usernam usernam pictur
87,usernam releas lyric video barbi dream gp eat
88,usernam albumunun ulkemd number olmasi benim muzikariyerim acisindan bana httpaddr verdi
89,usernam deserv queeeeeennnnn pictur
90,girl defin got next gone shine usernam hashtag
91,usernam usernam usernam usernam irem neden birinci acaba amk
92,usernam usernam compar st queen point hypocrisi dismiss queen good album cohes
93,usernam pictur
94,holi fuck usernam bitchhhhhh im fuck scream album fuck amaz
95,omg im still shook majesti true hashtag usernam drop album
96,usernam usernam album hashtag garbag ever thing chun li great barbi dream song lmaooo recycl song mixtap day back like number call dream fell longgg way smh face palm zero width joiner male sign
97,usernam usernam chun swae majesti
98,give fuck like fueurkind happi hug face hug face hug face usernam fire fire fire hundr point symbol hundr point symbol smile face heart shape eye smile face heart shape eye smile face heart shape eye parti popper parti popper parti popper confetti ball confetti ball confetti ball clink glass clink glass clink glass hashtag crown
99,usernam proud
100,alexa play barbi dream x usernam person blond hair emoji modifi fitzpatrick type number zero width joiner femal sign grow heart two heart unicorn face
101,usernam queen album hard fuck worth wait
102,usernam usernam usernam man sir
103,usernam na know chocol delici pictur
104,love usernam much alway alway
105,usernam bitch
106,pretti sure usernam made hashtag two heart thank nicki need
107,usernam hashtag need clear record okay music industri need usernam usernam hashtag
108,listen usernam sinc releas still get enough queen track track hit love album much
109,usernam httpaddr pictur
110,usernam usernam natur perfect right record video today pictur
111,usernam ahem hashtag pictur
112,nicki minaj chun li httpaddr hashtag hashtag usernam
113,usernam usernam fala da nicki ma nao lancou seu album ainda ne pensa que engana pictur
114,collab brilliant heavi heart exclam mark ornament heavi heart exclam mark ornament heavi heart exclam mark ornament usernam usernam usernam touch hashtag hashtag heavi heart exclam mark ornament hashtag hashtag hashtaghashtag angel voic hashtaghashtag httpaddr
115,usernam usernam true queen
116,usernam usernam gonna end get beat behind artist
117,usernam usernam usernam wait wtf majesti low better debut top number hot number pictur
118,usernam top five
119,say better prankster hashtag usernam fire ok hand sign emoji modifi fitzpatrick type number
120,true bad bitch aint weak bitter usernam
121,usernam usernam love bitch
122,usernam pictur
123,usernam usernam usernam usernam usernam usernam usernam usernam usernam girl read repli wrong thread
124,usernam queeeeeen explain one x think face httpaddr
125,usernam usernam numberhoodlum hardli clear record shrug emoji modifi fitzpatrick type number zero width joiner male sign
126,numberc usernam usernam usernam usernam usernam usernam usernam numberchainz usernam usernam usernam usernam usernam usernam usernam usernam usernam usernam usernam usernam usernam usernam numberfutur usernam usernam usernam usernam usernam usernam usernam usernam usernam usernam usernam usernam usernam usernam usernam usernam usernam usernam usernam usernam usernam usernam usernam usernam usernam usernam written god bless seventh day sanctifi rest work god creat made
127,usernam put ganja burn first song want hear entir album song ring much truth fire fire fire album exemplari face throw kiss xo usernam
128,usernam bitch face look triumph pictur
129,hashtag think food hashtag usernam
130,excus usernam get mine like fuck need babi httpaddr
131,usernam said pictur
132,usernam thank queen
133,wonder usernam put barbi tingz hashtag pictur
134,usernam hashtag song play merced ad hhmm great tast pictur
135,usernam usernam usernam usernam omg stop lol
136,usernam usernam usernam httpaddr
137,usernam usernam hashtag fire fire fire fire fire regrann usernam yooooo loudli cri face loudli cri face loudli cri face loudli cri face nicki lmfaooo whyyyyyy em like thattttt hashtag usernam hashtag hashtag hashtag hashtag hashtag hashtag httpaddr
138,usernam new album secur titl queen rap well never mind
139,ok slap usernam pictur
140,usernam usernam sleep face sleep face sleep face wait fail tell none top chart closest barbi dream number that highest one
141,yo usernam want nicki minaj tv back hashtag hashtag
142,hashtag coco chanel feat foxi brown par usernam sur hashtag httpaddr
143,usernam usernam collab
144,heard song yet know good usernam could made nickxna hashtag number glue inspir back coco chanel pictur
145,usernam new album though smile face heart shape eye smile face heart shape eye smile face heart shape eye smile face heart shape eye love prob favourit far hashtag pictur
146,come see new anthem usernam
147,usernam usernam usernam pictur
148,usernam thank much bring old usernam back zone song dope pictur
149,majesti shit usernam hashtag hashtag full moon face smile face horn unicorn face fire heavi black heart
150,usernam tell er say ye
151,usernam perfect ok hand sign emoji modifi fitzpatrick type number usernam hashtag httpaddr
152,usernam usernam queen
153,sleep happi ignor aga usernam xoxo guy see u numbermorrow
154,usernam crown gem stone comet smile face sunglass pout face
155,need anoth ellen interview usernam
156,dude usernam spill whole ass teapot barbi dream
157,usernam usernam usernam usernam usernam usernam usernam hashtag
158,usernam usernam usernam httpaddr pictur
159,usernam usernam fact like omg queen smile face heart shape eye face tear joy face tear joy
160,usernam usernam usernam omg yesterday forgot check weari face
161,usernam usernam happen
162,usernam hashtag repeat person rais hand celebr emoji modifi fitzpatrick type number fire black heart suit usernam pictur
163,usernam usernam usernam booooooooooooor ii wast data disappoint reliev face disappoint reliev face pictur
164,usernam pictur
165,usernam usernam usernam outstream chun li
166,usernam would get insan dm tag woah didnt think smart cooki wonder nicki minaj usernam
167,usernam usernam love ass
168,usernam liter damag ear listen llc right hope ur happi
169,usernam hace todo bien
170,usernam opinion usernam queen princess emoji modifi fitzpatrick type number
171,usernam listen queen day soooo fuck good fire fire fire fire
172,usernam usernam cancel
173,usernam si better get ha pictur
174,usernam bar
175,usernam half decad bnumber listen album face tear joy face roll eye howev usernam lil queen reppin anoth queen congrat flex bicep emoji modifi fitzpatrick type number crown princess emoji modifi fitzpatrick type number nail polish emoji modifi fitzpatrick type number hashtag multipl music note fire pictur
176,usernam pick hashtag side sinc mixtap luhhh
177,usernam vote wait soooooo come us muvaaaaa loudli cri face skull
178,ever click know click iz usernam
179,usernam usernam face open mouth face open mouth face open mouth face open mouth
180,listen usernam school work heavi black heart fire hashtag hashtag hashtag pictur
181,usernam usernam usernam usernam fave releas second album cs singl flop take sever seat
182,usernam majesti featur usernam usernam fire em certainli show kick ass rapid fire rap skill still left year nice job track three
183,hashtag usernam love si two heart album icon reliev face hashtag hashtag hashtag hashtag hashtag hashtag pictur
184,usernam usernam rippp
185,usernam usernam usernam surpris nicki minaj
186,usernam usernam play wtf
187,miss usernam make song mf singl gonna problem pictur
188,usernam
189,usernam joke si pictur
190,lmfaooooooooooooo omfg usernam
191,usernam said know pussi wet cri shit face tear joy loudli cri face felt soul
192,usernam usernam usernam hashtag number countri okay keep tell face tear joy
193,jeremi fire start work pump get home sleep im listen usernam new album drink busch light alon hashtag
194,usernam usernam love lern jergi revolv heart revolv heart revolv heart revolv heart beat heart smile face heart shape eye face throw kiss
195,usernam usernam usernam queen
196,usernam usernam dear nicki pictur
197,usernam usernam usernam classic omg
198,usernam come see heavi black heart heavi black heart heavi black heart heavi black heart heavi black heart pensiv face feel hashtag
199,usernam usernam pictur
200,barbi dream though face tear joy usernam
201,usernam usernam usernam samee pleas explain
202,usernam usernam album bang
203,usernam usernam usernam track traci trashbag deni unoffici releas lmaoo
204,everi time het high think usernam hashtag
205,usernam usernam usernam usernam usernam usernam usernam usernam lol
206,usernam fli fuck bitch nic
207,lmfao mani react like hashtag loudli cri face loudli cri face loudli cri face loudli cri face usernam shit gosh hashtag hashtag usernam pictur
208,came back hope usernam visual least would moment femal rap coco chanel wake sleep face want shrug emoji modifi fitzpatrick type number zero width joiner male sign pictur
209,usernam hashtag smile face heart shape eye smile face heart shape eye smile face heart shape eye smile face heart shape eye pictur
210,usernam tell pick side
211,usernam usernam usernam usernam usernam tri usernam like man leav bitch alon
212,usernam wow tht made happi
213,gotta king statu get ya bodi fuck yea caus queen embodi person rais hand celebr emoji modifi fitzpatrick type number crown smile face heart shape eye ok usernam hundr point symbol
214,usernam usernam take moment follow show that imposs get follow speak evil monkey eu te amo
215,stop listen nicki album hashtag sinc came shit realli masterpiec album without skip song real mf talent right usernam pictur
216,usernam realli said real make nigga scrap pussi young ladi luck get strap pussi weari face would odel beckham bang cake till saw hoppin car dancin drake face tear joy face tear joy hand index middl finger cross hand index middl finger cross hand index middl finger cross nail polish nail polish
217,might gotten hashtag still need hashtag love song usernam pictur
218,usernam foxyyyyyyyyyy everyth hashtag pictur
219,amaz album usernam hashtag go hard call hand emoji modifi fitzpatrick type number call hand emoji modifi fitzpatrick type number
220,usernam realli someth differ hashtag differ anthoni ever done time gave us throwback si thing
221,omg usernam snap good form yasss queen smile face heart shape eye smile face heart shape eye smile face heart shape eye tongu clap hand sign emoji modifi fitzpatrick type number number clap hand sign emoji modifi fitzpatrick type number number clap hand sign emoji modifi fitzpatrick type number number
222,usernam usernam usernam usernam httpaddr
223,let usernam dress room steal everyth sight
224,mom two heart two heart usernam hashtag pictur
225,usernam usernam well care leak si releas
226,usernam usernam pictur
227,usernam say middl queen right thinkin see call shit queenthi bitch realli f ckin queen felt weari face fire
228,play hashtag usernam hashtag mahjong tile red dragon squar cjk unifi ideograph number izakaya lantern japanes doll httpaddr
229,bed surpass number million view spotifi right first track hashtag achiev mileston congrat usernam usernam httpaddr
230,im sure bout errrrrbodi els stop check usernam heard usernam
231,waaah jvien de comprendr que outro etait la suit de coco chanel j ador hashtag hashtag usernam
232,period mama usernam pictur
233,usernam like crazi atlant record need stop
234,numberchainz usernam usernam usernam usernam numberixnumberin usernam mad one bro yor hundr point symbol multipl music note bottl pop cork bottl pop cork person fold hand gem stone hear evil monkey see evil monkey see evil monkey r money wing money wing money wing money wing money wing princess sunset build princ emoji modifi fitzpatrick type number number
235,usernam usernam usernam usernam usernam nah beat
236,usernam queeeeeeen new album fire fire fire
237,usernam usernam scream bad bitch
238,usernam usernam top number ganja burn majesti barbi dream thought knew good form wich
239,usernam usernam usernam usernam usernam usernam
240,usernam usernam exigimo colaboracion
241,usernam usernam bodi look definit doubt need listen song see see vampir look lestat
242,usernam usernam usernam usernam usernam usernam least actual photoshop use use black marker cover everi part bodi face
243,usernam sooooo gonna see ellen radio interview
244,usernam read khale hashtag hyster face tear joy face tear joy face tear joy face tear joy laugh dat
245,usernam pictur
246,usernam casper necessari good form play
247,usernam im tri team hundr point symbol
248,usernam usernam usernam usernam usernam word sound draki
249,usernam usernam gif nsjsjsjsjsjsjsjsjsnsnsjsj
250,usernam said go barb
251,usernam usernam usernam see
252,usernam play right pictur
253,usernam still trend hashtag
254,usernam usernam usernam usernam hashtag
255,usernam usernam yasssssss fire fire fire fire fire fire ring ring ring ring ring ring ring ring ring ring ring ring ring ring ring ring ring ring babi emoji modifi fitzpatrick type number babi emoji modifi fitzpatrick type number babi emoji modifi fitzpatrick type number babi emoji modifi fitzpatrick type number babi emoji modifi fitzpatrick type number babi emoji modifi fitzpatrick type number babi emoji modifi fitzpatrick type number babi emoji modifi fitzpatrick type number babi emoji modifi fitzpatrick type number babi emoji modifi fitzpatrick type number babi emoji modifi fitzpatrick type number babi emoji modifi fitzpatrick type number babi emoji modifi fitzpatrick type number babi emoji modifi fitzpatrick type number babi emoji modifi fitzpatrick type number babi emoji modifi fitzpatrick type number httpaddr
256,usernam usernam usernam pictur
257,usernam still chart without si soo good luv heavi black heart inform desk person clap hand sign
258,usernam usernam hashtag httpaddr
259,usernam usernam want number
260,usernam usernam smile face sunglass
261,usernam said thing broke handsom realli felt hashtag loudli cri face loudli cri face
262,usernam usernam usernam ur fave lose pictur
263,lmfao usernam petti man forgotten go way level huh lol
264,usernam pictur
265,usernam pictur
266,playinghard white usernam hashtag hashtag pictur
267,usernam usernam
268,usernam usernam usernam tell see
269,usernam usernam usernam omg cupcakk stan tast heavi black heart
270,usernam r u talkin bout girl came beat one
271,usernam usernam heard hashtag usernam
272,usernam trash pictur
273,usernam queen
274,like usernam basic announc na thing tryna deflect talk traci nah si tea
275,usernam usernam pleas let get trend
276,fuck number time night peac victori hand emoji modifi fitzpatrick type number number usernam usernam new album tho fire pictur
277,usernam usernam love lauren heavi black heart heavi black heart heavi black heart heavi black heart heavi black heart heavi black heart heavi black heart
278,hashtag give life right fire usernam
279,might go usernam royal farm arena baltimor md sep number httpaddr
280,usernam usernam especi barbi dream fire fire fire
281,usernam bihhhhh ili face tear joy face tear joy blue heart sign horn emoji modifi fitzpatrick type number number extraterrestri alien
282,find usernam use hashtag beat merced commerci black heart suit fire hashtag mind black heart suit
283,usernam documentari xx face look triumph face tear joy
284,want redo vers majesti never heard get wash never usernam em came blood said bodi like last time
285,usernam thank shift cultur fire httpaddr
286,usernam usernam whatup young nigga join youngmoney
287,never realli listen usernam damn new album fire fire
288,usernam usernam usernam usernam usernam usernam face tear joy face tear joy face tear joy face tear joy
289,nick usernam need hashtag thank hashtag person fold hand emoji modifi fitzpatrick type number
290,usernam ima shoot b tch put gun hip shoot miss trace
291,wss shoe store commerci use starship beat radio get check skull usernam
292,felt usernam
293,let wife stream hashtag usernam also hook fire
294,usernam usernam usernam hashtag nashashtag hashtag hashtag hashtag hashtag hashtag hashtag hashtag hashtag hashtag hashtag hashtag hashtag httpaddr
295,usernam usernam bop preorder sweeten
296,usernam usernam usernam follow noth opinion ya simpl mind ass
297,usernam usernam wild af roll floor laugh roll floor laugh roll floor laugh
298,usernam go keep use usernam refer song lol
299,ganja burn workout track fire _ usernam
300,usernam usernam usernam si u tri u murder dancer dancer
301,nickiminaj got hashtag lp flush face smile face heart shape eye hashtag hashtag hashtag
302,usernam usernam es por molestar pero para cuando deja de ser manger de tu novio saca tu album estamo en sequia de musica pd te amo bloque siguem por favor person fold hand emoji modifi fitzpatrick type number number
303,usernam
304,fuck talk nicki rt usernam nuttin like skippi want wife missi like sippi
305,know usernam hashtag heart usernam stop play past number number hour
306,wait album longesttttt usernam thank youuuuuu face palm emoji modifi fitzpatrick type number zero width joiner male sign fire smile cat face heart shape eye person rais hand celebr emoji modifi fitzpatrick type number
307,ok love usernam queen black heart
308,chun swae usernam fire late night bop pictur
309,usernam usernam omg si got suspend loudli cri face
310,usernam adress name age u want
311,usernam usernam thought collab might happen normani nicki eye
312,realli think hashtag hashtag favorit hashtag crown usernam
313,litreal album repeat sinc friday usernam album fire fire fire hashtag pictur
314,uncondit moment blue heart usernam hashtag x
315,usernam heavi black heart httpaddr
316,usernam wake releas beauti usernam new album headphon hashtag hot choreographi dancer emoji modifi fitzpatrick type number dancer emoji modifi fitzpatrick type number amaz usernam hashtag hashtag httpaddr
317,usernam usernam yesss
318,usernam usernam ditto
319,usernam hashtag vinyl record
320,damn wtf look cat face tear joy cat face tear joy cat face tear joy skull skull skull usernam httpaddr
321,usernam hashtag hashtag hashtag usernam httpaddr
322,usernam would album number pictur
323,usernam wanna talk pictur
324,usernam usernam usernam usernam usernam usernam usernam usernam usernam usernam usernam usernam still tryna say girl run world k
325,usernam usernam wig
326,usernam usernam usernam usernam debunk whole argument one line gif obvious mad ass fan come good side live good life
327,usernam httpaddr
328,im appreci chun li even weari face weari face weari face weari face weari face weari face weari face weari face weari face weari face usernam hashtag
329,usernam usernam album drop xx
330,usernam shout usernam banger friendship ina way face tear joy
331,usernam listen new usernam song call hashtag featur usernam httpaddr pictur
332,usernam best album best song love queen crown smile face heart shape eye usernam usernam usernam hashtag hashtag hashtag pictur
333,usernam usernam usernam usernam usernam usernam nicki queen ariana run pop cardi princess
334,usernam savag sexi
335,usernam usernam
336,face hear usernam snap usernam new cut pictur
337,usernam hashtag who replac usernam tour sinc gonna behind bar skull
338,got life sir usernam
339,usernam usernam usernam hollllup cardi beauti sister beauti nicki minaj beauti like everi human beingso simmer dusti
340,usernam usernam need collab pleaseewwwww
341,fave song usernam new album hashtag hashtag usernam fuck hashtag nah care came head snatch wig usernam
342,usernam omg omg usernam jesu bitch httpaddr
343,usernam usernam greatest time year
344,usernam hashtag usernam hashtag hashtag hashtag httpaddr
345,usernam usernam live san francisco california closet one
346,usernam usernam lol appreci
347,usernam si face tear joy eye httpaddr
348,mayb see somebodi leak usernam eye eye eye
349,usernam usernam usernam usernam usernam usernam lol kakhulu ntwana
350,love usernam
351,hashtag usernam hashtag need push
352,usernam usernam usernam usernam usernam usernam usernam usernam usernam shrug emoji modifi fitzpatrick type number zero width joiner male sign
353,usernam make music poor peopl insecur
354,usernam queen rap
355,usernam say x caus need know
356,oh god usernam
357,usernam httpaddr
358,queen queen queennnnn heavi black heart heavi black heart heavi black heart heavi black heart heavi black heart usernam
359,usernam face throw kiss face throw kiss smile face heart shape eye smile face heart shape eye love nicki
