,tweet
3389,spend monday bed wear usernam jewel usernam hashtag gem stone pictur
3390,mi ni si mandaran uno de usernam volveria con un ex face good gestur emoji modifi fitzpatrick type number zero width joiner femal sign zafoo bebe face good gestur emoji modifi fitzpatrick type number zero width joiner femal sign httpaddr
3391,usernam usernam bella bella bella usernam deja sin aliento smile face heart shape eye smile face heart shape eye hug face hug face face throw kiss face throw kiss por favor que belleza
3392,usernam usernam usernam hyde
3393,due commerci usernam girlfriend get usernam wed ring hashtag
3394,usernam corazon plata number usernam hashtag hashtag hashtag en joyeria zafiro httpaddr
3395,charl hilda pregnant grandmoth clutch pocket watch bought usernam lieu engag ring still watch origin receipt get next daughter pictur
3396,usernam usernam usernam melodyguynumb usernam usernam usernam hashtag hashtaghashtag usernam hashtag hashtag
3397,woke like hashtag usernam pictur
3398,usernam usernam usernam da yu debei hai gakuo da shitemasu xian shi dian desi zhe numberren xing fang bu ming numberren desu
3399,usernam usernam usernam give icon blair waldorf gossip girl
3400,usernam usernam hashtag hashtag hashtag httpaddr
3401,get paid post instagram favorit jewelri cloth brand httpaddr hashtag usernam usernam usernam usernam hashtag hashtag hashtag hashtag hashtag hashtag hashtag hashtag hashtag hashtag hashtag pictur
3402,usernam horrid bellow cacophoni pretend song ad cnn ad mainli show hand singer sound like terribl pain aw
3403,usernam usernam usernam usernam httpaddr httpaddr httpaddr
3404,usernam usernam usernam pictur
3405,usernam usernam lol know ex
3406,usernam usernam usernam oooooooooo niceee
3407,usernam usernam usernam look fabul
3408,usernam usernam like everyon els eagerli await hashtag two howev anyon els notic subtl small usernam box smile face smile eye
3409,new usernam exhibit show classic usernam piec httpaddr pictur
3410,usernam usernam usernam think make usernam smile nice truth trustworthi boyfriend someon break scare cant make work
3411,usernam usernam get lil maddi proud face throw kiss face throw kiss
3412,usernam usernam free mind rest follow hat top hat flamekeepershatclub jewlrey gem stone usernam ear clair shirt shirt harlemgatsbi pick today usernam ask httpaddr
3413,usernam usernam usernam usernam lucki
3414,usernam usernam frame mani design avail cardiff bristol store hashtag hashtag pictur
3415,usernam usernam usernam bear mere moneysymbnumb usd ladi actual got number hashtag hashtag httpaddr pictur
3416,usernam usernam usernam retweet el costo
3417,usernam usernam oh loveee
3418,usernam usernam usernam may new york pleas enjoy behalf person rais hand celebr indulg enjoy sir
3419,que te parec juntar joya con tecnologia bueno en usernam lo pued hacer por medio de la diferent oportunidad laboral que ofrecen visita ya httpaddr obten mayor informacion hashtag hashtag hashtag pictur
3420,usernam usernam usernam queen serv look
3421,kudo staffer led project well done usernam httpaddr
3422,rubbish servic usernam milan hashtag hashtag
3423,usernam call u lead way worldwid ivori ban usernam panel httpaddr pictur
3424,usernam usernam usernam usernam cringey
3425,usernam could say better cherri blossom revolv heart tulip usernam hashtag httpaddr pictur
3426,almost number year later lost one usernam ear happi easter weari face
3427,usernam usernam yni uao w usernam q wink face
3428,usernam usernam usernam usernam jajahaj yo estoy como do hora de esa vaina
3429,usernam home detail httpaddr usernam httpaddr
3430,usernam usernam get ring size pick favorit smile face heart shape eye smile face heart shape eye smile face heart shape eye
3431,got vintag alaia dress book fenti mua got usernam neck wristsi readi slay hashtag red carpet pictur
3432,hashtag moneysymbnumb carri engrav sterl silver usernam money clip
3433,good morn know usernam sell sterl silver tin moneysymbnumb number yup look like tin green bean come pictur
3434,ya esta targeteando usernam heavi black heart eye speak evil monkey
3435,usernam usernam usernam queen smile face heart shape eye
3436,usernam usernam usernam usernam whew pick wrong incom tax bracket timelin appear
3437,usernam usernam ur amazingli beauti
3438,usernam usernam eight home number number differ wive car elev number number dollar usernam bill
3439,everyon usernam extra friendli ok hand sign emoji modifi fitzpatrick type number
3440,usernam usernam usernam
3441,usernam usernam usernam usernam get two
3442,usernam smile face heart shape eye smile face heart shape eye repost thecaratclub katakana middl dot katakana middl dot katakana middl dot swoon gorgeou diamond ring set smile face heart shape eye two heart want comment ring usernam via pleasereturntocesar hashtag httpaddr
3443,usernam give cool tri work httpaddr
3444,need go shop father day look like belong usernam usernam
3445,ever look insid macarthur bowl eye stadium design built usernam unlik trophi colleg footbal trophi httpaddr pictur
3446,usernam usernam love ya pictur
3447,usernam usernam usernam smile face heart shape eye smile face heart shape eye
3448,usernam usernam treat
3449,usernam usernam best book ever
3450,kiyawawa white heart suit usernam eburidei obuziekuto pe katakana hiragana prolong sound mark pa katakana hiragana prolong sound mark katsupu bo katakana hiragana prolong sound mark nchiyaina httpaddr
3451,usernam usernam usernam kill em smile face heart shape eye
3452,usernam usernam e qdo frita alguma coisa e depoi que lent ta toda respingada eu fico pistola vou lavar banheiro e fico ainda mai pistola nerd face pout face
3453,thank usernam lead jewelri industri respons gold sourc pleas lead way transpar publish audit name diamond supplier hashtag httpaddr
3454,usernam usernam usernam usernam usernam nice invent color blue
3455,might upgrad usernam might visit usernam rock wine glass httpaddr
3456,usernam usernam love u much u r perfect heavi black heart
3457,usernam usernam usernam usernam usernam usernam date night mi amorhashtaghashtag ootd suit shirt usernam shoe usernam dress usernam shoe ear necklac usernam sunglass usernam purs usernam bracelet usernam usernam watch usernam make usernam pictur
3458,usernam usernam usernam well sure look fun wink face
3459,hashtag umno sten kathemerin poluteleia e sullog tou rint krakoph gia ton oiko usernam httpaddr pictur
3460,usernam usernam puedo llevar uno que ya tengo porqu cuando lo compr hace ma de number ano habia esto
3461,usernam new store bright engag destin shopper engag brand click read latest blog post httpaddr hashtag hashtag hashtag pictur
3462,usernam beauti song new commerci howev loud distract purpos pleas lower octiv
3463,chines actress song zuer flash stun feminin beauti slim figur promot tiffani co shanghai hashtag hashtag hashtag hashtag hashtag zu er hashtag fan ni usernam usernam httpaddr pictur
3464,usernam usernam usernam usernam simpli flawless smile face heart shape eye
3465,usernam work modern hashtag design via usernam httpaddr pictur
3466,usernam usernam drop hint face tear joy
3467,usernam usernam usernam love support wildlif conserv
3468,usernam hey got personalis necklac birthday last week sloan squar london metal alreadi tarnish normal
3469,usernam girl sing commerci sound like wine like hurt
3470,usernam usernam usernam disney cinderella vibe
3471,usernam said breakfast tiffani tiffani co usernam new york ny httpaddr
3472,usernam usernam usernam qveen yellow heart
3473,usernam usernam like number think face
3474,usernam usernam handsom
3475,usernam usernam numberlock omg want
3476,love usernam commerci featur accapella usernam hashtag
3477,teihuani katakana hiragana prolong sound mark inhuinitei pendanto httpaddr usernam korehamai ubekinanoka face tear joy
3478,usernam usernam usernam usernam hahaha raquel cat orang white gray day rainbow
3479,huge hashtag fan alway want go usernam made one rome next step new york finger cross smile face smile eye heavi black heart pictur
3480,usernam banksi broad daylight brought usernam httpaddr
3481,ahhhhh smile face heart shape eye smile face heart shape eye smile face heart shape eye inlov scent usernam droplet pictur
3482,usernam ring commerci alicia key everyth smile face heart shape eye smile face heart shape eye smile face heart shape eye
3483,usernam usernam usernam april wed kyoto sakura blossom wear custom chanel haut coutur suit collect httpaddr prize guess one xxx rememb hint princ futur horhashtag hashtag hashtag
3484,got back usernam thank help hook new bag pictur
3485,new diamond ring ring hashtag hashtag hashtag numberk hashtag white gold hashtag gem stone gem stone hashtag hashtag usernam pictur
3486,usernam experienti hashtag move seem work store sale beat expect rise number combin enclos keycap first quarter number httpaddr usernam face stuck tongu wink eye
3487,usernam introduc new campaign featur usernam usernam tiffani first ever record remix version moon river hashtag hashtag usernam hashtag hashtag pictur
3488,item snag hashtag httpaddr make annual gala tomorrow place bid onlin help us hashtag hashtag hashtag usernam usernam usernam pictur
3489,usernam technic difficulti
3490,usernam usernam actual shot camera
3491,usernam usernam usernam
3492,new pen holder offic usernam pictur
3493,usernam someth littl turquois box make heart go pitter pat thank usernam hashtag usernam httpaddr pictur
3494,badli wish gone usernam store visit nyc statu liberti usernam
3495,head usernam style studio covent garden discov uniqu retail experi newli open store offer wide rang tiffani icon collect well uniqu event interact displayshashtag hashtag hashtag usernam pictur
3496,thank usernam lead jewelri industri respons gold sourc pleas lead way transpar publish audit name diamond supplier hashtag httpaddr
3497,new usernam commerci annoy mute tv whenev
3498,da um dess que eu fico nojenta smile face open mouth tightli close eye usernam pictur
3499,usernam usernam pictur
3500,usernam span fashion jewelleri watch interior design food drink art featur brand usernam usernam usernam piec collect true collect fascin histori httpaddr usernam
3501,usernam usernam usernam look like tear drop acc love sm
3502,usernam usernam usernam piec amaz stori ring
3503,usernam usernam usernam usernam like
3504,alessandro bogliolo usernam tien un gran potenci para crecer en el mercado espanol httpaddr memo usernam pictur
3505,usernam breakfast usernam cours amaz httpaddr
3506,hashtag wonder event grand open pasadena store usernam thank
3507,usernam usernam usernam iin smile face smile eye
3508,usernam usernam usernam pleas hug scienc
3509,usernam usernam usernam usernam usernam usernam usernam usernam usernam
3510,usernam usernam welcom usa
3511,new usernam ad us groov nonstop woman bunni ear httpaddr
3512,usernam usernam e mesmo
3513,usernam usernam usernam whole world
3514,perfect commerci usernam hashtag
3515,aint usernam want face tear joy blue heart
3516,usernam usernam usernam usernam usernam love si
3517,usernam nyc get paint job tiffani co tune today httpaddr usernam hashtag hashtag hashtag
3518,usernam usernam usernam ok neg squar latin capit letter b utex smile face heart shape eye
3519,usernam tiffani co chi dai dong wu dian usernam li dao qu dong jing du httpaddr
3520,usernam usernam usernam frank ocean better two
3521,usernam hashtag es preciosa lo quierooo thumb sign smile face heart shape eye clap hand sign wrap present wrap present face scream fear person fold hand person fold hand flush face
3522,bizarr strateg relev coal reef conserv usernam sustain strategi mutual exclus busi strategi need guidanc check usernam hashtag guid httpaddr pictur
3523,usernam one thing look forward pari usernam champ elyse httpaddr
3524,usernam usernam usernam usernam usernam allow usernam dump billion litr sewag chemic st lawrenc river thank usernam effort revers damag usernam usernam usernam usernam httpaddr
3525,thank usernam usernam outstand beyond call duti custom servic simpli astonish servic receiv hashtag hashtag
3526,usernam cheer thursday whether thirsti throwback celebr day style usernam champagn flute avail hashtag hashtag hashtag httpaddr
3527,usernam usernam number
3528,usernam usernam smile face heart shape eye smile face heart shape eye smile face heart shape eye
3529,usernam usernam usernam
3530,usernam usernam usernam wow pictur
3531,prop usernam first commerci right usernam coverag hashtag beauti like engag
3532,hey usernam run wrong set ad realli readi next may pictur
3533,usernam usernam usernam well hot daaaaaamn
3534,usernam usernam usernam usernam usernam usernam usernam usernam usernam beauti pic
3535,usernam usernam usernam beautyy
3536,hashtag summit learn hashtag hashtag usernam includ partnership usernam eleph pictur
3537,two es magazin editor got exclus look usernam utterli instagramm new concept store complet fragranc vend machin personalis bar hashtag hashtag pictur
3538,usernam clap hand sign emoji modifi fitzpatrick type number number clap hand sign emoji modifi fitzpatrick type number number clap hand sign emoji modifi fitzpatrick type number number httpaddr
3539,usernam usernam usernam like magic blue heart hashtag
3540,usernam usernam style girl lol size
3541,usernam usernam usernam usernam hoe meer bling bling hoe beter
3542,hashtag number carat emerald cut diamond ring usernam fetch moneysymbnumb million hashtag salesroom hashtag pictur
3543,usernam usernam gorgeou face tear joy
3544,usernam usernam princess emoji modifi fitzpatrick type number
3545,usernam usernam usernam number favorit thing togeth usernam usernam hashtag usernam hashtag hashtag hashtag httpaddr
3546,usernam usernam deserv
3547,loveeee smile cat face heart shape eye smile cat face heart shape eye usernam pictur
3548,usernam foundat commit moneysymbnumb million hashtag conserv effort httpaddr v usernam hashtag usernam
3549,usernam spend numberk usernam better sparkl includ veggi garden carat
3550,usernam usernam usernam usernam ere como nefert
3551,usernam usernam usernam oh god love
3552,usernam love usernam commerci
3553,mind ill breakfast usernam pictur
3554,usernam believ dream spot featur usernam best fashion film spring number mpc handl vfx httpaddr hashtag hashtag hashtag httpaddr pictur
3555,usernam usernam usernam great news heavi black heart eleph heavi black heart
3556,usernam usernam hashtag make smile ring smile face heart shape eye hashtag hashtag hashtag
3557,usernam usernam usernam usernam usernam usernam le vibrazioni vieni da live httpaddr
3558,usernam usernam usernam usernam queen love g
3559,usernam usernam usernam lookin like whole entre
3560,think hate heteronorm ring commerci usernam surpris pictur
3561,usernam usernam usernam usernam like
3562,usernam usernam usernam usernam
3563,hey usernam flatter offer woman champagn number smile face halo face stuck tongu wink eye pictur
3564,new flora fauna collect usernam natur fit summer httpaddr pictur
3565,usernam usernam ooo love idea
3566,usernam kendal via instagram met usernam pictur
3567,usernam usernam one step time would probabl work
3568,usernam usernam hashtag hashtag hashtag httpaddr
3569,usernam beauti commerci includ everyon touch heavi black heart compani continu support httpaddr
3570,usernam usernam usernam usernam pleas run presid usa
3571,usernam usernam usernam como tienen mucho seguidor encima ni dio mg ni rt face tear joy face tear joy
3572,usernam usernam usernam usernam great black sun ray black sun ray
3573,usernam usernam usernam find one aswel
3574,usernam usernam alway thought sinc look flawless machin engrav skill
3575,usernam happi hashtag one xerox usernam pull lili pad pitchfork usernam sent form letter transatlant cabl usernam taxidermi hamster usernam hashtaghashtag
3576,thank usernam lead jewelri industri respons gold sourc pleas lead way transpar publish audit name diamond supplier hashtag httpaddr
3577,latest round compani paid famili leav benefit number week usernam number week usernam number week usernam httpaddr
3578,usernam realli hashtag httpaddr
3579,usernam beauti commerci hashtag usernam
3580,usernam usernam usernam usernam thank nikolai glad hear enjoy stay
3581,usernam usernam usernam usernam usernam happen
3582,moon river amoneysymbap ferg ell fan usernam usernam butterfli crescent moon water wave jb httpaddr hashtag
3583,usernam usernam usernam
3584,usernam stop ad plz pictur
3585,usernam wear new hashtag collect latest hashtag usernam hashtaghashtag httpaddr pictur
3586,usernam usernam usernam u look like oragami
3587,hashtag fan could uniqu piec memorabilia uniqu diamond watch go auction first time httpaddr usernam usernam pictur
3588,usernam usernam actual laugh loud well play usernam
3589,want usernam coffe pizza diamond hashtag pictur
3590,usernam usernam usernam usernam x
3591,usernam hashtag experi make usernam sale sparkl httpaddr via usernam
3592,usernam usernam aqui venden puca tiffani co usernam new york ny w usernam httpaddr
3593,usernam usernam love thank great experi smile face smile eye pictur
3594,usernam art
3595,usernam mi mama amaba usernam
3596,usernam usernam usernam spectacular clap hand sign emoji modifi fitzpatrick type number heavi heart exclam mark ornament
3597,hashtag season way royal wed next month better time snap bargain usernam platinum wed band httpaddr extra psnumber thumb sign emoji modifi fitzpatrick type number hashtag pictur
3598,usernam amaz commerci royal wed wow heart arrow
3599,_annaism smile face heart shape eye sucker anyth usernam think perfect occas new gift usernam face stuck tongu wink eye
3600,usernam usernam judg insta acc slightli smile face
3601,usernam usernam also attest polit sale rep tiffani manhasset ny last visit accommod profession two heart
3602,get brand new beauti usernam eye glass found awesom usernam eye glass miss sinc april loudli cri face face roll eye ughhh get lasik alreadi hashtag
3603,usernam usernam like number bottl fav wink owl wine hug face victori hand emoji modifi fitzpatrick type number victori hand emoji modifi fitzpatrick type number
3604,usernam usernam usernam usernam usernam usernam usernam usernam usernam usernam usernam usernam usernam usernam love usernam perfum smell gorgeou smile face heart shape eye smile face heart shape eye smile face heart shape eye smile face heart shape eye
3605,numberm view past month usernam encourag viewer believ dream see top spot may hashtag httpaddr pictur
3606,usernam hola chilito llegu vine directo conversar la tv look por boutiquemontemarano usernam santiago metropolitan region httpaddr
3607,usernam tiffani co usernam new york ny httpaddr
3608,usernam usernam usernam didnt know open till late
3609,usernam usernam usernam nah stylist tho fire fire fire
3610,usernam still heard custom servic someon pleas get touch
3611,usernam usernam jewelri boy
3612,teihuani katakana hiragana prolong sound mark ziyueri katakana hiragana prolong sound mark nisonochang deke yin dekirusa katakana hiragana prolong sound mark bisuwosuta katakana hiragana prolong sound mark taburetsutonimiao itash shu kinowen zi yairasutomo revolv heart ring httpaddr hashtag tiffanyandcohashtag katakana hiragana prolong sound mark hashtag yin sa katakana hiragana prolong sound mark bisuhashtag katakana hiragana prolong sound mark
3613,usernam multipl music note lot world see multipl music note
3614,usernam un peluchito asi si te acepto usernam heavi heart exclam mark ornament smile face heart shape eye heavi heart exclam mark ornament smile face heart shape eye heavi heart exclam mark ornament
3615,usernam usernam usernam lol oh face tear joy
3616,thank usernam sponsor discuss anim welfar protect eleph pictur
3617,hug face usernam pictur
3618,usernam visit amaz tiffani co style studio hashtag recent great addit area cool creativ innov twist tradit usernam brand httpaddr
3619,know woman love handbag mayb makeup jewelleri cake influenc usernam usernam even usernam pictur
3620,thank usernam lead jewelri industri respons gold sourc pleas lead way transpar publish audit name diamond supplier hashtag httpaddr
3621,sorri usernam canadian govt habit auster measur citizen less purchas abil pretti bubbl blower one must admit pictur
3622,wait buy ladi usernam wed ring make life live marri offici
3623,usernam usernam usernam usernam second thought took cruella de vil shoe loudli cri face
3624,usernam usernam usernam psnumber one pair caus one gotta get two
3625,usernam usernam usernam pictur
3626,usernam usernam usernam eleph anyth slaughter christian land
3627,usernam last night new york parti usernam heavi black heart love hashtag pictur
3628,usernam spent numberband usernam
3629,buy usernam pocket knife usernam film camera httpaddr
3630,usernam skip around new usernam campaign check full ad httpaddr
3631,usernam usernam usernam usernam usernam thumb sign face tear joy face tear joy still decid outfit girl gotta lot option ring person rais hand celebr pictur
3632,treat love two heart usernam pictur
3633,princess jasmin found aladdin cowboy live happili ever ring number number number usernam pictur
3634,usernam usernam usernam usernam last night usernam floral paper launch work usernam hairstylist usernam stylist usernam makeup usernam usernam use httpaddr
3635,usernam usernam usernam cute si pictur
3636,usernam guess usernam make world seri ring pictur
3637,usernam cute bad broke face tear joy
3638,usernam usernam usernam usernam look amaz alway love uk x
3639,number usernam usernam usernam usernam usernam usernam usernam pictur
3640,usernam usernam af lol
3641,tiffani httpaddr shu kinowen zi yairasutowok yin dekirupa katakana hiragana prolong sound mark sonara katakana hiragana prolong sound mark shiyon puroguramu make tiffani wosuta katakana hiragana prolong sound mark usernam httpaddr pictur
3642,usernam usernam would like moneysymbnumb number bracelet saw usernam httpaddr
3643,usernam usernam usernam sound like perfect birthday plan great day
3644,usernam usernam usernam weari cat face smile cat face heart shape eye face throw kiss smile face heart shape eye face throw kiss heavi black heart close lock key
3645,usernam usernam usernam look beauti
3646,usernam usernam
3647,tiffanyandco awar brand use sell erotica via contest right httpaddr hashtag hashtag
3648,die find number nephew usernam look wed band roll floor laugh usernam
3649,usernam absolut love new advert love romanc two heart
3650,usernam usernam usernam stun smile face heart shape eye
3651,usernam disappoint servic number week number visit still respons happen brand
3652,usernam usernam hashtag hashtag one commerci prop nice job
3653,thank usernam lead jewelri industri respons gold sourc pleas lead way transpar publish audit name diamond supplier hashtag httpaddr
3654,usernam usernam usernam usernam azteca x
3655,usernam long love davidyurman usernam girl hashtag httpaddr
3656,usernam usernam usernam face tear joy face tear joy face tear joy seen opportun took pictur
3657,diamond rare ya rare money afford real one mean okay diamond httpaddr still must propos solitair princess cut usernam pictur
3658,usernam love ring definit someth need make comeback better chunki size diamond
3659,usernam usernam usernam usernam es hermosa
3660,usernam sure win commerci alicia key sing background seen number time today gotten old
3661,thank usernam lead jewelri industri respons gold sourc pleas lead way transpar publish audit name diamond supplier hashtag httpaddr
3662,thank usernam lead jewelri industri respons gold sourc pleas lead way transpar publish audit name diamond supplier hashtag httpaddr
3663,usernam fantast vip event thank usernam pictur
3664,usernam usernam usernam usernam thank presid trump hashtag peopl afford shop
3665,usernam usernam usernam least tri usernam grimac face pictur
3666,usernam usernam ouch sorri
3667,tyler know well everi singl dollar spent birthday present went toward help save eleph usernam eleph grow heart
3668,usernam usernam usernam love bless
3669,el grabado mano de la joya de usernam con un mensaj diseno especi es un detal diferenciador pictur
3670,usernam usernam goe deep insid mission find number reef could surviv climat chang usernam numberreef usernam usernam usernam hashtag usernam usernam usernam usernam httpaddr
3671,icon jewelleri brand usernam open play new retail store london hashtag complet fragranc vend machin spot jewelleri engrav leather emboss httpaddr via usernam pictur
3672,usernam usernam usernam cutest bean planet smile face heart shape eye smile face heart shape eye loudli cri face
3673,usernam usernam pretti one pretti ladi ring
3674,dress usernam tonight usernam hashtag make usernam jewelri usernam usernam watch usernam dress hashtag shawl hashtag shoe usernam purs usernam thank usernam pictur
3675,usernam tri buy mom mother day gift broke mani retweet free pair pictur
3676,usernam usernam favorit shade blue
3677,sunday best hashtag usernam usernam pictur
3678,usernam pictur
3679,usernam usernam usernam love u
3680,si ne prend que le token c est deja number milliard de dollar la blockchain est une revolut hashtag par jean marc bellaich de usernam
3681,usernam usernam usernam usernam usernam usernam usernam ep thai charact mai chattawa aaaihm thai charact mai ek tahnuuaich thai charact mai ek thai charact mai tho yenii thai charact mai ek phue thai charact mai ek ngeh thai charact maitaikhu nkhra thai charact mai tho ngaerk
3682,usernam nice associ collect
3683,usernam usernam usernam yasssss queen slayyyi
3684,usernam usernam usernam smile face heart shape eye smile face heart shape eye drool face
3685,quiero estar en ny solo para ver la campana de hashtag person rais hand celebr emoji modifi fitzpatrick type number usernam
3686,usernam hot
3687,usernam love shirt
3688,usernam usernam think rememb film
3689,usernam usernam new arm candi girl day usernam thx usernam ador atla collect piec candi lollipop two heart hashtag hashtag hashtag northpark center httpaddr
