,tweet
5117,thank usernam lead jewelri industri respons gold sourc pleas lead way transpar publish audit name diamond supplier hashtag httpaddr
5118,usernam usernam usernam usernam lol figur maddi would danc bad
5119,usernam usernam usernam usernam hashtag idea help restor hashtag hashtag hashtag hashtag httpaddr
5120,usernam usernam usernam usernam um girl safeti pleas use crosswalk thank
5121,usernam lmao oooo shoot get starbuck
5122,usernam usernam smile face heart shape eye smile face heart shape eye
5123,usernam usernam great articl lot interest hashtag compani featur usernam usernam usernam etc includ shitti prod base hashtag usernam rip seller rare make money hashtag pictur
5124,usernam marco pautasso al museo del risorgimento per sessant anni della pubblicazion di colazion da tiffani di truman capot una tavola rotonda con usernam per ripercorrer la vicenda editorial del romanzo la version cinematografica il valor cultural garzantilibri
5125,spoilt rotten today mr b mark last year number usernam love lunch usernam set bar high next year hubba x pictur
5126,usernam usernam usernam hell wear
5127,usernam la madrina usernam usernam comprando el regalo de hashtag para el bautismo domingo numberh hashtag con usernam desd hashtag hashtag hashtag hashtag usernam earth globe asia australia earth globe europ africa earth globe america pictur
5128,usernam marion definit expert come look orchid magnific hibiscu compliment stun pearl plum usernam frame beauti gem stone ok hand sign emoji modifi fitzpatrick type number keith httpaddr
5129,usernam usernam que linda bienvenida chile
5130,usernam usernam usernam usernam smile face heart shape eye smile face heart shape eye
5131,usernam tri appeal younger gener w new ad comic dream diamond bc cannot afford
5132,usernam tiffani co usernam zhong yang qu tokyo w usernam usernam httpaddr
5133,usernam nau teihuani katakana hiragana prolong sound mark ming gu wu san yue dian usernam ming gu wu shi aichi httpaddr
5134,usernam usernam true profession craftsman
5135,usernam thank usernam number gorgeou jewelri hashtag video go eye usernam usernam ring fire pictur
5136,usernam usernam usernam usernam usernam usernam haha love think husband glad stay shop think travel tnumber surpris easi stressfre whole experi compar termin earli flight next time keep recommend mind smile face smile eye
5137,usernam usernam gem stone black heart en cordoba argentina httpaddr
5138,usernam usernam preciou gestur usernam support usernam initi behalf httpaddr
5139,usernam usernam usernam look amaz jdjdjsj
5140,number mani disagre shoulder ruch coutur top sheer elbow length glove match long train coutur pant usernam worn hashtag respect theme hashtag hashtag ft usernam usernam jewelri pictur
5141,usernam pictur
5142,cont usernam busi owner worst thing ever call custom want apolog friend famili never ever get anoth gift tiffani
5143,usernam need bracelet repair got done last year charg
5144,preciou diamond gem stone usernam foundat invest moneysymbnumberm great barrier reef fish spout whale httpaddr hashtag pictur
5145,usernam usernam made new friend today smile face heart shape eye hope piec usernam find home usernam near futur hashtag hashtag hashtag hashtag hashtag hashtag walter e httpaddr
5146,usernam hi polici send e receipt custom email give staff free rein proposit custom use person data suppos transact purpos tiffani custom servic
5147,year ago husband want birthday anniversari v day honey wife white smile face nice ear ring bracelet usernam today husband want birthday anniversari v day honey wife smile face open mouth smile eye roomba pleas pleas pleas usernam
5148,usernam engrav heart tag pendant husband draw fave hello kitti melodi smile face heart shape eye smile face heart shape eye thank true_blue_mrs_li invit usernam event today enjoy httpaddr
5149,hey usernam readi spend banknot dollar sign today appar sale peopl hashtag shop think could afford anyth hashtag hashtag
5150,usernam usernam jajshsjajajajjajajaa wey jajajsjajajajajaja
5151,usernam usernam bienvenida tu chile lindo heavi black heart
5152,rilancio usernam definir strategia con manag senza consulenti esterni fiducia e ottimismo ho fatto l evangelista e ho parlato con le person dicendo che avevano un marchio eccezional splendida intervista al ceo alessandro bogliolo httpaddr
5153,millenni flock usernam httpaddr
5154,usernam usernam usernam cute girl pictur
5155,usernam usernam diva hashtag hashtag httpaddr pictur
5156,lost usernam tie clip piss
5157,hashtag clapper board ell hashtag collect via usernam instagram pictur
5158,usernam hashtag thursday hashtag usernam buckl grandfath initi httpaddr
5159,first thought usernam httpaddr
5160,usernam pe katakana hiragana prolong sound mark pa katakana hiragana prolong sound mark kuritsupu butsukuma katakana hiragana prolong sound mark ku httpaddr
5161,usernam usernam usernam usernam usernam q diosa su angelada total black heart suit
5162,usernam usernam usernam usernam smile face heart shape eye smile face heart shape eye loudli cri face loudli cri face loudli cri face loudli cri face loudli cri face
5163,usernam usernam usernam u time final make prioriti sorri sound harsh histori speak realli wish noth best love everi day like first day lot guy would proud usernam arm
5164,usernam absolut gorgeou restor usernam hashtag hashtag ode hashtag giant one hashtag usernam hashtag httpaddr
5165,usernam usernam usernam usernam usernam everyth love dude much
5166,usernam usernam usernam usernam green
5167,usernam fabul fierc hashtag creation theme usernam hashtag w usernam hashtag usernam usernam pictur
5168,thank usernam lead jewelri industri respons gold sourc pleas lead way transpar publish audit name diamond supplier hashtag httpaddr
5169,usernam return one worn
5170,usernam usernam mayb smirk face smirk face smirk face
5171,usernam usernam usernam usernam photo know u seen date shit even learn photographi
5172,thank usernam lead jewelri industri respons gold sourc pleas lead way transpar publish audit name diamond supplier hashtag httpaddr
5173,usernam final soon someon direct tiffani get involv issu resolv within hour thank
5174,hashtag hashtag hashtag hashtag usernam usernam pictur
5175,aliciakey one featur usernam believ love took number number spot week top usernam song commerci httpaddr httpaddr
5176,usernam usernam
5177,month ago wrote gratitud journal number would purchas new ring usernam complet forgot wrote notic tonight write last month intent bought ring symbol abund goal unlock
5178,usernam top luxuri brand u accord number kadenc luxuri index happi present full studi httpaddr
5179,love new usernam sunglass dark sunglass oh usernam one dark sunglass thank babeee smile face smile eye
5180,icon jewelleri brand usernam recent releas fabul straw httpaddr pictur
5181,usernam never thought first usernam blue would come form glass hashtag usernam httpaddr pictur
5182,tiffani co vintag number numberk solid gold manual wind numbermm swiss watch lvnumber daddi watch hashtag usernam hashtag hashtag hashtag httpaddr
5183,dear usernam heavi black heart heavi black heart heavi black heart ad usernam rainbow hashtag hashtag hashtag pictur
5184,usernam tiffani enchant tm colar de flor httpaddr
5185,usernam appar warranti product vari shop shop work intern compani product number month old cover warranti appal servic hashtag
5186,usernam usernam usernam usernam usernam httpaddr
5187,usernam usernam usernam need asap send
5188,kind stuff like see usernam usernam pictur
5189,usernam share wall usernam rachelmenkenni care coupon housew draper get program work usernam hashtag
5190,usernam usernam usernam usernam usernam usernam think face httpaddr
5191,went usernam first time year grand time everyon super help love parti theme sterl silver jewelri floor hashtag
5192,usernam love usernam theme wed invit tell us theme creat hashtag hashtag hashtag hashtag co
5193,usernam usernam diamond overvalu market manipul would make perfect ico buy moneysymbxrp
5194,usernam new home accessori collect usernam launch itali yesterday night httpaddr
5195,usernam usernam usernam httpaddr
5196,usernam usernam oh wow enter thank
5197,know demograph make twitter think respond posit usernam ad fan name
5198,usernam smile face heart shape eye smile face heart shape eye smile face heart shape eye
5199,usernam kawaii smile face heart shape eye
5200,usernam usernam usernam usernam usernam lol hate play much song embed head torment
5201,usernam usernam congratul second time ring gorgeou like two xx
5202,usernam everi time hear commerci clearli amplifi woman raspi shrill want throw someth tv hashtag hashtag
5203,usernam promot park bunch stupid blue vehicl illeg bu stop number ave pictur
5204,usernam usernam usernam waouh
5205,usernam kind jewelleri ring hashtag
5206,usernam usernam hi candic glad back look forward see photo new twitter catch
5207,rt usernam bloom town look behind scene latest campaign film usernam set hashtag world hashtag watch httpaddr camera flash usernam pictur
5208,perk first timer usernam nice number player usernam cuff link pictur
5209,ya termin ahora voy por mi usernam mi usernam inform desk person emoji modifi fitzpatrick type number number zero width joiner femal sign
5210,usernam usernam usernam usernam make straw keep time
5211,usernam usernam usernam usernam love pleas make forget watch first number second video need speak brand manag build authent relationship tri someon ride wave genuin person fold hand emoji modifi fitzpatrick type number
5212,realli usernam super bowl hashtag
5213,usernam numberlb bundl love wear usernam collar borrow mama pictur
5214,usernam thank usernam
5215,usernam usernam usernam damn beauti z wish like u
5216,usernam usernam usernam congratul jerri
5217,usernam nice advert rude boy sign horn ok hand sign hashtag choon
5218,usernam usernam usernam usernam usernam usernam usernam nini
5219,usernam usernam pleas follow back butterfli heart arrow love heavi black heart mommi mel heart arrow heart arrow
5220,usernam shout usernam gem stone thank continu busi us usernam purpl heart shirt hat look spectacular wave white flag zero width joiner rainbow hashtag httpaddr
5221,like say hashtag gift sponsor hashtag usernam hashtag pictur usernam usernam usernam usernam usernam usernam hashtag hashtag pictur
5222,usernam usernam face tear joy
5223,usernam usernam usernam work hard
5224,usernam usernam usernam usernam usernam bloomberg inexplic keep support republican like peter king nullifi chanc might dem nomin
5225,usernam hashtag diamond hashtag
5226,love tiffani blue color hashtag usernam smile face heart shape eye pictur
5227,usernam usernam usernam damn girl shine bright teach pretti
5228,warm sunni day call beauti golden usernam citrin diamond ear black sun ray citrin transpar quartz strike yellow hue believ heal properti sparkl httpaddr hashtag pictur
5229,usernam usernam arab letter alef ysyr arab letter alef arab letter alef kht jynyfr wyn arab letter alef lhj arab letter alef b tw arab letter alef sli lki arab letter alef jybh lki bnfsi smile face sunglass
5230,everywher go introduc wife went usernam yesterday look ring said ever got engag want ring tiffani safe say get engag near futur loudli cri face speak head silhouett white smile face
5231,usernam usernam usernam pretti
5232,usernam usernam hashtag usernam usernam katakana middl dot katakana middl dot katakana middl dot usernam alastairmckimm frederikkesofi usernam thank usernam httpaddr pictur
5233,hashtag el tema que eligio usernam para su nueva campana publicitaria es simplement increibl tambien es gracioso que marta debayl la queria erradicar hace un ano pue segun ella invitaba practicament la anarquia
5234,usernam usernam usernam
5235,usernam icymi luxuri brand embrac digit transform see usernam usernam httpaddr pictur
5236,usernam usernam usernam usernam took us hour find outfit lol
5237,usernam usernam usernam yaaaa celebr audrey birthday dizzi symbol pictur
5238,usernam concert usernam tonight he icon pictur
5239,say togeth number fist hand sign four leaf clover green heart thank usernam lead jewelri industri respons gold sourc pleas lead way transpar publish audit name diamond supplier hashtag httpaddr
5240,usernam usernam swaysanitsugui tsutekuruno face open mouth cold sweat
5241,find usernam websit like httpaddr like lot
5242,usernam tri book tabl blue box restaur number peopl septemb onlin number et uk tri book state reserv longer avail think guy book never avail hashtag hashtag
5243,usernam usernam usernam usernam awesom fav
5244,usernam usernam much class good day maddi
5245,usernam alo number de junho usernam
5246,camera flash day number year ago rees witherspoon attend usernam celebr number blue book collect olivia wild amber heard httpaddr pictur
5247,usernam usernam usernam beauti
5248,usernam usernam usernam nice smile face heart shape eye usernam
5249,usernam want face scream fear face scream fear face scream fear usernam
5250,usernam yep bought usernam birthday number year ago favorit piec day famili nicknam sinc babi
5251,usernam left ring resiz pleas take good care feel kind strang without put far long
5252,usernam usernam usernam hashtag happi commun
5253,notic reissu updat usernam plaqu receiv hashtag award number check former winner new hardwar pictur
5254,even california wildfir damag hashtag usernam httpaddr
5255,start day get reserv usernam cafe hashtag trip smile face smile eye
5256,usernam usernam usernam usernam omg steal brand face tear joy
5257,usernam usernam interest stuff suppos anyon forget breath complet abl ask refund anyway wink face
5258,usernam stylish smile face heart shape eye smile face heart shape eye smile face heart shape eye usernam usernam usernam usernam usernam usernam usernam usernam pictur
5259,usernam usernam usernam usernam
5260,usernam usernam usernam usernam usernam usernam usernam nii thai charact mai ek eraakamlangepi thai charact thanthakhat aikhr yuu thai charact mai ek hr kha khru thai charact mai ek nkhrissssnumb
5261,usernam congrat ogi rea usernam tucson u got top rate httpaddr hashtag hashtag hashtag
5262,usernam realli miss tiffani eau de parfum atomiseur numberml year releas need authent version
5263,sneak peek pair usernam hashtag favril turtl shell glass dome atop silver bronz base give us feel collect martin cohen cross rago hashtag block octob number hashtag hashtag hashtag hashtag pictur
5264,usernam usernam usernam usernam cute
5265,usernam usernam say loud black proud rainbow person fold hand emoji modifi fitzpatrick type number grow heart hibiscu heavi black heart thank hashtag usernam thank nikki nelm haircut emoji modifi fitzpatrick type number zero width joiner femal sign jessica small kiss mark alexandria mandelkorn dancer emoji modifi fitzpatrick type number usernam dress usernam spaceship clutch usernam jewelri pictur
5266,usernam hi justin pleas dm us full name email address order number may locat record thank
5267,usernam green envi usernam piec green heart kennethjamescollect hashtag hashtag hashtag hashtag hashtag hashtag hashtag httpaddr
5268,think enough ppl realiz usernam own whole product process direct sourc move bring artisan ny sit side side design open even oppi levg hous talent httpaddr
5269,hi usernam client usernam would love speak someon uk team regard solest ring pleas get touch asap rowena httpaddr mani thank agent e x pictur
5270,usernam usernam hashtag anyth hashtag anywher
5271,love beauti mayb usernam trade sparkli one httpaddr
5272,u buy onlin usernam ring bracelet differ real time joke buy new graduat gift usernam thank pictur
5273,usernam usernam usernam wow beauti pictur world heavi black heart smile face heart shape eye smile face heart shape eye
5274,usernam usernam usernam im ugli ugh look
5275,usernam usernam chou kun v konbanha glow star statu liberti le shiilu ninatsutezui gao nashi jian guo goseteliang katsutan music note qi wotsuket tokyo tower gui tsutelai tene heavi heart exclam mark ornament li raretaramatal shiil shiiotu chan hua taxi athlet shoe shirt steam bowl ring dai tsuterun
5276,usernam usernam usernam usernam usernam usernam beauti pictur love purpl heart
5277,usernam usernam usernam usernam usernam usernam usernam momentumeventco via nodexl httpaddr usernam chronicledinc mediledg robcandiano bgreenzweig tiffanyandco bodybuildingcom lululemon ancestri kedstop hashtag hashtaghashtaghashtaghashtaghashtaghashtaghashtag
5278,great commerci usernam hashtag hashtag
5279,usernam usernam usernam usernam smile face heart shape eye smile face heart shape eye smile face heart shape eye
5280,usernam usernam u inspir lemon
5281,usernam bear got pwned son
5282,exchang ring miss moment ring usernam usernam cufflink usernam venu usernam visit usernam winchest week hashtag view uniqu movi album alongsid exclus brand pictur
5283,usernam face open mouth
5284,usernam usernam boiiii find someth cute like tiffani take word face palm emoji modifi fitzpatrick type number zero width joiner femal sign
5285,anumb funni stori usernam bought engag ring sf month later got post card rep help choos say hope said ye smile face open mouth smile eye brilliant delight hashtag httpaddr
5286,usernam usernam usernam cute pictur
5287,royal wed superbowl usernam
5288,thank usernam best custom servic ever
5289,usernam usernam launch new uniqu store design encourag creativ interact self express call tiffani style httpaddr wide rang icon httpaddr
5290,usernam usernam usernam beauti
5291,usernam usernam usernam usernam usernam beauti purpl heart
5292,usernam usernam usernam care quick glanc feed show almost sport one tweet stranger promot feed set wait twitter
5293,usernam usernam usernam usernam usernam aw
5294,track hashtag help translat site hashtag improv effici dynam also provid insight better address global challeng understand global user differ behavior experi attribut hashtag w usernam usernam usernam pictur
5295,usernam usernam usernam queen
5296,usernam usernam usernam usernam usernam heavi black heart answer
5297,also made birthday wishlist got ring finger size usernam
5298,usernam usernam usernam usernam stand commerci look like tri get busi drug dealer like bling
5299,usernam usernam glad hear usernam usernam recov nice usernam httpaddr buy hera littl get well httpaddr usernam pictur
5300,talk usernam start offer hashtag experi littl one mean everi mom talk would
5301,usernam usernam usernam moon riverwid milei cross style somedayy dream maker heartbreakerwher ever go go way
5302,usernam new post httpaddr usernam nicki minaj donald glover wear tiffani co saturday night live httpaddr
5303,usernam propos usernam ring
5304,usernam beauti heavi black heart heavi black heart purpl heart sparkl heart could pleas follow us instagram user name thisislivingnumb thank love usernam face throw kiss face throw kiss
5305,usernam belat birthday dinner rental mean usernam birthday maggiano httpaddr
5306,usernam usernam trump tax cut begin filter economi rich super rich benefit first usernam stand see first bump post earn revenu trump tax cut benefit rich first
5307,usernam pleas cancel schedul tv advert know ever done take anymor perhap could use tortur pow detaine someth instead pictur
5308,usernam usernam usernam wow girl
5309,usernam usernam usernam usernam pictur
5310,secret cafe new york citi httpaddr hashtag hashtag hashtag usernam hashtag usernam hashtag usernam usernam usernam hashtag hashtag usernam hashtag hashtag pictur
5311,readi marri high school sweetheart wed heavi black heart ring usernam usernam pictur
5312,usernam fave
5313,usernam usernam best citi world
5314,usernam usernam look good
5315,usernam usernam usernam usernam p pictur
5316,usernam usernam queen crown heavi black heart
5317,usernam oh would releas fabul home abc accessori rang know want everyth
5318,follow sinc collect launch septemb number usernam usernam rais moneysymbnumb million hashtag
5319,usernam usernam usernam nap
5320,usernam usernam usernam amaz beat heart beat heart beat heart beat heart beat heart beat heart beat heart beat heart beat heart beat heart beat heart beat heart beat heart beat heart beat heart beat heart beat heart beat heart beat heart beat heart beat heart beat heart beat heart beat heart beat heart beat heart beat heart beat heart beat heart beat heart beat heart beat heart beat heart beat heart beat heart beat heart beat heart beat heart beat heart beat heart beat heart beat heart beat heart heavi black heart heavi black heart heavi black heart heavi black heart heavi black heart heavi black heart heavi black heart heavi black heart heavi black heart heavi black heart heavi black heart heavi black heart heavi black heart heavi black heart heavi black heart heavi black heart heavi black heart heavi black heart heavi black heart heavi black heart heavi black heart heavi black heart heavi black heart heavi black heart heavi black heart heavi black heart heavi black heart heavi black heart heavi black heart heavi black heart heavi black heart heavi black heart heavi black heart heavi black heart heavi black heart heavi black heart heavi black heart heavi black heart heavi black heart heavi black heart heavi black heart heavi black heart face throw kiss face throw kiss face throw kiss face throw kiss face throw kiss face throw kiss face throw kiss face throw kiss face throw kiss face throw kiss face throw kiss face throw kiss face throw kiss face throw kiss face throw kiss face throw kiss face throw kiss face throw kiss face throw kiss face throw kiss face throw kiss face throw kiss face throw kiss face throw kiss face throw kiss face throw kiss face throw kiss face throw kiss face throw kiss face throw kiss smile face halo smile face halo smile face halo smile face halo
5321,hashtag usernam usernam turnaround plan turn gem httpaddr
5322,usernam usernam love u mad use best sware everyth
5323,usernam usernam usernam dessert cruella devil pictur
5324,hashtag jean marc bellaich de usernam l ensembl de crypto monnai c est numbermilliard de dollar soit plu que l industri du lux plu de numbermilliard sont leve en ico chaqu moi
5325,love new window art display usernam london bond street gorgeou pop colour street creativ hashtag hashtag hashtag hashtag hashtag hashtag hashtag hashtag hashtag hashtag hashtag pictur
5326,usernam usernam gorgeou
5327,dear usernam hashtag sister took son store yesterday good custom number birthday gift rude treat left v ill ladi hard work even get disgust hashtag
5328,usernam usernam long instal locat thank
5329,today bought someth usernam think final made life
5330,fantast work usernam foundat celebr moneysymbnumberk usd usernam hashtag program improv water qualiti reef httpaddr
5331,usernam usernam usernam breathtak smile face heart shape eye
5332,cool appar number tiffani collect goe fund hashtag httpaddr usernam
5333,usernam haileybaldwin swept away hashtag usernam pictur
5334,go two subway station two bodega laugh spanish good way final got hashtag gem stone take home usernam pictur
5335,usernam open style studio covent garden invit custom play interact httpaddr hashtag hashtag pictur
5336,usernam tri make reserv blue box cafe month luck would love take mother come visit ny first time end june help make dream realiti hashtag
5337,buy ring state get warranti servic like complementari clean spain thank advanc usernam
5338,happi b day hashtag elegantli misplac escort ever deserv usernam fact hashtag open first time sun film hate danish pastri eat slowli yearn hashtag reflect pastri croissant gem stone httpaddr
5339,usernam usernam usernam usernam usernam usernam usernam alway personalis copper plate good manner
5340,usernam usernam ask opruitt buy em
5341,usernam usernam usernam gorgeou
5342,usernam order late water spot packag guy went beyond apolog gift custom servic amaz
5343,usernam odd tweet promot usernam sayin think face
5344,usernam usernam usernam usernam love smile face heart shape eye
5345,chief creativ offic reed krakoff reinvent usernam number centuri httpaddr
5346,usernam excit news usernam climat corp partner usernam commit moneysymbnumb million help protect restor great barrier reef australia plu check innov challeng hashtag httpaddr tropic fish hashtag
5347,might think jewelri think usernam know loui comfort tiffani dabbl paint draw furnitur lamp tile glass silver mosaic creativ inspir usernam new book tiffani blue hear httpaddr pictur
5348,tiffanyandco announc creation hashtag hashtag hashtag workshop hashtag modern streamlin hashtag process hashtag hashtag httpaddr hashtag hashtag pictur
5349,usernam httpaddr
5350,tiffanyandco purchas tiffani ring half centuri less number month later silver leav fallen unbeliev experienc difficulti get replac receipt warranti thought blue box signifi qualiti servic pictur
5351,usernam usernam usernam usernam usernam usernam usernam usernam usernam usernam clap hand sign emoji modifi fitzpatrick type number number clap hand sign emoji modifi fitzpatrick type number number clap hand sign emoji modifi fitzpatrick type number number
5352,usernam heavi black heart heavi black heart heavi black heart heavi black heart heavi black heart kiss mark
5353,usernam usernam usernam luv u
5354,hashtag jean neon heel win shop link product pictur post httpaddr hashtag hashtag hashtag hashtag usernam usernam usernam usernam
5355,free chocol croissant free coffe cute boy hand ye pleas take one tiffani blue number number hashtag usernam pictur
5356,appar sought place goto hashtag lineup around block hashtag usernam hashtag pictur
5357,littl usernam post vacat gift pictur
5358,usernam usernam proud
5359,usernam usernam cuti face
5360,usernam wed ring shop much profession broseph yurman tiffani co usernam new york ny httpaddr
5361,usernam usernam love much queen
5362,usernam email sent pleas check
5363,better spaghetti made gold piggi bank hashtag usernam pictur
