,tweet
0,usernam usernam usernam omg yesss inlov whole look smile face heart shape eye two heart
1,usernam give cool tri work cnnmoney httpaddr
2,usernam usernam usernam usernam usernam thank
3,usernam usernam usernam omg cute white smile face
4,yo en usernam pictur
5,usernam thank usernam moneysymbnumb number sponsor hat hero ball septemb number donat breakfast tiffani new york live auction packag hashtag hashtag hashtag hashtag hashtag hashtag hashtag pictur
6,usernam usernam usernam usernam melanin queen
7,usernam would love one birthday next month hug face
8,hashtag recogn leadership usernam advanc innov conserv strategi coral reef world preciou marin resourc httpaddr
9,fun fact number usernam blue book launch first mail order catalog us hashtag
10,usernam usernam usernam sure
11,look amaz usernam happi see back usernam ask notic alway wear necklac must sentiment usernam xx
12,usernam usernam usernam slay everyday
13,new blog post well truli worth wait say smirk face httpaddr hashtag hashtag hashtag hashtag tiffanyandco usernam usernam usernam pictur
14,usernam usernam usernam usernam damn hot
15,usernam thank usernam number gorgeou jewelri hashtag video go eye usernam usernam ring fire pictur httpaddr
16,usernam usernam usernam x
17,usernam usernam usernam suppos breakfast tiffani dinner hoodlum
18,usernam usernam costco come blue box shrug emoji modifi fitzpatrick type number number zero width joiner male sign
19,away ye usernam hashtag pictur
20,usernam httpaddr person fold hand person fold hand
21,usernam usernam thank littl far neutral face
22,first stop today tell friend celebr usernam usernam hashtag pictur
23,usernam usernam heavi black heart heavi black heart heavi black heart ring pictur
24,usernam usernam see sad think also need match collar realli lift spirit
25,usernam usernam gorgeou love usernam blue blue heart
26,usernam usernam usernam weird nasti nois dream tongu
27,usernam usernam forgiven anyon want watch hashtag
28,usernam usernam usernam u look like snack
29,usernam usernam usernam issa rock
30,reed krakoff talk us first collect usernam hashtag httpaddr
31,usernam awesom
32,celebr birthday earli tomorrow reserv usernam blue box cafe want go month excit shortcak parti popper
33,usernam usernam usernam inkatha asl
34,usernam usernam usernam preciou two heart
35,usernam know histori hashtag know altern choic birthston hashtag birthston get detail click httpaddr usernam usernam usernam hashtag hashtag pictur
36,channel audrey hepburn usernam blue cab coffe cart croissant httpaddr pictur
37,usernam expect collect base number men person fold hand person fold hand person fold hand bangl want compani
38,usernam usernam usernam usernam alway wonder lollipop guild would look like acid
39,boyfriend got yellow heart obsess usernam hashtag eight petal outlin black florett pictur
40,usernam usernam usernam hunni dinner pictur
41,usernam usernam usernam beauti women men garment avail welcom summer shirt other free httpaddr
42,usernam usernam nice work use number base colour accent color per style keep black white
43,usernam usernam usernam usernam usernam usernam
44,memo baj digest weekli jewelleri news round via usernam chart upward trend hashtag target grow hashtag sale speak head silhouett hashtag talk first collect usernam spiral shell hashtag hashtag number biggest jewelleri hashtag httpaddr
45,first commerci nbc coverag royal wed wed engag ring well play usernam hashtag hashtag
46,usernam usernam usernam usernam pictur
47,need know usernam ball yarn legit joke joke someon actual paid
48,contemporari luxuri look like usernam newest collect httpaddr
49,type market tri get stay good job tiff usernam httpaddr
50,cours usernam beat retail apocalyps tiffani timeless ring
51,throw back last time visit new york breakfast usernam red appl happi independ day enjoy celebr region indic symbol letter u region indic symbol letter clink glass pictur
52,usernam usernam usernam gal flawless
53,moon river usernam usernam ell fan httpaddr
54,usernam sparkl shine like star univers sparkl hashtaghashtag hashtag hashtag hashtag hashtag hashtag hashtag hashtag hashtag hashtag hashtag hashtag hashtag hashtag hashtag hashtag hashtag kiss mark hashtag heavi black heart hashtag l eye k usernam usernam usernam pictur
55,usernam usernam usernam usernam pictur
56,stick overpr shite jewelleri yer ars usernam royalist cunt promot join httpaddr
57,usernam usernam usernam usernam annunaki queen
58,usernam great advert shame refund polici substandard jewelleri hashtag
59,explor usernam pictur
60,usernam usernam por
61,runway fairway usernam usernam usernam keep look ok hand sign exclus design experi hashtag
62,loui comfort tiffani famou beauti stain glass decor art interior howev mani peopl know accomplish painter long becam involv art white right point backhand index httpaddr write hand kieli usernam usernam pictur
63,usernam usernam usernam lol cage isnt key pendant roll floor laugh
64,usernam usernam usernam would love win gorgeou mug congrat lucki winner
65,usernam fashion friday black sun ray tulip rose hibiscu cherri blossom sunflow leaf flutter wind crown two heart sparkl jlo new video lusciou jewelri usernam httpaddr
66,usernam usernam seem maci
67,usernam interoffic envelop httpaddr
68,star stun usernam co paper flower event nyc best look eye thought balloon hashtag hashtag hashtag hashtag pictur
69,tiffani co homewar close dionn ward blue heart close video usernam item parti popper blue heart hashtag hashtag hashtag hashtag httpaddr
70,hashtag esto fueron lo rostro de la socialit mexicana que figuraron en la inauguracion de la ma recient tienda de usernam en mexico sparkl heart ring httpaddr
71,usernam usernam usernam usernam hashtag blue heart blue heart blue heart
72,order mom usernam necklac day yesterday ship estim would number number got next day insan pay overnight ship loveeeee tiffani smile face heart shape eye
73,acryl usernam blue nail sit usernam usernam univers shop center number pictur
74,love hashtag new tiffani co campaign usernam httpaddr hashtag hashtag
75,usernam usernam sterl silver reusabl straw
76,hashtag usernam return tiffani tm etch star round tag charm httpaddr
77,usernam usernam right smile face heart shape eye smile face heart shape eye
78,usernam usernam usernam pictur
79,usernam usernam usernam usernam usernam weari face smile face heart shape eye
80,fico pesquisando joia da usernam na internet e fico chateada por nao ter nenhuma ou por nao ter dinheiro
81,usernam usernam usernam usernam perfect cellphon love power music video smile face heart shape eye hashtag pictur
82,usernam usernam usernam si ahora vi que es ma tipo laboralhashtag hashtag
83,usernam usernam hell yeah heavi black heart heavi black heart
84,usernam usernam wat
85,usernam hashtag diamond gem stone
86,usernam usernam usernam wonder kiss brazil
87,seem like great day usernam littl blue box hashtag thank usernam pictur
88,usernam usernam su primer gran exito en espanol en dond estuvist viviendo bajo una piedra jlo tien una noch ma ven bailar que hicist
89,usernam usernam make happi
90,usernam usernam usernam eso algodon de azucar esa galleta se ven chida smile face smile eye luego te regalo una jajaja
91,look back time custom color usernam hashtag hashtag hashtag hashtag hashtag pictur
92,dope collab fire usernam x usernam httpaddr
93,usernam amaz thing usernam hashtag hashtag tiffani commit httpaddr
94,usernam yeeeeeiiiiiiiii usernam dond hay una tienda cerca de mi
95,usernam usernam usernam usernam usernam usernam usernam usernam usernam happi follow liker look forward see tweey wink face
96,nick jona reportedli shut entir usernam pick priyanka chopra engag ring ring ring ring httpaddr pictur
97,usernam hello may phone fax number legal depart subpoena address thx
98,final pick piec usernam dancer emoji modifi fitzpatrick type number dancer emoji modifi fitzpatrick type number dancer emoji modifi fitzpatrick type number dancer emoji modifi fitzpatrick type number dancer emoji modifi fitzpatrick type number dancer emoji modifi fitzpatrick type number dancer emoji modifi fitzpatrick type number love spoil sometim lol
99,usernam usernam usernam usernam usernam oh celebr last day rachel think next face tear joy
100,breakfast usernam croissant updat audrey hepburn version number pictur tiffani co
101,usernam innov idea help strengthen reef applic open hashtag challeng support usernam fdn receiv moneysymbnumberk toward solv issu heart reef httpaddr usernam usernam usernam hashtag pictur
102,usernam usernam worthless junk
103,thank usernam lead jewelri industri respons gold sourc pleas lead way transpar publish audit name diamond supplier hashtag httpaddr
104,usernam usernam usernam fact
105,usernam usernam usernam want everyth closet
106,usernam sell serious ugli elitist thing get gross advertis moneysymbnumb metal clothespin pictur
107,usernam hashtag hashtag hashtag hashtag hashtag hashtag hashtag hashtag hashtag hashtag hashtag hashtag hashtag hashtag usernam hashtag hashtag httpaddr
108,mean red resist tiffani usernam hashtag hashtag hashtag pictur
109,andreea diaconu en usernam usernam para la portada digit de usernam agosto number x usernam pictur
110,usernam usernam usernam usernam bare afford pay rent wanna see rich peopl stuff timelin thank pictur
111,usernam usernam usernam usernam
112,usernam usernam aye make cri still went ahead forc marri
113,usernam third necklac usernam wear usernam ad small bead without charm
114,usernam usernam usernam usernam care pr priyanka green card face stuck tongu tightli close eye face stuck tongu tightli close eye mayb get marri quicki divorc even look good togeth
115,usernam usernam new york best
116,usernam usernam hashtag readi fli usernam hashtag hashtag hashtag hashtag hashtag hashtag hashtag hashtag hashtag hashtag gift usernam usernam pictur
117,usernam usernam usernam usernam usernam beam usernam paper flower event clad usernam blazer usernam tight love think hashtag hashtag hashtag hashtag hashtag hashtag hashtag hashtag hashtag hashtag
118,usernam like usernam
119,usernam usernam regram hashtag hashtag hashtag httpaddr
120,usernam usernam excit xx
121,wife make go usernam forgot pre auth credit line lol face tear joy pictur
122,usernam alway place heart usernam httpaddr
123,usernam shame cafe take book came nyc desper come fulli book day get cute littl number new store near rockefel though smile face heart shape eye pictur
124,usernam usernam usernam zendaya love
125,usernam usernam usernam usernam omg heavi black heart
126,usernam usernam usernam usernam beauti damn fine ye sexi truli dyjuan barn yahweh
127,usernam usernam kinda look like dua lipa pic
128,angri usernam paid fast deliveri took week half arriv order came number necklac rather necklac bracelet travel hour half tiffani birmingham face poor custom servic problem solv
129,usernam usernam usernam get ring one day xo
130,usernam two heart lotti moss two heart supermodel usernam visit hashtag salon hashtag extens thrill result seen recent usernam event pictur
131,tyf arab letter alef ty arab letter alef sh arab letter alef l arab letter alef lqlb ring heavi black heart tiffanyandco pictur
132,usernam usernam usernam gorgeou cup usernam usernam usernam usernam
133,usernam breakfast tiffani number hepburn wore jean schlumberg creation set number ct tiffani yellow diamond credit tiffani co usernam extraordinari yellow hashtag httpaddr
134,usernam usernam usernam pashmina rug
135,usernam usernam usernam lolz dude better get save
136,httpaddr hashtag usernam usernam hashtag hashtag pictur
137,usernam usernam love campaign love tiffani co need fresh younger face lot cash rich young woman younger woman futur x
138,usernam usernam hahahahahahaha omg us actual walk grand stair pure smile face open mouth smile face open mouth smile face open mouth
139,usernam usernam usernam numberngelvazquez hashtag sparkl heart
140,usernam hangul filler hangul filler hangul filler hangul filler hangul filler hangul filler hangul filler hangul filler usernam thx httpaddr
141,usernam usernam x usernam design hashtag pictur
142,usernam troubl wrap head around estim moneysymbnumb repair moneysymbnumb tiffani tclip pen gift employ replac spring buf polish bit much ya think pictur
143,usernam still look usernam book charm
144,usernam usernam usernam beauti
145,usernam usernam ad obnoxi
146,usernam usernam usernam usernam usernam vocod ou auto tune je tromp tout le temp entr el deux xdnan mai cett perf de thalia et maluma c est ce que je voi arriv pour le futur de shak et ca deprim
147,usernam number year old usernam key ring final httpaddr
148,usernam usernam usernam field trip wed wednesday oh noth check gem gem stone hour face tear joy hashtag hashtag gem stone usernam dress usernam high heel shoe usernam httpaddr
149,usernam usernam usernam prettiest
150,usernam usernam omg love soo much idol xx heavi black heart heavi black heart heavi black heart
151,usernam usernam usernam usernam much spend campaign ruin classic johnni mercer song jewelleri brand simultan awe
152,shop usernam fifth avenu definit must experi visit hashtag pictur
153,usernam love maui store beauti silver chain charm necklac broke two week purchas one wear snap help
154,usernam usernam usernam usernam beauti dress
155,usernam usernam usernam okay plu whatev get monday oh im go faint
156,usernam usernam ni que lo diga cuando te veo tengo la vista ma hermosa del mundo te veo veo una de la mile maravilla del mundo
157,usernam usernam usernam usernam dum spiro spero
158,usernam pictur
159,usernam usernam hashtag hashtag hashtag heavi black heart ari birthday cake crown smile face smile eye httpaddr
160,usernam usernam au moin ell ell ne le perdra pa se diamant face scream fear
161,usernam usernam usernam beauti
162,honor share stage usernam afternoon hashtag discuss brand stay essenti custom expect chang pictur
163,usernam w usernam hashtag hashtag hashtag usernam hashtag hashtag hashtag usernam usernam sell virtual good build actual dream usernam usernam usernam usernam inspir usernam usernam usernam usernam pictur
164,wow feelin everyon look usernam parti ring
165,usernam usernam swear everi time see photo donut miss cat face tear joy
166,usernam usernam usernam usernam usernam usernam usernam usernam usernam usernam usernam usernam pictur
167,usernam usernam yaaaa girl ring smile face heart shape eye birthday cake ring
168,usernam usernam usernam wish best life happi birthday enjoy day garet love n miss mwah hashtag
169,usernam celebr number year anniversari number year later hubbi still know surpris even littl blue box usernam hashtag hashtag limani httpaddr
170,listen hate basic usernam jewelleri liter stun yep girl xoxo hashtag hashtag
171,dare usernam use voic audrey moon river new modern advertis want clever instead play trash music afterward could play frank ocean cover moon river
172,usernam usernam usernam love queen
173,usernam usernam usernam usernam usernam httpaddr
174,enough get feet pvt pyle best squar ass away start sh tting tiffani cufflink definit f ck usernam hashtag usernam hashtag pictur
175,usernam good deal daniel outstand bought tiffani product phone result
176,usernam usernam pictur
177,fume usernam ear snap clean half especi sinc coupl month upsid face
178,hate capit ew also today walk usernam flagship store pictur
179,usernam today color inspir come perfectli brand littl blue box usernam blue hashtag hashtag hashtag hashtag pictur
180,tri get reserv usernam blue box cafe damn near imposs weari face
181,usernam usernam usernam numberyardsarchitec_ bob seger talk got better deal hand hashtag hashtag
182,usernam usernam pictur
183,usernam usernam great brand
184,idk cryptic messag usernam tri send someth come number number birthday graduat come whatev want httpaddr
185,visit san jose california walnut creek california locat usernam jewelri servic say start get mean red option clean centuri ring store hashtag
186,luxurylaw client number zendaya joan arc wear usernam usernam usernam pictur
187,knew usernam would make babi smile smile face smile eye night star hashtag usernam pictur parker new york hotel
188,usernam usernam pretti
189,usernam usernam usernam usernam jajajajajajajajajaja yo con ponchito pura amistad de la buena victori hand emoji modifi fitzpatrick type number
190,usernam got necklac saturday wear number day take night time keep bag keep away perfum badli tarnish expect happen paid amount sure mirror qualiti
191,usernam usernam usernam shrug emoji modifi fitzpatrick type number number zero width joiner male sign wink face
192,usernam hashtag molli channel inner hashtag wore pearl barkfast tiffani usernam dog face heavi black heart gem stone fifti seven number dental httpaddr
193,cong chiyannoringu si terunaateihuani katakana hiragana prolong sound mark atorasu naro katakana hiragana prolong sound mark ringu suta katakana hiragana prolong sound mark ringushiruba katakana hiragana prolong sound mark httpaddr usernam
194,usernam usernam usernam damn pictur
195,usernam usernam usernam postmagazin featur live q usernam highlight hashtagd new usernam paper flower campaign usernam read articl pictur
196,usernam usernam usernam lol dead na miss dey miss ake kill person na face tear joy face tear joy face tear joy
197,advert usernam appear almost everi night ad break hashtagnew week serv remind despit extens jewelleri collect includ jewelleri
198,usernam help cri face brand new elsa peretti necklac broke chanc fix store need ship thank
199,usernam usernam usernam usernam love heavi black heart
200,littl blue box usernam alway nice hashtag
201,usernam usernam good luck soph
202,hashtag usernam celebr hashtag big bold beauti impact way httpaddr
203,usernam usernam usernam usernam usernam
204,usernam mgbwhome vhernierjewel stuartweitzman robertmarcni tiffanyandco dior patekgenev httpaddr
205,usernam usernam usernam usernam usernam usernam usernam usernam usernam usernam usernam usernam usernam woodford make great manhattan especi doubl wood
206,usernam usernam blue heart blue heart blue heart
207,usernam usernam polish restor amaz ring replac miss stone get enough public
208,rollout usernam hashtag campaign stellar ok hand sign emoji modifi fitzpatrick type number
209,usernam usernam ye httpaddr
210,littl blue box arriv friend usernam hashtag gracious donat player award mulligan meal golf outing june number hashtag hashtag hashtag hashtag pictur
211,fur unseren kunden usernam konnten wir ein lupenrein liebeserklarung auf dem hashtag umsetzen httpaddr
212,usernam usernam usernam usernam usernam mirko marley domd estan
213,usernam usernam travel kenya w usernam usernam influenc press met w usernam usernam learn challeng face eleph codinha share fight eleph critic httpaddr
214,usernam usernam usernam usernam love
215,bottom usernam silver bracelet bought wife birthday one month ago least shinni top non tiffani silver bracelet worn year bracelet purchas tiffani store hashtag flush face face look triumph pictur
216,hashtag plan today bing watch usernam yoga pj feign surpris famili give usernam china paper cup ask pictur
217,hashtag usernam vivid dream high jewelleri collect httpaddr hashtag pleas rt pictur
218,usernam usernam usernam
219,primera vez en mi vida que tengo deuda tengo por fin un ahorro vida establ lo puto chileno abren usernam todo se derrumbo
220,usernam usernam usernam blanket
221,wow x gem stone ring usernam usernam pictur
222,usernam summer citi wilt flower wear usernam rose gold necklac dizzi symbol hashtag hashtag hashtag pont alexandr iii httpaddr
223,usernam smile face heart shape eye smile face heart shape eye smile face heart shape eye
224,brosh iz natur nogo zhemchuga v form krylyshek usernam n iu iork number number gg potriasaiushche sochetani tvoreniia prirodi chelovecheskogo talanta na vystavk iz muzeev katara hashtag sokrovishcha morei rek pictur
225,tiffani co built secret lab shini dream httpaddr via usernam usernam usernam hashtag
226,usernam usernam number floor usernam view usernam usernam union squar dewey monument httpaddr pictur
227,okay folk whoever find buyer httpaddr get nice present usernam get plu usernam get moneysymbnumberk usernam get moneysymbnumberk usernam get moneysymbnumberk help vet httpaddr get launch hashtag
228,retweet clio award usernam aliciakey one featur usernam believ love took number number spot week top usernam song commerci httpaddr httpaddr
229,tiffanyandco store thrive big chain like sport author payless shoe languish hashtag hashtag hashtag httpaddr
230,leigh summer hit tour rehears june number number tiffanyandco atla pierc key pendant moneysymbnumb cartier yellow gold just un clou ring moneysymbnumb number nike epic lux sheer panel leg avail nike lunarglid sneaker avail similar pictur pictur
231,make sure check review usernam fragranc collect white heart suit v httpaddr hashtag hashtag hashtag pictur
232,usernam groov de paloma picasso r anel httpaddr
233,tiffanyandco challeng brought hashtag hashtag hashtag hashtag hashtag hashtag hashtag hashtag hashtag httpaddr
234,usernam usernam campaign absolut beauti never tweet ad deserv prais hand beauti next time includ age hand love come age smile face smile eye
235,usernam pearl alway appropri jacki kennedi ador usernam piec hashtag alway favourit pearl simpl yet equal httpaddr
236,usernam usernam usernam black heart suit black heart suit smile face heart shape eye
237,usernam usernam number
238,usernam hashtag
239,alway enjoy give shout great servic someon run social bank across apac jp mea usernam servic usernam order someth come nyc get back syd cbd store got airport collect
240,usernam yet anoth use gorgeou bag pictur
241,usernam ugh beauti burrata got grain snow pea radish beauti almost want see eaten usernam hashtag hashtag httpaddr
242,usernam usernam usernam tiffani lucki see evil monkey
243,usernam usernam usernam look regal asf pictur
244,usernam usernam number kendal jenner ig updat paper heart usernam blue heart usernam hashtag hashtag hashtag pictur
245,usernam usernam hate tell ummm take tiffani co fix suggest send new york get fix got mine back last week almost two week weari face
246,thank usernam lead jewelri industri respons gold sourc pleas lead way transpar publish audit name diamond supplier hashtag httpaddr
247,check usernam hashtag spotlight lisa baldwin hashtag usernam httpaddr hashtag
248,usernam usernam tengo que volver reparar mi pulsera que se volvio caer el corazon azul lo mand reparar con ello face palm emoji modifi fitzpatrick type number zero width joiner femal sign
249,usernam usernam usernam usernam usernam happi anniversari joyc hope wonder day x
250,usernam usernam usernam fuck love
251,usernam tiffani co eyewear eleg usernam valley primari eye care smile face sunglass httpaddr catasauqua panumb number numberhashtag hashtaghashtag hashtag hashtag hashtag hashtag hashtag hashtag hashtag pictur valley primari eye care llc
252,usernam camila via ig hoje passei na loja da tiffani pra escolh meu present quer dizer pra conhec toda colecao da linha q fui brevement apresentada em httpaddr otima dica de dia do namorado ring smile face heart shape eye colecao e linda autentica e httpaddr dica ai galera face throw kiss tiffanyandco pictur
253,casual told cowork still know get mom hashtag one cowork suggest get usernam jewelri die insid upsid face girl got much money
254,surpris ad spot wed brand includ usernam abound got wed fever bride veil emoji modifi fitzpatrick type number face thermomet hashtag
255,usernam usernam usernam usernam abraham descent build bless children trump atla mountain pleiad maia orion giza ephesian hunter chief bull test demet bacchu harvest hyad leukai silvan san juan diego st john jame brother donner neet civil rite
256,least moneysymbnumb number number year pocket matt ryan go usernam sb trophi made sinc win one lol hashtag
257,usernam usernam usernam usernam
258,usernam usernam usernam notic dress lol
259,favorit style usernam ok hand sign emoji modifi fitzpatrick type number sparkl hashtag accessor look coupl usernam platinum ring also debut pair usernam hashtag platinum diamond ear unavail diamond open flower ring moneysymbnumb number gem stone pictur
260,mad usernam junk ass fake ass float whole stock pile merchandis give away crowd refus give away hate crime deni singl goddamn ring pop pride gay give ring pop jagwe
261,usernam u amaz job jewelri selena wore met galla hope boss put someth extra check week say caus shear holder co xoac
262,usernam seem brand tiffani
263,usernam usernam usernam usernam usernam usernam ellen ah scusa caterina sarai massacrata dalla regina hashtag anticipa pictur
264,usernam usernam usernam pictur
265,ariana usernam juli issu avail june number wear usernam two hing bracelet psnumber number pictur
266,usernam usernam usernam amaz dress look beauti
267,alway pleasur usernam pictur
268,usernam usernam usernam bella
269,usernam ador live san francisco see much happi god present last also thank usernam
270,usernam usernam usernam marri one day love
271,part usernam campaign dream come true blue heart hashtag hashtag pictur
272,usernam usernam usernam usernam bunion gorgeou
273,want tiffani model usernam happi place heavi black heart
274,usernam usernam usernam usernam usernam smile u other otherwis fake insincer like chequ u cant cash co substanc anyhow u get point disappoint face
275,hashtag hashtag smile cat face heart shape eye smile cat face heart shape eye top upward arrow top upward arrow rocket rocket fire fire usernam crescent moon glow star yellow heart pictur
276,usernam c mon want make monday stress disappoint face
277,usernam usernam usernam
278,usernam usernam usernam usernam cant wait smile face heart shape eye blue heart
279,compar hashtag shop usernam sever sale peopl show beauti bracelet necklac pendant ring time much go realli appreci rate number number
280,usernam usernam usernam usernam usernam pictur
