,tweet
1708,usernam usernam usernam usernam look
1709,tiffani co unveil new collect strip away typic rule fine hashtag usernam take street hashtag seri cryptic market push dramat latest hashtag httpaddr pictur
1710,usernam usernam usernam usernam fabul advertis love two heart two heart two heart
1711,usernam usernam usernam usernam usernam usernam love pic smile face heart shape eye
1712,liter receiv worst custom servic usernam ever face roll eye
1713,usernam usernam usernam usernam jeloh
1714,absolut love usernam current ad campaign tv spot usernam hashtag hashtag
1715,usernam usernam kind polici would like honestli want ear necklac remaind credit ring cost lose anyth
1716,usernam usernam usernam u spill spaghetti lol
1717,thank usernam usernam new hashtag award truli honor pictur
1718,usernam usernam open anti luxuri hashtag store httpaddr hashtag brand appeal hashtag discern hashtag hashtag hashtag hashtag hashtag hashtag
1719,flower hashtag would guess usernam spectacular new collect hashtag collect combin hashtag hashtag twist hashtag check articl collect httpaddr pictur
1720,feel usernam order come payday smile face heart shape eye hashtag
1721,usernam usernam right miss great
1722,usernam usernam usernam lol cours
1723,usernam usernam usernam usernam tri show sorri chang better man see love love leav nasti word door door
1724,usernam usernam httpaddr
1725,usernam usernam next time usernam
1726,usernam dm still respons realli poor custom servic thought premium compani
1727,kind monogram usernam accessori think tinsley room select box guess luggag tag cute way pre plan vacat hous hurdl part hashtag
1728,usernam usernam numbergerardpiqu usernam usernam usernam
1729,usernam got usernam glass wed gift make feel extra bougi pictur
1730,usernam great commerci purpl heart purpl heart
1731,uh usernam well done tv ad hand mani kind coupl thumb sign ring
1732,number year usernam today thank usernam necklac smile face heart shape eye hashtag work amaz compani pictur insper
1733,usernam usernam usernam usernam that answer look roll floor laugh roll floor laugh
1734,uepa un escenario para amar exito de httpaddr usernam pictur
1735,usernam usernam usernam clinton fine soul deserv nonsens put continu propag extrem right
1736,usernam usernam usernam expens one person number wish could afford
1737,usernam usernam usernam roll floor laugh roll floor laugh roll floor laugh roll floor laugh mal posso esperar
1738,usernam hashtag daisi inspir brooch ring usernam part latest stori flower bride publish solitairemagazin pick seven floral httpaddr
1739,usernam usernam usernam usernam queen inde
1740,thank usernam lead jewelri industri respons gold sourc pleas lead way transpar publish audit name diamond supplier hashtag time evolv
1741,usernam usernam noth less pictur
1742,usernam usernam usernam usernam usernam nice heavi black heart sparkl sparkl love wardrob hair also kudo new style team
1743,usernam usernam pictur
1744,tiffani tiffani go shop usernam multipl music note
1745,usernam someth blue tiffanyandcohashtag hashtag hashtag hashtag hashtag hashtag hashtag hashtag hashtag hashtag pictur
1746,retweet british vogu usernam asapferg break boundari usernam brand ambassador httpaddr pictur httpaddr
1747,usernam get usernam ring prank better prank
1748,usernam usernam usernam usernam usernam usernam pictur
1749,usernam usernam usernam smile face heart shape eye ok hand sign hundr point symbol
1750,usernam usernam orang hashtag hashtag hashtag hashtag hashtag hashtag hashtag hashtag hashtag hashtag hashtag hashtag hashtag hashtag httpaddr
1751,usernam usernam pictur
1752,thank usernam lead jewelri industri respons gold sourc pleas lead way transpar publish audit name diamond supplier hashtag httpaddr
1753,usernam clasp beauti bracelet broken year best way get fix pictur
1754,usernam usernam beauti
1755,usernam toffifay trump bumpngrind widda midnight moonlight ladi man sg
1756,usernam usernam usernam take whole wig away pictur
1757,thank usernam lead jewelri industri respons gold sourc pleas lead way transpar publish audit name diamond supplier hashtag httpaddr
1758,usernam actual usernam one first major fashion brand adopt gif make year httpaddr hashtag cara
1759,usernam usernam usernam holi shit need outfit smile face heart shape eye
1760,usernam tour usernam tenni racquet ball kiss mark lip usernam smile face sunglass usernam shade dark sunglass usernam haircut hair usernam usernam pictur
1761,usernam thank much usernam memor pendant smile face heart shape eye love much doodl engrav mak name back hashtag hashtag hashtag httpaddr
1762,usernam ummm guy new commerci alicia key give littl headach could ya run time
1763,usernam usernam usernam usernam usernam usernam usernam usernam adio resentida social pont trabajar deja de acosar gent en la rede que es lo que te dedica wave hand sign emoji modifi fitzpatrick type number number
1764,usernam usernam usernam amaz
1765,usernam usernam usernam usernam usernam usernam smile face smile eye hashtag
1766,man bag briefcas full eurcamoneysymbh readi hashtag hashtag hit usernam seriou shop read hashtag httpaddr pictur
1767,finish complet number pg term paper usernam best work might add final finish everyth colleg august time watch nanni repeat next number month pictur
1768,usernam usernam usernam oh nice gift usernam usernam
1769,usernam usernam see dead pool friday
1770,walk usernam get given think face hashtag pictur
1771,usernam usernam product uniqu deem recognit
1772,tiffanyandco revamp start pay global store sale climb number percent httpaddr pictur
1773,usernam mors code thumb pressur ring usernam usernam usernam usernam usernam hashtag
1774,usernam decis decis one ladi number number smile face heart shape eye grow heart doubl tap like httpaddr httpaddr usernam photo via usernam hashtag hashtag hashtag httpaddr
1775,usernam usernam usernam thank dude happi smile face smile eye
1776,cat knock usernam piggi bank loudli cri face use save disneyland broken heart
1777,usernam wow fabul usernam pop gorgeou hashtag hashtag hashtag hashtag hashtag hashtag hashtag hashtag hashtag hashtag hashtag hashtag hashtag pictur
1778,usernam think hashtag wore new silver platinum bracelet right arm sat bead look like usernam bracelet seen may still b px hashtag usernam bracelet wow major wed bling new style number usernam httpaddr
1779,let danc hashtag wear hashtag polka dot silk chiffon dress set usernam pictur
1780,usernam usernam usernam loudli cri face loudli cri face loudli cri face
1781,usernam diner usernam hashtag hashtag hashtag hashtag hashtag hashtag httpaddr
1782,usernam usernam love much
1783,usernam favourit colour hashtag gem stone camera flash usernam usernam pictur
1784,usernam usernam usernam tell come daya face tear joy deff dress way better lol
1785,usernam se rodea de estrella para lanzar su campana believ dream httpaddr hashtag hashtag hashtag hashtag hashtag
1786,usernam usernam usernam usernam usernam usernam usernam usernam usernam usernam usernam usernam usernam usernam usernam usernam usernam usernam usernam usernam usernam usernam
1787,usernam sistah tiffani commerci fire made want run buy jewelri usernam
1788,come usernam smile face heart shape eye pictur
1789,usernam dommag usernam
1790,usernam bought bracelet tiffani earlier even open box arriv back home notic bracelet scratch extrem disappoint sold someth clearli damag
1791,acclaim aesthet artist director usernam hashtag talk galeri favorit artist best auction purchas person project yet httpaddr pictur
1792,usernam usernam usernam slt mess
1793,give best shop experi usernam orlando cameron best hashtag pictur
1794,usernam usernam probabl heavi black heart
1795,thank usernam lead jewelri industri respons gold sourc pleas lead way transpar publish audit name diamond supplier hashtag httpaddr
1796,usernam usernam usernam dinner sometim
1797,usernam usernam usernam usernam usernam fire sexi video hashtag hashtag damn hot perfect song incred choreographi cant stop danc love u hashtag kiss hashtag face throw kiss face throw kiss face throw kiss keep hashtag hashtag hashtaghashtag hashtaghashtag hashtag hashtag hashtaghashtag hashtag pictur
1798,usernam usernam usernam think face face tear joy
1799,usernam brighten morn littl poem david sedari topic love new usernam paper flower brochur absolut stroke market httpaddr
1800,usernam see usernam see fit naph face throw kiss face throw kiss heavi black heart
1801,usernam usernam cuando uno de mi hijo tenia number ano vimo junto una entrevista que te hicieron en algun canal de tv que recuerdo su comentario por ti fue se paso belleza con contenido cada vez que leo algo tuyo puedo dejar de recordarm esa asertiva definicion
1802,usernam usernam usernam interview go
1803,usernam usernam usernam vintag queen crown sparkl smile face heart shape eye sparkl crown
1804,usernam usernam usernam
1805,usernam hashtag hashtag premier suit alexandermcqueenjewelri usernam hashtag hashtag hashtag hashtag hashtag httpaddr
1806,usernam usernam diosa unica bonita una star una divina
1807,usernam usernam usernam birmingham took breath away mani beauti piec httpaddr
1808,usernam usernam usernam usernam number bad
1809,usernam usernam congratul
1810,usernam usernam tea
1811,usernam usernam happi birthday usernam
1812,moment walk usernam store first time friend buy someth get ring saw display mind person bow deepli emoji modifi fitzpatrick type number number zero width joiner femal sign
1813,usernam usernam queen maddi
1814,usernam usernam usernam usernam henc men suit hang around
1815,usernam usernam usernam usernam usernam renew transit fossil fuel worldwid vegan stab dark expect moneysymbnumb number heard moneysymbnumberm blow partnership ahem
1816,usernam usernam usernam skinni legend
1817,buy hous plant usernam cost actual hous pictur
1818,usernam
1819,usernam usernam usernam color remind usernam inaugur parad stun
1820,great usernam usernam ad ring kiss mark
1821,usernam littl someth blue ring blue heart usernam httpaddr pictur
1822,usernam usernam usernam beauti
1823,usernam usernam usernam pretti
1824,usernam usernam bling tiffani hashtag
1825,usernam usernam usernam smile face heart shape eye smile face heart shape eye smile face heart shape eye
1826,usernam usernam need
1827,usernam advert beauti perfect stapl end hashtag sparkl heart
1828,usernam usernam women longer shop tiffani usernam
1829,usernam usernam fresh creativ sparkl heart hashtag usernam katakana middl dot katakana middl dot katakana middl dot follow paint splatter road usernam taken nyc liter paint town signatur blue color pretti geek goe without say tiffani suc httpaddr pictur
1830,usernam usernam usernam usernam think miss opportun add usernam campaign huge audrey hepburn fun version moon river good httpaddr
1831,usernam usernam ne achei feio parec uma coleira de dedo hahahaha
1832,usernam usernam congrat alic tiffani compani happi somebodi work number year compani time fli
1833,usernam usernam usernam wonder call fat rascal noooo york
1834,usernam usernam usernam usernam woman one kind cherish beauti girl heavi black heart
1835,encuentra el accesorio perfecto en usernam pictur
1836,eu causo inveja ate na usernam
1837,usernam usernam usernam love
1838,usernam usernam gorgeou x heavi black heart usernam
1839,usernam receiv repli either email credit account
1840,usernam usernam usernam hashtag number hashtag hashtag hashtag hashtag hashtag hashtag hashtag httpaddr
1841,know get mom mother day text heart emoji quit cut got number great gift idea get start httpaddr usernam usernam usernam usernam usernam usernam usernam pictur
1842,usernam usernam sure equal proud alic heavi black heart
1843,hashtag reli cost cut digit sale usernam built secret hashtag lab shini dream httpaddr usernam tiffani secret space bring expert look jump rival bring separ entranc
1844,usernam love tea friend usernam usernam httpaddr
1845,usernam usernam know love smile face heart shape eye smile face heart shape eye
1846,usernam usernam chill b lol
1847,usernam new commerci usernam amaz smile face heart shape eye serious go get mani marri wed beauti well done hug face
1848,usernam usernam usernam queen smile face heart shape eye drool face
1849,tiffanyandco seen increas engag ring sale due includ hashtag market campaign
1850,usernam usernam usernam usernam usernam inspir
1851,hashtag reveal vision usernam httpaddr pictur
1852,usernam yyou seen cab usernam blue number avenu sign tooo suppos new yorker usernam ed httpaddr usernam blue
1853,usernam usernam usernam usernam icon purs suppos lesbian pride flag happi coincid face tear joy face tear joy
1854,usernam usernam usernam fix idk knot
1855,usernam favorit necklac sell ebay httpaddr httpaddr hashtag hashtag hashtag hashtag
1856,think found new hashtag usernam precis cut hashtag amaz hashtag hashtag hashtag hashtag hashtag hashtag hashtag hashtag hashtag hashtag hashtag pictur
1857,hashtag hashtag love usernam colour la ferrar ah usernam pictur
1858,usernam usernam thought ring alreadi face palm emoji modifi fitzpatrick type number zero width joiner femal sign ring
1859,thank usernam hashtag commerci bwrxjwr platinum band express love moment put pictur
1860,usernam usernam black heart eleph earth globe america hashtag hashtag hashtag httpaddr
1861,akti v usernam hat besten tag seit number hashtag hashtag
1862,usernam happi anniversari hashtag usernam httpaddr
1863,usernam sister two go get engag second trump walk past usernam store singapor get ring kju next bride mar lago melania flee convent eastern europ bromanc level number hashtag
1864,thank usernam lead jewelri industri respons gold sourc pleas lead way transpar publish audit name diamond supplier hashtag httpaddr
1865,tiffanyandco chang imag engag hashtag httpaddr pictur
1866,usernam usernam usernam doubl whammi wink face
1867,ever time felt absolut poorest today discov usernam sell paper clip moneysymbnumb httpaddr believ httpaddr
1868,usernam _sarahnumb told look like tiffani good
1869,risiko nel hashtag italiano il gruppo tage e francesco trapani usernam comprano il number di vam invest con opzion sul number number anni httpaddr usernam
1870,usernam usernam fantast tyler let us know help tri free sampl stationeri kit httpaddr
1871,thank usernam lead jewelri industri respons gold sourc pleas lead way transpar publish audit name diamond supplier hashtag httpaddr
1872,usernam usernam usernam usernam thank httpaddr
1873,usernam usernam awesom
1874,usernam thank much repli white medium star
1875,usernam usernam usernam usernam usernam usernam usernam ye
1876,want tiffani co necklac number thankssss usernam
1877,usernam earn monthli bonu cash time extra fun time usernam httpaddr
1878,usernam usernam beauti liter princess crown thank wonder role model daughter love black heart suit hug face usernam
1879,usernam usernam usernam usernam usernam usernam usernam
1880,get usernam eyeglass happi person rais one hand emoji modifi fitzpatrick type number zero width joiner femal sign complet blue glass case bag smile face heart shape eye
1881,usernam ok hand sign ok hand sign
1882,usernam usernam usernam usernam omg pride look everyth wave white flag zero width joiner rainbow
1883,usernam usernam true brummi let
1884,usernam usernam sooo proud babi
1885,thank hashtag usernam hashtag us headlin gorgeou gala wait til next one pictur
1886,hashtag hashtag usernam intens new perfum smell pennsylvania httpaddr hashtag fragranc hashtag usernam httpaddr pictur
1887,usernam hope someon could help frustrat product qualiti issu moneysymbnumb number item purchas pleas dm email
1888,butterfli pretti crimson sky cherri blossom rainbow smile priceless smile face heart shape eye smile face heart shape eye usernam heavi black heart usernam enginaykanathashtag hashtag hashtag hashtag hashtag pictur
1889,usernam usernam usernam legend
1890,paul zimniski usernam present posit outlook diamond price rough polish yesterday toronto usernam diamond symposium talk usernam recent impress quarterli result httpaddr httpaddr
1891,truli loss word usernam pictur
1892,usernam usernam pawn lol jk
1893,usernam still got month get massiv number frame store includ name like usernam usernam usernam contact us visit us anytim monday saturday grab offer hashtag httpaddr pictur
1894,usernam usernam usernam u pictur
1895,usernam usernam cocki word mean domin dude fact combat vet brain damag stand learn pretent spout nonsens co sound badass fact peopl seek hashtag offer hashtag littl one want love parent back hashtag hashtag
1896,usernam hashtag usernam hashtag hashtag httpaddr
1897,usernam usernam usernam usernam beauti black woman magic u live truth momma
1898,usernam usernam mom kinda hot
1899,usernam morn media launch debut paper flower collect hashtag hashtag pictur
1900,usernam usernam wow zendaya ring
1901,usernam la joyeria usernam tien la opcion de cafeteria ahora la mujer tenemo nuestro momento httpaddr
1902,usernam usernam usernam slay slay slayyyyyyyyy smile face heart shape eye smile face heart shape eye two heart two heart two heart two heart smile face heart shape eye smile face heart shape eye smile face heart shape eye two heart two heart smile face heart shape eye two heart smile face heart shape eye smile face heart shape eye two heart smile face heart shape eye smile face heart shape eye smile face heart shape eye smile face heart shape eye
1903,usernam usernam proud mom region indic symbol letter b region indic symbol letter r grow heart
1904,usernam usernam doesnt jewelri say brittani lynn steve star bright
1905,usernam face throw kiss face throw kiss wolf face
1906,ell fan chat us spend summer angelina joli new movi make hip hop debut usernam usernam httpaddr
1907,usernam usernam usernam usernam model hashtag pictur
1908,usernam usernam hey hannahlook great bouquet bouquet bouquet bouquet bouquet bouquet bouquet bouquet bouquet kiss face kiss face kiss face kiss face
1909,usernam usernam usernam usernam usernam natalieevamari fashioncityblonumb voguemagazin ew danygarciaco imagin imageloc ellemagazin britishvogu danygarciaco parismatch thr kkwbeauti pictur
1910,usernam usernam que linda
1911,thank usernam lead jewelri industri respons gold sourc pleas lead way transpar publish audit name diamond supplier hashtag httpaddr
1912,usernam usernam know pretti cool
1913,smile face heart shape eye usernam httpaddr
1914,nice one usernam httpaddr
1915,thank usernam lead jewelri industri respons gold sourc pleas lead way transpar publish audit name diamond supplier hashtag httpaddr
1916,usernam usernam usernam usernam usernam gorgeou happi see tl
1917,usernam breakfast usernam hashtag hashtag pictur
1918,usernam usernam usernam didnt attack like
1919,usernam top number halloween costum break bank pictur
1920,usernam thought treat thank usernam httpaddr
1921,usernam love still life tiffanyandco c number paolo fassolihashtag hashtag hashtag hashtag hashtag hashtag hashtag hashtag hashtag httpaddr
1922,usernam go charg moneysymbnumb fix clasp braclet even year old jewelri high qualiti last lot longer year pout face pout face
1923,hola usernam gracia por darm ma razon para seguir trabajando think face blue heart
1924,usernam hello possibl engrav jewelleri alreadi bought tiffani possibl thank
1925,usernam usernam wow cool
1926,usernam usernam usernam wow pure motiv right get want usernam especi determin go get em girl
1927,better invest futur educ jim quinn nsla vice chair former presid usernam hashtag hashtag
1928,que debo pensar cuando mi novio empieza investigar la medida de mi anillo sacar el tema de propuesta boda omg purpl heart purpl heart siento como liv cuando encontro la caja de usernam en la peli usernam jajajajajajaajaja ok ya hashtag hashtag hashtag
1929,usernam usernam usernam usernam pictur
1930,usernam usernam hashtag articul lorri dash symbol dash symbol dash symbol dash symbol hashtag hashtag hashtag httpaddr
1931,usernam usernam amaz cri face loudli cri face sparkl heart
1932,time hashtag sparkl campaign usernam usernam usernam hashtag pictur
1933,usernam usernam usernam nah son mistaken pictur
1934,usernam call usernam
1935,usernam usernam tiffani need chill backward tweet
1936,usernam usernam usernam cute babi babi symbol smile face halo godmompertti kiss mark high heel shoe high heel shoe flex bicep blue heart blue heart rabbit gem stone bust silhouett microphon kiss mark bear face koala kiss face close eye usernam kiss mark microphon high heel shoe high heel shoe paw print bust silhouett gem stone flex bicep blue heart blue heart kiss face close eye lock
1937,usernam usernam usernam beauti
1938,thank usernam lead jewelri industri respons gold sourc pleas lead way transpar publish audit name diamond supplier hashtag httpaddr
1939,usernam usernam usernam
1940,usernam usernam usernam hoe meer bling bling hoe beter
1941,usernam katakana middl dot neeeeeeeed one smile face heart shape eye smile face heart shape eye smile face heart shape eye smile face heart shape eye smile face heart shape eye korehayu shii metsuchiyayu shii drool face usernam disneycruiselin tiffanyandcohashtag hashtag hashtag hashtag hashtag katakana hiragana prolong sound mark hashtag katakana hiragana prolong sound mark kuru katakana hiragana prolong sound mark zurain hashtag katakana hiragana prolong sound mark httpaddr pictur
1942,usernam kiss hand may quit continent usernam jap best friend xoxo httpaddr
1943,usernam usernam sorri person fold hand emoji modifi fitzpatrick type number number roll floor laugh
1944,mother day say thank usernam metro watch trace diamond hashtag hashtag pictur
1945,usernam thank usernam usernam help shop list team love gift guy best heavi black heart deelopera usernam httpaddr
1946,less number month usernam item jewelleri break charg absolut fortun someth last day longer cheap high street rubbish poor face look triumph face look triumph
1947,usernam usernam hashtag featur usernam usernam usernam coverag hashtag hashtag captiv romant heavi black heart hashtag pictur
1948,usernam commerci perfectli time ring hashtag
1949,usernam usernam usernam usernam would like see routin
1950,usernam usernam usernam congrat bro deserv hashtag
1951,usernam usernam usernam well close
1952,usernam usernam usernam usernam usernam togeth thru air season
1953,usernam usernam usernam usernam yeah one afford jewelri tiffani compani
1954,truli one best commerci right one w usernam f usernam sing hashtag stun imag love heavi black heart ring clink glass perfect time hashtag
1955,give littl blue box usernam two heart two heart
1956,ell fan put modern spin breakfast tiffani remix version moon river usernam httpaddr hashtag hashtag usernam pictur
1957,anyon connect usernam need score tabl number blue box cafe luck usernam
1958,top retail like usernam use custora improv perform email direct mail campaign help identifi persona prevent churn custom drive person outreach read case studi httpaddr
1959,well usernam rebrand thing stay classi ghetto tacki spend moneysymb elsewher usernam usernam usernam usernam keep real classi follow hashtag co disgrac
1960,rita katakana hiragana prolong sound mark n tou teihuani katakana hiragana prolong sound mark tm mini daburu ha katakana hiragana prolong sound mark tagu pendanto shiruba katakana hiragana prolong sound mark enameruhuinitsushiyu httpaddr usernam
1961,number usernam enchant necklac pictur
1962,usernam httpaddr
1963,paint nail usernam blue still miss ring ring think face usernam
1964,usernam usernam cup handl pattern cool seem avail favorit trade platform
1965,good advic wear work temperatur rise usernam usernam usernam usernam usernam usernam usernam usernam hashtag hashtag hashtag hashtag hashtag hashtag hashtag hashtag hashtag hashtag httpaddr pictur
1966,icon retail taken major step upgrad oper importantli jewelri design stoke unexpect level growth first quarter usernam httpaddr pictur
1967,usernam usernam today saw thought number profit go eleph crisi fund anoth great reason buy jewelri way go tiffani eleph eleph pictur
1968,usernam usernam usernam usernam lmaoooo
1969,usernam usernam usernam usernam usernam usernam usernam usernam usernam usernam usernam usernam usernam usernam usernam usernam usernam usernam usernam usernam usernam usernam usernam usernam usernam usernam usernam usernam usernam hashtag reach number million hashtag hashtag hashtag hashtag let go hashtag hashtag hashtag hashtag heavi black heart air spend qualiti time thank usernam hashtag hashtag hashtag hashtag hashtag hashtag usernam hashtag pictur
1970,usernam usernam usernam usernam terribl ad
1971,usernam sent dm pleas assist thank
1972,usernam usernam usernam truli amaz icon african american girl young woman smile face heart shape eye
1973,usernam usernam usernam usernam usernam usernam usernam usernam usernam usernam usernam usernam usernam usernam usernam usernam usernam usernam usernam usernam usernam usernam usernam usernam usernam
1974,usernam usernam usernam aghh give life
1975,usernam usernam usernam love stan fashion icon
1976,absolut crazi new return usernam jewelleri got mine number nice add anoth smile face heart shape eye
1977,usernam usernam usernam usernam dislik person america outsid kenya west
1978,usernam usernam usernam fada
1979,usernam usernam usernam usernam tom tappin
1980,usernam usernam deberian de poner pop up en el palacio de hierro de guadalajara aqui nunca tenemo nada de esto
1981,usernam sleep symbol keep follow new content tomorrow watch usernam httpaddr
1982,usernam usernam usernam usernam hashtag hashtag hashtag hashtag hashtag usernam hashtag hashtag hashtag hashtag hashtag usernam hashtaghashtag usernam usernam grace usernam httpaddr
1983,usernam usernam usernam alhamdulillaaahhh jemput jemput loudli cri face heavi black heart heavi black heart yellow heart yellow heart yellow heart yellow heart
1984,usernam usernam usernam look like gidget fli nun
1985,love new hashtag collect usernam hashtag hashtag hashtag hashtag hashtag hashtag pictur
