,tweet
0,_opsbeaw usernam usernam usernam usernam obrigadaaaaa
1,usernam cool thank
2,hashtag hashtag york blvd n ave number give number pair brand new usernam tomorrow sunday number number number numberpm time hashtag pictur
3,usernam usernam joke wtf offend
4,tomorrow start usernam u open surf world largest surf competit luckili hashtag minut away huntington beach live one oc desir locat two home left secur today httpaddr pictur
5,usernam vai lancar colecao van gogh e bem que ele poderiam mandar un mimo
6,usernam usernam usernam awesom
7,koleksi usernam x van gogh museum ini telah dirili di httpaddr select retail dan van gogh museum amsterdam pada number agustu lalu hashtag seperti apa koleksinya httpaddr pictur
8,excelent hashtag x hashtag es la ultima colaboracion de la moda el art httpaddr usernam usernam usernam hashtag hashtag hashtag hashtag httpaddr
9,usernam usernam usernam usernam usernam got bristol gig free lighter cri face cri face cri face cri face cri face
10,usernam usernam van vault locat get httpaddr list httpaddr
11,usernam usernam usernam lol guess feet help drop disappoint face
12,usernam hahaha love okay
13,usernam usernam usernam clap hand sign clap hand sign clap hand sign thumb sign
14,realli want usernam know get help
15,usernam usernam usernam usernam usernam usernam usernam usernam usernam usernam pictur
16,usernam usernam usernam lmao thank
17,hope usernam go sell germani pretti love smile face heart shape eye pictur
18,usernam usernam usernam usernam usernam na mame ya hay que pedo con la gent
19,usernam usernam usernam usernam usernam usernam usernam usernam omg sal
20,usernam rest fit sponser post usernam usernam pictur
21,usernam usernam usernam usernam usernam usernam usernam usernam usernam usernam httpaddr
22,usernam usernam usernam usernam usernam togeth two favorti thing
23,fun fact work usernam three year high school know way much van shoe got first pair number year agowut
24,usernam usernam usernam yee
25,usernam usernam bad boss
26,usernam usernam thumb sign
27,usernam wear best hug face pictur
28,conscienc man compass hashtag need brilliant piec usernam usernam spectacular collabor sparkl hashtag hashtag hashtag hashtag hashtag hashtag hashtag hashtag hashtag httpaddr
29,usernam usernam usernam usernam usernam msrp
30,usernam usernam woah
31,te amo usernam
32,usernam usernam right gut got shoe pattern instead shrug emoji modifi fitzpatrick type number number zero width joiner femal sign
33,perfect hashtag usernam usernam usernam hashtag heavi black heart dog face kiss mark shop bag ribbon pictur
34,usernam websit show whole van x van gogh collect guy sold
35,usernam guy need restock best shoe yet van yacht club loudli cri face loudli cri face
36,til first van store oper name van doren rubber compani manufactur shoe sold directli public compani display three style shoe price usmoneysymbnumb usmoneysymbnumb number dnumberc ftw usernam
37,usernam usernam cool bean brother
38,usernam usernam rememb wear pair psnumber airwalk school get bulli whole week wear brand one heard hashtag
39,usernam shut take money pictur
40,think forc buy new usernam slip on loudli cri face break hole
41,usernam usernam usernam usernam keep flexin
42,usernam pleas make exact shoe adult size pleas slightli smile face pictur
43,hashtag usernam usernam pictur
44,usernam usernam usernam usernam usernam usernam plan take coupl week month legit craft project focu alongsid els plan thank p
45,que lindoooo smile face heart shape eye smile face heart shape eye smile face heart shape eye usernam httpaddr
46,usernam usernam usernam bro day gotta watch trailer see movi gonna good also woth show show watch sceen next week amd dont hashtag
47,usernam usernam usernam usernam say thank love surpris im still emot definit updat get
48,usernam usernam usernam queen van clap hand sign emoji modifi fitzpatrick type number stan forver
49,usernam life httpaddr
50,usernam usernam hashtag go
51,hashtag usernam sale httpaddr pictur
52,usernam pictur
53,usernam usernam usernam moneysymbvfc babi
54,hey usernam need partner vacuum compani use snoopi van get dog fur stair vacuum usernam challeng hashtag hashtag hashtag pictur
55,still salti someon stole numbermoneysymb usernam merch girlfriend bought anniversari pair custom van also bought christma usernam
56,man usernam x usernam collab tho drool face drool face drool face
57,usernam usernam call custom servic answer question way faster twitter
58,usernam usernam sponsor girl yeah mani rt get girl van sponsorship
59,usernam usernam time number drop
60,woman emoji modifi fitzpatrick type number zero width joiner artist palett artist heart artist palett us hashtag stan part usernam realli dope closer look women van x van gogh collect pictur
61,usernam usernam usernam que dice
62,usernam usernam usernam movi trailer kind like see car wreck want look away stop look get reaction hear multipl version stat would want
63,usernam usernam usernam usernam anyth civil thumb sign thumb sign xx clap hand sign clap hand sign
64,usernam usernam usernam perfect
65,usernam usernam usernam sweet
66,usernam usernam usernam usernam hulk smash lol
67,hashtag paint pair van hashtag sparkl artist palett two heart usernam pictur
68,usernam usernam usernam hate trailer love tent send shoe watch movi start leav old school
69,usernam usernam thank xox
70,usernam usernam usernam sick
71,hey usernam head nba summer leagu tomorrow want offer shoe contract anyon usernam usernam
72,usernam usernam usernam usernam handsom boy ya got slightli smile face miss u jen hope ur doin well slightli smile face
73,awesom idea usernam usernam httpaddr
74,serio que tem gent que pensa que vai ganhar camisa e teni da usernam seguindo um perfil fake kkkk
75,husband rock star put shoe love custom van heavi heart exclam mark ornament hashtag usernam pictur
76,number number usernam alreadi sold van gogh sunflow van devast
77,complet obsess new usernam featur favorit artist hashtaghashtag hashtag hashtag face scream fear pictur
78,usernam thank
79,usernam usernam pictur
80,sunflow almond blossom van gogh brought great deal emot life paint check usernam hashtag hi hashtag sneak usernam x usernam collabor sunflow cherri blossom httpaddr hashtag pictur
81,usernam hey reco pull trigger usernam hope great teleport back number year ago
82,usernam usernam _dianasu usernam usernam usernam pictur
83,usernam usernam usernam usernam got last night excit heavi black heart
84,usernam think make pictur shirt hit dm want pictur
85,usernam usernam love sock
86,usernam usernam usernam usernam usernam ask polic
87,usernam usernam damn harri back white van
88,ja queremo toda peca dessa collab usernam httpaddr
89,usernam usernam name chang tho like fuck chuck follow
90,usernam usernam usernam wya
91,usernam usernam usernam usernam usernam usernam usernam usernam usernam sushi q esqueci nome tbm
92,usernam usernam usernam usernam love em purpl heart smile face open mouth tightli close eye pictur
93,usernam usernam usernam wrong band sadli hahaha bb dear hunter thank think
94,usernam usernam otw fire fire electr plug
95,usernam usernam usernam love ye pleas
96,got new thread usernam outlet peter van
97,realli understand usernam platform dude size
98,usernam usernam usernam yo need sock
99,usernam usernam httpaddr
100,usernam usernam usernam love usernam much
101,usernam usernam usernam usernam usernam usernam usernam usernam usernam usernam usernam usernam usernam usernam usernam usernam usernam usernam usernam usernam pictur
102,usernam usernam usernam look good
103,hashtag li nong x hashtag_trendnumb number number nine percent thx love fan meet changsha chang sha hashtag hat champion usernam shoe van usernam shirt bythercr warmwater_numb yi bei nong cha _number nong nong de chao ji nong chang hashtag li nong shi shang ke pu hashtag li nong si fu pictur
104,usernam usernam usernam smarttv wsl app open thumb sign face pile poo trash
105,usernam usernam plug
106,usernam usernam usernam usernam usernam amaz biggest freak fan
107,van gogh meet van doren usernam x usernam collect truli amaz favorit piec collab face open mouth read httpaddr pictur
108,usernam usernam hug face heavi black heart
109,usernam usernam usernam ya go
110,usernam much shoe good qualiti usernam
111,usernam vans_numb partner van gogh museum wearabl art httpaddr pictur
112,usernam usernam usernam guy go post usernam pictur date
113,usernam usernam usernam usernam thank
114,usernam van way bro usernam
115,usernam patrocina heavi black heart pictur
116,usernam kill listen plug tomorrow work usernam market la sit traffic listen guy like everyday tomorrow guy epic bum go offic live show
117,never look usernam store loudli cri face hashtag
118,blinki shred new usernam tnt advanc prototyp full edit pope httpaddr camera flash reec leung pictur
119,usernam gonna buy pair
120,usernam sign httpaddr
121,usernam yall make van gogh shoe lite slip old cant wear normal van without kill feet
122,usernam usernam someon make pair usernam death expertis leav airplan watch head explod grin face smile eye flush face
123,readi tonight konkret bowl parti usernam special perform usernam let get drunk boy girl person rais hand celebr pictur
124,van gogh van dope usernam realli outdid pictur
125,usernam usernam usernam usernam usernam usernam usernam usernam usernam usernam usernam usernam usernam usernam usernam usernam usernam usernam usernam usernam usernam love loudli cri face purpl heart
126,bruh usernam alway got best collab
127,erm excus usernam hell miss opportun van gogh pictur
128,um someon wanna get best usernam hashtag pictur
129,justo hoy que puse lavar todo mi teni empezo llover manana saldr tengo que ponerm usernam hashtag tire face loudli cri face
130,usernam usernam usernam usernam glad restock
131,usernam usernam much size number
132,usernam usernam usernam usernam usernam dope call hand emoji modifi fitzpatrick type number
133,usernam usernam usernam oh see smile face smile eye smile face smile eye smile face smile eye
134,usernam accident got wrong size van gogh turtledov colorway anywher help gift gf
135,usernam usernam pleas get wear post pix
136,usernam usernam usernam usernam better man surviv methink thing would differ attempt go program pictur
137,hey fuck usernam cancel major vansxvangogh order even though order midnight stop fuck oversel shit soooo piss
138,usernam usernam cc usernam
139,idk polaroid mosquito bite usernam weekend portrait usernam heart arrow super babe usernam usernam pictur
140,late parti one cool collabor usernam x usernam great idea use collect contemporari way reach new audienc victori hand emoji modifi fitzpatrick type number hashtag httpaddr
141,usernam usernam usernam usernam dope
142,noth better new pair usernam pictur
143,usernam usernam number number
144,usernam usernam eu tb kk
145,money save uni gonna spent usernam x van gogh collab ya boi rock whole fit stg
146,usernam usernam usernam usernam usernam usernam usernam still rock van convers chuck time total comfort
147,usernam usernam black heart collis symbol heavi black heart pictur
148,inquir usernam india marvel merch avail said octob octob nooooo want nowwwww
149,usernam usernam usernam usernam weeeeeei que bonito
150,usernam usernam numberx plu cher que le shoe
151,wait icon becom rich enough join usernam give kid kick shoe afford back school
152,usernam tri restock van gogh collab naw
153,pleas restock van gogh usernam grimac face grimac face
154,usernam hashtag hashtag httpaddr
155,usernam realli yourself smile face heart shape eye pictur
156,usernam usernam alway welcom usernam hashtag smile face sunglass thumb sign emoji modifi fitzpatrick type number pictur
157,usernam usernam miss shoe drop worst condol brother
158,broo get usernam wear look luck httpaddr
159,usernam usernam usernam yellow line cool
160,congratul hixson high school art student win moneysymbnumb number nationwid usernam van custom cultur competit w entri featur rubi fall icon chattanooga attract way go usernam hashtag hashtag httpaddr
161,usernam heyyy looki arriv custom van thanx bunchi sister laura total awesom birthday present big hug high number usernam hashtag hashtaghashtag hashtag hashtag hashtag hashtag hashtag hashtag hashtag hashtag hashtag pictur
162,wait get custom appa usernam httpaddr usernam sweet design pictur
163,usernam stop collab usernam
164,usernam van gogh collect great love buy pair us wear size larger number smile face open mouth cold sweat
165,usernam wtf long fuck hold time im number min
166,usernam usernam van
167,icymi usernam brand sand week usernam usernam usernam kept fan refresh usernam usernam brought competit closer ever hashtag httpaddr
168,usernam pleas make shoe twenti one pilot usernam new album trench wear day die
169,usernam smile face smile eye face stuck tongu tightli close eye face stuck tongu tightli close eye two heart van pictur
170,usernam pictur
171,usernam hashtag see huntington beach bit surf pictur
172,usernam usernam usernam httpaddr
173,usernam usernam usernam usernam dope af
174,usernam usernam usernam usernam usernam usernam usernam center number number sur close aisl
175,check hashtag think got last slip pair vans_numb usernam pictur
176,vancouv number men world pro tour van park seri usernam usernam pictur
177,usernam usernam usernam usernam lol oop correct sorri switcheroo ing pictur
178,lose focu alway stay woke sparkl black heart hashtag hashtag hashtag usernam rework mepant usernam hashtag shoe usernam watch usernam pictur
179,usernam usernam usernam actual away trafford centr shop littl one grin face smile eye
180,somebodi sign come twin face cowboy hat face cowboy hat usernam usernam usernam usernam usernam usernam httpaddr
181,new usernam collect honor beauti work vincent van gogh httpaddr pictur
182,usernam usernam teni top
183,say forev usernam need app
184,usernam hashtag hashtag hashtag usernam hashtag hashtag hashtag hashtag hashtag usernam httpaddr
185,usernam usernam forev warp usernam sale tampa show person rais hand celebr emoji modifi fitzpatrick type number person rais hand celebr emoji modifi fitzpatrick type number hashtag
186,trabalhamo com data certa usernam usernam ajuda ai vai nunca te pedi nada pictur
187,usernam black white splash dinosaur watcha think fire fire pictur
188,usernam usernam usernam pue el lune es el prime day te digo ma
189,hey someon usernam sponsor spend plenti money yall shoe slide dm sure work agreement smile face smile eye
190,usernam collabor give life
191,brother usernam reppin usernam number anniversari usernam clean hashtag pictur
192,lie last school year work sale associ ann arbor usernam sale associ usernam briarwood mall technic writer usernam work around citi ann arbor great way escap campu familiar citi end
193,usernam usernam usernam big movi know go see trailer purpos trailer get want see movi watch alreadi know e g marvel movi other may watch one time also dnt like preview next episod tv seri
194,usernam usernam usernam someon work movi theatr numer year still love go movi must seat trailer jerk come disrupt start featur tri find seat dark hashtag
195,usernam agre usernam think face
196,usernam need board made usernam httpaddr
197,usernam usernam usernam yesss babe smile face heart shape eye
198,check hashtag bought usernam art usernam super excit pun intend face stuck tongu wink eye httpaddr pictur
199,usernam usernam hahah cicah sambal sikit
200,bother go usernam websit hope get new hashtag stock style size alreadi realli van give frig break
201,usernam usernam mexico pictur
202,usernam give wallet break year pictur
203,usernam usernam usernam usernam usernam usernam help identifi guy usernam usernam
204,usernam usernam life
205,faith usernam time start get compens
206,usernam usernam would green also
207,usernam usernam mayb convinc publish would great cross promot benefit commis variou author wink face
208,usernam usernam usernam watch movi trailer go movi
209,averi start kindergarten style doughnut doughnut doughnut doughnut thank usernam pictur
210,van gogh sunflow skull usernam pictur
211,lsh blog usernam usernam usernam today hashtag hashtag hashtag hashtag hashtag hashtag hashtag pictur
212,usernam know shame compar old one yeah cool
213,yo usernam tryna sponsor caus wear cloth like time alway wear pair everyday even work
214,usernam usernam face stuck tongu wink eye pictur
215,usernam usernam hashtag industri learn usernam usernam parent vf corp via usernam httpaddr
216,thank usernam usernam usernam hundr point symbol hashtag hashtag hashtag pictur
217,hashtag usernam x usernam north face yellowth next usernam x clockwis rightward leftward open circl arrow heavi black heart appreci pictur
218,usernam usernam usernam holli shit curren would best super number number ever
219,usernam usernam boy make progress slowli sure thank usernam make shirt usernam take pictur hashtaghashtaghashtaghashtaghashtag pictur
220,yo usernam fix store sick filter size click shoe stock pointless filter fix ya damn code
221,usernam usernam usernam bruder tu synthwav drunter und samml noch ghilen internetfam
222,usernam usernam usernam usernam usernam usernam usernam usernam usernam usernam usernam usernam usernam usernam usernam usernam eso es todo hashtag de miel
223,twist leather usernam uncommon sale httpaddr pictur
224,usernam usernam usernam usernam make pictur
225,correct way tie usernam x usernam shoe pictur
226,rock new kick today work thank usernam take damn money usernam usernam hashtag pictur
227,hey usernam one shirt sell smell like stinki cat poo pleas fix thank u send tweet
228,mad caus realiz last time bought pair usernam girl never ask van famili account guess said someth find receipt look everywher shrug emoji modifi fitzpatrick type number number zero width joiner femal sign weari face weari face like number point
229,want sunflow van almond blossom van cart wasnt fast enough sold fjcjjd usernam doesnt restock van gogh collect stroke pictur
230,usernam usernam httpaddr
231,usernam usernam final someth afford
232,van let make almond blossom low top slip on usernam u say urself
233,usernam usernam usernam usernam streetwear tbhh usernam cuz hell
234,usernam pictur
235,artist palett athlet shoe une futur coollabor van gogh usernam x usernam httpaddr pictur
236,usernam usernam _mady_j oh one bought shoe sold time got onlin think face
237,usernam usernam usernam inanilmaz olmu dizzi symbol
238,usernam usernam usernam lol
239,usernam vegan sigh httpaddr
240,usernam usernam usernam iri
241,usernam usernam understand custom alway moneysymbmoneysymbmoneysymbmoneysymb
242,usernam reach regard donat request upcom chariti event
243,usernam usernam usernam usernam usernam usernam usernam usernam usernam usernam usernam usernam usernam usernam usernam usernam smile face heart shape eye toni hermosa
244,take moment appreci amaz photo took van x vans_numb pictur
245,usernam usernam ayy fuck em g face tear joy flex bicep emoji modifi fitzpatrick type number
246,usernam usernam go number one tho hashtag pictur
247,cleaaaan hell shout _shynz usernam pictur
248,usernam usernam usernam usernam usernam usernam usernam usernam usernam usernam usernam usernam usernam usernam usernam usernam usernam usernam usernam usernam usernam usernam usernam usernam sweet usernam pictur martinezzzz houseee number
249,rt usernam classic usernam promot usernam pictur
250,usernam usernam usernam wow nick beauti
251,excit get van x van gogh hat get email got cancel tire face usernam
252,usernam usernam wear today went deadpool today possibl best deadpool shirt ever made like cap n shoe
253,usernam usernam usernam big
254,usernam hi abl buy van gogh sneaker start midnight august number anoth set time worri sell limit launch
255,usernam usernam usernam usernam usernam usernam usernam usernam usernam slightli smile face
256,usernam usernam usernam problem movi suck day trailer show best part get peopl show
257,usernam usernam usernam isa ngang bagsak dyan
258,el hashtag corr cargo de usernam ideal para est hashtag de usernam usernam usernam hashtag en mini realismo httpaddr whatsapp para info de cita cotizacion mobil phone rightward arrow left number pasal cotorrear face stuck tongu wink eye pictur
259,usernam pleas usernam collab next
260,hello ye usernam like usernam collab ok thank great
261,crush better see evil monkey blue heart usernam usernam pictur
262,_opsbeaw usernam usernam alo usernam patrocina noissss
263,usernam usernam man realli hope would size still real mvp
264,p incas clear talk misalign text sole u see letter r divid number part r align properli vans_numb usernam hope earli posit respons ur side
265,usernam usernam amaz saw eastrand mall big usernam amaz
266,usernam usernam usernam wow black heart suit
267,usernam usernam yo dm creativ team ass bring back
268,congratul usernam get w today hashtag podium hashtag proud put work hashtag hashtag usernam usernam usernam usernam usernam usernam usernam hashtag hashtag pictur
269,usernam ever restock old skool v line pleas
270,usernam usernam allow use gift card websit sinc close read uk store closest portsmouth weari face want anoth pair van
271,usernam women sock entir moneysymbnumb versu men encourag women part skater commun pay product
272,tsh usernam x usernam hashtag hashtag hashtag hashtag hashtag hashtag hashtag pictur
273,usernam usernam usernam beauti grin face face ok gestur emoji modifi fitzpatrick type number number zero width joiner femal sign footprint
274,usernam pleas help find anywher onlin pictur
275,also cool usernam usernam give away tonight right set pictur
276,usernam usernam usernam lovee sleep excit see na byahe nakami mamaya papuntang roxa team sleep excit iloveyouuu see laterrrr loudli cri face smile face heart shape eye two heart usernam
277,idea usernam cozi
278,usernam usernam usernam usernam usernam idea much awesom look
279,fun london sun black sun ray sun face sunni instylecosmotop usernam short usernam shoe usernam pictur
280,usernam usernam usernam usernam usernam usernam usernam usernam usernam usernam usernam usernam usernam usernam usernam usernam usernam usernam usernam usernam usernam usernam usernam usernam usernam usernam usernam usernam usernam usernam usernam usernam usernam chang world best number year love appreci tic tac pictur
281,usernam usernam usernam loudli cri face loudli cri face
282,despis usernam shoe compani like loser mini van usernam crap pile poo car recreat vehicl rat mean democrat
283,usernam usernam usernam thank god believ miss
284,stop usernam black skateboard trainer ff bad usernam
285,fuck ye usernam usernam usernam et al usernam repres true great present person fold hand emoji modifi fitzpatrick type number hashtag httpaddr
286,usernam _junebuug littl thing
287,usernam usernam thank youuu
288,usernam usernam usernam sure thing
289,usernam van gogh shoe sold immedi limit run collect chanc first batch hashtag hashtag
290,usernam _papayaya rip van gogh disappoint face
291,usernam usernam usernam like see futur divin power wrought peril shake christma present either
292,usernam usernam smh
293,usernam usernam usernam look type shoe wear id say usernam sponsor lol wont point one set con haha
294,usernam usernam lo al surf
295,usernam usernam usernam smile face heart shape eye smile face heart shape eye
296,usernam two heart two heart pictur
297,usernam usernam usernam lucki
298,go restock van gogh collect usernam
299,athlet shoe harri estaba utilizando usernam ua old skool con un valor de number dolar en la historia de instagram de nick grimshaw pueden comprarla aqui httpaddr inbox tray usernam jh heavi heart exclam mark ornament pictur
300,tengo la camiseta de hashtag pero esto zapato usernam tienen la edad de usernam lo color el aguant la resistencia de hashtag hoy voy por ello pictur
301,usernam usernam usernam jarg usernam
302,usernam usernam patrocina blue heart smile face open mouth person fold hand
303,usernam take vincent van gogh hashtag wall onto sneaker httpaddr usernam pictur
304,usernam usernam usernam usernam yo everyon ask usernam dirti joke haha
305,need usernam kinder bank account upcom van gogh collabor look money save take gre like pictur
306,usernam usernam custom size let start mobbin
307,usernam love pero lo que le hecho van gogh te lo perdono en la vida dare neutral face
308,usernam usernam usernam usernam think your underestim brillianc
309,usernam patrocina com colecao van gogh sou maior fa dele mundo obrigada
310,alguem mude presenteia com um teni da usernam pra eu fazer stori
311,love u usernam
312,vincent van gogh usernam sold damn fast
313,usernam usernam usernam usernam usernam usernam usernam _bigbennumb usernam omg make custom one peopl
314,usernam usernam usernam zero drip musti dri
315,usernam anumb home friend face share network folk get mayb enjoy small treat dinner nicer bottl wine pair custom usernam true stori work face possibl great chanc go person share prais hashtag
316,usernam usernam usernam counter low ground
317,usernam ya week receipt need call thank get back quick x green heart
318,usernam three week own ultrarang rapidweld strip alreadi come hashtag hashtag pictur
319,usernam mani rt like need get one sneaker new van x van gogh collect
320,sneaker thing right usernam usernam usernam usernam usernam usernam usernam usernam hashtag hashtag usernam pictur
321,usernam burrito two heart pictur
322,usernam usernam pictur
323,usernam patrocina aqui usernam
324,la tengo la number ni fan de van amo usernam httpaddr
325,usernam fire pictur
326,usernam usernam usernam usernam usernam el japon creo q su poco peso fue una ventaja en esta ola fue el unico q conseguia enlazar la penultima seccion con la orillera q se volvia levantar bastant hueca
327,usernam usernam usernam could also whole meme pack think face pictur
328,usernam usernam pictur
329,usernam usernam usernam like go complet blind help stand wait watch trailer hashtag hashtag
