,tweet
5345,usernam usernam usernam one fire custom black glitter toe box heel tab snappin neck everywher la vega sun black sun ray athlet shoe astonish face pictur
5346,usernam want usernam sponsor
5347,usernam hi email guy never got repli sleepi face
5348,usernam start rise fame smile face heart shape eye
5349,usernam usernam usernam usernam usernam usernam usernam usernam love much everi way black heart
5350,usernam vans_numb unveil usernam collect inspir artist icon paint httpaddr pictur
5351,usernam usernam usernam tambien uso stilett grin face smile eye
5352,usernam usernam usernam canon number
5353,mano olha essa nova colecao da usernam inspirada van gogh puta merdaaa que lindo number number pictur
5354,vans_numb vault reinterpret checkerboard pattern latest collect og classic httpaddr
5355,c mon usernam know wait starri night one bring starri night one httpaddr
5356,usernam interestinggg
5357,usernam fusiono lo mejor del art en su nueva coleccion inspirada en la obra del artista hashtag man zero width joiner artist palett echal un ojo dino que te parec downward black arrow httpaddr pictur
5358,usernam usernam usernam esto es vanstastico
5359,someon could buy bunch usernam forev grate stinkin obsess unreal
5360,spend money usernam hashtag pictur
5361,usernam usernam usernam usernam struggl real
5362,usernam usernam usernam aaaaaaah je le veux aussiiiiii
5363,usernam usernam usernam know
5364,usernam usernam respeita isso e suor meu trabalho digni
5365,usernam sick cop sure pictur
5366,usernam usernam usernam usernam one underr band search former clariti new wave two favorit album
5367,spent time pick usernam want new marvel collabor choos nomine suprem court honestli end aveng one capt marvel high top took bit realli research decid httpaddr
5368,vs guy tell worri usernam pictur
5369,usernam usernam heavi black heart two heart
5370,usernam httpaddr
5371,usernam patrocina noixxxx athlet shoe revolv heart httpaddr
5372,yo usernam better get stock van gogh sneaker abl get pair
5373,usernam weari face weari face weari face
5374,usernam usernam usernam avan gard
5375,usernam order paid twice differ shoe time cancel refund wast time want custom go elsewher
5376,usernam usernam bisa nyala gak kadel yaampuun keren banget imanku goyah loudli cri face loudli cri face
5377,usernam shitti servic usernam advis everyon buy brand bullshit servic
5378,love howev involv photograph content creation limit edit collab usernam usernam hashtag hashtag httpaddr
5379,want van gogh usernam sold
5380,usernam usernam usernam invoic black high
5381,usernam way guy got page beeper say might consid make anoth pair captain marvel van littl ol way number men thank thought forgotten much love trent gresham
5382,usernam shanyia free fuck van
5383,usernam model guy yet smile face heart shape eye smile face heart shape eye smile face heart shape eye smile face heart shape eye smile face heart shape eye smile face heart shape eye httpaddr
5384,usernam usernam usernam blind far way go
5385,usernam fire pictur
5386,usernam usernam usernam usernam
5387,usernam usernam se unen para lanzar una coleccion exclusiva inspirada en la obra del pintor smile face heart shape eye clap hand sign pictur
5388,usernam usernam hey man follow instagram love pictur la keep good work rais fist emoji modifi fitzpatrick type number number
5389,voila unwrap usernam x usernam pictur
5390,vele usernam x redbat usernam rocket rocket rocket rocket usernam x usernam yellow heart sunflow
5391,usernam usernam usernam alway avoid trailer spoil whole damn flick
5392,usernam usernam usernam usernam usernam whoa thank share total awesom
5393,usernam still kinda bother name van gogh pictur
5394,usernam guy gonna restock vincent van gogh collect
5395,hashtag usernam le rind homenaj al pintor holand hashtag con su nueva coleccion desd teni hasta una bomber jacket httpaddr pictur
5396,hashtag ya abrio su puerta en hashtag hashtag hashtag super hashtag la mejor ropa de hashtag en un solo hashtag smile face sunglass dancer heavi black heart person cartwheel zero width joiner femal sign alguna marca que encontrara usernam usernam usernam usernam usernam tambien pode visitarlo en hashtag hashtag pictur
5397,vanz way usernam pictur
5398,usernam usernam usernam esta bien padr sting
5399,usernam usernam usernam um dia gent chega la
5400,good look x usernam usernam pictur
5401,usernam usernam good peopl make happen hashtag httpaddr
5402,liter scream usernam x van gogh collab aaaaaaaaaaaaaaaa
5403,hi twitter drop show yall new shoe nerd face usernam super dope custom slip extraterrestri alien rais hand part middl ring finger emoji modifi fitzpatrick type number number pictur
5404,usernam lame fuck drop shoe collect numberam
5405,usernam usernam usernam hashtag zayn
5406,usernam usernam numberphiko usernam usernam usernam usernam usernam yoh attend year disappoint face
5407,usernam usernam usernam usernam usernam usernam yep person rais hand celebr person rais hand celebr grin face smile eye grin face smile face smile eye
5408,usernam usernam best
5409,usernam van gogh collect ever avail itali
5410,usernam usernam good luck think would great job
5411,usernam usernam
5412,usernam usernam usernam hahahahaha yesssss hilari
5413,usernam pictur
5414,usernam usernam usernam ech bromi yo quiero amor two heart
5415,new usernam call hand emoji modifi fitzpatrick type number number
5416,usernam usernam usernam ufff ando enamorado smile face heart shape eye smile face heart shape eye smile face heart shape eye
5417,usernam usernam usernam usernam much charg
5418,usernam usernam van gogh slip skull paint cri face cri face
5419,butterfli feel get everytim mailman drop box usernam pictur
5420,usernam soooo good readi skateboard
5421,usernam usernam pictur
5422,usernam usernam usernam usernam usernam usernam mind pair number
5423,usernam usernam xoxoxoxo
5424,usernam usernam usernam choos one leav one
5425,usernam collabor van gogh museum drop promis call van gogh
5426,order usernam go usernam smile face heart shape eye smile face heart shape eye spoil birthday hug face
5427,usernam usernam usernam hi top
5428,usernam usernam much
5429,never excit shoe usernam usernam collabor wait launch
5430,simpl monochrom style featur japanes craft easi shirt contemporari polo shirt usernam pictur
5431,usernam usernam usernam one favorit thing go movi upcom movi trailer beforehand love get pump time disappoint movi start
5432,usernam usernam fuck aldo sont affreux
5433,surf usernam pictur
5434,usernam make adult size fuck coward pictur
5435,usernam usernam usernam need dp van
5436,usernam usernam usernam usernam usernam usernam usernam usernam usernam usernam _beth_ward usernam usernam usernam summer festiv weekend jimmi cliff candi statton sister sledg later pictur
5437,usernam moneysymbnumb sale moneysymbnumberm regist say moneysymbnumb smile face sunglass oh ya babi
5438,usernam usernam arriv mexico
5439,current usernam summer tour stop usernam hq sign peppa pig pictur
5440,usernam httpaddr stick team usernam one dizzi symbol pictur
5441,usernam usernam one wear today
5442,usernam usernam usernam usernam usernam usernam reach help hook hardwork kid hashtag
5443,van amaz sweeti usernam httpaddr
5444,usernam usernam usernam weed make think think face
5445,usernam usernam pikiii expressionless face
5446,terrel owen celebr hof induct send class number inducte custom usernam httpaddr
5447,usernam van gogh collect alreadi sold
5448,usernam hello irish van websit httpaddr problem search everyth wont let add basket
5449,usernam usernam rememb th talkin lol
5450,hola usernam quiero una zapa de basquiat gracia tkm muchisimo
5451,dear usernam pleas rereleas shoe number pictur
5452,usernam usernam usernam love almond tree
5453,usernam usernam usernam gay
5454,usernam usernam mort ao capitalismo pictur
5455,usernam usernam usernam make sure get movi way earlier showtim watch trailer gaug whether want see base like plu crowd reaction suck back row
5456,usernam pictur
5457,want slide school usernam httpaddr hashtag hashtag pictur
5458,usernam usernam go number minut custom servic need help
5459,usernam usernam usernam lucki enough grab pair gogh collect worri bc sold order seem go nowher
5460,usernam may concern pleas stop make possibl creat van pocketbook thank hug face httpaddr
5461,theyr bring back usernam usernam weari face weari face weari face weari face grow heart grow heart grow heart grow heart grow heart hashtag pictur
5462,hashtag taken airplan departur number million daili user last count hashtag becom way peopl choos share learn carousel ad usernam stori help usernam share power brand messag white right point backhand index httpaddr
5463,usernam van x van gogh collab go onlin thing van store also carri item
5464,latest style usernam arriv httpaddr pictur
5465,usernam usernam usernam usernam wait send van number edit call stood midnight breez
5466,much love usernam fact van gough collect sold less day crap ive tri find pair shoe collect sinc releas date cant find anywher none retail locat wholesal angri face pictur
5467,usernam usernam need new model
5468,usernam usernam usernam usernam usernam numberlg usernam usernam usernam usernam usernam thank
5469,usernam usernam white smile face x emoji modifi fitzpatrick type number number multipl music note pictur
5470,usernam alway makin sure fresh death hashtag hashtag hashtagdayz hashtag hashtag pictur
5471,favorit sneaker wear usernam sing number number
5472,usernam usernam
5473,usernam usernam usernam usernam decid move alberta royal tyrrel museum drumhel alway room couch crash grin face smile eye best mj
5474,usernam httpaddr
5475,work last ever usernam rip usernam pretti sad rn pictur
5476,usernam usernam still get box glass mount case need emerg shoe narcissist gym trophi
5477,usernam usernam usernam guess gotta sign kookbook
5478,hashtag van way vans_numb pictur
5479,usernam usernam usernam go blind number time movi number number like best part trailer make bad movi toler total wast bean
5480,usernam usernam holi shit look good
5481,know much extrem sport love see brand like usernam usernam know build loyalti hashtag
5482,usernam usernam usernam usernam ador smile face heart shape eye
5483,research usernam found great usernam timelin hashtag collabor hashtag compani usernam usernam usernam usernam wow hashtag hashtag hashtag hashtag hashtag hashtag hashtag httpaddr
5484,usernam usernam ye went right open said smart bc sold onlin
5485,usernam evlen benl pictur
5486,usernam usernam
5487,usernam usernam usernam love preview although admit lot ruin movi watch separ entiti especi see music pair scene reveal trailer done right work art
5488,usernam usernam ye girl wait face throw kiss smile face heart shape eye smile face heart shape eye smile face heart shape eye smile face heart shape eye
5489,usernam expect van x van gogh ship order still say process
5490,usernam might come contract get pleas upset lol httpaddr
5491,usernam fat tongu discontinu ever find low top canva style
5492,amo mucho la colaboracion de usernam usernam pero van hacer odiarla mucho por la masividad por que son asi
5493,usernam usernam usernam amaz gift surf peopl hashtag inspir hashtag hashtag check collect wear beach httpaddr pictur
5494,van model photo lmaoo hashtag usernam pictur
5495,usernam thumb sign emoji modifi fitzpatrick type number number
5496,usernam usernam price
5497,usernam usernam hashtag hashtag hashtag hashtag via usernam hashtag hashtag hashtag usernam usernam hashtag hashtag httpaddr
5498,usernam joke hope van authent sale black one mine sinc christma number want chang bc realli color use wait van stupid
5499,super annoy usernam van x van gogh collab day search last three hour find pair size abl go shop week find
5500,usernam usernam life tho
5501,usernam usernam fresh ass foo two heart
5502,usernam usernam pleas chang name
5503,pleas bless shoe tire face tire face pleaseeeeeeeee usernam usernam pictur
5504,usernam ammina kodumun cocuklari yapacaniz ayakkabiya sokayim iki gun giydim serc parmagim su topladi
5505,numbergag usernam
5506,usernam usernam usernam usernam number damn bro manag number
5507,usernam usernam visit amsterdam van gogh museum last month go need skull sure
5508,usernam usernam pleas
5509,usernam make spider man boy jacket men bought shit could bare fit dog make exclus product kid guy know everybodi like superhero
5510,usernam els buy shoe stock everywher pictur
5511,usernam usernam usernam usernam wild mate lovin ride
5512,usernam usernam usernam trailer naw feel ya brief recap top bad bing show n ladi differ show come handi penguin compromis
5513,usernam usernam usernam usernam usernam usernam usernam usernam usernam numberbeersandam usernam usernam usernam usernam usernam usernam usernam usernam usernam usernam pictur
5514,favorit httpaddr hashtag usernam pictur
5515,usernam usernam great shot
5516,usernam tri take whole paycheck tbh httpaddr
5517,usernam adventur time pictur
5518,time break new kick thank usernam usernam hashtag hashtag hashtag hashtag hashtag hashtag pictur
5519,usernam usernam usernam guy look tire hope okay enough sleep
5520,new usernam x van gogh museum line brand sleep pictur
5521,hbwti arab letter alef ljdydh usernam
5522,usernam patrocina nunca te pedi nada
5523,usernam made order saturday chose number number day deliveri dispatch email yet need item friday birthday present
5524,um wtf bought usernam suppos send code moneysymbnumb next order never
5525,usernam jerezim usernam usernam numberu usernam numberatu vans_numb usernam usernam httpaddr hashtag hashtag hashtag
5526,usernam usernam chocada que nao custou acima de number number reai pictur
5527,watch statu van gogh usernam order pictur
5528,ganhei uma camisa da van e comprei outra purpl heart e acho q vou comprar um teni tmb usernam purpl heart purpl heart
5529,usernam usernam bought friday audiobook shoe
5530,usernam usernam usernam let make happen
5531,usernam usernam usernam usernam xksmkakskskakalallslzkzkxjxjsjkzk modelo ofici vitalicio
5532,usernam never go wrong usernam old skool hashtag pictur
5533,usernam usernam never nail done long omg want nail smile face heart shape eye
5534,usernam usernam vend na censura number na galeria veplan
5535,usernam usernam collabor come
5536,splurg day usernam pictur
5537,usernam dave alreadi anxiou buy new usernam phoenix edit smile face open mouth smile eye smile face open mouth smile eye pictur
5538,usernam usernam usernam go blind riski play like roll dice hashtag
5539,usernam honestli go take get offic usernam twitter account weigh
5540,usernam usernam usernam gotta make green gold east bay usernam
5541,honest god knock fuck usernam realli snap need sm pictur
5542,usernam demand refund pictur
5543,usernam usernam ay ay ay tienen talla de nino face tear joy
5544,usernam usernam usernam watch trailer
5545,miss weekend hashtag check recap info activ event happen usernam see ya sand usernam usernam usernam usernam httpaddr
5546,gastei meu vansinho lindo preto ate ultimo suspiro usernam manda um pretinho old school novo eu faco propaganda demai de vc meu amigo sabem bem
5547,usernam hermano aztlan en una sudadera de usernam
5548,usernam usernam pictur
5549,usernam guy ever go bring back duck green port royal gum authent buy either chanc deepli regret
5550,usernam usernam van beennnn wave live without em
5551,usernam alway favorit lift shoe
5552,usernam usernam usernam usernam usernam usernam usernam usernam usernam nice
5553,went check van gogh collect usernam fall love slip ask size girl goe might girl drop like forreal bring size number pastel pink old skool
5554,usernam usernam usernam ye
5555,year wear usernam much consider decid usernam shoe clap hand sign emoji modifi fitzpatrick type number feet hurt today sneez face sneez face
5556,hello im super broke realli wanna buy smth ur collab van gogh usernam
5557,usernam usernam usernam alway trailer inform decis best decis
5558,hashtaghoursleft would get sneaker bunch cool pair van usernam usernam httpaddr
5559,bruh u gotta ask vinni okay usernam httpaddr
5560,usernam order number pair van number size grimac face grimac face
5561,could program person pair shoe would usernam pictur
5562,usernam usernam everyth seem stock x pout face x disappoint face disappoint face
5563,charlott play number numberpm journey left foot stage sign usernam tent numberpm pick wristband sign van tent photo usernam pictur
5564,usernam usernam usernam usernam usernam usernam usernam usernam usernam usernam usernam usernam usernam usernam usernam usernam usernam usernam usernam usernam usernam usernam
5565,usernam usernam usernam usernam custom van think face think face think face
5566,empieza el otono pisando fuert la hashtag estan de regreso athlet shoe httpaddr vans_numb hashtag hashtag hashtag hashtag hashtag hashtag hashtag hashtag pictur
5567,usernam usernam usernam someon explain van stock everywher uk back stock go month
5568,usernam usernam de ti lo dudo face tear joy face tear joy
5569,ya orden mi van gogh van estoy bien bien bien bien feliz estan precioso gracia beat heart usernam
5570,quero usernam httpaddr
5571,happi wait till midnight get van x van gogh shoe drool face drool face wait arriv usernam pictur
5572,usernam usernam usernam usernam usernam usernam beauti fire
5573,usernam thought enjoy number year old wallet still go strong ish pictur
5574,realli want everi color usernam
5575,mom rememb order usernam pictur
5576,usernam usernam usernam usernam dude work booth eaux clair insult cloth wear cri cat face
5577,usernam usernam usernam usernam usernam usernam usernam _bigbennumb usernam order pair polamalu
5578,usernam usernam usernam usernam go crazzyyyy fire fire smile face heart shape eye ok hand sign emoji modifi fitzpatrick type number
5579,usernam restock van gogh line stock realli unhappi sold even get home order disappoint cri face
5580,usernam usernam woahhhhh smile face heart shape eye smile face heart shape eye
5581,usernam usernam criss
5582,hear usernam x pokemon collab
5583,usernam usernam lame
5584,appreci usernam repli email seriou loudli cri face speak head silhouett
5585,pensamento dia queria ter todo os teni da usernam pra sair todo dia com um par diferent cara ele combinam com tudo afff
5586,usernam usernam usernam see trailer movi number number dollar invest day take chanc chick flick wors movi sub titl
5587,usernam usernam dm ok hand sign
5588,usernam usernam guess who gonna first one buy
5589,usernam belong ad pictur
5590,love usernam boot want year namanj still afford knew readi usernam usernam treat lapho ngama usernam face tear joy face tear joy
5591,hey usernam slip on year flex toe today shit happen fuck pictur
5592,usernam usernam suprem face tear joy
5593,usernam u guy van gogh stuff
5594,usernam usernam wind river netflix sicario theater dinoc theater shootist prime thank usernam wind river holi fuck go buy blu ray
5595,usernam usernam hell yay
5596,usernam make whole hashtag line im current die omg vincent time favourit artist inspir im complet awe face without mouth hashtag hashtag
5597,usernam usernam usernam httpaddr
5598,usernam bought pair van ask make acc van famili still earn point van bought
5599,usernam usernam usernam collect goe live tomorrow
5600,heard rumor usernam hand design know regardless usernam put togeth badass pack black slip favorit pictur
5601,hey usernam news hashtag shoe bigger size feel like wanna big way least hashtag hashtag lol
5602,van se une com van gogh museum amsterdam em uma colaboracao especi httpaddr hashtag usernam hashtag usernam hashtag pictur
5603,seen usernam store came back buy sold sold onlin honestli disappoint wander around store look checker shoe could diy rainbow home
5604,also usernam partli due social media hashtag nowaday global rockstar one world famou artist strong recogniz hashtag usernam usernam hashtag usernam httpaddr
5605,need new van gogh usernam asap
5606,usernam usernam restock point pictur
5607,usernam usernam usernam ya casi sale black heart suit
5608,usernam usernam last one bottom right cool idea
5609,usernam usernam would kill pair hightop adult spidey shoe hashtag
5610,usernam right usernam guy plain mean make hard find loudli cri face loudli cri face
5611,usernam usernam usernam usernam stoke bud usernam back usernam usernam today talkin hashtag usernam usernam hashtag music faction thx usernam hashtag usernam usernam usernam numberp numberetun httpaddr pictur
5612,go millionair still wear usernam
5613,usernam usernam ahhhhhhhhhhh pictur
5614,usernam usernam usernam usernam usernam usernam usernam comfi
5615,usernam usernam usernam
5616,usernam usernam usernam beauti
5617,usernam usernam right drool face
5618,usernam skinni pant van usernam
5619,usernam new usernam hashtag httpaddr
5620,usernam usernam usernam usernam love color littl better sinc yellow pop
5621,usernam usernam usernam usernam usernam usernam usernam usernam usernam usernam quan bu oyuan ishimasu
5622,wearingjump usernam usernam usernam usernam
5623,usernam black heart suit free pair van student need white point backhand index emoji modifi fitzpatrick type number number hashtag hashtag hashtag hashtaghashtag hashtag athlet shoe hashtag pictur
5624,usernam usernam van beauti thing face scream fear smile face heart shape eye loudli cri face
5625,usernam usernam usernam usernam usernam usernam nice fun hashtag hashtag aaron
5626,usernam usernam _leeeno_ face tear joy
5627,usernam usernam usernam usernam smack
5628,usernam usernam thumb sign nice
5629,neeeeeeed life usernam hurri pleas restock hashtag pictur
5630,wanna design usernam usernam pictur
5631,usernam usernam httpaddr
5632,usernam usernam welcom shoe game
5633,usernam wesh c est de usernam loudli cri face loudli cri face
5634,usernam usernam usernam usernam usernam unrel gear fantast endors great drummer keep good work
5635,usernam usernam pictur
5636,usernam usernam usernam usernam got email van reneg place order
5637,florida impact teammat usernam usernam hashtag reppin usernam us open surf contest hashtag usernam pictur
5638,usernam usernam usernam usernam eh el khara da smile face open mouth cold sweat
5639,look like croatian team sponsor usernam
5640,buy pair yellow van celebr favorit color usernam releas shoe cover van gogh sunflow favorit paintinglik fuck van hurt like
5641,usernam usernam pictur
5642,usernam usernam usernam good look g fire fire black heart suit
5643,usernam need bikini
5644,usernam usernam usernam usernam thank sir paul awesom
5645,good time usernam camera flash jonathan weiner pictur
5646,usernam usernam usernam usernam usernam
5647,hashtag hashtag usernam black heart suit smile face heart shape eye fire pictur
5648,usernam futur pictur
5649,classic usernam checker slip avail usernam hashtag hashtag hashtag hashtag hashtag pictur
5650,lace custom hashtag usernam kick perfect hashtag pictur
5651,numbermi hike usernam today grossest blister feet need invest hike boot
5652,usernam usernam usernam hashtag pictur
5653,usernam usernam thank smile face smile eye smile face smile eye
5654,usernam usernam usernam usernam usernam oh love color sure someth closet would match shoe
5655,su siralar bir sezonun baslamasini bir de usernam nin usernam serisinin turkiy ye gelmesini bekliyorum fist hand sign emoji modifi fitzpatrick type number
5656,eu te odeio usernam usernam
5657,usernam usernam pleas bring back whole collect amaz need sunflow one bad
5658,restockin rata vulc usernam usernam
5659,wrong van kind work usernam brunch shoe peopl skateboard kid want retro athleisur cool win usernam moneysymbvfc httpaddr pictur
5660,vans_numb usernam bring fire hashtag hashtag httpaddr
5661,mani hashtag celebr hashtag hashtag wonder mani wear usernam know back stori hashtag creat hashtag know hashtag new qualif usernam hashtag hashtag
5662,usernam usernam usernam usernam awww ok appreci tri
5663,usernam usernam sponsor httpaddr
5664,usernam usernam usernam minimalist
5665,usernam usernam usernam usernam usernam usernam usernam hulk smash brotha hulk smash pictur
5666,usernam anoth disney collect octob next year pleasee
5667,usernam makin seriou money almost everybodi pair first day back school face tear joy face tear joy
5668,usernam usernam usernam amaz need get
5669,usernam usernam usernam like trailer movi come attract favorit show movi reason man let get need time alway catch watch show dint need extra wast time love van bro
5670,usernam hizo madrugar para que retrasaran el vuelo una hora media face roll eye pero ya compr mi usernam van gogh dio da dio quita
5671,usernam usernam como se vuelan jajaja
5672,smfh mani van idk usernam hasnt given least one free pair never buy anoth one
5673,usernam collect grow look order number pair apparel smile face heart shape eye addict
5674,usernam usernam usernam man willi back van yeah
5675,usernam consid sponsorship musician mexico
5676,usernam usernam awesom show guy thank hashtag today made us listen feel like
5677,usernam usernam usernam usernam hoseok order taehyung bts_twt
5678,usernam usernam usernam usernam te puedo pagar con una patata justiciagob
5679,love usernam usernam
5680,usernam want number want fuck shirt word cannot express incred mad fuck pictur
5681,look van past number min obsess usernam
5682,usernam usernam usernam isso msm
5683,usernam usernam usernam usernam usernam pictur
5684,usernam still would much like get captain marvel shoe bad sold everywher news date restock
5685,usernam usernam downnnn
5686,la marca usernam no vestira de art en union con el museo de van gogh inspirado en cuatro famosa obra del pintor holand vincent van gogh calavera girasol almendro en flor el autorretrato del artista en zapato sombrero hasta camisa sudadera quien dijo yo pictur
5687,usernam usernam usernam usernam jam look realli clean
5688,usernam accident got bleach van got alot compliment total make like pictur
5689,usernam usernam usernam love philli museum wear show sock van slip check us websit page thank
