,tweet
1668,usernam usernam usernam smile face heart shape eye smile face heart shape eye smile face heart shape eye smile face heart shape eye smile face heart shape eye
1669,like chanc crapper usernam
1670,usernam pleas help find websit broken heart pictur
1671,usernam usernam smile face heart shape eye smile face heart shape eye smile face heart shape eye smile face heart shape eye smile face heart shape eye
1672,got van gogh usernam today sunflow sunflow sunflow sunflow sunflow sunflow sunflow sunflow sunflow sunflow sunflow sunflow sunflow sunflow sunflow sunflow sunflow sunflow sunflow sunflow sunflow sunflow sunflow sunflow pictur
1673,sure call van gogh collect shrug zero width joiner femal sign usernam httpaddr
1674,usernam usernam pleas restock soon everyth sold woke number numberam realiz releas time numberam sheesh
1675,usernam usernam thank
1676,usernam usernam usernam sua teoria esta certissima como ganhar seguidor rapido e facil
1677,usernam usernam face tear joy face tear joy face tear joy face tear joy face tear joy uyinja maaarn mgodoyi
1678,fresh af usernam pictur
1679,usernam order process sinc last thursday site say number day ship number day process face palm emoji modifi fitzpatrick type number number zero width joiner male sign
1680,stock loudli cri face size least usernam vulc sf shop van httpaddr
1681,usernam usernam usernam usernam usernam usernam cool let plan properli whatsapp
1682,visit van us open next week rememb naugl beach short walk boardwalk hashtag hashtag hashtag hashtag hashtag usernam pictur
1683,got number pair usernam want pair sinc high school gee year back face open mouth face roll eye grimac face heavi black heart x yellow heart green heart blue heart soooo much smile face smile eye pictur
1684,twin kid everi chanc get heavi black heart usernam pictur
1685,usernam usernam usernam think ad pair dr pepper van combin number favorit thing would total asset van collect
1686,usernam usernam even skate
1687,legitim rock usernam pj parti eye eye pictur
1688,usernam usernam lol fire market team
1689,usernam usernam usernam usernam usernam amaz anyon want pic rang know come
1690,usernam mimo pl httpaddr
1691,usernam hey van gogh sunflow shoe ever come back stock pictur
1692,usernam usernam usernam usernam cool guitar
1693,usernam van gogh line avail buy uk site
1694,usernam usernam usernam usernam everth seem sold expect new arriv
1695,excit usernam x usernam shoe pictur
1696,usernam usernam usernam face tear joy
1697,usernam final got back zip sknumber hi cobbler moneysymbnumb fix faulti zipper hashtag hashtag
1698,usernam pleas pleas pleas tell go get back stock loudli cri face loudli cri face loudli cri face loudli cri face loudli cri face loudli cri face pictur
1699,usernam cart empti number time websit move numberk like crawl final got pair van x authent hashtag glad got confirm site went hard pictur
1700,want collab van must go usernam
1701,want pair usernam
1702,much hype usernam vincent van gogh collect httpaddr
1703,today proposit histori beg bug vote us thru next stage usernam x usernam musician want httpaddr
1704,usernam usernam mandem mimo
1705,watch movi trailer like go complet blind week burn question hashtag usernam repli answer one winner get fresh pair custom dp show usernam pictur
1706,usernam usernam usernam usernam ayee catch barricad alreadi ya
1707,usernam releas van gogh shoe collect call vincent van gogh market team suck
1708,usernam need stop teas releas van gogh drop wait
1709,love van continu loyal custom thank usernam pictur
1710,usernam usernam usernam usernam usernam nice
1711,wanna advertis usernam pictur
1712,usernam pl restock vincent van gogh collect urgent
1713,usernam usernam god wish could get van custom
1714,usernam usernam usernam usernam usernam pleas organis jhb loudli cri face loudli cri face loudli cri face person fold hand person fold hand
1715,usernam usernam treat yo self
1716,love hashtag label remind made usa usernam usernam back day proud wear httpaddr
1717,collab usernam usernam sparkl pictur
1718,usernam usernam usernam nice done
1719,usernam usernam usernam usernam usernam usernam usernam usernam usernam usernam huoro katakana hiragana prolong sound mark tortshimashita quan teyu shiidesu
1720,usernam epoch sport brand newest old sneaker gq httpaddr
1721,start think obsess usernam usernam shoe hey could blame
1722,usernam usernam skrr skrr face tear joy
1723,usernam usernam usernam wat een gelul
1724,face black heart suit usernam fire pictur
1725,usernam usernam smile face heart shape eye pictur
1726,tri spend much money materi thing imma tell right usernam stop drop flame kick gonna irrespons hell money money wing money wing money wing
1727,usernam usernam snap custom usernam terrel owen made honor hashtag lb usernam pictur
1728,highlight day number hashtag pre usernam usernam music note pleaser usernam pictur
1729,usernam want size like women big feet keep stock face roll eye
1730,usernam usernam usernam usernam awesom hous ever
1731,usernam usernam would like take moneysymbmsr payment option happili work set
1732,pisei coco usernam desculpa por favor
1733,usernam usernam hashtag hashtag pictur
1734,usernam usernam sell size
1735,order bad boy friday number day ship hope ship soon wear see usernam saturday person fold hand emoji modifi fitzpatrick type number number first pair usernam probabl number year excit wear hashtag pictur
1736,usernam usernam usernam tri
1737,usernam usernam
1738,hey usernam shoe last year
1739,wear usernam often hire model spokesperson purpl heart green heart blue heart heavi black heart
1740,httpaddr guess stick pair waterproof usernam forese futur eh oof grimac face hashtag hashtag
1741,numberdeg usernam shoe like perfect pictur
1742,usernam usernam usernam serious cool
1743,numberday dnumberp usernam hat head white heavi check mark usernam tank top bodi white heavi check mark usernam cargo short cover dick white heavi check mark usernam x sknumber hi feet white heavi check mark usernam mall grab white heavi check mark usernam cousin hand said take hit want told think white heavi check mark
1744,usernam sponsor pleas want free gear
1745,usernam usernam harass van hope happi pictur
1746,hey usernam curiou long doesit normal take respond support ticket submit one never got email say reciev
1747,mock usernam promo made morn hashtag pictur
1748,usernam collect usernam sold sadddddddd
1749,pretti dang surreal see usernam roll campaign shot sri lanka new ultrarang shoe httpaddr pictur
1750,also fuck usernam ship around world fuck upset buy anyth put pictur
1751,usernam usernam httpaddr
1752,custom wed usernam inbound emo wed countdown alert
1753,van gogh usernam came pictur
1754,usernam httpaddr
1755,usernam usernam usernam pleas pleas restock van gogh van absolut gorgeou beg get birthday sold incred quickli pleas let us know restock possibl black heart suit
1756,usernam usernam usernam say alreadi white smile face
1757,usernam thank mean lot respons usernam help suggest got father day present wear month worth wear loyal brand number year
1758,usernam usernam usernam usernam usernam funni much bigger
1759,usernam usernam love jacket
1760,usernam pleas pleas pleas restock van gogh collect want give u money pleas take
1761,usernam usernam usernam cannot wait omg
1762,usernam usernam usernam fire fire fire
1763,usernam usernam usernam ti season
1764,usernam go restock hashtag collect
1765,usernam help pleas
1766,usernam usernam look genuin happi radiant glow star glow star glow star
1767,usernam usernam ye instor purchas email sadedeji httpaddr thank
1768,better let settl thu usernam usernam
1769,usernam usernam usernam usernam usernam usernam usernam usernam usernam usernam usernam usernam arriv home weekend ajfcigar usernam usernam usernam usernam love master like us open surf httpaddr hashtag usernam hashtag hashtag usernam hashtag hashtag hashtag pictur
1770,usernam shirt usernam hashtag hashtag hashtag pictur
1771,usernam usernam usernam usernam next time van custom cultur look help school art program design get chosen creat shoe
1772,proof stay true brand root authent hashtag lead success usernam continu lean california cool skater cultur aesthet world catch httpaddr
1773,usernam usernam thank tantee
1774,so anyon know get pair usernam checker sunglass sell usernam bf bought pair date someon broke find anywher onlin moneysymbnumb super bum broke
1775,usernam person custom us
1776,bro ship confirm moneysymbnumb email loudli cri face usernam
1777,size number van klcc pleas usernam need desper pictur
1778,usernam usernam bagussss
1779,usernam usernam httpaddr
1780,usernam usernam usernam usernam usernam usernam get right
1781,number would tell shiiii way dress see today vans_numb shoe nikeuk tracksuit pant adidasorigin hoddi nyc cap gucci man httpaddr would say go chang least dog face weari face pill broken heart tm
1782,last day van us open surf surf citi usernam usernam pictur
1783,usernam patrocina pfv nunca te pedi nada
1784,usernam usernam usernam usernam ye babi good
1785,fire next big thing fire dobsi van dayw usernam usernam usernam usernam usernam usernam usernam usernam usernam usernam usernam usernam usernam usernam usernam pleas rt hashtag see pictur
1786,ankl wrap cast bandag big rip favorit pair van pl help usernam
1787,usernam guy make adjust pictur
1788,usernam yall know anyth frampton retail scam
1789,could pair van gogh employ usernam misplac shoe display last pair store
1790,usernam usernam damn
1791,design cutest custom usernam bring pull trigger actual buy grimac face
1792,usernam vfcorp parent compani usernam known wholesal manufactur sell retail reduc brick mortar wholesal exposur like tradit wholesal brand expand direct consum busi httpaddr usernam
1793,v happi rn usernam usernam pictur
1794,usernam usernam orlando fl httpaddr
1795,usernam usernam httpaddr page order wide model wink face
1796,usernam rainbow checkerboard slip on ever go come back stock like moneysymbnumb ebay
1797,usernam usernam invoic meeeeee
1798,hey usernam band sign tent need wristband get band merch tent thank
1799,usernam usernam usernam usernam usernam heavi black heart heavi black heart heavi black heart rais fist emoji modifi fitzpatrick type number rais fist emoji modifi fitzpatrick type number
1800,usernam meu amor quando faremo parceria mesmo httpaddr
1801,usernam usernam usernam usernam mayb check dev team watch attend contest year keep disrespect surf fan feel good
1802,cok mu guzelsin heavi black heart sign horn helal sana usernam clap hand sign httpaddr
1803,usernam amaz shoe ever avail men size number httpaddr pictur
1804,love music put usernam custom servic phone line make wait shrug emoji modifi fitzpatrick type number zero width joiner femal sign use shazam discov stand dark lawson httpaddr
1805,gf turn usernam addict
1806,numberguitar usernam usernam feel good outfit wink face smile face sunglass love skull crossbon heavi black heart
1807,usernam usernam usernam usernam te gustaron podemo ver el precio si pasa tu examen de civica pue ya va
1808,readi weekend wassup victori hand emoji modifi fitzpatrick type number x usernam usernam pictur
1809,thank usernam want see adventur shoot usernam follow photographi account httpaddr pictur van world headquart
1810,usernam releas van gogh line holi shit never need someth
1811,usernam manda mimo
1812,usernam hous usernam usernam award nomine announc pictur
1813,usernam usernam usernam trailer love trailer
1814,usernam help meeeeee httpaddr
1815,usernam usernam vibrant
1816,look shoe usernam usernam hashtag usernam pictur
1817,usernam usernam hahaha kau tag van teru semangat betul face tear joy
1818,want snuggl usernam pictur
1819,merchant van week famili wagon weekend new roofbox readi road trip could usernam decal though wink face wink face pictur
1820,hashtag let love hashtag hashtag therealmadboi vldphotographi slikouron adidasorigin nike vans_numb pictur
1821,usernam reason fuck usernam
1822,usernam usernam yall gunna restock
1823,usernam usernam usernam trailer way go
1824,usernam purpl heart pictur
1825,usernam patrocina aaa
1826,usernam usernam graphic design help brand market skill hashtag hashtag hashtag design hashtag card hashtag hashtag shirt design much order fiverr httpaddr skype roseretorabbi httpaddr
1827,usernam usernam got kid van alreadi gum bottom wtf pictur
1828,omg omg omg need starri night plsssss fail usernam httpaddr
1829,usernam usernam shoulda two year ago
1830,usernam usernam se la rifaron con su coleccion purpl heart smile face heart shape eye
1831,hashtag hashtag usernam pictur
1832,usernam usernam usernam usernam want
1833,usernam van goth collabor uk store
1834,usernam wtf us big nigga like logo u cant use size logo u use babi small fix shit heavyweight nigga need justic pictur
1835,time usernam make usernam design
1836,usernam heavi black heart pictur
1837,usernam usernam need smile face heart shape eye
1838,proof anyth van usernam usernam pictur
1839,usernam usernam usernam like see preview snide remark pre load
1840,vans_numb unveil awesom new collabor van gogh museum amsterdam featur artist paint turn work sneaker art artist palett avail august number pictur
1841,usernam usernam amaz want loudli cri face loudli cri face loudli cri face loudli cri face loudli cri face loudli cri face loudli cri face loudli cri face loudli cri face loudli cri face loudli cri face loudli cri face loudli cri face loudli cri face loudli cri face loudli cri face loudli cri face loudli cri face loudli cri face loudli cri face loudli cri face loudli cri face loudli cri face loudli cri face loudli cri face loudli cri face loudli cri face loudli cri face loudli cri face loudli cri face loudli cri face loudli cri face loudli cri face loudli cri face loudli cri face loudli cri face loudli cri face loudli cri face loudli cri face loudli cri face loudli cri face loudli cri face loudli cri face loudli cri face loudli cri face loudli cri face loudli cri face loudli cri face loudli cri face loudli cri face loudli cri face loudli cri face loudli cri face loudli cri face loudli cri face loudli cri face loudli cri face loudli cri face loudli cri face loudli cri face loudli cri face loudli cri face loudli cri face loudli cri face loudli cri face loudli cri face loudli cri face loudli cri face loudli cri face loudli cri face loudli cri face loudli cri face loudli cri face loudli cri face loudli cri face loudli cri face loudli cri face loudli cri face loudli cri face loudli cri face loudli cri face loudli cri face loudli cri face loudli cri face loudli cri face loudli cri face loudli cri face loudli cri face loudli cri face loudli cri face loudli cri face loudli cri face loudli cri face loudli cri face loudli cri face loudli cri face loudli cri face loudli cri face loudli cri face loudli cri face loudli cri face loudli cri face loudli cri face loudli cri face loudli cri face loudli cri face loudli cri face loudli cri face loudli cri face loudli cri face loudli cri face loudli cri face loudli cri face loudli cri face loudli cri face loudli cri face loudli cri face loudli cri face loudli cri face loudli cri face loudli cri face loudli cri face loudli cri face pictur
1842,usernam usernam usernam usernam usernam usernam usernam usernam usernam usernam pictur
1843,usernam usernam usernam usernam preciat u brudda
1844,usernam partner usernam creat hashtag accessori bear earless master work want httpaddr pictur
1845,ver te quiero crear necesidad usernam pero usernam pictur
1846,shout usernam keep comfi yesterday feet day sparkl heart sparkl heart sparkl heart
1847,usernam usernam usernam usernam usernam usernam usernam usernam pictur
1848,usernam usernam usernam man dope
1849,usernam usernam plz plz plz could make adult size xoxo pictur
1850,usernam usernam usernam new marvel collect
1851,usernam usernam usernam usernam denni great tweet read man
1852,la nueva colaboracion de usernam x usernam ha sorprendido lo apasionado del art haciendo homenaj al trabajo del pintor estandart del post httpaddr lanzamiento sera el proximo number de agosto estara de venta en usernam usernam taf pictur
1853,usernam rt usernam huntington beach ca let get creativ someth everyon van custom loung see full schedul activ httpaddr pictur
1854,usernam usernam usernam usernam usernam usernam talk babi either asshol johnson
1855,usernam action hashtag aspen colorado wish made numberyear old pictur
1856,hear usernam usernam aafa usernam weigh consum impact trump continu tariff threat china via usernam httpaddr httpaddr
1857,usernam usernam beauti smile face heart shape eye httpaddr pictur
1858,usernam usernam usernam usernam wish abl go weari face hope see guy live one day
1859,usernam usernam mani retweet collab
1860,usernam come usernam say
1861,usernam usernam usernam usernam mani stair number
1862,usernam usernam usernam usernam usernam number get jacket n much
1863,usernam someon stole number dollar
1864,need new shoe realli hard time pick two usernam get think face hashtag pictur
1865,usernam usernam finish level pictur
1866,usernam usernam wantagh hashtag number usernam workshop usernam number sign usernam number number play mutant white lightn stage
1867,usernam usernam usernam usernam usernam usernam usernam usernam usernam _theg usernam pant
1868,usernam usernam copi lefleur usernam
1869,bicho comprei un teni muito foda obrigado por existir usernam e usernam smile face heart shape eye
1870,sooo bought usernam van last night love usernam girl fer sure
1871,low key sponsor usernam usernam usernam usernam usernam usernam hashtag
1872,usernam usernam gotta gotta
1873,usernam usernam pictur
1874,usernam usernam usernam usernam hey hood
1875,usernam usernam usernam ideal blind bat
1876,usernam usernam usernam snort laugh thank smile face open mouth cold sweat
1877,usernam usernam dope
1878,obrigado usernam essa colecao van gogh veio em um otimo momento da minha vida x
1879,number hashtag la airport shirt tee suprem number fw jean pant usernam usernam headphon earpiec usernam vetement x umbro school satchel bag usernam athlet shoe shoe usernam cr what_wuyifan_wear pictur
1880,usernam usernam pretti cute dog one dog face
1881,usernam onlin releas well caus liter none store near
1882,need usernam drop shoe mickey mous cuz easi cop toonka
1883,best shoe world without doubt toy stori x usernam woodi old skool call hand emoji modifi fitzpatrick type number
1884,way usernam wrap present hold _skateyou_ coin go earn _skateyou_ app link bio httpaddr pictur
1885,usernam usernam usernam sold disappoint face wait news back
1886,usernam usernam usernam look cool tho
1887,usernam usernam kid day
1888,new usernam heavi black heart pictur
1889,hashtag number retail gone fur free includ selfridg h north face usernam usernam net porter hashtag right side histori ban fur usernam hashtag pictur
1890,usernam usernam usernam stylish
1891,bitch pant roll knee wear eazi e christma sock usernam slide fwm
1892,littl upset usernam vincent van gogh collect featur anyth starri night
1893,usernam usernam love n appreci oh god
1894,usernam usernam usernam usernam awesom
1895,usernam man put shoe full test know know need hook keep killin usernam httpaddr
1896,sad usernam come dawg httpaddr
1897,usernam usernam usernam haha cool
1898,van damnnnn daniel usernam usernam pictur
1899,alway ride usernam hashtag pictur
1900,usernam
1901,usernam usernam usernam usernam usernam need smile face heart shape eye smile face heart shape eye
1902,usernam okay thank clear
1903,usernam usernam usernam usernam wow jealou
1904,feet wide everi singl shoe tri mall peopl make fun shoe wear cute like sorri wear usernam usernam without serious deform feet fit fuck shoe suck hate
1905,usernam usernam usernam hashtag
1906,vans_numb debut exclus vincent van gogh capsul collect httpaddr pictur
1907,usernam usernam usernam usernam heart
1908,cet ete vault usernam est associ le label japonai wtap usernam pour creer une collect de chaussur vetement et accessoir honor le savoir fair japonai avec l esthetiqu design emblematiqu de hashtag httpaddr pictur
1909,usernam lemmi catch model contract eye tongu pictur
1910,call usernam number day ago told sneaker b ship number day yeah confirm email ship happen never order usernam
1911,usernam think need revisit algorithm unless usernam mid skate shoe like wear sinc grade school new normal marathon okay consid still pictur
1912,eu rezando pra ser tao boa skate que vou ter uma certa marca usernam dando teni pra eu trucidar na lixa sempr nova no meu shape sempr novo pictur
1913,usernam usernam seen fun project pictur
1914,usernam usernam wholelotta gang shit go sponsor young man
1915,usernam thank much cancel van gogh order week stay order realli sorri let linger process sever place restock could purchas confirm
1916,usernam usernam time drop number
1917,usernam usernam usernam usernam pictur
1918,usernam usernam httpaddr usernam
1919,usernam usernam yeah van gogh favorit artist super pump
1920,eu estou bastant apaixonado por ess teni da usernam black panther serio olha essa beleza pictur
1921,usernam someon pleas explain usernam collect fuck women size also explicitli list anywher case readi buy everyth
1922,usernam usernam avail pietermaritzburg
1923,usernam usernam usernam moneysymbvfc owner van nice today rest market crash grin face
1924,moda sanat dunyasi isbirliginin son ornegini usernam usernam gerceklestirdi yeni van koleksiyonu tasarimlarini van gogh un muhtesem tablolarindan aliyor hashtag pictur
1925,pleas sponsor us usernam usernam pictur
1926,usernam usernam usernam usernam usernam usernam usernam usernam usernam usernam usernam usernam awesom pic
1927,usernam usernam meanwhil usernam look like ultim mother hen pictur
1928,realli usernam walk around kick shouldnt happen pictur
1929,yessssss smile face heart shape eye smile face heart shape eye smile face heart shape eye usernam httpaddr
1930,know peopl shoe obsess call like sneaker head whatev call sole appli usernam
1931,usernam usernam usernam usernam usernam usernam hey buddi
1932,usernam usernam wait
1933,usernam van x van gogh collect avail httpaddr httpaddr
1934,usernam need dragon ball z x van collab
1935,yo usernam hold hashtag nearli number min give
1936,usernam usernam shirt
1937,usernam usernam usernam usernam usernam pictur
1938,usernam chanc intern order van gogh
1939,usernam usernam fuck damn janet
1940,hey usernam van gogh collect women size want get sweatshirt size small
1941,usernam usernam usernam usernam usernam usernam done
1942,usernam sock usual usernam booti sock clean
1943,new van gogh usernam drop know pair get tire face
1944,alo usernam da um dess pra ver se eu nao fico um nojo pictur
1945,usernam usernam usernam ye scott lad sign horn emoji modifi fitzpatrick type number number pictur
1946,la perfecta relacion entr el hashtag la hashtag la marca de hashtag usernam ha lanzado su ultima coleccion inspirada en el genio van gogh athlet shoe artist palett hashtag sparkl pictur
1947,hello le craquag sur le site van collect van gogh smile face heart shape eye usernam usernam smile face heart shape eye smile face heart shape eye smile face heart shape eye pictur
1948,usernam usernam usernam usernam usernam wawu dope
1949,usernam httpaddr
1950,usernam usernam want
1951,usernam usernam usernam usernam pictur
1952,usernam usernam usernam usernam usernam usernam usernam usernam usernam usernam usernam videazo ojala haber podido ir likazo
1953,usernam usernam usernam usernam usernam usernam usernam usernam much would cost love
1954,usernam look like van gogh merch stock
1955,usernam usernam ladi gentlemen strong warm sneaker get
1956,usernam usernam sexist make flyest stuff girl size annoy bad deserv free gear pain suffer honestli
1957,usernam usernam usernam hkskskk convers
1958,usernam usernam usernam want buy face throw kiss happi person rais one hand
1959,usernam usernam thank mark
1960,usernam sure welcom usernam famili
1961,usernam all babi shoe color come babi play put mouth car ride mouth finger end black like ink everywher
1962,usernam usernam usernam usernam usernam look like convers
1963,eu sincerament queria um patrocinio da usernam httpaddr
1964,le gen parlent beaucoup de problem de discrimin enver beaucoup de chose mai pa assez de gen comm moi qui font du number en pointur et qui galer enorm trouver de chaussur autr que sur internet usernam usernam usernam faut fair un truc
1965,usernam usernam usernam neeeed hug face
1966,hello usernam usernam httpaddr
1967,need new sneaker go usernam buy said sneaker immedi overwhelm transform look option instead settl pair sleek white usernam noth creatur habit
1968,usernam usernam
1969,usernam usernam usernam
1970,usernam hello legendari establish shoe brand skater everywher love talk potenti profit idea regard classic kick
1971,usernam usernam usernam usernam usernam usernam usernam pictur
1972,usernam kick wet u bet ur girl rock usernam gym today
1973,usernam usernam usernam skull slip on fire fire
1974,vincent van gogh de verdad que usernam ha perdido una oportunidad ahi hubiera sido genial
1975,alguem pode fazer feliz com um mimo da nova colecao da van rs congrul vc foi sorteada entra em contato cmg q eu passo endereco usernam
1976,usernam usernam usernam usernam usernam learn play sax
1977,usernam
1978,take note usernam httpaddr
1979,usernam need hit new lace trend eye usernam pictur
1980,usernam usernam plead number
1981,usernam usernam look sold cap jelli pictur
1982,usernam usernam pictur
1983,usernam order van x spitfir duffl bag got backpack instead tri get retour form websit abl go vacat coupl week retour stuck backpack pleas help lmao pictur
1984,usernam usernam usernam usernam shiii thiccccccc face stuck tongu
1985,usernam usernam manda ess pra mim pf
1986,im liter tear usernam releas vincent van gogh line
1987,veel te klein maat gekocht dan maar voor aan de muur usernam x usernam zoal usernam zei van gogh pictur
