,tweet
3337,shoe work art liter clap hand sign emoji modifi fitzpatrick type number sunflow clap hand sign emoji modifi fitzpatrick type number find pair along style part usernam collect usernam hashtag hashtag hashtag pictur
3338,usernam donna engag great convers respect home citi share tip park compliment disney pixar bo peep usernam maryssa gener kept us updat locat stitch throughout meal long wait see
3339,welcom futurebi usernam pager number pictur
3340,van gogh van usernam loudli cri face face scream fear face scream fear face scream fear face scream fear
3341,time plot gonna get usernam endors
3342,usernam usernam shoe strike balanc surf sand
3343,usernam usernam huntington beach ca httpaddr
3344,usernam usernam lol yeah like basic one ever make like vegan old school high top
3345,usernam usernam usernam wisco repres
3346,_michaeladodd usernam usernam hire
3347,hashtag spirit anim today dash usernam hashtag usernam usernam usernam pictur
3348,usernam usernam got mani lmao
3349,usernam usernam usernam filho eu zoando quem fica falando isso para de ser retardado
3350,usernam usernam usernam jealou sold
3351,usernam usernam usernam number point
3352,usernam pictur
3353,van platform wanna know black heart usernam
3354,usernam x van gogh une collect parfait pour cet ete httpaddr poke usernam pictur
3355,usernam heavi black heart
3356,usernam usernam yanliz varya acayip cool olmaya basladi tipe bak face savour delici food
3357,usernam usernam usernam posit new way fail go buddi skateboard realli oc knew lol super cool rock sista everyon quick tip booz skatin thumb sign emoji modifi fitzpatrick type number rememb biten tha deck hurt clap hand sign smile face sunglass thumb sign smirk face
3358,usernam usernam usernam hashtag
3359,usernam walloff wallandoff wall
3360,usernam announc new usernam collect releas soon pictur
3361,usernam need get contact guy got mani idea outfit put togeth guy brand
3362,essa colecao da usernam van gogh vaso com quinz girassoi ta demaissssss moneysymbmoneysymbmoneysymb httpaddr
3363,check mate shop usernam footwear store onlin hashtag hashtag hashtag hashtag hashtag hashtag hashtag hashtag hashtag hashtag hashtag hashtag hashtag hashtag hashtag hashtag hashtag hashtag hashtag hashtag pictur
3364,usernam number wear shoe much wear tear start give second life sew fabric even friend hope turn someth support slow fashion wast good pair shoe pictur
3365,cours son first pair shoe gonna usernam sign horn emoji modifi fitzpatrick type number number pictur
3366,usernam usernam smile face heart shape eye heavi black heart pictur
3367,love shoe usernam would bought pair today could get number pictur
3368,usernam lemm get free shoe face tear joy face tear joy hashtag hashtag pictur
3369,vincent van gogh x usernam offici yesssss httpaddr
3370,usernam usernam usernam usernam nao te preocup mano continua jogar da maneira q gosta sem pressao alegria na perna que eu arranjo te uma cunha na nike
3371,usernam usernam usernam boy marcu wear usernam
3372,usernam anoth disney collabor
3373,sabia de la colaboracion del museo van gogh en amsterdam usernam visita nuestra blog enter httpaddr pictur
3374,ohhhhhhhemmmmmgheeee tell usernam httpaddr
3375,vincent van gogh usernam collect kill oh godddd
3376,usernam usernam usernam ein freundin hat mir die au den usa mitgebracht ziemlich n soft ice cream e schuhchi
3377,usernam usernam usernam usernam usernam usernam usernam usernam usernam usernam usernam number meal voucher tomorrow show like
3378,usernam lancou um teni baseado na obra de van gogh com certeza irei comprar sparkl heart
3379,primeiro usernam lanca colecao inspirada van gogh agora uma inspirada marvelassim fica dificil guardar dinheiro pro lanch pictur
3380,vans_numb first van ever bought number bought number grade number year old serv well even waffl still go strong pictur
3381,go size place bought number differ pair vault slip on variat ridicul usernam usernam
3382,usernam usernam van kotory tak dolgo zhdali van wait pictur
3383,usernam usernam usernam usernam usernam usernam khsm arab letter alef l arab letter alef ylh number unamus face
3384,usernam fuck shoe squar
3385,usernam usernam usernam thank treat band incred well
3386,usernam usernam usernam oh ok sorri thx
3387,usernam pretti solid custom servic
3388,usernam usernam usernam like watch trailer next week keep excit never spoiler alway seem twist love
3389,usernam usernam usernam usernam usernam usernam
3390,usernam usernam dope smile face heart shape eye
3391,usernam usernam offend throw diff perspect joke van repli seem super seriou petit make bullet list van sleep vincent van gogh chase clout congrat numberk rt though
3392,usernam usernam usernam usernam agre love heavi black heart
3393,usernam usernam present new wave act announc endless daze festiv number thank much usernam articl heavi black heart httpaddr
3394,usernam usernam usernam usernam usernam fire fire
3395,gotta say absolut love new usernam tnt black heart heavi black heart best shoe ever worn skate
3396,hey usernam got number week ago r come apart normal usernam pictur
3397,usernam pleas repair old skool flame stock brazil thank much
3398,usernam usernam sick kick
3399,usernam bring back men mesh slip espadril back u k
3400,usernam hashtag usernam usernam usernam hashtag hashtag hashtag hashtag httpaddr
3401,sucker usernam sucker usernam number come togeth make shoe cours bought pair first day came hashtag hashtag hashtag hashtag pictur
3402,usernam usernam usernam usernam usernam usernam chang si
3403,ever chanc see boy home alway make sure wear usernam
3404,moneysymbnumb basic white graphic tee go si usernam
3405,usernam usernam usernam bora tomar uma providencia aeeee bebe
3406,wear usernam usernam betcha
3407,usernam usernam yo clean
3408,usernam usernam usernam love
3409,usernam size van gogh pair go
3410,f usernam never shoe big feet
3411,usernam usernam need pictur
3412,usernam usernam usernam wowiiiiii
3413,numbernew usernam usernam yoooooo sick love pair histor artist work guess shoe twin never get brown leather woodi boot
3414,usernam usernam number number number shot later
3415,usernam love hashtag
3416,ya vieron el tnt advanc pro de usernam usernam le gusto para patinarlo para fresearlo httpaddr pictur
3417,usernam usernam sell van collect uk
3418,look usernam websit custom shoe put amaz pictur usernam usernam usernam beg mom moneysymbnumb lol pictur
3419,usernam usernam usernam usernam pictur
3420,usernam usernam usernam watch preview caus give away much show know van daughter goe south carolina might actual think cool
3421,usernam make shoe size number love get pair
3422,usernam usernam bruder geht aber kann man den macbook anschliessen
3423,el museo de art de van gogh se une con usernam para crear una coleccion en honor al pintor httpaddr athlet shoe pictur
3424,usernam usernam usernam great show
3425,usernam thank let know would like know promo code first time buy onlin
3426,usernam usernam usernam
3427,usernam usernam usernam usernam cop
3428,disney usernam readi breakfast donald pictur
3429,usernam usernam pleas restock sunflow shoe loudli cri face loudli cri face loudli cri face
3430,sinon usernam quand le hashtag authent du tableau la nuit etoile pleas person fold hand loudli cri face
3431,usernam usernam van staff discount everyth wow
3432,els want photo shoot usernam ami pond rock van gogh inspir usernam httpaddr usernam usernam hashtag hashtag hashtag hashtag pictur
3433,usernam usernam usernam usernam fire fire fire heavi check mark heavi plu sign heavi plu sign face throw kiss
3434,usernam smile face heart shape eye pictur
3435,usernam usernam dad joke got like actual qween
3436,usernam usernam usernam
3437,usernam usernam usernam usernam probabl cheapest thing own
3438,help stop buy usernam
3439,usernam usernam usernam usernam gold pick trash beach today
3440,usernam usernam usernam patrocin duzz ant que ele fiqu rico
3441,wait usernam come
3442,usernam usernam amem smile face heart shape eye smile face heart shape eye ok hand sign
3443,usernam grey van usernam
3444,usernam pictur
3445,usernam usernam usernam love trailer almost much go movi imagin set one without catch trailer
3446,usernam usernam usernam watch trailer everyth except game throne star war
3447,usernam usernam usernam admit movi preview guilti pleasur best part look wife preview simultan give thumb signifi think worth see
3448,ok din mag updat late si usernam pinag halong kiss noon kiss ngayon cuti fangirl advertis bili nga rin kami ng van usernam usernam kiss feel ko talaga magal kang busi woman someday hashtag httpaddr
3449,stand stand pair usernam chex colorblock kick usernam chequer flag heavi black heart blue heart yellow heart chequer flag pictur
3450,usernam usernam usernam kemaren nanya numberjt om disappoint face
3451,esto son lo producto experiencia que recomienda hashtag de la mano de nuestra colaboradora _rosabrava nerd face usernam usernam usernam usernam usernam httpaddr
3452,usernam usernam wrong
3453,got welcom usernam famili today smile face sunglass
3454,hole bottom usernam mean need decid want wear total fall apart like suck get new one unlik
3455,call vincent van gogh skate someth clever market team usernam httpaddr
3456,usernam usernam dope
3457,got phone usernam told releas usernam shoe size bigger men number charact femal thu believ men would interest wear van shoe pictur
3458,usernam usernam excel night reliev face
3459,got pair magic usernam sparkl camera flash pictur
3460,close get van gogh museum x usernam collab weari face stop time becam usdnumb poorer ughhhhhashtag
3461,usernam usernam usernam
3462,usernam outfit use quinceneara past week thumb sign pictur
3463,need collect usernam
3464,signatur httpaddr new usernam classic tee perfect first day back school grab one store onlin httpaddr pictur
3465,usernam tent usernam hang around hope play usernam
3466,well tri save money usernam decid come van gogh collect
3467,usernam usernam usernam thank
3468,usernam usernam usernam watch want facebook
3469,casual thursday wear flat still manag fall unamus face usernam hashtag hashtag hashtag hashtag hashtag hashtag pictur
3470,usernam usernam jacket would look good u queen swear
3471,usernam usernam usernam nicee
3472,usernam usernam usernam lovey usernam
3473,ride wave hashtag tire celebr hashtag launch hashtag kick hashtag hashtag hashtag hashtag hashtag hashtag hashtag usernam usernam usernam pictur
3474,usernam usernam hahah usernam ajuda ela
3475,usernam usernam import question need answer usernam
3476,usernam websit like realli bad xanga page
3477,usernam lame version lol pictur
3478,usernam usernam number schuh number footlock
3479,usernam usernam usernam thank read enjoy weekend
3480,wear today usernam pictur
3481,thank usernam usernam everyon made usernam happen mani great memori introduc favorit band usernam usernam
3482,van black heart smile face sunglass usernam usernam
3483,usernam usernam usernam sick fire
3484,usernam usernam usernam enamor smile face heart shape eye
3485,usernam usernam usernam khyli khwshglh lnti unamus face smile face heart shape eye
3486,usernam usernam usernam love
3487,usernam usernam pleas beg check link white point backhand index emoji modifi fitzpatrick type number white point backhand index emoji modifi fitzpatrick type number see happen uganda httpaddr
3488,need green flannel usernam
3489,hey usernam stop sleep jaewon gotta get unemploy jobless till
3490,usernam long beach island nj
3491,usernam usernam pleas
3492,usernam usernam usernam usernam usernam usernam usernam usernam usernam usernam quan bu yu shiidesutsu x heavi black heart
3493,need shoe sponsor number day shrug emoji modifi fitzpatrick type number zero width joiner male sign usernam pictur
3494,usernam usernam use hot glue
3495,usernam usernam usernam find pictur
3496,usernam usernam sad see sold today realli want sunflow one
3497,last saturday weekli hashtag youth skateboard workshop httpaddr number numberpm today learn skateboard forget drop usernam tent httpaddr camera flash black umbrella photographi pictur
3498,cop usernam definit gogh hard hashtag hashtag pictur
3499,usernam usernam addia mnd
3500,usernam usernam usernam usernam harri ma le quedan bien la van media larga pantalon arremangado
3501,usernam go restock collect soon seem like let greedi peopl get
3502,hashtag vans_numb usernam httpaddr
3503,hashtag hashtag usernam usernam hashtag fire new music come soon pictur
3504,usernam usernam usernam usernam hashtag hashtag hashtag hashtag te cobra por producto que compra hashtag
3505,ashley schroeder usernam usernam hashtag usernam usernam photo usernam pictur
3506,van gogh museum usernam collabor uniqu collect launch august number see httpaddr hashtag hashtag hashtag hashtag hashtag hashtag hashtag hashtag pictur
3507,check new derbi skate usernam usernam usernam pictur
3508,usernam white sunflow van gogh hoodi find websit avail store
3509,usernam hard asl x idc idc idc new design thi snap smile face heart shape eye
3510,van authent number dx anaheim factori hashtag hashtag usernam pictur
3511,usernam usernam nyc van store still limit size time hashtag sq
3512,usernam usernam hashtag hashtag hashtag hashtag hashtag hashtag pictur
3513,tryna sponsor young talent usernam usernam usernam usernam usernam usernam httpaddr
3514,best time year christma summer us surfer skater usernam usernam wednesday august number number numberam pdt usernam pictur
3515,usernam usernam usernam usernam want creat van pictur unfortun imag copyright could one pleas help goal life get shoe made pictur
3516,usernam usernam hashtag lindourh baylow pictur
3517,person hurt usernam discontinu two style ever complet fallen love pictur
3518,hey usernam captain marvel van come larger size anytim soon realli look forward get sister us got big feet pleas thank
3519,usernam usernam yesss smile face heart shape eye smile face heart shape eye smile face heart shape eye smile face heart shape eye
3520,usernam usernam usernam van came forev warp bundl
3521,usernam usernam usernam usernam mira lo que son esta bebe smile face heart shape eye
3522,van se ja critiquei n lembro patrocina usernam httpaddr
3523,van gogh fashion line make spend cash httpaddr great work usernam usernam pictur
3524,usernam usernam thank grub boy cop shoe peek svelt usernam pictur
3525,hola usernam preguntaba si tendriai dispon algun modelo de zapatilla que se rompa en tre mese gracia
3526,usernam usernam httpaddr
3527,usernam usernam usernam usernam usernam usernam usernam usernam usernam caption
3528,usernam usernam van gogh jajajaja
3529,bit sneakerhead splurg got pair usernam black panthet usernam pictur
3530,noth fresher crispi new pair usernam smile face sunglass sign horn emoji modifi fitzpatrick type number hashtag
3531,usernam usernam damn daniel
3532,usernam usernam usernam omg
3533,usernam usernam usernam grand inconspicu saturday disguis face tear joy thank mill back
3534,wait patient usernam coupon last order number hour ago buy next par shoe
3535,usernam suppli us lace tie around entir bodi actual tie lace
3536,usernam usernam
3537,usernam usernam usernam actual class clap hand sign
3538,definit would buy pair get vans_numb vans_europ httpaddr
3539,usernam usernam wow usernam dope respond usernam soooo talent keep great work realli cool
3540,usernam usernam usernam usernam usernam e patrocinado pela adida
3541,usernam usernam usernam trailer even movi ye watch trailer check happytim murder trailer look suggest
3542,usernam usernam coolest kid school
3543,great time clean neighborhood skatepark last saturday number annual mini ramp rage event usernam usernam hashtag pictur
3544,usernam usernam sweet garag band go come name logo shirt rock raleigh hashtag blondi hashtag
3545,offici week sinc mess back itch get back board take easi bit longer clip last time usernam hq unicorn face pictur
3546,usernam usernam cool gonna get hashtag edit capt marvel usernam wrote pictur
3547,usernam usernam alreadi got scalzi nail polish buy scalzi shoe take money
3548,usernam usernam usernam sayin heard buuuuuut grin face smile eye wink face fire
3549,usernam usernam usernam usernam _bigbennumb usernam usernam usernam usernam make pair pay
3550,usernam usernam feel honor sparkl heart
3551,usernam usernam design water bottl pleas
3552,pretti shore break round number number hashtag men qs numberk present usernam usernam watch live httpaddr visit usernam
3553,icon usernam team usernam creat fashion line inspir dutch master museum dedic profit preserv van gogh legaci collect art keep access futur gener httpaddr pictur
3554,usernam usernam lame
3555,usernam gosh disgust pictur
3556,usernam usernam usernam usernam usernam usernam usernam usernam great pic
3557,usernam even go reach wow great custom servic hashtag
3558,usernam usernam usernam watch movi trailer wait detail plot movi wikipedia go watch theater
3559,buy usernam
3560,usernam usernam suprem weak wearin year
3561,usernam oi amor eu te amo ma veze vc passa do limit ok
3562,usernam still wait repli regard order place number number told number week order receiv order psnumber alreadi taken account thumb sign
3563,hello memang taknak consid jadikan van gogh collect tu perman collect kee usernam usernam
3564,usernam usernam usernam usernam usernam usernam eeyyy dizzi symbol
3565,usernam vernit noski v shakhmatnuiu shashku urodi bliat pictur
3566,usernam usernam usernam watch tv commerci extend youtub clip may give away much get sens tv might even want see film also googl review much like read plot want know folk like
3567,usernam usernam usernam movi gotta watch trailer must see realli look stupid list tv show want surpris
3568,got em haha thank usernam pictur
3569,usernam tri get shoe face need approv sooo yea pleas need usernam pictur
3570,damn better order new pair usernam slip pro quick httpaddr
3571,usernam usernam usernam usernam hashtag
3572,usernam usernam search collect detail httpaddr hashtag usernam hashtag
3573,meu sonho de princesa e algum dia ser patrocinada pela usernam
3574,usernam usernam listen sometim chip need extra salt
3575,usernam guy go women size avail store van gogh collect would known case would order onlin
3576,usernam usernam yepppp thumb sign emoji modifi fitzpatrick type number
3577,psa usernam releas van gogh shoe friday think ever want pair shoe badli smile face heart shape eye loudli cri face heavi black heart person rais hand celebr emoji modifi fitzpatrick type number number pictur
3578,sneaker brand usernam join forc amsterdam van gogh museum new collect inspir painter famou work httpaddr pictur
3579,recognit passion vans_numb usernam usernam pictur
3580,usernam
3581,usernam usernam usernam time watch trailer clip movi show know go watch b c watch seen
3582,epic intim night usernam collis symbol skull crossbon collis symbol hashtag forev hashtag hashtag sneer told hashtag crown thank u usernam sparkl heart usernam usernam usernam usernam hashtag hashtag hashtag hashtag pictur
3583,usernam usernam usernam usernam stupid fuck make enough damn shoe sell
3584,usernam thank much shoe cleaner recommend think work great pout face pictur
3585,usernam usernam pink tax exist look close see sock similar price differ made differ amount similar ingredi
3586,usernam usernam usernam would invest pair
3587,usernam die pictur
3588,usernam still hold
3589,usernam way speed process van famili point purchas still reflect almost number week purchas number phone call fix problem
3590,look like misstep usernam put usernam van shoe hashtag
3591,usernam usernam usernam usernam person fold hand excit restock person fold hand
3592,usernam usernam usernam support artist
3593,hello usernam go restock rainbow checker old school van ye psa franc
3594,usernam usernam omg pl post global canva
3595,usernam usernam usernam usernam nice deltoid cobra
3596,usernam usernam usernam usernam usernam disgust militari medal militari medal hundr point symbol
3597,usernam usernam usernam pictur
3598,pagina de usernam usernam por favor mandei ma correo con vuestra rebaja ayer ya deje lo dollar que tenia que dejarm httpaddr
3599,hashtag look cute pink usernam hashtag hashtag hashtag hashtag hashtag hashtag pictur
3600,crowd surf today magic thank usernam usernam
3601,usernam usernam _felipemelo_ usernam usernam usernam
3602,usernam usernam usernam pictur
3603,usernam manda un mimo nunca te pedi nada httpaddr
3604,usernam usernam usernam usernam caught big loss time
3605,akid name jonney laundri shoot usernam usernam httpaddr hashtag
3606,usernam usernam usernam usernam usernam numberlg usernam usernam usernam usernam usernam usernam look great need one asap evo mod prefer black heart suit
3607,usernam malibu shoe pictur
3608,usernam usernam usernam usernam usernam rais fist emoji modifi fitzpatrick type number rais fist emoji modifi fitzpatrick type number rais fist emoji modifi fitzpatrick type number rais fist emoji modifi fitzpatrick type number
3609,usernam usernam what max capac venu sinc first come thnx
3610,usernam oh that sad okay ty anyway hahahahah go check one
3611,usernam usernam usernam yeah serious favorit hoodi number hoodi
3612,usernam usernam usernam pode mandar essa mochila querida
3613,went usernam journey pacsun tilli none store van authent lo pro thank good store one mall still exhaust hashtag
3614,usernam usernam usernam give call soon open tomorrow
3615,usernam usernam usernam usernam usernam care travel usa pictur
3616,honestli live life tri get sponsor usernam
3617,shop usernam want buy shoe usernam evn usernam anoth sale go myntra fckn size avail mean fuck even u keep damn sale even keep product mean what even wrong
3618,usernam usernam httpaddr
3619,usernam usernam usernam usernam usernam usernam usernam usernam usernam liter see guy earlier jkghfgjkgfgjd
3620,usernam usernam let get onlin order fuck shoe alot pleas
3621,hashtag american eagletop usernam jean usernam shoe usernam pictur
3622,usernam usernam shoe compani gonna get watch ok hand sign emoji modifi fitzpatrick type number
3623,usernam get free van number pair still need girl rich
3624,_opsbeaw usernam usernam usernam usernam q foto lindaaaaassss
3625,usernam usernam usernam yess got sunflow
3626,usernam usernam usernam even know
3627,got new magenta usernam work fire usernam hashtag hashtag pictur
3628,usernam usernam hard frfr
3629,usernam usernam usernam usernam usernam usernam usernam usernam pic bro
3630,usernam usernam usernam usernam need pair done ok hand sign emoji modifi fitzpatrick type number
3631,vincent van gogh x van ua old skool old vineyard favourit drop year love blend art sneaker realli highlight sneaker scene potenti timeless usernam usernam usernam pictur
3632,usernam usernam usernam usernam usernam usernam next one right around corner x zero width joiner femal sign black heart x zero width joiner femal sign
3633,usernam usernam usernam yurp
3634,usernam usernam waw keren patunyaaa xxxx
3635,usernam usernam usernam usernam usernam usernam usernam usernam usernam usernam usernam usernam usernam usernam usernam usernam usernam usernam usernam usernam usernam usernam usernam usernam httpaddr
3636,usernam usernam cheh
3637,usernam usernam usernam usernam usernam httpaddr
3638,usernam usernam sweet
3639,amo te usernam
3640,usernam hashtag collect match made artist heaven httpaddr pictur
3641,usernam usernam usernam usernam usernam usernam usernam usernam usernam usernam usernam usernam usernam usernam extrem httpaddr
3642,usernam httpaddr
3643,usernam usernam thumb sign thumb sign get wet
3644,usernam _originathalie help
3645,afternoon treat best ice coffe usernam usernam pictur
3646,usernam guy restock van x vincent van gogh collect
3647,usernam hi look forward buy van old school r mani counterfeit live kenya genuin store yo buy kenya
3648,realli wanna sponsor usernam face tear joy loudli cri face wear van got custom van loudli cri face weari face face tear joy
3649,usernam usernam usernam alway watch movi new tv trailer pilot never watch upcom episod trailer want see invest time new show movi start show would rather suspens linger last episod hold week
3650,usernam usernam usernam usernam usernam usernam usernam usernam usernam usernam usernam got dem yeezi look love smile face heart shape eye
3651,favourit van ever heavi black heart heavi black heart heavi black heart heavi black heart vans_numb vangoghmuseum hashtag hashtag pictur
3652,usernam usernam usernam usernam yesssssss
3653,usernam give campaign httpaddr
3654,alo usernam da um dess pra eu ver um negocio rapidao pictur
3655,usernam usernam usernam usernam usernam usernam blondi forev like b w e music kept get better sadli move heaven grate talent surviv
3656,love usernam unmatch smile face smile eye smile face smile eye smile face smile eye pictur
3657,usernam usernam usernam guess christma wish list
3658,usernam usernam vans_numb sukablyat est khot odna prichina po kotoroi zdravomysliashchii chelovek mozhet otdat shest kuskov za kusok khuini kotoraia za sezon prevratitsia v shit
3659,usernam obsess gotten point notic usernam wear usernam collab distanc face tear joy weari face httpaddr
3660,usernam usernam usernam that girl smile face heart shape eye
3661,hashtag usernam usernam x usernam httpaddr
3662,smile face heart shape eye smile face heart shape eye smile face heart shape eye smile face heart shape eye smile face heart shape eye usernam httpaddr
3663,usernam usernam usernam usernam usernam must agre roll theo
3664,usernam usernam usernam ha realiz post twitter oop grimac face
3665,quando sera q sai colecao da usernam x van gogh
3666,wait give usernam even money year httpaddr
3667,psa current free ship usernam com spend moneysymbnumb new pair sneak moneysymbnumb next purchas smile face heart shape eye
3668,usernam releas hashtag fashion line inspir icon artist httpaddr via usernam
3669,usernam usernam
